id,title,selftext,author,score,num_comments,upvote_ratio,popularity,created_utc,permalink,year,month
1hcxwer,CMV: Reddit's male spaces are completely broken and no longer represent men at all.,"I genuinely want someone to try change my mind on this because it's such a disparaging thought.

I've recently had a bit of an experience in r/askmenadvice that really irked me. I have found myself on the receiving end of the bullshit and seen some things I really don't like about collective male behaviour on Reddit.

Here's an example thread (on mobile so I'll edit with the link in a sec.

I have literally just been trying to argue my point that these spaces are public despite having 'men' in the name, and that we should be kinder and more considerate. There are 1000+ people reading even 0 upvote posts, who may be damaged by the casual women bashing that is so common, and many people have admitted to me that women should expect. They are extremely unlikely to participate because of the backlash.

These loud few boys do not take any accountability for how their actions affect other people. I do not care how old they are, they are simply not emotionally men yet if that's how they think. I appreciate that they are hurting, but choosing not to grow up has never been and will never be a successful strategy for coping with the real world.

In my opinion, men take responsibility. This is true for every happily married man I know IRL.

Approx 95% of the 'men' I've interacted with in these spaces are telling me the following:

1. I'm too angry/emotional with my argument - which implies my opinion as a man is invalid (feeling my emotions does not scare me now I've sought therapy)
2. That vulnerable people should not access these spaces if they can't handle it (that doesn't change that they still will)

Particularly concerning is that the sub descriptions openly have rules like 'be nice' and say that men are keen to open up their feminine side.

Staying cold and distant ain't the way to do it. Becoming a man for me has been all about understanding my emotions and exercising them helpfully.

Things that will CMV:

- Examples of reddit male spaces that aren't like this
- Genuine discussion of where my cognitive dissonance may lie on the matter

Things that will not CMV:

- Being told I am being dramatic/too angry/emotional about this. I feel very passionately about this and I will not censor myself when I've just expressed an opinion that I feel most men IRL share with me.
- Being told that's just the way it is, and I should ignore it. I believe that men can moderate ourselves and take responsibility better.

From my perspective, while I appreciate people need to vent to heal, Male Reddit is making things much, much worse. It's actually become a barrier to proper growth for anyone who interacts with them regularly and thinks it's normal.

So please CMV, because I am clearly hurting about this in the dark somewhat and I'd like to see the light.",ponderous_pete,352,623,0.6100000143051147,0.2256255123984014,1734044275,/r/changemyview/comments/1hcxwer/cmv_reddits_male_spaces_are_completely_broken_and/,2024,12
1hhai1y,CMV: No amount of gun violence deaths will result in political change and people should stop expecting it,"Every time there' is a major mass casualty incident in the United States caused by a firearm you constantly see people saying that it will be a ""Wakeup call"" and that it will somehow inspire change.

You can change my view if you convince me that people don't say that or don't believe it.

My view is that there is no specific amount of people that have to die in order to inspire meaningful change or legislation. Even after the Mandalay Bay Massacre in Las Vegas when 59 people were killed and more than 500 others injured, nothing happened.

You can change my view if you can convince me that there is a certain number that would inspire change.

The people who have the ability to make change simply don't care. They could put the effort in, but the deaths of everyday Americans does not justify that effort for them. They will continue to get elected no matter what, so they don't bother. Why hurt their political career when they could just sit in office and focus on other issues. Of course there are other important issues, so they can go handle those instead.

You can change my view if you can convince me that they do care. 

The people who have the ability to make a change will never be in danger of being impacted by gun violence. Politicians at high levels are protected, and at low levels usually come from privileged positions and will never face the threat of gun violence. They might deeply care about the issue, of have loved ones affected, but they themselves will never face that danger or experience fear of gun violence so they simply won't act. It doesn't apply to them. 

You can change my view if you can convince me that gun violence does impact politicians.

To conclude, no amount of dead Americans will inspire meaningful change. No amount of dead kids will make the politicians care. No amount of blood will make them act, unless of course it's blood of their own. 

Change my view.",attlerexLSPDFR,335,641,0.7699999809265137,0.22522382095835375,1734552628,/r/changemyview/comments/1hhai1y/cmv_no_amount_of_gun_violence_deaths_will_result/,2024,12
1h4rlyl,CMV: Forced conscription is inherently wrong,"This is a topic that recently came up again in the context of the Ukraine war so here's my take: Forcing people into frontline service is inherently and always immoral. I have a few reasons for believing this 

1. Sending someone into war with 2 weeks of training is very likely to get that person killed. So knowingly doing so is essentially equivalent to manslaughter

2. It's a violation of bodily autonomy

3. The state should serve the people and not the other way around. The reason why a state exists is to enable large numbers of people to live together in relative peace and prosperity. A state that puts it's own existence above the lives and welfare of its citizens should not exist ",jet_vr,158,820,0.6000000238418579,0.21920567602345709,1733133549,/r/changemyview/comments/1h4rlyl/cmv_forced_conscription_is_inherently_wrong/,2024,12
1hettt0,CMV: The New Jersey Drone’s are just mass hysteria.,"People are seeing planes and helicopters, maybe some small recreational drones from hobbyists.

I was really interested in this issue at first, however I noticed a reoccurring theme: nearly every time someone posts a photo or video of the “smoking gun” everyone goes “holy shit!” for the first hour or so. After that, someone figures out it’s an exact match for a helicopter, or a plane that was near the airport. It takes too long for a positive ID, and by the time it’s found everyone’s moved on to the next smoking gun- leading to many threads with the vast majority of comments freaking out about the phenomenon, burying comments that solve what it actually is.


Here’s the thing: I want to be wrong. I want to feel the magic of the drone invasion again. Someone change my view on this, because currently I believe this is a wave of mass hysteria that’s leaking into other states as more and more people see the “drones”.",toadwideweb,541,365,0.7799999713897705,0.21745882412585696,1734273403,/r/changemyview/comments/1hettt0/cmv_the_new_jersey_drones_are_just_mass_hysteria/,2024,12
1hdhfga,"CMV: The belief that the hijab is a voluntary, uncoerced choice in Iran is one of the most insidious examples of gaslighting masquerading as cultural relativism",[removed],Top_Present_5825,582,297,0.8700000047683716,0.21306134238541788,1734111003,/r/changemyview/comments/1hdhfga/cmv_the_belief_that_the_hijab_is_a_voluntary/,2024,12
1h4uwxf,CMV: Hating kids is a red flag ,[removed],Accomplished-Fix1204,446,422,0.699999988079071,0.20570115001824454,1733146000,/r/changemyview/comments/1h4uwxf/cmv_hating_kids_is_a_red_flag/,2024,12
1hezsg8,CMV: Misandry isn’t Feminism,"This is something that in recent years both me and feminist friends find bothersome within the movement, and getting out of hand.

With the number of Feminism support declining, and people hating on Feminism, as well as Feminists exiting the movement, many couldn’t help but think where and how it went wrong.

Feminism is a movement that used to be about Women rights, but it never truly meant hating on men or becoming the same oppressive monsters “who think they know better for both sexes” as men once used to be towards women, making women not having the right to vote, etc. etc.

Feminism as it went forward after those past achievements, was all about one thing: Opposing PATRIARCHY and it’s rules or teachings, introducing instead more loving and empathetic ones instead. Not opposing men. Understanding that both men and women suffer under it, and wanting to free humanity from it.

But yet despite the benevolence in that… Feminism faced an insane amount of hate and opposition all over the world, and if you listen to the reasons why, you wouldn’t be surprised.

That’s when it dawned on me.

*The public hates Misandrists. Not Feminists.*

It is likely that despite the benevolence of Feminism, a population of Misandrist saw Feminism as an “excuse” to spread Misandry equal to the level of toxicity of the patriarchy and Misogyny.
Possibly turning into the very same monsters that real Feminism tried to liberate women from, except this time focusing on men.

In that sense, Misandry paints Feminism the bad image that many people all over the world sadly mistake it for. 

Instead of being a movement on love, equality, and liberation, the hatred that Patriarchy-induced Misandry brings into such “Feminism” brings the movement unironically closer towards the Patriarchy and it’s teachings, than against it.

Feminism is about gender equality. Empathy, not tyranny. Harmony and love for all, not hate.

I would rather call this type of Feminism the “Matriarchy”, which reflects more traits and behaviors in common with the toxicity of the Patriarchy. 
Rather than Feminism.",DittoBurrito123,217,653,0.6899999976158142,0.1977867279725111,1734289787,/r/changemyview/comments/1hezsg8/cmv_misandry_isnt_feminism/,2024,12
1hq2sx0,CMV: medically assisted suicide should be allowed everywhere,"I’m only 36, but I’ve been sick most of my life. I have multiple neurological conditions that are extremely difficult to treat. I have a terrible quality of life. It should be acceptable for people like me to get a doctors help with dying. 

My grandmother lived in Oregon, so she had this option when she was diagnosed with terminal lung cancer. She was able to pass away before her suffering got too bad. It was peaceful. I’m honestly jealous. 

To be clear, I’m NOT going to hurt myself. I will continue to fight for my family. ",MeggieMay1988,514,299,0.8399999737739563,0.19617740508441522,1735607046,/r/changemyview/comments/1hq2sx0/cmv_medically_assisted_suicide_should_be_allowed/,2024,12
1h8x7bt,"CMV: The solution to police misconduct in the US isn’t defunding, but ramping up training/requiring a 4 to 6 year degree.","For context, this isn’t to dismiss a very real and longstanding issue of police forces abusing their power in various parts of the United States, or civil asset forfeiture, or the increase in militarization we’ve seen due to the Pentagon’s 1033 Military Equipment Lending program to police departments.

However, a few years ago, post-2020, I had the idea of a *Four Year Force* Program as a possible win-win for police reform advocacy.

The basic idea is it’d be a kind of GI Bill for people looking to join the police force (ie a free ride). 

There’d be a standardized, baseline federal curriculum for aspiring police officers, which would include:
- firearms discipline
- physical fitness benchmarks
- deescalation and negotiation training, and 
- civil rights 101

It’d also be part of an ordinary bachelor’s degree, so they’d be among other students and not separate from the population they might one day serve. Officers looking to join SWAT or similar would need 2 years of additional training.

That’s the basic idea, borne out from my concluding the lack of training an high stakes is mostly why we see what we see. 

However, I suspect there are very glaring reasons why this idea might be awful, and I wanted to hear those out before I start, say, writing op-eds to my local paper to pitch this idea to my congressman.",Pathos316,420,399,0.8100000023841858,0.19405899138425783,1733591865,/r/changemyview/comments/1h8x7bt/cmv_the_solution_to_police_misconduct_in_the_us/,2024,12
1hn0ahj,Cmv: Pro-illegal immigration sentiments are astroturfed by corporations that benefit off of their labor,"Illegal immigration causes competition for housing and wages among the poorest Americans. It creates downward pressure on wages and working conditions.

They are pretty much exploited by default. Immigrants on work visas are already exploited enough.

Every single study I have read on the matter says that illegal immigration provides a net benefit to the economy, but the ones that go into the details find that it's the wealthy people that receive the benefit by exploiting the workers more. The working class is generally negatively impacted by this, even if the economy does better overall

There is, at the same time, no real benefit we provide the world on a meaningful scale by accepting refugees. There are specific, local scenarios where we can absolutely have a meaningful impact by accepting refugees. 

The best example of this has been how we accept Haitians. There's been general bipartisan support for accepting these people as refugees, and even Trump extended the protections first doled out by Obama after the earthquake

However, when everyone tries to claim asylum, the alternative means of entering the US that was necessary for these Haitians after their airport was shut down was made not viable. 

The only people who truly benefit off of Illegal immigration are the wealthy that exploit them for their labor

I hate the idea that we profit off the exploitation of a lower class of people

I'm open to all sorts of immigration reform but I do not wish to engage on the subject of opening up more legal avenues for immigration",Particular-Pen-4789,271,567,0.6600000262260437,0.19277208897115183,1735253390,/r/changemyview/comments/1hn0ahj/cmv_proillegal_immigration_sentiments_are/,2024,12
1h6iufo,CMV: Elon Musk isn’t a genius and his companies shouldn’t be trusted. He’s  just an evil cry-baby rich-boy who grifts off other peoples work. ,"Tom Mueller is the person responsible for designing SpaceX rockets. Martin Eberhard and Marc Tarpenning invented Tesla, Musk was simply their first *paid employee*. He bought twitter and single-handily drove its stock into the ground, losing nearly 80% of its value. Even people who work with him have said how poor his understanding of coding is. Musk used his daddy’s money to buy into these companies, but he’s not some genius. He just claims other peoples work as his own by throwing money at them. Musk is a conman who’s only genius id stealing credit, and any company he touches is not to be trusted. ",KlosterToGod,352,453,0.6800000071525574,0.18852381008500116,1733326404,/r/changemyview/comments/1h6iufo/cmv_elon_musk_isnt_a_genius_and_his_companies/,2024,12
1h8vncs,CMV: Blue states should now implement universal healthcare. ,"After the death of the UHC ceo, I think this is one of those rare times where both the right and the left agreed together. Never have I seen this much united anger aganist insurance companies. I think that universal healthcare is gonna be even more popular, and I think before we implement it nationally, we should implement it in a state.


Vermont tried doing this but the bill got blocked. I honestly think that a northeast or west coast state should implement universal healthcare. Why? Because while universal healthacre has succeeded in many other countries, the US has way differnet environment then Scandinavia. Because of that we should test if universal healthcare will actually benefit people. Another reason why is because states like New York and Illionois might once again gain population since they are the first states to have universal healthcare. These are my reasons why and would like to hear constructive criticism.",Adorable-Mail-6965,425,363,0.800000011920929,0.1874757211823359,1733587623,/r/changemyview/comments/1h8vncs/cmv_blue_states_should_now_implement_universal/,2024,12
1h94uka,CMV: The only thing Conservatives conserve is wealth for the wealthy. ,"Throughout recent history, there have been ""conservative"" political parties. These parties have always been about one primary thing and that is hoarding wealth for the upper class.

The conservatives in Britain are a great example. The Tories there have existed since time began as a proxy for the landed interests, especially the monarch. The same is true everywhere in the world, where deep pockets fund political operations dedicated to keeping those very same pockets deep. 

Sure, some are religious nutballs intent on forcing sharia law of whatever sort down people's throats, but these religious parties are always, ALWAYS, somehow associated  and/or backed by oligarchs and other well-funded sources intent on taking power.  

Which gets back to the main point for those conservatives which is accumulating wealth. 

Change My View, if you can.  ",Super901,414,364,0.6399999856948853,0.18489213256240003,1733612996,/r/changemyview/comments/1h94uka/cmv_the_only_thing_conservatives_conserve_is/,2024,12
1hfxdur,CMV: Outrage over Palestine was pushed by entities to influence the 2024 election,"Palestine outrage was pushed with the purpose to damage Biden/Harris's chances of winning the 2024 election. Literally 2 days after the election results all the subs which were full of ""people"" attacking dem for not doing enough for palestine magically disappeared.

I'm in many leftist subs and literally nobody speaks about Palestine anymore.

The outrage was real but it was inflated to help trump's chances and it worked and now any trace of outrage is buried by whatever other news might be popular at the moment.

In a couple of months trump-Israel-Hamas will sign some kind of peace treaty which will destroy any chance of a Palestine free state and nobody will care mark my words.

If I have to bet money on it I would say it was done by the russians but whoever did it, I'm pretty sure it happened and I hope someone will learn from it.",JackColon17,109,692,0.5699999928474426,0.1787893800476871,1734393267,/r/changemyview/comments/1hfxdur/cmv_outrage_over_palestine_was_pushed_by_entities/,2024,12
1h671rd,CMV: it’s not “disrespectful” or bigoted to incorrectly eat or prepare ethnic food under most circumstances,"So, let me start by saying that I do get where the other side of this issue is coming from. I’m Greek American. People incorrectly eat our food quite often. From putting dill in tzatziki (maybe some Greeks do that but no Greek owned restaurant I’ve ever been to has, nor has my family or any family I know and have eaten with), to honey mustard chicken gyros, and more. I find it annoying. However, that doesn’t mean I have a right to tell other people how they want to eat food on their plate.

If someone wants to eat a honey mustard chicken gyro or put dill in their tzatziki, go for it. Who am I to judge? If you enjoy your food, that’s what matters most.

That being said, I can see some exceptions to this. For example, if a friend is trying to introduce you to their culture through food, I’d recommend eating and preparing the food how it’s meant to be eaten and prepared. That being said, that isn’t really about cultural respect as much as it is about respecting your friend.

The other argument for the other side that I’ve heard is that there are reasons why food is prepared certain ways in certain cultures, normally for health and practical reasons. And, I get that. But, I’d argue that as long as you’re not really harming anyone, it’s fine.

I guess there’s also the argument that the food item comes from a culture consisting of people of color or oppressed groups. In which case, it’s harder for me to speak on that because I am white. But, I’d again argue that there isn’t really any harm done? If anyone has a different perspective, feel free to share it.

",Lordkeravrium,436,309,0.8500000238418579,0.1784923084927999,1733284316,/r/changemyview/comments/1h671rd/cmv_its_not_disrespectful_or_bigoted_to/,2024,12
1hbplyh,cmv: Luigi Mangione did the right thing.,"United Healthcare is the #1 claims denier, a feat presided over by the former CEO. This causes untold suffering and tragedy. Meanwhile, United’s profits have been increasing, and people insured by UHC have been getting squeezed. More suffering.

Oh, and when the CEO got murdered, Anthem immediately backed off its proposed limited anesthesia policy (which would have caused yet more suffering to juice profits). It’s an evil system run very purposefully by actual people, and that CEO (whatever his name) was at the top.  

And no, being a father and husband doesn’t mean that you’re not also a vile person. I feel bad for the kids, but he deserved it.",grammercomunist,186,576,0.6299999952316284,0.17308576184511676,1733908502,/r/changemyview/comments/1hbplyh/cmv_luigi_mangione_did_the_right_thing/,2024,12
1h4j25s,CMV: Trump is not a Christian and his Policies do not reflect the teachings of Jesus,"Argument 1: Jesus said to ""love thy neighbor as thy
self.'


Trump's anti immigration policy supports
concentrating undocumented immigrants without
guidelines on how to do so humanely and deporting
them to places the escaped because of violence


Argument 2: Jesus said ""You have heard, an eye for
an eye, and a tooth for a tooth, but I say offer no
violent resistance to one who does evil"",


January 6 was violent and supported by Trump
even if Democrats are ""evil"" this isn't the teaching of
Jesus.


Argument 3 Jesus said """"I am the way, and the truth,
and the life. No one comes to the Father except
through me""


Trump is not a Christian which leads me to believe
he does not have a relationship with Jesus.",TheOceanInMyChest,422,295,0.7400000095367432,0.17187090373124986,1733102076,/r/changemyview/comments/1h4j25s/cmv_trump_is_not_a_christian_and_his_policies_do/,2024,12
1hfn4kf,Cmv: Trying to be manly is ironically very unmanly,"This is a specific type of person. Guys who try desperately to be manly “alpha” men, who are very insecure about how others see them and become very emotional if anyone dares think they are not mr macho man are ironically very unmanly. They cannot do something which they consider “feminine” because they are manly men what if someone sees them. They are slaves to gender stereotypes and society. They have to try to look as “manly” as possible and anyone who does not look like that is automatically less of a man to them. What is manly is obviously not always universally defined, but going off gender stereotypes, i feel that caring so hard about being manly is not very manly. It is also the same kind of guy who is always becoming so angry at everything and yet says that men are not emotional as if anger is not an emotion. 

I feel as if being brave enough to truly be your authentic self in the world without trying to be manly and just being who you are is what is actually manly. You do whatever you want it does not matter if someone else might think it is not masculine, who cares. That being said if you happen to fit into the masculine stereotype then that is cool and completely fine. As long as you are not a try hard or asshole about it. ",After_Discipline_794,429,266,0.8199999928474426,0.16732477503389306,1734366949,/r/changemyview/comments/1hfn4kf/cmv_trying_to_be_manly_is_ironically_very_unmanly/,2024,12
