id,title,selftext,author,score,num_comments,upvote_ratio,popularity,created_utc,permalink,year,month
1hjhy0n,"CMV: ""Believe all women"" is an inherently sexist belief","

Women can lie just as much as men. Women can have hidden agendas just as much as men. Women are just as capable as men of bringing frivolous lawsuits against men. At least, that's what the core principles of feminism would suggest. 

If it's innocent until proven guilty everywhere else, and we're allowed to speculate on accusations everywhere else... why are SA allegations different? Wouldn't that be special treatment to women and be... sexist? 

I don't want to believe all women blindly. I want to give them the respect of treating them as intelligent individuals, and not clump them in the ""helpless victim category"" by default. I am a sceptical person, cynical even, so I don't want to take a break from critical thinking skills just because it's an SA allegation. All crime is crime, and should ideally be treated under the same principle of 'innocent until guilty'. 

But the majority of the online communities tend to disagree, and very strongly disagree. So, I'm probably missing something here. 

(I'm a woman too, and have experienced SA too, not that it changes much, but just an added context here)",JustSocially,703,815,0.7099999785423279,0.3569325849917049,1734811531,/r/changemyview/comments/1hjhy0n/cmv_believe_all_women_is_an_inherently_sexist/,2024,12
1h7f34c,CMV: Anyone who bough Hawk Tuah Crypto with anything other than fun money is a fucking idiot,"I actually don't have anything against Haley Welch. Let me be clear. I am (or at least was) of the opinion that she is a very smart woman who is able to capitalize on her 15 minutes of fame and might be a respected podcaster or something else. And if you say that's impossible, just listen to Joe Rogan's ""I'm Gonna Be Dead Someday"" CD and ask yourself if you think that had the makings of a millionaire podcaster who would sway the election of the United States and the world-changing consequences of Trump's election.

That said, Crypto is what it is. It might be a store of value. It might be the future of money transactions, replacing credit cards and cash. Or it might be a ticket to sell your crypto to a bigger fool than you. We're still figuring that out. If you thought a memecoin about a drunk girl giving blowjob instructions was going to be the next Bitcoin, or even the next Doge, that's on you. You're a fucking idiot if you thought spending a dollar on Tuah was a better investment than a scratch-off.

Change my view. Explain why, even though the rug got pulled, it was a good idea at the time.",EmpireStrikes1st,1144,225,0.9200000166893005,0.34049592271514506,1733420977,/r/changemyview/comments/1h7f34c/cmv_anyone_who_bough_hawk_tuah_crypto_with/,2024,12
1hkrean,CMV: The man who set a woman alight on the New York subway deserves to die,"I never believed in capital punishment until today, but this guy single handedly converted me.

Burning someone to death is just about the worst thing you can do to them. It is the most excruciating way to die. 

Doing that to an innocent bystander is unconscionable. In fact, that's an understatement. There are no words to describe it. It's beyond comprehension. It's unspeakable.

This murder doesn't just deprive a woman of her life. It hurts every single woman on the planet. Every day, women have to live in ever greater fear of being attacked. This act compounds that problem and actually makes it more likely further attacks will occur. I would argue that everyone suffers as a consequence of that reality.

There are two reasons why the attacker should be tortured to death. 

Firstly, as a deterrent. You will make women - and the general population - safer by punishing this murderer. Something has to be done to protect women and a painful, inhumane death will go some way to achieving that. But all this pales in comparison to the second reason. That reason is retribution.

The world gains nothing from this man's existence. His continued being does nothing whatsoever to assuage any of the pain society experiences as a consequence of his actions. And it does nothing to address the extraordinary cost those actions inflicted on the victim.

From a utilitarian, never mind a moral perspective, there is an imperative to punish this man. The only way to do that - and the only way to gain any semblance of justice and utility from the situation - is to inflict the maximum amount of pain on him. At least then we can in some way alleviate the mental anguish and suffering of society as a whole.

I would actually argue that the man deserves to be tortured to death, but death at a minimum is more than justified.",idoze,690,670,0.8399999737739563,0.32197575709330606,1734971296,/r/changemyview/comments/1hkrean/cmv_the_man_who_set_a_woman_alight_on_the_new/,2024,12
1h46fdx,CMV: Piercing your baby’s ears is extremely weird and wrong,"Some people when they have a daughter they have her ears pierced pretty much immediately and in my opinion this is just extremely weird and wrong. Just because she’s a girl does that mean she will automatically want pierced ears? There is a good chance that she will want her ears pierced, but let her make that decision herself when she’s a bit older rather than forcing it on her when she’s a baby. I’ve seen lots of people opposing things like circumcision and FGM on infants (which I’m also against), but I feel like this is an overlooked issue that people don’t really talk about. ",Okapi05,764,557,0.8100000023841858,0.3161627382881874,1733068906,/r/changemyview/comments/1h46fdx/cmv_piercing_your_babys_ears_is_extremely_weird/,2024,12
1hq867d,CMV: I don't think much progressive change will come to America nor the Democratic party in the future.,"Hey, as the title says, I don't really think that much change in favor of progressive policies will come to the USA and the Democratic party. Mainly, it's about AOC losing her bid for the oversight committee to an old man with throat cancer and with all those old people in charge. Then, my thoughts have shifted more pessimistic towards the Democrats, that they're just Republican-lite, that they don't care about voters - just their wallets, that they benefit either way of they lose or win because they keep getting richer, that they will never change because it benefits them. I'm 17 years old, and I've done my fair share of volunteering for the Democrats. I've written letters and sent them to swing states, I've done door knocking, I volunteered with a local organization to get people to vote for the Democrats. I used to be blue to the core, obsessed with the past accomplishments of the Democratic party. I was (and still kind of am) obsessed with the New Deal, obsessed with the Great Society because I truly believe in their policies and I still thought that there is some semblance of the New Deal in the modern Democratic Party. But now I think the ones at the top of the Democrats just don't care about progress or what's good for the people, just their careers. I believe if Harris won, she would have been infinitely better than the current elect, but that the current condition of the Democratic party would not allow the progressive ideal to bloom in America even if she got elected. I feel horribly apathetic at the current state of the Union and I severely hope to be proven wrong.",WattsAndThoughts,417,914,0.800000011920929,0.3056911883373621,1735624232,/r/changemyview/comments/1hq867d/cmv_i_dont_think_much_progressive_change_will/,2024,12
1hkwd3q,"CMV: The Democrats are not a ""right-wing"" party and are not out of step with center-left parties in other developed countries.","This is something you here all the time on Reddit, and from people on the left generally, that the Democrats are actually a ""right-wing"" party on the international level and somehow their policies would be center right in other post-industrial democracies. People can arguable about the specifics of ""right-wing"" and ""left-wing"" so the more precise case I'm making is that the policy goals of the Democratic party are not out of step or somehow way further to the right compared to other mainstream, center-left parties in Europe or other Western democracies. If the policies of the Democratic party were transported to the United Kingdom or Germany, they would be much closer to Labour or the SPD and aren't going to suddenly fit right in with the Tories or the CDU. 

I will change my view if someone can read the [2024 Democratic platform](https://democrats.org/wp-content/uploads/2024/08/FINAL-MASTER-PLATFORM.pdf) and tell me what specific policy proposals in there would not be generally supported by center-left parties in Europe or other Western democracies. 

In 2020, Biden ran on a platform that included promises like raising the minimum wage to $15 an hour, providing universal pre-k, making community college and public four year universities free, creating a public option for health insurance, among other things. Biden's primary legislative accomplishments were passing massive fiscal stimulus through the American Rescue Plan and infrastructure law and a major subsidies for green energy through the Inflation Reduction Act. He also expended a bunch of political capital on a plan for widespread student loan forgiveness that even other Democratic politicians conceded went beyond the scope of the Executive Branch's powers. I don't see how any of these things can be considered remotely right-wing. Even left-wing commentators like Ezra Klein at the New York Times have said that the Biden administration has been the most progressive administration ever in American history.

I think the assertion that Democrats are ""right-wing"" is mostly the result of people fundamentally misunderstanding the major differences between the American political system and the parliamentary systems practices in most other western democracies. The filibuster makes it so, that in practice, any major policy proposal requires bipartisan support. The last time the Democrats had a filibuster proof majority was back in 2009, which they promptly lost in like a year after a special election in Massachusetts. With their filibuster proof majority, the Democrats used it to pass the Affordable Care Act. Say what you will about the ACA, you can believe it didn't go far enough, but I don't really see how it be remotely construed as ""right-wing.""

Meanwhile, the majority party in most parliamentary systems is able to pass pretty much whatever they want with a 50%+1 majority, provided they can get their party/coalition in line. The logic people seem to employ when they argue that the Democrats are right-wing are they identify progressive policies that America doesn't have that other countries do have like single-payer healthcare, universal parental leave, etc and then reason backwards to conclude that the Democrats must be right-wing. But the Democrats explicitly call for many of these policies in their party platform, it's just virtually impossible to pass most of these things because of the Senate filibuster. 

As an additional note about healthcare, it's worth pointing out that many European countries do not have nationalized, single-payer systems use a mix of private and public healthcare options. The big examples are Germany and Switzerland. Even countries with single-payer systems like Canada still use private health insurance for prescription drugs and dental work. Just because the Democrats seem confused on whether they want to whole-heartedly embrace as Sanders style ""medicare for all"" isn't prima facia evidence that the party would somehow be right-wing in Europe. 

Finally, the Democratic party is arguably much further to the left on many social issues. One of the biggest examples is abortion. It's not clear what, if any, restrictions on abortion that Democratic party endorses. In states that have a Democratic trifecta in the governor's mansion and supermajorities in both houses of the state legislature, abortions are often effectively legal at any point, provided you can find a sympathetic doctor to provide a ""good-faith"" medical judgement that completing the pregnancy would harm the health of the mother. 

The viability standard set in Casey of around 24 weeks gave the US a significantly more generous timeframe to get an elective abortion, whereas most European countries cap it [around 12 weeks](https://www.statista.com/statistics/1268439/legal-abortion-time-frames-in-europe/). Many European countries also require [mandatory counseling or waiting periods](https://reproductiverights.org/wp-content/uploads/2020/12/European-abortion-law-a-comparative-review.pdf) before women can get abortions, something the Democrats routinely object to. For comparison, the [position](https://edition.cnn.com/2024/04/15/europe/germany-abortion-recommendation-intl/index.html) of the Germany's former left-wing governing coalition was the abortions up until 12 weeks should be available on demand, provided the woman receives mandatory counseling and waits for three days. If a Republican state set up that standard in the US, the democrats would attack it relentlessly as excessively draconian, which is precisely what they've done to North Carolina, which has an extremely similar [abortion law](https://www.acluofnorthcarolina.org/en/abortion-guide-access) on the books.",ThePurpleNavi,358,890,0.6100000143051147,0.2854252826126643,1734984967,/r/changemyview/comments/1hkwd3q/cmv_the_democrats_are_not_a_rightwing_party_and/,2024,12
1hedrsk,CMV: circumcision is child abuse,"I believe that it is child abuse to cut on the genitals of baby boys and that it should be illegal to cut on boys genitals 

The common counter arguments are religious freedom parental rights that cutting on boys genitals is medicine and the it’s legal argument 

I will address all the objections that I’m aware of 

1. As far as religious freedom I don’t believe religious freedom includes the “right” to carve your religion onto someone else’s body regardless of what holy book people quote the boy’s bodily autonomy and bodily integrity outweighs this

2. In regards to “parental rights” I don’t believe in the concept at all parents shouldn’t be allowed to do whatever they want to their children just cause “parental rights” if a parent produces child porn of thier kids they would rightfully be behind bars for their actions it wouldn’t matter if the parent who produced child porn used “parental rights” as a defense 

Likewise parents should be prohibited from being able to cut on the genitals of baby boys and people should be able to take their parents to court for having their genitals cut on without thier consent 

3. The most common “defense” for circumcision being “medicine” is the AAP statement which has been expired for years and the AAP did not renew the policy endorsing circumcision and when it was in effect the other pediatric organizations that weren’t in the United States condemned it as a culturally biased paper

And there’s an entire industry that makes billions of dollars from cutting on the genitals of baby boys and use them for biotech companies 

4. Just because it’s legal to cut on the genitals of baby boys does not mean people should do so slavery used to be a legal practice in the USA as well the fact that it’s legal only indicates who is in power not that it’s justified to cut on babies genitals

Not to mention anti cannabis laws did not stop people from advocating to legalize cannabis 

Anti abortion laws don’t stop people from advocating for legalizing abortion 

Pro abortion laws don’t stop people from advocating to make abortion illegal 

Likewise the fact that it’s legal to cut on the genitals of baby boys is not going to stop intactivists from advocating to make it illegal to cut on the genitals of baby boys and pressing for every single piece of legislation that makes it more difficult for circumcisions to happen such as defunding circumcision adding more burdens on the hospital so that they are like it’s not profitable anymore to cut on boys genitals etc.",flashliberty5467,440,773,0.6600000262260437,0.2807769799785779,1734213879,/r/changemyview/comments/1hedrsk/cmv_circumcision_is_child_abuse/,2024,12
1hk3zlc,CMV: Child Abuse is more tolerated from nonwhite families than it is from white ones.,"I know that there is plenty of abuse from white families here in western countries. However at least for the most part we as a society condemn it (Rightfully so) and see it as horrible parenting. However child-abuse is always talked about and condemned in terms of white parents. When it comes to parents from other countries and cultures, like Hispanics, Asians, and Indians just to name a few, it's talked about more casually and not condemned as much due to it being ""part of their culture"" (seriously look up videos and shorts on you-tube of people from other cultures casually joking about how their parents beat them and emotionally, and verbally abused them). I'm not trying to be ignorant or stereotype other people's culture but why are we so tolerant of abuse from nonwhite people, instead of condemning it. Also we see a good chunk of white people cut contact with their abusive parents when they reach adulthood (again rightfully so) however that rate is nowhere near the same with Minority kids as a good chunk of them I've seen online actually spend time, and act all friendly with their parents as if they forgot what they put them through and some of them even excuse it as ""they just showed their love in a different way"". This baffles and horrifies me to say the least.  ",Mysterioape,831,294,0.8500000238418579,0.2758299380974924,1734890812,/r/changemyview/comments/1hk3zlc/cmv_child_abuse_is_more_tolerated_from_nonwhite/,2024,12
1h9o6wr,CMV: The Democrats are doomed in the long term.,"Before I present my case, I want to get two things out of the way. One, I am a Democrat who voted for Kamala Harris, so I would very much like to be wrong. Two, this analysis does not take into account the possibility that no future elections are held. While I'm not convinced US elections are over forever, half of Reddit seems to be. Anyway, here's why I believe the Democrats are fucked even if democracy remains intact.

The 2024 election should have been a lay-up for Kamala Harris. Biden and Trump were both historically unpopular nominees, so much so that a man changed his legal name to ""Literally Anybody Else"" and ran a joke campaign. Biden was replaced by Harris in July, leading to tons of enthusiasm and small-dollar donations on the Democratic side. The economy was (and is) doing considerably better than in most other countries, including wealthy European nations. Most importantly, her opponent was a senile old man whose inaction led to the deaths of over a million people in the United States alone, was the only head of state to deny climate change, and tried to overthrow the government on his way out. Despite having the easiest possible set of circumstances with which to win a presidential election, *she still lost.*

Furthermore, rural voters are never going to vote for Democrats again. Local media, commonly cited as an antidote to polarization, has shriveled up, to be replaced by right-wing talk radio. Now, if Democrats could lose those areas by 30 points instead of 50 points, that would go a long way in the swing states. However, they don't just need swing states to remain viable as a national party (more on that later). Additionally, the 2024 election saw urban centers, people of color, and many other demographics that traditionally vote for Democrats swing violently rightward. As a 24-year-old man myself, I'm shocked but not surprised that Trump outright won men under 30. And I don't think they're coming back, because the Democrats won't embrace alternative media - there will never be a left-wing Joe Rogan. If the Democrats can't make up ground in rural areas, but also lose core parts of their base, they are doomed.

The situation is even more dire in the Senate, especially important because the Senate is the only chamber that can confirm or block nominees to the judiciary. Even with a 47-seat minority, the Democrats will still control both seats in several states that voted for Trump in this election. This includes both Arizona seats in a state Trump won by more than 5 percentage points. In other words, the Democrats are far more likely to lose Senate seats than to gain them in the long term. Even in the short term, the Democrats have just two pick-up opportunities in 2026 Senate - North Carolina (which has remained elusive for Democrats at the federal level since 2008!) and Maine (in which the unbeatable Susan Collins is likely to run again). Even if the Democrats can elect a President, they can only do so much without the Senate on their side, and if the judiciary gets right-wing enough, they will start green-lighting even more egregious voter suppression than we've already seen, which will eventually make it virtually impossible for Democrats to win again.

Finally, let's look at the media. In a craven display of anticipatory obedience, the Washington Post infamously did not endorse Kamala Harris this year. To make matters worse, MSNBC's Morning Joe (the channel of choice for the #Resistance) is already sucking up to Trump because they fear he'll try to shut them down. Trump would be foolish to shut them down, of course, because they're perhaps more responsible than anyone else for him returning to power. But in the period between the 2016 election and Trump's inauguration, I remember there being a lot more protests among both Democratic lawmakers and Democratic civilians than I see this time. That could partly be because the Kyle Rittenhouse precedent allows white vigilantes to murder protestors and get away with it, in which case I don't blame people for being too scared to protest. But the Democrats seem demoralized rather than angry, which is why I don't think they will engage in the necessary activism to resist Trump's worst policies.

CMV.  
",SacluxGemini,229,911,0.6000000238418579,0.25715056346869286,1733679746,/r/changemyview/comments/1h9o6wr/cmv_the_democrats_are_doomed_in_the_long_term/,2024,12
1h7h9y2,CMV: The lack of empathy in the assassination of the United Healthcare CEO is perfectly reasonable both practically and morally. ,"Some things that lead me to this conclusion 

1. United Healthcare was the largest claims denier for healthcare medications and procedures in the USA 

2. This industry results in the preventable deaths of tens of thousands of people every year. 

Therefore, he is directly responsible for the death of tens of thousands of Americans each year. Wanting to see vigilantism against him is at least reasonable at most justifiable.

Also, saving money by denying claims enriched him lavishly. Meaning he would profiteer at the death and suffering of others. Wanting to see vigilantism is also at least reasonable for this, at most justifiable. 

Also I’ve heard:

3. (Not sure if true) I’ve seen that United spent many of their net income on stock buybacks as opposed to expansion in coverage, meaning they had money to cover more claims and instead spent it in a way to increase share value (directly enriching the board of directors at the expense of clients)",TarkovskyAteABird,414,614,0.7699999809265137,0.23945345949387098,1733426345,/r/changemyview/comments/1h7h9y2/cmv_the_lack_of_empathy_in_the_assassination_of/,2024,12
1hh4ua8,"CMV: If a militant force intermixes civilian and military centers/assets, they are partially to blame for civilian deaths.","If a smaller, more oppressed force is being invaded by a stronger military, one effective tactic is to hide amongst civilian populations to create difficult choices for the opposing force.

This can include tactics such as: launching rockets outside of hospitals, schools, and children's daycares and storing ammunition in hospitals and civilian centers, and treating wounded soldiers in hospitals.

If a militant force does this, and then the opposing force bombs these centers, at least partial blame is on that defending force for innocents caught in the crossfire no matter the aggression or how oppressed they are by the outside force.",theguy445,236,771,0.6899999976158142,0.22837920561376296,1734537984,/r/changemyview/comments/1hh4ua8/cmv_if_a_militant_force_intermixes_civilian_and/,2024,12
