id,title,selftext,author,score,num_comments,upvote_ratio,popularity,created_utc,permalink,year,month
1hhujbm,CMV: The left and right should not argue because we should be focused on taking down the ultra wealthy instead,"I have been having arguments with family recently who voted for Trump this past election when I voted for Kamala. I had the realization that us arguing amongst ourselves helps the ultra wealthy because it misdirects our focus to each other instead of them.

It's getting to a point where I want to cut ties with them because it's starting to take a toll on my mental health because the arguments aren't going anywhere but wouldn't that also help the ultra wealthy win if we become divided?

CMV: We should not argue with the opposing side because we should be focused on taking down the ultra wealthy instead. We should put aside our political and moral differences and mainly focus on class issues instead.",shinkansendoggo,1963,1996,0.8199999928474426,0.9356176342208642,1734619848,/r/changemyview/comments/1hhujbm/cmv_the_left_and_right_should_not_argue_because/,2024,12
1hlvucu,CMV: There is no evidence directly connecting Luigi Mangione to the person who was seen shooting Brian Thompson,"**I am not arguing whether or not Luigi Mangione was guilty, nor am I arguing whether the murder of Brian Thompson was good or not.**

Luigi Mangione has plead not guilty to the murder of Brian Thompson. His lawyer asserts that there is no proof that he did it. I agree that there is no proof that we can see that he did it.

There is no evidence that the man who shot Brian Thompson and rode away on a bike is the man who checked into a hostel with a fake ID and was arrested in Pennsylvania. They had different clothes and different backpacks.

I'm not saying it's impossible that they are the same person, I'm just saying there's no evidence that I can see that they're the same person.",razorbeamz,1912,927,0.7799999713897705,0.6893230793245535,1735110359,/r/changemyview/comments/1hlvucu/cmv_there_is_no_evidence_directly_connecting/,2024,12
1hksiq5,CMV: Reddit is a far left echo chamber.,"The general reputation of Reddit is that it leans very far to the left, and if you use it much at all, you can easily understand why. Many of the largest subreddits are filled with progressive or far-left takes, and the way the site functions tends to amplify those perspectives. While plenty of communities cater to other ways of thinking, the general culture of Reddit is slanted left. It's become sort of an echo chamber for those ideas, and alternative views really don't get much traction.

First off, many of the most popular subreddits on Reddit have to do with progressive or socialist issues. Places like r/politics, r/antiwork, and r/latestagecapitalism are filled with posts railing against capitalism, billionaires, and big corporations. The discussions go beyond just pointing out problems, too—they can get really extreme. You see and hear people quite vociferously saying that billionaires don't deserve to exist and calling CEOs-bankrupting industries for profit, specifically the ones dealing in healthcare-are something people say quite easily; from basic 'Billionaires deserves to lose everything' comments up to and including outright physical or other forms of suggested violence. These posts gain thousands of upvotes, so they are on the front page, reinforcing the leftist vibe.

The voting system on Reddit makes the echo chamber effect even worse. If someone posts a comment or opinion that doesn't fit the dominant narrative-like a conservative or moderate take-it's usually downvoted so hard it disappears. On the other side, everything that corresponds to the popular left-leaning view is upvoted and moved to the top. That means just one side of the argument is really seen, while opposing viewpoints get buried or ignored. Over time, this just discourages people with different perspectives from even bothering to engage. Why post something if it's just going to get downvoted into oblivion?

Then, of course, there is the huge role of moderation in giving shape to the overall tone of the platform. Large subreddits are run by their moderators, who are themselves often very left-leaning. They can be very quick to remove posts or ban users if they don't agree with the content, even when it doesn't break any rules. Such moderation makes a one-sided space where alternative viewpoints are not just unpopular but also actively suppressed. It's unsurprising that people view Reddit as a hostile place for anyone who doesn't align with progressive values.

Another reason has to do with the makeup of the site's users: The users go for a younger, more technologically hip audience that can easily go to the left on social issues and politics. Users interact and upvote this content as it speaks for their views, only to increase the presence of the left on this site. Now, for those right-leaning areas of Reddit-areas such as r/Conservative or r/libertarian-they exist but pale in size to the big left leaning behemoths.

At the end of the day, Reddit is not completely bereft of other viewpoints, but the way the site is structured makes it incredibly hard for them to be heard. From the voting system to the heavy-handed moderation to the demographics of the user base, Reddit has devolved into a leftist echo chamber where everything else is drowned out. No surprise there, really, when people think of it that way.
",Honest_Shopping_8297,593,2291,0.5799999833106995,0.6510443199184921,1734974335,/r/changemyview/comments/1hksiq5/cmv_reddit_is_a_far_left_echo_chamber/,2024,12
1hghe43,CMV: It's perfectly reasonable for a country to ban or severely restrict immigration from Islamic countries ,"I'm personally generally not a fan of religion. And I think Christianity is also problematic and contains a fair amount bigotry and sexism for example. However, I'd say in 2024 Islam is definitely by the far the most dangerous and most intolerant major religion in the world. Of course there are millions of Muslims who are reasonable people, who have fairly moderate or even progressive views, sure. But by and large the way Islam is being practiced today makes it the most intolerant and most dangerous major religion that exists.

A pretty large percentage of Muslims around the world hold beliefs that are extremely at odds with Western ideals such as democracy, liberty equality and human rights. According to [Pew Research](https://www.pewresearch.org/religion/2013/04/30/the-worlds-muslims-religion-politics-society-beliefs-about-sharia/#:~:text=Sharia%20as%20the%20Official%20Law%20of%20the%20Land&text=In%20South%20Asia%2C%20high%20percentages,%25) a very significant percentage of Muslims worldwide support Sharia law, and of those a significant percentage believe in things such as the death penalty for leaving Islam or stoning people for adultery. In almost every Muslim-majority homosexuality is illegal and in some it's even punished by death. Many Muslim majority countries have male guardianship laws, blasphemy laws and ex-Muslims in many Muslim countries would risk their lives if they openly came out as ex-Muslim.

And even many Muslims in the West continute to hold many of those extremely illiberal beliefs and ideas. According to a 2015 poll around half of all Muslims in the UK think homosexuality should be illegal, 39% believe a wife should always be obedient to her husband, and 23% support Sharia law. And many Islamic ideology not only has serious consequences for people in the Muslim community but also for society as a whole. The UK for example has a very high rate of forced marriages, the victims often being women from Muslim immigrant families, and the UK also has one of the highest rates of [honor-based violence and killings](https://www.jns.org/uk-honor-based-crimes-up-62-in-2-years/), much of that happening within the Muslim community.

But Islamic ideology also severely affects society as whole in non-Muslim countries. The vast majority of the most deadly terrorist attacks in Europe in the 21st centuries for example were commited by Islamic extremists. The Madrid train bombins, the Paris terror attacks, the Nice truck attack, the London bombins, the Brussels bombings, the Barcelona terror attack, the Manchester arena bombing, that's just a few of the terrorist attacks commited by Islamic extremists in Europe. Islamic ideology has a chilling effect on free speech, with the free press in Europe these days being afraid to publish material the Muslim word could see as offenseive after events like the Charlie Hebdo shooting where employees at a French satirical magazine were killed for saying publishing a caricature of the prophet.[ In the UK a teacher is still in hiding](https://www.dailymail.co.uk/news/article-13276847/teacher-pupils-cartoon-prophet-mohammed-hiding.html) and fearing for his life, because he dared show students at his school a depiction of prophet Muhammed. I mean how far have we come if a teacher, not in Afghanistan, but in the UK must live in hiding, fearing for his life because they've offended the wrong people?

So in summary I think it's absolutely reasonable for a country to refuse to admit people who adhere to Islamic ideology. Many Muslims may have fairly moderate or even progressive views, and the majority of Muslims are peaceful people for sure. But given how much Islamic ideology has already affected many non-Muslim countries, no government should be expected to gamble with people's lives and admit millions of people from Muslim-majority countries, where inevitable a signficant percentage of those will likely turn out to hold beliefs and ideas that are extremely at odds with Western ideals like liberty and freedom.",RandomGuy92x,1461,1200,0.7400000095367432,0.6340288572995885,1734460517,/r/changemyview/comments/1hghe43/cmv_its_perfectly_reasonable_for_a_country_to_ban/,2024,12
1hc2wam,"CMV: Fairly or not, Joe Biden’s legacy as a president will be seen by most contemporary Americans as one of failure. ","Biden will be a historian’s president, loved in between the pages of a book but forgotten and disdained by your average Americans. I voted for Biden in 20 and Harris in 24’ but his presidency will be haunted by the shadow of defeat by trump. There’s no way around it. If you run an incumbent out of office saying “we’re better than this guy!” and then that same guy turns around and runs *you* out of office with overwhelming disapproval by the American public, you lost the battle and the war. 

Nobody cares about his achievements in foreign policy because America is making a turn toward isolationism again — as it’s done throughout its history at various times — nobody cars about build back better or the inflation reduction act. He will be seen as a Jimmy Carter-like figure, impotently standing on the sidelines as a former actor/celebrity rides to power in the Oval Office on Red Wave that reshaped the Republican part in Reagan’s image much as Trump has reshaped the current GOP in his. 

The only thing that spared him from a Carter landslide-like loss is his decision *not* to run for reelection in 24. A decision that came too late as it would turn out, but one saved him from being seen as a total failure unfortunately for him he’s almost 100 years old (or he looks like he’s almost 100 years old) so he won’t have the redemption arc Carter had with Habitat for Humanity.

He’ll die a one-term who will chiefly be remembered for his “senility”, the worst presidential debate performance of all time and the apathy by which most people greeted his arrival, his tenure and his departure from office.  ",nowlan101,1362,1120,0.7799999713897705,0.5913527273325621,1733948183,/r/changemyview/comments/1hc2wam/cmv_fairly_or_not_joe_bidens_legacy_as_a/,2024,12
1h44j71,CMV: Men and Women should ALWAYS be held to the same standard within any given job,"I was having a conversation with a woman about why more women aren't pilots and they had all these reasons why, and they said something that gave me pause. They said that in aviation everyone is held to the same standard but when giving the reasons why more women weren't in aviation, they didn't mention that maybe women simply can't or aren't willing to meet that standard. I think firefighting is another job where women are expected to meet the same standard as well.

In jobs such as the military, women are held to an objectively lower standard and arguably a lower subjective standard when it comes to discipline. This doesn't make sense to me as if someone is doing a specific job, regardless of their sex, there is a standard to do that job and I think everyone should be held to that standard period. This means one of two things for me:

1. If someone is unable to meet the standards required for the job then they just don't have the prerequisites required to accomplish the job and should not be hired.
2. If the standards are lowered so that a group of people are able to meet the requirements, then the standards should be lowered across the board because this shows that's the actual standard needed.

The only exception that I can think of doesn't have to do with sex but rather merit where there is something extraordinary about you which would justify waiving a standard.",TheAverageBear132,1027,1333,0.7200000286102295,0.5525103991721132,1733063614,/r/changemyview/comments/1h44j71/cmv_men_and_women_should_always_be_held_to_the/,2024,12
1hbydut,"CMV: Taxation is not theft. In fact, it is more akin to a modest admission ticket to participate in the economy.","I think a lot of people get their paycheck and see tax deductions and feel robbed. Like what do you mean my yearly salary is not actually how much I take home?"" Right? Libertarians make the the saying ""taxation is theft"" their rallying cry, often arguing that no taxation is acceptable, and the government should essentially disband or be at least decimated. 

I think this argument is intuitive to a lot of people because it does not feel like the benefits we get out of our tax dollars is not as valuable to us as the money would have been. When the average person thinks about how tax dollars benefit them they probably think about roads and maybe the mail or schools but not much else unless they receive government benefits like Medicaid or SNAP. In fact, the ways the government helps poor people are a lot more visible than the ways the might help everyone else. When poor people are essentially getting a monthly check from the government every month, I think it's easy for the average person to conclude that taxes are basically a scam to transfer money from working people to bums who don't work. 

But I think the benefit of tax dollars for the average American are actually much greater than we see at a glance, and the average American benefits from taxation far more than they lose because the government creates and manages the economic conditions that allow us to earn so much in the first place. 

Let's say you're a car salesman at a Toyota dealership. That dealership exists because cheap, safe trade is possible with Japan. This safe free trade is facilitated by the US military, which supports the defense of allies like Japan that could be invaded by China if the US were not an ally. If Japan were at war with China, the country might be blockaded, embargoed, or sanctioned by China in ways that make exports more expensive. Japan would also have to devote tremendous resources to their war effort. Domestic labor would be shorthanded and car manufacturing might have to be converted for war machines. If it were possible to get Toyota cars out at all, they would be more expensive. If China won the war they might impose trade restrictions on Japanese cars to the US to support its own vehicle industry. Also keep in mind the Japanese car industry only exists because the United States supported Japan's economic recovery after WW2 (with taxes), which created the Japanese economic miracle, which allows them to keep producing cheap cars. This relationship with Japan is only possible because the US won WW2 (with tax dollars). 

Imagine if FDR had been a penny pinching libertarian. He might have gone to war with Japan but would he have converted US industry to the extent necessary to win the war? Would he have raised taxes to fund the war effort if taxes are inherently theft? Or would he have negotiated for peace the moment he could secure non-aggression with Imperial Japan? Libertarian Truman certainly would never have approved funds to help Japan's economy recover. Libertarian FDR/Truman probably means no winning WW2, no Japanese economic miracle, no cozy trade relationship, which means no cheap cars in 2024. 

Your job selling cars at Toyota exists because of decisions made by the government 80 years ago supported by a tremendous tax burden, and tax dollars continuously spent to support that status quo. And besides you, customers benefit from cheap reliable cars. And the government collects tax revenue on the sales to make up for its expenses. This whole industry that benefits us all would not exist without the government spending money. This is how economies grow and create more wealth overall than existed before taxation.

While Toyota cars are maybe an easy example, there are so many other ways the government upholds the economy, such that this reasoning can apply to any job. Domestic cars? Made with imported steel and exported for profit that allows the company to grow and employ more people. Work at Walmart? Full of cheap imported goods. Bank? Insured by the government. Library? Government. Law? All about the government. Farm? Subsidized by the government. Healthcare? Majorly bloated with employees bc of the government. 

All of this is not to say that the government is perfect or that you should be ""thankful."" I am just arguing that we should recognize that the government is a necessary institution that requires taxes to work. Every day millions of Americans drive to work in Toyota cars on roads built and maintained by the government, kept safe by the government, to work in industries supported by the government, buy goods and services kept cheap by the government, and send their kids to schools provided at no cost by the government and wonder where all their tax dollars are going. Your tax dollars are all around you mate. 

And I know a lot of people are going to say this can all still exist with a free market and no government, but we have never seen that happen in the real world. Imagine what no government truly means. You would have to pay a toll of some sort to use a road if you did not build it yourself. You would have to pay a regular fee for police and fire protection. Your employer would not be required to provide healthcare, a bare minimum salary, or safe working conditions. You would be nickel and dimed at every turn so often that it would be just as bad as paying taxes or worse. And that's only assuming the inevitable corporate monopolies play nice and do not decide to simply enslave you. If a libertarian utopia were possible I just think it would have been accomplished by now. 

There are already places on earth in which there is no government. Haiti's government has collapsed. If you hate the government you can just move there. But it's a gang-controlled hell hole and nobody has the power to stop it except governments. People there are desperate. They would work for pennies to make iphones or flip flops or whatever but nobody can build a factory there because it would be taken over by gangs. Governments create order which creates economies which create wealth. You cannot have the economy and wealth without the government. All the government asks is a small fee in the form of taxes. 

Taxation is not theft, it is a small admissions fee to enjoy the robust, lucrative economy created and maintained by the government. Again, not perfect, but far better than the alternative. The lie that taxation is theft was created and circulated by rich people who know that less government means more power for them. 

Sorry, I have never taken a single economics class. I am guessing this is some economics 101 shit that economists have already extensively fleshed out. But I am a humble non-economist who does not possess the mental bandwidth to get up to speed sophisticated macroeconomic debates. Also pls no communism/socialism.",Prince_Marf,733,1575,0.7099999785423279,0.530440384120636,1733936997,/r/changemyview/comments/1hbydut/cmv_taxation_is_not_theft_in_fact_it_is_more_akin/,2024,12
1hi0od9,CMV: Elon musk having as much power as he does is one of the most deplorable things to ever happen in america.,"This is obviously a subjective opinion. Just want to start by saying that. Im also aware Elon musks companies have provided great value to Americans. The fact that he has essentially infiltrated the American government to the point he is being suggested for speaker of the house is probably the most insane thing I’ve ever witnessed.

It is a textbook example of the worship of the wealthy and the unrestricted power of money in the US government. I find it absolutely insane that he can actually sway government officials including the president when he knows nothing about the average American outside of twitter. In a proper functioning government, what he’s done so far would be illegal. 

I don’t even see what his goal is , he’s as rich as he can get, he has more power than 99.9999% of humans on earth. He is treated like a super genius visionary by many. I mean what the hell else can he get?

The guy is insane. Anyone supporting him is insane. This is a disgrace to the human population and to the US. Genuinely ridiculous and deplorable system.   

My view is billionaires(elon musk in this case) should never in a million years have the amount of influence over the political system that he does right now. Citizens united decision is one of the biggest mistakes in American history.",fiktional_m3,948,791,0.8600000143051147,0.41409918054056793,1734635894,/r/changemyview/comments/1hi0od9/cmv_elon_musk_having_as_much_power_as_he_does_is/,2024,12
1hahwza,CMV: People care a disproportionate amount about the war in Gaza compared to other conflicts.,"First off, I am not saying that we should be not shining a light on Israel's crimes, colonial aspirations and possible genocide.   
  
I'm curious as to why no one talks about UAE's involvement in South Sudan, a war that is just as colonial, is longer lasting and has resulted in the death, rape and misplacement of far far more civilians. The UAE has very close ties with the US and receives considerably military, logistic and financial support. Your tax dollars are funding the murder of millions of people in South Sudan.  
  
I've never seen anything on my feed or on any random subreddit about Saudi Arabia's war in Yemen. Saudi receives weapons from the US and the UK (and others) and uses them against civilians, causing mass starvation and has resulted in far more deaths than in Gaza. It is currently the world's largest humanitarian catastrophe.   
  
Recently people have been posting about Israel invading parts of Western Syria and destroying chemical weapons facilities but I didn't see a single post when Turkey repeatedly invaded and occupied Northern Syria which they continue to do.   
  
In my view, it can't be lack on emotional bandwidth as all the aforementioned wars started long before the most recent invasion of Gaza. It can't be about colonialism as the UAE's ambitions in South Sudan are purely motivated by economic colonialization. It can't be about the West's support for Israel as we support the UAE just as much as we support Israel, President Mohammed bin Zayed recently visited the White House and Biden called the UAE a ""Major Defense Partner"". Every year they are growing closer with the US, the UK, etc  
  
Again, I'm not suggesting that that people shouldn't be posting about Israel's crimes, but if we care about human suffering, colonialism and our governments supporting awful regimes I should be seeing even more posts about UAE in South Sudan or Saudi Arabia in Yemen or Turkey in Syria.   
  
Is it purely ignorance or is it more sinister antisemitism or something else entirely?   
  
Sources:  
[www.theguardian.com/commentisfree/article/2024/may/24/uae-sudan-war-peace-emirates-uk-us-officials](http://www.theguardian.com/commentisfree/article/2024/may/24/uae-sudan-war-peace-emirates-uk-us-officials)   
[https://en.wikipedia.org/wiki/United\_Arab\_Emirates%E2%80%93United\_States\_relations](https://en.wikipedia.org/wiki/United_Arab_Emirates%E2%80%93United_States_relations)   
[https://www.cfr.org/global-conflict-tracker/conflict/war-yemen](https://www.cfr.org/global-conflict-tracker/conflict/war-yemen)  
[https://caat.org.uk/homepage/stop-arming-saudi-arabia/uk-arms-to-saudi-arabia/](https://caat.org.uk/homepage/stop-arming-saudi-arabia/uk-arms-to-saudi-arabia/)  
[https://www.theguardian.com/world/2024/dec/09/israel-us-and-turkey-launch-strikes-to-protect-interests-in-syria](https://www.theguardian.com/world/2024/dec/09/israel-us-and-turkey-launch-strikes-to-protect-interests-in-syria)",ownmonster3000,983,633,0.7400000095367432,0.38853134805334744,1733772190,/r/changemyview/comments/1hahwza/cmv_people_care_a_disproportionate_amount_about/,2024,12
