id,title,selftext,author,score,num_comments,upvote_ratio,popularity,created_utc,permalink,year,month
1cz17gg,"CMV: The reason there’s so much loneliness in America today is because we the people have replaced our traditional institutions of community in America with social media and the internet, which are half-measures at best and actively harmful at worst.","
Humans are, in my opinion, naturally lazy creatures who will always choose the path of least resistance in almost anything. This includes communication. Throughout most of human history our sense of community was connected to our ability to travel to meet other people or other peoples ability to travel to us. 

The postal service, mail, letters, tv radio shows and phones all altered the equation but none more fundamentally then the internet did. The internet offered something unique. The *closest* simulation you could get to having a person/people in the room with you while also being alone. It has the trappings of community but none of the soul.

Low investment, low barrier to entry. Those are the hallmarks of social media. Yes it’s monetized in variety of different ways but on the whole it’s accessible and easily available at no cost to almost anyone. But it’s this lack of investment that causes the problem. People feel less satisfied, more lonely and more disconnected because the crutches they’ve fallen back on — again the path of least resistance — are empty calories. They provide no real nutrition, no food for the soul, they can aid people in connecting but they’re a tool. Not a solution in my opinion. 

My nephew is the textbook example of social media’s failed promise. He’s probably on the autism spectrum, he’s naturally shy and as a result has almost no friends in school. But with social media, game chats and YouTube to provide nourishment it should be no problem right? 

Wrong. 

He’s almost graduated high school and god love him, he’s emotionally stunted. Idk how he’s gonna meet a man/woman, how he’ll fall in love, how he’ll build a network of friends, how he’ll even hold down a job if he’s never exercised, never developed, the “muscles” you need to form meaningful, longterm connections with other humans. 

It’s not to say people like that are doomed. They’re not. I’m not on the spectrum but I had many of the same problems as he did in school but I was forced/forced myself to develop a personality and learn how to work and be social outside of a screen. 

But if you’ve got a collection of electronic crutches to fall back on, you and by extension the rest of your society is going to splinter into smaller and smaller, more disconnected tribes that happen to share the same town, city or country. ",makeyouamommy177,1336,241,0.8899999856948853,0.4331538972557238,1716492116,/r/changemyview/comments/1cz17gg/cmv_the_reason_theres_so_much_loneliness_in/,2024,5
1d1pqxa,"CMV: If you believe that the 2020 election was 'stolen', then you must concede that voting for Trump in 2024 is a waste of time/lost cause. ","Election season is coming up, and my mostly conservative family who can't stop whining about how the 2020 election was stolen are ramping up their ""you need to vote for Trump,"" rhetoric. However, this doesn't make sense. 

If you truly believe that the 2020 election was compromised by the deep state/George Soros/the Democrats/whoever Alex Jones is blaming this week, in favor of Biden, then it doesn't make sense to even bother voting for Trump. 

Typically when I hear this argument, it follows that there are some sort of vague background characters acting under the eyes of the American public, pulling strings to subvert Trump. Why wouldn't this then occur again in 2024? If you truly believe that, then by the logic of your own worldview, Biden is guaranteed to win again, and you're wasting your time by even walking to the ballots on Election Day. 

I think the only way you could convince me otherwise, is by demonstrating that something about the election process has changed fundamentally for this upcoming election, that essentially limits/disables the unseen actors from performing the rigging again. However, I don't think you could reasonably even scrape that point together, because if anything, the circumstances would only be more against Trump for this upcoming election. In the last election, Trump was at the very least in charge of the Executive Branch. Now Biden and Kamala are in charge, meaning that the 'deep state democrats washington elite cabal' or whatever, have EVEN MORE of an upper hand in playing around with the votes. 

If Trump, while president, had the election unfairly taken away from him in 2020, because the elites rigged the election against him, then it stands to reason that the now only stronger elites would do this again, meaning there's literally no reason for anyone to go cast a vote for him. ",dirtyjersey1999,784,845,0.6899999976158142,0.4262093101299199,1716810761,/r/changemyview/comments/1d1pqxa/cmv_if_you_believe_that_the_2020_election_was/,2024,5
1cts1b6,CMV: Feminism and chivalry are incompatible,"Chivalry here referring to the courteous behaviour displayed by men towards women on the basis of their sex, a.k.a being a ""gentleman"". This is textbook sexism. It's discrimination of treatment based on sex.

Feminism rejects sexism and so it is diametrically opposed to chivalry.

Often people argue that chivalry just means being courteous regardless of sex but this is a strawman because that's not how the word is generally used. It's used to refer to acts of benevolent sexism e.g paying for a woman's meal, holding the door for her, etc. Otherwise you'd just call it kindness.

If you're happy with special treatment because of your sex, you cannot claim to be a feminist",udonisi,270,1401,0.6000000238418579,0.4181730393869039,1715904975,/r/changemyview/comments/1cts1b6/cmv_feminism_and_chivalry_are_incompatible/,2024,5
1d0cf9l,CMV: The eastern world is always infantilised and the west is always held accountable beyond reason. ,"Thats it. Ive seen it everywhere. Eastern nations, have always been given a break on everything. If lets say europe or USA is involved with something the whole world turn mad. 
Afghanistan gets kidnapped by Talibans and starve? Its the west fault. 

Terror arab groups attacks on MENA? Its western fault. 


PRC has an agresive neo-colonial policy in action agai? Nothing is done. 

Iran rapes its own people? Everything goes silent.

Gulf states build walled glass cities in the dessert but cant spare a buck for their "" religion brothers"" . The west should instead accept millions of refuges running from civil wars of people like Assad. 

Europe has massive debates on racism and such ,yet countries like Korea and Japan ban black people from certain venues like its the 60s. 

Its as if these nations should be treated like kids but the west should always accept criticism, even for things not related to it. ",tachisenpai99,964,604,0.7300000190734863,0.4177052728181737,1716644862,/r/changemyview/comments/1d0cf9l/cmv_the_eastern_world_is_always_infantilised_and/,2024,5
1d3jaf1,CMV: People are using the word “Genocide” too loosely,"I saw an image earlier thats been posted around primarily on instagram saying “all eyes on genocide” and it has the following 5 groups/countries mentioned (Congo,Armenia,Kurdistan,Uyghurs, and Palestine) non of the places except for possibly the Uyghurs are close to even being a genocide. For example Palestine, at most has lost about 1% of its population. Which is terrible don’t get me wrong but its still nowhere close to being genocide levels. People seem to have the impression that a lot of people dying = genocide. We have seen actual genocides before too which is confusing since theres such a massive amount of misinformation going around about the meaning of the word. For example, theres the holocaust:6M , the Rwandan genocide:500k - 1M, and the Armenian genocide:600k - 1.6M. None of whats happening in either of these places I mentioned above are even close to these numbers. Hopefully most never will be",AthleteSuspicious151,111,1490,0.5199999809265137,0.3953956154588975,1717007510,/r/changemyview/comments/1d3jaf1/cmv_people_are_using_the_word_genocide_too_loosely/,2024,5
1csqdpf,CMV: Muting mics during a Biden/Trump debate actually benefits Trump's style of debating.,"Biden and Trump are scheduled to debate ([source](https://www.cnbc.com/2024/05/15/biden-challenges-trump-to-two-debates-before-election.html)).

A lot of people are praising this as a win generally, but especially for Biden because it will stop Trump from interrupting Biden during his responses. I don't think that's right. In fact, I think muting the mics will benefit Trump much more than Biden.

Muting someone's mic when it's not their turn to respond does *not* stop interruptions, it only stops the audience from hearing it. Consider this: Biden is answering a question posed to him. Meanwhile Trump is talking and rambling over Biden. If Biden gets distracted by this (as any reasonable person would), then this could very easily throw off Biden's response. But to the wider audience who can't hear Trump's interruptions, it will simply look like Biden is stammering, stuttering, or otherwise ""too old"". Especially in an era where sound bites and TikToks drive political perceptions, this could end up looking really bad for Biden.

I realize Biden could also employ this kind of tactic, but it's simply not his debate style. Trump's debate style on the other hand is very suited for this kind of tactic.

There could be ways to mitigate this though. Part of the debate rules could include a requirement that both candidates are visible at all times (like a PIP), or the two can be physically separated (like being televised in different rooms). But I think on its own, the rule to mute mics for the person not responding will mostly benefit Trump in the debates.

I would like to believe that the political debates are as fair as possible, so please CMV.",Slightly_Sleepless,849,581,0.8199999928474426,0.37986891578147153,1715793821,/r/changemyview/comments/1csqdpf/cmv_muting_mics_during_a_bidentrump_debate/,2024,5
1d33bxv,CMV: Every city should have a “fent tent” ,"A fent tent is:

-A big tent 
-Located far enough away from desirable areas 
-Located close enough to the city

A fent tent has:

-Bus service 
-24/7 police patrol
-24/7 EMS 
-Cots and blankets for sleeping 
-Methadone and other programs for those who want to get clean
-Narcan

A fent tent:
-Offers clean dose appropriate opioids administered regularly 
-Hearty and healthy soup served twice a day

What society gets:

-Elimination of most property crime 
-Elimination of most panhandling 
-Elimination of drug use and camping in public places 

What drug addicts get:
-Dignity 
-The ability to have their cravings satisfied so that they can focus on making healthy choices in their lives 
-Food, safety, shelter

A fent tent would pay for itself many times over.

In before:

-We tried that in Portland, and it didn’t work. No, the reason it didn’t work is because you did nothing to address the root of the problem: access to free drugs, food, and shelter.


",MyPhilosophyAccount,468,887,0.6600000262260437,0.34796285262271165,1716955518,/r/changemyview/comments/1d33bxv/cmv_every_city_should_have_a_fent_tent/,2024,5
1d1h20u,"CMV: Being homeless is a situation that is next to impossible to get out of without financial assistance, and or free room and board for at least a couple of months. This could be from any source. Expecting someone to do it alone is unrealistic. ","Alright, so disclosure, I’m homeless currently. I’ve been homeless for roughly 7 months now. So I have a different perspective on this than probably the majority of people who might see this thread. I also have had the better part of a year to get a closer look at how this really works and what options are available. 

So imagine this scenario: You receive disability income at $900 a month. You do not have a permanent residence. Your disability stipulates that you can earn up to an additional $900/mo before losing benefits. You receive a check on the 3rd of every month for $900. 

Okay, so on the 3rd of, let’s say, June, you check into the cheapest motel you can find. It’s $76/night, or $350/week. No monthly rate. That means a month is $1,400. Already more than you have. The most you can afford is two weeks, for $700. Now you have $200 left. You will need to use this money for food, unless you have EBT. Let’s assume you do, and food is not a cost you have to be concerned with. Your checkout date is June 16th.

Let’s say that on day one you apply at, say, McDonald’s, and they hire you, on day one. And you begin work on the 4th of June. Both of those things are unlikely, but let’s roll with it. 

They have presumably agreed to hire you part time, and keep your monthly pay at under $900. Let’s also assume that you started work at the perfect time in the pay period, and you will be paid in exactly 1 week and 6 days. Also unlikely. You will be paid on June 17th, and will be evicted from the motel the day before you get paid. But you’re tough, you sleep in a park that night and roll with the punches. You get paid $450 before tax, so probably around $400 after taxes, generously. Congratulations, you can now afford another whole 7 days in a motel! 

Unfortunately, you won’t be paid for 14 days, with no reliable or consistent way to bridge that gap. Homeless shelters are frequently full, and rarely near where you need to be to work. They also have strict curfews, and no excuse (even working) will bypass that. You probably also haven’t got phone service, because the entirety of your money is going to your motel. This means you cannot call a shelter before heading to it to see if they have a bed, not that it would matter anyway as they don’t reserve them. So you will waste away your entire day and or night walking around to find a place to stay. 

During this time, you will more than likely be fired, as you have nowhere to sleep, no way to shower, nowhere to put your belongings (whatever they may be) no way to wash your clothes, and ostensibly no food to eat. You will try to show up for work, because you’re not a quitter, but you’re haggard, tired, and smelly, not to mention fatigued from lack of nutrition. 


This is just a taste of the struggle of the cycle of homelessness. You could change my view by demonstrating that my assessment of the situation isn’t accurate, and provide me with evidence.

",DetroitUberDriver,943,334,0.9100000262260437,0.34580824995034687,1716775825,/r/changemyview/comments/1d1h20u/cmv_being_homeless_is_a_situation_that_is_next_to/,2024,5
1citg0m,CMV: The Man vs Bear debate is sexist,"As a backpacker I have literally witnessed multiple times the fact that women gladly pick the man over the bear. Solo women hikers are common on the trail and they never have any issue approaching me in the woods, or basically any other man. However if you tell them you saw a bear up the trail, they will likely stop and want to stick with you. I was hiking with a guy who got a call from a girl saying she saw a bear ahead so she turned around and got off the trail. So we went and made sure the coast was clear for her. When actually confronted with this choice, women will basically always do the exact opposite of what they type into social media. 

The protocol out there for a bear is to calmly back away and not look at it. The protocol when coming across a stranger is to smile and wave. To pretend the two are comparable is downright insane.

Statistically, men that will harm you are an EXTREME minority. There are around 100 million men age 15-64 in the US. There are estimated to be 500k sexual assault related incidents a year with factoring in under reporting issues. That means around 0.5% of men are committing these crimes. That is assuming the distribution is uniform, but it's not. Most of these crimes are coming from the same people over and over. 60% of them are rearrested within 5 years! 14% get arrested again before their trial is even over, More than half of rapists had previous convictions. It would be very safe to say that according to many sources I have looked at, the guys you don't want to come across in the woods make up less than 0.2% of men. Then even if you cross one, there is another percentage chance to calculate on whether they actually do something bad or not.

I am all for spreading the message. The me too movement was an awesome way to do it that opened some eyes to the reality that we do have a big problem. It didn't degrade men. It wasn't rooted in lies and hatred for men. This bear thing on the other hand is just gender war fuel. Look around, do you think it worked? No one they wanted to reach is taking it seriously because people see the nonsense it is made of. I just saw a guy being called a rapist for nothing more than choosing man instead of bear. Also just saw a video where a MAN protecting his family from a bear got clawed and it was clipped out and retitled to try to make bears look like a better choice. You can't get anywhere with a movement based on lies. There are proper ways to bring awareness, but ya'll really shot yourself in the foot on this one. The vast majority of men are with you. But when you make a ridiculous statement like ""men are more dangerous than bears"", you can only push more men away from being allies. You have to decide if the goal is to make things better, or if the goal is to hate on men.",neilthefrobot,116,1280,0.5600000023841858,0.3454514324067035,1714690697,/r/changemyview/comments/1citg0m/cmv_the_man_vs_bear_debate_is_sexist/,2024,5
1ckzwfe,CMV: You’re not a self hating Jew if you don’t support Israel,"I see this constantly on Reddit and the media interviews discrediting groups like Jewish voice for peace and any Jewish people ( even holocaust survivors) who criticize Israel’s policies or existence in its current context. I mean no religion or ethnic group can be a true monolith right? It’s like saying all Iranians support the shah, or all Iranians support the Islamic republic. It’s my belief that you’re not a self loathing Jew for not supporting Israel, and based on my limited knowledge it seems some Jews don’t support Israel at all based on religious reasoning? ",Upset_Title,195,1180,0.5699999928474426,0.34313040619670854,1714939075,/r/changemyview/comments/1ckzwfe/cmv_youre_not_a_self_hating_jew_if_you_dont/,2024,5
1cjal2k,CMV: Cats are one of the worst invasive species,"For context I am a herpetology graduate student in Arizona studying the impacts of feral/domestic cats on native lizard populations. Many of my peers are studying invasive species and we tend to talk about our shared experiences. However, whenever I address cats (house cats) as an invasive species, I am nearly shunned out of the room. 

This isn't to say I hate cats, I really do love them. But allowing your cat outside, feeding feral cat colonies without TNR efforts, and refusing to spay/neuter your cats is causing immense harm to the environment. My speciality is lizards but many other parts of the world have seen drastic drops native bird, rodent, and amphibian populations as well. 

TLDR: Cats are invasive and are doing just as much, if not more, harm as other invasive species like carp and pythons.  ",Sunlight_stardust,739,465,0.7099999785423279,0.32069473266079046,1714747851,/r/changemyview/comments/1cjal2k/cmv_cats_are_one_of_the_worst_invasive_species/,2024,5
1czsicm,CMV: Prior Authorization Should be Illegal,"I'm not sure how much more needs to be said, but in the context of medical insurance, prior authorization should be illegal.  Full stop, period.  There is absolutely no justification for it other than bastards being fucking greedy.  If my doctor, who went to fucking medical school for over a decade, decides I need a prescription, it's absolutely absurd that some chump with barely a Bachelor's degree can say ""no.""  I've heard of innumerable cases of people being injured beyond repair, getting more sick, or even fucking dying while waiting for insurance to approve prior authorization.  There is no reason this should be allowed to happen AT ALL.  If Prior Authorization is allowed to continue, then insurance companies should be held 100% liable for what happens to a patient's health during the waiting period.  It's fucking absurd they can just ignore a doctor and let us fucking suffer and/or die to save a couple bucks.  ",TheTaintPainter2,751,447,0.9100000262260437,0.31965509920349555,1716577434,/r/changemyview/comments/1czsicm/cmv_prior_authorization_should_be_illegal/,2024,5
1cmfr1l,CMV: Dropping birth rates isn't an actual problem. ,"I've seen more and more headlines and news outlets in the last year talking about how horrible it is more people aren't having babies. Everything from blaming selfish millennials to focusing on how our economy can't be sustained without more kids. 

I have so many problems with this. But the main is that it's such a waste of time to keep circling around ""we need more babies"" mind set for our economy. 

We have advanced technology, brilliant scientists, more knowledge at our fingertips than ever before. Why are we STILL so reliant on an economic model in which human population MUST grow or society will collapse one day? Really? No one can problem solve some and spearhead some solutions here? 

Not to mention, we can't just grow indefinitely. Truly, we can't. We've already wreaked havoc on the environment and our natural habitats. We're practically an invasive species. 

Less people in the future means less cars driving to pollute the air, less consumerism, less suburban sprawl to ruin beautiful land with strip malls and mcmansions. It'd also mean cheaper homes in better locations. 

Of course, there are issues with having less young people. The older generation needing to be taken care of seems to be the biggest fear I hear echoed, but again, there could be a solution for that. For example, actually PAYING nursing home workers better and providing benefits so more people flock to the field? Maybe we'll need less schools in the future if there are less kids. Funding and resources can be allocated to the elderly. I'm not even saying that's a great idea. I am not a brilliant scientist or someone with political power. But even stupid me can see that there are ways to problem solve some of the issues rather than blaming the younger generations and forcing women to give birth. 

I'm tired of hearing it talked about. Because at the end of the day, it's a mute point. Women have birth control (for now), and we have a sense of self and the right to choose. We aren't the generations of the past who had 10+ kids. And we probably never will be again. We have to move on and focus on new ways to live rather than trying to boom a population growth spurt when it simply will not happen. ",Cbsanderswrites,551,610,0.699999988079071,0.30348599097340645,1715098521,/r/changemyview/comments/1cmfr1l/cmv_dropping_birth_rates_isnt_an_actual_problem/,2024,5
1cnwsjl,CMV: Allowing Trump to put fascists on the Supreme Court isn’t worth a protest vote over Gaza,"The two furthest right justices, Alito and Thomas, are likely to retire if Trump wins.  If Trump gets re-elected he will make the Supreme Court’s 6-3 conservative majority last FOREVER and may even be expanded to 7-2 if Sotomayor has health issues.  We already lost abortion because of this.

None of this is worth it over Gaza.  Biden wants a ceasefire and humanitarian aid, Trump wants Israel to “finish the job”.  Trump has also said he will involve US soldiers if Iran attacks, and will deport those critical of Israel.  In a year, if Trump wins, the Gaza people today will be like the ‘but her emails’ people in 2016.
",HatefulPostsExposed,232,952,0.6600000262260437,0.2977488305835782,1715259860,/r/changemyview/comments/1cnwsjl/cmv_allowing_trump_to_put_fascists_on_the_supreme/,2024,5
1d00efr,CMV: The 24-hour time format is far superior to the 12-hour time format.,"Using the 24-hour time format eliminates the use of the suffixes AM and PM as well as any ambiguity about if a time is in the morning or evening. I can say, “We’re leaving at 1830” and there is no question if it is in the morning or afternoon.

The 24-hour format is also the primarily used format internationally, which helps to avoid confusion, especially when across multiple time zones.

I see no major downsides to the use of it and the standardization worldwide would be extremely beneficial. The learning process that many would undergo is negligible considering the benefits and it would take a few weeks maximum for people to learn how to use it on average. Within a generation, it would become second nature to people who grew up using it rather than the 12-hour format.",KaeFwam,768,319,0.8999999761581421,0.29312116044461795,1716599211,/r/changemyview/comments/1d00efr/cmv_the_24hour_time_format_is_far_superior_to_the/,2024,5
