id,title,selftext,author,score,num_comments,upvote_ratio,popularity,created_utc,permalink,year,month
1cm7v5h,CMV: There is no valid aviation-safety-related reason for airplane mode in modern airliners,"Airplane mode makes little difference to the navigation or communication capabilities of a modern airliner. First, the bands that a mobile phone tranmit on (800MHz upwards) do not overlap with the coms radio of airliners (100-300MHz for VHF and lower for HF). Second, they largely do not tranmit on the same bands as what’s used for navigation either, and either way ground based navaids are going the way of the dodo, and what’s left that’s commonly used is only ILS systems. One could argue that they may interfere with GPS since they both use GPS, but that’s neither here nor there or else GPS would break down in a slightly more crowded area.  

The simplest way to explain my point would be, if having mobile phones off airplane mode is so dangerous, then terrorists wouldn’t need to go to the trouble of bringing a bomb or some such, they merely need to turn on their $200 phone and that would be enough.  

Finally, to clarify, I am narrowing the scope of this to aviation safety related reasons. I don’t care if your phones might impact cell towers which might just happen to make an emergency call be delayed. And I don’t care if it’s because the law tells you to.  

I’d like to see anyone who can change my view by presenting evidence to support the opposite position. 

Note: I had to type the word tranmit in lieu of t-r-a-n-s-m-i-t because there is an overzealous bot preventing posts containing the t-word, even if it is part of another word.",Outrageous-Split-646,392,391,0.8799999952316284,0.2054029435735174,1715074601,/r/changemyview/comments/1cm7v5h/cmv_there_is_no_valid_aviationsafetyrelated/,2024,5
1cmmqqx,CMV: There is still no genocide occurring in Gaza.,"
This has been a claim repeated since the day of the Oct 7th massacre. This claim that Israel is committing genocide against the Palestinian people of Gaza. and have been attempting genocide for decades now.   


This claim has no sensible basis. I think there are are many ways I could tackle this but by far the strongest arguments against this claim is just in a simple review of the numbers.   


Hamas states the current death toll as around 35000 or roughly about 1.75% of the total population.   
The population of Gaza being 2 million.  
Therefore currently a bit over 98% of Gazans remain alive according to that number.

Now here come the important points.

Firstly Israel has the military capability to nuke Gaza, but more importantly they have enough conventional ordinance to do as much damage as nuke on Gaza would do. In fact they have dropped more than twice the explosive equivalent of the two nukes dropped on Japan.

Note that the combined l death toll of the initial explosions in Hiroshima and Nagasaki was between 60,000 & 80,000

Gaza city specifically has a population of 590,481 and was the most densely populated part of Gaza. It was significantly more densely populated than both the cities in Japan. Currently the refugees in Rafah are just as tightly packed together if not more tightly.

This brings us to 2 points 

It is simply true, that 

1. If Israel wanted to, they could quite literally kill virtually the entire population in a night.

They haven't

It is also simply true, that 

2. the amount of bombs Israel has already dropped has had enough explosion power to kill the majority of the population. 

Yet the vast majority lives, therefore the bombs can not have been intended with a goal of genocide. 

The only logical conclusion from these two points is that they Israel has not attempt to kill as many civilians as they can but have in fact attempted the opposite thus there is no genocide.   


P.S if you’re response to this is some version of 

“so your complaint is not enough Palestinians have died yet” 

Please don’t bother commenting, it is better that you don’t waste everyone’s time. 


  




   
",AnimateDuckling,0,821,0.4000000059604645,0.20073349633251833,1715116060,/r/changemyview/comments/1cmmqqx/cmv_there_is_still_no_genocide_occurring_in_gaza/,2024,5
1d1adl1,cmv: The Electoral College should not be winner takes all for each state,"I've seen, over the years, plenty of arguments about the electoral college. Ranging from it being a hallmark of our country, a cornerstone that if changed would lead to everything falling, to being a cancerous stain upon what could otherwise be a democracy.

  
From where I stand, the biggest problem with the Electoral College is that each state is winner takes all. Look at Florida, for example. It is a state which, for the most part, is 50/50. A nail biter of counting, where nobody knows who will get all of the votes. Entire elections hinge upon such counting. And then other states, which are solidly blue or red....they don't matter. Because everyone knows which party is getting all of the votes. 

  
So, where do I stand? If you get 50% of the votes in a state, then you get 50% of the electoral votes. Odd numbers go to whomever get more. Florida, for example, has 125 electoral votes. In 2020 Trump got 51% of vote, meaning he got all 125 electoral votes. I argue that he should have gotten 63. 

  
By splitting it this way, every state becomes in play. Let's say democrats get 40% of the vote in Texas. Usually that would mean absolutely nothing, but now it means 40% of the electoral votes. The same for Republicans in say, California. This makes every state a battleground state, and every vote matters. Candidates can't ignore the vast majority of the country, and nobody would be able to shrug and say that their vote doesn't matter because of the state they live in. 

  
I honestly can't see any downside to this. But when I posted something similar in a different subreddit, I got downvoted with no replies, and that means that there are different points of views. So, I'm posting this here, as  I am willing to have my view changed on this. ",Significant-Bother49,362,400,0.7900000214576721,0.19920007122653463,1716755277,/r/changemyview/comments/1d1adl1/cmv_the_electoral_college_should_not_be_winner/,2024,5
1ctwoqa,CMV: Conservatives aren't generally harder-working than liberals or leftists despite the conventional wisdom.,"In the USA, at least, there's a common assumption that republicans/conservatives don't have time to get worked up about issues of the day because they're too focused on providing for their families and keeping their noses to the grindstone to get into much trouble.

In contrast, liberals and leftists are painted as semi-professionally unemployed lazy young people living off the public dole and finding new things every day to complain about.. 

I think this characterization is wildly inaccurate- that while it might be true that earning more money correlates with voting to protect the institutions that made it possible for you to do so, I don't think earning more money means you worked harder. Seems pretty likely to me that the grunt jobs go to younger people and browner people- two demographics less likely to be conservative- while the middle management and c-suite jobs do less actual work than the people on the ground.

Tl;dr I'd like to know if my rejection of this conventional wisdom is totally off-base and you can prove me wrong by showing convincing evidence that conservatives do, in general, work harder than liberals/leftists on average.",theforestwalker,180,603,0.6100000143051147,0.19785293090341272,1715920074,/r/changemyview/comments/1ctwoqa/cmv_conservatives_arent_generally_harderworking/,2024,5
1cvoqzc,"CMV: Saying someone ""committed suicide"" is fine","Over the last couple years, especially from people I know in mental health, there has been an effort to change language around suicide to use the phrase ""die by suicide"" instead of ""commit suicide"" and while I think ""die by suicide already sounds kind of off because speaking in passive voice sounds like it is removing agency from the individual, I also have problems with the main argument for the switch that I've seen.

The argument is that committing suicide sounds like they're doing something wrong. Since you commit crimes and historically suicide, or attempts to do so were illegal.

But we don't just use ""commit"" as a crime. It's also just means to pledge, or just carry out. You commit resources. You commit to a relationship. You commit energy.

Maybe I could be persuaded to the phrase ""commit to suicide"" since it makes it less about carrying out an action, but following through with a plan, but I strongly oppose ""die by suicide""",Free-Database-9917,326,428,0.8399999737739563,0.1959620033832604,1716126663,/r/changemyview/comments/1cvoqzc/cmv_saying_someone_committed_suicide_is_fine/,2024,5
1cs557z,CMV: Disparity in any system is not automatically evidence of discriminatory practices,"This seems to be a common sentiment for a lot of people and I think it's a projection of their ideology, which is one not of equality, but equity.

For the purposes of this post I use the definition of equity as meaning ""Equal outcomes for all identity groups"". But that is not realistic or rational.

Equity is not natural and for companies/corporations for example, you can't expect the demography of the company to match the demography of the surrounding area, and for larger corporations it's especially unreasonable to expect the corporation as a whole to match the demography of the entire country. I'm talking about America, and in a place like America each state has different demography depending on the state and even the county.

But even so, you can't expect the demography of even a county to match every company in that county. People have different interests and capabilities for any number of reasons and that's normal and okay.

I don't think ironworkers are mostly men because they dedicate energy to discriminating against women. Same with construction workers. Or oil rig workers.

I don't think Kindergarten teachers are mostly women because they dedicate energy to discriminating against men. Same with nurses. Or secretaries.

I think this is just a natural reflection of the biological differences between males and females and our natural tendencies, aptitudes, and personality traits.

This could apply to ethnic groups as well, for any number of reasons. Sometimes those reasons seem arbitrary, and that's okay. But I think usually it's cultural.

In 2006, Joe Biden, remarked that ""you cannot go to a 7-Eleven or a Dunkin' Donuts unless you have a slight Indian accent"". I guess what he meant is that most people who own gas stations and convenience stores are Indian/Pakistani/etc. I seem to recall he made a similar statement during a political debate.

People bristle at comments like these, saying they're racial stereotypes. But they're true? The statistics back that up.

I hope the anti-AI crowd will forgive me, but I had this funny dialogue with ChatGPT just now. In asking about Biden's remarks, it says:

>This remark was widely criticized as being insensitive and perpetuating stereotypes about Indian-Americans. While the comment was specifically about Indian-Americans, it does touch upon a broader stereotype that certain immigrant groups are heavily represented in the ownership of convenience stores and gas stations.

But then I asked it, ""Which demographic group is dominant when it comes to ownership of convenience stores and gas stations?""

And the answer included:

>""...one prominent group is Indian-Americans, particularly those of Gujarati descent. This demographic has a substantial presence in the convenience store and gas station industry.  
>  
>Other demographic groups, including Arab-Americans, Korean-Americans, and Pakistani-Americans, also have a significant presence in the ownership of convenience stores and gas stations.""

So...reality is insensitive? This stereotype is bad? But the stereotypes are literally true according to the data.

Does this mean that the gas station ownership industry is discriminating against white men? I don't see any reason to think so. Why is it a bad thing that certain ethnic groups dominate the ownership of various businesses? Asian-Americans owning laundromats is another one that comes to mind.

My thought is, who cares? Why is this a bad thing? I just see it as another interesting quirk of living in a multicultural society. There are certain things attributed to various ethnic groups for various reasons and that's just part of the delightful tapestry of a diverse society.

The way I see it, it's okay that we have lopsided representation of various groups in various different fields. There are many different kinds of companies/hobbies/whatever, and they have many different kinds of work cultures, required aptitudes and personality types for the employees, and this results in sometimes unequal representation. And that's okay.

I could expand on the title of this CMV to relate to many other, more ""serious"" topics, but that would make this post much longer and much more complicated.

Anyway, a lot of people seem to disagree with the idea that disparity is not automatically evidence of discrimination. Why is that? Change my view.",HelpfulJello5361,375,366,0.7699999809265137,0.19452856937395985,1715725749,/r/changemyview/comments/1cs557z/cmv_disparity_in_any_system_is_not_automatically/,2024,5
1cybgx6,"CMV: If the US is serious about a world built on rule-based order, they should recognise the ICC","So often you'd hear about the US wanting to maintain a rule-based order, and they use that justification to attack their adversaries like China, Russia, Iran, etc. They want China to respect international maritime movement, Russia to respect international boundaries, or Iran to stop developing their WMDs. However, I find this basis of foreign policy inconsistent with the refusal to join the ICC, but instead passed the [Hague Invasion Act](https://en.wikipedia.org/wiki/American_Service-Members%27_Protection_Act), which allows the US to invade the Netherlands should the ICC charge an American official. 

The ICC is set up to prosecute individuals who are guilty of war crimes AND whose countries are unable or unwilling to investigate/prosecute them. Since the US has a strong independent judicial system that are capable of going after officials that are guilty of war crimes, the US shouldn't be worried about getting charged. So in my opinion if the US is serious about maintaining a rule-based order, they should recognise the ICC.",WheatBerryPie,250,506,0.6600000262260437,0.1937443926225747,1716412330,/r/changemyview/comments/1cybgx6/cmv_if_the_us_is_serious_about_a_world_built_on/,2024,5
1cijv9h,CMV: The Antisemitic awareness act should not pass it is unconstitutional and will hurt Jews,"As a pro Israel Jew (if you came here to change my view about that then get the fuck out of my post right now) I don’t think this should be signed into law. As an American, I’m a firm believer in the complete and total freedom for folks to speak their mind without government infringement. I fear this new act by Congress will be counterintuitive. Speech should never be punished or enforced by the government. It was the entire basis for us fighting a revolution against the British. Furthermore, the world hates Jews right now for what’s happening in the Middle East. I fear that this potential law would make life for Jewish Americans even more difficult. The world already thinks that were this privileged, media controlling entity, I got a bad feeling this act will not be a good law for Jews. We have so many hideous stereotypes against us as is, this will add further to it. 

P.S. if you come here to argue about Israel versus Palestine you will be blocked and reported. My post is strictly about the new law. If you come here to talk about Israel being evil or some other antisemitic dogshit you will not be entertained. Please stick to the talking points about this potential act becoming a law. ",ManVersusMan90,55,723,0.5400000214576721,0.1921787786019053,1714666923,/r/changemyview/comments/1cijv9h/cmv_the_antisemitic_awareness_act_should_not_pass/,2024,5
