id,title,selftext,author,score,num_comments,upvote_ratio,popularity,created_utc,permalink,year,month
1chzwpu,"CMV: Saying that you'd ""rather meet a wild bear in the woods than a random man"" is the same kind of logic that racists and other bigots use.","To say that you would rather meet a bear than a random man in the woods requires that you believe all men are a threat, or at least more so a threat than a wild bear. This is the same kind of logic that racists use to justify their racism, and why they typically believe that the races should be separate because one race poses a danger to the other. Both points of view require a demonization of an entire group of people with a blanket assumption that that group is inherently dangerous. The first is sexist, and the second is racist.

Some counterarguments I've seen so far that I'd like to address:  
**1) Women may have had bad experiences with men, so they will have a (justified) aversion.**  
 \- If someone from Race Y has had bad experiences with Race X, they are not justified in painting all people of Race X as an inherent danger because they have not encountered 99% of the people from Race X. They are basing this fear off of a very small population compared to the overall population most of the time. Even if they've had 100s of bad experiences with men or Race X, to preemptively fear all of them is either sexist or racist. It is more rational and appropriate to assume a man or a person from another race is their own individual person, rather than treating  them as a monolith with a sexist or racist view.

**2) It's not about men in particular, but strangers**  
 \- If that were true, then the meme/saying wouldn't specify men. It would include meeting a random woman.

**3) It's not about all men, it's about random men**  
\- ""I can't be racist, I have a friend from race X."" Again, to fear *all* strangers from a group requires that you believe that group of people has inherently negative qualities, which is racist, sexist, etc, and that encountering them puts you at an increased danger than being with people from another group, or a bear.

**4) Men have power over women in society, so women are justified in feeling this way**  
\- Neo nazis and fascists will often say that Jewish people have all the power in society. This doesn't make it right for them to demonize them. Further, even if it is true that men have power over women, that tells you nothing about the random man front of you. In order to fear every man, you have to believe every man is dangerous or likely dangerous, which is sexist (or racist if we switch 'man' to 'person of race X'

I think the danger of this kind of thinking can easily be seen if you just switch out the subject. ""I'd rather meet a wild bear in the woods instead of a random person from a different race.""

A woman can absolutely feel this way, of course, but I don't think we should act like it's anything other than sexism, just like it'd be racist if this were about race.",Caseated_Omentum,20,1137,0.5099999904632568,0.2835973509208084,1714604004,/r/changemyview/comments/1chzwpu/cmv_saying_that_youd_rather_meet_a_wild_bear_in/,2024,5
1d1y22j,"CMV: If Israel wishes to establish international credibility, it should get third parties to investigate the major incidents that took place in Gaza.","Yesterday it was reported that an airstrike in Rafah has resulted in at least 45 deaths, many of which women and children. There are even pictures of charred and decapitated babies coming out. All the videos we saw are horrific. Bibi has already called it a [""tragic mistake""](https://wsvn.com/news/us-world/netanyahu-acknowledges-tragic-mistake-after-rafah-strike-kills-dozens-of-palestinians/) and the IDF will investigate the incident.

This is not the first time the IDF has had a high-profile incident that warrants investigation. Others include the killing of 7 WCK aid workers, the killing of the 3 Israeli hostages, and the Flour Massacre that killed more than 100 Palestinians. In the case of the 7 WCK aid workers, the investigation was reportedly [""hurried completed""](https://www.theguardian.com/world/2024/apr/05/israeli-inquiry-blames-wck-aid-killings-on-grave-errors-by-military-personnel) and was unlikely to be [transparent and honest](https://www.politico.com/news/2024/04/02/israeli-strike-on-jose-andres-aid-group-prompts-new-level-of-us-backlash-00150245). The killing of the 3 Israeli hostages did not result in anyone reprimanded or dismissed despite a clear violation of rule of engagement that heavily tanked IDF's reputation. On the Flour Massacre, Israel's version of event has been [doubted](https://edition.cnn.com/2024/04/09/middleeast/gaza-food-aid-convoy-deaths-eyewitness-intl-investigation-cmd/index.html) by CNN too.

Suffice to say, it's unlikely that the IDF will investigate yesterday's incident or any other incident in a transparent, honest manner with proper accountability to those responsible. Without doing so, Israel's international credibility is rightfully tarnished and gives other institutions like the ICC ground to investigate Israeli officials. (Note that the ICC only investigate individuals when their home country's justice system is incapable of punishing war criminals.) It should get third parties that involve an international team of experts to investigate these incidents to clear its name or to hold those responsible accountable. It's what a democratic nation _should_ do.",WheatBerryPie,352,614,0.699999988079071,0.24872168916466342,1716833779,/r/changemyview/comments/1d1y22j/cmv_if_israel_wishes_to_establish_international/,2024,5
1cspqkr,CMV:Misandry is deemed acceptable in western society and feminism pushes men towards the toxic manosphere ,"Basically what the title states.

Open and blatant misandry is perfectly acceptable in today's western society. You see women espouse online how they ""hate all men"" and ""want to kill all men"".

If you ask them to replace the word men or man in their sentence with women or woman and ask if they find that statement misogynistic, they say ""it's not the same!"" I have personally watched a woman in person say these things at a party about how she hates all men and wishes they would all just die so society could be better off. Not one of her friends, who are all big time feminist, corrected her or told her she is being sexist, in fact some of them laughed and agreed.

This post is not an incel ""fuck feminism"" take post. I love women and think that they deserve great and equal treatment, however when people who vehemently rep your movement say these things and no one corrects them, it sends a message to young men about your movement and pushes them towards the toxic manosphere influencers.
 
I know there will be comments saying ""but those aren't true feminist"" but they are! These women believe very strongly that they are feminist. They go to rallies, marches, post constantly online about how die hard of a feminist they are, and no one in the movement denounces them or throws them out for corrupting the message. This shows men that the feminist movement is cosigning these misandrist takes and doesn't care for equality of the sexes, thus pushing young men towards the toxic manosphere.",storm1499,0,989,0.5,0.24180929095354523,1715792247,/r/changemyview/comments/1cspqkr/cmvmisandry_is_deemed_acceptable_in_western/,2024,5
1cvgvr9,cmv: Feeding & Housing the poor will do more to reduce crime than Cops or Prison ever will.,"Improved housing will cut crime. Living on the street before or after a prison sentence is a major cause of offending.

A recently released study by Elior Cohen at UCLA finds that targeted housing assistance to people experiencing homelessness reduces crime, increases employment, and improves health.

Because housing problems are often a key underlying factor for people’s involvement with the criminal justice system, there are ways housing interventions can help lessen criminal justice involvement. Decriminalizing homelessness, for example, can reduce rates of initial arrest and break the homelessness-jail cycle.",AliceInCookies,576,307,0.8299999833106995,0.23640566250950257,1716096295,/r/changemyview/comments/1cvgvr9/cmv_feeding_housing_the_poor_will_do_more_to/,2024,5
1cmax98,CMV: The bear-vs-man hypothesis does raise serious social issues but the argument itself is deeply flawed,"So in a TikTok video that has since gone viral women were asked whether they'd rather be stuck in the woods with a man or a bear. Most women answered that they'd rather be stuck with a bear. Since then the debate has intensified online with many claiming that bears are definitely the safer option for reasons such as that they're more predictable and that bear attacks are very rare compared to murder and rape commited by men. 

First of all I totally acknowledge that there are significant levels of physical and sexual violence perpetrated by men against women. I would argue the fact that men women answered they'd rather be stuck in the woods with a men does show that male violence prepetrated against women is a significant social issue. Many women throughout their lifetime will be the victim of physical or sexual violence commited by a man. So for that reason the hypothetical bear-vs-man scenario does point to very serious and wide-spread social issues. 

On the other hand though there seem to be many people who take the argument at face-value and genuinely believe that women would be safer in the woods with a random bear than with a random man. That argument is deeply flawed and can be easily disproven. 

For example in the US annually around 3 women get killed per 100,000 male population. With 600,000 bears in North-America and around 1 annual fatality bears have a fatality rate of around 0.17 per 100,000 bear population. So bears are roughly 20 times more deadly to women than American men. 

However, I would assume that the average American woman does not spend more than 15 seconds per year in close proximity to a bear. Most women, however, spend more than 1000 hours each year around men. Let's assume for just a moment that men only ever kill women when they are alone with her. And let's say the average woman only spent 40 hours each year alone with a man, which is around 15 minutes per day. That would still make a bear 480 times more likely to kill a woman during an interaction. 

40 hours (144,000 seconds) / 15 seconds (average time I guess a woman spends each year around a bear) = 9600 

9600 / 20 (men have a homicide rate around per 100k population around 20 times that of a bear) = 480    

And this is based on some unrealistic and very very conservative numbers and assumptions. So in reality a bear in the woods is probably more like 10,000+ times more likely to kill a woman than a man would be. 

So in summary, the bear-vs-man sceario does raise very real social issues but the argument cannot be taken on face value, as a random bear in reality is far more dangerous than a random man. ",RandomGuy92x,82,850,0.5699999928474426,0.23079314855526564,1715085566,/r/changemyview/comments/1cmax98/cmv_the_bearvsman_hypothesis_does_raise_serious/,2024,5
1d1ruf3,"CMV: Hindus have a full right to use the Swastika, as it originated as a religious symbol of theirs. ","CMV: Hindus have a full right to use the Swastika, as it originated as a religious symbol of theirs.

The Nazi Germans took inspiration from the Hindu Swastika to create their own symbol of tyranny. It was originally a symbol of the Hindus to symbolize peace and prosperity. I have seen that if Hindus use it as a doorstep symbol, they are viciously insulted by their neighbors. They should be allowed to use it, since it was not in their control whether the Nazis used it to represent their own faction. They should not be asked to stop a centuries-old tradition simply because a tyrannical and mad leader decided to use it as his party's symbol on a whim.",Fun_Protection_6939,555,305,0.8199999928474426,0.23003431201331387,1716817443,/r/changemyview/comments/1d1ruf3/cmv_hindus_have_a_full_right_to_use_the_swastika/,2024,5
1cqsfep,"CMV: If the majority of Muslims hate me, then I simply don't care about them","I live in the UK. I'm a bisexual woman who has sex outside marriage, drinks, and smokes. 

According to the majority of Muslims here, I should be punished. 23% believe I should be executed:

[https://www.theguardian.com/uk-news/2016/apr/11/british-muslims-strong-sense-of-belonging-poll-homosexuality-sharia-law](https://www.theguardian.com/uk-news/2016/apr/11/british-muslims-strong-sense-of-belonging-poll-homosexuality-sharia-law) 

It's not just in numbers. I've faced discrimination by Muslims irl. I've seen Muslims I know, neighbors and classmates, say online gay people are ""sick"" and that Western women are trash. 

I'm from a Catholic third world country. An immigrant. In my country, where over 90% of the population is Catholic, I never faced discrimination. Just some stares. We recently legalized gay marriage. I consider myself Christian and I've never been treated differently by other Christian. So even though the Bible does have homophobic messages, most Christian don't hold those views.

However, most Muslims do hold those views. My friends in Belgium and France say it's worst there.  In these first world, Western countries Muslims already hold regressive views. In the Middle East, it's even worse. The regions with more support for sharia law are Palestine and Iraq, with over 90% of people there believing I should be executed. [https://www.pewresearch.org/religion/2013/04/30/the-worlds-muslims-religion-politics-society-beliefs-about-sharia/#:\~:text=Support%20for%20sharia%20as%20the,the%20Palestinian%20territories%20(89%25)](https://www.pewresearch.org/religion/2013/04/30/the-worlds-muslims-religion-politics-society-beliefs-about-sharia/#:~:text=Support%20for%20sharia%20as%20the,the%20Palestinian%20territories%20(89%25)).

Why should I care about Muslims then? This doesn't mean I want anything bad to happen to them. I don't support what's being done to innocent Palestinian children, but I also know their parents and relatives would almost 100% want me dead. What it's being done to them, they want to happen to me.

People around me say I should combat islamophobia. They want to me to advocate for Muslim women to be allowed to wear a veil in public spaces, they want me to believe Islam is the religion of peace. My classmates invited us to a mosque, to ""connect"" with that group, why should I go to a place where they want me dead? Why should I care if a mosque is not allowed to be, if Muslim men are not allowed to pray at work, when they want me dead? Why should I denounce islamophobia when Muslims would hand me over to executioners without a care in the world? As long as their physical wellbeing is intact, then I simply do not care

Again, I don't wish them harm. I denounce war and invasions because no human being deserves to be killed and tortured, but I KNOW in their deathbeds, they still want my death",FelixSecretAccount,326,554,0.7799999713897705,0.22676884934903058,1715580938,/r/changemyview/comments/1cqsfep/cmv_if_the_majority_of_muslims_hate_me_then_i/,2024,5
1cr8qdc,"CMV: For people with an anticapitalist worldview, it is a moral imperative to start a business","The general anticapitalist worldview is that business owners are capitalists exploiting their workers by taking a cut out of the value generated by their labor. Given we're not close to ending capitalism anytime soon politically, the only thing these people can do to end the exploitation is become the business owners and pass on more or all of the value of their employee's labor to their employees. Because they're not greedy, they could get the best workers because they pay more and thus they'd be able to easily wreck their competitors because they don't have that greed factor. The more people who did this, the better for workers and the working class, as more people would be able to work for a company that wasn't focused on greedily taking as much of their value for themselves as they could, and instead focused on fairly redistributing all the company's gains to the workers who created the value.",BoysenberryLanky6112,278,552,0.6700000166893005,0.21283447364275784,1715630184,/r/changemyview/comments/1cr8qdc/cmv_for_people_with_an_anticapitalist_worldview/,2024,5
1d3jdol,CMV: There is much subtext to the Israel - Hamas war.  But not everybody gets this.   Bad actors ON BOTH SIDES constantly shift between the specific and the general to muddy the waters and make progress difficult,"

I don't think anybody has covered themselves with glory, post 10/7. When Chuck Shumer publicly calls out Benjamin Netanyahu, on the floor of the United States Senate, then it is clear that Israel, under Netanyahus leadership, has gone off the rails. What happened after that? Chuck Shumer was called an 'anti-semite,' and Israel kept barreling down that path.

This is a lot of anger at Benjamin Netanyahu and his government, all of which he has earned, and which he hides behind the Israeli people to avoid, calling any and all criticism of his specific actions just general anti-semitism.

I also think people conflate the Palestinian people with Hamas.  Hamas, ostensibly, is the governing party in the Gaza strip, but Hamas, as an organization, derives from the Muslim brotherhood, is largely funded and fueled by non-Palestinian Arabs who are hiding among and behind the Palestians in Gaza, more than half of whom are under the age of 15.    The October 7 attack was not a legitimate piece of governance, but a specific attack on Israelis and and a continuation of the oppression of the Palestinians.

With specific regard to American protestors I think the fact that this is happening now, when the Shoah fades from living memory, and much history lies between us and World War II, is of interest. I would venture to guess that the majority of people protesting, and most of the younger ones, grew up in a relatively peaceful world with a strong Israeli nation, and don't have the historical context to understand the Jewish state: they may regard it as just another country, acting badly, and protest accordingly. This may, fairly, be regarded as a form of naivete. That is, at least, how I regard it. But there are two, small but vocal groups who have a propensity to hijack the narrative. The first is the amoral pugilist: they just love to fight and will employ whatever dirty tactics necessary to prevail. They will employ anti-semitic tropes to put people off balance and 'stir the pot.' The second is the true anti-semite, who see, in Israels present behavior, an excuse to let their hate flag fly. Both of these groups, I venture to say, take advantage of the naivete of the majority to push their anger and hate and derail any manner of constructive dialogue: call it the Yigal Amir veto, if you will. 

So it is valid criticisms of specific actions, by belligerents, (Netenyahu, et all, and Hamas)  that are then attacked as support for generalities: Pro-Palestianian is equated to Pro-Hamas, and criticisism of specific Israel action is termed generic anti-semitism.  All of this muddies the water and makes resolution of this so much more difficult, which is what the haters, on both sides, want. ",TreebeardsMustache,291,537,0.6399999856948853,0.21280844856279918,1717007749,/r/changemyview/comments/1d3jdol/cmv_there_is_much_subtext_to_the_israel_hamas_war/,2024,5
1cx5qxg,CMV: Influencers shouldn't be cancelled for not talking about political topics.,"While it is always a good thesis to listen to your viewers, at the end of the day, their platform is their platform. Recently I've seen certain large scale YouTubers be spammed all across social media because they have not addressed certain topics they want to hear them address or support, and are threatening to cancel them for it.

This is idiotic. It is essentially targeted harassment and initiating a boycott on them for not expressing their own political views, when they're not a political influencer, is virtue signalling stupidity.

If they want to talk about it, they will. It is not a cancellable offence to not use your platform to talk politics if your platform isn't focused on politics. Every issue is deeper than the vast majority of people assume and if the influencer gets information wrong or puts up a dodgy site for donations etc, that will do more harm than good and backfire on them, not to mention divide their following, and it will be a toxic cesspit.",MattStormTornado,303,520,0.699999988079071,0.21201331388301042,1716291515,/r/changemyview/comments/1cx5qxg/cmv_influencers_shouldnt_be_cancelled_for_not/,2024,5
1cpdcgp,"CMV: Biden's attempt to appease both sides of the Gaza issue is hurting his electoral chances, he should commit to one side and accept the consequences.","Recently, there have been multiple reports on the divide between Netanyahu and Biden, but they have been conflicting, or at least mixed messages. Here's a report by [BBC](https://www.bbc.com/news/world-us-canada-68984999) saying that it is ""reasonable to assess"" that arms supplied by the US have been used in ways ""inconsistent"" with Israel's obligations, but in the same [report](https://www.nbcnews.com/politics/politics-news/biden-administration-says-israel-isnt-violating-us-weapons-terms-rcna151764) it says that it hasn’t verified specific instances that would justify withholding military aid, and the headline used for each outlet is different depending on what the journalist prefer to highlight. Biden has also withheld military supplies and threatened to withhold more, as reported [here](https://www.bbc.co.uk/news/world-middle-east-68980820), but not enough to actually stop the Rafah invasion from happening. 

To me, this is an attempt by him to appease both the pro-Israel and the pro-Palestine camps within the Democratic party, but I think he's failing at both. Pro-Israel folks will see this as a severe stepback from the unconditional support US has historically provided to Israel, while the Pro-Palestine folks will still see him as complicit in the genocide in Gaza as long as the Rafah invasion goes ahead, and the campus protests are unlikely to die out anytime soon. I think the most disastrous outcome for Biden is neither side doesn't feel like they can vote for him anymore in the election, handing Trump a victory. He should commit to one side, either back Israel unconditionally or withhold significantly more arms sales and aid so that America is no longer complicit in what's happening in Gaza. The latter is not at all an [unpopular position](https://www.dataforprogress.org/blog/2024/5/8/support-for-a-permanent-ceasefire-in-gaza-increases-across-party-lines) anyway, with a recent poll showing that a majority of Democrats believe that Israel is committing genocide and disapprove of Congress' recent military aid to Israel.",WheatBerryPie,328,488,0.7200000286102295,0.211192154123263,1715418635,/r/changemyview/comments/1cpdcgp/cmv_bidens_attempt_to_appease_both_sides_of_the/,2024,5
1csag26,CMV: There is nothing wrong with female students helping a male teacher unbraid his hair,"If you haven’t seen the news recently JaQ Lee is a teacher that went viral for making a video with his female students helping him unbraid his hair. He only asked his students to help him unbraid his hair because he had a hair appointment after school that day and he wouldn’t be able to unbraid his hair in time if he waited until after school.

Prior to making this video he had already posted many videos of his students. It is very obvious that he loves his job and he loved his students. However recently he was fired for that video. Many people think it is inappropriate for him to have his female students unbraiding his hair even though it is obvious he had no ill intentions against his students. However I have to disagree.

It is a teachers job to build strong bonds with their students. A strong bond between a teacher and their student is the main way for a student to trust their teacher. A student who trusts their teacher is more likely to listen to that teacher when they teacher and is more likely to go to that teacher if they have any issues. It is obvious that this was just another way for him to bond with his students. 

Also it is just hair. People are acting as if the students were putting lotion on his back or cutting his toenails. The students were just helping him unbraid his hair what exactly is the harm behind that.

In the black community many of us don’t have strong male figures in our lives. When a male role model does enter our life we look up to them and admire them. Majority of his students are black. It is very possible that many of his students may not have a male role model in their life and because of the strong bond they have with their teacher they look up to him and admire him. Helping him unbraid his hair is a way for his students to bond with him and show their appreciation for him.

It is very possible that now since this teacher has been fired that the students in that classes grades will drop. They had a lot of trust and respect in Mr.Lee and it will be hard for a new teacher to gain these students trust and respect. The students may not listen in class anymore leading to their grades dropping. A lot of negative things could happen as a result to this school firing an amazing teacher.

I just want to see the other side of the argument why exactly do people find this situation so unacceptable and disgusting when it is very much harmless?",No-Kaleidoscope-4050,293,516,0.6700000166893005,0.20823419832480672,1715740942,/r/changemyview/comments/1csag26/cmv_there_is_nothing_wrong_with_female_students/,2024,5
