id,title,selftext,author,score,num_comments,upvote_ratio,popularity,created_utc,permalink,year,month
1hjhtug,CMV: The 2020s has been and will be viewed as a terrible decade ,"My overall feelings on the 2020s decade will be no more or less different from the majority of people when I say that of all the decades that has transpired throughout modern time, this decade has, by far, been a consistent disaster, one after another, with a general pessimistic vibe that even in future retrospects, it will be objectively viewed as an unlikable era that will never be looked back at fondly. I will admit that despite the past decades' major downsides, they are viewed much more favorably based on various statements, regardless of the age group – from the amount of analysis I had conducted in my research, it is immensely rare to hear about how decades such as the 1980s and the 1990s are viewed negatively in the same vein as the 2020s; the disdain for the latter couldn't be more overstated as I had underwent personal struggles with anxiety and depression from recent current events. Even when I struggled from my mental disability in my childhood, I still viewed the past rather fondly. Granted, there is a theoretical chance that I could be just viewing the past with 'rose-tinted glasses', I find it to be practically impossible to imagine the 2020s to be viewed so fondly in retrospects given the overly negative reception with many past events in comparison.

So far, the 2020s decade has given people the pandemic and its after-effects within society, political unrest along with radical polarization, increased social isolation leading to depression and increased risks of suicide, the gradual erosion of democracy with cases such as Afghanistan and Myanmar, inflation along with massive corporate consolidation over housing, multiple genocides and wars, the countless mass shootings happening within the United States, skyrocketing cost of living, the increasing gap of wealth gap inequality, erosion of certain rights such as abortion, greenhouse gas emissions have increased global average temperatures, and that’s only to list a few. I understand that horrible events in the past have happened as well - it's just that so much bad has happened from this decade alone that it seems to make the events of the past pale in comparison.  I just find that the world, let alone this decade, is seemingly bleak and will not be looked back at admirably with the exception of the young adolescents and individuals that have been raised in a high class privileged lifestyle.

Ideally, there is testimony from research groups backed up by data that society as a whole is supposedly better off than before from the decrease of extreme poverty, fewer people dying in conflicts in recent decades than in most of the 20th century, the ever-advancing medical treatments against fatal illnesses, increased life expectancy along with decreased child mortality rate; those aspects are taken for granted admittedly. However, the general vibe that I have felt recently is anything but positive – I noticed that people are generally depressed overall due to various factors that have been listed. I read that the same group of adults aged 18-35 in general will note that their time in certain past decades that they lived in at that time positively whereas another group of adults within the same age bracket will persistently state that the 2020s is a terrible time to be living in. Even from reading about older generations that have lived through certain rough times with the Great Depression, the World Wars, the looming threat of the Cold War, segregation, apartheid, communism with Eastern Europe, the Vietnam War, the AIDS epidemic that those periods of time, they would state that this time of era is even worse than they they lived through which really puts the 2020s in such a negative light.

To put it in layman's terms, I am filled with confidence that the 2020s is generally despised now and that it will never be - this decade's overall vibe and reception will be no different than the 1930s. Change my view.",Cyberdork087,499,182,0.8600000143051147,0.16682202145185718,1734811219,/r/changemyview/comments/1hjhtug/cmv_the_2020s_has_been_and_will_be_viewed_as_a/,2024,12
1hp76ya,"CMV: Eating meat is a natural part of the food chain, and humans are fulfilling their role in nature by doing so.","The food chain is one of the most fundamental principles of nature, and every living creature plays a role in it. Lions eat meat, tigers eat meat, eagles eat meat, and humans eat meat too. This process is not a deviation from nature but an essential part of it. Just as lions hunt gazelles or eagles catch fish, humans consume both plants and animals to sustain themselves.

I believe humans were created by God with the ability to eat meat, and this is reflected in how we are designed. Our bodies, with teeth suited for both grinding plants and tearing meat, and digestive systems capable of processing a wide variety of foods, clearly show that eating both plants and animals is natural for us. From the earliest days of humanity, people hunted and ate meat as part of their survival. Over time, this relationship with meat became a cornerstone of human life, providing essential nutrients and energy.

Some might argue that humans have the choice not to eat meat, but I don’t think avoiding meat is a more ethical decision. Eating meat is neither unethical nor unnatural—it is simply a part of how God created us to live. Just as lions and eagles follow their instincts to eat meat, humans are also fulfilling their natural role by doing the same. Saying that humans should stop eating meat because we can is, in my opinion, like suggesting lions should stop hunting because they might adapt to eating plants.

This analogy also helps illustrate the deeper point: all creatures are part of a cycle. Sheep eat grass, humans eat sheep, and the energy continues to flow through the natural world. This interconnected system is how the world was created to function, and humans are not exempt from it. Participating in this cycle is not only natural but essential for balance.

I see no conflict between eating meat and being part of the natural world. We are creatures like any other, placed on Earth to live according to the system God created. It is no more unnatural for humans to eat meat than it is for a bird of prey to catch a rabbit. This is not a question of morality but of nature and design.

I understand that some may have personal reasons for choosing not to eat meat, but I do not believe this makes them morally superior. Just as a lion is not “wrong” for eating a gazelle, humans are not “wrong” for eating animals. It’s simply the way life works.

I’m curious to hear other perspectives and see if anyone can offer arguments that might change my view. Can someone help me see this differently?",ZookeepergameFit2918,144,581,0.6000000238418579,0.16347907702358316,1735509905,/r/changemyview/comments/1hp76ya/cmv_eating_meat_is_a_natural_part_of_the_food/,2024,12
1hp5w8v,CMV: The post-truth era will usher in a new dark age if we don't stand up for evidence and compassion.,"I don't think people understand enough that while it's true that presidents were always called stupid liars, no president has ever openly spewed and embraced easily disprovable lies and ""alternative facts"" anywhere near as much as Trump does on a daily basis. By a lot. Trump is a narcissistic, psychopathic manchild except this time it's not hyperbole. We live in post-truth, post-parody times in the USA. Trump destroyed respect for science and experts, and destroyed the responsibility that should come with the leadership role. The EU is still holding strong against misinformation but they too might fall if we let the likes of Elon Musk have their way.",G14DMFURL0L1Y401TR4P,337,343,0.7900000214576721,0.1606961436065243,1735506526,/r/changemyview/comments/1hp5w8v/cmv_the_posttruth_era_will_usher_in_a_new_dark/,2024,12
1hpuw7y,"CMV: ""YYYY-MM-DD"" is a superior date format to ""DD-MM-YYYY""","You may have seen [this meme](https://imgur.com/5dYgqoE.png) before, explaining why the ""DD-MM-YYYY"" date format (commonly used in America) is superior to the ""MM-DD-YYYY"" format (commonly used in the US).  However, I think that it misses the mark a lot, and both of those formats are inferior to one that puts the year first, then the month, then the date (e.g. ""2024-12-30"")

I think this format is better than the other two for a few reasons:

* It matches how people normally express numbers.  Typically we express numbers in a way that is [Big Endian](https://en.wikipedia.org/wiki/Endianness); we say the largest magnitude part of the number first, then descending down to the smallest part.  For example, if you want to write the number five million and one, you would write it as 5,000,001.  You start with the ""5"" (which has the biggest magnitude, since it counts millions) and end with the ""1"" (since it has the smallest magnitude and counts ones).  The DD-MM-YYYY date format flips this (kind of, see below) and starts with the smallest magnitude and goes to the largest.

* When I said it flips it, that's only kind of true.  The numbers are still big-endian for each individual part of the date.  For example, writing the current year as ""2024"" is big-endian.  It starts with the 2 (which represents thousands of years, the largest magnitude piece of information), followed by the ""0"" for hundreds, the next ""2"" for tens, and then the ""4"" for ones.  It's big-endian, descending magnitude.  And the month and date parts are also big-endian.  So when you write with DD-MM-YYYY, you don't really end up with a big-endian or small-endian date format.  It's a small-endian collection of individual date parts which are themselves big-endian, resulting in a mixed-endian result where the magnitudes go up and down (much like the pyramid on the right side of the meme posted at the top).

* If you add in time-of-day, it becomes even more clear that you're going up and down in terms of magnitude.  We write time of day in HH:MM:SS format.  As far as I know, there's no country where SS:MM:HH is preferred.  This is big-endian, starting with the largest magnitude and then moving down from there.  If you list the date in ""DD-MM-YYYY"" format, and include the time, then you're always going to have a format where it goes up and down.  Either ""HH:MM:SS DD-MM-YYYY"" or ""DD-MM-YY HH:MM:SS""  Both of these are ""out of order pyramids"" in the illustration above.

* ""YYYY-MM-DD"" also has the nice advantage in the fact that, if you sort filenames or other pieces of data in a simple alphanumeric way, then you are also putting them in chronological order.  The other two date formats don't have this.

Ultimately, the only advantage that I can think of that DD-MM-YYYY has over YYYY-MM-DD is ""but it's what some people are already used to, so why change?"", which is incidentally the exact same reason people choose MM-DD-YYYY over DD-MM-YYYY.   

So change my view.",kabukistar,356,292,0.7699999809265137,0.15440516424210177,1735586042,/r/changemyview/comments/1hpuw7y/cmv_yyyymmdd_is_a_superior_date_format_to_ddmmyyyy/,2024,12
1hnsooe,CMV: Parents and teachers should never use physical punishments,[removed],Square-Dragonfruit76,99,591,0.6299999952316284,0.15419948221495305,1735343801,/r/changemyview/comments/1hnsooe/cmv_parents_and_teachers_should_never_use/,2024,12
1hol8ku,CMV: declining birthrate fear mongering is bullsh$$,"Only people crying about declining birthrates are mega rich and love to use statistics to back their claims yet when you use statistics they themselves Blatantly refuse to abide by their own logic. Almost like even rich people realize how hard it is to raise kids yet statistically refuse to have more than 2 kids while expecting poor people to have 4+.

If people think declining birthrate is scary, I'll take it anyway over a world with 15 billion people, logic that pro natalist preach as if Earth's resources are infinite is so ass backwards. ",Able_Ad_5318,203,442,0.6600000262260437,0.1481709975889619,1735437125,/r/changemyview/comments/1hol8ku/cmv_declining_birthrate_fear_mongering_is_bullsh/,2024,12
1hh9ivl,CMV: It is wrong to force a child to live on a vegan diet.,"They may be become malnourished because humans are omnivores, meaning we need to eat both plants and animals. I even think you could make a case that it's neglect to the same degree as conventional forms of neglect. Being vegan is not an excuse for failing to meet the needs of a child, and it should be the child's choice to be vegetarian or vegan once they grow up, not forced on them from birth. Furthermore, many medicines are made from animal products, so is it okay to deny medical treatment to your child because you want them to be on a strictly vegan diet?

Go ahead and change my view.",Confident_Worth8061,37,614,0.5400000214576721,0.14342696942764582,1734550121,/r/changemyview/comments/1hh9ivl/cmv_it_is_wrong_to_force_a_child_to_live_on_a/,2024,12
1hm1w21,CMV: People telling you to see obese people as people is not promoting obesity,"I am sick and fucking tired of the thinkpieces I see in here! The body positivity movement was created to tell overweight people that they should not hate themselves. If they wanted to promote obesity, they would only spread excessive mukbang content, but that clearly isn't the case. To say fat people are human and deserve to be treated with basic fucking respect is not a radical thought. Some of the most unhealthy eaters I know with high cholesterol, high blood pressure, pre diabetes, GERD, and perspiration issues are skinnier than me or socially acceptable. I know a woman whose who diet is Cheetos and mac and cheese. Girl is so backed up and constipated, she literally poops once a week and it is one giant hard log. Yet when we are next to each other, people unsolicitedly compare our bodies. 

Most fat people you'll meet are on a weight loss journey and I wish people were kinder. No wonder there was a body positivity movement. People are so freaking mean to fat people for existing! How do folks have an issue with other people's weight, idk. 

Unless you are a doctor or trainer, you shouldn't have anything to say about anyone's weight. Also, fat people deserve to smile and not have to deal with people being assholes. And if other people are being assholes, fat people have a right to ignore them and smile anyway.


Lil Segway below:


Sadly, I reached this conclusion when I became overweight. I was on meds and had deep depression so I ballooned from a solid 160 to 200 in the span of 4 to 5 years. To see the treatment I am receiving is jarring. I went from eating what I want to people micromanaging my food intake. I'll never forget when I got over a weight plateau and celebrated (lost 10 lbs) only for someone to come in and call me fat within hours and how I need to lose weight. Then for me to finally fit in a dress that I couldn't wear for over a year and still be told, ""You need to stop eating so much, you need to start exercising."" The ironic thing is that I was, which is why I could fit in more clothes lmfao. 

I've actively been eating less and spacing out my meals. My one dinner has become dinner for night one and night two. My breakfast has been spread out where half is breakfast and the other half is lunch. I do struggle with eating late because tbh I never finish my meals throughout the day, yet because I have a belly, I'm dragged for it. Plus it made me realize that people don't know what weight looks like. I've weighed myself before family dinners and I am the same exact weight as when I saw them months ago. Yet I walk in the door and people are yelling at me that I got fatter and need to stop eating. I'm glad the body positivity movement exists because I'm not going to let people make me feel like shit for being overweight right now, but I'm just tired. ",PeaSame4326,206,412,0.699999988079071,0.14238777488291132,1735137733,/r/changemyview/comments/1hm1w21/cmv_people_telling_you_to_see_obese_people_as/,2024,12
1hfv9u7,CMV: Ukraine is probably headed for a defeat in the Russo-Ukrainian war,"I've been following the war in Ukraine since the Russian military buildup in 2021, and at this point I think Ukraines odds of winning are slim to none.
Ukraine's strategy in the past year or so has hinged on defending fortified cities like Vuhledar and attriting the Russian forces to create a bloody stalemate, after which Ukraine could build up their forces to match or potentially outmatch Russian forces. However, they've been consistently driven out of their fortified cities, with Avdivka and Torersk being some of the most notable instances of this. Ukrainian defense near Pokrovsk are currently struggling under the Russian offensive, and if Pokrovsk falls, Ukraine has no fortified position behind that for quite a distance, forcing them to either give up large chunks of land or defend open and unfortified ground.

The AFU is not in great shape either. Their premier units, like the 47th Mechanized, have been whittled down to a shell of their former selves as attrition takes a major toll on them. Their rank and file is not doing much better, as many of their units around Pokrovsk are at less than 40% strength according to Pravda UA: https://www.pravda.com.ua/eng/articles/2024/09/17/7475408/#

The Russian military, meanwhile, has a formidable artillery advantage and has begun catching up to Ukraine in the quantity and quality of FPV drones they’ve been using. Incentivized by large cash bonuses and salaries, Russian volunteers are currently signing up in huge numbers, ensuring that addition does not decimate the Russian army. While the Russian economy is struggling, there is no indication that anybody in the Kremlin is considering ending the war due to the economy. Countries rarely end wars due to economic pressure in the first place. For example, both World Wars bankrupted the British Empire entirely, but they never surrendered until all of their objectives had been achieved. In fact, among Russia’s political elite, the main complaint has been that Putin has not mobilized the economy and populace more. If you remember the Wagner revolt, Prigozhins complaint was that Putin was not producing enough ammunition to fuel the war effort. 

So based on what I’ve said above, I think Ukraine cannot reclaim their occupied territories, and I think their situation is likely to worsen. I also believe Russia is not going to simply give up and go home, as the Russian political elite are in lockstep around supporting the war. If you  ",jadacuddle,73,552,0.6000000238418579,0.1390653986573522,1734387517,/r/changemyview/comments/1hfv9u7/cmv_ukraine_is_probably_headed_for_a_defeat_in/,2024,12
1hcv5d3,CMV: Apple removing the headphone jack was an anti-consumer decision.,"I’ve heard the argument of how they “needed to” so they can improve phones at a larger rate but to me while it does serve some benefit, it’s timing makes it hard to believe it has nothing to do with selling more airpods. I don’t believe that the room for improvement increases at a rate that justifies removing this feature and the precedence it set has made phones far more inconvenient. I’ve also heard the argument that wired headphones were being phased out which I geniunely find largely untrue. Bluetooth headphones, while you can still find cheaper bluetooth headphones wired headphones are STILL significantly cheaper with some being at the $1-5 dollar range. ",PlasmaGod1971,352,202,0.8899999856948853,0.1337442378458043,1734036988,/r/changemyview/comments/1hcv5d3/cmv_apple_removing_the_headphone_jack_was_an/,2024,12
1hgjslt,CMV: There is nothing wrong in seeking escorts if you can't get laid,"Lots of conventionally unattractive or socially awkward men nowadays struggle to get female attention all their lives and it can continue well into late 20s. Dating apps have made things worse and further ruins their already fragile confidence. I myself have faced this and know quite a few people who do so as well. It stings when you do a lot to improve yourself, dress well but barely make any actual progress while someone with a jawline and extra few inches (vertical, not horizontal) get attention even while wearing a potato sack and looking like they haven't shaved in years.

People will say you have a shitty attitude, try to put the blame on you, call you insecure but dont believe everything they say. Nonetheless, the only way to let go of this bitterness is to accept that most women are spoilt for choices nowadays (again, fault of men only for being down to fuck anyone with a pulse) and they have a right to set  their standards, even ones who you think are conventionally unattractive themselves. There is nothing wrong if she chooses who she wants from her options. You are not entitled to affection or sex or anything really. Women don't owe you a thing.

Now coming to escort services, it is a perfectly valid alternative if you have enough money to spare. Best is to go for independent escorts only, without any middleman involved. No one should be shamed for entering into such a transactional relationship. The only concerned parties are you and the woman. Its completely understandable if you don't want to deprived of any sexual contact throughout your 20s (or more, god forbid) for reasons beyond your control and you feel these services are the only option left.

Trust me, you will feel better and lead a better life as long you don't get carried away. Its far better than letting bitterness and despair consume you. Do what's best for you. Try not get swayed by people (irl or online) who try to convince you that you are a bad person or misogynist or whatever for engaging in such practices. They are not in your shoes. Your life is not the same as them. They don't care if you remain a virgin. You are not guaranteed to be ""rewarded"" with anything if you go about things the ""right"" way, whatever that is. Women get attracted to whoever they want, which includes criminals and abusers. You can be the best version of yourself and it still doesn't guarantee you will get laid. Life simply doesn't work like that.

Life is unfair. Always think about what's best for yourself. So go out there, spend that dough and get laid guilt free and don't let any moral police get to you.",sayantaneden10,229,342,0.7200000286102295,0.1329689833726649,1734466768,/r/changemyview/comments/1hgjslt/cmv_there_is_nothing_wrong_in_seeking_escorts_if/,2024,12
1hbc4s8,"CMV: Folks who refuse to tip on ""principle"" are just throwing a tantrum aimed at the wrong group.","I understand folks refusing to tip at places like Starbucks or McDonalds where the employee is not a tipped wage earner, but I hate folks when refuse to tip even at restaurants or for delivery where it is actually expected. The system sucks, but stiffing the worker who provided you a service is just taking your frustrations out on the exploited party. If you really want to send a message, don't use those delivery platforms or frequent those restaurants that rely on tipped wage earners and vote with your dollars.

Folks act like tipping is just peer pressure from the worker when in actuality tips exist to bridge the gap between the tipped wage and minimum wage. Obviously none of us made that decision, but it is the way that the system is currently constructed. Folks who refuse to tip tipped wage earners are just throwing a tantrum over this lack of control. There are actual constructive actions you can take to change the status quo, call your representative, organize with workers rights advocates, boycott restaurant owners, but stiffing the employee just puts that person in danger of wage theft for no fault of their own, especially if they are an immigrant or lack the time/resources to pursue legal action.

For the folks saying that tipping has gotten out of control and they don't want to tip every time they make a purchase are right, so don't. Oh you feel pressured because the check out person flipped the screen around for you? Grow a backbone, hit skip, and turn it back. You are not obligated to tip everyone, but there are certain people you are obligated to tip if you receive a service from them and you should absent some extenuating circumstances.

And yes, tipping is a way for restaurants to pass costs off to the consumer. But do you really think the price of the food on the menu would remain the same if the worker received the actual minimum wage. The price you pay for food is lower because restaurants don't have to account as much for employee wage when crafting the menu. If they did, the price would increase and these same folks complaining about tipping culture would start complaining about unaffordability. Paying for services is not cheap, paying for a persons time and efforts is not cheap. It sucks that certain activities may not be cost effective for everyone, but that is the nature of discretionary spending. You can either play by the rules and try to change them if you are so inclined, or stay home and cook for yourself. Its really not so bad.",smokey2916,89,504,0.5799999833106995,0.1326650186903814,1733864368,/r/changemyview/comments/1hbc4s8/cmv_folks_who_refuse_to_tip_on_principle_are_just/,2024,12
