id,title,selftext,author,score,num_comments,upvote_ratio,popularity,created_utc,permalink,year,month
1cywsmg,"CMV: otherwise apolitical student groups should not be demanding political ""purity tests"" to participate in basic sports/clubs","This is in response to a recent trend on several college campuses where student groups with no political affiliation or mission (intramural sports, boardgame clubs, fraternities/sororities, etc.) are demanding ""Litmus Tests"" from their Jewish classmates regarding their opinions on the Israel/Gaza conflict.

This is unacceptable.

Excluding someone from an unrelated group for the mere suspicion that they disagree with you politically is blatant discrimination.

https://www.nytimes.com/2024/05/22/style/jewish-college-students-zionism-israel.html",laxnut90,1643,1624,0.8299999833106995,0.857290104305781,1716481148,/r/changemyview/comments/1cywsmg/cmv_otherwise_apolitical_student_groups_should/,2024,5
1cwq65v,CMV: it is perfectly reasonable of the ICC prosecutor to seek arrest warrants for leaders of Hamas *and* of Israel for alleged crimes against humanity,"I’m feeling like the world has gone mad in its general reaction to this move by the ICC prosecutor.

We have Biden and others calling it outrageous to suggest equivalence between Israel and Hamas (which it would be) but that’s not at all what the ICC prosecutor has done - he’s just said ‘name’ is suspected of this list of bad things, and ‘name’ is suspected of this other list of bad things, with evidence, and those allegations are serious enough that there is potentially a case to answer. 

I’ve also seen people on Israeli subs saying although they might hate Netanyahu, the ICC has lost the plot. Like: ‘he’s a criminal but obviously not THAT kind of criminal!’, and saying the ICC should turn its attention to the real crims in Russia or North Korea instead. But, jurisdictional issues aside, why would you not want scrutiny of all leaders responsible for massive loss of life? Even the strongest supporter of Israel’s right to defend itself should surely be concerned about how exactly that defending is done? And there are lots of features of Israel’s warfare that should at least prompt cause for concern (disproportionate fatalities, friendly fire, dead aid workers, soldier misconduct)

Meanwhile Hamas says the move equates victim with executioner. Same point applies as above, that leaders on both sides might have some charges in common, but the question in each case is “did this person do this stuff?” NOT “is this person better/worse than that person?” Also I don’t believe there is any doubt that Hamas ordered deliberate killing of civilians and taking of hostages. The whole point of the concept of war crimes is that it doesn’t matter how righteous or justified you feel, or how nasty war is - you should never do them. 

Are we really so addicted to “good guy vs bad guy” narratives that we can’t bend our minds around the concept that maybe two sides, despite all sorts of legitimate grievances, can simultaneously inflict great evils on one another?

Is it perhaps that it’s such a complex situation the moderates stay quiet so the polar extremes dominate the airtime?

Or am I missing something here? I see no sensible reason for calling the ICC’s (very preliminary) move anything other than reasonable, or anything short of exactly what we should want to see in modern civilisation. 

",Affectionate-Ebb9136,1005,2045,0.7599999904632568,0.7815126050420168,1716238469,/r/changemyview/comments/1cwq65v/cmv_it_is_perfectly_reasonable_of_the_icc/,2024,5
1clrqw2,CMV: future of Islamism in Europe is not promising ,"
I'm ex-muslim and I was worried about what's happening in the last few years where people in the UK chanting for implementing Sharia as well as Germany 

I don't have problems with Muslims just if you want to say I'm islamophobic but I don't want my head to be chopped off because I left my faith for the scientific errors in the Quran which is the word of God 

But I truly believe that stoning to death, killing apostates, cutting hands and doing jihad which is militarily fighting other countries to worship allah and enslaving their women and children and kill men if they defend their land and implementing jyzia to humiliate non-muslims is something bad and inhumane and terrorist 

I think that 1 scenario will happen in the future out of 2 

1. The good scenario 

Europe will organize the immigration policy and the next generations of Muslim will be less conservative and many of them will leave the faith and everything is gonna be fine (most of the ones who want sharia are either 1st generation or 2nd at most) a


2. The bad scenario 

UK will face a civil war from people who wants to implement the Sharia (and yes that's what literally in the Quran, Muslims are ordered to jihad) and eventually the UK will win but after many casualties 


Sorry if that's sounds very extreme but I'm genuinely worried because I'll encounter many persecution if people in my country knows that I'm atheist and maybe I'll be killed if they know and I'm willing to go work in the west and I -for obvious reasons- don't want to be killed there too
",Man_of_Medicine,1163,1772,0.7200000286102295,0.7590221418640806,1715023695,/r/changemyview/comments/1clrqw2/cmv_future_of_islamism_in_europe_is_not_promising/,2024,5
1cpozer,"CMV: The Republican Party made a mistake running Trump 2024. People would vote for just about anyone other then Biden, but we will not vote for Trump.","Who knows how well this post will age but for me personally I think this was a mistake. Yes I know, this is in part what the GOP base wants. Yes I know that he could easily split the party and cost them the election if he *didn’t* get the nomination but I still think it was a poor choice. 

And I still think the wet noodle spine of most of the party establishment precluded the possibility of them mounting any serious opposition to Trump’s candidacy. But look, Biden is old. People don’t like him. They’re not inspired by him. His voice is weak and thin and his economy is unaffordable. 

But I genuinely believe people dislike Trump more. God I wish Haley was running and the GOP should too because she’d be cleaning Biden’s clock right now. I’d happily campaign for her. 

But I will not support a man who led an insurrection against our 2 centuries of Republican government. ",makeyouamommy177,1785,971,0.7599999904632568,0.7374083129584352,1715455254,/r/changemyview/comments/1cpozer/cmv_the_republican_party_made_a_mistake_running/,2024,5
1cxggvr,"CMV: Men are spoke about as a collective, and ""Not all men"" is a valid argument.","With the recent ""Man or Bear"" controversy, I've seen ""Men"" discussed as a collective. 

When men point out, that ""Not all men are dangerous"", while all bears are. We are explaining why your attack on rapists is offensive to the average man. Yes, we agree, rapist, sexist, bigots, are scum.

However, we have a right to be offended when men are spoke about as a collective and try to defend ourselves. We are not rejecting your point or that the stuff some men do is awful, but make it clear that you're talking about some men and not all me, because the way the discussion is phased does implicate ALL MEN",Arcuran,1265,1523,0.6600000262260437,0.7267133748364871,1716319763,/r/changemyview/comments/1cxggvr/cmv_men_are_spoke_about_as_a_collective_and_not/,2024,5
1chig4t,"CMV: Saying “The United States is a republic, not a democracy” adds nothing to political discourse","You see this a lot, particularly from right leaning commentators when someone says that something thing or another is undemocratic, usually something Trump did or said. And someone will say, “The United States is not a democracy, it’s a republic.” 

This is essentially like saying, “human beings are ren’t mammals, they’re primates”.

Yes, the United States is not a *direct democracy* like ancient Athens, but it’s a representative democracy, which is essentially the same thing as a republic. 

And it features pretty well developed press freedoms, an independent judiciary, full equal protection for all citizens under the law, enforcement of property rights, transparency and accountability of government officials, elections of legislators, robust political debates , etc. These are all hallmarks of a democracy. 

So, I’m not sure what stating that the United States is a republic, not a democracy, adds to any discussion. Unless, the people who bring this up are suggesting that Americans abandon the rule of law and liberal norms. 

Is there something I’m missing?",Schmurby,1436,1295,0.8199999928474426,0.7188668132289591,1714558057,/r/changemyview/comments/1chig4t/cmv_saying_the_united_states_is_a_republic_not_a/,2024,5
1cv8toi,CMV: 200 sexual partners over a 4 year period is a very high number and points to an unhealthy relationship with sex,"Excess of anything is considered unhealthy, whether it be eating, drinking, working or playing video games. While an action in itself might not be negative, when done to an extreme certainly points to an unhealthy relationship with that particular activity.   
  
However, when it comes to sex, there seems to be a lot of hesitation to agree on this, otherwise uncontroversial, fact. I recently faced pushback on a Reddit post stating that 200 sexual partners over a 4 year period is objectively high. So I'm here trying to see whether there is any perspective that makes 'sex' a special class or whether my statement is in fact, as I perceive it to be, uncontroversial.",lwb03dc,1163,1576,0.75,0.7111003814728826,1716070587,/r/changemyview/comments/1cv8toi/cmv_200_sexual_partners_over_a_4_year_period_is_a/,2024,5
1cktjcg,"CMV: If Israel is an illegitimate state because it was founded on ethnic cleansing, so is Turkey.","In 1948 Israel won its war of independence as a product of Arab states refusing the UN partition plan of Mandatory Palestine and then proceeding to not make any sort of counter-offer during this period. 700,000 Arabs either fled Mandatory Palestine or were expelled. 

In the Palestinian narrative, this is seen as the ""Nakba"". They conveniently ignore the significantly larger number of Jews who were expelled from Middle Eastern countries immediately after this.

Regardless, let's say that this narrative is entirely correct. That Israel is an illegitimate state because of their acts of ethnic cleansing justified through Jewish nationalism. Then it should also logically follow that Turkey is an entirely illegitimate state.

Turkey emerged from the remnants of the Ottoman Empire after the Turkish War of Independence (1919-1923). The establishment of Turkey happened as the result of significantly worse levels of ethnic cleansing and genocides against ethnic minorities. The most obvious example being the Armenians. 1.5 million of them were systemically exterminated in this war. The ideological justification of this is fundamentally identical to that of the State of Israel, Jewish Nationalism or Zionism. Following the war, the 1923 Treaty of Lausanne created a compulsory population exchange involving 1.2 million ethnic Greeks from Turkey and 500,000 Muslims from Greece.

This was explicitly endorsed and enforced as state policy to create an ethnically homogeneous nation. If Israel had the same intentions, they failed. This is not, and has not been reflected in the ethnic makeup of the State of Israel.

The only *possible* difference between these two circumstances that would make Israel illegitimate and Turkey legitimate, is that many Israelis came from Europe instead of the Middle East. However I fail to see how this is relevant to the actual act of ethnic cleansing and population swaps that makes Israel illegitimate in the first place. 

Out of consistency, all pro-Palestinians who think that Israel is an illegitimate state per the principles of its founding should also apply this standard to the State of Turkey and many other states around the world.

All 'anti-zionists', who want the destruction and/or dissolution of Israel entirely (not just them to stop their actions in the West Bank or Gaza and implement a two-state solution) should also be in favour of the destruction/dissolution of Turkey and right of return for all displaced Greeks (and Muslims) from both countries.  
  
The fact that Turks happened to *also* be in modern-day Turkey for a very long time is irrelevant to the question of whether or not ethnic cleansing (or 'population swaps, as it was called') makes the state that did it illegitimate. Saying that Israel is a 'European Colonial Venture' has nothing to do with the logic presented nor do I particularly care about the recklessness of the British Empire in the dissolution of their mandates.   ",Sqewed,821,1704,0.6200000047683716,0.6465979056659339,1714922165,/r/changemyview/comments/1cktjcg/cmv_if_israel_is_an_illegitimate_state_because_it/,2024,5
1cqsuws,"CMV:Islam is evil, and the biggest threat to the West","First. Let’s get this out the way before someone’s chimes in with the “Islamophobic” retort. Criticizing Islam isn’t hateful. Or racist. Arabs are fine. Islam is not. I hold all 3 religions in nearly equal contempt. However the other two are in the 21st century at least. There are a frightening number of radicals worldwide. The religion itself was built on conquest and spread by the sword. Muhammad was a pedophile. And Islam actually got better for awhile. Then I want to say around the 1700s/1800s you started having these different schools of thought. Then you had Sayyid Qutb come along in the early 1900s. He’s basically the father of modern day Islamism. Let me explain two different kinds of people. 

There is a difference between radicals and terrorists. A small minority are terrorists.

15-25% of all muslims are radical in their beliefs, meaning they believe one or a combination of the following:

1.	⁠Being gay should be illegal.
2.	⁠Honor killings are sometimes justified.
3.	⁠Apostates should be killed.
4.	⁠Terrorist attacks against civilian centers is sometimes justified.

Anyone who believes those things is a radical. Regardless if Islam teaches it or some government says it. In this specific case, 15-25% or more muslims believe some of these things. There are polls recently that show close to 90 percent of Gazans support Hamas. A majority supported October 7th. 93 percent of Palestinians oppose homosexuality. Close to 40 percent of young British Muslims believe apostates should be killed. I can go on and on. And that is why I believe Islam evil and a grave threat. ",Routine_Suggestion52,760,1725,0.6499999761581421,0.6346455452596687,1715582710,/r/changemyview/comments/1cqsuws/cmvislam_is_evil_and_the_biggest_threat_to_the/,2024,5
1d4kyjr,CMV: There isn’t anything I can think of that Biden has done wrong that Trump wouldn’t be much worse on,"Labor? Biden picketed with AWU and that’s never been done by POTUS and his appointee in the NLRB seems to be starting to kick serious ass.

Infrastructure? His Build Back Better Act is so good that Republicans who tried to torpedo it are trying to take credit for it now.

Economics? I genuinely don’t know what Trump would be doing better honestly, though this area is probably where I’m weakest in admittedly.

I’ll give out deltas like hot cakes if you can show me something Trump would or has proposed doing that would take us down a better path.",EnvironmentalAd1006,794,1379,0.699999988079071,0.5595727777663633,1717122194,/r/changemyview/comments/1d4kyjr/cmv_there_isnt_anything_i_can_think_of_that_biden/,2024,5
1ckwnfl,CMV: You have the right to be overly neutral about foreign conflicts that you don't really have too much affiliation with,"This is in response to things like Israel vs Hamas and Ukraine vs Russia as an American (more with the former). Since I'm pretty young, my feed (mostly Instagram, I don't really use TikTok) unsurprisingly has people constantly saying how we need to have our voices involved and that if you do nothing you're letting genocide happen. I think I've seen at least ten posts a day about this with the same messages. But I do feel that as someone with barely any personal ties to these conflicts, I feel I just don't really think I can say who is right. Plus having a wide variety of friends and my knack for researching tons of information has exposed me to different views which has made it only harder to truly pick a side of sorts. The only opinion I really have is that I don't want the civilians of the region to suffer any longer, which isn't really that disagreeable. I have several friends who protested and while most of them didn't see too much fighting (their schools mostly just had a two hour rally and everyone left afterwards), the ones who did see battles like at UCLA or Columbia were much more distressed and I did spend some time comforting them as a friend even if I had told them I was more or less neutral, which they understood and had no problem with. ",GB_Alph4,1024,994,0.800000011920929,0.5298665187346332,1714930556,/r/changemyview/comments/1ckwnfl/cmv_you_have_the_right_to_be_overly_neutral_about/,2024,5
1csgums,CMV: It’s perfectly acceptable to care about a potential partner’s sexual history ,"It’s no secret that there is a double standard between men and women on this topic. Men’s promiscuity tends to get a pass or even praise while womens’ tends to get cringed at or shamed. 

But I think regardless of gender, it’s not an unfair standard to want a partner that hasn’t slept around a ton. A popular sentiment online is that if I found out well into a relationship that my partner had slept with 50 people, any emotional reaction I may have can only be the result of insecurity. 

Is it inherently insecure to not want a person who is willing to let their body be used by numerous strangers? At the very least I think I’m justified in thinking “ew”, and that doesn’t have to be because of my own insecurity. 

I’m no prude. I don’t think sex is sacred or anything. And you don’t have to agree with my preference, but why can’t this just be merely be a preference without accusations of sexism or “slut-shaming”? ",Feeling_Quantity_491,816,1231,0.7099999785423279,0.529549423681453,1715766295,/r/changemyview/comments/1csgums/cmv_its_perfectly_acceptable_to_care_about_a/,2024,5
1cis8r4,CMV: Standing in solidarity with Palestinians does not mean endorsing or supporting everything Palestinians believe in,"When I discuss with people here about Israel/Palestine issues, I will always get accused of supporting Hamas or condoning the Oct 7th attacks because many Palestinians do, but this is a line of reasoning I don't follow. When Nat Turner rebelled and killed more than 50 White people, abolitionists did not stop supporting abolition, in fact he is viewed quite favourably today by African Americans. Or when ANC bombed Church Street which killed 19 people and wounded 200 more, many South African Blacks saw that as justified yet it doesn't mean one should stop opposing the apartheid. Similarly, just because many Palestinians believe that the Oct 7th attacks are justified, it doesn't mean that I think they are justified and, more importantly, that I should stop supporting them in getting their right to self determination.  

The other accusation I get a lot is that I am homophobic to support the Palestinians, which is strange given that I am bisexual myself. Truth be told, when considering all matters in politics, I probably have more in common with the average Israeli than the average Palestinian, but the right to self-determination, the right to safety, and the right to basic necessities are not and should not be conditioned on someone having political beliefs that align with mine. If that is the case then I would not support most self-determination movements in the world because I am solidly on the left on most issues.

I think the converse is true as well, if someone is standing in solidarity with Israelis, I do not immediately assume that they support Bibi or the Israeli settlers (in fact odds are they don't). I am very well aware that someone can simply believe in Israel's right to self-defence without taking Bibi's actual political positions into account.

So I would like to hear why standing in solidarity with the Palestinians necessarily means that I endorse or support political positions that are mainstream amongst Palestinians.",WheatBerryPie,688,1354,0.6700000166893005,0.5237684315780102,1714687498,/r/changemyview/comments/1cis8r4/cmv_standing_in_solidarity_with_palestinians_does/,2024,5
1cmoixk,CMV: The generalization of all men as potential predators is no different from racially profiling minorities. ,"I'm sure by now, most of you know about the ""would you rather be stuck in the forest with a man or a bear"" trend where a lot of women are saying they'd rather be with the bear. This trend shows just how normalized it's become to generalize all men as potential predators, like we're guilty until proven innocent.

But how is this generalization attitude any different from police who profile black people? Or a TSA agent profiling someone with a turban?

""*We know not all men are rapists, but because some of them are, we must be wary of all men""*

Well, let's apply that logic towards any other group.  
*""We know not all Muslims are terrorists, but because some of them are, we must be wary of all Muslims.""*  
*""We know not all black people are criminals, but because some of them are, we must be wary of all of them.""*

It's obviously racist to think every Muslim is a potential terrorist, so why is it ok to think that every man is a potential predator? 

I'm not denying that bad men exist, of course they do. But the overwhelming majority of dudes are just normal people trying to get through life. If you can understand that not all Muslims are Osama Bin Laden, then you should be able to understand that not all men are Ted Bundy.",Glass_Bucket,597,1354,0.6600000262260437,0.49827823549957884,1715120475,/r/changemyview/comments/1cmoixk/cmv_the_generalization_of_all_men_as_potential/,2024,5
1cr2zdb,CMV: Hamas wants innocent Palestinian women and children to die because it achieves a desired effect; public support.,"Hamas attacked Israel in early October and took hostages because they wanted Israel to respond. 

Even now, it would be easy to identify your fighters and go to war as known combatants, but they refuse and hide. Hamas leadership could surrender and turn over weapons and funds to end the war, but they dont. These things won’t happen because it doesn’t achieve the effect that Hamas desires. 

If Hamas surrenders, Israel looks strong. If they continue playing cat and mouse amongst the local populous, Israel looks evil. Both sides have the ability to stop what’s going on. 

Hamas and its supporters have equal blame in everything currently going on in the region.

Change my mind. ",Sicily_Long,631,1248,0.6700000166893005,0.4818851746077404,1715616265,/r/changemyview/comments/1cr2zdb/cmv_hamas_wants_innocent_palestinian_women_and/,2024,5
