post_id,title,text,author,score,upvote_ratio,num_comments,created_utc,created_datetime,subreddit,permalink,month,year
1m0uegm,AITA For letting a family fail an escape room on purpose,"I (M24) work at an Escape for a second job, and throughout the week days I'm usually by myself as there aren't a lot of bookings for rooms. One of these times, I had a booking for a group of 7. The group gets here and it's a Mother, 4 Daughters and 2 boyfriends of the Daughters. All of them appear to be at least 20 or older except for the youngest Daughter who, at the oldest, was around 13. I take the family back to the room and explain everything, then let them Start the room. The second I sit down in the control to watch them, I notice only the boyfriends, who have never done an escape room, and the mom seem excited and are looking around. The daughters start looking around eventually and even find one of the puzzles for the room. They start working on it and not even 2 minutes go by and the mom swoops in, takes the puzzle, and makes them go look elsewhere as she worked on it. That was how the rest of the room went, the kids would find the stuff, and the mom would take over and make them leave. The youngest, getting fed up with this, decides to just sit down and wait in the first part of the room, (This escape room had 4 separate rooms for them to go through). After the group gets to the 3rd room, the mom storms into the first room and tells the little girl to stop pouting and come join them, then before she can respond, the mother tells her ""You're ruining this experience for everyone. I wish I didn't bring you""... I was flabbergasted... how could anyone speak to thier daughter that way? Eventually they're nearing the end and all they need is to find a key fob to open the door and escape. In thier haste, they miss it and the mom keeps asking if I can give them a clue to where it is. Here is where I might have been the asshole. They had already used all 3 of thier clues and I was feeling petty, so I told them that unfortunately I wasn't allowed to tell them any clues on its location, even though I totally could and my boss would have preferred I told them... but I was alone so I decided that I wasn't going to help. 30 seconds left and the little girl who had been yelled at by her mother found the key fob they needed, smiled, put it back where she found it, and walked away without a word to her family. The timer goes off and I come back to the room, saying the did a good job but unfortunately weren't able to escape. The mom was pissed and starting blaming the kids but eventually calmed down, thanked me for all the help and left. The kids slowly followed and the last one to leave was the youngest daughter. I asked her why she didn't show them the key she found and she smiled and said "" Well my mom already said I ruined the experience for her, for I made sure she couldn't win"". After they left I though about it and kinda felt like an asshole, so I came on here to ask If I was the asshole",Maverick_7265,4046,0.9399999976158142,120,1752614964,2025-07-15 16:29:24,AmItheAsshole,https://www.reddit.com/r/AmItheAsshole/comments/1m0uegm/aita_for_letting_a_family_fail_an_escape_room_on/,7,2025
1m5w7p4,AITAH for taking a job that’s twice the amount I’ve ever made and would solve my financial problems,"Got offered a job for $60k+ a year. Only problem is I’d have to work weekends. My gf works M-F and has weekends off. Her one requirement is that I also don’t work weekends. It has made my job search significantly more difficult and I said screw it and went to an interview anyways. They offered me the job and I want to take it but now she is freaking out.

I’ve been in a financial hole for years now and this job would help bring me out of it. I’ve been depressed for years due to finances. This would be life changing for me. 

We have lived together for 8 years and she said we are done if I accept this job. She’d rather have me make $30k a year if it means I get weekends off for us to spend together. This job also has full benefits which I have never had. I need health and dental, etc. 

Would I be the asshole to accept the job? She keeps saying I’m being so unreasonable and choosing money over her. ",One_Ground5972,4031,0.9300000071525574,1706,1753134762,2025-07-21 16:52:42,AmItheAsshole,https://www.reddit.com/r/AmItheAsshole/comments/1m5w7p4/aitah_for_taking_a_job_thats_twice_the_amount_ive/,7,2025
1m8i37v,AITA for expecting my bf to grab a bag for me,"I (20f) was at my bfs house (20m) yesterday. Im on my period and keep a few tampons in my purse, but had a ton in the bag I brought over, along with my change of clothes. When I went over I went to talk to his mom in the kitchen, and we talked for a few minutes and I left my bag there. I went to his room and he was playing games at his desk and I was on his bed.

I started bleeding and went to the bathroom and realized I bled trough my underwear and a little trough my pants. I checked my purse and saw I had no tampons as I forgot to refill it since I had filled the duffel bag, I realized I couldn't just go to the kitchen as I now didn't have pants and I couldn't even leave the bathroom because someone might be there. I called my bf and he told me to let him finish his game. I asked him how long that would take

He said that it would be like 20ish minutes till he could help me since him and his friends just got into a new game. I asked if he expected for me to just wait cramping, in the bathroom him and his sister SHARE, for 20 minutes. He told me that me not having tampons in my purse wasn't his problem and that he wasn't going to sell his game for me. I said that he was being really mean. When he finally came I told him I was upset that he made me wait and he told me that he didn't know what I expected him to do and that I needed to manage myself better. I said even if I did, I still would have bled trough, which is why I couldn't leave. He told me that I could have figured it out. I told him that I literally couldn't and he just said whatever and I went home a little after that and I'm starting to think that I could have planned a little better for it.",DiscussionMental7742,3671,0.949999988079071,1135,1753395535,2025-07-24 17:18:55,AmItheAsshole,https://www.reddit.com/r/AmItheAsshole/comments/1m8i37v/aita_for_expecting_my_bf_to_grab_a_bag_for_me/,7,2025
1ma3zye,AITA for going back on my promise to help my sister pay for her wedding when she wouldn’t move the date?,"Hi Reddit. So I (28M) have an older sister “Tina”(30F). When I was 15, I met a girl in the same grade called “May”(15F). May and I clicked instantly and we started dating a few weeks after. May and I dated through the rest of high school and college and I asked her to marry me when we were 22. We got married at 23 and had our son at 24. May unexpectedly passed away in a car accident when our son was 2, so 2 years ago. I’m still devastated and genuinely don’t think I’ll ever date or get married again. My whole family really liked May and we all took her loss hard. Except for Tina. 

Tina didn’t have a lot of luck with boyfriends during high school or college. Until she met Daniel (32M) she had never even been on a date. I know she felt really jealous that I got married and “started a life” first but other than that we were warm with each other. She was polite and respectful at May’s funeral and I thought she had gotten past the jealousy thing. 

Apparently not. Tina and Daniel started dating about 6 months after May died (1.5 years ago) and I was really happy for her. They got engaged 4 months ago and are planning their wedding for summer 2026. When they first got engaged Tina asked me if I would be willing to help cover some costs. Despite raising my son alone, I work a good job and make a lot more than Tina or Daniel, and I really wanted my sister to be happy so I said yes. Well, they just revealed their wedding date. 

Yes, you guessed it. Tina and Daniel are planning to get married on the same day that May and I were married. She “gave me a heads up” by texting me last week and letting me know. I asked her if she was mental and why would she do this. She said that it was the date they liked, and they had every right to pick it. Her and I went back and forth for a few days where I kind of begged her to reconsider. She did not. She posted it to Facebook yesterday. 

I sent her a text saying that she was in her right to pick the date, but that I would not be in attendance or contributing financially. She freaked out, repeatedly calling and texting. She called our mother who started to call and text me and word spreads fast in family so now everyone knows and it seems like the family is split in three sides. Half of the family says that I am in the right. Tina says I’m being an AH, both for not coming and not paying, and there are some cousins supporting her. Mom says that I don’t have go, but I should keep good on my promise. I don’t know. I feel like I’m in the right, but I need some objective opinions.",aitathrowawawa,3582,0.9300000071525574,655,1753563126,2025-07-26 15:52:06,AmItheAsshole,https://www.reddit.com/r/AmItheAsshole/comments/1ma3zye/aita_for_going_back_on_my_promise_to_help_my/,7,2025
1lpe9mp,"AITA for telling my friend to STOP telling me about his ""jealousy"" of women, especially lesbians ?","I (23f) am a lesbian and I have a friend (23m) who is straight. He hates being a man but he promises he isn't trans. According to him, women are divinely beautiful and we don't have to try to be beautiful. To him, men are physically gross and no non-delusional man can ever feel as beautiful as a woman. He talks about wishing he was born a girl. 
                 I feel sad during and after listening to him. I feel anxious because I don't want to do anything to make him feel worse. I told him to stop telling me about his ""jealousy"" of women, especially lesbians. He said I was being a bad friend because I'm the only one he can talk to. He said no professional can help him but they can't make him born a girl. Am I the asshole ?",Legitimate-Way8993,3515,0.9599999785423279,286,1751405922,2025-07-01 16:38:42,AmItheAsshole,https://www.reddit.com/r/AmItheAsshole/comments/1lpe9mp/aita_for_telling_my_friend_to_stop_telling_me/,7,2025
1mcqd6e,AITA for giggling at a family's problems during an HOA meeting?,"This happened this past Sunday. My dad and stepmom are out in a small trip and I'm pet sitting their cat and staying at their apartment whirl they're out.

My dad asked me to attend the ""HOA"" (not sure how to call it, we live in Mexico and we don't have an HOA in the US sense) meeting due to some points about renovations,and other important issues would be touched upon.

During the meeting, there was an ""open mic"" moment to discuss other matters in a more neutral way. One of the neighbors, a woman that we'll call Carol, raised a concern about the ongoing issue with the ""gang"" that's been terrorizing the complex for a while now, and how nothing had been done to stop this.

The gang in question? a group of kids between 6 to 10 yo

Their ""clear gang activities""? talking about games in the elevator/corridors, playing in the main plaza after school, going from tower A to B to pick some of the other kids, or getting toys out to go play.

I know some of them, they sometimes come to the apartment asking for bandaids or get one of my nephews to go play with them, really good kids imo, most outrageous thing they've done was hit a garden light with a ball and breaking it, which they took full accountability for and told management as soon as it happened.

According Carol, the kids are an issue and they make her feel HIGHLY uncomfortable, because she can tell all of them are ""up to no good""

Her daughter, a mid teens, added that she feels so insecure when she's home alone cuz more than once the kids have come up to her door and tried the door handle, banged on it, and that they've even tried picking the lock.

Mind you, her apartment is across from my dad's, and the kids only knock on his twice a week when my nephew is there. And that she also felt unsafe walking anywhere near the plaza because she felt ""perved on"" by, again a bunch of kids between 6-10yo.

The husband was also very mad cuz according to him, he's seen them running around the underground parking lot, and I quote, ""Keying cars and trying to open them, probably to steal the cara or whatever is inside!"", which cannot be true because all minors need to be accompanied by an adult or a security guard to access the parking area, to avoid any accident.

I couldn't help it and snorted, then giggled when Mr. Dad added that whole bit about kids trying to steal cars, cuz as we all know, kids are into that kind of stuff. Carol began to ask what was so funny and why I thought that ""gang"" activity was funny, when I could be the next one to be attacked. I probably messed up by telling her that, I doubt that a bunch of kids who look for anthills to kick are crime masterminds, which of course got a couple of giggles from other neighbors.

Carol is now mad at me and my dad for raising ""someone who supports gangs"", my dad doesn't give a shit because he hates Carol, and my stepmom is also mad at me for not taking this seriously.

In some way, somehow, am I the asshole?",hot_faced13,3489,0.9599999785423279,161,1753830064,2025-07-29 18:01:04,AmItheAsshole,https://www.reddit.com/r/AmItheAsshole/comments/1mcqd6e/aita_for_giggling_at_a_familys_problems_during_an/,7,2025
1lsje8q,AITA for not letting my SIL’s kid order an adult meal for my wedding?,[removed],SlowEnthusiasm7373,3440,0.7200000286102295,4535,1751747617,2025-07-05 15:33:37,AmItheAsshole,https://www.reddit.com/r/AmItheAsshole/comments/1lsje8q/aita_for_not_letting_my_sils_kid_order_an_adult/,7,2025
1mbu5xt,AITA for yelling at my partner who keeps buying crappy branded food when I’ve asked him not too,"My partner (M37) and I (F38) have two young kids and we are well and truely in the trenches with our newborn at the moment. Both of us are like ships in the night, barely have time to think or do anything and our routine has been shot to bits managing our newborn. 
He has taken on the responsibility of going to the supermarket more these days as he finds the walks enjoyable and takes our toddler out whilst I’m home with the new born. 
I sometimes buy myself a coconut water as a treat as I love this one brand. Recently he’s been buying some coconut water for me because he knows I love it. 
But when he’s at the shops he grabs the cheapest brand coconut water but I cannot stand the taste of it and have asked him calmly several times to not buy that brand and to please spend the extra dollar to buy the other brand one that I really enjoy. (So back note, my husband is the stingiest cheap scape known to man and he’s actually admitted to me his money saving isn’t normal compared to others. We both have seriously well paying jobs and are not financially stressed at all, he just loves a bargain and buys the no name brand everything alllll the time) 


He says he just grabs the one mindlessly and doesn’t mean to upset me but he’s done it 5 or 6 times now, and the last time I didn’t get angry at him I just got him to really focus and explained my frustrations and for him to please stop buying that brand, it tastes gross, its not a treat for me and to please get the other brand that I would occasionally but and he was like yep ofcourse and said he would (like he has every other time, but I thought sortof explaining it more it would sink in) Then today he brought home the shit wee tasting stuff AGAIN and I just lost it. We’ve had a huge weekend, I’m sick and a coconut water would have been the nicest treat for me but bringing home the brand I cannot stand felt like it was the biggest punch in the gut to me. When I saw it, I was literally shook, I just lost it and yelled at him and was like WTF did you buy this shit again and threw the carton in the bin without even opening it. He was like woah woah woah I didn’t do it on purpose. I then yelled what is wrong with you?! Like why do you keep doing this and he just walked out of the room so it ended there. 

He got really upset with me and said I’d made him cry by yelling at him and made our toddler upset (cos he got a bit scared when I yelled). The whole thing felt like a complete set up to me and I don’t know after asking 5-6 times previously patiently and calmly how to not get to a point of just cracking up and yelling for him to stop buying that stuff because it feels like a constant reminder of how much he doesn’t care about me after asking him to stop buying it several times. 
AITA for yelling? Like what’s going on here?? ",Acrobatic-Employ3942,3147,0.9399999976158142,952,1753740983,2025-07-28 17:16:23,AmItheAsshole,https://www.reddit.com/r/AmItheAsshole/comments/1mbu5xt/aita_for_yelling_at_my_partner_who_keeps_buying/,7,2025
1m3e5ty,AITA for telling my nephews no cake after they were told they could have cake?,"This happened a week ago and I have no remorse but my in laws are still upset over it. 

My sister in laws birthday was last week. I spent the day making it special for her, driving her around to her favorite stores and spots around town until eventually her friends had a suprise birthday party for her that was our last stop. 

She had way too much to drink and I had to drag her out of the party when her mom called me multiple times to get home to pick up our kids. It took me an hour and her friends kept booing me but eventually we were on our way home but she kept demanding I take her to other friends houses the whole time. I said no, it's 8:30pm and we need to pick up our kids. She was upset at me but ended up passing out anyway.

We got to my mother in laws house to pick up the kids and while I was in the bathroom, I heard my mother in law talking to my sister in laws sons and telling them that they can have cake at my house (they were going to stay the night at my house so my sister in law can have a peaceful night).

I was already so frustrated and tired and when I heard that, I was done. I walked out and helped everyone get ready. My mother in law was handing me the cake and asked ""Oh, can you take this?"" I just looked at her and said ""No."" And walked away. 

The boys all pouted and the older one started crying. I just didn't care. I got them all packed up and told them that it's bedtime and we aren't having sugar but we can have cake tomorrow. The older one bawled again and had a fit the whole way home. 

The next day, I brought them over, all the kids had cake, everything was fine. But my SIL and MIL think I overreacted, that I was being horrible and mean to the boys. I wanted to tell them so bad that saying no is not a bad thing but I just kept my mouth shut. It's been a week and they are still bothered by it.

So reddit... AITA?

Edit to add: I forgot to mention that the kids already *had* cake.. While they were at their grandma's they had cake, and cookies, and ice cream",Ok-Spare-9358,3123,0.9300000071525574,393,1752873172,2025-07-18 16:12:52,AmItheAsshole,https://www.reddit.com/r/AmItheAsshole/comments/1m3e5ty/aita_for_telling_my_nephews_no_cake_after_they/,7,2025
1m00izb,AITA for getting the other kids sugary drinks when she isn’t allowed one?,"It was my(18) little sister(13)’s birthday. Our parents and her friends’ parents asked me and my girlfriend(17) who is one of the kids’ sister, to take them to the cinema. So we did.

After getting the tickets, I went to buy the drinks. Asked them what they all want. Two Fuze Teas, one slushie and one Coca Cola. Got around to the final kid who looked a bit sad. She said her mom doesn’t let her drink sugary drinks. Then she pointed at a shelf where there are small boxes of unsweetened almond milk, saying that those are okay. So I got one of those for her.

My girlfriend later said I shouldn’t have gotten the other kids drinks she wanted to try but wasn’t allowed to, and that it was insensitive.",InspectorDull9735,3055,0.9599999785423279,216,1752531783,2025-07-14 17:23:03,AmItheAsshole,https://www.reddit.com/r/AmItheAsshole/comments/1m00izb/aita_for_getting_the_other_kids_sugary_drinks/,7,2025
1m9c0n0,AITA for not telling my dad I will not pay for my brothers college?,"Had an argument with my dad the other day, and he told me that my parents will pay for my college fully but I would have to completely pay for my brothers entire university tuition if I want them to pay for my college. If not, I would have to take out a student loan.

I told him no way I can pay for someone's college tuition right out of college. 

A little bit of background, we are pretty well off and have a nice home in a gated community. My parents afford enough to go on nice trips, they pay for all my extracurriculars, I've never had to work for my family, and I can use their money to go out with my friends. I know I am extremely privileged, and I know based on my parents line of work, they could pay for my brother. My brother is a smart kid and definitely aiming for an out-of-state school, I do not think it is feasible for me to have to pay 80k+ a year with my starting salary to pay off his college tuition.

I said I would definitely help out my parents financially in other ways, but I could not do this. I also have been applying to scholarships so my parents don't have to pay for my college fully.

However, my dad said I am being selfish, and the financial burden on them is too high.

I honestly do not know if I'm wrong or not, so AITA???",KittyNoir1,3010,0.9200000166893005,559,1753480269,2025-07-25 16:51:09,AmItheAsshole,https://www.reddit.com/r/AmItheAsshole/comments/1m9c0n0/aita_for_not_telling_my_dad_i_will_not_pay_for_my/,7,2025
1mcq63z,AITA for leaving work early without telling anyone because it was over 130°F where I work.,"So i (18M) am currently interning at a very prestigious nursery in the Midwest. Its a really big deal for me because the company has government connections, and having this on my resume basically guarantees me future job opportunities. 

But here is the issue. My boss (lets call him MB) has been out of town on vacation for the past week. Normally, he's the one who works alongside me and checks in. But because he is gone his boss (WB), who works out of a completely different office across the state from where I’m stationed, has been “supervising” me remotely using the security cameras in the greenhouses. The greenhouse I work in is about a mile away from mine and my bosses office building, and since MB is gone, I haven’t had access to the air-conditioned office at all. I’ve been stuck at the greenhouses the entire time in the heat. 

Now, the weather has been brutal lately, with highs around 100–105°F. Inside the greenhouse, it's even worse. There’s no fan, no AC, and barely any ventilation. The only way I can cool it down is by opening the roll-up walls about 3 feet, but that doesn’t do much. Even with shade cloth, the temperature inside reached over 130°F today. I was working in those conditions for 6 hours straight before I started feeling lightheaded and got a headache. 

Since I couldn't cool off and had nowhere to rest (again, I had no access to the office), I made the decision to leave about 2 hours early. I didn’t notify WB because I knew she’d be upset, and I don't have any sick leave to use anyway. About 30 minutes after I got home, WB checked the security cameras, saw I was gone, and called me. She asked where I was, and I told her I had gone home because I wasn’t going to keep working in a greenhouse that was 130°F. She told me that if I didn’t return immediately and finish out the day, I’d be suspended with no pay for a week. Problem is, I live about 30 minutes away and can’t work past 5 p.m (it was already 4:30), so there wouldn’t have been enough time to drive back and get anything done. 

So here is where I might be the ass I told her that even if I could make it back in I wouldn't go back in because it was just too hot there and that if she wants to make sure the plants in there are fine she should come out of her nice ac'ed office and try working in there when it is as hot as it is. She then told me her intern isn't having any problem with the heat (she only has one greenhouse to take care of and it actually has ventilation unlike the 6 I have to take care of). So I just gave up on the conversation said I was sorry and hung up. 

So now I might be suspended, and I’m worried it’ll ruin my reputation at this company. I get that I probably should’ve told someone, but I also think I shouldn’t be expected to work in dangerous conditions with no break and no access to AC.

So AITA for going home early without telling my boss?

",ExternalWelder_,2993,0.9100000262260437,577,1753829562,2025-07-29 17:52:42,AmItheAsshole,https://www.reddit.com/r/AmItheAsshole/comments/1mcq63z/aita_for_leaving_work_early_without_telling/,7,2025
1m48s4n,AITA for giving deodorant to my little brother's female friend ?,[removed],Gloomy_Appointment52,2825,0.9599999785423279,435,1752963772,2025-07-19 17:22:52,AmItheAsshole,https://www.reddit.com/r/AmItheAsshole/comments/1m48s4n/aita_for_giving_deodorant_to_my_little_brothers/,7,2025
