post_id,title,text,author,score,upvote_ratio,num_comments,created_utc,created_datetime,subreddit,permalink,month,year
1lte1fp,AITA for drinking fruit juice when my partner has said he doesn't like it?,"Let me give you some background. I (26F) have been drinking diluted summer fruits juice all my life because I hate drinking water. When I do try drinking water I physically wretch due to the anxiety it gives me trying to drink it. So I stay hydrated by drinking diluted cordial.

When I met my current partner (34M, let's call him Jim) I was drinking 30% cordial 70% water, which I admit now was strong.
About 6 months into my relationship with Jim, he confessed he didn't like me drinking the juice because it made my breath smell bad (of the juice), it stopped me trying new foods and it stopped us from travelling cheap because we would have to pay for baggage just so I can take the juice on holiday. He even compared it to an addiction and how he was able to quit smoking so I can quit this. 

We decided to compromise and 1 year later I had reduced it down to 5% cordial. I was able to take my juice in mini aeroplane bottles and I had to admit I was tasting food better.

However Jim was still not happy and we keep getting into fights about how 'disgusting' it is and it is putting him off wanting to kiss me. I can't even have other fruit flavoured drinks because Jim says it smells and tastes too similar.

So I tried to give it up for him. It has been a month of attempting to drink sugar water. I am getting panic attacks and dehydrated because I'm not drinking enough. I am considering going back to the cordial because of this but I am worried I'd be letting myself and Jim down.

AITA for wanting to drink fruit juice or do I need to keep pushing?",No-Mall1172,2780,0.7400000095367432,2482,1751841109,2025-07-06 17:31:49,AmItheAsshole,https://www.reddit.com/r/AmItheAsshole/comments/1lte1fp/aita_for_drinking_fruit_juice_when_my_partner_has/,7,2025
1mco56v,AITA for not being 'present' for a once in a lifetime trip?,"A while ago my family (mom, dad and older sister) and I (19M) went on a trip to Europe. We had been planning it for the better part of a year, watched all the travel vlogs we could, researched places to go, made itineraries, the works. My mom and sister especially put a lot of effort into planning the trip and did a really great job at doing everything.

A few days before the trip I had an appointment with my doctor. Without going into too many details, he referred me to a specialist because he thought it might be cancer. He said that it was probably nothing to worry about, but it was better to be safe than sorry in the case that it was cancer. Unfortunately, I couldn't get an appointment with the specialist until after the trip. My family was great and super supportive, and promised me that everything was going to be okay. I really didn't want it to ruin the trip.

I like to think that I'm a pretty chill guy. I don't let a lot of stuff get to me and I can usually put things to the back of my mind and not think about them. This time, I was worried. Even though the doctor said it was probably nothing, I couldn't shake the feeling that something was really wrong. I was okay when we were busy because I could distract myself, but in any downtime I kind of spiralled.

Whenever we weren't talking and were waiting in a line, or on a bus driving somewhere, or at the hotel or something I couldn't stop spiralling. It started with convincing myself that it absolutely was cancer, then to what treatment would be like, then to that I was probably going to die and before I knew it I was planning my funeral. I know, it was super dramatic, but that's where my mind went.

Here's where I might be the asshole. To distract myself, I downloaded a bunch of books onto my phone and read any time I started to think about it, aka any time I was left to think. My parents noticed I was reading and asked why and I told them, so they left me to it for a little while, but then my mom and sister started to make comments about how I wasn't 'present'. I tried to tone it down, but I couldn't get it out of my head so ended up reading like six books in the couple of weeks we spent in Europe. Eventually, my mom and sister took to clicking their fingers in my face and saying that I was not present again.

I want to stress that I would only do this when we weren't doing anything, so I put the phone away for all of the activities and tours (or when my parents were letting me have a beer because the drinking age is like 18 in Europe) and stuff. I also made sure to put it away when someone was talking to me. It was just when I had enough time to think.

We got back and I had my appointment and it luckily wasn't cancer. My mom drove me to the appointment and on the way home she said something like ""I bet you feel stupid for not being present on our trip"". I told her how scared I was, but we got into an argument and she said I ruined the trip. So am I the asshole?",Fun_Bend_6292,2711,0.9700000286102295,182,1753824553,2025-07-29 16:29:13,AmItheAsshole,https://www.reddit.com/r/AmItheAsshole/comments/1mco56v/aita_for_not_being_present_for_a_once_in_a/,7,2025
1mefijb,AITA for telling my dad if he wants me to not move he has to help me buy a home?,"I am a baby millennial who is trying to buy a home in this economy. I make a decent salary but apparently not enough to afford a home with the going prices nowadays. I’m not even wanting anything crazy big or extravagant. I’d be content with a 900 square feet condo. The average cost of a home in my town is $650k. I was aiming for $250k max. All housing is expensive where I live in the Midwest. 

I told my parents I may be moving soon as I was searching for a home in low cost of living states such as Alabama or Tennessee and they are opposed to me moving. They said they’re getting up in age and need their children around in case of an emergency (yes I have siblings but I’m the only female child). I help my parents the most. One of my parents is also terminally ill and I’m a part-time caregiver. 

I told them I needed somewhere to live. Moving home isn’t an option since I left years ago due to emotional abus3 that has since been resolved. I told myself I’d never move back with my parents though because of that. 

My parents told me to just keep renting. I don’t want to keep renting forever. I’ve been renting for 7 years. They told me I should not move far from them because they need my help and I help them the most. I told him I didn’t really have any other options. My dad said I can move back home and I declined. I told him if he wants me to live near him then he should help chip in to make that possible for a down payment and he said no. He said that’s my responsibility to buy my own home since I’m an adult and I need to manage my money and not move until I can afford to. So I told him I will move to a cheaper place then so my money will work in my favor to afford a home. I have saved up, I just cannot specifically afford a half a million dollar home. He said I’m being neglectful of them in their old age and how they’ve done so much for me already that I shouldn’t be selfish and move far away from them. ",survivalobsolete,2530,0.8999999761581421,1112,1754000846,2025-07-31 17:27:26,AmItheAsshole,https://www.reddit.com/r/AmItheAsshole/comments/1mefijb/aita_for_telling_my_dad_if_he_wants_me_to_not/,7,2025
1lzyqp8,AITA for not kashering the kitchen for my son?,"Throwaway blah blah. I grew up Orthodox Jewish but it wasn’t the lifestyle for me and I left while remaining very culturally Jewish. My husband is Jewish and I raised our children to be very in touch with their cultural identity (sent them to Jewish schools and sleepaway camps) but don’t really practice the religion in terms of keeping the Sabbath, following the dietary laws, etc.

Our son is 19 and has, over the past two years, become pretty religious. He spends the Sabbath with friends, which is fine with us. We have tried to compromise on the dietary laws by purchasing kosher meat/poultry for him, not mixing meat and dairy, etc. we live in an area with a large Jewish community and he has cart blanche to use Apple Pay to buy himself whatever food he wants. 

Because I grew up in the community I know the rules and do the best I can for him while not limiting myself to a culture that I chose to leave.

I recently found out from one of my other kids that he is annoyed that we haven’t converted one of our ovens (we have two) into a kosher oven for his use, or purchased separate dishes for him etc.

Sibling was like “Did you ask Mom and Dad to do any of this?”

Son was like “no, mom grew up with all of this so she definitely knows what I need and is choosing not to do it.”

Sibling pointed out he can’t be mad if he doesn’t ask while ALSO pointing out that Son is 19 and that this is our house and if he’s that pressed he can get his own place and do what he wants.

Fact is, I don’t want to. I cook and bake a lot. I like having two ovens. I don’t want to relive the exhaustion of a kosher (semi-kosher) kitchen, though I could.

AITA for not accommodating my son’s religious beliefs to the best of my ability rather than a baseline level?",Intrepid-Jello-1886,2380,0.9599999785423279,349,1752527575,2025-07-14 16:12:55,AmItheAsshole,https://www.reddit.com/r/AmItheAsshole/comments/1lzyqp8/aita_for_not_kashering_the_kitchen_for_my_son/,7,2025
1m7n3cw,AITA for leaving my mom to drown in work?,"I’ve worked with my mom since 2022. She owns a small business that made \~$60–100k/year when I joined. I helped her grow it to \~$380k last year. I manage most of the business side and also do service work.

About a year in, she offered to make me an equal partner. I said no. I want to move out of state and don’t want to be tied down. Still, she defers to me a lot, especially with things she doesn’t understand.

Recently, she decided to reintroduce a service I strongly disagreed with. I don’t hate the service itself, but when she and her husband offered it years ago, it led to them working past midnight, often needing my help, even when I had school early the next day. It turned me off the whole industry for years, despite being good at it and enjoying the work.

She wanted to add the service again due to recent legal changes that could hurt the business. She sees this as future-proof. I partly agree, but I think it’ll eventually be impacted too. I pushed for a pivot to a related but new area. It’s slower growth, but healthier long term.

I told her the business is already disorganized and overwhelmed, and the new service is fast-paced and deadline-heavy. She agreed in theory, but said my idea wouldn’t scale fast enough. When I kept pushing back, she pulled the “it’s my business” card. I told her that’s her right, but I wouldn’t sacrifice my work-life balance again and would quit if forced to.

We eventually agreed: if the new service required after hours work, she’d handle it herself.

That was six weeks ago. Since then, I’ve already stayed late once because she didn’t know how to use the tech. She also asked me to stay late tomorrow for an unrelated deadline, and I agreed. Today, I finished my work early and said I’d clock out to offset overtime. She was clearly annoyed.

Later, she texted saying she’s overwhelmed (from the new service). I didn’t respond because I didn’t know how to without saying “I told you so.”

I feel bad. But I’ve warned her for years that the business is too disorganized and unsustainable. She always shut down suggestions because they’d require slowing down.

Also, our history is complicated. She made big decisions when I was younger that negatively affected me. I’ve had to deal with trauma from some of them. I’m tired of paying the price for her choices.

I’m exhausted and emotionally drained, and the same issues affecting the business are affecting my mental health too. She even suggested I take an extra day off, but there’s always “something urgent” that comes up.

Now she’s overwhelmed, and I feel guilty. But I knew this would happen, and I don’t want to be the fallback again. If I say yes once, it’ll become the norm.

So, AITA for not helping her now, even though I know she’s drowning?",EducationalShift6857,2342,0.9800000190734863,133,1753309161,2025-07-23 17:19:21,AmItheAsshole,https://www.reddit.com/r/AmItheAsshole/comments/1m7n3cw/aita_for_leaving_my_mom_to_drown_in_work/,7,2025
1lv1o01,AITA for telling my husband to choose between me and his smart home obsession?,"I (33F) have been married to Alex for 5 years. He was always into tech, which was fine, the last couple years have gotten out of control with his obsession with making our house ""smart.""

It started innocently with some smart bulbs and a video doorbell. But now everything in our house needs an app or voice command to work. Every door has a smart lock, every window has smart blinds, every outlet has a smart switch, there are smart sensors on all faucets, and he even got a smart toilet I can't figure out how to flush without my phone. (I'm way past asking)

Yesterday was my breaking point. I left work early with a terrible migraine and my phone almost dead at 2% battery. All I wanted was to get inside, take my meds, and rest in a dark room. But our WiFi was down so the smart lock wouldn't work. My phone died before I could try the backup cellular system he installed.

I had to sit on our front porch in the sun with my migraine for two hours waiting for Alex to return. He had disabled the regular key lock because it was a ""security vulnerability."" I borrowed our neighbor's phone to call him, but he was in meetings with his phone on DND.

When he arrived, instead of apologizing, he got excited about adding more backup systems to prevent this from happening again. He completely missed that I don't want more tech solutions. I just want to enter my house without needing an app.

This morning made things worse. I couldn't make coffee because he replaced our normal coffee maker with a fancy smart one that ""learns our preferences"" but needs WiFi to work (which was still down). Even the microwave was unusable because it's connected to his system.

I snapped. I told him he needs to choose between me or this smart home obsession. I'm done living in a house where I need tech support just to turn on lights or use the bathroom. He got defensive, saying I'm being dramatic and should appreciate how he's ""improving"" our home. He claims I'm ""holding back progress"" and this is how all homes will be soon.

Here's the thing: I'm a software developer myself, so I understand home automation. But this isn't about convenience anymore. It feels obsessive and controlling. He's spent thousands on this system and keeps adding more complicated features.

AITA for giving this ultimatum? ",Organic-Wind2276Aqua,2323,0.9399999976158142,480,1752011980,2025-07-08 16:59:40,AmItheAsshole,https://www.reddit.com/r/AmItheAsshole/comments/1lv1o01/aita_for_telling_my_husband_to_choose_between_me/,7,2025
1mdifn8,AITA for not inviting a stranger our pastor told us to invite over for Christmas Eve with just my husband and I?,"So, this a throwback and the people involved besides my husband are no longer a part of my life at all. But therapy is weird and while working through something else entirely the memory of this situation popped out from wherever it was laying dormant in my brain and hasn't gone away since. So, I shall ask you, oh dear citizens of Reddit, AITA here or was the pastor out of pocket?

Let me set the scene: It is Christmas eve early 2000s. It is below freezing outside and snow is blowing lightly around. My husband and I are alone, but will be going to visit family the next day. We used to have our celebration on Christmas eve just us, then go to the big family event the next day. 

There was a guy our pastor was helping out, around 20 years old. My spouse and I were early 20s as well. The only thing the pastor new for certain about us was we didn't have kids and we didn't have plans for Christmas eve that involved other people. Or maybe he didn't know the second part and just assumed? Unclear. 

Anyway, hubs and I went out for our annual Chinese food meal and to hang out looking at Christmas lights then planned to watch a movie or something at home. While out at dinner husband got a call from our pastor telling him that he'd sent the guy we didn't know (we'll call him Brian) to our house because we weren't doing anything and thought we should be kind and share our Christmas eve with the man. Let me be so clear that this was never discussed prior. 

Well, he sent the guy to our house on a dang bicycle in freezing temperatures and was irate when we didn't leave our food to go visit with Brian. We were lectured about Christian love and how we were not being good Christians by not inviting Brian along. What? 

So, we eventually go home, Brian is on our couch (presumably he was told to just go in? We lived way out in the country so the doors weren't locked.) I'm shaking with anger. I tersely said goodnight and went to bed because I was not dealing with a relative stranger when my little introverted heart had been promised one night of peace out of the week of chaos.  All of this was reported back to the pastor by Brian who was so hurt and put out by us not being there when he arrived. 

I thought nothing of it honestly until months later I asked the pastor for a letter of recommendation which he willingly gave only to find out he wrote horrible things about my character and my uncharitable nature. Based, I can only assume, on that event since I served regularly at the church and helped quite a lot of people if I'm being honest. Which this pastor would have known. So. Am I the Asshole? ",Aryasummer,2278,0.9200000166893005,383,1753909387,2025-07-30 16:03:07,AmItheAsshole,https://www.reddit.com/r/AmItheAsshole/comments/1mdifn8/aita_for_not_inviting_a_stranger_our_pastor_told/,7,2025
1lpf3xj,AITA for jokingly saying I don’t allow guests in my house during a family trip?,"I (29F, hijabi) went on a weekend trip with my married cousins/their husbands and their cousins from their mom’s side. We were at a restaurant one evening, they were joking about their motel being terrible, and one cousin joked, “Maybe we’ll just stay at your place instead.”

I just woke up from a nap maybe 10 mins before we got to the restaurant and I jokingly replied, “Sorry, I don’t allow guests in my house. It might be worse than the motel you picked.” I said it sarcastically, thinking we were still joking around.

Later that night, all three sisters pulled me aside and told me to be “more mindful” around their husbands because I might’ve made a bad impression. They said I sounded unaccommodating and told me they were giving advice “as sisters,” even bringing up the loss of my brother.

I felt blindsided. I wasn’t intentionally trying to be rude but I was tired and made a blunt joke. I live alone, I wear hijab, and it’s not appropriate for me to host a mixed group anyway. I thought it was obvious the comment was a joke in response to their joke.

TL;DR: Cousins joked about crashing at my place, I joked back that I don’t allow guests, and later they told me I embarrassed myself in front of their husbands. AITA?",radiantvalor,2161,0.9200000166893005,104,1751408009,2025-07-01 17:13:29,AmItheAsshole,https://www.reddit.com/r/AmItheAsshole/comments/1lpf3xj/aita_for_jokingly_saying_i_dont_allow_guests_in/,7,2025
1lvuvkt,AITA for shitting down whenever my brother's university plans come up?,"Apologies in advance, this is long — but I feel like I’m going to go crazy if I don’t get some outside perspective.

I (26F) have a younger brother (18M) who’s about to start his undergrad in the US. He’s really excited, and I'm happy for him — but I’m also struggling with a lot of complicated feelings. 

When I finished school, I too had dreams of studying abroad. I went to an international school where almost everyone went on to study in the States. I applied to universities in the US and UK, got a few admits, and was starting to plan my next steps.

Right as everything was coming together, my dad pulled the rug out from under me.

Out of nowhere, he decided I wouldn’t be going abroad — and instead, I’d be going back to our home country. He sent out my applications himself, got me admitted to one of the top engineering schools there, and just told me that’s where I’d be going. End of discussion.

The thing is I never wanted to study engineering. I told him *so many times*, but it didn’t matter. His reasoning was that I needed to “get in touch with my roots.” For context, I’m a third culture kid — spent my entire life abroad, grew up in a different country, and studied in a predominantly American system. His decision felt like exile.

Those four years of university were the worst years of my life. I was stuck in a country I didn’t feel at home in, studying something I had no interest in. I was numb the whole time, and I’ve spent years trying to block it all out. It still fucks me up to this day. My parents know how I feel, but they believe I should be “grateful” to have graduated from such a prestigious university.

After graduating, COVID hit. I was stuck with a degree I didn’t want and no idea what to do. Eventually, I decided I would pursue a Master’s, but this time on my terms. Fast forward three years: I’ve built a life I love, I live in a great country, I have a job I actually care about, and I’m happy.

But now my brother is going to university in the US — the exact path I wanted to take. He said he wanted to study there, and they supported him without hesitation. And I’m finding it impossible to process.

I feel so fucking angry. I feel like I was robbed of a future I could’ve had. Every time someone brings up his college plans, I feel like I’m choking. And so I stay out of family discussions. My parents have noticed, and when I tried to explain why, they called me jealous, fake, and ungrateful. They told me I have no right to be upset since “everything worked out in the end.” They said, I should be supportive and present during this important phase in my brother's life.

But it’s true, I am jealous. Not because I don’t want my brother to have this opportunity — I do. I’m glad he gets to live out his dream. But I’m angry that I didn’t get the same chance. That I was given no choice. I just resent my parents, and the unfairness of it all. And so I stay away.

Question is: AITA for still being upset about this, even though things have worked out for me now?

 ",interstellardisco,2129,0.9599999785423279,175,1752096431,2025-07-09 16:27:11,AmItheAsshole,https://www.reddit.com/r/AmItheAsshole/comments/1lvuvkt/aita_for_shitting_down_whenever_my_brothers/,7,2025
1mbv5wi,AITA for hiding my baby bump and telling the father that he shouldn't bother showing up for the birth?,"I (24F) have been with my boyfriend (28M) for 5 years now and I am pregnant with my first baby. We've been trying to get pregnant now for about a year so we were both super excited when we found out. I am now 21 weeks pregnant and have a super noticeable bump. I absolutely adored seeing my bump at first, as did my boyfriend, but now it's something that I've become very insecure about.

For context, I have always looked extremely young for my age. Even though I'm 24, I genuinely still look like a teenager. It's never been something that's bothered me especially, but now that my bump visibly shows, I've noticed that I've been receiving very judgemental looks when I'm out in public. It's blatantly obvious that people think I'm a pregnant teen and they don't like or support it. My boyfriend has never noticed these looks so it's something I've kept to myself. But it's become something so bad to me that it makes me not want to go outside. So I'll wear clothing that hides it the best it can.

My boyfriend has recently noticed this and accused me of not wanting the baby. I tried to explain the real reason I'm hiding it but he ended up telling me ""Maybe you weren't ready to be a mam if you're this embarrassed by it"".

We don't usually fight but hormones have been acting crazy so I just snapped at him. I told him that he should support me during this instead of guilt tripping me and that if he can't even support me through this, then maybe he shouldn't even be around when the baby actually actually gets here, as he'll clearly show no support there either. That not only am I dealing with the physical affects of pregnancy, but I'm also dealing with the emotional affects of it. That everywhere I go I'm being judged like I'm a knocked-up teen girl who made a mistake, and the person who should make me feel the safest is the one ridiculing me.

We haven't spoken properly in a few days, and he's telling me that I overreacted and that he's hurt by what I said. I know I went too far but I was just so angry and hurt.

So AITA?",Unlikely-Lynx-8394,2113,0.8600000143051147,641,1753743513,2025-07-28 17:58:33,AmItheAsshole,https://www.reddit.com/r/AmItheAsshole/comments/1mbv5wi/aita_for_hiding_my_baby_bump_and_telling_the/,7,2025
