post_id,title,text,author,score,upvote_ratio,num_comments,created_utc,created_datetime,subreddit,permalink,month,year
1b5v77r,AITA for suggesting my minimum wage and part time boyfriend pay me back for half of my gas for taking him to and from work everyday?,"My (27 F) boyfriend (36 M) of 8 years works at the Amazon distribution center and I am the one to give him rides to and from work, as he works overnights and I worked days. He does have a friend who takes him to work 1 time a week. I also take him to appointments when needed and to the gym daily. He does not have a car or license at this time due to several unpaid speeding and parking tickets.

So about 3 weeks ago I was laid off from my job in marketing. I was making about $55 an hour and holding things down at home with the mortgage and bills without any issues, so I never found it necessary to ask him for gas money to take him to work and home. I figure he works hard and doesn’t get paid much so why make things worse for him? I fill up my gas tank about one time a week for $60. I understand that he is making only $16 an hour and working only about 24 hours per week. I am also privileged to have gotten an masters degree, so I can see how charging him for gas may be an asshole move. But now that I am unemployed and living on much less from unemployment, I am on a budget. I feel like I’m making changes to my lifestyle such as letting go of my personal training sessions, going natural with my nails and avoiding overconsumption.

So on Thursday I asked him about paying to fill up my tank once every two weeks, and I’ll pay the other two weeks, and he got really upset and told me how much easier life has been for me and how I take that for granted. He also says he doesn’t have the money to pay $120 a month for gas (which is understandable because he only makes about $350 every week) even though I have been paying all the bills since we moved in together 4 years ago. I told him that I am not a free Uber service and I feel taken advantage of at times. He still has avoided talking to me about the matter. Am I the asshole in the situation?


TL;DR I lost my decent paying job and am on unemployment and am asking my minimum wage part time work boyfriend whom is unlicensed to pay for the gas I use to pick him up now due to finances. AITA?
",flatsoda-97,2829,1.0,1,1709507522,2024-03-03 17:12:02,AmItheAsshole,https://www.reddit.com/r/AmItheAsshole/comments/1b5v77r/aita_for_suggesting_my_minimum_wage_and_part_time/,3,2024
1bm4ocj,AITA for telling a woman with kids to Fuck off for making fun of my dog?,"My husband and I were on vacation and we brought our senior dog, because we take her everywhere. She’s a sweet 14 year old shih tzu/poodle. She’s having joint issues, so when we take her on a city trip, we put her in a dog stroller so we can walk around. 

So we were navigating a busy sidewalk and this woman, her friend, and their kids, there were at least 4 kids—this woman points at our dog in the stroller and says “oh hell no.” She starts laughing, pulls her friend over, and they and their kids surround the stroller. The woman goes “are you for real? This is not a child. These are children.” Pointing at her kids. As if I was cosplaying a parent by having my dog in a stroller. I am child free by choice and parents like this are so rude. It’s like the world revolves around their kids, and how dare I put my old dog in a stroller. Strollers are for kids only! 

So I told her to F off and get out of my way and pushed the stroller forward to move on. She then starts yelling how dare i cuss in front of her kids. I kept walking and she left us alone, but it ruined my day and I can’t stop thinking about it. I think she’s an asshole, but was I wrong to “swear” in front of her kids? I was pissed off. I don’t want to be rude in front of kids, though. AITA?",MarvelousDarlink,2692,1.0,1,1711232369,2024-03-23 17:19:29,AmItheAsshole,https://www.reddit.com/r/AmItheAsshole/comments/1bm4ocj/aita_for_telling_a_woman_with_kids_to_fuck_off/,3,2024
1bm6tz7,"AITA? On a Whim, My Husband and I Renewed Our Vows in Las Vegas Elopement Style. Divorcing Sister is Furious, Says We’re “Inconsiderate.”","I’ll try to keep this short (like my sister’s marriage 🙈). Background- My sister 39f) has been married for almost 2 years and in the process of getting an international, contentious divorce. It was a shotgun wedding and both families advised them against it (to no avail). We all saw this coming.

Anyway, last week was my daughter’s Spring Break and on a whim we decided to take a last minute trip to Las Vegas. I (42f) have been jokingly pushing a vow renewal on my husband (of 22 years) for a looooong time. We laugh about it and move on…usually. But right before we left it popped in my mind that doing a vow renewal elopement style would be fun (in the spirit with the last minute nature of our trip). I grabbed a white shirt, a light up plastic ring, a janky bouquet of faux roses, and a dress up tiara for our daughter (the flower girl). I found the absolute cheapest, cheesiest vow renewal package ($69 lol) and we went ahead and said “I still do!” after about a 3 minute ceremony.

It was just something fun for us and we didn’t tell anyone ahead of time or make an announcement of any kind afterward because it was *just fu*n. It was our 8-year-old who went around announcing to everyone (including people on the sidewalk…grocery store…at school) that her parents FINALLY got married. She doesn’t really realize (or care about) the difference between a wedding and a vow renewal so we got some side eye from people we know thinking we’d been lying all this time about being married. Fun times.

My daughter told her cousins and my sister that we got married on our trip. My sister was the Maid of Honor in our real wedding so, obviously, she got that it was a vow renewal. She didn’t say anything in front of the kids but gave me a super fake smile and laugh when she heard. When we had a moment with the kids out of ear shot, she let me have it. She told me it was completely hurtful and inconsiderate for my husband and I to do a vow renewal while she is in the middle of a divorce. Mind you, her divorce has been in the works for 6 months with no end in sight. She told me our vow renewal was “rubbing our marriage in her face” and said we should either have not done the vow renewal or kept it a secret. She hasn’t spoken to me since and this was almost a week ago.

My mom is a people pleaser and refuses to take a side on this one. My friends think my sister is nuts to be mad about it (but maybe they’re biased because they’re *m*y friends!?). And my husband stopped caring about what she thinks/says years ago. We are not close with my dad at all so me, my sister, and my mom are all the close (nuclear) family we have. I don’t want this to become an issue because it was mostly just silly joke decided on last minute. I’m thinking about apologizing to my sister for making her feel bad and just trying to move on. But part of me is refusing to do that because I think she’s being ridiculous. So, kind friends, please tell me, AITA!?

TLDR: my sister says my Las Vegas elopement style vow renewal was inconsiderate because she is going through a divorce. What!?",jenelisab,2664,1.0,1,1711238044,2024-03-23 18:54:04,AmItheAsshole,https://www.reddit.com/r/AmItheAsshole/comments/1bm6tz7/aita_on_a_whim_my_husband_and_i_renewed_our_vows/,3,2024
1b989ly,AITA For Telling A Stranger “Maybe You Could Have The Decency To Mind Your Damn Business”?,"I am a 23 y/o woman, the other two women involved were (and I’m estimating, I don’t know them) were a mother around 45 and her mid-late teenage daughter.

So I just left the pharmacy where this took place and I’m writing this in the car before I head out, but I was waiting in line to pick up my prescription. Line was pretty long, it went all the way down an aisle a few feet from the counter. I’m chilling in line, it’s inching along, and about ten minutes into waiting, this woman and her daughter come out of a different aisle and start browsing the one that the line is in. They’re talking about what they want to get, and suddenly the daughter goes “does something smell like a grease trap to you?” I laugh and turn around and say “yeah, that tends to happen after 11 hours in a kitchen” in a casual, joking tone. The mother makes a face and says “well you smell awful. You could at least have the decency to go home and shower first.”

I didn’t expect a stranger to get nasty with me, and after a long day I didn’t have the grace for it, especially with over an hour of driving ahead of me. I also didn’t feel like explaining to the woman that I had about 1.5 hours of driving ahead, that I wasn’t going home first, and to take this little detour would’ve meant 50 minutes of driving (30 from work to home, 20 from home to pharmacy) instead of 15 (from work to pharmacy). So, I snapped back “well maybe you could have the decency to mind your own damn business!”

She chastised me for being rude and stormed away with her daughter saying she was going to tell the store I’m “mistreating her”. Nothing happened. Ten more minutes later and I had my meds, and now I’m here wondering if maybe I snapped a bit too hard. AITA?",Head_Particular_5857,2436,1.0,1,1709852444,2024-03-07 17:00:44,AmItheAsshole,https://www.reddit.com/r/AmItheAsshole/comments/1b989ly/aita_for_telling_a_stranger_maybe_you_could_have/,3,2024
1bgj5u2,AITA for not being over excited for a coworker coming out?,"AITA for not being over excited for a coworker coming out?  I (married/straight/M34) have worked with Toby (fake name M30) for about 2 years. We don’t hangout outside of work, but interact almost everyday and have always gotten along. One day Toby seemed “off” so I asked “Hey, are you ok? You seem off.” After a pause he looked at me seriously and said “I’m gay…” and then stared at me without saying anything else. I didn’t suspect he was gay, but I knew he didn’t ever talk about SO. I responded “Cool!  Is that a recent development?” And he said “Yes, I’ve only told my family.”  I responded, “That’s cool man! Do you still go by He/him/Toby?” Him “Yes.” Me “Ok, well thanks for feeling comfortable enough to tell me” and we went back to work. 

A few days go by and he had told a few other people. One of those people pulled me aside and told me I hurt Toby’s feelings when he told me first. Toby thought I was dismissive in how I responded and it soured his coming out experience. I’ve interacted with Toby a few times since then and it didn’t feel any different than before. 

I responded the way I did because I didn’t want to make a big deal about it. He’s being who he is and I thought making a big scene out of it would cheapen that. Plus, I have no role in his life outside of work. I don’t want to do anything to make work weird for him or me and I’m not sure if I should do/say something or just leave it alone.  
",travisharden23,2330,1.0,1,1710631581,2024-03-16 18:26:21,AmItheAsshole,https://www.reddit.com/r/AmItheAsshole/comments/1bgj5u2/aita_for_not_being_over_excited_for_a_coworker/,3,2024
1bkiqvi,AITA for telling my sister she should have aborted my niece? ,[removed],sisterniecethrowaway,2299,1.0,1,1711058260,2024-03-21 16:57:40,AmItheAsshole,https://www.reddit.com/r/AmItheAsshole/comments/1bkiqvi/aita_for_telling_my_sister_she_should_have/,3,2024
1bjqegz,WIBTA if I tell my friend her son is not welcome to stay in my house unless he is responsible for himself?,"For context: My (F31) best friend (F31) is a single mom of a 14 year old boy. She has low contact with her parents because they kicked her out when she got pregnant in High School, so she doesn’t have  a big support system. We are really close and  I’ve always done what I could to help her, her son is my nephew, not in blood, but in every way that counts,   
  
She does everything for her son. I mean everything. He doesn’t even pick up his plate from the table after he finishes eating, she does it for him. While I personally don’t think this is a good way to raise a child, I never gave her my opinion, she never asked for it, it’s not my business how she decided to raise her child and I’m not a mom so how can I give parenting advice?  
  
Last week my friend  had to take a 2 business trip and had another one schedule for next week. She asked me if her son could stay at my house the days she is out of town, because she doesn’t feel comfortable leaving him alone in their house. I agreed and he stayed with me for 2 days last week.   
  
The 2 days were a frustrating experience for the both of us because he kept expecting me to do everything for him, including: packing his back for school, picking up his clothes whenever he dropped them, serving him cereal in the morning, washing his dishes, and waking him up in the morning to go to school. He even blamed me because he missed the school bus because I didn’t make sure he woke up after his alarm rang. I heard his alarm and assumed he was awake.   
  
I’m not eager to repeat this experience. I love that child but he is too old for this I think. BesidesI have  a demanding  job. I don't have time or energy to be the maid/babysitter of a teenage boy even if it’s just two days.   
  
I’m thinking about telling my friend that if she wants her son to stay with me next week he has to be responsible for  himself. I can promise to cook him 3 meals a day, and I can make sure he is up for school, but he needs to pick up his own clothes, pack his own bags, and wash his own dishes, Otherwise he cannot stay. I don’t feel this is unreasonable, but I feel kinda bad putting these conditions because she doesn’t have  a big support system, and if I don’t let him stay at my house it’ll be really hard for her to find somewhere else to drop him off. WIBTA?  
",Ok-Manner8406,2145,1.0,1,1710973571,2024-03-20 17:26:11,AmItheAsshole,https://www.reddit.com/r/AmItheAsshole/comments/1bjqegz/wibta_if_i_tell_my_friend_her_son_is_not_welcome/,3,2024
1b51stz,"WIBTA if I move out, leaving my chronically ill roommate vulnerable?","I (30sf) live in Los Angeles, where rent is really high.  I live in a house with two roommates (30, 50f).

My 30-year-old roommate, Kay, has been battling an autoimmune chronic illness for a couple of years. She’s not able to eat a lot of foods and has these spells where her energy is drained. 

My 50-year-old roommate Tammy is emotionally immature, doesn’t help out with chores and has a tendency to be really forgetful. For example, she once broke a toilet seat and didn’t bother to replace it before going on a last-minute trip out of town. After I got the delayed utilities payment from her, it came with a poop emoji attached to it. 

I’m responsible for the major utility bills (water, power and internet). It’s hard getting payments from Kay and Tammy because of Kay’s health issues and Tammy’s irresponsibility. They also have two dogs who are very loud and cause a ruckus.

I’ve been having a hard time coping with Kay’s health problems.  It’s horrible for me to say it, but when she is down, she is down. That leaves the majority of household chores, bills, and trash on me.  

I’m in school and working full time.  I can’t stand living like this anymore. Recently, a friend of mine was looking to fill in a roommate vacancy. I will pay more for rent, but the location is closer to my college and my work. 

I feel guilty moving out because of Kay’s health issues. She relies on me to help her get groceries she’s sick. Not to mention, Tammy does f-all to help around the house.

Kay even said that if I move out, it will be bad for her because of her health problems. She says she’s trying to get better, but she’s been saying that for over a year and it’s affecting my life too.

WIbTA if I move route?",No_University_2612,2135,1.0,1,1709421322,2024-03-02 17:15:22,AmItheAsshole,https://www.reddit.com/r/AmItheAsshole/comments/1b51stz/wibta_if_i_move_out_leaving_my_chronically_ill/,3,2024
1b8dpns,AITA for calling my gf vain for ruining our vacation? ,[removed],diir18,2043,1.0,1,1709765030,2024-03-06 16:43:50,AmItheAsshole,https://www.reddit.com/r/AmItheAsshole/comments/1b8dpns/aita_for_calling_my_gf_vain_for_ruining_our/,3,2024
1b50c4a,AITA for naming my child after a villain?,"So, I recently gave birth to my husband and I's first child, a girl. When I was pregnant, we had a lot of trouble deciding on a name, but I finally found one I liked and my husband said he was fine with.

My husband was playing Street Fighter and I watched for a few seconds, and the character Juri was on screen, and something just clicked. I really loved the sound of the name, and brought it up to my husband. He was a bit unsure at first since the character is apparently a psychopath (I don't really know anything about the game or character) but I assured him it'd be fine since we aren't literally naming the baby in honor of the character, and that since it's also a real name it's not like it's inherently tied to that. He ended up agreeing to go along with it, and said it was a nice name regardless.

So, months later, the baby's born, and I'm talking with a friend of mine. She ends up asking how we picked the name Juri, and I brought up that it was kind of a funny story and explained how we picked it. She was kind of astonished, saying that I was naming my character after a villain who's a ""psychopath"" and that I was setting my daughter up to be bullied. I argued that it's a real name, and that it's not like I was naming the kid something like Darth Vader where anyone who hears it will immediately associate it with a villainous character. My husband chimed in saying he went to high school with someone named after Melina from Mortal Kombat (who is also apparently a crazy villain character) and everyone just thought it was cool when they found out. The friend just said that I was setting my daughter up for a lot of hardship in the future, and now I'm second-guessing my choice. I didn't think it'd be a big deal but a few other people among my friends/family found out the origin of the name and are now telling me it was horrible to name my child that. AITA?",Training-Pizza2806,1972,1.0,1,1709417596,2024-03-02 16:13:16,AmItheAsshole,https://www.reddit.com/r/AmItheAsshole/comments/1b50c4a/aita_for_naming_my_child_after_a_villain/,3,2024
1br32ip,AITA for not removing my ‘inappropriate’ bathroom mat for when my mother came over?,"I (24M) recently got married and one of the homewarming gifts i received from my dad (45M) is a bath mat that says ‘GET NAKED’ on it. It’s hilarious and it’s proudly displayed in the bathroom. My wife finds it hilarious too because she appreciates the close relationship i have with my father.

As you can tell, my dad had me pretty young and we have a very close relationship. He bought me the house i share with my wife Bia (24F) and he is the coolest parent ever. We get eachother silly gifts all the time and it’s the way our relationship works. 

He raised me by himself until he met my stepmother (i call her mom but for the purpose of the post I’ll call her stepmother) when I was six. He was technically with my biological mother until I was four but she was neglectful and abusive hence why he did all the child care himself. I’ve been trying to rekindle the relationship with her since I was 14 but it’s gone bust multiple times. We’ve been consistently in contact for the past three years and we are slowly making improvements although there is a long way to go. 

At my wedding, we had a mother son dance alongside the father daughter dance and I danced with my stepmother instead of my biological mother. No one was shocked by this besides my biological mother. 

She was really hurt by this so I’ve begun to put a bit more effort into our relationship. I’m not going to hold her actions from 20 odd years ago against her anymore when she’s being apologetic and has done the work to improve herself. My stepmother is fiercely protective over me and even she admits my bio mother is making a lot of progress. 

My bio mother is also very religious and conservative. She came over to my house for the first time and saw the mat. I knew it may have been an issue with her but thought that she wouldn’t comment on it. She tried to tell me it was sinful and that i should remove it and when i told her it was from my dad, she said it was childish of him to give me something like that. Her main thing against my dad is to call him childish because he’s younger than her by 3 years (i think, not even sure how old she is tbh) and apparently the mat was another iteration of his inability to grow up. FYI, he is a successful doctor with five more children that are being raised perfectly, I can’t even call them demon younger siblings because they are angels. 

I told her that I was going to remove the mat just because she was at my house, she said it was inconsiderate, we argued and she left. 

My wife thinks that she was over reacting although my friends said i should’ve removed it because most older people aren’t as chill as my parents (dad and step mom) so i should’ve anticipated her reaction. She is mad at me now and thinks that i don’t care about rekindling our relationship. AITA?

",Mammoth_Start_6402,1947,1.0,1,1711755399,2024-03-29 18:36:39,AmItheAsshole,https://www.reddit.com/r/AmItheAsshole/comments/1br32ip/aita_for_not_removing_my_inappropriate_bathroom/,3,2024
1b6okh1,AITA for calling my sister out for telling my wife that she looked pregnant?,"My sister isn't a child, she's 30. The thing is that she hasn't had the most conventional adulthood.  She spent most of her late teens and early twenties in and out of one rehab or another, she didn't go to college, lives alone and I don't think she has that much of a social live. She lives out of town so we don't see her much.

My wife isn't a heavy person by any means,  but like many, many people, she isn't quite as thin as she was when we first married, pre child and all that. Totally normal and obviously I couldn't care less. My sister came over with my mom to visit several months ago which was her first time seeing my wife and I in years. She came into town again more recently and we met her at my parents house. She saw my wife and said ""oh I thought you were pregnant"". Implying that my wife looked pregnant last she saw her but clearly isn't as she would be showing more now. My wife is a very emotionally mature person and didn't make a thing of it and neither did I. 

I thought maybe my sister, perhaps being less exposed to societal norms than some, didn't know that you don't say that,  ever. So I sent her a text later on telling her that I know she didn't have bad intentions but that it's generally quite rude to comment that someone looks pregnant and really shouldn't be said, basically ever. 

She got all bent out of shape, saying I was a jerk for ""guilting"" her and that I should ""grow up"" and ""stop taking everything so seriously"". AITA?",Right-Ad8261,1905,1.0,1,1709592077,2024-03-04 16:41:17,AmItheAsshole,https://www.reddit.com/r/AmItheAsshole/comments/1b6okh1/aita_for_calling_my_sister_out_for_telling_my/,3,2024
1bsmeyn,AITA for telling my roommate's girlfriend that she needs to leave?,"I live in an on campus apartment with a roommate. I pay a reduced rent but I work for the school so I'm getting shit pay and still pay a decent amount of my paycheck for rent. Only me and my roommate are on our lease, however it's not uncommon for my roommate's girlfriend to stay with us for a while. As in multiple weeks at a time. So much that it's caused a noticeable increase in our power and water bill. It also causes a hassle when getting ready. She obviously takes super long in the shower and bathroom, uses all the hot water and leaves hair in the sink and shower which I refuse to clean. 

All of this has lead me to feel that she needs to go. I have a pretty busy schedule so I rarely see my roommate with enough freetime to tell him to kick her out, but I do see her pretty often. Yesterday, I got done at the gym and came home to shower before work and she was in the bathroom. I told her I needed to get ready for work and she said she wouldn't be too long. 

I ended up going back to the gym to shower and was late to work waiting on her. I get home and my roommate is now at work and she's in the living room. I tell her that she needs to get her own place to live. I said I cannot deal with another person here, she lives here for free and I don't want her her so she needs to get out by the morning. 

At around 11 I am woken up by my roommate yelling at me and calling me a bully for what I did and accused me of being jealous since I don't have a girlfriend. I told him that I wouldn't have said that if he made sure she wasn't imposing. He's still mad and she's still here so it's been awkward lately. He 

AITA",Heavy-Calendar7870,1896,0.9700000286102295,267,1711922875,2024-03-31 17:07:55,AmItheAsshole,https://www.reddit.com/r/AmItheAsshole/comments/1bsmeyn/aita_for_telling_my_roommates_girlfriend_that_she/,3,2024
