post_id,title,text,author,score,upvote_ratio,num_comments,created_utc,created_datetime,subreddit,permalink,month,year
1cs6609,AITA for not wanting to visit my wife's grandparents after they gave my brother-in-law (BIL) a 50K truck?,"My BIL is a 28M with no job who lives in my in-law's basement. He is obese and survives off of welfare cheques from the Canadian government. He is capable of working but chooses not to. My wife on the other hand (26F) moved out at 18, self-funded a degree, works in a good field (80K annually), got married, and has never sought a hand-out from her parents or her grandparents even though they both have the means.

We spent our vacation time the last two years visiting her grandparents who live across the country. Recently her grandparents (85), moved out of their house and into retirement living and no longer had space for both of their vehicles. Her grandpa decided to gift my BIL a truck with a fair value of $50,000. His justification was to ""help him build confidence"" and ""give him something to care for."" My wife was given nothing and they did not do anything to even out the gift.

We have a trip planned to visit them in a few months, but I have no interest in going to see them. I am mad at myself for letting money ruin my perception of them, but I do not appreciate how my wife was treated. I feel they take her for granted. We always go out of our to visit them. All of our trips are self-funded. We have never asked anything of them while lots of her cousins have been baled out financially. I just have an icky feeling about the whole thing.

My wife got upset when I told her I wanted to do something else with our vacation time. She got really upset and it led to an argument. She took the stance we have to enjoy our time with them while we have it.

My wife and I are currently saving for our first house, paying off student loans, and saving for our first child. We still drive my very first car I bought 10 years ago. The situation stings, as we could have used the help, while her brother lives a free ride and gets nothing but help all the time.

AITA for not wanting to see my wife's grandparents because of this? ",Neat-Drawer-50,3871,0.9399999976158142,907,1715728480,2024-05-14 18:14:40,AmItheAsshole,https://www.reddit.com/r/AmItheAsshole/comments/1cs6609/aita_for_not_wanting_to_visit_my_wifes/,5,2024
1clxt18,AITA for not putting off school to take in my nephews?,"Throwaway for privacy.

I (30F) have a very small, not very close family. I have an aunt and uncle, who have three children (my cousins, two of whom are still minors) and I had my sister (40f). My parents have passed away. My sister and I weren't very close. She had three boys (9,7, and 6) and was a single mom. 

Last year I was accepted to a PhD program. I am set to start in the fall and I plan on moving in a couple months to get settled before the semester starts.

My sister passed away just after the start of the year. She had some health issues that unfortunately caught up with her. Obviously I was still upset to hear of her passing and went to her funeral. After the funeral, my aunt and uncle asked to meet.

My nephews are staying with them for the time being, but they want me to take over their care. I explained to them that I couldn't since I was moving soon to attend my program. They urged me to put it off. I told them it didn't work like that. I couldn't put things off until all three of the boys were able to be on their own. They asked if I could take them with me and I told them that wasn't possible. 

We went back and forth, until everyone became very upset and we parted ways. Both of them have been calling, texting, and emailing me. They are getting more and more aggressive and this weekend my aunt called my a selfish little asshole and she couldn't believe how I was handling this. They both want me to put off going to school to take care of my nephews. I've since blocked them on everything.",AnxiousAnthill,3579,0.9700000286102295,498,1715039163,2024-05-06 18:46:03,AmItheAsshole,https://www.reddit.com/r/AmItheAsshole/comments/1clxt18/aita_for_not_putting_off_school_to_take_in_my/,5,2024
1cv9vho,AITA for making my sister-in-law pay for a professional cleaning service after she cooked in my kitchen?,"Last week, I invited my sister-in-law, who loves cooking, to stay with us. She offered to cook dinner as a way to show her gratitude. However, I have a meticulously organized and spotless kitchen due to my severe anxiety around mess and disorder, something that my family is well aware of.

Despite this, after she cooked, the kitchen was left in what I would consider a disastrous state—spills on the counter, pots not cleaned properly, and utensils misplaced. It took me hours just to calm down after seeing the mess. The next day, I calmly explained how distressed it made me feel and asked if she could cover the cost of a professional cleaning service to restore it to its original condition.

She was shocked and upset by my request, arguing that she had already contributed by buying groceries and spending her evening cooking for us. My husband thinks I was too harsh and should have cleaned it myself or let it go this time. This has caused tension between us and his sister.

So Reddit, AITA for insisting she pays for the cleaning service knowing my issues with anxiety and cleanliness?",Guilty_Discount_5535,3568,0.8299999833106995,1271,1716073599,2024-05-18 18:06:39,AmItheAsshole,https://www.reddit.com/r/AmItheAsshole/comments/1cv9vho/aita_for_making_my_sisterinlaw_pay_for_a/,5,2024
1cp1h69,AITA for not wanting to walk her down the aisle or lie in a speech?,"I (41M) have two kids with my ex wife, (42F) a son John(22) and daughter Sally (20), I'm remarried to my wife (28). I'm very close with my kids, my son is engaged to Abbie, she seems nice but has been a bit pushy trying to create relationships with me and my wife, though she's also awkward with her. Abbie isn't close to her family, she told us many stories why and while some of her complaints don't seem awful, it's not my place to judge and I didn't live it so I can't know anyway. 

We've tried to be welcoming but Abbie has forced her way into some family traditions where she wouldn't have been invited, and some where no one outside of specific family would have. She has been calling Sally ""sis"" since they were only dating a few months, has an odd sister/mother-in-law thing she does with my wife, and the one I'm not a fan of, wants me to be like father to her. Not because we've clicked or anything. We are very different people, not saying that in a bad way, just saying it's not based on how we get along or anything. 

My kids and I have a tradition when they come over that we have a private catch-up in my office/study before they leave, which is now even more important to them because while they both get along well with my wife they don't want to have personal conversations around her yet. Abbie asked if we could talk, and after I explained the tradition John later asked that I do it, saying she'd never had a caring conversation with her dad. We compromised that I didn't include her in the tradition but do join the two of them for coffee and let her talk. Then she started calling me dad, they werent even engaged yet, John pulled me aside and begged me to give her that, laid this whole thing on me about me always being the dad she always wanted right in front of her and she just wanted that, told me she cried watching me and Sally together (she still gives me random hugs, I'm a lucky dad). I didn't like it but I do feel bad so fine I gave her that. She wants me to walk her down the aisle and the father/daughter dance. I don't want to walk her down, and I walk with a cane so dancing is hard. At my own wedding I only danced twice. John is begging for me to do one, preferably the aisle. 

They came over Sunday, John and I were talking, I thought to address it, when Ab walked in without knocking, asking if he'd told me yet. I asked what, John said she wanted me to say something about having a second daughter now in my speech and how I loved her. I just looked at him. She asked if I'd do the walk and dance for Sally, I said of course. She yelled she's my daughter too and I said it will never be the same, Sally is my actual daughter. I tried to explain I'd talk about her being a happy addition to the family and I love how happy she makes Jack, which i thought was a good compromise, but she started crying. John apologized and they left, but he called me when they were home nearly begging me to. AITA because I won't lie and say I love her or she's my daughter.",GreatestThrow-man,3251,0.9200000166893005,1210,1715378443,2024-05-10 17:00:43,AmItheAsshole,https://www.reddit.com/r/AmItheAsshole/comments/1cp1h69/aita_for_not_wanting_to_walk_her_down_the_aisle/,5,2024
1cob8oh,AITA for accepting a part in a play even though my boyfriend doesn't approve?,"I (16, F) have been a part of my school's theater company since I was in middle school. Theater means a lot to me, and it's given me a community of silly, talented, amazing people that make up my core friend group. While they would get all the leads for each show (both at our school and local community theaters), I never got anything higher than an ensemble part or a part with a few lines, and it always hurt me a lot because I would feel excluded. I've never let myself feel too discouraged by this, and I've been able to do a lot of behind-the-scenes stuff for shows I'm not a huge part of, like building sets, making props, and directing. This would always be super fun, but never as fun as being onstage and being a part of all the inside jokes my other friends would bring up outside of rehearsals (and this only added to me feeling excluded).

Anyway, me and my friends all auditioned for a local teen production of Little Shop of Horrors last week, with four of us (including me) all auditioning for Audrey. We audition, and I think I do pretty well, but part of me knows I won't get the part. Well, yesterday, the cast list came out, and to my surprise, I GOT AUDREY!! I'm so excited and still buzzing over the fact that I finally have a lead, and one of my dream roles no less. All of my friends were extremely supportive and there was no tension among any of us over the results of the cast list, so I accepted the part right away before dancing around my room and going out for ice cream with my friends. 

When I got back, I texted my boyfriend of a year (17, M) about the news, expecting congratulations and excitement (since he knows how big of a deal finally getting a lead is for me), but instead, he told me I should reject the part because I'd have to kiss the guy playing Seymour, and also generally act romantically around him onstage, and that makes him uncomfortable. The guy playing Seymour is one of my close friends I've known since 7th grade, and our relationship has always been purely platonic (he also has a boyfriend of his own). I can see how my boyfriend would be uncomfortable since I'd be acting romantically with someone who isn't him, and with someone I'm pretty close to. I told him I already accepted my part and he left me on read, and I don't really know how I'm feeling at the moment. I'm hurt because he hasn't congratulated me, but I feel bad for potentially hurting him and accepting the part without talking to him about how it would affect our relationship. AITA for accepting the part?",TheatreKiddo24601,3244,0.9399999976158142,1628,1715297246,2024-05-09 18:27:26,AmItheAsshole,https://www.reddit.com/r/AmItheAsshole/comments/1cob8oh/aita_for_accepting_a_part_in_a_play_even_though/,5,2024
1cqljhp,AITA for refusing to wear the dress my mother-in-law bought me?,"About 2 weeks ago was my brother-in-law's wedding and they were VERY clear that it was a formal event and they wanted everyone dressed nicely. My MIL told me that the dress I planned to wear wasn't formal enough and offered to buy me one that would fit the occasion better since I don't exactly have the money to buy myself a fancy dress right now. Let me be clear that I LOVE my MIL and I was very grateful for her offer. I sent her a link to a dress that I liked and she agreed to order it and have it shipped to me. 

The dress came the other day and it's NOT the one I asked for. It's nice, but its not what I wanted. Its a completely different cut and color from what I asked her to get. Even though it's a nice dress I hated the way it looked on me, so I just wore the dress I was originally planning to wear. It didn't perfectly fit the dress code but I figured it was close enough. Apparently not because the moment my MIL saw me she was asking why I wore it instead of the dress she bought me. She was very upset at me for not wearing the other dress considering she paid for it (which I understand but it still wasn't what I asked for).

When I told her it was the wrong dress she said that she ordered a different one on purpose because she thought it would ""fit me better"". Which it didn't because it looked awful on me. She also said the one I sent her was a bit pricey, but she's not exactly living paycheck to paycheck, she has the money for it. She let it go after a while but I'm starting to feel bad for it. I wasted her money and looking back what I wore did stick out a bit. Nobody has mentioned it since but I'm still wondering, AITA?",throwawayfornowidk,3137,0.9300000071525574,803,1715557789,2024-05-12 18:49:49,AmItheAsshole,https://www.reddit.com/r/AmItheAsshole/comments/1cqljhp/aita_for_refusing_to_wear_the_dress_my/,5,2024
1ci0153,AITA for thinking each of my kids getting their own room is more important than my new husband having 3 to himself?,"My new husband and I agreed before we scheduled our wedding that, even though space would be tight, we would lIve in his house. We have a master bedroom & a second bedroom upstairs, a main floor office/bedroom, and a finished basement with a legal bedroom, a second good- size room, and a storage room. Each floor has a full bathroom. We have 3 children who live with us, 17, 14 & 12. They are all mine, his are all out of the house. We decided to give the basement bedroom to the 17, upstairs second bedroom to the 14, and the office to the 12. That would leave the second room and storage room in the basement for my husband's exclusive use for his activities- magic & writing. WE ALL 5 AGREED TO THIS. 

We married in December and moved in towards the end of March. He was nowhere near ready (chronically late), but I had a tenant moving into my home and we had to leave it. Now we've been here a month (with a box or two & a suitcase each, most the rest is in a storage unit or was sold/donated/tossed) and my husband just decided he writes best in the office, so the 12 & 14 year- olds will have to share a room. I think he's being selfish, he could easily write in his magic room, which he has to himself. As a compromise, my 12 said he could have his office and give the her the storage room instead (I'm sure I could fix it up nice for her!). He says no, he needs all 3 rooms to be able to write and do magic. He & I have dated/been married for almost 6 years now and he's maybe used each room 5 times. He's disabled but wants to try to make some money on the side as a magician (he's great & he was an outstanding magician in his youth, so this may be possible). I just don't think he requires 3 tooms of the house to do this, that 2 should be sufficient. 
The only other 2 rooms in the house are the kitchen (my husband also cooks and has every gadget and ingredient, so there isn't always a place to sit in there...) and the living/dining room (one room). My husband spends most of his time watching tv or researching magic tricks in the living/dining, so the kids can't really hang out in there, either. So the only place they have where they can choose what they do or have alone time is their room. 
I am paying half the mortgage, all the food, and for everything the kids or I need. He pays the other half the mortgage, gas/electric, and for everything he needs. If he has a show (he did one last fall) we ALL help (making things, set up, tear down) and I invest $4 figures in it. So we feel like we're being supportive.
I think each kid should get their own room, AS WAS AGREED to before we got married. And my husband should make it work with 2 rooms instead of 3. AITA?",SpaceWitchEnthusiast,2845,0.9599999785423279,971,1714604323,2024-05-01 17:58:43,AmItheAsshole,https://www.reddit.com/r/AmItheAsshole/comments/1ci0153/aita_for_thinking_each_of_my_kids_getting_their/,5,2024
1d4gqm8,AITA for telling my mom I don’t want to care for her kids ,"AITA for not wanting to care for my siblings

I (20f) have a sister (16f) and two half siblings from our mom’s new marriage (3m) and an infant sister. My mom insists on my help with the youngest siblings, constantly, without notice. She wants me to babysit, or feed them, or give them baths. Most of the time it’s fine, but sometimes it’s overboard. For context in my reactions: I have autism, high functioning/ Asperger’s.

The situation: Today she asked me to give them baths, I did. It was hard because of my sensory issues and the fact they were both screaming bloody murder in my ear over wanting my mom to give them baths instead. It was okay though, I pushed through, got them dressed through the screaming. Then I left them in the living room with her and started to go back to my room. She asked if I could hold the baby a little longer. I did, but she was screaming and crying still, so it was hard. The only time she’d calm down was if my mom held her, and she didn’t want to because she was getting ready to leave for an AA meeting. At this point I was extremely overstimulated. I was standing sort of rigid, but still holding the baby acceptably, I thought. She began to yell at me, saying I wasn’t holding her with the right body language, and if I held her “like I cared about her” she wouldn’t cry. I told her she’s probably crying because she wants to be held by her mom, separation anxiety, because no matter how much I coddled her before, she still cried. This is a consistent thing that’s happened since my sister started going to daycare. Maybe I am a bit rigid after being screamed at, but still I don’t feel like my body language was the issue. My mom eventually got fed up and told me to put her in the feeding chair, so I did and started to walk back to my room. She then started to rant on about how she still needs my help with watching them longer and how I don’t care about my brother and sister. She said she shouldn’t have to ask for help. It didn’t even occur to me that it was assumed for me to stick around and watch them because their father is home. All she asked was that I give them a bath, then hold the baby, and I did that. This escalated into an argument in which I told her that her children aren’t my responsibility, especially not at 20 years old, and while I don’t have a problem helping out sometimes, I’m not her employee and both can’t (because of autism) and won’t (because I wouldn’t want to if I could) predict what she wants from me in order to wait on her hand and foot.

I do live at home for free, so it could be entitled of me to be so averse to helping her with them. I do other things, I’m the only one in the house who cleans regularly (every other day) and that’s easy for me as it doesn’t involve any crazy variables & never changes. But I do not want to help with my siblings the amount she wants.",kydism,2767,0.9599999785423279,295,1717109587,2024-05-30 17:53:07,AmItheAsshole,https://www.reddit.com/r/AmItheAsshole/comments/1d4gqm8/aita_for_telling_my_mom_i_dont_want_to_care_for/,5,2024
1cva3j9,AITA for not moving my wedding date? *UPDATE*,"Hey everyone! It's been a while (I forgot my password), but a few people asked for updates on how my last post turned out. Unfortunately, a lot of you may not like the answer. 

Almost all of you said not to change the date, and to enjoy my time without them there. I followed half of that advice. I eventually did relent to my family and change the date of the wedding. My fiancé (now husband!) said that the date wasn't as important as my happiness, and the fighting with my parents was destroying that. Now after six months, we both wish we hadn't because it was useless.

They still didn't show up. Not only that, but they convinced 90% of my family not to show up either. I ended up with only four relatives there in a crowd of about 100 guests.

My mother claimed that I had been ""excluding her from planning"" (by scheduling venue tours on days that my fiance and I were both free but I didn't realize she was working, and by finding my dress by surprise on a ""just here to look"" trip without her being there). They hadn't shown any interest in planning, so I mainly didn't want to bother them. To them, this was ""clearly a sign that you don't want us there"". So they went out of town on the new date.

In the end, narcissist mother still got her yoga, I still moved my date, and I still walked myself down the aisle.

But my petty self did, in fact, strike back. I had an amazing time, and I made sure that I left obvious empty seats marked for them and told everyone the truth with a smile when they asked. The few family members that did show are now no longer speaking to them either, as are all of the friends who came. The only exception is my brother (who I'm pretty sure they asked to relay the details of the party to them), and even he has almost entirely cut them out due to how they've acted.

I haven't spoken to my mother since about a month before the wedding, when she told me to get all of my old things out of her house. I speak to my father very rarely, and only over things like deaths in the family. My in-laws have basically taken me in as their own, and I'm far happier than I ever was in the nightmare of a family I grew up with. Life is good.

TLDR: moved the date of the wedding so mom could go to yoga, parents still didn't show, had a better day without them than I would have with them there, finally cut contact with those narcissists",friendlylocalnpc,2730,0.9700000286102295,120,1716074271,2024-05-18 18:17:51,AmItheAsshole,https://www.reddit.com/r/AmItheAsshole/comments/1cva3j9/aita_for_not_moving_my_wedding_date_update/,5,2024
1clw8w7,AITA for not wanting to attend my brother’s wedding because and for calling my SIL rules stupid? ,"Im 27F dentist and my brother 32M and his soon wife 27F are getting married in less than 2 months. Let’s call my SIL Abby. Abby and I never had a relationship of our own. We definitely don’t hate each other but we are not besties. We just exist in each others presence.
I noticed that in the invitation to their weeding that Abby requested the dress code to be all women in the wedding to wear off the shoulder dresses, suits or anything just off the shoulder. Doesn’t matter the color or the sequence unless it is off the shoulder.

Now as I said I am a dentist and as many people already know dentists may not have the best back/shoulder posture ever. And Im not an exception and I always tend to wear outfits that do not emphasize that part of my body.  Now the type of clothing this dress code demands needs someone with a good back posture because that’s the emphasis. I totally lack that and yes I did try one dress of the shoulder on looked absolutely horrendous.

So I asked if I the dress code is really that important and if I have to abide it but my brother told me Abby stressed on this dress code so much. And Abby was like if she “leeways” me she has to leeway everyone (I was kinda baffled that so much importance was placed on a certain type of clothing with no explanation given) 

I went with my friend shopping hoping I’d find one that I looked not so clownery in. I tried on so many different fits, looked like shit in all of them. So I told my mother since they are so attached to that dress code then I think the best option here for me is to not go. So I wouldn’t ruin their organization and I wouldn’t have nightmares about how awful I looked in that event. But my mum got mad at me and said Im being dramatic for not wanting to be there for brother and family just for a dress. I told her I want to attend but I also want to look good and feel pretty and they are sticking to such a stupid rule that they can’t provide a meaning. Regardless I respected that and decided not to ruin their image of how they want their wedding. My mum said my absence will also ruin things because the guests will wonder why the sister is not attending when Im healthy. I told her well the guests will also wonder why I look like I could be the guy of hunchback Notre Dam (okay Im not that bad but you get the gist here) My mum is still mad at me (haven’t told my brother and SIL yet)",Useful_Flower2687,2607,0.8899999856948853,2034,1715034868,2024-05-06 17:34:28,AmItheAsshole,https://www.reddit.com/r/AmItheAsshole/comments/1clw8w7/aita_for_not_wanting_to_attend_my_brothers/,5,2024
