post_id,title,text,author,score,upvote_ratio,num_comments,created_utc,created_datetime,subreddit,permalink,month,year
1cl4gmd,AITA for not treating my step daughter like my daughter?,"Iam 38F married to my husband 42M. Back when I was 16 I gave birth to my daughter, Mary, dad deadbeat but we’re fine now anyways. I started business in my early 20s and now Im considerably wealthy. My husband has a daughter, jane, who’s only 1 year older than Mary. We got married 2 years ago and one of our main “aims” with this marriage was to have a nice accompany as we both had almost the same experience with love/sex/birth as his ex left him with Jane just like my ex left me with Mary. However,Im objectively wealthier than my husband, he’s not poor , I just make more money and finances never been a main topic to us both thankfully. 

Now Mary works in a certain institution and makes her own money and pays her own bills. But I also like to spoil her with money and luxury and we travel alot together sometimes I give her money to travel alone. Like she’s fine on her own financially but I give her always. Also Mary has a boyfriend he’s somewhat well off and always pays for their dates so Mary wanted to surprise him on his birthday but her plans were kind off above budget so I paid the rest. 

Everything was fine until  Jane called me saying she wants me to give her 2K for her and her friends to travel for a little vacation. I told her 2K for a vacation is alot I can help her with sone but she then brought up everything I get and pay for Mary and never her. I told her because Mary has no one but me, as my husband doesn’t contribute anything to Mary so obviously I’ll direct my efforts to her and she also work she doesn’t just depend on me. Let’s just say that phone call wasn’t the nicest. 

I know the whole perception of if you marry someone with kids then they’re your kids too, sure Jane is not a kid she was 21 when I got married to her father. So that’s why it was never logical for me to become her mother just like she never tried to become my daughter just like my husband never tried to be Mary’s father. This family started with all adults and I never try to separate Jane and her father nor get between them. Not that I have a problem with giving Jane money in general, it was her entitlement in demanding the money.",Tricky-Plan-4762,2585,0.9200000166893005,858,1714951055,2024-05-05 18:17:35,AmItheAsshole,https://www.reddit.com/r/AmItheAsshole/comments/1cl4gmd/aita_for_not_treating_my_step_daughter_like_my/,5,2024
1cw1rrj,AITA for being uncomfortable with my wife's band posters?,"I (31m) have been married to my wife (30f) for 5 years now. I love her so much, and I am so incredibly lucky to be married to her, but there is one thing that really bothers me.

She has always been a huge fan of a lot of rock bands, particularly emo bands. This by itself doesn't bother me at all, in fact I love the music too and we go to concerts together all the time. What bothers me is that she has posters of these bands tacked up everywhere around our house. Our bedroom walls are COVERED in them. And I mean covered. There is not a single inch of wall space in our bedroom that is not dedicated to her band posters. Everywhere I go, everything I do, therd are always eyes of a hundred emo men following me around. It sounds stupid, and it probably is to be honest, but I don't think I can stand another night's sleep feeling like I am being watched constantly. I don't want to be ""watched"" by the members of My Chemical Romance or Taking Back Sunday or 21 pilots as we make love. 

I've tried asking her nicely to move some of them and she gets really offended and mad at me so I just left it behind. But it's getting hard to handle.

AITA?",OddIssue91,2516,0.9599999785423279,620,1716162071,2024-05-19 18:41:11,AmItheAsshole,https://www.reddit.com/r/AmItheAsshole/comments/1cw1rrj/aita_for_being_uncomfortable_with_my_wifes_band/,5,2024
1ci13ea,AITA for refusing to knit a blanket for my new grandson even though I’ve made them for my other grandchildren?,"I 53F am married to my husband Dan 59M. Dan has 2 kids Jack 35M and Adam 31M with his ex and I have two kids 29M and 27F with my ex. As a blended family, our kids have all been supportive and they were all out the house by the time we started dating so they didn’t care. 

All of our kids have children, so for all my grandchildren I have knitted a blanket for when my grandkids first leave the hospital, which has been a tradition since I made the first one. 

Adam has recently introduced us to Kate 30F, his coworker. Kate was married and Adam was dating Sarah 33F, who at the time was pregnant with my grandson (Adam and Sarah’s second baby), when Kate and Adam started their affair. Kate realised she was pregnant so she got a divorce and Adam broke up with Sarah. Adam and Kate’s relationship has not gone down well with anyone, with Dan and Jack  refusing to see Kate or Adam. Dan’s ex cheated on him which is still a sore topic for Dan and Jack as he remembers his mom and why they have especially struggled. 

Through this, I have maintained a relationship with Sarah who is really struggling. Her family haven’t spoken to her since she had my granddaughter Annie 3F without being married. Adam didn’t go to a single appointment for Sarah and instead I have gone with her which has created a rift between me and Adam as I refuse to go with Kate.

The blankets I make are very intricate, and take months to make as I make them slowly. I decided to only make one for Sarah’s baby and not Kate’s, Adam never asked for a blanket so I assumed he understood I was not making him and Kate one. I maintain a civil relationship with Adam but I am also upset at how he treated Sarah, and how he now ignores her and their baby.

Sarah recently had her baby and I was with her whilst she was in labour. I gave her the blanket and she posted her baby’s hand and the blanket on her social media. Adam has contacted me to say Kate is infested in having a blanket for their baby and he told me how much it would mean to them as Kate has no family and they ant their child to be part of the family and think that we will all come around later.

I am on the fence, I am angry for Sarah and her baby but Adam is family and I don’t want to make rash decisions that can cause more drama in the family especially as Adam’s and Sarah’s two kids are involved, with Annie old enough to understand the dynamics.

 ",InternationalDig1466,2340,0.9599999785423279,618,1714607115,2024-05-01 18:45:15,AmItheAsshole,https://www.reddit.com/r/AmItheAsshole/comments/1ci13ea/aita_for_refusing_to_knit_a_blanket_for_my_new/,5,2024
1cp3df4,AITA for not giving my sister any of my money even though I am in a significantly better financial situation?,"My (26F) sister (32F) ""Bethy"" and I are both stay-at-home moms. I have 1F twins; she has three sons, 6M, 4M, and 2M.

My husband, Micheal, is a master plumber who makes excellent money; he owns his own business, and I couldn't be prouder of him. I used to be a librarian; I have my MLS and bachelor's in Education. During the birth of our girls, on the way to the hospital in the ambulance, we hit a speed bump, and I was injured. I am now an ambulatory wheelchair user and attend physical therapy, as I am learning to walk again. I hurt from my hips down, but my babies are worth it. We decided I would be a SAHM after my first surgery, and my husband gives me $3000/month to use how I want to, as ""payment for being such a good mom"" We are extraordinarily blessed financially, and I'm happy being able to see my girls growing up.

Bethy's husband, Jackson, is an elementary school teacher, but teaching doesn't pay much in our state. Bethy has been a SAHM for the entirety of her marriage and is used to having to scrimp and save for things.

She asked me out for coffee recently and I accepted. I was chatting with her when I mentioned that our girls would start baby swim classes soon. I was happy the pool was wheelchair accessible. Bethy started ranting about how expensive swimming lessons are and how she could never afford to put her boys in swimming. I said I was also excited about playgroup this week, as I had been nervous to go the first time we had gone because none of the other moms and dads in the group used mobility aids. When I mentioned the name of the playgroup I go to with my girls, Bethy became angry because it's one of the more expensive playgroups.

She was angry because ""I knew money was tight."" and ""I didn't even think to invite her and Jackson's son because then she wouldn't have to pay for daycare. She then asked if my husband gave me an allowance. She was a bit angry, and people were starting to stare, so I said yes and asked her to keep her voice down. She wondered how much it was, and I told her. She asked if I could give it to her, and I told her no because I like to treat myself after my physio appointments, and I want to save as much as possible for a rainy day fund.

Bethy said she and her husband have nothing but rainy days and left the restaurant without paying. I feel embarrassed and ashamed that I'm not helping her when I know I could. Still, when I asked Micheal he said that my sister could get a job and reminded me that I became a SAHM because it was something we agreed we were financially stable enough to do as well as because of my mobility limitations. He also said I deserve nice things and shouldn't have to give them up just because my sister wants me to.

I feel conflicted, AITA? If more people think I am, I'll consider giving her the monthly payment; I feel guilty for not helping.",SAHMAITAThrowRA,2275,0.9399999976158142,658,1715383471,2024-05-10 18:24:31,AmItheAsshole,https://www.reddit.com/r/AmItheAsshole/comments/1cp3df4/aita_for_not_giving_my_sister_any_of_my_money/,5,2024
1cycxbk,AITA for not letting my FIL into the apartment?,[removed],milkywhitetofu,2036,0.9700000286102295,254,1716416016,2024-05-22 17:13:36,AmItheAsshole,https://www.reddit.com/r/AmItheAsshole/comments/1cycxbk/aita_for_not_letting_my_fil_into_the_apartment/,5,2024
1cpt7jl,AITA for revealing at a Dinner I am the one who makes more money?,"A little context for this post I (33F) have been dating my Partner (34M) casually for 3 years and 8 months. Over the last 8 months we have gotten more serious. He works in IT and as I ""Only"" work behind a bar in a strip club he seemed to always assume I make much less than him, he'd always say that he never wanted us to discuss money as he didn't want me to feel embarrassed so I never brought it up as I didn't care even if I found it a bit funny despite the fact I own both my car and home while he is renting and paying off his car.

I like him though so I brushed it aside figuring if we ever moved in together then we could talk about our finances and be open about it. Despite him thinking I only work behind the bar, I am actually a Mixologist at a high end Strip Club, so on top of a very generous salary I actually make amazing tips most nights too, i've worked at the same place for 9 years and I love it there.

As things are getting more serious he wanted me to meet his parents and I agreed, yesterday we had dinner with his parents and they clearly didn't approve of me and during the dinner his Mother brought up that she didn't think this was a good idea but if he was insisting on doing this when we got married we'd need to have a prenuptial agreement to protect her son. I was silent waiting for my partner to say anything but he didn't. He just continued to eat and I got annoyed before agreeing with her. I told her I fully agreed that we needed a Prenup as i'd need to protect my assets, this led to some laughs from around the table and I finally asked my boyfriend how much he made, he tried to brush it off before finally revealing he made £25,000 a year and telling me it was fine and not to feel less.

I won't lie I burst into laughter right there at the table not caring that I was being rude and bluntly told him not including my tips I make £43,291 a year they didn't believe me so I began to point out how I go on holiday twice a year, how I own my home and car while he rents and is paying off, how I always bought him nice gifts. I then told him for perhaps the hundredth time that i'm a Mixologist not a Bartender.

The dinner got silent and on the drive to my home he berated me the entire time for embarrassing him, and how could I have not told him I made that much money, that I should have told him from the start. I reminded him that he didn't want us to talk about money and I figured when and if we one day moved in together that we'd talk about our finances then. He kept talking about how I should have just privately told him after the dinner then and not embarrassed him in front of his parents but when I asked him then why he didn't defend me when his mother embarrassed me he had no answer.

I don't know i'm just super annoyed right now and feel done with this, was I wrong to reveal it the way I did?",MediumChart5892,1959,0.9399999976158142,747,1715467284,2024-05-11 17:41:24,AmItheAsshole,https://www.reddit.com/r/AmItheAsshole/comments/1cpt7jl/aita_for_revealing_at_a_dinner_i_am_the_one_who/,5,2024
1cnh0ai,AITA for say you are not my mother?,"My sister Lisa (24) had a baby six months ago. This was a problem for the family because my sister still lives with my parents. Only has worked part time restaurants jobs and the father and her never dated and he ghosted her.

My sister contacted me about her mother’s day gift and told me she wanted a iphone 15 max pro so she can capture the special moment with her baby. I told my sister she is not my mother and I am not the father of the child so I’m not getting her that.

She cried to my mom about how rude I was to her and how I don’t love her or my  nephew. My parents tried to convince me to go half with them on a phone to make it up to my sister and I said no. My mom also offered to get the new phone through her carrier and we could do monthly payments. I said no again stating my sister is not my responsibility.

My mom admitted that my parents and my sister have had some money issues because everything is up in price and I told my mom it took two people to make that baby so it’s time to get child support from the dad.

My mom called me an asshole for that and said she doesn’t even want to see me this weekend and I’m ok about it after this argument. I do not feel like any of this is my responsibility because I did not get my sister pregnant or act fake supportive of her stupid choices.",LumpyEvidence3168,1847,0.949999988079071,282,1715206340,2024-05-08 17:12:20,AmItheAsshole,https://www.reddit.com/r/AmItheAsshole/comments/1cnh0ai/aita_for_say_you_are_not_my_mother/,5,2024
1ctomq8,AITA for refusing to pay for my sister's expensive wedding even though I'm wealthy?,"I (35M) have a younger sister (29F) who is getting married in a few months. Our parents passed away years ago so it's just been the two of us. I'm fortunate to have a very high paying job and have done well for myself financially.  
  
My sister and her fiancé are planning a large, extravagant destination wedding and the costs are adding up to over $100k. They asked if I would be willing to pay for everything since 'I can easily afford it'. I told them no, that's an unreasonable request, and I'm not comfortable spending that much. I offered to give them $20k as a wedding gift instead.  
  
Well, my sister flipped out, called me selfish, and said I'm ruining her dream wedding. She said since our parents are gone, it's my duty as her only family to give her the perfect wedding. She's now refusing to talk to me until I agree to pay.  
  
I feel like I'm being fair by offering a generous $20k gift, which is more than enough to cover a nice wedding. AITA for refusing to fund her $100k dream wedding just because I'm wealthy? I love my sister but I feel like she's being a bridezilla and her request is totally unreasonable. Looking for some outside perspectives.",Old-Firefighter853,1765,0.9399999976158142,901,1715895346,2024-05-16 16:35:46,AmItheAsshole,https://www.reddit.com/r/AmItheAsshole/comments/1ctomq8/aita_for_refusing_to_pay_for_my_sisters_expensive/,5,2024
1cpsggj,AITA for asking my friends what flavor their wedding cake is?,"I (22f) am in the wedding party of my friends we will call Em(25f) and Roe(25m) who will be getting married in about 2 months. I have been really excited for the wedding since it'll be an opportunity for all the friends from college to get together for the first time in 2 years. Not to mention Em and Roe are my best friends, or at least I thought they were. 

We have a discord for all the wedding stuff and they have a channel about food. They've been really good about being open about the food they intend to have at the reception including vegan/vegitarian/gluten free options for everyone and answering questions so I didn't think there would be any contention if I asked a question. 

Anyway, about 4 days ago I posted a message into the discord asking ""Hey, what flavor is the cake gonna be? I wanna mentally prepare myself lol."" I think looking back my choice of extra words is what caused all this, but I meant it in the sense that I have a long documented dislike of chocolate flavored foods like cake or ice cream.  So I added it in the event the cake was chocolate. 

I recieved a private message back that the cake would be chocolate and that if I had a problem with it then I could ""shove it"" cause it was their wedding not mine. And i felt really taken aback by this response. 

Never did I mention that I would have been upset and I certainly wouldn't have put up a stink about it. Its exactly like Em had said, it's their wedding. I explained as much and tried to apologize for any offending I did but she got even more defensive and started basically blasting me for implying that she was offended and I was just left overall very confused. 

I gave it two days before I tried to apologize again and smooth it over figuring she may have just been having a bad day but I got shut down again telling me she didn't need my apology cause nothing was wrong and I needed time stop trying to make it seem like shit was wrong between us and to just drop it. 

I texted Roe to see if I could gauge what was going on since he and I have always had an open dialogue about things like this but he basically just told me he couldn't talk to me right now and I have to imagine its cause Em told him not to. 

Its been 2 days since then and I'm just really confused. This whole thing has made me want to drop out of the wedding party and honestly not go at all. I wish Roe would talk to me and Em would be honest. I can't help but think maybe I just don't get how stressful planning a wedding is and like maybe theyve gotten pushback from other people on other things and somehow its being taken out on me? Or is it really a big no no to ask stuff like this? I don't know? This is the first wedding i'll have ever gone to, so am I the asshole?",Scaredoflove11,1693,0.8299999833106995,1771,1715465102,2024-05-11 17:05:02,AmItheAsshole,https://www.reddit.com/r/AmItheAsshole/comments/1cpsggj/aita_for_asking_my_friends_what_flavor_their/,5,2024
1cwtc4p,WIBTA if I bought a car my wife couldn’t drive?,"WIBTA if I bought a car my wife can’t drive?

I need to buy a new car, and I would love to have a manual transmission. It’s my one non-negotiable. I grew up driving manual, and I miss it deeply. All of my cars have been inherited, so I’ve never had a say in my car’s features/specs. This will be the first car I’ve purchased for myself. Finally, I’m a “car guy.” I enjoy driving, and I’ve always wanted a sporty car, but also have it fit my needs.

My wife is 7 months pregnant and bought herself a new mid-size SUV last year (with her own money). She views cars as a way of getting from A to B, with practically and comfort.

Note: we have to park our cars back-to-front in our gravel driveway, with one car being in the garage. I will widen the driveway, which I can do it in a weekend, so we can park our cars side-by-side.

We have mostly separate finances, but have a joint CC and checking account, which we both contribute to monthly. The rest is our personal money that we keep in personal bank accounts (including separate savings and separate investments).

I’m paying the down payment and monthly payments on the new car. So I feel the decision is mine, but happy to listen to my wife’s thoughts (reciprocation from her car purchase). 

When I started the car buying process, I went with sport compacts (which are in my budget). Based on our prior discussions, the car has to be a daily commuter for me, allow me to take the kid(s) to/from Daycare, and quick local trips.

My wife thinks these cars are too small and cannot fit our needs with a baby and a potential second child. She says there’s not enough space for kids stuff (there is) and the backseats won’t fit two backward-facing car seats (they will). I’ve tried to show her my research, but she refused to watch the videos or read the articles I’ve bookmarked. 

Her main sticking point is she won’t be able to drive it because it’s a manual. She’s concerned she won’t be able to drive it when she’ll need to (in an emergency). I told her I’m happy to teach her manual, but at first she flat out refused to learn. Now she says she’ll learn, but gives an excuse of how we’ll be too busy. I said if it’s that important she drive the car, her mom can stay for a weekend to watch the baby and we can take a day for her to learn. Again, she said we won’t have time. 

Every time we discuss it, she accuses me of ignoring our family and that she needs to be able to drive the car. I say she’s creating a false dichotomy, and the car I want can fit our needs. I also argue that her car can be the big family car for trips or hauling, and my car can be for easy parking during city trips or sports events. Note: I don’t drink, so I will always be able to drive.

We’ve had many arguments over this. The most recent resulted in her giving me the cold shoulder for 2 days. I am at my wits end and ready to buy without her blessing. 

WIBTA if I ignored my wife’s objections and got the car I wanted?

Edit: I’m specifically looking at is a Honda Civic Si. We live walking distance to urgent care, CVS, and a grocery store. Our neighbor is a NICU nurse if shit really hits the fan. And we do “baby sit” my FIL’s SUV (he works/lives abroad), which we use on occasion, but we don’t know when he’ll be returning. So a third car is not an option for now

Edit 2: Classic RIP my inbox.
After parsing through this thread, there are separate issues at play that I’ve sorted out and here’s what I’ve gathered.

1. IWBTA for BUYING a car my wife can’t drive WITHOUT her blessing - yes, I fully acknowledge my timing of this is awful. I will postpone the purchase until after the baby arrives and I’ll get an automatic to ensure we both drive the car.

2. I’m not an asshole for WANTING a manual car and the model of car I want is reasonable. My wife could learn eventually, but that’s her choice. Again, my timing is terrible (which makes me the A-hole) so I’m going to get my “fun car” in a few years time. 

Clarifying point: I don’t want an SUV. They’re more expensive and I much prefer driving a car that’s not high up. I also think automotive companies have shoved a narrative down American’s throats that SUVs are the ONLY family friend options which is false. Literally just look at the rest of the world. ",penguin_trooper,1634,0.8700000047683716,2556,1716246751,2024-05-20 18:12:31,AmItheAsshole,https://www.reddit.com/r/AmItheAsshole/comments/1cwtc4p/wibta_if_i_bought_a_car_my_wife_couldnt_drive/,5,2024
