post_id,title,text,author,score,upvote_ratio,num_comments,created_utc,created_datetime,subreddit,permalink,month,year
1d578oc,"AITA for ""tricking"" my brother into selling me his half of our childhood home then demolishing it? ","My mom and dad divorced when I was young. My brother loved the fact that our mom had no rules for him so he went with her. I abided by the custody agreement because I had no choice in the matter. My mom loves us both but she dotes on my brother like he farts perfume. 

My dad kept the house. He had to buy my mom out. It was an old house built in 1953. It had old wiring and was really less than suitable for modern life. What it did have though was a huge yard that was great growing up. 

My dad passed away during COVID. He left everything equally between my brother and I. I wanted the house. I told my brother that we should tear it down and put in infill housing like that neighborhood is zoned for. He just wanted money. I bought out his half of the house at the market value. It was sold as a teardown. He took the money and bought a car and went on a vacation. He still has money left. 

Then I had the house demolished and built a fourplex. Each unit has three bedrooms, 2 and a half bathrooms, a small yard, and a garage. I kept one unit for myself  and rent each of the other units for $2,000 a month. My mortgage is $1,800 a month for the entire thing. So basically I live free and bank $4,000 a month. 

My brother is pissed that I didn't give him a unit to live in for him since it was his home too. I actually offered to sell him one at cost and he said no. 

I'm lost. I offered him a partnership, I paid a fair price, I offered to sell him a unit, I did everything to try and be fair. He thinks I tricked him because I get ""free"" money every month. 

Our mom said she would be cutting me out of her will and giving everything to him if I didn't give him a unit or the income from one. I agreed that was fair and said that I would no longer feel the need to contribute to her upkeep or retirement when the time came. 

I am being bombarded by the two of them but I took the risks. I took on the debt. This is my money now. ",KeyAwareness3064,17362,0.949999988079071,1398,1717192325,2024-05-31 16:52:05,AmItheAsshole,https://www.reddit.com/r/AmItheAsshole/comments/1d578oc/aita_for_tricking_my_brother_into_selling_me_his/,5,2024
1d2wc7d,AITA for repeatedly calling someone stupid after they accused me of lying about my children’s ethnicity?,"My husband is Dominican and I’m Irish. Our kids look like him in terms of facial features but they inherited my pale skin. Our son has his father’s dark hair but my daughter’s is borderline dark blonde. Genes are weird, what are you gonna do?

Both my kids and myself have my husband’s last name, which is a popular Dominican last name. There have been times we get looks when people hear our last name and my husband isn’t around. But it’s never been too bad and usually, I shrug it off.

Due to my husband’s work schedule, he’s rarely at school events. So, most people just know me. There’s another little girl in my daughter’s class with the same last name as us. Her mom also volunteers often. When we met, she flat out said “you’re not Dominican.” I said, “no. My husband and kids are.” She said “but your last name is (x)”. I said yeah…because it’s my husband’s. She pointed out how pale they are. I just said genes are weird.

But almost every time we see each other, she brings it up somehow. Making comments about how pale the kids are. Finding it weird they don’t know Spanish (my husband didn’t learn growing up so they don’t know it either). I just let it roll off because while it’s weird, I’m not about to get into a pissing contest.

The teacher asked the kids to make collages about their cultures. My daughter’s had stuff related to being a Dominican and stuff related to being Irish. They had a whole culture day where parents were invited. The mom of the other little girl saw my daughter’s collage and rolled her eyes, thankfully not in front of my daughter. There were no other kids around at the time as they were getting food. It was just parents looking at the collages. I asked what her problem is. She said I’m not a real Dominican. I said I never claimed to be. She said my kids aren’t either and that my husband is probably only a little Dominican and we’re claiming a culture that’s not ours.

I was dumbfounded. All I could ask was “are you stupid?” She said there was no need to be defensive. Finally, I had enough, pulled out my phone and showed her pictures of myself with my husband and the kids. She stared at it for a moment and mumbled an apology. I said “yeah, maybe research how genes work so you don’t make yourself look stupid in front of a bunch of 3rd graders”. She got teary eyed and walked away.

I got the stink eye from some other parents which I ignored. When I told my husband later, he said calling her stupid repeatedly, when she already apologized, was an asshole move. AITA?",Ok_Garage5055,13311,0.9700000286102295,555,1716934762,2024-05-28 17:19:22,AmItheAsshole,https://www.reddit.com/r/AmItheAsshole/comments/1d2wc7d/aita_for_repeatedly_calling_someone_stupid_after/,5,2024
1cnie84,AITA for evicting my brother and his family from the house I have inherited so my daughter can live there?,"I(40f) have a daughter ""Caroline"" (17f), my brother ""Adam"" (34m) is married and has 2 kids under the age of 5.

Back when I was in my twenties our great grandmother ended up with an illness which required someone to take care of her. This ended up being me as everyone else was busy with their lives and I have only recently graduated from uni back then. Due to this when she passed away I have inherited the house she lived in, which is a small 2 bedroom. I have lived there until I got married and me and my husband ended up moving to a bigger property. About a year later my brother asked if I'm willing to rent it out to him, which I agreed to do, but have warned him I will need it back when Caroline turns 18 (She was 3 at the time) since it is very close to universities and city center. Legal agreement was drafted for the rent (significantly below market value) so everything was followed by the book.

About a year ago I have informed my brother about needing the house back as my daughter is going to be 18 and I would like to have some repairs done before she moves in. My brother ignored me, so I have issued him notice to vacate, which was also ignored. As he continued to ignore me, I had no choice but apply for a court order to evict them, with hearing taking place last month. Last week him and his family were officially evicted. Upon getting into the house I have noticed it wad in horrible condition and it would take a few months just to make it somewhat habitable, let alone do redecorating or repairs.

I have raised this with my brother since he was meant to look after the house and let me know of any repairs, but this talk ended up in an argument where I was called an asshole for evicting him and his family so my ""spoiled"" daughter can live by herself and not giving them enough notice (they had just over a year to find something suitable). He also said I have inherited the house by ""cheating"". My parents are on his side since Adam and his family live with them.",AccomplishedMango209,11560,0.9599999785423279,908,1715209920,2024-05-08 18:12:00,AmItheAsshole,https://www.reddit.com/r/AmItheAsshole/comments/1cnie84/aita_for_evicting_my_brother_and_his_family_from/,5,2024
1cql5it,AITA for refusing to give someone an item out of my shopping cart? ,[removed],CarbonDallas55,9573,0.9399999976158142,1281,1715556606,2024-05-12 18:30:06,AmItheAsshole,https://www.reddit.com/r/AmItheAsshole/comments/1cql5it/aita_for_refusing_to_give_someone_an_item_out_of/,5,2024
1d240bm,AITA for asking our babysitter to set alarms when she sleeps?,"My wife and I(34) have three children ages 7, 4 a 9 month old. I work a demanding job(in the medical field) and work many many hours, my wife not so much but she does have night shifts often. We just got a new babysitter a few months ago after our one we had for 2 years moved for college.  Our new babysitter is only 16, but she had been babysitting one of my coworkers children for awhile and I trust him. 

A few nights ago my wife and I were both working nights and I saw on the camera that our babysitter was asleep on the couch and the baby had woken up was crying for almost 30 minutes while she slept. That bothered me, so without talking to my wife when I got home in the morning I had told my babysitter maybe she should set alarms throughout the night to make sure she’s awake since the baby monitor didn’t wake her and that it was not okay for her to leave the baby crying like that.

 I guess it hurt the kids feelings because she mentioned it to my wife and my wife is really upset with me because “she’s only 16” and what I was asking is unreasonable and that this has never happened before so again I’m being unreasonable and that I should’ve talked to her first because this could’ve been a “learning experience.” She also said I was completely out of line as well. I’m really not worried about a learning experience but am worried about the fact if my children are cared for properly. Aita?",One-Page5216,8202,0.8700000047683716,2077,1716848462,2024-05-27 17:21:02,AmItheAsshole,https://www.reddit.com/r/AmItheAsshole/comments/1d240bm/aita_for_asking_our_babysitter_to_set_alarms_when/,5,2024
1d25mhh,AITA for not accommodating someone because she never spoke up?,"I (28f) recently went out with a few friends and some of their friends. Eventually we were discussing where to get food. I suggested a few places like pizza, Chinese, sushi, Korean, etc. People gave opinions, like they were/weren't feeling XYZ or they have certain allergies. This one girl, Abbie, never spoke up even when I specifically asked her. I didn't know her well but wanted to include her, but she would just mumble and not give a definitive answer. Eventually we settled on korean food.

There were few people in the group who weren't too familiar with the food so I explained the menu. Everyone seemed to enjoy the food and I thought that was that.

Towards the end of the meal, Abbie started whining about the food. She didn't like this, she didn't like that, she was unfamiliar with the food, she couldn't even ""choose"" the restaurant. Few people reminded her that I specifically asked her where she wanted to eat and it was a group consensus. (Just for the record, I'm an introvert but can be very opinionated and can speak up for myself.)

I asked Abbie why she didn't speak up earlier and she responded she didn't want to upset anyone. My tone turned harsher and said ""well you could've said something earlier instead of whining and causing a scene now. Why bring it up at the end of it if you didn't want to cause trouble?""

Abbie's face turned red as she got up, paid, and left.

AITA for embarrassing her?",AppropriateRest3979,7087,0.9599999785423279,494,1716853049,2024-05-27 18:37:29,AmItheAsshole,https://www.reddit.com/r/AmItheAsshole/comments/1d25mhh/aita_for_not_accommodating_someone_because_she/,5,2024
1cit51q,AITA for not going to another restaurant after my boyfriend refused to order from where I stopped?,"Earlier today I asked my boyfriend to go with me to run some errands. When we finished I was hungry and picked a Mexican restaurant for lunch. It was more of an authentic place which I absolutely loved but my boyfriend said nothing looked appealing. He gave me money for my meal and said he was going to go to a place down the street. 10 minutes later he's back because the place had a really long wait
time.

I made some suggestions from the menu he would probably like to try but he said no. He said he told me last week he was burned out on Mexican food when we went out for dinner with my parents because 'we always eat it'. He didn't order anything that night either which was really embarrassing to have someone at the table not eating the entire time and trying to explain to my mother and step-dad in a way that didn't sound disrespectful. 

Service at this place was rather slow so I wound up taking most of my meal with me. He said to stop along the way to my place so he can get something to eat. I said no because he knew I had to be home by a certain time for a maintenance person and everything he wanted was in the opposite direction.

We got back to my place and he said he was going to go home because he was starving. I said he could stay and cook something here but he said no and that he needed space after I 'made him starve'. I told him he wouldn't be starving if he hadn't been picky and he left. He's still mad at me so AITA here?

ETA: No I am not Mexican but my stepdad is so I grew up eating it most my life. My stepdad picks where we choose to eat each week or he won't go, and they want all of us there each week or its a whole drama. I do cook other kinds of food sometimes. I do eat different food when I go to his home. When my boyfriend eats with me including our weekly meal with my parents it's only 3-4 days eating some kind of Mexican cuisine. I'll start asking him where he'd like to go when I drive.

The place he walked to was like 5 minutes away but he thought he wouldn't have time to wait for take-out since take-out was a 35 minute wait. Usually the sit down places I go to are pretty quick, like get your food 10-15 minutes after ordering. When we realized the place I chose was slow he didn't have time to go back or place an order online. I acknowledge that just picking the restaurant on a whim driving by it instead of asking if he wanted to stop for food was wrong of me. I'll pick up something I know he likes and take it to him at work for lunch.",crow_of_paradise,6425,0.8500000238418579,2689,1714689861,2024-05-02 17:44:21,AmItheAsshole,https://www.reddit.com/r/AmItheAsshole/comments/1cit51q/aita_for_not_going_to_another_restaurant_after_my/,5,2024
1cjlv3y,AITA for failing to stop my MIL buying ‘landfill’ for my kids at a funfair?,"
I went to a local funfair with my kids & mother in law (MIL).

We decided to walk around looking at all the rides before deciding what to go on. 

MIL had forgotten her wallet so it would be me buying any rides. (This let me relax about the sometimes tricky dynamic of who is paying for what.)

As we walked past a prize stall (pay money to win a prize), MIL commented in shock at the high price & I agreed.

At the next ride, my husband joined us. He & I were chatting when we noticed that MIL had gone back to the previous prize stall with the kids.

He asked urgently what I had agreed with her about that stall, & I (slightly confused at his urgency) remembered we had both thought it overpriced.

I knew she didn’t have money on her so I assumed they had just gone back to look.

We have disagreed with MIL many times about her excessive (in our view) gifts for the kids. Each visit she buys toys which soon get discarded, or more sweets & snacks than the kids can eat.

This is important to us because (a) we want to teach the kids moderation & value rather than excessive disposable expenditure, (b) we are worried about the environment & the excess of toys contributes to landfill, (c) while she has the right to use her money, the amount spent on this stuff feels wasteful when it could be used for more lasting things for the kids.

Back to the fun fair.

My husband insisted I tell him what I had “agreed” with MIL. We hadn’t agreed anything, I told him. We agreed it was priced too high?

I then noticed she had taken out her phone to pay using her contactless payment.

Husband said he didn’t want her buying it, & I said he should go tell her. He insisted he didn’t want to do that before finding out what I had agreed with her. 

I told him if he could see what was happening he should go & stop her.

By now it was finished & I said look it’s done now, it’s her money to spend & if she wants to have fun with the kids by spending £15 on a prize stall that’s up to her, & that I hadn’t “agreed” anything with her as I believed she had forgotten her wallet.

After we got home he picked a huge fight with me, telling me he was really distressed by the landfill of the prizes (the toys are already falling apart), & the repeated messages this kind of spending sends to the kids about the value of things. 

His main complaint at me is that when we first saw the stall before he joined us, he insists I should have told MIL not to buy it for the kids, & the facts that (a) I believed she had no means of paying & (b) had commented on how overpriced it was were not relevant, I still should explicitly have said that we didn’t want her to buy anything. 

I think this is unreasonable & would have made things really awkward at what was supposed to be a fun outing.

He says it’s my fault that MIL spent her money on poor quality prizes which will be landfill by next week.

Was it my fault?",ImaginaryMammoth8643,6408,0.949999988079071,1208,1714777570,2024-05-03 18:06:10,AmItheAsshole,https://www.reddit.com/r/AmItheAsshole/comments/1cjlv3y/aita_for_failing_to_stop_my_mil_buying_landfill/,5,2024
1cnhi4x,AITA for not getting my daughter anything for her birthday?,"My daughter turned 13 yesterday. I made sure to ask her what she wants for her birthday a few months in advance. She gave me a list. Great. I explained she won't be getting everything from the list as it was big and some things were expensive. She understood.

About a week after we had that conversation, she tells me she wants tickets to a show for her birthday. Going to the show would also mean traveling a little out of the city. Neither are cheap. So I told her that would be the only gift she would get and would also replace a party. She said that's what she wants and I triple checked before I booked tickets.

A couple of weeks ago, would you believe, she tells me she changed her mind again. She wants clothes instead of the show. I told her I already booked everything so there's absolutely no way. She got into a strop about it and said she isn't going. I told her fine I'll take someone else, fully expecting her to later apologize and say she is coming.

But the apology never came. In fact her attitude got worse and she got into trouble at school. She asked me if I got her the clothes and I told her no, I'm sticking to my word. I don't think she believed me. Well her birthday came and she realized I wasn't bluffing. I didn't get her any gifts. She was appalled and I was the worst mother ever. I told her she's learned a valuable lesson. I really wanted to make her birthday special but she was being awful. Of course other relatives got her things but none from me.

She told her grandparents her side of the story. Which was of course all one sided making her out as a victim. They called me and I explained to them the whole truth. They also think I'm awful and the ""poor girl"" needs gifts from her mother. I told them next year will be different if she behaves. 

AITA?

",Swimming_Cow_7876,6030,0.9399999976158142,1451,1715207560,2024-05-08 17:32:40,AmItheAsshole,https://www.reddit.com/r/AmItheAsshole/comments/1cnhi4x/aita_for_not_getting_my_daughter_anything_for_her/,5,2024
1cuhn0r,AITA for telling my girlfriend not to call my dad “doctor”?,"

My(28m) girlfriend recently got her doctorate. I’m obviously very happy for her and proud of her. 

Since then, she has been greeting my father as “Doctor” [lastname]. Although he does have a doctorate degree, no one has ever called him that, and he told me it makes him uncomfortable. 

I asked her to not call him that. She says that she wants to be polite and call him by his title. She now wants to be called doctor when might parents greet her as well. 

I understand it’s a massive accomplishment but I don’t think she should expect my parents to call her doctor? And she should not call my dad doctor if he asks her not to. 

She thinks I’m trying to downplay what she did but I’m not. 

AITA?",Old-Independence1862,5759,0.9599999785423279,1373,1715983499,2024-05-17 17:04:59,AmItheAsshole,https://www.reddit.com/r/AmItheAsshole/comments/1cuhn0r/aita_for_telling_my_girlfriend_not_to_call_my_dad/,5,2024
1cke3wt,AITA for having a bigger reaction to a strangers gift then my husbands?,"For Context: I 30F just had birthday, my husband got me 30 gifts to mark the event. Nothing big, just different little items. None of the items were anything I’d buy myself in particular. My husband has the habit of buying things he likes or finds cool but not really thinking of the other person. For example: one of the items was a nice set of colored pencils, I have a specific art style and only draw with black pens. Or a nice vase that is very specifically his style. 

However I was still extremely grateful and made sure he knew this. 

My sisters own a bar, so I go there and am around quite often. They have a regular who comes to the bar maybe 2 times a week for the last 2 years so I see him pretty frequently. I’d never seen him outside of the bar. We have a joke about how aliens are probably watching all of us and every once in a while throw crazy things at us just to see how it plays out. 

Anyways the other day we went in to have drinks for my birthday, the regular came and told me happy birthday and handed my a small pouch. In the pouch was 100 dollars and a small silver alien holding a diamond. Also a note that said, “I’m hoping the aliens give you everything you deserve.”

I started crying, it was just so thoughtful especially since I was expecting anything. I thanked him and gave a hug, he went about his way. My husband was acting strangely the rest of the night. When we got home I asked what was wrong and he told me that he was upset about the way I reacted to the gift. He said I didn’t act that way about his gift that he worked really hard on. He said that it was inappropriate for the regular to give me a gift. He said I was a AH for reacting that way especially in front of him. But it was just a natural reaction. He doesn’t want me to keep the gift. 

I feel really badly but I want to keep the gift. So AITA? 

Not a real diamond and he gives $100 to all the staff on their birthday. 

I just want to thank everyone for the responses, it gave me a lot to think on. I will say this an a man twice my age, I’m 99% sure he likes men and in no way it remotely flirtatious in my opinion. Also this was not a ring or piece of jewelry it’s just something you put on a desk. ",Throwawaygiftgiv3,5107,0.9599999785423279,566,1714866933,2024-05-04 18:55:33,AmItheAsshole,https://www.reddit.com/r/AmItheAsshole/comments/1cke3wt/aita_for_having_a_bigger_reaction_to_a_strangers/,5,2024
1chzcff,AITA for not paying my husband back for our daughters purchase?,"I'm not necessarily a stay at home mom but I do have our daughter everyday while I watch 2 other children (they are all 4) so I still make money and pay half the bills. 

I was in the room with my daughter while she was playing a video game, I was folding laundry. I was paying more attention to my laundry and my daughter went to the home screen and selected currency to purchase in a game. This was a 50$ purchase. My husband's card is connected, so he was charged, he gets the notification instantly that his card was charged and comes in the room asking what happened?

I didn't know, since I didn't see, and he explained the charge on his card and realize she made the purchase. He said it's fine, I'll just have to pay him back. I asked why, since it's also his child and he agreed to let her play and he didn't put pin protection on so that this wouldn't happen. He said ""you were the one watching her"". 

I don't think I should have to pay him back for this incident since it was an accident and she's 4 and I wouldn't expect him to pay me back either if the roles were reversed. he's still expecting payment back though. AITA for refusing to pay him back?",WideGuest433,4552,0.949999988079071,481,1714602570,2024-05-01 17:29:30,AmItheAsshole,https://www.reddit.com/r/AmItheAsshole/comments/1chzcff/aita_for_not_paying_my_husband_back_for_our/,5,2024
