post_id,title,text,author,score,upvote_ratio,num_comments,created_utc,created_datetime,subreddit,permalink,month,year
1lwow5n,"AITA for ""letting"" my sister go thirsty through an entire meal?","My sister does this thing where she'll just say something she wants with the expectation that someone will do it for her. For example, if she wants the AC turned on, instead of asking someone to turn it on for her, she'll keep repeating things like ""Oh, isn't it super warm in here?"", ""Does anyone else feel really hot?"" or ""I heard that today is a super hot day!"" and if someone asks her if she wants the AC on, she'll reply with ""No, no, I'm good! But if *you're* hot then you should turn it on!""   
  
Anyways, last weekend it was my birthday so my family and I went out to celebrate. During the meal, she kept making comments implying that she wanted another cocktail, but wouldn't order it. The waitress even came by and asked if we needed anything, but she didn't order a drink even when we all did. I could tell she was agitated at that point, but it was my birthday so I just ignored her. 

When we all got home, she got really snippy and said that it was super rude that we all got our own drinks and didn't order one for her. My brother and I brought up that she said no when the waitress asked, but she said that wasn't the issue. In her opinion, we should've known to order her a drink too because everyone else got one, and the fact that we ""let"" her go thirsty was inconsiderate. And that in the future we ought to order her drinks too. She also said that she was only saying ""no"" to the waitress because her family should've ""taken care of her"" (her words, not mine). 

The three of us have been kind of arguing back and forth about it, and I'm just tired of fighting, so I wanted to get some more opinions on whether or not I should've ordered her a drink as well. ",Proof_Strategy2442,19491,0.9200000166893005,3455,1752183150,2025-07-10 16:32:30,AmItheAsshole,https://www.reddit.com/r/AmItheAsshole/comments/1lwow5n/aita_for_letting_my_sister_go_thirsty_through_an/,7,2025
1lvxapt,AITA for refusing to punish my daughter after she blew up on the classclown that she dint want at her birthday party?,"My daughter is 12 and she goes to a small school. Her grade only has 18 students (10 boys and 8 girls). My daughter also has other friends from the sports she does. We plan to have her go to a much larger high school in the future. Her 13th birthday party was last weekend and I asked who she wanted to invite, she wanted to invite 7 of the girls from her class and 5 from her soccer team. The one girl she doesn't want to invite is name Kelly.

My daughter doesn't like Kelly, she is the class clown in her grade and my daughter hides her annoying and attention seeking. I asked her why she didn't want her there and her response was ""she ruins school for me all the time, I don't want her to ruin my birthday."" I agreed with her list and sent the invites out.

My ex-wife is invited to all her major milestone instead of us doing separate events. I learned an hour beofre the party my ex-wife sent an invte to Kelly since her mom found out about the party. My daughter was not happy to see her (it was a suprise for her), I told her to enjoy the party.

It was going well until the cake came out, my daughter wanted a glitter cake (when you blow out the candles glitter goes everywhere). While everyone was around the cake, Kelly took her fingers and swiped icing off the top layer of the cake. It ruined the cake and my daughter lost it. She yelled at Kelly, basically saying, "" what is wrong with you, this is why I didn't want you her and that you ruin everything."" She ran to her room after and Kelly was crying.

Kelly's parent is wanting an apolgy, my ex-wife wants her to apoligze as well. I am refusing to make her do that or punish her at all. I pointed out that my ex never should have invited her and to the mom that her child ruined the cake, and that at 12 years old should know better. They are calling me an ass and my daughter is just upset.,",Alarmed_Giraffe_5284,15876,0.9300000071525574,1304,1752102621,2025-07-09 18:10:21,AmItheAsshole,https://www.reddit.com/r/AmItheAsshole/comments/1lvxapt/aita_for_refusing_to_punish_my_daughter_after_she/,7,2025
1m52myo,AITA for telling my roommate's friend about my heritage?,"I 21F am half Mexican and half Chinese. My parents came to the US before I was born, but thought it was very important for me to learn their native languages and participate in both of their cultures. Because of this, I can speak Spanish and Mandarin. Both of my parents also loved cooking, so growing up we ate a lot of traditional Mexican and Chinese dishes as well as some blended fusion meals as well.

A few nights ago, I was cooking dinner at my apartment. I was making one of those fusion dishes, but I got stuck on a particular step, so I called my mom to ask for help and we talked in Spanish. I was on the phone when my roommate, Ann 23F, came home with her friends, who I was not told were coming over.

Later, one of the guys from the group came into the kitchen and asked what I was making because it smelled  good. I explained the dish was created by my parents to blend Mexican and Chinese cuisine. He then asked why I was speaking on the phone in Spanish earlier, so I told him that I’m half Mexican and half Chinese, and that I grew up speaking both Spanish and Mandarin with my parents. He seemed genuinely interested and asked me more about the languages and the cooking, so we ended up talking for a while about my background and how food and language are such a big part of my life.

The next day, I found out through my other roommate that Ann had told her I was showing off and flirting with her friend. This pissed me off because I wasn't trying to flirt with him and he was the one who started the conversation with me. I tried to talk to Ann about this, but she just seemed annoyed and told me that it was obvious how it looked and I should be more mindful when she has her friends over. I told her that I can't be ""mindful"" if she doesn't even warn me about having company over. She said that she doesn't have to get my permission to invite people to the apartment. I was getting irritated by this point so I let the conversation die down after this.

It's been so awkward ever since this happened and every time I see her she's short with me and barely acknowledges me. I'm starting to wonder if I behaved out of line. AITA?

EDIT: I posted the recipe to what I made on my profile since many of you were curious!",BeneficialCourse2856,12576,0.9300000071525574,1213,1753052068,2025-07-20 17:54:28,AmItheAsshole,https://www.reddit.com/r/AmItheAsshole/comments/1m52myo/aita_for_telling_my_roommates_friend_about_my/,7,2025
1lu69qb,"AITA for pulling my daughter from soccer camp and telling her that she can't see her ""ghetto"" friends anymore","Throwaway account

My daughter is in soccer camp twice a week since the beginning of the summer, she is 15. She has made two new friends and I do not like them. They have been over my home once and they were rude, loud, and obnoxious. They made a mess of the house, gave me attitude when I asked them to quiet down (one rolled her eyes and started arguing with me), they were blasting music, and money went missing ( I had 40 dollars on the counter and it disappeared). So I am not the biggest fan of them, and after that I didn't allow them to hangout at our home. My daughter was not a fan of this but still saw them at soccer camp.

The soccer camp is next to a plaza and they allow the kids to get food from the fast-food places. I got a call from the coach that my daughter and her two friends caused issues at Arby's. She recorded it on her phone, her two friends were heckling the fast food worker and left after causing a mess (dumped there drink all over the ground and flipped off the worker). My daughter was recording this and laughing along. TBH I found it disgusting.

I informed her that she is being pulled out of soccer camp because she can't behave by herself and that she won't be seeing those friend anymore. She was very unhappy and started an argument. She told me that I don't like them because they are ghetto and I told her she is correct. They are too ghetto, too loud, too rude, too disrespectful and I am not allowing her near them. She hasn't talked to me since. I shared this with my sister and she basically told me I forgot my roots and to let her see the friends.

Edit: for more contexts, I grew up in a horrible neighborhood and yeah that type of behavior was common where I grew up. Yes I do find that behavior  ghetto as hell

Also I am black, my daughter is mixed. Still think it is super ghetto",SoccerProblem3547,11922,0.9300000071525574,944,1751922895,2025-07-07 16:14:55,AmItheAsshole,https://www.reddit.com/r/AmItheAsshole/comments/1lu69qb/aita_for_pulling_my_daughter_from_soccer_camp_and/,7,2025
1ltfwg9,"AITA for telling my family if they don’t like the way something is, they can take care of it themselves?","I am married and have 3 kids, all are teens. My husband and I both work and my kids are in school and do sports or clubs after school. I recently hit a ceiling in my field and in order to continue to grow professionally, I had to get a graduate degree, so I started my masters degree. 

In the past, I usually did most of the chores. My husband does the typical “man” chores” my kids have some of their own chores like doing their own laundry, taking turns sweeping/vacuuming, cleaning their own bathroom, etc. I did a majority of the rest and all of the cooking. 

I am a year into my degree. At the start I was keeping up with the chores I did before, but it quickly wasn’t possible. I asked for help and was told “everything is fine, you’re being too picky”. But over time, my family seems to be getting fed up. 

They’ve been complaining about things a lot lately. From eating frozen meals (I make them myself in a large batch and freeze them for later), to the floors having stains (if you cleaned up skills, they wouldn’t be there!), the stairs have dust and pet fur on them, etc. If they bring it up, I tell them they are capable of handling it, but they just walk away and it doesn’t get done. I’m doing what I can, but between work, school, and everything else at home, it can’t all be done. We aren’t living in squalor, i just can’t get to the finer details like I could before. 

Yesterday my husband came to me while I was doing my homework and said the shower curtain liner in our bathroom was moldy. This pushed me over the edge. 

I had my family come into the living room and told them that if they don’t like how something is, they have able bodies and can deal with it themself. That they have the skills to clean, I have just been taking care of so much they didn’t see. Now I need them to step up. That they don’t like something, they need to step up and take care of it. And how I also plan to redistribute chores. 

My kids were arguing that they shouldn’t have to do more, they’re in school and busy afterwards. I told them that I don’t care, I am busy too! And I can’t do it all. That need to step up or shut up, in nicer terms. That night my husband told me I was too harsh and need to lighten up. He says I was rude and basically telling them their feelings don’t matter and I need to lay off of them. I told him the message wasn’t only for the kids, it was for him too. He needs to step up. 

But afterwards I started to doubt myself and felt too harsh. No one is really talking to me right now. I’m worrying now I was too harsh. I did change up the status quo in the house for my own personal reasons. 

So AITA for telling them if they see something they don’t like, they need to step up and take care of it and not complain about it?",TA_busywife,10993,0.949999988079071,1364,1751846334,2025-07-06 18:58:54,AmItheAsshole,https://www.reddit.com/r/AmItheAsshole/comments/1ltfwg9/aita_for_telling_my_family_if_they_dont_like_the/,7,2025
1m7m35l,AITA for forcing my diet on my boyfriend?,"I’m from France originally, and I moved to the states almost 2 years ago. Now for some reason, the food here makes me sick. Not in an “Ew, that’s gross.” Kind of way. But actually physically sick. My body seems to struggle to digest it. Whether it’s take out or fancy restaurant food. Either I can’t go to the bathroom for days, or I’m violently vomiting. I tried dealing with it for months and months, but I started losing weight very quickly because I couldn’t eat. I ended up developing a serious aversion to food, and my family recommended I go and speak to a specialist.

I had never had a problem back home, and I was terrified I was seriously ill. So I went to multiple doctors where I was poked and prodded and I had multiple tests done. They have all said nothing is wrong with me physically.

I spoke to a dietitian and he explained that my body is probably not used to the amount of salt and preservatives that is found in the food in the states. (Please don’t think I’m bashing the US! I love it here and it’s a great country.) My dietician recommended fresh and organic produce to see how my body coped, and to my delight, I improved.

I stopped vomiting and I was able to start slowly putting weight back on. I started making meals from scratch and meal prepping to save time throughout the week. My dad is actually a chef back home, so he was more than happy to send me some recipes to keep my diet interesting. I made a delicious vegetarian lasagna from scratch, and put it in the oven to cook. My boyfriend (American) came home after work and asked what was for dinner. I said I was making a veggie lasagna. He rolled his eyes and said he was sick of “that organic crap” and wanted a cheeseburger.

The comment hurt. I made a real effort at meal times to keep it varied so we’re not always eating the same thing. I said I couldn’t make one because I didn’t even have any burger buns. He said it was unfair to “make” him eat my diet. I had never realized he was opposed to it. He benefited from home cooked meals and I had seen that his clothes were fitting him better. He had more energy and he didn’t sleep so much on the weekends. I apologized and said I didn’t mean to make him feel forced.

AITA for forcing my diet on him?",Bluebiird95,9700,0.8500000238418579,2204,1753306754,2025-07-23 16:39:14,AmItheAsshole,https://www.reddit.com/r/AmItheAsshole/comments/1m7m35l/aita_for_forcing_my_diet_on_my_boyfriend/,7,2025
1m6rvvs,AITA For Pointing out my wife acted similar after my SIL's gender reveal?,"So, my wifes sister is pregnant. She had a gender reveal last Saturday. This is her second baby. Second baby is a boy, first kid is a girl. SIL was kind of disappointed (or surprised, I guess?) about having a boy but, I wouldn't say mad. My wife only has sisters so SIL probably didnt imagine herself raising a boy. 

So anyways right, on the ride back home, my wife was talking about how it was ""Weird""  her sister was so visibly disappointed when the blue came out, but like, she acted the same. She got over it after like a day (or a week) but she still was. We have two daughters, she was hoping for a boy and a girl. She was like, ""We're not talking about me though,"" and I said ""Just pointing it out"" and she responded ""You *always* do that though."" Kind of just admired the air for the rest of the car ride. 

AITA?",Diligent-Paper-861,9275,0.9300000071525574,1058,1753222484,2025-07-22 17:14:44,AmItheAsshole,https://www.reddit.com/r/AmItheAsshole/comments/1m6rvvs/aita_for_pointing_out_my_wife_acted_similar_after/,7,2025
1lwqser,"AITA for ""embarrassing"" my more fit coworker?","I am a camp counselor (25M) who works with elementary aged boys. To give some context, I am incredibly short and fat. Like, I am under 5 feet tall and around 200 pounds. This does not affect my ability to do my job. I'm just as active as any other counselor, I work with the kids just as much.I have to get blood tests done regularly for unrelated reasons (related to why I'm so short) and there's never really any concern when it comes to my cholesterol or insulin or anything weight related. I'm just saying this so you have some context for my general appearance and the fact that no, my weight doesn't affect my health or my level of activity.

My co-counselor is a guy around my age who is (I think) a baseball player. We could not look more different. He's got more than a foot of height on me and probably about the same weight, so he's obviously more visibly fit. He brags a lot about how even after we spend all day chasing kids in the sun, he still goes to the gym for a couple of hours. 

The issue is when it comes to actually having to use strength practically, I out do him every time. I'm not trying to do it intentionally. But when we have to carry 20 kids backpacks and he can only handle 8 while I have 12, or when he can't open a jar, or when we have to lug heavy equipment and he's huffing and puffing while I'm not having a problem, it becomes pretty evident that I am just stronger than him, at least for stuff like that. I'm sure he could out bench me or whatever proper fitness stuff is, and trust me he crushes me when we play sports with the kids, I'm just talking about that kind of work.

The issue is that the kids have started to pick up on the fact that I am the ""strong counselor"". If they want to be picked up or can't open something in their lunch or want a break from carrying their bag on a hike, they come to me. Apparently, my co-counselor complained to one of the other counselors that I am ""embarrassing"" him because a guy like me shouldn't be able to be stronger than him. That counselor then came to me and told me I should tone it done because it can be hard for someone who prides themself on being an athlete to be worse at something than a guy ""like me"". I said there was no way I was going to do my job worse just to protect hit ego, and the other counselor said I was being a jerk and as the summer goes on the boys might start bullying my co-counselor if they think he's weaker than me, which I don't think is going to happen but I'm not sure. 

AITA for not wanting to stop doing my job the way I'm doing it so that I don't hurt this guys feelings?",HunterTop9579,8948,0.949999988079071,562,1752187912,2025-07-10 17:51:52,AmItheAsshole,https://www.reddit.com/r/AmItheAsshole/comments/1lwqser/aita_for_embarrassing_my_more_fit_coworker/,7,2025
1mbtusi,AITA for not allowing Airbnb guests to use my patio,"I bought a flat as an immigrant a few years ago in a bad reputation street of a bad reputation city in a bad reputation country in Europe. 

I won't say that it was just luck, but the country became an attractive country to visit, the city developed a lot, and my street, being in the center, became very attractive to visitors. 

Now my street has been fully renovated and so has the façade of my building, because we got public funds for that. But the inside is still prewar grey because we are fine with it. 

My flat is the only one that opens to the courtyard and after speaking to the neighbours they were all enthusiastic for me to turn my corner of the courtyard into something pretty, on whichever way I felt. In this kind of buildings it is defined how much each apartment owns of the land, but not delimited. So I own, let's say, 5% of the land. Usually I would use it for a parking space but it is not like you have a delimited parking space and since I don't drive I asked the neighbours if I could take the corner next to my door as mine. This was a no parking space and everyone enthusiastically agreed to let me make a mini garden/patio. 

After the city and the street blew up with tourism someone did some legal trickery to buy the flats on top of mine that were supposed to be saved for low income people and turn them into Airbnb. We are not happy about it for many reasons, starting with those flats were supposed to be for actual low income people. 

But to the actual conflict: I let my neighbours use my patio, but I've been kicking Airbnb guests out of it. Apparently the Airbnb host posts pictures of my little corner of the courtyard as a public space. I don't think it's a public space since I own part of the land and the Airbnb owner does not, and it has been accepted that this is my portion of the land. 

Now the Airbnb owner is saying that he will sue me for discrimination since I share my little patio with the other neighbours but I don't allow tourists in it and he has had some negative reviews. 

I'm absolutely safe legally, but morally am I the asshole for not allowing tourists in my space when I let neighbours use it?",DisneyWitchyGirl,7453,0.9399999976158142,357,1753740221,2025-07-28 17:03:41,AmItheAsshole,https://www.reddit.com/r/AmItheAsshole/comments/1mbtusi/aita_for_not_allowing_airbnb_guests_to_use_my/,7,2025
1ltdxi1,AITA for telling my friend i don't want to end up like her after she told me to lower my standards?,"I (22F) met Rachel (23F) 3 years ago in university, and we became friends. For context, I have never dated before and I am ok with that, I don't purposefully seek out relationship and I am comfortable being by myself. I have a few close friends and this is enough for me. In contract, Rachel has had a lot of boyfriends, and doesn't like to be single (her words). She met her husband, Max, 2 years ago in one of the uni classes, and they quickly began dating. He isn't the most pleasant guy to be around imo, and they had quite a few big arguments during the relationship. He even tried to flirt with me, and I told Rachel about it, but she dismissed it saying he was probably just trying to butter me up so I help him with homework. He has told some sexist jokes in the past too. Whenever they fought, I always told Rachel she deserves better and to break up with him, but in the end they always made up. He proposed to her after one year, and they got married 4 months ago. However, after they moved in together (in the flat that Rachel's parents pay the rent for) Max became even worse. He never helps out with cleaning or cooking, doesn't really take Rachel out on dates anymore, and whenever she tries to talk to him about it, Max tells her to stop complaining about ""wife's duties"".

So, a few days ago Rachel asked me if I would like to go on a date with one of her friends from high school who is single and is looking for a relationship. I've never been on a date before, so I agreed out of curiosity. We went to a nice restaurant. The guy never asked me a single question about myself back, and after I got tired of coming up with questions about him, we just sat the rest of the meal in awkward silence. We split the bill, and after he walked me to the subway station, he tried to kiss me. I declined as politely as I could and went home.

The next day I met up with Rachel. Apparently she's already heard about how the date went from her friend. She asked me why I rejected him. I told her the reasons I mentioned before, and that I didn't really like the guy. Then she rolled her eyes and said that I need to lower my standards because I'm honestly not that attractive, that I blew maybe my only chance to date, and if I continue like that I'll end up forever alone. Even though she knows I'm fine without a relationship! Also I'm not insecure about my appearance, but hearing my friend say that about me hurt. I got angry and said ""Better to be forever alone than end up like you, with a husband that doesn't respect me"". She started crying and said that I'm being rude when she's just trying to look out for me, and then left. We haven't texted or spoken since.

Honestly I'm not sure if I want to salvage this friendship after finding out this is how Rachel felt about me all this time. However, I feel guilty for saying this to her when I knew it was a sore spot, and also for kinda blaming her for the fact that her husband is awful. So, AITA in this situation? ",babybluecantread,6744,0.9800000190734863,308,1751840811,2025-07-06 17:26:51,AmItheAsshole,https://www.reddit.com/r/AmItheAsshole/comments/1ltdxi1/aita_for_telling_my_friend_i_dont_want_to_end_up/,7,2025
