post_id,title,text,author,score,upvote_ratio,num_comments,created_utc,created_datetime,subreddit,permalink,month,year
1m1pky4,"AITA if I don't want to meet biological kids I have never seen, did not raise, etc?","When I was 32 years old, I was married with three young children and both my husband and I were struggling with full time jobs, him also with school, and life in general.  I found out about a program where I could ""sell"" my eggs.  I went through a company a friend knew about, did one cycle of shots/hormones, and they retrieved 15 eggs.  I posted my info on the site and a couple from California contacted me, as wife did not produce eggs and could not carry baby.  They were interested in my eggs in particular because I already had three healthy children, and they both had red hair and green eyes; as do I and all of my children.  They ended up having 3 healthy children, which I guess are technically half me biologically and half her husband.  This happened over the course of a few years with a surrogate.  I never saw pictures, didn't ask to, and didn't communicate with them after the last child.  I received $5000 at the time and it was sorely needed for anything from medical bills to daycare costs and day to day expenses.  Fast forward to now - I am divorced from my husband of 25 years and our children are grown, the youngest being 23.  My current boyfriend is absolutely apalled that #1 - I never told him about this and just brought it up in normal conversation, #2 - that the action itself was completely ethically wrong, and #3 - how can I function knowing I have three biological children in CA somewhere I will never meet or so and my genetics or just ""out there.""  I honestly don't think about it.  They aren't my kids and I never saw things that way.  This has become a daily discussion turning into an argument about me trying to find out where they are or what they are doing.  AITA for not caring or just looking at it in a blase' manner?",Still-Hangin-In,6389,0.9399999976158142,726,1752702396,2025-07-16 16:46:36,AmItheAsshole,https://www.reddit.com/r/AmItheAsshole/comments/1m1pky4/aita_if_i_dont_want_to_meet_biological_kids_i/,7,2025
1m02rxj,AITA for letting my boyfriend tell a friend to find her own ride home from the beach?,"Took a friend to the beach after she’d been begging to go. She brought no money, ate our food, drank my alcohol, then disappeared to make out with two random guys. We stopped our day to look for her, made eye contact, and got ignored.

She has a pattern of flaking, mooching, and crossing boundaries like commenting on my looks, smacking my butt, and getting upset when I didn’t want her sleeping in my bed. My boyfriend’s always been uncomfortable with how clingy she is with me.

When she finally showed back up, he told her she could ride with the guys she was with since she clearly wasn’t with us. She started crying, and he still told her she could ride back with us, but it’s not fair for her to disappear and treat us like a free ride. She chose to leave and turned her location off. Now she’s acting like we abandoned her.

AITA? (Or we rather) 
",Bingewitch,6140,0.9700000286102295,284,1752537460,2025-07-14 18:57:40,AmItheAsshole,https://www.reddit.com/r/AmItheAsshole/comments/1m02rxj/aita_for_letting_my_boyfriend_tell_a_friend_to/,7,2025
1lwo8b9,AITA for saying guests could go ahead and leave my 4th of July Party,"I (33F)  hosted a 4th of July party for my friends.  A friend brought their relatively new spouse.  Met him once at a restaurant and spoke for a few minutes.  I have 2 German Shepards, Jameson & Guinness. My house is their house. I chose this property, because it was a good fit for them.   

This friend (32F) dislikes my dogs on a bad day to being tolerant of them on a good day. When they arrived both dogs wanted to say hi, neither my friend or the spouse acknowledged them.    I found that annoying.   Literally everyone else that showed up said hi to my dogs. Like all 20 other people. They sat on the couch when Guinness came up to them.  I see him say something to my friend.  My dogs are the sweetest things ever.  He gently pushed Guinness away and he asked me if I could put the dogs in another room, citing they don't want the dog bothering them during the party.  

I backed up my dogs, told them i'm sorry, but this is Jameson and Guinness's house, you need to deal with it or leave. My dogs live here and they don't get put away for anyone.  If you just pet them, they'll leave you alone.  After a brief convo, they decided to leave. I told them they don't call the shots at my house about my dogs.   The rest of my friends were split on how I acted. Some said it wasn't a big deal to put them in another room for a few hours and others said I was right.  AITA?  ",MolassesActual4703,5541,0.7699999809265137,2748,1752181520,2025-07-10 16:05:20,AmItheAsshole,https://www.reddit.com/r/AmItheAsshole/comments/1lwo8b9/aita_for_saying_guests_could_go_ahead_and_leave/,7,2025
1lv3g4z,AITA if I return mail to sender?,"So my spouse has this friend who keeps having mail sent to our house. Idk why, he has a house, but yet he has all his mail sent here. For the first *three months* I didn't have an issue with it but a few weeks ago he had something important sent to the house that he needed asap. He wanted my husband to bring it to him but when my husband when out for drinks he forgot the letter. The next morning (a saturday) this dude calls us over a dozen times at 6am... like my husband didn't answer the first time so his ""friend"" just started calling again and again and again in a super passive aggressive fashion. Eventually my spouse answered the call, grabbed the letter and went to bring it to his ""friend"" like some servant. It was not a pleasant way to be woken up and I told my spouse to tell his friend that we aren't the post office and that he can send his mail elsewhere. Hubby, who is incredibly too kind, thinks I'm over reacting. I dropped the issue but today I found not one but *four* peices of mail including a new bank card and something thick and important looking from the social security office. I haven't told my spouse these letters arrived yet because i know he'll just deliver them and it'll continue the problem. I'm really really tempted to just return the mail to sender. Would I be the AH if I did? 

Caveat: the ""friend"" is *not* disabled and he *does* have a car and a job. Literally no reason that he can't go get a po box. ",freethechimpanzees,5443,0.9800000190734863,463,1752016620,2025-07-08 18:17:00,AmItheAsshole,https://www.reddit.com/r/AmItheAsshole/comments/1lv3g4z/aita_if_i_return_mail_to_sender/,7,2025
1lpecq5,AITAH for not taking my son’s friend who is our neighbor to events and activities because he’s not potty trained?,"TL;DR:
One of the kids in our neighborhood friend group is 9 and still needs an adult to wipe him after he poops. I don’t think that’s my responsibility, so I don’t include him in activities that take us far from his mom. Other parents apparently have been wiping him, and now I’m being talked about for “excluding” him. AITA for setting this boundary?


I live in a close-knit neighborhood where the kids all play together, go to the same school, and bounce between our homes for meals, sleepovers, and activities. It’s a great dynamic most of the time.

One of the boys (M9) in the group still requires his mother to wipe him after using the bathroom. Again—he’s 9. I’m not here to judge his development, but I am saying this: that is not my responsibility, and I didn’t think it needed to be said out loud.

The kid avoids using the restroom away from home entirely. He’s held it through school days, playdates, even had accidents trying to get back home. If he’s at my place and has to go, he just leaves.

I’m pretty active—I take the kids hiking, camping, geocaching, to hot springs, beaches, golf courses—all-day stuff, far from home. I don’t invite this boy on those kinds of outings because, frankly, I don’t want to be out in the middle of nowhere and have to wipe a 9-year-old kid’s butt. I don’t think that’s a normal expectation to place on anyone outside of his parents.

Recently, another parent vented that they had been wiping this kid, which shocked me. Then I hear that people are saying I’ve been excluding him—and yeah, I have, from situations where it’s absolutely unreasonable to expect me to step in for that kind of care.

So, AITA for not including him in certain activities because I refuse to take on what I consider to be an inappropriate responsibility?",GoDavyGo,4893,0.9599999785423279,712,1751406133,2025-07-01 16:42:13,AmItheAsshole,https://www.reddit.com/r/AmItheAsshole/comments/1lpecq5/aitah_for_not_taking_my_sons_friend_who_is_our/,7,2025
1m47ks1,AITA for not sharing my food with my in-laws,"I (24F) grew up with 2 sisters so of course I was constantly forced to share everything especially food with them. My husband (27M) was an only child. 

We live with his mom for the moment and what bothers me the most every time I bring home fast food or any other food for myself or the both of us, he offers it to his mother. I wouldn’t have an issue picking up something for her as well but when he goes and offers something I bought for myself that I was excited to eat it irks me a little bit. 

Well recently I was really craving Italian food. Stuffed shells to be exact. My husband and I agreed to go pick up something from the local Italian place and bring it home to eat. Well we get home and he instantly offers his mother some of our food but this time I protested and said she can have some of his dish because I wanted mine for myself. He immediately got an attitude with me and said I wasn’t going to eat it all (the dish only had two large stuffed shells??) and told me I was being stingy. His mom I guess kinda read the room and said she would just have some of his. He then doubles down and basically tells her to take the other shell from my plate and puts it on her plate for her. This is was really irritated me because I then ended up still hungry after because half my dinner was given to his mom. He offered some of his to me but he KNEW I didn’t like what I got. 
To conclude AITA for not wanting to share my food with her and was I being “stingy” ",FrostyArgument565,4670,0.9399999976158142,1280,1752960537,2025-07-19 16:28:57,AmItheAsshole,https://www.reddit.com/r/AmItheAsshole/comments/1m47ks1/aita_for_not_sharing_my_food_with_my_inlaws/,7,2025
1lybg4s,AITA for asking for my eggs of toast?,"I bought breakfast at a cafe. I would say I am reasonably regular, like they would recognise me. I ordered the same thing I always do, a veggie breakfast. They always put the eggs on the plate and never on the toast. I always have to move them and sometimes I break them. I like it better when the eggs are already on the toast. I asked them today when I ordered if they could put the eggs on the toast. The owner acted like I was being really fussy and said I could put them on myself. Then I could hear her talking to the chef “sometimes it gets a bit much.” I got my breakfast and the eggs were on the toast but I would never ask again based on her reaction. It kind of made me feel embarrassed and like I don’t want to go there any more for a while, which is disappointing because I like their breakfast. Was I the AH for asking for the eggs on the toast? ",avatar_k0rra,4669,0.9300000071525574,546,1752355215,2025-07-12 16:20:15,AmItheAsshole,https://www.reddit.com/r/AmItheAsshole/comments/1lybg4s/aita_for_asking_for_my_eggs_of_toast/,7,2025
1meghvb,"AITA for telling my roommate no, she can’t have the larger bedroom, put her desk in the living room, and use extra common storage for only $50/month more than me?","I’m moving into a new apartment in a few weeks with a roommate. The apartment has two bedrooms and the rent is $2,600. One room is a little bigger and has more closet space, and my roommate and I are trying to figure out who gets which room and how to split rent in a way that feels fair.

She’s saying she wants the bigger room, but she also wants to put her desk in the living room to work there. I already told her I’m not comfortable with that because I would feel like I’m disturbing her if I needed to cook or j relax in the shared space while she needs quiet or is in a meeting. I also told her I think the bigger room should cost $100 more because it has more space and a larger closet.

She came back and said she thinks the rent should only be a $50 difference and she still wants to have her desk in the living room, and maybe use more of the shared hallway storage than me too. To me that just feels really unbalanced and is way more than I would try and ask for personally - she’s getting the bigger room, an extra separate work space outside of her room and taking over more of the shared space, all for barely more rent.

My two biggest priorities are (1) having a decent-sized room where I can study privately since I’m starting an intense dental hygiene program, or (2) feeling like I can use the shared spaces without walking on eggshells or constantly worrying about being too loud.

I suggested two options that I think are fair:

Option 1:
She takes the smaller room, we split rent evenly, and she can use the hallway storage to make up for the closet size difference and put her desk in the living room.

Option 2:
She takes the larger room, pays $100 more (or $50 more if I get the single parking lot spot), and the shared spaces stay neutral, no desk, we split the hallway storage equally, and everyone can use the space whenever.

I’m not being stubborn about the money and I honestly would be happy to pay $1400 and $1200 if the common spaces were shared evenly and I had the larger room. I just don’t want to end up in a situation where I feel resentful or like I don’t have space to breathe. I’ve tried to compromise, but it feels like she’s pushing for everything she wants without really taking my needs into account.

AITA for holding firm to these compromise options and telling her no?",BHSDH2027,4647,0.9700000286102295,637,1754003389,2025-07-31 18:09:49,AmItheAsshole,https://www.reddit.com/r/AmItheAsshole/comments/1meghvb/aita_for_telling_my_roommate_no_she_cant_have_the/,7,2025
1m5usmr,AITA for telling my mom she’s not my kids mom?,"
Throwaway because I just want a verdict and to be done with it. So for background I 28f and my husband 30m have two kids. 7m and 4f. My mother is actually a great grandmother. She lives the kids and is very helpful but she has this habit overstepping. 

So both our kids do chores. We give them things to do that they’re capable of doing. Like my son does the dishes sometimes after dinner. My daughter will help set and clean up the table afterwards. Those kinds of things. My mom came to visit us recently and I’ve been noticing she’s being doing this thing. She stops my son from whatever chore he’s doing and does it for him but if she sees my daughter doing something she won’t. At first I thought she just didn’t want her grandkids to do work because she often calls me a cold mother for making them do chores but then I figured out the pattern and it rubbed me the wrong way because I remembered she used to do the same thing to me. My brothers would do nothing while I did everything so I started correcting her and making my son finish his chores himself which made her really agitated. Yesterday we were having dinner and my daughter and husband were clearing up the table because it was my son’s turn to do the dishes. She tried stopping him but I told him to the dishes and took her outside. She told me I’m so cold for making my son wash dishes and why couldn’t I do it, I explained to her that we like to split chores evenly in the house and if he’s capable he should(it was like 5 plates and cups and a few spoons). She kept going and she called me lazy (something she would often do whenever I asked my brothers to help me out with chores). 

Here’s where I may be an asshole. I told her ‘she’s one to talk after making me clean up after everybody my whole life’ . I told her I’m not going to enable my son to be ‘f*cking’ losers like her sons. My little brother literally had to be spoon fed until he was ten because he refused to eat if my mom didn’t feed him. I was apparently ill treating my son by making him do all these chores. I told her ‘I’m teaching him to be independent and that she may have raised two boys but she’s not my kids mom so she should f*ck off when I’m trying not turn my son into an incompetent asshole.’ She left crying. My dad called and told me she’s moping around.  My husband says it was deserved but he really doesn’t like my mother because he’s seen over the years how she treats me compared to how she treats my brothers. Did I go too far and any advice is appreciated.Thank you. 

",Technical_Fly_9052,4412,0.9800000190734863,468,1753131437,2025-07-21 15:57:17,AmItheAsshole,https://www.reddit.com/r/AmItheAsshole/comments/1m5usmr/aita_for_telling_my_mom_shes_not_my_kids_mom/,7,2025
1lye9uj,"AITA for throwing out my friend’s couch after it sat in my garage for 3.5 years, even though I said she could only store it for two weeks?","In 2019, a friend asked if she could store a couch in my garage. It had belonged to her late father, and they were clearing out his house.

I said no.

My garage is small. One car and barely any extra room. It isn’t insulated, it leaks, and squirrels basically have squatter rights. I don’t store anything there on purpose. I also told her that people always say they’ll “pick it up soon,” and then never do. Somehow the person doing the favor becomes the villain.

She kept pushing. I offered options:  
– Rent a storage unit  
– Get a U-Haul, take the couch home, and have her kids drive up and get her car  
– Leave it at her dad’s and take the risk

Her niece even borrowed a trailer to bring it to me. All that, just to keep it out of her siblings’ hands.

I finally said yes, but I was crystal clear. Two weeks. After that, I could do whatever I wanted with it.  
She said absolutely. Her kids would be there that weekend to pick it up.

They never came.

I called a few times that first year.  
“Oh yeah, we’ll come get it.”  
Crickets.  
In one of my “please get your couch” calls, she said, “I’m a Sagittarius. We’re not good at this stuff.”  
I’m still not sure what that has to do with picking up your couch.

I tried again in year two. Same story. After that, I gave up. She never once brought it up on her own.

Around year three and a half, I had construction work happening. The crew backed a trailer into the garage and accidentally crushed the couch. When we looked closer, it was already moldy and torn apart by squirrels. The workers felt bad. I told them not to worry. It had been sitting there for years.

We even discussed whether I should tell her. Everyone agreed there wasn’t much point. She hadn’t mentioned it in over three years.

So I didn’t.

Fast forward to this year — now year six. I mention I’m cleaning out the garage and she casually says, “Oh, I need to come get that couch.”

Me: “It’s gone. The squirrels got it.”  
Her: “What?”  
Me: “Yeah. The garage isn’t insulated. They love it in there.”  
Her: “I had no idea.”  
Me: “You did. You just forgot. And I said two weeks.”

She hasn’t spoken to me since. Unfriended. Full stop.

Meanwhile, I lived around that couch. I broke my toe on it. I had to work around it constantly. I paid to have it hauled away. It took up space I didn’t have for three and a half years. The first time she brought it up was in year six.

So I’m really asking:  
Should I have told her back when it got ruined, even though she hadn’t asked about it in years?  
At year six, should I have just said “sure, come get it” and played along, even though I doubt she would have?  
Or was this always going to end the same way, no matter what I did?

**TL;DR:**  
Friend asked to store her dad’s couch “for two weeks.” I said no, then agreed with a firm limit. She left it for 3.5 years. Couch was destroyed. I tossed it and didn’t tell her. She finally mentioned it in year six. Now she’s upset. AITA?",SpecialistPie1037,4269,0.9599999785423279,297,1752363069,2025-07-12 18:31:09,AmItheAsshole,https://www.reddit.com/r/AmItheAsshole/comments/1lye9uj/aita_for_throwing_out_my_friends_couch_after_it/,7,2025
1lsnj7d,AITA for telling off my 'future' sister in law when she didn't want to invite my younger  brother to her wedding,"I 23f have an older brother, Drew, 26m who is getting married at the end of this summer. To say it lightly me and his fiance, Lacy, 25f, do not get along. She's very stuck up and has made some snide comments to me and my younger brother, Max, 16m. For context Max has always been the black sheep of the family. He is very academically and artistically talented but my father and mother are disappointed in his lack of sports (cliche I know), not to mention they've favored my sister, his twin, Caroline, 16f. Max and Lacy were civil for awhile but I guess I haven't seen them speak in a long time for reasons unknown to me. 

The problem occurred last night when I was asking Lacy about the wedding and how the planning was going. She started telling me her seating chart and showing me what she had planned, I was looking at the chart and Max's name  was nowhere to be found. I don't love Lacy but I'm not going to assume the worst of her, so I asked her where Max's name was and she got suddenly quiet. "" He's not going to be there"", she said. ""You mean not in the wedding party?"", I ask. ""No, he's not invited"", she said it so calmly I'd assume she was talking about the weather. I kept asking her why she wouldn't invite him but invited Caroline. She just said that she feels Caroline is more mature because she is a girl.  


This wedding isn't going to be child free, Lacy has stated this multiple times. I have many little cousins who are being invited, since family is very important to us. Not inviting Max makes no sense. He is a very nice kid, and very mature for his age. Much more mature than Caroline. He never causes problems but like I mentioned earlier, there are some big issues with him not following Drew's and my dad's footsteps in football. I know Lacy is very desperate for my family's approval so maybe outlining Max is the way to do it for her but I have a feeling there's something more to it. 

After what Lacy said about not inviting Max, I stood up and started yelling at her for not including Max.She kind of just ignored what I was saying but when I escalated, Drew came over. As he was walking over she started to cry and make a bigger scene about it. Drew knelt down to comfort her and gave me dirty looks. Once she was inside he turned to me and started yelling at me about being rude to her, when she is under so much stress from planning the wedding and trying to get my family to like her. I understand that my family is closed knit and kind of not welcoming to newcomers but that doesn't excuse her behavior and I told my brother so. I asked him why he didn't want to invite Max and he just told me to stay out of it (Classic move of him). He walked out then and we haven't spoken since last night. 

I don't want to fight with Drew, but I'm standing my ground for Max's sake, Max also doesn't know about any of this yet and I'm hesitant to tell him. My parents have stayed out of it so far but Drew is still set on being mad at me AITA?""",Accurate-Damage-7458,4189,0.9599999785423279,855,1751759334,2025-07-05 18:48:54,AmItheAsshole,https://www.reddit.com/r/AmItheAsshole/comments/1lsnj7d/aita_for_telling_off_my_future_sister_in_law_when/,7,2025
