post_id,title,text,author,score,upvote_ratio,num_comments,created_utc,created_datetime,subreddit,permalink,month,year
1cujoln,AITA for not letting my neighbors use my backyard?,"Created an account to ask.

My partner and I (F30s) just got some new neighbors. They moved in about a month ago. We met them briefly. They are a couple around our age and a daughter who might be 4 or 5, and a dog. 

We have our backyard fully fenced in with a privacy fence. Their yard doesn't. I was out front last weekend when the couple came up our driveway and started chatting. They mentioned that they were on a waiting list to get their yard fenced in but were told it would be a few months. They said they would really like their daughter and dog to have a place to run around but didn't feel comfortable with the lack of fence (our neighborhood backs up to a wooded area and a creek). 

They asked if they could borrow our backyard for a few hours a day so they could let everyone run worry free. I admittedly immediately didn't like this, but I told them I would think about it.

I talked to my partner, and we both agreed this wasn't a good idea. We have two dogs ourselves, and they can be a tad protective of their yard. One of them also doesn't love kids and the other one can be a tad dog selective. Because of this, we would have to coordinate when we could let our dogs out and that's just not something we want to deal with. There are just too many things that could go wrong. Plus that good ole American worry that if someone got hurt we could get sued. 

The guy stopped by again on Wednesday and asked if we had given it any thought. I told him we had discussed it, and unfortunately it just wasn't going to work out with our dogs and their schedule so we wouldn't be able to accommodate them. He immediately got sour and said it was nice to know how neighborly we were. He left abruptly but I could hear him muttering under his breath.

Him and his wife have made a big show of snuffing us the last couple of days. My partner said they will get over it, and while I'm not going to reconsider, I do feel kind of guilty. 

AITA for not letting our new neighbors use our yard?

Just so everyone knows - Our gate is locked and we have cameras.",YackBardWitch,1508,0.949999988079071,396,1715989187,2024-05-17 18:39:47,AmItheAsshole,https://www.reddit.com/r/AmItheAsshole/comments/1cujoln/aita_for_not_letting_my_neighbors_use_my_backyard/,5,2024
1d0nn8i,AITA for not stopping to explain what I was doing to a bystander while I was helping a seizing man?,"Please do not share this outside Reddit. 

I’ll try to keep it short. I (40F) witnessed a dude have a seizure, which I was able to identify bc my best friend is epileptic and has been since we were kids. A few bystanders came over and helped me stabilize him as he was a big dude and I’m an average sized woman. Another woman and I were on the ground with him when suddenly a not-at-all-good-Samaritan we’ll call Dick shows up and starts barking (wrong) orders and instructions. Neither of us listen to him or act on his demands. He gets louder and louder and starts recording, saying it’s evidence that “these women refuse to let me help this man!”  

Eventually the seizing stops and EMS and the police show up. Dick immediately accosts the medics AND cops shouting about how he was trying to help and nobody would listen to or let him.  After everyone chatted, EMS confirms what we did for the seizing man was correct. 

Dick is outraged and then decides to direct his ire square at me and tells me that all I had to do was explain it to him in the first place. Internally I was like: What? You’re suggesting the “correct” answer was for me to take my attention off a medical emergency and explain to you why and how I was doing what I was doing/not doing? But I said, “I do not owe you or your ego any explanation for anything, ever, most certainly not in the middle of a medical emergency,  but for your information my best friend of 25+ years is epileptic. This is how I know what to do and not to do in the event of a seizure.” He YELLED, “That’s all you had to say!” At this point even the cops piped up and one said, verbatim, “No she didn’t, bro. She was focused on helping the guy.”  

I felt like I didn’t do anything wrong but was also kind of rattled, so when my friend’s wife later said I was being harsh and arrogant by not acknowledging and/or addressing Dick during the actual seizure and later referring to his ego in my “speech” to him I kind of felt like an asshole. 

She said he too was also just trying to help and “possibly prevent a disaster,” and then asked who anointed me the “Jesus of the situation.” I said I wasn’t being arrogant Jesus, I was simply the first one to get to the guy, knew he was having a seizure, and knew what to do, so I did it and didn’t concern myself with a dude screaming (again, WRONG!) orders in the background. 

Outside the screaming guy it was really a scene full of good people trying to help and made me feel better about humanity even. And then this friend’s wife basically called me an arrogant asshole.

Am I?",hiseizurethrowaway,1480,0.949999988079071,219,1716677314,2024-05-25 17:48:34,AmItheAsshole,https://www.reddit.com/r/AmItheAsshole/comments/1d0nn8i/aita_for_not_stopping_to_explain_what_i_was_doing/,5,2024
1cvanvk,AITA for questioning my husband about cross contamination in his food truck?,"Backstory: My husband runs a food truck with his mom in the summer and maintains a daily full time job, I work full time in mental health. We often bicker about everything from who forgot to fill the water pitcher last to whether our mother's are disrespectful to each other. We have a pattern of questioning each other on stuff we know the other knows more about. Further context, I don't work on his truck, but I do maintain the paperwork side of it (accounting, licensing, food safety certifications, etc).

The situation: I brought our toddler up to the truck today to see daddy and grandma, otherwise he doesn't get to see them as much in the summer. A customer asked what they had that was gluten free, and he said they have corn chips for the nachos and corn tortillas. We marinate all our meat by hand and buy fresh veggies and queso for toppings, but we do toast the corn tortillas and the flour tortillas on the same pan for the tacos. So I asked, ""but what about cross contamination?"" in front of the customer. He kind of snapped at me and said, ""it's fine, it's not a problem."" The customer didn't get anything and he lectured me that I don't work on the truck, no one's ever complained, and that he knows what he's doing. I think I'm trying to make sure we don't accidentally make anyone sick and/or get a lawsuit. I know for things like tree nut allergies, even being in the same airspace as a peanut can be deadly for some people, celiac people out there, can it be the same? I'd rather be safe than sorry.",Shastakine,1352,0.9300000071525574,326,1716075950,2024-05-18 18:45:50,AmItheAsshole,https://www.reddit.com/r/AmItheAsshole/comments/1cvanvk/aita_for_questioning_my_husband_about_cross/,5,2024
1d1clkv,AITA for kicking my sister out and leaving my son unpunished for what he said?,"My (F45) sister (F37) visited our house with her boyfriend last week, and I couldn't say I was looking forward to it even though I love her to death; she's always been manipulative. I invited my mom along, and five minutes after my sister and her boyfriend showed up, one of my youngest daughters (twisted her foot running to the kitchen and cried. My sister told her to toughen up and critiqued my husband for getting her an ice pack, calling him unattractive for being so soft and continued to joke about how he got a wife. I told her to be quiet. 

Later, my oldest kids (F18 and M15) came to hang around and my sister commented on elements of my daughter's body, stating how lucky she was to have a ""hot body"" as a teen. My daughter politely told her not to talk about her body in any way, but my sister told her to be more aggressive because it would get her attention. I told my sister if she wasn't going to quit bullying my family she could take her boyfriend and leave, but she only laughed at me. My son told her to ""stop projecting"" just because she's wimpy and not attractive and my sister said ""it's not cute when you do it."" We all (excluding my mom and the boyfriend) were telling her to leave and she wouldn't until my son, of all people, raised his voice and said to make like her hairline and recede and called her a miserable freeloader. My sister rolled her eyes but left; I think she was intimidated. My son can be very scary when he wants to be and he's very no-bullshit. Later, once my mom recovered from the stress, talked with me and said what my son said was ""highly inappropriate and abusive."" I referred to my sister as abusive instead, and we argued until she eventually left. Knowing her, the entire family will know soon. But I'm not going to defend my sister's behavior. Aita?",Wooden_Cheesecake_99,1280,0.9700000286102295,225,1716761536,2024-05-26 17:12:16,AmItheAsshole,https://www.reddit.com/r/AmItheAsshole/comments/1d1clkv/aita_for_kicking_my_sister_out_and_leaving_my_son/,5,2024
1czwzo4,AITA for “breaking” my vegan diet?,"Hi people, 

My entire family are vegans, my dad especially is a very “vocal” vegan. He goes to vegan protests, was in vegan groups in our old city, he’s a vegan activist. Which I love, I’m not trying to paint those things as bad I really respect him for his thoughts. 

My brother and I have both been raised vegan our entire lives. At school it’s always made me feel “othered” is the best way to explain it. Never able to eat anything sold in the school canteen, at friend’s birthdays never able to eat a piece of cake with my friends, or have to be the one who says “we can’t go to that restaurant they don’t serve any vegan food”. Always having to explain why I’m not allowed to “try a bite” of their sandwich. They aren’t huge things but they are things that make me stick out. Since I’m an awkward guy anyway, it just doesn’t help me socially. So when we moved cities and I joined a new school last Monday I decided that I’m not going to follow the vegan diet while I’m at school. I kept this to myself because I know my parents wouldn’t support it and would be angry. 

When at home, or with my parents I will follow the vegan diet but if I’m out with my friends or at school I’m not going to say, in my mind this was respectful of my parents wishes. No meat in the house or around them but my myself is different. My brother and I both go to this new school. Since we don’t share a dinner time I didn’t tell him that I wasn’t going to follow the vegan diet, I didn’t think he would support it and I thought he would tell dad. 

Things have been going alright but I didn’t know that on Fridays my brother’s dinner time would be at the same time as mine. I was sitting with some new friend and I was eating a cheese pizza (this is the only non-vegan food I’ve eaten so far. I want to try pepperoni but still feel a little scared) and my brother caught me and asked what I was doing eating pizza. 

I tried to play it off but I knew I was screwed, my brother told my parents and now everyone is really upset at me. I’ve been grounded and my dad said he’s going to call my new school and tell them that if they sell me non-vegan food he will put in a discrimination complaint. Which is just going to make me seem like a weirdo now. 

I tried to explain to him that I was trying to be respectful by not doing it here, but my parents just gave me a huge lecture about how I’m so selfish for breaking the diet. He said he can’t trust me anymore and now I feel guilty in one half of my brain and in another I’m telling myself it isn’t that big of a deal and they’re overreacting. 

But I don’t know if I’m just being blind. 

Please, no debates about the ethics of the vegan diet. I don’t care to debate it with anyone I’m sure there are subreddits where people will be happy to. Please focus on my situation when giving your verdict.",Vegan-conundrum,1274,0.8899999856948853,893,1716589204,2024-05-24 17:20:04,AmItheAsshole,https://www.reddit.com/r/AmItheAsshole/comments/1czwzo4/aita_for_breaking_my_vegan_diet/,5,2024
1cjk523,WIBTA If I kept some of the insurance money from my car (that my sister totaled),"Update #1: So far I’ve seen similar opinions from everyone and I appreciate everyone’s comment. We’re having a BBQ tonight since my sister just got back from school for the semester. I’m going to bring it up with everyone at dinner and I’ll post a second update letting everyone know how it went. 

Bit of background, I bought a new car in 2022 and gave my old one to my sister after she totaled her last one. Since then, my mother has been paying the car payment for her (she was a minor). With the payment history split between us, I've paid for 60% of the car to date, while my mother has paid the other 40%. My mother came in a told me they were looking at new vehicles today and that she wouldn't mind putting $4-6k down on a car if it meant a low interest and monthly payment (this money comes from the insurance payout being sent to me). I commented that I would need at least $1500 to pay off some credit card debt, and was told no. Now, I don't mind helping out, but I was just told that I wouldn't be receiving any of the insurance money meant to pay for my vehicle, because my younger sister needs it more? Why does the person who has totaled three vehicles in four years need to put $4k+ on a brand new vehicle, and $400 to pay off her credit card, but I can't get $1500 to pay off a credit card to make my life easier?   
  
Would I be the asshole splitting the money based on how it was paid? 60/40. The original loan was 48 months, we have 8 months left, I paid the first 20 and $1500 down, and my mother the second 20. That would give me $3500, much more than I originally asked for, and leave $2500 to pay off her credit card, and the rest as a down payment on another car. I feel like this is going to be an unreasonable offer considering they both assumed they would get the entire amount. ",SimpleSeaworthiness5,1261,0.9599999785423279,288,1714772926,2024-05-03 16:48:46,AmItheAsshole,https://www.reddit.com/r/AmItheAsshole/comments/1cjk523/wibta_if_i_kept_some_of_the_insurance_money_from/,5,2024
1cs4uw5,AITA because I didn't want to cook a steak on mother's day?,"I (40f) and my husband (41m) have been married 21 years. We have several children the oldest is 20 the youngest is 5. 
Mother's day has always been a point of contention. I really wish he would do something nice for me but he always tells me ""you aren't my mom,"" and does nothing noteworthy. It's gotten worse over the years and came to a boiling point two days ago (mother's day) 
I had reminded everyone that mother's day was coming up but on the day everyone except our 20 and 18 year olds forgot. 20m works all day he came over late in the evening, and 18 said happy mother's Day in the morning before he left for work.  I can't really fault the other  kids for it as many of them are young. By noon I was almost in tears. 

When my husband came out of his man cave and told me he wanted me to cook steak for lunch I almost broke down crying. I cook almost every day for everyone and I really just did not want to cook on mothers day. 

I left the house, went for a walk and bought myself a pizza. When I came home I put his steak in the air fryer. Which was apparently wrong and he got mad about it. 
As he was scolding me over cooking the steak wrong I started crying and said ""it's mother's day!! "" And his response was.... 
He yelled at me for wanting to be the center of attention and told me ""you aren't my mother! You did not give birth to me!"" 

He spent the rest of the day angry at me. He refused to eat the rest of the day. He said he wanted steak to be something nice we did together and I said I didn't want to have to cook because it was mother's day and I wanted him to do something for me but he didn't want to so I went for pizza alone. 

Around dinner time he made a steak and I thought it was for him as I had already eaten but he put it in front of me and told me I better enjoy it. I ate about half it was a huge steak the size of the plate.

I tried to talk to him later he got angry and stormed out. The next day he was still angry. I told him he really hurt my feelings and he said ""you say every other day that I'm hurting your feelings. You always take things wrong, so I guess I just won't talk at all that way you can't take anything wrong."" 

He wants me to act happy so I've been trying to but now it's been two days and he's still angry with me. He keeps sitting on the couch arms crossed refusing to speak or anything. 

Maybe I should have just cooked the steak and not gone out? Am I being unreasonable, after all I'm not his mom. It's just that, as the mother of his children it would be nice to be celebrated on mothers day for once. 

",ToughPast1806,1247,0.9200000166893005,675,1715725007,2024-05-14 17:16:47,AmItheAsshole,https://www.reddit.com/r/AmItheAsshole/comments/1cs4uw5/aita_because_i_didnt_want_to_cook_a_steak_on/,5,2024
1d23txo,AITA for refusing to pay off my boyfriend's overdraft?,"I've known Ron as a casual acquaintance for a few years, but we started dating about two weeks ago.  I'm 19 and he's 20.  He has a full-time job and only pays his mum £40 a week for bills/food.  His only other expense is his car.  So he has a lot of disposable income, but he doesn't save, he blows it all on nonsense like gadgets that he then never uses again.  So much so that he's overdrawn by £2K.

I'm a full-time student who babysits on the side, and I'm frugal.   I've managed to save £3K.  It has taken me about 2 or 3 years to save that.  Tonight I mentioned that some friends of mine are going on holiday in September and I am going to join them.  Ron asked me ""How will you pay for that, you don't have a job apart from babysitting.""  I said ""I have £3K in savings, so I will just use some of that.""

Suddenly Ron got a really calculating look in his eyes, and just outright asked me to pay off his overdraft.  He said he would pay me back £200 a month.  I said he should just pay off his own OD at £200 a month.  He said ""But then I have to pay interest!""

I refused to lend him the money for several reasons:

1. He's such a spendthrift I don't believe he would pay me back.  If he can't set aside £200 a month to pay off his own OD, he is not going to set aside £200 a month to pay me back.

2. I earn a small amount of interest on my savings.  Why should I lose that to save him interest?

3. What if I have an emergency, or an opportunity like my upcoming holiday?  I then  won't have any money to pay for it.

And I didn't say this one to him, but also I don't want to lend him the money because he has such a bloody cheek.  I know we've casually known each other (friends of friends) for a few years but we're only really just now getting to know each other properly and I just think it's such a rude and selfish thing to ask.  It's really made me see him in a different light and I don't like what I'm seeing.  Anyway he thinks I'm the one being selfish because the money is ""just sitting there"" and I ""don't really need it.""  So AITA?",SavingsGirl765,1246,0.9599999785423279,743,1716847972,2024-05-27 17:12:52,AmItheAsshole,https://www.reddit.com/r/AmItheAsshole/comments/1d23txo/aita_for_refusing_to_pay_off_my_boyfriends/,5,2024
1cjm3zb,AITA for kicking my MIL out of my house for being passive aggressive about my husband cleaning up?,"My husband, Tom, and I recently moved into our house, today we hosted our first dinner party with my mother in law (mil), FIL, BILs and their wives and SIL. I took a day off from the my business to make sure everything was perfect. I spent hours on my feet to make sure everything was perfect, I went grocery shopping, cleaned the house and cooked. By the time everyone got here I was exhausted but I still entertained everyone because I was so excited to have them over.



Everyone was having a good time, even MIL, I think its because Tom and I sat at opposite end of the table and she got to sit next to him. We moved to the living room to have dessert and that's when everything went to crap. I was in the kitchen with SIL plating up the desserts she brought and making more ice cream. A few minutes later Tom came back and started clearing up the dishes that were on the table, I didn't ask him to do this, he's just like this. MIL heard us talking and came to the kitchen and saw Tom loading the dishwasher, she asked if he knew what he was doing and he told he did.



MIL came in after Tom went back to the living room and said (I forgot some of the other stuff she said). ""PugLoverNo1565, if you needed help with cleaning up you could have asked us to do it instead of stressing Tom with it. He's not good at this sort of thing and he has had a long day at work. The key to happy marriage is working together and making life easier for each other. Tom works so hard, he bought this house and everything in it to make life easier for you. The least you can do is clean up"". I told her I didn't ask for help, Tom just helped because this is house too and he wants to make life easier for me. I also asked her if she realised it wasn't 1993 because Tom isn't a baby anymore he's capable of cleaning up, its not rocket science. I told her we don't need marriage advice, especially from her because she said something about making our marriage last while she's was on marriage number 3/7 at my age. She called me angry and said I had no need to be vicious, I told her I'd show her vicious and I left the room. MIL followed me to the door and I told her get out, she did and then started crying.



Everyone came to see what was going on and I told them I'm tired of MIL and her nastiness she tries to hide by being passive aggressive. FIL apologised for her and I told him I don't accept, she can apologise for herself or leave. Tom and his brother Andrew told her to apologise and she refused so I shut the door in her face and went to the kitchen. FIL and one of DH's brothers and his girlfriend left soon after. The rest that stayed had a good time and they left two hours ago.



All hell has broken loose and I'm getting messages basically calling me an asshole. I don't think I was but Tom and everyone who stayed is biased because they can't stand MIL, so I don't know. AITA?",PugLoverNo1565,1219,0.9599999785423279,153,1714778277,2024-05-03 18:17:57,AmItheAsshole,https://www.reddit.com/r/AmItheAsshole/comments/1cjm3zb/aita_for_kicking_my_mil_out_of_my_house_for_being/,5,2024
1cre4nx,AITA for not allowing my sisters family members (her dogs) at my family party.  ,"I hosted a Cinco de Mayo family party last weekend.  I recently remodeled my backyard and pool, plus being Mexican, I thought it would be the perfect weekend to show off the updated digs.  I invited any family that lived in the area.  Its the first party i've held since before Covid.  

My sister and I are opposites.  She is a dog mom (god I hate writing that) to an extreme degree, My wife and I are not dog people.  When she got the invite she reached out and said her, her boyfriend, and 2 dogs (Small 10 pound dogs) would be there.  I was annoyed and called her to tell her no, her dogs are not allowed.  

She asked if kids were going, I said yes, some were.  She said well her dogs are family and they should be able to come.  I told her I don't consider your dogs family.  In fact I think your crazy for thinking that your dogs are my family.  She argued her dogs were just as much family as the kids were.  She said her dogs wanted to see their uncles new backyard.  I told her to shut up and never say that again to me.  I re-affirmed that her and her boyfriend could come, but nothing else from their house.  She got angry but I eventually hung up.  

She didn't go to the party claiming I was rude and an asshole to her.   Apparently my parents even agree with her, which fucking blows my mind.  Heard a rumor she is hosting an event and is seemingly excluding me from the invite list. AITA Here?",SmoothShift1389,1214,0.9100000262260437,357,1715643939,2024-05-13 18:45:39,AmItheAsshole,https://www.reddit.com/r/AmItheAsshole/comments/1cre4nx/aita_for_not_allowing_my_sisters_family_members/,5,2024
1ci0jjc,AITA for kicking my mom out after she was awful to my wife and daughter?,[removed],throwaway8195921,1186,0.9599999785423279,297,1714605639,2024-05-01 18:20:39,AmItheAsshole,https://www.reddit.com/r/AmItheAsshole/comments/1ci0jjc/aita_for_kicking_my_mom_out_after_she_was_awful/,5,2024
