post_id,title,text,author,score,upvote_ratio,num_comments,created_utc,created_datetime,subreddit,permalink,month,year
1ba03qq,AITA for uninviting my friend from my Oscar party over a bottle of whisky?,"All names are fake.

Me (29M) and my wife ""Kate"" (27F) host an Oscar watch party at our house every year. We've been doing that since we moved in together 5 years ago. We dress up well, place bets on the winners and eat popcorn. It's a fun tradition that many of our friends look forward to every year. One of those people is ""Rick"" (28M), a friend of mine from college.

My wife loves whisky. Shortly before last year's party, my FIL gave her a bottle of Macallan. He said he'd spent $175 on it. Kate gave birth to our first child in 2022 and was still breastfeeding last year, so she decided to save the bottle for after our son had weaned.

During last year's watch party, Rick got wasted. While reaching for something else in our liquor cabinet, he accidentally dropped and broke the bottle. He apologized profusely once he'd sobered up. I was angry, but the whisky was Kate's and she forgave him, so I decided to drop the subject.

A couple weeks after that, we asked Rick how he planned on replacing the bottle. He was shocked at our question, and told us he didn't intend to. Rick's been having money problems for a while and struggles to pay his rent. He said that since we knew about his condition, it was unreasonable of us to expect him to pay for a $175 bottle of whisky.

I told Rick he had until this year's Oscar party (which was months away at the time) to save up for a new bottle. If he didn't, he wouldn't be welcome at our place for the party. At the time, he agreed. Throughout the year, I asked him about the savings several times. He always told me he was close to the goal.

Last week, I asked Rick about it again. He confessed he hadn't actually saved any money for the bottle. So I kept my promise and uninvited him from the party.

Both Rick and his girlfriend (who frequently joins him at our parties) are now angry at me for uninviting him over a ""drunken mistake."" They also insist that I'm being unsympathetic and entitled by expecting Rick to pay for a new bottle.

Kate's on my side, but is worried we're being too harsh. I really don't think we are, but as Sunday approaches, I'm starting to feel guilty.

I have less than two days to sort this out. AITA?",InternationalList333,4370,1.0,1,1709933973,2024-03-08 15:39:33,AmItheAsshole,https://www.reddit.com/r/AmItheAsshole/comments/1ba03qq/aita_for_uninviting_my_friend_from_my_oscar_party/,3,2024
1bixndd,AITA for not forgiving my MIL after she gave away my late mother’s heirloom to a stranger?,"I (30F) am known in my family for my patience and generosity. I’ve always gone out of my way to help others, and I take pride in being a good person. My husband (32M) and I have a beautiful relationship built on mutual respect and understanding.  
My late mother left me a precious heirloom, a vintage necklace that has been in our family for generations. It’s not just valuable, but it holds immense sentimental value to me. I’ve always kept it safe and only wore it on special occasions, cherishing the memories it holds.  
Enter my MIL (57F), who has a history of overstepping boundaries. Despite our differences, when she lost her apartment, my husband and I opened our home to her, asking for nothing in return but basic respect for our belongings.  
One day, I came home to find my MIL hosting a tea party with her friends, and to my horror, one of her friends was wearing my mother’s necklace. When I confronted her, my MIL nonchalantly said she gave it away because she thought it was ‘just old jewelry’ and that her friend admired it.  
I was heartbroken and felt utterly betrayed. My husband was equally appalled and supported my decision to ask her to leave. Now, the rest of the family is painting me as the villain, saying I’m overreacting and should forgive her because ‘family is family.’  
So, AITA for not being able to forgive this breach of trust?",Cold_Device5620,4054,1.0,1,1710887897,2024-03-19 17:38:17,AmItheAsshole,https://www.reddit.com/r/AmItheAsshole/comments/1bixndd/aita_for_not_forgiving_my_mil_after_she_gave_away/,3,2024
1bfrtju,AITA for letting my wife’s friend quit causing her to lose multiple benefits totaling in $50k+?,"I (35M) worked with my wife’s close friend Sara (29F) who she has know since college. They were sorority sisters and my wife was her big and Sara was the little or something along those lines. Sara and I were in the same industry and she eventually applied for a position at the same Company I currently worked at. She got the job almost 3 yrs ago and we have been at the same midwestern office. She was apart of my team but I dealt very little with her directly and wasn’t her direct report. 

Sara had done very well and was promoted within 6 months to a good position. She seemed to be on a fast track but recently stumbled in her latest interview for a sought after position. We gave the position to a more deserving candidate in my eyes. As we sometimes see Sara was upset and it was the start of her leaving the company. I could sense she was applying elsewhere and did put in a 2 weeks notice, offered to stay on 1 month inline with her projects deadline, which we accepted. We wanted to keep Sara but I could not give her a raise because she was already at the top of her pay scale. Her job offer was actually lower pay so there was no leverage there either. I told her this within a few days and Sara was pretty upset. She decided to leave immediately.

Here is where the issue comes up. Sara was aggressive with her 401k and the company stock options by my recommendation. We have a 10% 401k match (very generous) and stock buying options (match stock purchases - basically a 2 for the price of 1 deal). She would tell me later she maxed the 401k and stock options every year. The problem is my company has a 3 yr vesting schedule before the matching is permanent. So if an employee leaves before both 401k and stock matching is gone. Sara’s 3yr anniversary was within the 1 month notice date but not when she abruptly quit. 

It something I realize between Sara’s notice and her quitting. I wasn’t able to advise her of this nor did I know how much she put into these program. There was really nothing I could do when she abruptly quit. 

It was about 2 months later Sara came over with my wife and laid into me. She tried transferring her funds and found out about the vesting period and asked if I knew. She revealed the amount she would be losing during the transfer of funds and it was greater than $50k. Both Sara and my wife have said I’m TA for not warning her. I told her the situation and how I did not consider her quitting immediately (in front of others too).

So AITA for not warning Sara that she was just short of the 3 yr vesting period that would’ve saved for $50k? 

",Barkleyslakjssrtqwe,3901,1.0,1,1710545426,2024-03-15 18:30:26,AmItheAsshole,https://www.reddit.com/r/AmItheAsshole/comments/1bfrtju/aita_for_letting_my_wifes_friend_quit_causing_her/,3,2024
1blczql,AITA for not getting my “stepdaughter” a present?,"I (F40) got married to my ex-husband, James (M43), three years ago. He had a daughter, Annabel (F13) from a previous marriage. For background purposes, Annabel has next to no contact with her bio mother. She left when Annabel was two, and apart from the occasional birthday card, there’s no contact there.

I’ve known Annabel since she was nine, and we had a good relationship, especially in the absence of a maternal figure in her life. I never had children of my own and never intended to, but was surprised that I was fine with being in a relationship with someone with a child.

James, Annabel, and I lived together for four years in what you could consider the “normal” nuclear family. However, my relationship with James just got more and more strained. We were constantly arguing and bickering about really pointless things and the atmosphere in the house was sour. Annabel could tell and she became more withdrawn. Eventually, I told James I was leaving because I wasn’t happy in the house or the relationship. He was livid, swearing and shouting, saying that he didn’t want to see me again. I left and went to live with my sister until I found somewhere of my own.

This happened about three months ago, and I haven’t had any contact with James since then, other than to collect some things from the house. I asked how Annabel was, and he said she was fine, but didn’t really expand upon that. 

However, last week, I received an angry call from James saying how selfish and immature I’d been my not getting Annabel a birthday present. I knew it was her birthday but decided not to and haven’t tried to maintain a relationship with her because of the tension with James. James said how upset she was and that he couldn’t believe I put relationship issues over a 13 year old girl, who I knew didn’t have a mother. I told him he was being ridiculous and that if he wanted to cut me out of his life completely, that includes his daughter.

He said I was an asshole and a small gift or card would have meant the world to Annabel, before hanging up the phone. 

I sent Annabel a happy birthday text (the day after her birthday as the call was late), but she hasn’t responded.

AITA?",Confident_Hat_4582,3798,1.0,1,1711148735,2024-03-22 18:05:35,AmItheAsshole,https://www.reddit.com/r/AmItheAsshole/comments/1blczql/aita_for_not_getting_my_stepdaughter_a_present/,3,2024
1b5vv3d,AITA for not giving my sister $600 to come to my dinner at the fire station i work at,"Context: when you first get hired by the fire department the first 6 months are called probation. After you complete it you cook dinner at your station, invite your family and whoever else you want.

 I’d been telling my family since I first got hired that they ALL need to come. When I finally got the date I could have my dinner my 20 year old sister said she had tickets for a rave that day and cant change the dates anymore. This was an extrenely big deal to me and I’m very upset that she won’t just not go to the rave and come to my dinner. 

I rarely ask her to go places and she always flakes out and says she’s “tired” but has the energy to go out with friends every week. she then said if i gave her the money she spent then shed be able to go but also said id have to reimburse her boyfriend too, which i refused. not because i dont like him but because i dont want to pay 600 for my sister to come to an event i had been telling her about for months. She said unless i did that she can’t go, and im extremely upset and offended that my own damn sister would rather go to a rave then her brothers probationary dinner since this is like a wedding or graduation and not going is extremely messed up.  You go out to support your family cause you love them and want to be there for their accomplishments, seldom rarely do my other family members even fake smiles at these events but I know if it was the other way around I’d move heaven and earth to be there for my family’s big day.

",Valuable_Ad7539,3709,1.0,1,1709509177,2024-03-03 17:39:37,AmItheAsshole,https://www.reddit.com/r/AmItheAsshole/comments/1b5vv3d/aita_for_not_giving_my_sister_600_to_come_to_my/,3,2024
1bmybct,AITA for not inviting my ex best friend to my wedding even though I was the MOH at hers?,"I (31F) had a friend Maria (31F) growing up. We met when we were about 8 or 9, and quickly became best friends. We started slowly growing apart in high school as our schedules changed and almost completely lost touch during college. By the time we were \~23, we only saw each other once a year at Christmas for our old friend group’s Christmas dinner.  


Maria got engaged to her high school sweetheart and asked me to be her maid of honor in the wedding. At the time she asked me, we had not seen or spoken to each other in almost 2 years, so it honestly shocked me when she asked, but I agreed. She asked me about a year before the wedding, and after she asked me to be MOH, she did not speak to me again for 6 months. I had taken it to mean maybe she wanted to rekindle our friendship and reached out a few times during those 6 months to meet up for lunch or hang out, but she never responded.  


When she finally texted me, it was to meet up with her and her best friend (one of the bridesmaids) to pick out the dresses for the bridal party. She showed up 3 HOURS LATE. Apparently, she and her friend decided to meet up for lunch and to hang out before meeting me at the mall, completely ignoring our agreed upon time and the fact that I had already said I was there and waiting for them. I’m not going to go into details of the next 6 months leading up to the wedding, but that should give you an idea of how it went. By the time the wedding day came, I genuinely felt so used and disrespected. On the day of the wedding, Maria was just mean. I waited until the speeches and the first dance were over, then I left the reception and went home. I have not spoken to her since.  


It's been about 4 years since her wedding, and I am now engaged and getting married in 2 months. I did not invite Maria or any of our old friend group. In my mind, our friendship is well and truly dead. Apparently, Maria ran into my sister at a store and were chatting and my sister mentioned the wedding. Maria texted me (honestly shocked she still has my number) to send me her address “so I knew where to send her invitation” and I just responded “thank you, but the guest list is already set. have a nice day”. She told the friend group and now they’re all blowing up my phone about inviting them ‘for old time’s sake’ and that I owe at least Maria an invitation because I was her MOH. They’ve been posting on social media and now even my mom is getting involved, saying I should invite them all just to keep the peace and out of respect for our old friendship.

  
My argument is that I haven’t spoken to them in years, and I don’t care about this ‘wedding etiquette’ thing and I don’t owe her an invitation just because I was her MOH, especially considering everything that happened with her wedding. But literally only my fiancé is on my side. So, AITA?  
",throwaway1047u102985,3641,1.0,1,1711321427,2024-03-24 18:03:47,AmItheAsshole,https://www.reddit.com/r/AmItheAsshole/comments/1bmybct/aita_for_not_inviting_my_ex_best_friend_to_my/,3,2024
1bcgc6d,AITA For Giving My Wife The Cold Shoulder After She Donated Our Vacation Fund?,"I (41m) and my wife (39f) are people who like to travel. We take our kids (12f and 14f) on trips 2-3 times a year. And over the year I usually put aside money for travel. My wife's niece also needs knee surgery due to soccer injuries (soccer season ended a month or so ago) and my sister-in-law can't really afford it. I'm not sure how much health insurance will cover or how much the surgery will even cost, but they've been looking for help to pay for it. 

&#x200B;

Well after we booked flights and stuff, we had about 15k-20k left in the account. We didn't really know what to do with it yet.  

&#x200B;

FF to this morning, and my wife and I are talking about attractions and stuff and my wife kind of sneaks in to the conversation that we would have to pay out of pocket since she gave the remaining money to her sister. I was absolutely fucking livid because a) That was our money in the account, which means my money was also in the account and b) I'm SURE they don't need that much, especially if they have insurance which will most likely cover some of the surgery cost. 

&#x200B;

Since then, I went to work, came back, and haven't spoken to her since. She's tried to talk about it, but I don't want to talk about anything except my money getting back into my account. I feel bad for ignoring my wife and giving her shade but at the same time I'm really fucking pissed. AITA? 

&#x200B;

I can add any needed context in comments, since this whole thing is just kind of a blur in my mind. ",TAAITA9194949,3632,1.0,1,1710195739,2024-03-11 17:22:19,AmItheAsshole,https://www.reddit.com/r/AmItheAsshole/comments/1bcgc6d/aita_for_giving_my_wife_the_cold_shoulder_after/,3,2024
1bda5i9,AITA for threatening to cancel a cruise because my girlfriend wants to bring her dog? ,"I(26M) and my girlfriend(27F) have been together for about 2 years. We don't live together, but live about an hour away. She recently adopted a pit-mix from the shelter and the dog is horrible. Her growls and snarls whenever I visit her and she brings it with her when she visits me. I have a cat which I keep locked away when the dog visits as I don't trust it.  She brings it everywhere with her. 

She has been talking about going on a cruise as her parents came back from one that went to the Bahamas. I found a good deal on one to the Carribean. I booked it and sent my girlfriend the details. She's super excited and mentioned that she was even more excited that the dog could come. I immediately told her that the dog was not coming as I was not going to put people at risk and have the vacation ruined. Her parents are more than happy to watch the dog when we go away, but she is trying to fight me on bringing the dog along. 

I then told her that if she continue to press the matter about bringing the dog, I would cancel the cruise. She got pissed at me and started sending me horrible messages and telling our mutual friends that I was trying to separate her from the dog. I haven't spoken to her all day as I need space and time to think. She clearly sees me as the AH and trying to paint me as the bad guy. 

AITA for threatening to cancel a cruise because my girlfriend wants to bring her dog? ",Any-Hour7989,3545,0.9900000095367432,1,1710281231,2024-03-12 17:07:11,AmItheAsshole,https://www.reddit.com/r/AmItheAsshole/comments/1bda5i9/aita_for_threatening_to_cancel_a_cruise_because/,3,2024
1bpfugs,AITA for correcting my mom when she calls my son “MY baby”,[removed],Sweet-Little-Magpie,3426,1.0,1,1711580423,2024-03-27 18:00:23,AmItheAsshole,https://www.reddit.com/r/AmItheAsshole/comments/1bpfugs/aita_for_correcting_my_mom_when_she_calls_my_son/,3,2024
1b6pymg,AITA for throwing a piece of popcorn at someone who kept using their phone during a movie?,"The title is pretty self-explanatory... but here are the details...

We went to see Dune 2 (HIGHLY recommended) last night... in a VIP theatre with comfy seats and table service... which I mention because to attend, you must be 19+ -- they serve real drinks.

Seated two rows ahead of us, were three young women... 19-22 I'd guess.

They didn't shut up during any of the previews, and spoke loudly to each other throughout the movie... which is annoying, but, unfortunately, hardly unique these days.

But what was incredibly annoying... starting at about 20 minutes into the movie, one of them got onto her phone. She was only two rows ahead and it was full brightness, so it'd be an understatement to say it was distracting. She'd text, scroll instagram, watch TikTok videos... for a few minutes... then put it down. Ten minutes later, out came the phone again. 

After the third time, I said, quite loudly, ""Put the phone away!"" She looked back, gave me a look like ""STFU old man"", but put it down. And then, 10 minutes later, pulled it out again. Again, full brightness.

So I got a piece of popcorn and threw it at her... hit her on the head. As you can imagine, she turned around... ""Are you fuckin serious right now?!""

""Yeah, I'm serious, can't you live without your phone for a couple of hours?""

""Shhh!"", said someone

""Shut up!"", said someone else.

She put it away... and then, maybe 20 minutes later, out it came again.

I threw another piece of popcorn, which barely missed but flew by her face. She put the phone away and it stayed away for the rest of the movie.

Nobody stood, nobody clapped, nobody really cared. And that might have been the end of it, except after the movie, she quite bluntly said to her friend as we were walking out, looking at me, ""That's the asshole.""

In telling others about this this morning, I've come to understand that movie etiquette has changed from when I was 20. Back then, of course, there weren't phones... but it was unheard of to engage in behaviour that'd be distracting to others. And when phones appeared 30 years ago, you'd NEVER get on it during the movie, and if you had to, you'd walk out and deal with it. But these days, this is par for the course.

Anyway, if I'm paying $25 per ticket plus food plus drinks (expensive!) plus parking for a night out and a true theatre experience, I'd like to enjoy it with what I think is the environment all of that deserves. I can watch movies at home and get on my phone all I want, for free. This is supposed to be different.

Am I out of touch? AITA? Is this ok these days?

And maybe that behaviour is not OK, but AITA for throwing a couple of kernels of popcorn at someone? It was certainly effective.",canada11235813,3410,1.0,1,1709595363,2024-03-04 17:36:03,AmItheAsshole,https://www.reddit.com/r/AmItheAsshole/comments/1b6pymg/aita_for_throwing_a_piece_of_popcorn_at_someone/,3,2024
1bezcnp,AITA for not giving my house to my SIL?,"Throw away for obvious reasons. This happened 2 nights ago, and I'm still feeling some type of way about it. 

Background: My (30f) husband (32m) has a younger sister (SIL 25f), SIL is currently going through a divorce with 4 children. My husband and I also have 4 children. My husband and I live on a very quiet country back road in our little town, us and his family being the only residences on the road. So both his sisters and their families, and his parents, live within walking distance of our house. 

My husband and I have been married for 7 years and have 4 young children. My husband bought the land we live on from his parents when he was 18, and when we got married, we built a house on it. We designed our house with a big family in mind and designed it to be our forever home. It has never been a thought to move or look elsewhere. 

My SIL is going through a divorce. She is struggling, to say the least. She was in a very toxic relationship with her ex, with her contributing just as much as he was, and he filed for divorce and moved out, leaving the 4 kids with her. 

My mother in law called my husband 2 nights ago and asked if we would come over for a chat. We get there, and my In-Laws and SIL are sitting on the couch like they were staging some kind of intervention, it was just really strange. 

My MIL didn't beat around the bush at all. She explained how SIL's ex was getting the house in the divorce and they would be homeless within the month if we didn't give her our home. It honestly took me a second to comprehend what she even said, because it was so out of left field.

Husband didn't need that second and looked them dead in the eyes and said ""No."" 

In-Laws started telling us things like, ""You guys don't need all that house"" ""You guys can move into one of the new neighborhoods in town"" ""You guys can just built a new house"". 

I offered to open up our playroom and guest bedroom to them until they could find somewhere to live, we have air mattresses and the guest room has a full bath, but that was not good enough apparently. That's when we got up and left. 

They began yelling after us, saying we don't care about the children, family helps family, we're being greedy and selfish, etc etc. I'm Honestly so proud of how we reacted, because my first instinct was to go off and say some hurtful things, but we went just home, to OUR home. 

We love SIL's kids, and obviously do not want them to be homeless, but they don't need MY house at the expense of my own children and family. I don't see why SIL's family deserves my home, what about my kids? 

Now the In-Laws are calling/texting, saying we don't care about the kids, we're selfish and greedy, we're making her homeless, and I'm wondering if maybe we were too quick to say no. So AITA for not giving my home to my SIL?",ThrowThatAsterisk,3036,1.0,1,1710458669,2024-03-14 18:24:29,AmItheAsshole,https://www.reddit.com/r/AmItheAsshole/comments/1bezcnp/aita_for_not_giving_my_house_to_my_sil/,3,2024
