post_id,title,text,author,score,upvote_ratio,num_comments,created_utc,created_datetime,subreddit,permalink,month,year
1bm5c92,AITA for refusing to wear an awful bridesmaid dress to my sister's wedding?,"My (Jane, 25/F) sister Lisa (27/F) is planning her wedding. She's detail-oriented, has a preference about everything, and wants it all to look perfect. Part of her plan is for all six of her bridesmaids to wear the same dress in the same color, and we knew that going in to shop with her at a boutique. Unfortunately, the other five are much smaller than I am, so picking out a dress that fit us all became an issue.

&nbsp;

We all tried on her favorite dress at the end, and it took me a long time to get it on. Outside I could hear her squealing with happiness as everyone else walked out of their rooms, and saying things like ""This is the one!"" with her friends hyping it up. But not only is it a horrible pale color that makes me look sick, it's unflattering to the point where I have massive rolls in the back and look pregnant in the front, especially with shape wear, which just bulges everything out across my hips and pinches the fabric up the sides. I also can't move well in it, and can't raise my arms more than halfway.

&nbsp;

I tried to talk to Lisa about finding a similar dress that could work better for my body type, but she and the other bridesmaids insisted that this was the perfect color and dress. Lisa was dead set on everyone matching exactly and seemed locked in on it, so we ended up (quietly) arguing in the store in front of our mom and the sales associate who came to check on us. They tried to calm things down by saying the dress looked fine and everyone matched nicely, but it was pretty clear they were just trying to keep the peace. When I asked the sales associate, ""Does this dress looks fine *on me?*""  her face turned red and she started talking about how it was important to honor Lisa's wishes on her special day, and at that point I hurried up to change and left. 

&nbsp;

Since then, Lisa and I haven't talked, while both my parents insist that I need to suck it up and do what Lisa wants for her wedding, while also relaying that she's been really upset about this issue, but I have been as well. AITA?",MembershipOk8179,1803,1.0,1,1711234113,2024-03-23 17:48:33,AmItheAsshole,https://www.reddit.com/r/AmItheAsshole/comments/1bm5c92/aita_for_refusing_to_wear_an_awful_bridesmaid/,3,2024
1br0k7o,AITA for forcing my partner to see a musical with me?,"My partner (27m) is not a fan of musicals. He doesn't ""hate"" them so much as is just isn't something he would choose to do. My family and I (26f) love musicals and they were a big part of my childhood growing up.

We moved to London not that long ago, and as a going away present my Mum bought us tickets for the Back to the Future musical. This is a really nice gift since they aren't cheap.

I assumed by boyfriend would be fine to go with me, but now he is refusing, saying that he would rather just stay home, and he doesn't even like musicals anyway. He argues that I could just take someone else.

The issue is that I have not been in London long, and don't really have many friends here yet. I'm also quite a shy person, so asking someone I don't know that well to see a show with me is a bit anxiety inducing. Plus, it was something my Mum got for us to go and see together as I had told her previously that it was one of my partner's favourite movies.

I'm really annoyed at my partner for this, because the tickets have already been paid for, and I was hoping that even if he wasn't a huge musical fan he could suck it up for me. My options now are to either go by myself, not go at all, or force him to go with me (which he has complained bitterly about). AITA?",anxiousorganism,1798,1.0,1,1711749250,2024-03-29 16:54:10,AmItheAsshole,https://www.reddit.com/r/AmItheAsshole/comments/1br0k7o/aita_for_forcing_my_partner_to_see_a_musical_with/,3,2024
1bavc2o,AITA for asking a hotel employee how they knew my name?,"
I’m staying in a hotel in Dublin City for the weekend and have a late flight home tomorrow evening. Around an hour ago I went to reception to enquiry if they could keep my luggage safe after check out and before my flight. There were two men at reception I spoke to. One was the young male receptionist who checked me in yesterday. The other was an older man, (50s) but he was not wearing the hotel uniform. 

The receptionist said “yes that’ll be no problem” and I smiled and said “that’s wonderful” then the older man said “what time’s your flight weary fruits?” I said the time and then realised, he knew my name which surprised me so I added “oh, that’s funny, how did you know my name? I didn’t tell you…” now I honestly believe my tone was more curious and confused since it had caught me off guard. I honestly thought maybe I was wearing something with my name on it and even looked down to see! 

The receptionist, said “oh, I don’t think he called you by your name, maybe he said Madame?”, I say “oh really? My mistake!”, honestly relieved if not a little embarrassed but the older man chimed in “no, she’s right, I know your name weary fruits. It’s my job to know everything and everyone here”. I reply with a nervous laugh “oh that’s bit weird…” I expected he was going to say JK or that he’s the manager and prides himself on knowing names etc. I clock that it all seemed a bit weird since he didn’t try to make it obvious he was joking. My real name isn’t even close to Madame so I don’t think I misheard him.  

The older man then asks what room am I in. I was caught up on how he knew my name but wouldn’t say how he knew it, so I started to feel a bit worried. Out of instinct I asked “why do you want to know that… I’m confused”. I believe I said this timidly but with a bit of anxiety as I remember scanning both their faces as I said it.

The receptionist interjects and smiles as if to reassure me, “i think he just wants to offer you a late check out”. I feel a better so say something along the lines of “oh I see that’s very nice of you but I guess I’m still just a bit weirded out by the name thing. Sorry I have had a long day so…” The older man says “well, I was going to, but since you’re been such a b word - I won’t do that now”.

 This  caught me off guard. Out of instinct, I said “I’m sorry I think this is gone the wrong way but it just confused me that we’ve never met and you know my name”. He then double down and repeats a similar line about how he just wanted to be nice but I had to go and be a b word about it. He’s not smiling or laughing just for context.

I can tell from the receptionists face he is shocked. I took a breath, said slowly, calmly, “okay well, I think that’s it. I really don’t know what to do with “that” (I gesture widely in his direction) language. I don’t appreciate it and I don’t have anything else to say so….” I go to leave, they both call me back but I just raise my hand and say “no, I’m done” and I left the hotel for air. 
",Weary_Fruit6649,1795,1.0,1,1710026440,2024-03-09 17:20:40,AmItheAsshole,https://www.reddit.com/r/AmItheAsshole/comments/1bavc2o/aita_for_asking_a_hotel_employee_how_they_knew_my/,3,2024
1bex2yp,AITA for not supporting my wife in changing careers?,"Me (M29) and my wife (F28) have have 2 kids (4+2) and have been married for 4 years. My wife works part-time as a receptionist, while I'm a full-time plumber. When our 2 year old was born, he was very sick and as a result we have some medical debt.

We are not currently struggling, but are living just at the point where we are comfortable.

My wife hates her job, but keeps in it because she's good at it and it pays well enough for an entry level position. She has wanted to become a nurse for a long time, but was unable to attend college and with the kids it's fallen on the backline.

I'm sympathetic towards this, I really am and would love to see her follow her dreams and become a nurse, I've made that very clear. But, she wants to do it now, and honestly I don't really see how that is possible. Between the clinical placements, studying, paying for the course, working, our childcare situation, our debts, I cannot see how it would work.

My wife says she has spoken with her parents and the kids would be able to stay with them usually and she could get a nightfill job. But I don't feel like this is going to be enough, she will be earning a lot less and I will have to work more hours to make sure we are definitely financially alright. This will mean I spend less time at home, can't contribute as much to household chores, which she will have to pick up and balance even more work.

I said I can't support this choice and that she should wait a few years until the kids are in school and she has more time. She says I am an asshole, that she has a right to be happy in her life and I should be supporting her. She says its unfair that I get to enjoy my work (which I do) and she spends her days hating it.

I agree it isn't fair but I just don't feel like now is the time to go about this and can't support her choice to change careers.

AITA?",No-Werewolf2312,1768,1.0,1,1710452925,2024-03-14 16:48:45,AmItheAsshole,https://www.reddit.com/r/AmItheAsshole/comments/1bex2yp/aita_for_not_supporting_my_wife_in_changing/,3,2024
1b993fj,AITA for telling my son that he should've told me about his girlfriend's dietary restrictions?,"My son (25M) started seeing a new girl named Lexi around a year and a half ago. She lives a few hours away, but they see each other often enough. I'd never met her personally until now. I don't know much about her, but she makes my son happy and seems to have a good head on her shoulders. That's all that matters to me. 

Last Friday, we hosted a barbecue and party, around 25-30 people. It was mostly family and friends. My son asked me if he could bring Lexi, and I told him that it was fine. We had ribs, burgers and wings, as well as some sides that didn't have meat.

What my son didn't communicate to me, or to anyone else handling the food, was that Lexi is a very particular eater and wouldn't be able to eat anything we served. Lexi is Catholic and can't eat meat on Fridays. My son was aware of this and invited her to a barbecue knowing what would be served. On top of that, she also has a sort of ED (ARFID) that limits what kinds of foods she will/can eat without feeling sick.

She was really sweet, and I enjoyed her company, but I felt terrible watching her sit without food. When I asked if she'd eaten beforehand, she told me that yes, and that she wasn't hungry. I asked my son separately why he'd gone out to eat right before a barbecue, and he told me that that they'd come straight from her house. So I asked him if she didn't like the food, to which he explained why she couldn't eat the meat, and that she wouldn't eat any of the sides either. Since he didn't say anything beforehand, I asked her myself.

I asked Lexi if there was anything I could get or make her, or if she wanted us to run somewhere and pick something up. She asked if I had any fruit, so she had fruit salad. After everything was sorted out my son came up to me and told me that I'd embarrassed her and shouldn't have drawn attention to it. I told him that he should have tried harder to accommodate her, or to at least tell us beforehand that she wouldn't be able to eat what everyone else was. We easily could have made some plain salad or had fruit available at no hassle for anyone else, and she would at least be able to pick at something instead of going hungry. If it were addressed beforehand then I wouldn't have had to ask. 

My son left in a huff to bring Lexi home, and he's still insisting that I made a bad impression and that it wouldn't have been a big deal if she didn't eat. Apparently I made her anxiety worse, but that's according to him, so I'm not sure I believe it. AITA? Could I have handled it any other way?",Just_Possibility_904,1729,0.9700000286102295,333,1709855036,2024-03-07 17:43:56,AmItheAsshole,https://www.reddit.com/r/AmItheAsshole/comments/1b993fj/aita_for_telling_my_son_that_he_shouldve_told_me/,3,2024
1bghnkw,AITA not asking permission to use hubby's coffee?,"My (28F) husband (37M) is a huge coffee geek. He has a separate set of shelves and equipment for it. I have tried over the years to learn more about his process and how to brew but it just doesn't click for me like it does for him. I always buy instant/go to Starbucks because it's all the same to me. He never says the coffee I've made is bad, just that something is always off. It's too bitter/astringent/weak etc. But thanks me anyway for my efforts.   
My husband is going through a busy time at work and has for the past 2 weeks. He freelances, his latest client turned out to be very difficult and he's had to make a lot of edits for this project. As a result, he's more stressed than usual and is working longer hours. So I thought that if I made him a coffee in the way he likes, that would cheer him up about it all.   
Long story short, he did not like what I brewed. He didn't really have anything nice to say about my gesture and then when he learned what beans I used, he was very annoyed and shut me out of his office without any thanks.   
He had two containers of beans on the shelf. I used the container which was small and finished it. I did not realise it was a rare coffee and processed in a unique way. It cost more than triple the other bag which was mainly full and double the size. I thought that using up the beans in the smaller container made more sense so he can buy himself another bag from his long list of beans he wants. He refuses to ever have more than 2 bags at once so he can appreciate them a lot more (whatever that means).  
He's upset with me because I didn't ask permission and he could have told me which bag to use if I was going to try and make him a coffee. I'm upset with him for his reaction. No thanks and shutting me out of his office. I think the whole permission thing is so gross to me and I shouldn't have to ask whether I can use something in our home. AITA?",aitapermissioncoffee,1683,1.0,1,1710627345,2024-03-16 17:15:45,AmItheAsshole,https://www.reddit.com/r/AmItheAsshole/comments/1bghnkw/aita_not_asking_permission_to_use_hubbys_coffee/,3,2024
1bez2tm,AITA for laughing at my sister because our mom won't let her share a room with her fiance?,"I posted here about a year ago because my mom and sisters thought I was an asshole because I went to Mexico with my boyfriend instead of appeasing her and making him sleep on the couch. 

My little sister thought I was wrong for not being able to spend nights away from him. Well we still are not married and my mom won't change her rules. We are visiting them though. And she accepts that we stay at a hotel. 

My sister Anna was one of the howler monkeys bugging me because ""I lied"" about not staying at a hotel last Christmas. She and her boyfriend got more serious since then and they got engaged on Valentine's Day. 

Last weekend was my dad's 60th birthday and we all came home. As per usual I rented a hotel. My mom told Anna that since my old room was available her fiance could stay there.

My sister tried arguing but my mom said there was no way that they were sharing a room. Anna tried to get me on her side since I no longer follow any dumb rules. I laughed at her and reminded her that she called me names for choosing to spend Christmas with my boyfriend's family instead of putting up with our mom. 

She started getting pissy and saying it was different because she was engaged and I am not. Our baby sister spoke up and said she already told Mom that she was going to follow my example if she ever gets serious with a guy. I'm pretty sure my mom thinks I'm the devil. 

Anyway Anna is pissed that I laughed at her for trying to get away with something she scolded me about just a year ago. I just thought it was funny she thought the rules didn't apply to her. 

Yes she is my mom's favorite. It didn't help.",No_Review8351,1672,1.0,1,1710457952,2024-03-14 18:12:32,AmItheAsshole,https://www.reddit.com/r/AmItheAsshole/comments/1bez2tm/aita_for_laughing_at_my_sister_because_our_mom/,3,2024
1blbacm,AITA for calling my mother homophobic for suggesting that my girlfriend ‘fixed me’?,"I (18M) was gay for as long as I can remember. I recently started dating my childhood best friend Lexi (17F). We have been friends since we were 10. 

I haven’t had feelings for a girl before so I’m not even sure what my sexuality is anymore. All I’m sure of is that I really like (possibly) love Lexi.

My parents have always been supportive of my sexuality but my mother has always seemed slightly disappointed. She never said anything about it outright, but you can from certain looks/comments that she made that she would’ve preferred it if i was straight. My father always told me not to pay it any attention because at the end of the day, she still loved me and needed time to adjust. He also said that she wanted life to be easy for me and that being gay made my life more complicated.

My mother loves Lexi and before I came out, she always made comments about it Lexi and I being together in the future. Even after I came out, she’d insist on me keeping my room door open when Lexi was over because ‘anything can happen if a boy and a girl are alone together, it’s natural!’. 

Anyway, Lexi was over at my house last weekend and my mother kept commenting on how we were ‘soulmates’ or about how we were such an adorable couple. After I got back from driving her home, my mother was grilling me about our relationship (how long I had liked her, how long we were dating etc). When I was finally released from the hot seat, she made a comment about how all I needed was the right girl. I asked her to elaborate and she said that my being gay was just phase and all I needed was for the right girl to come along.

I got pretty irritated after that and said she was being homophobic. We got into a massive argument. Now, my older sister thinks I was being an asshole because I know that my mother isn’t homophobic and that she’s from a different generation so things she’s saying are outdated, not homophobic. I feel bad now. AITA?

",CherryBusy6946,1636,1.0,1,1711144436,2024-03-22 16:53:56,AmItheAsshole,https://www.reddit.com/r/AmItheAsshole/comments/1blbacm/aita_for_calling_my_mother_homophobic_for/,3,2024
1bpgq11,AITA for not wanting to dump $15k on my sister's 50th birthday celebration? ,"AITA for not wanting to dump $15k on my sister's 50th birthday? 

So, I am doing fine in life financially but my sister is like on another level, way richer than me. She paid for her house x10 what I paid for mine, no exaggerating. She is very family oriented and enjoys family reunions, even when they end badly or hurting people's feelings. Both our parents passed away some years ago. So family reunions are the siblings getting together with their respective families. 

1.5 years ago she announced that she wanted to do something special for her birthday: she gave me notice, basically, that she wanted to have a family reunion at a posh European location for at least a week (she and her family are exploring Europe for 6 weeks prior to the actual party). I told her I was going to try to go. I did not have the courage to tell her that for me it would be difficult, just financially speaking. Bringing my whole family (I have many kids) on this trip was going to cost me no less than 15k. Just airfare alone would be close to 10k. 15k is one year of tuition (my oldest is a Junior) and I have other money stuff to think about too. So, when a thing from work created a conflict, I was relieved to have an excuse to cancel. 
She was super disappointed, particularly because she had made it very clear how important this trip was to her. If it had mattered to me, she said, I would have made the trip happen. So, I guess IATA. 
But, AITA for not wanting to shell out 1 year worth of tuition $ in a one-week ""special birthday celebration"" for my rich sister? ",Luckyphoenix29,1626,1.0,1,1711582623,2024-03-27 18:37:03,AmItheAsshole,https://www.reddit.com/r/AmItheAsshole/comments/1bpgq11/aita_for_not_wanting_to_dump_15k_on_my_sisters/,3,2024
1blbtmp,AITA for being relieved when I found my friend was not adopting a child?,"Context: Randy (41M) and I (35M) have been friends since we took college courses together, same major and later finding out we lived in the same city but never met before. We've been through a lot as friends and have always had eachother's backs

After moving back to our hometown, we started a social group of about 15, then it grew and grew until we could fill an entire section of a bar and/or restaurant. Slowly but surely, people ended up not attending the outings as often when started having kids. Understandable. I loved our outings as I started drinking socially, never getting drunk. As far as I knew, Randy was also childfree and said when parenthood came ringing for them he'd say ""Another one bites the dust"" I'd reply ""Maybe we'll see them in five years""

Two months ago, I saw a post on Randy's facebook saying he was adopting a 1 and a half year old. It threw me for a loop because he'd never talked about wanting to be a Father or a burning desire. I was in a tailspin thinking ""Oh God, another one"" as my social circle has narrowed as they've had kids 

One month goes by and I see another post from Randy. He's a proud Dad

Of a dog. I was sooo relieved! I felt like I could howl at the moon because I wouldn't lose one of my favorite people to the parenthood Portal. 

Onto the conflict: At another one of our hangouts, Randy had shown his dog's picture to a bunch of oohs and ahhs and stories relating to their dogs' odd quirks. I said ""My heart lept when I realized he adopted a dog and not a kid, I was afraid I wasn't going to see him for at least five years"" We laughed, but Randy was a bit quiet. We finished our food and left. 

As we walked to our cars, Randy later told me I was a AH for being relieved he's a dog dad than a human dad and why was I so concerned about it? I told him that as I go on in life, it's hard to find non parents/childfree friends and I'm all for people doing what they want to do in life 

Randy asked why does that matter? I said I would've had to get used to a new reality with him as a Dad if he decided to have a kid and he knows exactly what that means. He's seen what happens with our parent friends we don't see unless it's at an event for their kid.  

Some of our mutuals are on my side saying I wasn't exactly wrong but I didn't have to say it like that. Others are on his side saying that I was wrong for saying I was relieved he was getting a dog rather than a child 

So AITA for being relieved my friend didn't adopt a child? ",Altruistic_Grass_428,1602,1.0,1,1711145780,2024-03-22 17:16:20,AmItheAsshole,https://www.reddit.com/r/AmItheAsshole/comments/1blbtmp/aita_for_being_relieved_when_i_found_my_friend/,3,2024
1b7kuhv,AITA for calling out a mom who was embarrassing a Hispanic woman over pronunciation?,"I (31F) was doing a friend a favor picking up her son at a day care run by a woman from Guatemala. At pick-up, I saw a woman in her late forties causing a scene about how the woman was “disrespecting” her four-year-old daughter by pronouncing her name as “Tee-ah” instead of “Thea” (her name). She was loud and calling the woman gross for not being able to get her daughter’s name right in front of both kids and parents.

I am not sure if I should have just minded my business but I said that the “th” sound does not exist in every language and that it is wrong to embarrass someone like that because of an accent. That definitely put an end to the scene as the woman ran off. Later my friend called to say that I caused a “problem” for her among the other moms at the daycare. AITA?",popcornwithparmesan,1600,1.0,1,1709683001,2024-03-05 17:56:41,AmItheAsshole,https://www.reddit.com/r/AmItheAsshole/comments/1b7kuhv/aita_for_calling_out_a_mom_who_was_embarrassing_a/,3,2024
1bpgv0b,AITA for telling my wife how much a doctors appointment costs?,"My (40m) wife (41f) is currently sick with a cold or flu. She tells me she wants to go to urgent care, I say cool so we start getting ready. She casually mentions “oh god they better not just tell me to go home and wait it out” to which I replied “yeah, that’d suck, especially cuz its $100 to be seen” (money is SUPER tight for us right now). She tells me no, they’ll bill us. I remind her that our insurance clearly states on the card the costs for urgent care is time of service. To which she says “fine! Fuck it! I won’t go” - I tried to tell her I don’t care about the cost I was just mentioning that would suck if they just sent you home and charged you. She runs off crying and slams the door in my face. AITA?",BrokenPickle7,1594,1.0,1,1711582970,2024-03-27 18:42:50,AmItheAsshole,https://www.reddit.com/r/AmItheAsshole/comments/1bpgv0b/aita_for_telling_my_wife_how_much_a_doctors/,3,2024
