post_id,title,text,author,score,upvote_ratio,num_comments,created_utc,created_datetime,subreddit,permalink,month,year
1b9893v,AITA for taking my grandchildren to Disney for the first time without their mother and refusing to apologize when confronted?,"My son made this account and asked me to post this story, because he claims my normal meter is skewed and the internet is going to tell me I am an asshole.

I recently babysat my grandchildren (5 and 4) for a period of four nights and five days so my son and his wife could attend a wedding in Mexico, and spend a few days on vacation. They approached me since her mother would not be available, and I initially said I wasn't comfortable with that. It seemed like a long time to watch the kids, and she has point blank told me that the woman's family is more important than the man's, so I was irritated I was being asked and not her mother. I will admit that I did give in when my son became very emotional, but I felt/feel like they were being manipulative.

While I had the kids I was invited to a birthday at Epcot and wanted to go. It didn't even occur to me to run it by my son or daughter in law, as I had the kids for an extended period of time and obviously they knew they would be going where I went. My daughter in law had previously mentioned wanting to save up for Disney, but she's said that about a lot of things, and never made me aware it was something super special to her. Also it was Epcot. It's not like I took them to Magic Kingdom and they had some magical moment of seeing their favorite character. 

When they returned and found out my daughter in law was furious and burst into tears. She said I stole one of her kids first and called me entitled. To be honest I didn't react well to being called entitled, when she was the one who had previously demanded babysitting. My son asked me to apologize as she was distraught over missing their first Disney trip, but I declined and asked them to leave. 

My son reached out again and said I should have asked for something that big, and his wife feels robbed. I know she is a huge Disney person, but it was Epcot, not quintessential Disney and I don't feel I should have had to miss out on a birthday party I wanted to attend. I told my son I am not apologizing for anything and maybe they should think about how they made me feel when they didn't respect my initial no. My son feels like Reddit is going to show me the error of my ways. ",Simple-Band-9096,10666,1.0,1,1709852408,2024-03-07 17:00:08,AmItheAsshole,https://www.reddit.com/r/AmItheAsshole/comments/1b9893v/aita_for_taking_my_grandchildren_to_disney_for/,3,2024
1bfs9jt,AITA for telling my wife to get over my daughters short hair? ,"I(40M) and my wife(42F) have been married for 5 years. I have a 14 year old daughter from a previous relationship. Her mother wanted nothing to do with her when she was born. When I met my wife, she was worried about being a bad step-mother to my daughter. They became close and they do a spa day every mother's day. 

My daughter has very long hair down to her shoulders. She hates putting it up in ponytails and she complains about the length of time it takes to blow-dry. She's a big tom-boy and one of her friends recommended she gets a pixie cut. I booked her an appointment to get the cut she wanted and she was very happy. She's been in such a great mood and loves having the short hair. 

When I brought her home to see wife, my wife dropped what she was doing and looked like she was about to faint. She asked why I allowed daughter to cut all her hair off. I told her that this is the cut my daughter wanted. My wife got furious and started telling me about how I ruined daughter's image. I shot back at her to get over the hair-cut as it made daughter happy. That was all I wanted was my daughter to be happy 

My wife continued to complain about the haircut even around my daughter and I had to tell her multiple times to drop it. My daughter has been very depressed and it's worrying me. I have been giving my wife the cold shoulder and she's being very cold to both me and daughter. 

AITA for telling my wife to get over my daughters short hair? 
",Mysterious_Raise_156,8246,0.9900000095367432,1,1710546616,2024-03-15 18:50:16,AmItheAsshole,https://www.reddit.com/r/AmItheAsshole/comments/1bfs9jt/aita_for_telling_my_wife_to_get_over_my_daughters/,3,2024
1b481pf,AITA For Expecting My Wife To Do Most Of The Pool Upkeep?,"I (36m) and my wife (35f) purchased our house 3 years ago. When we were in the market for houses, my wife stated that she explicitly wanted a pool. I didn't really care too much for a pool, but we had a flexible budget so I guess why not? I requested though, that if we bought one, she would have to do 80% of the upkeep, if not all of it. She agreed. 

&#x200B;

FF to now. I've done 90% of the upkeep, and my wife had an excuse every time I ask her to help me clean the pool, or check the alkalinity or pH level of the pool, she always ""too tired"" or ""she'll do it later."" I let it happen the first couple times, but it's kind of getting frustrating now. 

&#x200B;

But luckily, I have two employees that are extremely helpful: My son (7M) and my daughter (6F). Very well paid, no complaints so far. Yesterday, my employees were using their time off to go to school, so I got to cleaning. Technically draining, but it took long enough that is was just about done by the time my wife got back home. 

&#x200B;

By the time we were heating to bed, I asked her if she could clean it on Saturday (or I could help) but she hit me with the ""I'm busy."" She doesn't work on Saturday. I got kidn of upset about it and told her that she should be doing 100% of the upkeep anyways and I'm going to stop taking care of the pool from now. 

&#x200B;

She just told me to stop bluffing and went to sleep. FF to this morning, and she doesn't even want to discuss anything pool related or even anything related with me. 

&#x200B;

AITA?",Financial_Mortgage15,7466,1.0,1,1709333147,2024-03-01 16:45:47,AmItheAsshole,https://www.reddit.com/r/AmItheAsshole/comments/1b481pf/aita_for_expecting_my_wife_to_do_most_of_the_pool/,3,2024
1ba2tj3,AITA for saying I'm entitled to food my parents buy?,"Throwaway account

I'm going to keep this short. I'm in college and living with my parents. My parents had an oops baby. My sister is only 4. They can't afford childcare so instead of getting a part-time job to help out I take care of her when they're at work. 

We got into an argument because they haven't gone grocery shopping and we're running low on food. They used the last of the bread for themselves tonight and when I brought up what I would eat we got into an argument. They told me I'm grown and it's not their responsibility to feed me anymore. I told them that's bs and I'm entitled to food because I'm taking care of thier kid.

They're now calling me an entitled brat and saying if I don't fix my attitude they'll kick me out. I told them go ahead because then they'll be homeless because they can't afford childcare even with both of them working. My relatives are telling me I'm in the wrong because I am an adult and need to grow up. So Am I the asshole?",Maybe_Entitled,7024,1.0,1,1709940677,2024-03-08 17:31:17,AmItheAsshole,https://www.reddit.com/r/AmItheAsshole/comments/1ba2tj3/aita_for_saying_im_entitled_to_food_my_parents_buy/,3,2024
1bq9tze,AITA for refusing to take any responsibility for my dog until my wife was forced to rehome him?,"I am going to lay this out of n the most basic way I can. 

I work from home. As does my wife. She wanted a dog. I said we did not have enough time to take care of a dog. She pestered me until I agreed. We took our time and found a rescue that had several pups that met our criteria. Small. Adult. Requiring just a couple of short walks a day. They did home visits and stuff. 

It was taking a while. During that time my wife found a farm that had working Blue Heeler X Border Collie pups. She got me one for my birthday. I had one just like her when I lived at home with my parents. 

She is a beautiful puppy but not in any way what we agreed on. We live in an apartment with no yard. My parents have an acreage. I a very busy. I do not have time for all the training and exercise that she needs.  I told my wife thanks but no thanks. She refused to listen to me. 

So I just refused to bond with the pup. I didn't even name her. I told my wife I would make sure that the pup was fed and got two half hour walks a day since that's what we agreed on. Everything else was on her. 

It took two weeks o barking, chewing, and pooping until she rehomed the pup. Now she is mad that I manipulated her into doing what I said we should do to begin with. She said she thought I would love a puppy that was like my old one. IF WE HAD THE SPACE AND TIME FOR HER I WOULD HAVE. I am pissed that I had to even do it. I feel bad for the dog. I'm thinking of not even doing the rescue now that I know more about how my wife thinks.",Expert_Royal913,6447,1.0,1,1711667776,2024-03-28 18:16:16,AmItheAsshole,https://www.reddit.com/r/AmItheAsshole/comments/1bq9tze/aita_for_refusing_to_take_any_responsibility_for/,3,2024
1bcfrxs,AITA for asking my mother to leave because she won't stop wasting my food.,"My baby sister just had a baby and our mom came to help. My sister and her husband live in a tiny apartment with no room for my mom. I agreed to let her stay with me since I live only eight blocks away. It's walkable. My plan was to Uber her over in the morning and pick her up after work. 

I only eat one meal a day during the week. Supper. I have coffee for breakfast and some fruit for lunch. On Saturday I treat myself to a good breakfast and Sundays I take the woman I'm dating for brunch. 

My mother decided that this was unacceptable. She got up early and went through my fridge and freezer to make me breakfast. 

I told her that I appreciate it but that I do not usually eat breakfast. She said that was stupid. I very clearly communicated to her that she was welcome to eat anything in my home but to please not make me breakfast as it was a waste. 

She made breakfast the following day. I walked out without eating it. I figured worst case scenario I could  eat it for supper. 

She threw it out since I didn't eat it. I told her once more to please not waste my food. 

She made breakfast for me the next day. I asked her if she was developing dementia. She is wasting my food for no good reason. I'm not poor or anything but wasting food is a pet peeve of mine. She said I was being ungrateful for her help and she was doing it to be nice since I was letting her stay with me. 

I explained to her again that I did not need, want, require, or desire breakfast during the week. She said she understood. 

She made me breakfast the next day. I had had enough. I took her luggage with me when I dropped her off at my sister's home. 

I told my doorman that my guest was no longer welcome. 

I got so many messages from her and my sister all day long. Even my dad called me to ask me to change my mind. I said no. 

He had to drive up and rent an Airbnb close to my sister because my mom was too scared to stay by herself. He's retired so he didn't miss work or anything. 

My sister came over alone to talk to me. She said I was being a complete ass and that I could afford the food my mom was wasting. I said I could but that I didn't want to. She literally used up two months worth of my food. She made up huge breakfasts that I didn't even eat. I keep all my bacon in individual servings. She thawed out three for every breakfast. One for her and two for me. And I ate zero. 

My father has asked me to let her back in. I said I would under the condition that she understand that my food is completely off limits to her. She can pay for her own food. I said I would make room in the fridge and freezer for her. She said I was being ridiculous and petty.  

So my dad is staying neutral but my mom and sister think I'm a jackass. My girlfriend thinks the whole thing is hilarious band refuses to get involved.",Ok_Lavishness_3277,6323,1.0,1,1710194431,2024-03-11 17:00:31,AmItheAsshole,https://www.reddit.com/r/AmItheAsshole/comments/1bcfrxs/aita_for_asking_my_mother_to_leave_because_she/,3,2024
1bm6875,AITA for telling my mom that she's doesn't get to make the rules?,"I (17M) live with my three brothers (15M, 13M, 10M), and my ma (40F). We're not very well off. I pay almost half the rent, I pay for groceries more often than not, and I juggle having a job, going to school, and raising these three kids, one of whom is disabled.

I say raising, because my ma, between having two jobs and basically never being home, doesn't contribute. She's gone by 8am, and usually not back before 10 or 11pm. In the past year, she's been home even less, getting home later and later. I'm pretty sure she goes out drinking.

The fight went like this: My ma came home last night a bit before 9pm for once, instead of 11 or later as she's been doing. 15M came out of his room to say hi, and 13M was already on the couch reading something for school, so she hugged both of them, and said hi, and said she'd stopped by the gas station to buy us all something and gave us all a candy bar, which was cool of her. Then, she asked where 10M was, because she wanted to say hi to him.

Now, I've practically raised these kids on my own for years now. And I do my best. On the very rare occasion my mom comes home early, she usually just goes to bed.

I have 10M go to bed at 8pm, which I don't think is unreasonable, and I let the other two stay up until 10pm, because they're older. We all eat dinner at 6, get home from school around 4, and have a pretty clean routine altogether.

Now, my ma was asking where he was, so I told her he was asleep. She asked why, so I told her it's past his bedtime. She told me he didn't have to go to bed that early. I told her he did. She told me no he didn't, she'd said we could all stay up until 10. 

I said that doesn't work, and she told me she's the parent, and it does work. And then she said it's not my place to micromanage the other three. she said, her kids, her house, her rules. And then she exploded, that I could stop being such a control- freak, because it wasn't my place to do that, or to have signed up 13M for soccer, or to have repainted the fence, or to have taken 10M to the doctor some weeks ago, or any of the things I've been doing without asking her.

I told her, it's also my house, I pay a lot of rent, and they're basically my kids, because she's never around, so it's more my house, my rules, if we wanna play that game. I told her she wouldn't know what works for 10M, because she's too busy to know him. I told her I might ask for her input if she was ever around, but she never is, so I don't give a shit how she thinks I should raise these kids, and she doesn't get to have a say in it. Not anymore.

She broke down crying, called me ungrateful ""for all that she does"" said she ""doesn't know where she went wrong"" and left the room. She either went to her room or she fucked off and left the house, idk and idc. She's an adult, it's her life. 13M said I'm a dick for making her cry, and 15M left the room a minute later, saying he was going to bed. So, Reddit, am I the asshole for telling my mother off?",throwawaythrow2929,5945,1.0,1,1711236420,2024-03-23 18:27:00,AmItheAsshole,https://www.reddit.com/r/AmItheAsshole/comments/1bm6875/aita_for_telling_my_mom_that_shes_doesnt_get_to/,3,2024
1bgjh7n,AITA for asking my girlfriend if she'd be comfortable with her parents watching her so I could attend my brother's band concert?,[removed],PsychologyIcy2861,5396,1.0,1,1710632473,2024-03-16 18:41:13,AmItheAsshole,https://www.reddit.com/r/AmItheAsshole/comments/1bgjh7n/aita_for_asking_my_girlfriend_if_shed_be/,3,2024
1bsniht,AITA For not specifying that my sibling is a man?,"My older brothers name is Viktor but no one has ever called him that. Ever. Everyone calls him Vik. I call him Vikky, something I started as a kid. He's like ten years older than me, doesn't live at home, yada yada.

Anyway we're going on our family vacation in a week. I was allowed to invite a friend. I invited a friend from my dance class - we've gotten pretty close recently. I told her we'd be sharing a room with Vik. She was fine and we started planning our trip.

Anyway yesterday my friend came over - she's never met Vik, obviously, and our parents wanted her to meet him before we fly because he'll basically be responsible for us (our parents pair the kids off so they get to relax).

When she got introduced to him she immediately, like, freaked out, and told me she no longer wanted to go and got her parents to tale her straight back home. I was obviously upset and I didn't know what had happened.

She called me later and said shebwas upset because I'd never told her Vik is a man. I was confused because like, yeah, I'd never outright called him a man but I've definitely called him ""he"" before and referred to him as my brother.

I said this to her and she told me she never called me call him ""he"" (blamed my accent) and that she assumed ""brother"" meant my other brothers (I have seven).

She told me she doesn't feel comfortable sharing a room with a grown man for a week and no longer wants to come. I'm really, really upset, but feel like if it was that big of a deal for her she should have asked?

I told her she was being unreasonable. Like, fair enough she shouldn't go if she's uncomfortable, but it's not my fault she didn't ask. She thinks I should have been upfront about it.

My parents think I'm being mean, my brothers are divided. So AITA?
",Wild-Question-147,5180,0.8399999737739563,1624,1711925558,2024-03-31 17:52:38,AmItheAsshole,https://www.reddit.com/r/AmItheAsshole/comments/1bsniht/aita_for_not_specifying_that_my_sibling_is_a_man/,3,2024
1bavkf0,AITA for leaving a barcrawl early without my girlfriend?,"I (27 M) just got home about 45 minutes ago and am currently dealing with my very pissed off gf (29 F). We have been dating since November after meeting off of hinge. 

Every year, the weekend before St Patrick’s day weekend, her friend from highschool “Dean” has a birthday barcrawl. A lot of people go; there must have been like 40 people there. My gf has known dean since highschool and she even dated him for a bit then. We are much older now so that doesn’t bother me. 

What bothered me is that my gf basically barely talked to me the entire time we were there. We got to the pregame around noon and went to the first bar at like 2 PM. She kept running off with her friends and I didn’t know a single person who was there. These aren’t friends she sees that often so I’ve never met them before. I spent most of my time at the first 3 bars looking for her. She was pretty drunk and hyper and I know she was looking forward to seeing these friends but it still felt like she ditched me. 

I even expressed to her that if she wanted to go without me it would be okay because I am kind of shy and not great with large groups of people i don’t know. She insisted that I go however so I did. Only for her to not be around me most of the time. 

When it came time to go to the third bar, I found her and told her I had an Uber coming back to my apartment and she can come over when she’s done. I said I didn’t care at all if she wanted to stay but I was done and didn’t really feel wanted at all. She tried to get me to stay but I insisted it was all good but I just wanted to leave. 

Now she is saying she’s not gonna come over and she’s mad at me for leaving. Even making snide remarks about how I don’t let myself socialize. So was I an asshole here?",Crazypaddythrowaway,5176,1.0,1,1710027058,2024-03-09 17:30:58,AmItheAsshole,https://www.reddit.com/r/AmItheAsshole/comments/1bavkf0/aita_for_leaving_a_barcrawl_early_without_my/,3,2024
1bbmrxj,AITA for telling my sister she doesn’t have a say in my nieces diet,"I adopted my 8 year old niece 5 years ago. Her parents just weren’t fit to be parents. They are still involved in her life as her aunt and uncle. 

My niece is homeschooled. She goes to a co op 4.5 hours a day, 4 days a week. I work 3 12 hour shifts a week so I usually need help getting her to and from co op 1-3 days a week. My sister works nights and is available to take her. Since it’s a bit of a drive back to the house, she usually hangs out at the co op and helps out with whatever they need. 

One mom at the co op makes lunches for the kids as her contribution. She has all of their allergy/dietary info and none of the kids have complained so far. Some examples of their lunches are turkey/ham sandwich, pb&j, mac and cheese, chicken nuggets, grilled cheese, hot dogs, and occasionally pizza. 

She also gives them sides like a cracker (goldfish, cheezits, chips, ritz, veggie straws, etc.), some kind of fruit (fruit slices, fruit cups, apple sauce), some kind of dessert (fruit snacks, cookie, brownie, etc), and a drink (usually milk or juice). 

My sister told my niece that she doesn’t want her eating that crap and that when she takes my niece to co op, she’ll be packing my niece a lunch. Apparently she told my niece that carbs are bad for her and that these lunches will make her fat. 

My niece came to me upset about it because she likes those lunches and that’s what everyone else eats. I told her that my sister was wrong then sent her to play before calling my sister. 

My sister defended everything she said and I told her that if she has concerns about my nieces diet, she will need to speak to me about it, not my niece. I also told her that I am my nieces parent, not her, and that if she feels that she has the power to make unilateral decisions regarding her health without consulting me I will get her a babysitter that can take her to co op. 

A lot of my family is against me on this and says that it’s my sisters kid so she should have a say and that me getting a babysitter will be cruel to both my niece and my sister (she already stays with my neighbor during the day but my neighbor can’t take her to co op). AITA for telling my sister she can’t make decisions about my niece? ",cooplunches,4810,1.0,1,1710108921,2024-03-10 17:15:21,AmItheAsshole,https://www.reddit.com/r/AmItheAsshole/comments/1bbmrxj/aita_for_telling_my_sister_she_doesnt_have_a_say/,3,2024
1batxxj,AITA for being honest when my dad asked where my mom was on my wedding morning?,"I recently married my beautiful wife ""Amanda"" She isn't the biggest fan of my mom and that is probably mutual idk. Amanda knows I am on her side and here to support any boundaries. She was concerned about how my mom would behave at the wedding and admitted to not wanting to spend any more time with her than absolutely necessary.

I ended up going to my mom's husband ""Chris"" and asking if he had any thoughts so we could all have  a peaceful day and no bridesmaids would need to ""accidently"" spill anything. At first he didn't want to help, but he didn't want my mom to feel embarrassed and gave in. He said it was already going to be a long day for her, so he recommended no pre wedding festivities and said he would get her out of the rehearsal dinner early, so she had enough time in between. He took her out right after dinner and took her somewhere else.

The day of the wedding she was not invited to get ready with the bridal party or have a champagne breakfast. Instead Chris took her to the beach for a long run (get that energy out) Then took her to a nice breakfast, home for some one on one attention, and let her know he had a special day planned the following day. She got her makeup done at their house and came just in time for the wedding. 

My stepmom ""Lexi' was however invited to get ready with the bridal party. I guess she told my dad my mom wasn't there and he asked me. I told him the truth that Chris was taking care of her as it would be too long a day for her. I guess he told someone else because my mom found out and was furious.

She asked how I could humiliate her and said I'm a shitty son. She said I could have said nothing and accused me of not loving her. She said she knows the truth that we just don't like her or want her around. I felt kind of bad after that encounter and was wondering AITA?",Anonnonnononon,4619,1.0,1,1710022822,2024-03-09 16:20:22,AmItheAsshole,https://www.reddit.com/r/AmItheAsshole/comments/1batxxj/aita_for_being_honest_when_my_dad_asked_where_my/,3,2024
