post_id,title,text,author,score,upvote_ratio,num_comments,created_utc,created_datetime,subreddit,permalink,month,year
186p36m,CMV: a Trump 2024 presidency would irreversibly alter United States politics & partisanship as we know it,"Loaded post, I know and this is a bit heady, but please let me explain. I’m from the Midwest and Trump supporters are everywhere. They frequently claim that Trump is being hit with “political” legal attacks during these court cases. They claim this like they’re saying something outrageous. They also act like Trump wouldn’t do the exact same thing against his opponents, or worse if re-elected. 

First off, obviously the cases against trump are completely political. He’s the former president, and I don’t see any republican plaintiffs. However, when I mention politics, I’m looking past the superficial ideological divide and I’m analyzing the actual mechanics and science behind “power” and mass influence. The study of politics is just that, the discipline studying the application of power and exercise of authority. Any system with more than one individual is political because there will be a power imbalance. There cannot be two chefs cooking the same meal unless one delegates. This is power and its political. 

In my view, systems of power become contentious when you have powerful individuals supported by other powerful people, institutions, or undifferentiated masses. Such as a political party. 

Trump is currently being tried for many different alleged violations, both civil and criminal. Trump was a former and recent president of the United States. This dynamic is completely unprecedented in the balance of Anglo-American politics. Trump could have murdered 3 people with a knife on camera and admitted to it and prosecution of him would still be political. It’s inescapable that the act of exercising government power against trump in the form of judicial oversight is an act of political power. It’s irrelevant how much or how little Biden, or any democrat, has to do with any prosecution. Its political no matter what.  Submission to any court and its laws, under any circumstances, is a recognition of political sovereignty. The very act of Trump, an important political figure, being accused and called to answer for his crimes is political. 

Therefore, if Trump somehow wins in 2024, as a felon or otherwise, it is unthinkable that he would be able to restrain himself from challenging the political systems that tried to hold him accountable in the first place. Even if he wanted to restrain himself. Again, it’s politics, if he is in power he will exercise it, his supporters would command him to do so regardless, right? Given the inherent political nature of the proceedings against him, it seems obvious to me that Trump would use government power to do something equally political. 

Since the nation is already in uncharted waters trying to prosecute a former, contentious president, if Trump wins in 2024, there is an incredibly likely chance that Trump would respond in kind and legally prosecute his enemies or otherwise exercise political power in ways unseen in American political history. 

This post is a prediction, one that I feel many Trump supporters are either ignoring or they want it to happen. Either way change my view and make it easier for me to live in TrumpTown and not be so cynical of US politics. Please poke holes in my appraisal of the situation. Please give me a reason to change my view and expect a boring election cycle in 2024. 

TL;DR: Trump is being accused of felonies and other crimes. Political or not, it’s all politics and it’s unthinkable that if re-elected, convict or otherwise, Trump will launch legal actions against his perceived enemies and a dramatic political battle, unprecedented in scope and scale, will erupt if he wins 2024.",Ok-Story-9319,1024,0.7300000190734863,1186,1701263573,2023-11-29 07:12:53,changemyview,https://www.reddit.com/r/changemyview/comments/186p36m/cmv_a_trump_2024_presidency_would_irreversibly/,11,2023
17q0cl6,CMV: There is no compelling reason to be angry about diversity in media,"Do you ever see those articles or videos of people complaining about ""wokeness"" in media, but they never quite describe what that is? Based on the context, it sounds like they're just complaining about diversity. I think more diversity is a good thing, because the world is diverse. That's just reality.  
  
I love the show Friends, but I'm going to pick on it a bit just as an example. It takes place in New York, and all the main characters are straight white people. Almost all the supporting characters are white people. It isn't very realistic in its portrayal of New York, because the city in reality is not 99% white people.  
  
My point is-- having more diversity makes sense and is more of a good thing than a bad thing. It's a net positive.  
  
Now let's look at some of the arguments these people make:  
  
**""Executives are forcing diversity just to pander.""**  
  
Probably. But executives have always pandered. Their job is to appeal to people in order to maximize profit. Why zero in on diversity as the main cause of this? It's a broader issue of studios chasing the dollar. At least in this case, the result of having more diversity isn't really a bad thing.  
  
**""They sacrifice good writing for diversity.""**  
  
Once again, these are two separate things. I agree that telling a good story should be the focus. Why would diversity have anything to do with this? Why pick out diversity as the thing that is making movies forget to tell a good story? There have always been poorly written movies long before diversity was encouraged.  
  
**""They make unnecessary changes to things we love.""**  
  
Anytime something is brought back for a reboot or new adaptation, there are going to be changes. Not all of these changes will be strictly ""necessary"". As long as you don't have an attitude of being resistant to all change, I don't see why changing something just to be more diverse is a bad thing. Why not instead just blame the changes that actually harm the story and characters? A minor change like a character having a different skin color does not sound harmful to me. It sounds like a very minor change.  
  
**Conclusion**  
  
To bring it all together, let's suppose they rebooted Friends with entirely new actors playing the same characters. And none of the acting was good. And they changed the race of one of the the main characters. And the writing was terrible. What would you think of all this? What would you mention in a critical review of it?  
  
I would think rebooting it in the first place is a completely unnecessary cash grab. I would be irritated by how bad the writing is. And I would point out how the new portrayals are not nearly as good as the original cast. So I'd have a lot of criticisms of the reboot, but none of this has anything to do with diversity or being ""woke"". If they decided to make Rachel black, I wouldn't care that the character was black. I would care that the new actor doesn't do as good of a job as Jennifer Aniston.  
  
Am I missing something? Where does this anger towards diversity come from?",Hal87526,1022,0.6800000071525574,1494,1699380369,2023-11-07 12:06:09,changemyview,https://www.reddit.com/r/changemyview/comments/17q0cl6/cmv_there_is_no_compelling_reason_to_be_angry/,11,2023
17zm3f0,CMV: people that don't opt-in for organs donation should go bottom of the list when it comes to become recipients,"This post is on the back of yesterday's post about how the default for organs donation should be opt-in and people should explicitly state that they want ot opt-out.

I was quite shocked at how many replies were against it, some people talked about ""tricking"" people, I'm not sure why, informative campaign could be done, is not some complex concept that the average person in the street can't understand. Also I'm not going into the debate on why people would rather have their organs rot in the ground instead of helping a fellow human being, but here's a proposal that I think would reconcile these views:

We keep the system as it is, but if you don't opt-in as an organ donor you go to the bottom of the list if you ever need one. Here are some points that got me to this idea:

* We already give priorities to organ recipients: age, medical history, etc (basically chances of survival) are already taken into consideration when lists are compiled, it's not just first come first served.
* It totally respects individual freedom
* It incentivize much needed organs donation  
* it's fair to people that opted in 

Just to reiterate: I'm not saying that people that are not organ donors DON'T get an organ ever, only that they get a lower score compared to people that opted-in, that's only fair, if you think your organs are too precious to donate even when you're dead, surely you can't expect others to do any differently. Otherwise you're just an HYPOCRITE. It's all about FAIRNESS. 

Now, I'm bias to the argument, my other half has received a kidney and is one of those things that people that haven't been through can't understand what it means to see a loved one getting sick, going through dialysis, going through the long process of getting into a recipient list and finally the long wait. 

Final couple of points: 

I'm sure there're super rare occasions where my POV may create some contradictions, we can discuss them and (as a society) find a solution, I don't believe in discarding good ideas just because they are not so good in the 0.1% of cases.   
Different countries have different protocols for organ donation/transplant. So pointing why it wouldn't work due to a specific law/regulation is a bit of a weak argument. I believe in principle every modern democratic country could implement this idea. 

&#x200B;

&#x200B;",invertedBoy,1005,0.8199999928474426,752,1700478283,2023-11-20 05:04:43,changemyview,https://www.reddit.com/r/changemyview/comments/17zm3f0/cmv_people_that_dont_optin_for_organs_donation/,11,2023
17rv33x,"CMV: in North America, the generations voting from the 50s to the 2000's ""pulled up the ladder behind them"".","""pulling up the ladder behind them"" refers to the idea that they achieved economic success, and then removed the programs that enabled them to achieve that success. Now. How did they do that?

1) national debt. American interest is at ...like almost a trillion dollars today. That didn't just ""happen"", obviously ""hey do you want to borrow money somebody else will have to pay""... who says ""no"", right? not america or canada. 

2) constantly increasing minimum wage throughout their working life, while engaging in free trade deals to make it easy to outsource work for cheap products. then, engaging in mass immigration because foreign workers will accept jobs for passports that kids just wont do that cheap.

3) underfunding education once they or their own kids had graduated. They increased class size, started giving university spots to foreign students, and allowing raising tuition to make it less accessible/more daunting. they also removed or reduced public childcare programs in many places.

4) sending cities and other governments into debt with spending that increases the value of their land,    and not raising property taxes like other taxes.

5) the bailout. measures to keep their investments and economic predictions and pension on track, at the expense of everyone else.

A lot of these things amount to short sighted behavior, in my opinion. It's selling out the future to make things better today. And a lot of them seem to be, kinda obviously, ""too good to be true"" - national debt and minimum wage, esp, seem like free money.",shtreddt,928,0.8399999737739563,600,1699586951,2023-11-09 21:29:11,changemyview,https://www.reddit.com/r/changemyview/comments/17rv33x/cmv_in_north_america_the_generations_voting_from/,11,2023
17m7age,CMV: gendered bathrooms are unecessary and most bathrooms should be available for any gender.,[removed],Simple-Young6947,858,0.7099999785423279,874,1698942140,2023-11-02 11:22:20,changemyview,https://www.reddit.com/r/changemyview/comments/17m7age/cmv_gendered_bathrooms_are_unecessary_and_most/,11,2023
17now0j,CMV: Leftists/LGBTQ+ people who support Palestine doesn't make sense.,"I'll start by saying I'm from SEA, so my perspective may be incomplete and I may have missing information, but I'll start with what information I think I know:

My understanding is Israel was formed after WW2 to give surviving Jews their own nation. This displaced the Palestinian people and while some do integrate into current Israel, a large number are in Palestine and over several years Israel has treated them badly and displaced them from their homes.

A few months ago Hamas, which my understanding is a terrorist group but is also supported and elected by the majority of Palestinians, launched a cowardly terrorist attack that killed many innocent people.

In response, Israel has acted like the US did after 9/11 and has attacked Palestine relentlessly. 

Since then, I've seen a large population of left leaning and LGBTQ+ people supporting Palestine, as well as rightist nazi 4channers. This confounds me. I expect the nazi 4channer types to support Hamas because they hate jews and Israel, but the other side confuses me.

My understanding is a large amount of palestinians support the terrorist attack, and also a lot of muslims hate LGBTQ+ people and would kill them if they could.

So I don't understand how anyone part of those communities could support people who hate them and would kill them, just because Israel is taking revenge.

I feel like if you do a terrorist attack, you're now in the ""find out"" phase of the ""fuck around and find out"" phase.

Looking for some perspective on why so many leftists support Hamas/Palestine on this. What do they honestly expect Israel to do in response to this attack? If the attack leads to Israel bending the knee, wouldn't that encourage more muslim terrorists to attack Israel? they can't afford to look weak.

I'm open to having my view changed but I do strongly think it's foolish and a case of ""living in an ivory tower"" if you're part of these communities and pledge your support of Palestine/Hamas.",fexterslab,825,0.6100000143051147,3365,1699114064,2023-11-04 11:07:44,changemyview,https://www.reddit.com/r/changemyview/comments/17now0j/cmv_leftistslgbtq_people_who_support_palestine/,11,2023
180kyd2,CMV: I don't think the Marvels failed because moviegoers are sexist and racist,"As somebody who enjoys writing, I can empathize with the director Nia DaCosta. I would be heartbroken if a story I'd poured blood, sweat, and tears into was shunned by so many people and, going by any metric, the Marvels has failed to attract audiences. 

Nia DaCosta herself did an interview in which she said ""There are pockets that are really virulent and violent and racist — and sexist and homophobic and all those awful things. And I choose the side of the light. That’s the part of fandom I’m most attracted to."" I don't think it's fair to interpret that as her saying superhero fans in general are these things or the movie failed because of these things as some people are. 

But there are others who are convinced bigotry is responsible for the failure of ""The Marvels"" or at least primarily responsible. Based on the data I've seen, I don't think this is the case. It's true that white people and men didn't turn out in large numbers which could suggest bigotry was a major factor. But nobody else did either. 

So why did the Marvels perform poorly? In my view...

The Marvels itself does not score particularly well with critics. This is probably the biggest factor. A movie can have legs if it gets good word of mouth from viewers and critics. Elemental is a great example. Bombed initially, but came roaring back. The A cinema score no doubt helped it. And elemental touched on racism and discrimination too. 

Due to the strikes there was limited press

There's a lot of superhero fatigue. I personally couldn't make it through more than 15 minutes of part 1 of avengers endgame. 

These all seem like more logical explanations than rampant racism and sexism. CMV",ICuriosityCatI,818,0.7200000286102295,1070,1700584125,2023-11-21 10:28:45,changemyview,https://www.reddit.com/r/changemyview/comments/180kyd2/cmv_i_dont_think_the_marvels_failed_because/,11,2023
17nqvow,"CMV: Any ethic group (including whites) can experience racism, it is just that the defenition of racism has changed to only include ""structural"" racism.","Hello,

My place of work has recently been running workshops on ""anti-racism"". I myself have been trying to engage with it as much as I can to try and better myself. 

One aspect that I find difficult is the idea that racism has to have a power inbalance. In my own country (the UK) a white person cannot experience racism as they hold more structural power. They can be *discriminated* against but that is not racism. 

I find this idea difficult for two main reasons:

1. I always thought and was taught growing up that racism is where you disciminate based off of the colour of someones skin. In that definition, a white person can experience racism. The white person may not be harmed as much by it, but it is still discriminating agaist someone based on their race. 
2. In my place of work (a school), we have to often deal with racist incidents. One of the most common so far this year is racist remarks from black students towards asian ones. Is this racism? I can't confidently decide who has the greater power imbalance! 

I promise that this is coming from a place of good faith!

&#x200B;",BrightonTeacher,817,0.75,731,1699119733,2023-11-04 12:42:13,changemyview,https://www.reddit.com/r/changemyview/comments/17nqvow/cmv_any_ethic_group_including_whites_can/,11,2023
17qex82,"CMV: The narrative that ""a voice actor should only voice characters of the race they belong to"" is not only nonsense, but has the potential to horribly backfire on the people promoting it if applied to them without excuses and compromises.","Let's deconstruct this narrative. It's very straightforward. A voice actor of race X, should only voice a character also of race X. If character is of race Y, then only a voice actor of race Y should play that character.  
I disagree with this. To me, voice acting comes down to the quality of your voice, your ability to take on the role and voice it. To me the narrative being put forward is nonsense, because what it is pushing goes against what I see voice acting as. It promotes the disqualification of a so many talents, based on solely on their race. We demote ourselves from choosing quality to now choosing skin color.  
Now to be clear, I am not saying people of a race are not good at voicing certain races or their own race. Rather, I am arguing that we are making quality less of a priority. And to illustrate this, let me entertain two scenarios:  
1. A white voice actor is chosen to voice a person of color because they are better at voicing the \*\*character\*\*, than the voice actor who is of the same race of the character, \*\*but\*\* is not as suited to the character as the people making the content desire.  
2. A \*\*non-white\*\* and \*\*non-Japanese\*\* voice actor, is chosen to voice a \*\*Japanese\*\* character in an anime, even though the character is not their race, because their voice acting ability is better suited to that character than the available Japanese voice actors who are the character's race, but not as suited for that character.  
I support both of these scenarios for being reality, because in both cases the \*quality\* of the persons ability to voice the character is what took priority. If the voice actor is chosen for a character who is also of their race, it should be because they had the talent to voice a character, who is not just defined by their skin but their way talking, the \*personality\* of their voice, which the actor was able to bring out better than other actors. Not because they were the same race as that character.  
Now I also made the claim in my view that the narrative has the potential to \*backfire\* on the people promoting it. And to explain it quite simply I need only point out that the people promoting these views... A themselves voicing characters not of their race. I don't even mean voicing non-human-like characters. I mean human beings or human equivalent characters who are of a certain race/ethnicity, being represented by voice actors who are not that race/ethnicity.  
For example:  
Mr SungWon Cho. Ethnicity: Korean.  A prominent promoter of this narrative.  
His roles include:  
Vice Admiral Legrange - Anglo-French ([86](https://www.animenewsnetwork.com/encyclopedia/anime.php?id=24481))  
Kajinosuke Tanikaze - Japanese ([Records of Ragnarok](https://www.animenewsnetwork.com/encyclopedia/anime.php?id=24643))  
Koutaro Tatsumi - Japanese ([The Honor Student at Magic High School](https://www.animenewsnetwork.com/encyclopedia/anime.php?id=23898))  
This nice video reel of his roles [on his Twitter (X) account](https://twitter.com/i/status/1717961644331208749). Plenty of non-Asian, let alone non-Korean roles there  
Ms Shakyra Dunn. Ethnicity: Black as per her twitter. An example I wish to put forward of who this would backfire on.  
Her roles are all compiled her by herself which saved me a lot of trouble:  
[On her instagram](https://www.instagram.com/p/Cx5yR18uKwW/)  
Now if we were to apply this narrative upon them, then they would have to relinquish a great number of roles, not because they can't voice them well, but because they are not the same race/ethnicity. And I am willing to bet that a good number of the voice actors who promote this narrative would also lose a large portion of their roles, because they do not fit the race of the character. In other words, it would backfire on them.  
The only way to avoid this backfiring would be to make exceptions and compromises. To say ""Oh well but this is different...."". No if we are going to go with this, then we need to go all the way. If this narrative is going to dominate voice acting then everyone should face the consequences that come with it, regardless of their race. And that would be the biggest backfire for the entire voice acting community for what I believe is absolute nonsense.  
It would reduce voice acting to be a race based profession first and talent based profession second. The mighty Kratos from God of War (Norse) is voiced by Christopher Judge, a man who has my favorite voice for Kratos in the series. But Kratos is Greek. And since voice acting is supposed to be done by the matching race.. Oh well I guess Christopher loses his job huh?  
I hope I have properly illustrated my view. And hope to see if anyone can find a way to change my view. You may change it by convincing me that voice acting should be about race first and talent second and that this would not backfire on the people promoting it.",Delusional_Gamer,805,0.8799999952316284,324,1699421910,2023-11-07 23:38:30,changemyview,https://www.reddit.com/r/changemyview/comments/17qex82/cmv_the_narrative_that_a_voice_actor_should_only/,11,2023
17xur4t,CMV: Vegan “leather” is dumb,"Alright first off I would like to make it clear that this is not an attack on veganism; its a noble cause to minimize the suffering of animals but vegan leather in particular is a terrible alternative. Although I am not vegan because meat tastes too good.

Firstly its simply lower quality that real leather.
Leather fibrous structure is much more durable than faux, leading it to last longer. Even if its for something that doesn't need to be resilient, leather patinas beautifully as it ages, while faux just breaks down and cracks. Because of this vegan leather is replaced more often than produced more waste.

Not only does faux create more waste but it also is much worse for the environment. Leather is biodegradable because it obviously comes from animals. 90% of vegan leather is made of plastic which cant say the same. There are some alternative vegan leathers made of cactus and other stuff but they are uncommon and still mixed with synthetic materials which also do not biodegrade.

So vegan leather produces more waste, and is more environmentally taxing but at least its free from animal suffering right? Well yes, but you can make an argument that leather is too. Almost all leather is a biproduct of the meat industry, meaning cows aren't being killed for their hides. If we all stopped buying leather it wouldn't have a major effect on the quantity of cows being slaughtered, we'd just use less of the cows. I view it like the Native Americans and the buffalo. To show respect for the buffalo they used everything. Nothing went to waste. Their hide is better as a pair of boots than rotting in a landfill.

Anyway if anyone feels I am misunderstanding why people prefer vegan leather, change my view. Thanks",SennheiserHD6XX,804,0.7599999904632568,516,1700270417,2023-11-17 19:20:17,changemyview,https://www.reddit.com/r/changemyview/comments/17xur4t/cmv_vegan_leather_is_dumb/,11,2023
