post_id,title,text,author,score,upvote_ratio,num_comments,created_utc,created_datetime,subreddit,permalink,month,year
1gdcgv6,CMV: Certain sects of liberals believe that simply reducing the power of 'straight white men' will inevitably lead to more progressive politics all round. They are mistaken. ,"Two years ago in the UK, a new front in the culture wars opened up when large posters exclaiming [""Hey straight white men; pass the power!""](https://pbs.twimg.com/media/FYiLQixX0AEUK03?format=jpg&name=900x900) were spotted in various locations around its cities, as part of a taxpayer funded outdoor arts exhibition ran by an organisation by the name of 'Artichoke' - a vaguely progressive body aimed at making art more accessible to the public at large.

Evidently, the art was designed to generate discussion, and due to its front page news level controversy, on that level at least it was an astounding success: with the intended message clearly being that 'straight white men' have too much power, and they need to hand it over to people who are not 'straight white men', in order to, according to Artichoke's own mission statement at least, ""Change the world for the better"". 

Now this kind of sentiment - that 'straight white men' (however they are defined) are currently in power, and they need to step aside and let 'other people' (again, however they are defined) run the show for a while - is one that seems, to my mind at least, alarmingly common in liberal circles. 

See for example [this article](https://www.mirror.co.uk/news/uk-news/lily-allens-right-white-males-9562356#ICID=sharebar_twitter), which among other things,  claims:

\>""It's white men who run the world. It's white men who prosecute the crimes, hand down the jail sentences, [decide how little to pay female staff,](http://www.mirror.co.uk/money/women-20s-paid-less-men-9560167) and tell the lies that keep everybody else blaming each other for the world's problems""

\>""It's white males, worldwide, who are causing themselves and the rest of the planet the most problems. It was white males over 45 with an income of $100,000 or more who [voted for tiny-fingered Donald Trump to run the free world](http://www.mirror.co.uk/news/world-news/donald-trump-followed-emergency-kittens-9549099)""

Before finally concluding:

\>""Let me ask you this: if all the statistics show you're running the world, and all the evidence shows you're not running it very well, how long do you think you'll be in the job? If all the white men who aren't sex offenders tried being a little less idiotic, the world would be a much better place"".

And this, at last, brings us to the crux of my issue with such thinking. Because to the kinds of liberals who make these arguments - that it's white men who run the world, and are causing everyone else all the problems - could you please explain to me:

How many straight white men currently sit among the ranks of the Taliban, who don't merely decide ""How little to pay female staff"", but [simply ban them from working entirely,](https://www.latimes.com/world-nation/story/2024-07-07/an-afghan-woman-wanted-to-be-a-doctor-now-she-makes-pickles-as-the-taliban-restricts-womens-roles) among [various](https://www.theguardian.com/global-development/article/2024/aug/26/taliban-bar-on-afghan-women-speaking-in-public-un-afghanistan) [other](https://amu.tv/129066/) [restrictions](https://medicamondiale.org/en/where-we-empower-women/afghanistan) ? 

How many straight white men currently govern countries such as Pakistan, Iran, and Thailand, where the kinds of crimes prosecuted involve [blasphemy (which carries the death penalty), ](https://www.bbc.co.uk/news/world-asia-68511557) [not wearing the hijab (which again, basically carries the death penalty)](https://www.theguardian.com/global-development/2022/sep/16/iranian-woman-dies-after-being-beaten-by-morality-police-over-hijab-law), and [criticising the monarchy (no death penalty at least, but still 15 years in prison)](https://www.theguardian.com/world/article/2024/aug/08/thailands-lese-majesty-laws-explained-in-30-seconds#:~:text=Under%20article%20112%20of%20the,majesty%20%E2%80%93%20anywhere%20in%20the%20world) ? 

Or how many straight white men were responsible for ""blaming someone else"" for the problems of any of those [various countries](https://en.wikipedia.org/wiki/List_of_ethnic_cleansing_campaigns#2000s) in which acts of ethnic cleansing have taken place, on the orders of governments in which not a straight white man sat? 

Indeed, the article preaches against the thousands of white men who voted for Trump -  ignoring the fact that more [Indians ](https://en.wikipedia.org/wiki/Results_of_the_2019_Indian_general_election)voted for Modi's [far right](https://jacobin.com/2024/03/bjp-far-right-modi-india) BJP, than there are white men in America \*at all\*!

Now; again, I must stress. NONE of the above is to say that straight white men have never restricted the rights of women, passed overbearing laws, or persecuted minorities. Of course they have; but surely it is more than enough evidence to show that NONE of those behaviours are exclusive to straight white men, and so simply demanding straight white men step down and ""Pass the power!"" is no guarantee of a progressive utopia-  when so many countries not run by straight white men are \*far\* from such? Moreover; does it not also suggest that ideology is NOT dictated by race, and therefore asserting that we can judge how progressive -or regressive- one's politics are simply by skin tone is ludicrous? 

Indeed, the whole idea that 'straight white men' exisit as a political collective at all seems frankly baffling to me; many liberals ironically seem to know the difference between Bernie Sanders/Jeremy Corbyn and Donald Trump/Boris Johnson (delete as nationally applicable) very well, and if straight white men do act in such a collevtive spirit, as liberals often allege, then how in high heaven did England have a series of [vicious civil wars, driven in part by religious sectarianism,](https://www.britannica.com/event/English-Civil-Wars) at a time when nearly every politician in the country was straight, white and male?!

Indeed; while we're back with the UK - even if all such people did step down, and hand over their power, we would still find a great deal of conservatism in the ranks of our politics; we may even find non white MPs standing up and demanding the [recriminalisation of homosexuality](https://www.theguardian.com/uk-news/2016/apr/11/british-muslims-strong-sense-of-belonging-poll-homosexuality-sharia-law), or even [persecution for apostasy.](https://www.bbc.co.uk/news/magazine-34357047) Yes, many ethnic minorities are more likely to vote for ""progressive"" parties (Labour in the UK, the Democrats in the US), but this clearly does not translate to political progressivism on their own individual part. 

Now, a counter argument to my view here may be; ""But are you not cherry-picking the worst examples? Why do you not look at those non-white societies which, presently or historically, have been more progressive?"".

And I concede; ancient India may have been more accepting of homosexuality and gender fluidity than was the norm in (white) Europe - as were several Native American nations. But this too ignores the fact that, as today, non white societies in the past also ran on a spectrum of progressive to conservative: certain Native American societies might well have been gender egalitarian, even matriarchies - but many of the Confucian states in East Asia (particularly China) were perhaps even more patriarchal than was the norm in Europe. Indeed, they were certainly as apt at [warfare](https://www.cambridge.org/core/books/abs/cambridge-world-history-of-genocide/atrocity-and-genocide-in-japans-invasion-of-korea-15921598/7EFEAB40BC9D61D2F9E92CF8C506FB70), [genocide, ](https://www.cambridge.org/core/books/abs/cambridge-world-history-of-genocide/qing-extermination-of-the-zunghars/6D038CADD0F808459451175C1CAD6DC5)and [ethnic persecution.](https://www.cambridge.org/core/books/abs/cambridge-world-history-of-genocide/viet-nam-and-the-genocide-of-champa-14701509/6E8490A4C5670883A94DAD24BF5C899A)

All of which is to say, finally reaching my conclusion, in which (I hope!), I have effectively stated my case:

History, foreign politics, and even the attitudes of minorities within 'white' majority countries all suggest that there is no correlation between skin tone and political belief - and it is FAR MORE important to listen to what people actually believe, rather than lazily assume ""Oh, you have X skin tone, therefore you must believe Y, and surrender your power to Z who will make the world a better place than you"". 

Again, the argument I am making here is NOT that there should be \*only\* straight white men in politics, or that non white men are inherently \*worse\* at politics - I am well aware that there are many extremely progressive POC, as there are many extremely progressive white men. 

Rather, I argue exactly the opposite; that liberal identity essentialism is entirely in the wrong, and no one group of people are any inherently more progressive or conservative than any other - thus, simply removing one group from power is no guarantee of achieving progressive causes. 

I stand of course to be proven incorrect; and will adjust my view as your thoughts come in!",TenTonneTamerlane,1156,0.7300000190734863,792,1730040057,2024-10-27 09:40:57,changemyview,https://www.reddit.com/r/changemyview/comments/1gdcgv6/cmv_certain_sects_of_liberals_believe_that_simply/,10,2024
1fzmfoc,CMV: protests are supposed to disrupt order.,"It seems that protests, by their very nature, are meant to cause disruption to make a point. Yet, it feels like whenever a protest takes place, we’re expected to get clearance and permission. This approach doesn’t seem to have the same impact and often only reaches those already involved or aware of the cause.

It feels like the system pacifies any real attempt at protest, diminishing its effectiveness when we have to follow guidelines and seek approval.

Just to be clear, I’m not advocating for violence, but I believe protests should have the power to truly challenge the status quo.",dezorg,1079,0.7900000214576721,675,1728461539,2024-10-09 03:12:19,changemyview,https://www.reddit.com/r/changemyview/comments/1fzmfoc/cmv_protests_are_supposed_to_disrupt_order/,10,2024
1gac58g,CMV: Censorship within /r/WorldNews is dangerous,"/r/WorldNews is the largest subreddit on reddit, and controlling the narrative with permabans for widely supported views is dangerous and promotes a one sided story. It creates a self perpetuating echo chamber. 

I was permabanned instantly for saying that Israel is enforcing an apartheid. Something many extensive United Nations reports have concluded, along with the top respected humanitarian aid organizations, and the government of the country for whom the word was literally invented, South Africa. 

Being instantly permabanned for just agreeing and sharing a view with these organizations undermines any credibility for the largest subreddit, yet they are the dominant voice for international news on reddit. 

Whether you agree that for example Israel is upholding an apartheid is not the issue, it is the complete lockdown on what is able to be discussed on that subreddit. 

If this was a smaller subreddit, I would not see the issue as then its part of the greater whole. But when its the largest source of news on all of reddit, and its one of the default subreddits, it is not the same thing. 

This is fundamentally dangerous.",Pattern_Is_Movement,890,0.6700000166893005,1306,1729694298,2024-10-23 09:38:18,changemyview,https://www.reddit.com/r/changemyview/comments/1gac58g/cmv_censorship_within_rworldnews_is_dangerous/,10,2024
1g1hrt5,CMV: Wearing hairstyles from other cultures isn’t cultural appropriation ,"Cultural appropriation: the unacknowledged or inappropriate adoption of the customs, practices, ideas, etc. of one people or society by members of another and typically more dominant people or society

I think the key word there is *inappropriate*. If someone is mocking or making fun of another culture, that’s cultural appropriation. But I don’t see anything wrong with adopting the practices of another culture because you genuinely enjoy them.

The argument seems to be that, because *X* people were historically oppressed for this hairstyle, you cannot wear it because it’s unfair.

And I completely understand that it IS unfair. I hate that it’s unfair, but it is. However, unfair doesn’t translate to being offensive. 

It’s very materialistic and unhealthy to try and control the actions of other people as a projection of your frustration about a systemic issue. I’m very interested to hear what others have to say, especially people of color and different cultures. I’m very open to change my mind.

EDIT: This is getting more attention than I expected it to, so I’d just like to clarify. I am genuinely open to having my mind changed, but it has not been changed so far. 

Also, this post is NOT the place for other white people to share their racist views. I’m giving an inch, and some people are taking a mile. I do not associate with that. If anything, the closest thing to getting me to change my view is the fact that there are so many racist people who are agreeing with me.",Snoo_89230,835,0.8199999928474426,591,1728674401,2024-10-11 14:20:01,changemyview,https://www.reddit.com/r/changemyview/comments/1g1hrt5/cmv_wearing_hairstyles_from_other_cultures_isnt/,10,2024
1gfvqfa,CMV: its not diversity thats “killing video games”. Its a lack of real diversity ,"I see a lot of people online say that Diversity is killing video games and how games are ""woke"" now. I cannot disagree more. Its the lack of actual diversity thats hurting the industry. Real diversity is arguments, different view points, tension, and showing that were different. Take Dragon Age: Origins. In that game it shows how elves are considered second class citizens to humans and the discrimination they face. That is diversity that builds to the lore and feels human, because diversity shouldn't be ""everyone gets along"". It should be ""even if we are completely different and im supposed to hate you we can still be friends."" It should be that we can have different view points yet still all work together. In the new game Veilguard everyone is treated the exact same regardless of gender or race, removing the differences between them. It leads to every character feeling the same. ",Ihateredditlollll,826,0.7099999785423279,886,1730318353,2024-10-30 14:59:13,changemyview,https://www.reddit.com/r/changemyview/comments/1gfvqfa/cmv_its_not_diversity_thats_killing_video_games/,10,2024
1fyamjb,CMV: There is absolutely no good reason to hold a pro-Palestinian demonstration today (Oct 7) and it should be seen as glorification of terrorism,"It is the first anniversary of the horrific attack on Israel, yet streets in my city are full of pro-Palestinian protesters with their flags.

I believe that there is absolutely no good reason for them to be there today and it can only be explained as celebrating the terrorist attack. They could have chosen literally any other date. Oct 7 is irrevocably connected to the horrors of last year.

I can see possible explanations like ""it was the start of the violence in Palestine"", but it really wasn't. On Oct 7 last year, there was only violence in Israel. The retribution came only days later.

Arguments of the type ""they are there to demonstrate for ceasefire to stop suffering on both sides"" seem quite disingenuous to me as well. Why the Palestinian flags then?",Downtown-Act-590,823,0.6000000238418579,2330,1728315409,2024-10-07 10:36:49,changemyview,https://www.reddit.com/r/changemyview/comments/1fyamjb/cmv_there_is_absolutely_no_good_reason_to_hold_a/,10,2024
1fvg47z,CMV: The comparative lack of union support for Harris vs. previous Democratic nominees is a very bad sign for her chances this November.,"I just can't shake the feeling that all these unions coming out and not-endorsing Harris (nor Trump for that matter) is a sign of a bad turnout for her. I don't believe union endorsements necessarily sway voters, but as a snap shot of how certain voters are feeling, it's wild to see that the Democratic candidate is not getting backing from a historically solid base. It draws attention to other places where the wall of standard/expected Dem support is cracking. I'm trying not to be too hopeless about it but it really seems to be a sign in Trump's direction (or at least away from Harris's). I'd love to be proven wrong about this and see how these endorsements or lack there of don't spell bad news. ",FamousPressure7780,821,0.7400000095367432,734,1727983973,2024-10-03 14:32:53,changemyview,https://www.reddit.com/r/changemyview/comments/1fvg47z/cmv_the_comparative_lack_of_union_support_for/,10,2024
1g76j7o,CMV: “From the river to the sea” inherently supports a Palestinian one-state solution,"In Arabic there are THREE versions of the slogan. TWO of which call for the “decolonization” of the Israeli state. These two slogans were infamous during the First Intifada: min il-ṃayye la-l-ṃayye / Falasṭīn ʿarabiyye (من المية للمية / فلسطين عربية, ""from the water to the water / Palestine is Arab"" and min il-ṃayye la-l-ṃayye / Falasṭīn islāmiyye (من المية للمية / فلسطين إسلامية, ""from the water to the water / Palestine is Islamic"")

The THIRD is the one that made it’s way into English, because it rhymes, and because it is the only reasonable one—it doesnt call for the recolonization of a Palestinian state: From the river to the sea, Palestine will be free""—the translation of min an-nahr ʾilā l-baḥr / Filasṭīn sa-tatḥarrar

So there are three slogans used by entirely different demographic geographically, culturally, and ideologically. Israelis are connected to western media, but also the immediate Palestinian sentiments surrounding them. They hear all three of these slogans. This is the true disconnect between all of these peoples. 

I often see interviews of people rallying say they support a one state, democratic solution. After all, two ethno-states where citizens of each do not have equal rights in the other would be the _definition_ of apartheid—supposedly what we are trying to end. 

That is why when I hear this slogan it means to me:
1) Belief the state of Israel should be replaced with an Arab state. 
2) Belief in a one state solution.",Imjustmisunderstood,776,0.6899999976158142,1451,1729336075,2024-10-19 06:07:55,changemyview,https://www.reddit.com/r/changemyview/comments/1g76j7o/cmv_from_the_river_to_the_sea_inherently_supports/,10,2024
1g5s219,CMV: The No Child Left Behind and Every Student Succeeds Acts Are Killing Education ,"From my understanding these two acts essentially give schools a grade based on student performance, and allows the states to intervene in the worst performing schools. 

My problem with this is that it incentivises schools to lie about grades and force students to graduate even if they are not ready simply to avoid state sanctions and possibly takeovers. This means the students themselves care less about their education because there are no consequences for performing poorly or not at all. The teachers will be forced by their admin to give them passing grades so that the school continues to look just good enough to avoid intervention. If students don't care to learn, they never will. There *must* be consequences for the students for performing poorly. I understand the idea that schools should simply do better and teach their students properly to avoid punishment, but it's much easier for them to just lie, and so only the schools who are honest are being punished for actually trying to help while dishonest schools are popping out uneducated children who simply got C's and a diploma so admin could keep their jobs",GoodGorilla4471,745,0.9300000071525574,237,1729174974,2024-10-17 09:22:54,changemyview,https://www.reddit.com/r/changemyview/comments/1g5s219/cmv_the_no_child_left_behind_and_every_student/,10,2024
1g0rxgr,"CMV: Iran is not the greatest adversary of the United States, and saying so is a pretty brazen absurdity that demonstrates Israel's outsized influence on the country.","Iran being the ""greatest"" enemy of the United States was a statement Kamala Harris made to the press when asked about who the United States greatest adversary was, for some context, but its a statement that could just as easily of come from a Republican's mouth. 

Russia and China both have stronger militaries and stronger espionage capabilities that are currently in use in the United States. Russia in particular has strong influence over US elections in a way that Iran just doesn't. Russia's attack of Ukraine is also more of an existential threat to the West and the United States alliances and strategic interests, but China's threat to Taiwan is also important, and even a conventional war with China would be disastrous for all parties involved. 

Iran doesn't have these kinds of capabilities, and is in part propped up by Russia, so even if we pretended that the US' most vital interests were in the Middle East (Which they aren't, and both Biden and Obama has wanted to get out of the region and refocus towards Asia), Iran is still largely a Russia proxy, indicating that the real threat is Russia. Iran has less than a fourth of the GDP of Russia and around half the population. Iranian proxies limited to the region, whereas Russia has proxies all around the globe and their influence extends into South America, putting them far more into the US' sphere of influence. What Iran is, is the greatest adversary of Israel, as it and its proxies operates primarily within Israel's sphere of influence while having a solely negative relationship with Israel (Whereas Russia, Iran's backer, has a more complicated relationship with Israel where they are not adversaries).

Naming Iran as the US greatest adversary is a conflation of the US interests with the interests of Israel. These are two different countries with two different interests, and it is disastrous to the US sovereignty that the interests of Israel should be promoted as the main interest of the US by our own politicians.",CoyoteTheGreat,661,0.6800000071525574,521,1728590990,2024-10-10 15:09:50,changemyview,https://www.reddit.com/r/changemyview/comments/1g0rxgr/cmv_iran_is_not_the_greatest_adversary_of_the/,10,2024
1g4f1jh,CMV: Saying Whites or Europeans are responsible for colonialism as a whole and should apologize for it is blatantly ignorant.,"First, only a handful of European countries were involved in colonialism in the first place. Another thing to also consider is the colonialism of Latin America is entirely different from the colonialism of Africa.

If you were to choose a colonizer you’d probably pick the Spainards. Now, they went to Latin America and intermixed with the population meaning that the people there now descend from BOTH Spainards and Natives. So who exactly are you gonna apologize to? All the people that colonized left Spain and Portugal. And you have BOTH spainard colonizer dna as well as native dna.

Now the real colonizers were the English, French, Japanese and the Turks. and yet everyone would rather just say “Europeans/White People are just evil colonizers” even though not every european country participated in colonialism and the colonialism was vastly different depending on the country.",Different_Salad_6359,656,0.6000000238418579,1641,1729017755,2024-10-15 13:42:35,changemyview,https://www.reddit.com/r/changemyview/comments/1g4f1jh/cmv_saying_whites_or_europeans_are_responsible/,10,2024
