post_id,title,text,author,score,upvote_ratio,num_comments,created_utc,created_datetime,subreddit,permalink,month,year
15ez7ul,"CMV: Ghosting is a real asshole move and ""no one is owed an explanation"" is a cop out excuse normalizing cruelness","Let's be clear. If you had a convo or two over a dating app, or even one to two face to face dates. Fine whatever, it's somewhat expected that ghosting happens. I still think you should say ""Honestly I'd rather not talk anymore"" block but I can see maybe giving that a pass.

But someone, whether it be someone you are seeing romantically, a friend, a family member does deserve some closure. If you just cease contact with no explanation that is an extremely fucked up thing to do. You are leaving people in limbo. There could be a period of days where they are questioning if you are just mad, busy or perhaps hurt. It takes a whole 5 seconds to type ""I don't want to be in your life anymore"" and if they say something mean or start to argue, block them.

What pisses me off is the super individualized, pop psychology excuses people use to defend this dogshit behavior. ""I don't owe anyone my time. No one is entitled to a response. Telling someone I want to cease contact may be unsafe. I have anxiety around confrontation, how dare you question me abliest!"" It's all such bullshit and you dancing around the fact that you are selfish, careless asshole for doing this. As for the safety thing, a person that is aggressive and unhinged actually may go more nuts if you ghost them then if you just sternly end things. And if they may be dangerous? End things over text and then block. What are they going to do? I know I'd be more pissed than if someone just ended things.

We should be striving to be more loving and caring people. Especially in this digital age where relationships are becoming more commodified. We are all sad, lonely, and a lot of us are inside more than out. Thinking you struck a connection with someone only to have that ripped away without an explanation is extremely cruel. I don't care if they aren't ""entitled"" to it.

One more thing I would like to add is some clarification on what ghosting is. I have heard people defend it in the past by saying ""I have had talks with this person and tried to establish boundaries. But they wouldn't listen."" That's not my definition of ghosting. To me ghosting is when one party suddenly ceases all contact when all was well the last time they talked. The ghostee had NO IDEA that the ghoster wanted to end things. It comes completely out of left field. Giving up on trying to talk to someone who you've repeatedly warned does not fit the definition IMO. If I am wrong there, let me know. But that is my understanding.

But yeah, ghosting makes you a cruel, selfish POS.",TheMedsPeds,329,0.8600000143051147,158,1690855626,2023-07-31 21:07:06,changemyview,https://www.reddit.com/r/changemyview/comments/15ez7ul/cmv_ghosting_is_a_real_asshole_move_and_no_one_is/,8,2023
15i2oun,"CMV: Out of all major music genres, rap/hip-hop is the worst to watch live",[removed],Forgot_the_slash_s,317,0.8100000023841858,147,1691161948,2023-08-04 10:12:28,changemyview,https://www.reddit.com/r/changemyview/comments/15i2oun/cmv_out_of_all_major_music_genres_raphiphop_is/,8,2023
15ufdh2,"CMV: Baldur’s Gate 3 should set a standard for other games, especially larger studios","Baldur’s gate 3 was recently released and got a lot of positive press. It also led to a lot of game developers saying it shouldn’t set a standard and others shouldn’t expect other games to be as good. 

Larian Studios is fairly small, not massively rich, and doesn’t have anything near the resources of the big triple a gaming studios. Those triple a gaming studios do routinely copy other games because creativity is hard and proven success helps. 

As such, they should be looking for lessons from this, we should compare future rpgs to Baldur’s gate, and they have the resources to do anything Larian did well. 

Note that I am not saying all games need to copy them. Sports games don’t for example and it’s ok for them to seek other inspirations. I just feel trying to copy the success of Baldur’s Gate 3 for rpgs is a reasonable and fair idea developers should look into.",Nepene,316,0.8199999928474426,159,1692350090,2023-08-18 04:14:50,changemyview,https://www.reddit.com/r/changemyview/comments/15ufdh2/cmv_baldurs_gate_3_should_set_a_standard_for/,8,2023
15xx5if,CMV: We need a non vegan animal rights movement,"Feel free to argue we don't need an animal rights movement, or that it has to be vegan.

As a preface, I have no issue with vegans. I think they are admirable in their dedication for something they care so much about. I do think veganism as a movement is counter productive, and will elaborate below. 

When I say a non vegan animal rights movement, I mean a movement that is primarily lead by non vegans and supported by non vegans. This is because I think this is the only way to really pressure governments to create and truly enforce animal rights.

Yes this means that I don't think animals desperately need the right to free movement, or the right to not be killed. In my opinion the current discourse around animal abuse leads to the majority of people just not engaging. 

What rights do a realistically think we could get animals? The right to not be tortured, the right to nutrition, the right to free roaming in an enclosed outdoor area, the right to clean living spaces. 

Is this perfect and amazing for animals? It's a lot better than what we have now and honestly I'm so frustrated with the idea that we should do nothing instead of ending animal abuse because it's not full emancipation. 

The fact is that individuals changing their diet makes almost no impact on the meat industry. Far more people are being born than are going vegan. The world is not going to go vegan! Also, if you are truly convinced that eating less meat will reduce factory farming, convincing 50% of the population to eat plant based one day a week would roughly double the impact of the current vegan population. (3% of vegans vs 1/7/half the population = 7% reduction in meat consumption) not to mention it would allow many more people to discover plant based food they like, and may eat that more.

The whole thing where we identify ourselves as vegan and eat no meat ever is completely non productive and in my opinion, has slowed down any movement on animal rights to a standstill.

I know it's not fully representative but just check out the vegan sub talking about someone eating less meat and how inadequacy it is. They will tell people to break up with their spouse because they decided they couldn't fully commit to veganism after all. 

Imagine if we decided anyone who drives a car is an enemy and cant advocate for climate awareness. Imagine how little that movement would be accomplishing if it was so exclusive and judgemental. 

We don't need to imagine it for veganism. It's accomplishing absolutely nothing right now. More meat is being eaten than ever and more animals are being abused than ever. Idealism will not save these animals from torture. ",timmytissue,312,0.800000011920929,368,1692685778,2023-08-22 01:29:38,changemyview,https://www.reddit.com/r/changemyview/comments/15xx5if/cmv_we_need_a_non_vegan_animal_rights_movement/,8,2023
15r47bo,"CMV: ""Once a cheater, always a cheater"" simply isn't true","While in most cases there is no excuse for cheating on your partner, I think in some cases isn't true.

Obviously there's people who have personality traits that drive them to cheat, e.g. always needing to be the centre of attention or having a combination of high sex drive and lack of impulse control, but even in those cases I think it's possible for a person to change if they want to, with a lot of reflecting and action and therapy or both.

However I think some people do it for genuine reasons, e.g. to escape an abusive relationship, and I think even some people may do it once and learn from it and never do it again.

So, change my view.",HullSimplibus,280,0.6700000166893005,340,1692040848,2023-08-14 14:20:48,changemyview,https://www.reddit.com/r/changemyview/comments/15r47bo/cmv_once_a_cheater_always_a_cheater_simply_isnt/,8,2023
15zuka6,CMV: Final moral dilemma in The Good Place is invalid,"Minor spoilers for 3 year old sitcom. I would ask everyone to use a spoiler tag when talking about major spoilers for the series because this is one of my go-to sitcoms and I want people to experience it without spoilers.

Final moral dilemma in Season 4 Episode 12 ""Patty"" is as following: Hypatia of Alexandria (Patty) informs that prolonged exposure to the Good Place will cause you to become lethargic hedonist. Because all your needs are met without effort, you become monotonous, lose interest in everything and even cause mental decline. You become a happiness zombie. Solution for this was >!to give option to ""quit"" the afterlife giving meaning for existence.!<

After the solution was implemented everyone went fine. While dilemma and conclusion itself is valid it's not valid in context of The Good Place. Reason for this is simple. The Good Place is not without challenges and hurdles.

Tahini >!learns thousands of tasks meaning that they actually needed to study and learn instead of instantly gaining those skills.<!

But maybe most compelling argument is Jason and his goal to >!play perfect run of Madden which takes him thousands of tries.<! Even with access to our current collective collection of media and games I could spend thousands of Jeremy Bearimies exploring this vast quantity of content. And not just that I would have access to everything new created on Earth. 500 hours of content is uploaded to YouTube every minute. New movies, games and books are released every year. And not just that but I would also have access to everything created in the Good Place (!>They tell that Shakespeare wrote multiple new plays and people can spend a life time learning about his works while he lived<!) multiplying new content to almost infinity.

Fact that you have to (or at least can) work for your enjoyment in The Good Place means you cannot become Happiness Zombie.",Z7-852,269,0.8500000238418579,176,1692861554,2023-08-24 02:19:14,changemyview,https://www.reddit.com/r/changemyview/comments/15zuka6/cmv_final_moral_dilemma_in_the_good_place_is/,8,2023
164jq1y,"CMV: Most married people in LTRs can't ""just leave him/her"" even if they'd like to","I see this advice all the time on various platforms, and it baffles me. Now, maybe the memes are true and it's just a bunch of teens responding to posts on social media, but if not, how the heck do so many people think leaving is that easy, let alone even possible for many?

""Why don't you just leave if he/she isn't filling your needs?""
 ""Why don't you just leave if he/she isn't pulling their weight?""
 ""Why don't you just leave if he/she refuses to go to counseling?""
 ""Why don't you just leave if he/she cheated on you?"" ""Why don't you just leave instead of cheating?""

All of these are great reasons not to stay, but they make people who don't have the option to leave feel like crap. If leaving was possible, I'd imagine the vast majority would do just that.

Am I missing something here? Super open to learning why this is the go-to advice.",positive_penguin135,257,0.8399999737739563,121,1693318649,2023-08-29 09:17:29,changemyview,https://www.reddit.com/r/changemyview/comments/164jq1y/cmv_most_married_people_in_ltrs_cant_just_leave/,8,2023
15tt316,CMV: Being pro- capitalism and pro free markets should mean you are also pro- open borders/immigration,"It seem like a lot of conservatives are very interested in capitalism and free markets, but anti-immigration/open borders. This has always confused me. People moving between countries seems just like people ""voting with their wallets"" on which countries/companies are the best. Not only do people benefit from this free movement by chosing where they can live the best life (based on income/living conditions/social programs/climate/etc), businesses also potentially get access to more people. This would allow them to hire better and/or cheaper labor.

Within the US, you can see movement of people between states and it's a powerful way for people to increase their quality of life and business benefits too. So why not at a global scale? It doesn't make sense to me. 

Why am I wrong that these two beliefs should go together?",ScarySuit,240,0.699999988079071,379,1692291378,2023-08-17 11:56:18,changemyview,https://www.reddit.com/r/changemyview/comments/15tt316/cmv_being_pro_capitalism_and_pro_free_markets/,8,2023
15vxy35,Cmv: women should not be billed for childbirth related medical attention,"It's so weird to me that this happens. I get that it's a medical situation just like any other. But it strikes me as wrong on a fundamental level 

Childbirth is something that is necessary for the continuation of us as a species. It's also an important and natural human activity. A momentous activity that is considered to be vitally valuable in every culture, and even ritualized in many.


We need to be incentivizing rather than discouraging birth in developed countries. Most of which would be losing population if not for immigrants 


 That's weird to me that women or families are charged for it. It's a basic and primal  instinct to be protective of pregnant women and infants. I can't really put it into words but it seems so wrong to bill them for having kids",I_Please_MILFs,235,0.699999988079071,343,1692495479,2023-08-19 20:37:59,changemyview,https://www.reddit.com/r/changemyview/comments/15vxy35/cmv_women_should_not_be_billed_for_childbirth/,8,2023
165b0px,CMV: Drinking age should be lowered in the US,"There are several reasons I think the drinking age in the US should be lowered from 21 to either 18 or 19.

1. most people ignore this law and drink before they’re 21. It’s odd to have a law that the majority of the population breaks. IMO it creates a disrespect for the law in general.

2. When I went to college, because I wasn’t allowed to get alcohol safely, at a restaurant with friends, our only option was to go to a frat house and drink the punch that they could have put anything inside of. I personally know a girl that was raped after a frat party. Outlawing drinking until you’re 21 just makes people put themselves in dangerous positions to drink.

3. The age was raised to 21 in order to lower the amount of drunk drivers. I agree if you drive after drinking then you’re a terrible person. But the type of person who would drive drunk definitely isn’t the type of person who would listen to the law about waiting until you’re 21 to drink.

4. When I joined my sorority the very first meeting they had all the new members bring photos of ourselves we took at CVS along with filling out a form with our info. They did this so they could place an order for fake ID’s for all the new members. My point in sharing this is to show how common fake ID’s are. Like most freshmen in college get fake ID’s. The problem with this IMO is that we are giving money to people who probably aren’t the best (think cartels and gangs who make the fake IDs)",Difficult-Prompt1731,230,0.6700000166893005,706,1693391610,2023-08-30 05:33:30,changemyview,https://www.reddit.com/r/changemyview/comments/165b0px/cmv_drinking_age_should_be_lowered_in_the_us/,8,2023
162zhov,CMV: Porn is one of the most psychologically degrading influences in our society. (TW),"It is so fucking sad that a whole generation of kids (and probably going to get only worse, for now at least) is experiencing pornhub main page as their introduction to what should be the beautiful, intimate, exquisite, bonding experience of lovemaking. Instead they immediately get thrown into an online world of aggression, incest, rape, sado-masochism, and just over all disgusting displays of human disconnection, abuse and selfishness, as the fucking NORM! AND on top of that, since the fish have no clue about the water they swim in, the culture around us validates all of this as “harmless fantasy” and overrides (or at least attempts to) the sense of the destructiveness and dehumanization that porn truly is… I work with kids in the mental health field and I see so much how radically it has impacted them, warps their view of sex, of women/men, before they have a chance to explore it innocently themselves. It also can have massive impacts on mental health in general.",BenedrylBooferBro,230,0.6600000262260437,380,1693164534,2023-08-27 14:28:54,changemyview,https://www.reddit.com/r/changemyview/comments/162zhov/cmv_porn_is_one_of_the_most_psychologically/,8,2023
15xjb56,CMV: Having kids is great,"We often get posts here about kids, usually about how awful it is that society expects people to become parents, how having kids is selfish and environmentally unfriendly or how having kids will ruin your life. It’s very hard to respond to these posts because telling people who don’t want kids that kids are great and that they should have them is a bit of a dick move. However, this subreddit is all about expressing and defending opinions, me writing this isn’t about convincing others, it’s about defending a view that’s rarely expressed here.  
Before I explain why kids are great I need to set a condition, it is possible for something to be great whilst still being expensive, frustrating, tiring or difficult. Many great things are one or all of these things, a safari is amazing but costs a fortune, climbing Everest is one of the hardest but most rewarding things you can do and sometimes my wife is incredibly frustrating, it doesn’t mean she’s not the best thing that’s ever happened to me.  
So why is having kids great? It boils down to two main things, one, they’re great fun and two, you get to experience how wondrous the world is through their discoveries. We never stop enjoying play but, as we get older, we get responsibilities and mature, we still like play but we limit how much of it we do and the play we do do we often take seriously. Kids don’t suffer from this, they don’t have our ego, they just want to imagine and pretend and race and climb and build. It’s a pure form of play that adults have often forgotten but we get to experience again with kids. The other day I pretended my three year old daughter could electrocute me. We spent a good 10 minutes of her touching me, me pretending to get an electric shock and her laughing like crazy. It was joyous and wonderful and I rarely experience anything close to it in my wider life, my daughter and I do something like that 5 times a day, it’s incredibly fun.  
The other thing is less obvious. One of the most rewarding things we can do as adults is to achieve something we’ve never done before, the older we get the less this happens. For kids this happens like clockwork, especially early on. Seriously the pride a child feels the first time they pull on their socks is wild and guess what, the parent feels it too. Rolling over, seeing a duck, eating with a fork, catching a ball and don’t even get me started on their first steps, these are all incredible experiences and you experience them along with your child. Children reframe what life is, the most mundane things for an adult are an incredible adventure for kids. Last week I flew with my kids for the first time, I filmed them as the plane took off, it was like we were on the greatest roller coaster ever built.  
Kids give you an experience that is unlike anything else in my adult life and, despite the tantrums, despite the mess and the constant need for attention, that is absolutely worth it. Here’s the other wonderful thing, I haven’t lost the adult stuff either. It takes a bit more work but I get to go out with my friends and do all the kid free stuff I used to, I still have both worlds. Having kids is great, Change my view.  
",Subtleiaint,227,0.6700000166893005,508,1692650232,2023-08-21 15:37:12,changemyview,https://www.reddit.com/r/changemyview/comments/15xjb56/cmv_having_kids_is_great/,8,2023
15frq87,CMV: Trump will pick RFK Jr. as his running mate,"For a few reasons.
A) RFK Jr already acts like a republican in almost very way except for his official affiliation.
B) Brand recognition, brand recognition, brand recognition.
C) Trump will be able to say ""Look, I'm a uniter, I'm reaching across the aisle to choose a Democrat"".
D) The Q-Anon crowd will lose their s***. For a while there, they were spouting some insanity about how JFK Jr. was secretly still alive and how he was going to come out of hiding and Trump was going to choose him as his running mate for his second term. Trump chooses RFK Jr, and they will say ""Q was right all along, we just misunderstood and had the wrong Kennedy son!""
E) Trump said the other day he was going to skip the debate and that the rest could debate amoungst themselves about which one he would pick as his VP- that absolutely means none of them are going to get picked.",Briwil78,225,0.7400000095367432,229,1690930909,2023-08-01 18:01:49,changemyview,https://www.reddit.com/r/changemyview/comments/15frq87/cmv_trump_will_pick_rfk_jr_as_his_running_mate/,8,2023
15vxagi,"CMV: Children under 18 should not be allowed to get genital surgery, and saying this is not transphobic","I consider myself a trans ally, I believe in children recieving appropriate gender affirming care to match their identity. What I don't agree with is them having permanent surgeries done to their bodies before they're old enough to consent to it.

In the US there has been an increase of teens from 13 to 17 getting such surgeries and a lot of them later regretting it because they weren't mature enough to make this decision. Putting a stop to this isn't transphobic in any way and is actually in the best interest of trans people.",IzhanX,211,0.6700000166893005,355,1692493587,2023-08-19 20:06:27,changemyview,https://www.reddit.com/r/changemyview/comments/15vxagi/cmv_children_under_18_should_not_be_allowed_to/,8,2023
15j0guf,"CMV: The ""No True Scotsman"" fallacy is more pervasive in religion than anywhere else, and can never be taken in good faith in that context.","Of all the groups of people I've seen try to ""disown"" a certain individual or group of individuals, none have done so with more frequency and fallacy that the religious.

Using Christianity as an example, if a Christian is a homphobic, racist person who likes to beat their children and drive on the sidewalk, you don't get to say they're not a ""true Christian."" They are just as Christian as you are.

A humble, accepting, loving moderate Catholic is absolutely a part of the same group as a Neo-Evangelist who uses their platform to disenfranchise minorities and spread hate and fear. They both fall under the banner of Christian, and the denominations therein make no difference when discussing how Christian they are.

If you can explain to me why one religous individual can realistically say another isn't a ""true <insert religion here>"" without it being a fallacy (or someone obviously making a mockery of <aforementioned religion> and not trying to genuinely be one,) I will take that as a flaw in my view.",TheWheelZee,208,0.8100000023841858,146,1691253979,2023-08-05 11:46:19,changemyview,https://www.reddit.com/r/changemyview/comments/15j0guf/cmv_the_no_true_scotsman_fallacy_is_more/,8,2023
