post_id,title,text,author,score,upvote_ratio,num_comments,created_utc,created_datetime,subreddit,permalink,month,year
1inzen4,CMV: Brian Thompson is the epitome of “the banality of evil”,"Hannah Arendt reported on the trial of Adolf Eichmann, one of the chief architects of the Holocaust, and wrote how if you removed the contexts of his actions as a Nazi official, he was just a normal person. She calls this “the banality of evil.”

There is no better example of the banality of evil than Brian Thompson, the United Healthcare CEO who was assassinated. He came from a humble background, worked hard to get to his position of power, and had a wife and kids. Yet he also implemented policies and practices that resulted in thousands, if not millions, of lives being ruined.

This holds true for most CEOs who are ruining this country, by the way.",KeyEnvironmental9743,1557,0.8600000143051147,636,1739388535,2025-02-12 13:28:55,changemyview,https://www.reddit.com/r/changemyview/comments/1inzen4/cmv_brian_thompson_is_the_epitome_of_the_banality/,2,2025
1ijftfn,CMV:  Canada and other US allies feeling bullied by Trump should start to poach its skilled citizens and businesses.,"Trump has essentially thrown the gloves off and turned the US into an untrusted partner.   This is not something that will just go away as US allies know that the next 4 years at minimum and probably longer will show an unstable US that cannot be trusted to do the right thing going forward.  The reason for this is that the GOP now has full control of all 3 govt branches, SCOTUS has a conservative super majority, and no one is holding him accountable.   Any change that could happen in a 2028 election would be viewed as temporary given the US’ swinging pendulum back to right wing extremism.   

To become more competitive against the US, allies should start to look at how to encourage highly skilled scientists, medical professionals, engineers,  ex-military, businesses, etc to immigrate from the US that have either been targeted by Trump, feel endangered by fascism, or simply disenchanted with being a US citizen going forward.  Industries like green power,  tech, higher ed, medical research etc. that feel they don’t have a future would be prime candidates for targeted incentives and proactive recruitment.   

Creating a program like “Canada Wants You” could be seen as an inclusive way to bring more talent and create growth for their economies.   A master plan would need to be created to prioritize industries to fund incentives and recruitment while also considering location to not overwhelm existing infrastructure.  An example would be a country establishing or maturing a space industry and targeting NASA, SpaceX or Boeing engineers to emigrate to their country. 

 

Counter arguments may be: 

\-Canada or other allies don’t have the money to incentivize large scale immigration:  This would be a fair argument, but investing in the future to become more competitive would be worth taking on debt.

\-Other countries don’t have the same pleasant weather that states like California have:   This would apply to Canada and other countries in northern latitudes, but Spain, France and Italy have decent alternatives for those that simply can’t handle cold. 

\-Individuals may not take the incentive as they have a family: The program would need to take this into consideration that perhaps the immediate family (including adults) would be accommodated as long as they have the means to make money and pay taxes.

\-Trump would retaliate with additional penalties:  No doubt that this would be the case given Trump’s actions lately.   That said, this program would result in a better long-term situation for the country receiving top talent and businesses.   Trump could offer the same thing to the countries by encouraging immigration to the US, but I believe that scientists and skilled professionals seeing what is happening will be turned off by the anti-intellectual behaviors of the US. 

\- Countries can’t handle the additional stress on their infrastructure:  As already noted, a master plan for this program would need to include the infrastructure related improvements to accommodate the additional immigrants.

\- US salaries are much higher than many of the other countries:  This is probably the biggest blocker.    The countries would need to pay for top talent and the country would need to come up with incentives like no taxes for 5 years, bonuses for coming, equity stake etc.  This could also lead to some animosity by the country’s citizens, but like a franchise player getting paid megabucks, it should be worth it if it drives innovation and competitiveness.

 ",Logical_Marsupial140,1501,0.8799999952316284,477,1738881903,2025-02-06 16:45:03,changemyview,https://www.reddit.com/r/changemyview/comments/1ijftfn/cmv_canada_and_other_us_allies_feeling_bullied_by/,2,2025
1itzpg1,"CMV: The US is firmly now an unpredictable adversery, not an ally to the Western world & should be treated as such.","And we should have been preparing to do it since the previous Trump presidency. 

But with his labelling of Ukraine as a dictatorship yesterday & objection to calling Russia an aggressor in today's G7 statement today Pax Americana is firmly dead if it wasn't already. And in this uncertain world, we in Europe need to step up not only to defend Ukraine but we need to forge closer links on defence & security as NATO is effectively dead. In short, Europe needs a new mutual defence pact excluding the US.

We also need to  re-arm without buying US weaponry by rapidly developing supply chains that exclude the USA. Even if the US has the best technology, we shouldn't be buying from them; they are no longer out allies & we cannot trust what we're sold is truly independent. This includes, for example, replacing the UK nuclear deterrent with a truly independent self-developed one in the longer term (just as France already has), but may mean replacing trident with French bought weapons in the shorter term. Trident is already being replaced, so it's a good a time as any to pivot away from the US & redesign the new subs due in the 2030s. But more generally developing the European arms industry & supply chains so we're not reliant on the US & to ensure it doesn't get any European defence spending.

Further, the US is also a clear intelligence risk; it needs to be cut out from 5 eyes & other such intelligence sharing programmes. We don't know where information shared will end up. CANZUK is a good building block to substitute, along with closer European intelligence programmes.

Along with military independence, we should start treating US companies with the same suspicion that we treat Chinese companies with & make it a hostile environment for them here with regards to things like government contracts. And we should bar any full sale or mergers of stratigicly important companies to investors from the US (or indeed China & suchlike). 

Financially, we should allow our banks to start ignoring FACTA & start non-compliance with any US enforcement attempts.

The list of sectors & actions could go on & on, through manufacturing, media & medicine it's time to treat the US as hostile competitors in every way and no longer as friendly collaborators.

To be clear, I'm not advocating for sanctions against the US, but to no longer accommodate US interests just due to US soft power & promises they have our back, as they've proven that they don't. ",vj_c,1498,0.8100000023841858,950,1740061665,2025-02-20 08:27:45,changemyview,https://www.reddit.com/r/changemyview/comments/1itzpg1/cmv_the_us_is_firmly_now_an_unpredictable/,2,2025
1iz61ma,CMV: Trump’s $5 million “Gold Visa” is an invitation for drug lords to set up their base in USA,"Who has $5 million to run away from another part of the world to come to USA. If someone has $5M to spend on a visa, they probably are well established in their own country and the desire to uproot to move here would be minimal, because you can always visit here for free to nominal visa fee for tourism purposes.

Who has $5 million lying around in cash? What type of people are interested in this “Pay to Play” scheme? Here are some type of people I can think of: 

1. Drug lords who can throw money to establish operational bases here. Think the NY fentanyl bureau chief is a Gold visa holder.

2. Some really corrupt people in third world countries who have obtained their wealth illegally. Most probably being investigated or wanted in their own country

3. Terrorist and criminals funded by shadow groups from other parts of the world

4. Countries planting their spies

Who else could possibly want to be part of this Pay to Play scheme?



",abhip,1438,0.8799999952316284,314,1740625681,2025-02-26 21:08:01,changemyview,https://www.reddit.com/r/changemyview/comments/1iz61ma/cmv_trumps_5_million_gold_visa_is_an_invitation/,2,2025
1iwnuxk,CMV: MAGA is a scam that exploits the working class,"The “Make America Great Again” (MAGA) movement was never about making America great. It was never about empowering working-class Americans or restoring economic prosperity for those left behind by globalization, automation, and corporate greed. Instead, it has always been a scam—a carefully engineered distraction to stoke resentment, sow division, and keep ordinary Americans too angry at the wrong enemies to recognize they are being systematically exploited.

Donald Trump and his billionaire backers built MAGA on the promise of fighting for the “forgotten Americans”—the blue-collar workers who saw their jobs disappear, the rural communities left hollowed out, and the families watching their wages stagnate while their cost of living skyrocketed. He made them believe their suffering wasn’t caused by corporate greed or billionaire tax cuts, but by immigrants, minorities, liberals, and a so-called “deep state” working against them.

It was all a con.

MAGA isn’t a movement for working-class Americans—it’s a branded identity, complete with red hats and rally chants, designed to make its followers feel like they’re part of something bigger while ensuring they never realize they are being exploited. Instead of helping struggling Americans, MAGA’s real function is to distract, divide, and exploit.

Step One: Exploiting Economic Anxiety with False Promises

From the start, Trump positioned himself as a champion of the working class, promising to bring back manufacturing jobs, stop outsourcing, and put American workers first. But every single economic policy enacted under MAGA did the opposite.
- The 2017 Tax Cuts and Jobs Act, Trump’s signature policy, overwhelmingly benefited the top 1%, giving billionaires and corporations massive tax breaks while offering crumbs to working-class Americans.
- Corporations used their tax breaks for stock buybacks, not job creation, further enriching CEOs and investors while leaving workers with stagnant wages.
- Factories continued closing, and automation expanded, eliminating more jobs—a reality Trump never addressed.

Meanwhile, MAGA supporters pay a higher tax rate than many billionaires. While everyday Americans see a chunk of their paychecks disappear to taxes, billionaires like Elon Musk, Jeff Bezos, and even Trump himself exploit loopholes, offshore accounts, and special tax breaks to pay far less than the average worker.
- A firefighter or teacher might pay 22-24% in taxes, while billionaires often pay an effective tax rate of less than 10%—sometimes even zero.
- A 2021 report revealed that some of America’s richest people paid zero federal income tax in multiple years, while MAGA supporters were left covering the cost.

The working class is paying for the billionaire class to get richer—yet MAGA convinces them their enemy is a poor immigrant or a liberal college student instead.

Step Two: Manufacturing an Enemy to Hide Who’s Really Screwing You Over

The genius of MAGA isn’t just in its false promises—it’s in its ability to make its supporters blame everyone except the actual people exploiting them. Every time Trump or his allies betrayed the working class, they fed their base a new villain:
- Immigrants are taking your jobs! (Reality: Corporations are outsourcing jobs and automating labor to increase profits.)
- Minorities are getting all the government benefits! (Reality: The biggest beneficiaries of government subsidies and tax breaks are billionaires and corporations.)
- Liberals want to destroy America! (Reality: Billionaires on both sides profit from division while ordinary Americans struggle with rising costs and stagnant wages.)

Instead of uniting Americans against the people who actually rigged the system—corporate elites, Wall Street, and political insiders—MAGA encourages its base to fight a cultural war against their fellow citizens. If you can convince a struggling factory worker in Ohio that their real enemy is an undocumented immigrant in Texas or a lesbian barista in Brooklyn, they’ll never stop to question why their boss just got a massive tax cut while their wages stayed the same.

Step Three: Suppressing the Vote to Maintain Control

MAGA leaders know that if more people vote, their hold on power is at risk. So instead of winning elections through popular support, they focus on voter suppression tactics designed to keep working-class Americans, particularly minorities and young people, from voting.
- Closing polling places in minority neighborhoods makes it harder for Black and Latino voters—who tend to vote Democratic—to cast their ballots.
- Strict voter ID laws disproportionately affect lower-income Americans who may not have driver’s licenses or easy access to government offices to obtain IDs.
- Purging voter rolls under the guise of “election integrity” often removes eligible voters, forcing them to jump through bureaucratic hurdles to re-register.
- Gerrymandering districts to dilute the power of working-class and minority voters ensures that even when MAGA policies hurt the people they claim to help, the system is rigged to keep them in office.

Trump and his allies spread lies about voter fraud not because fraud is a real issue—it isn’t—but because they need an excuse to justify voter suppression tactics that keep power in the hands of the wealthy. If everyone who was eligible to vote actually did, MAGA would collapse overnight.

Step Four: Keeping Americans Distracted with Endless Culture Wars

MAGA is not about policy—it’s about emotion. It thrives on outrage and grievance because if Americans ever stopped fighting each other long enough to look at the policies being enacted, they’d realize they were being conned. That’s why Trump and his allies keep their base hooked on an endless cycle of manufactured outrage.
- Instead of addressing rising healthcare costs, MAGA tells its followers to be mad about trans people in bathrooms.
- Instead of tackling corporate monopolies and stagnant wages, MAGA wants its base obsessed with whether someone knelt during the national anthem.
- Instead of fixing America’s broken education and job training programs, MAGA convinces its base that the real crisis is “woke” teachers indoctrinating their children.

This is not accidental. The more energy MAGA voters spend fighting these battles, the less likely they are to recognize the real scam happening right in front of them.

Step Five: Keeping the Working Class Down and Powerless

The final piece of the puzzle is ensuring that working-class Americans stay frustrated, poorly educated, and economically insecure—because an empowered, informed working class would be a threat to billionaire rule.
- MAGA Republicans push massive cuts to education funding because an educated population is harder to manipulate with lies and propaganda.
- They work to gut workers’ rights and labor protections because if people had strong unions and higher wages, they wouldn’t be as desperate or easily controlled.
- They fight against universal healthcare because nothing keeps people more dependent on their jobs (and less willing to fight back) than the fear of losing health insurance.

The system isn’t broken—it’s working exactly as intended. Billionaires don’t want independent, secure, well-educated Americans. They want a desperate, divided, easily misled population that will keep voting for the very people exploiting them.

The Hard Truth: MAGA Is a Scam—But Its Victims Keep Defending It

The tragedy of MAGA is that its biggest victims are the ones defending it most fiercely. Millions of working-class Americans, manipulated by fear and resentment, have been tricked into fighting for billionaires who are actively making their lives worse. They cheer for tax cuts they’ll never see, fight for industries that will never return, and defend a system that ensures they remain trapped in a cycle of economic frustration.

And when the next election comes, they’ll be told once again that their real enemies aren’t the billionaires hoarding wealth, the corporations sending jobs overseas, or the politicians voting against their interests. Instead, they’ll be told to blame immigrants, minorities, LGBTQ+ people, college students, and “coastal elites.” And once again, the cycle will repeat—because as long as MAGA keeps Americans angry at each other, they’ll never turn their anger toward the people actually responsible.

MAGA isn’t about making America great again. It’s about making sure the rich stay rich, the powerful stay in control, and the working class stays too divided and misled to do anything about it. CMV.",Parking_Truck1403,1346,0.8600000143051147,296,1740353521,2025-02-23 17:32:01,changemyview,https://www.reddit.com/r/changemyview/comments/1iwnuxk/cmv_maga_is_a_scam_that_exploits_the_working_class/,2,2025
1ijh6od,CMV: Trumps true agenda is to create outrage and confusion so people are distracted and scattered and the left is falling right into the trap,"Panama, Mexico, Canada, Gaze, Greenland, China. Every single day of every single hour, Trump and his admins are saying crazy shit that they have no intention of doing or no ability to do, in an effort to pass their true agenda which is siphoning off wealth from the United States. 

[Ezra Klein explains it perfectly ](https://www.youtube.com/watch?v=K8QLgLfqh6s)here talking about Steve Bannon: ***""The opposition party is the media, and  because they're dumb and they're lazy they can only focus on one thing at a time all we have to do is flood the Zone. Every day we hit them with three things they'll bite on one and we'll get all of our stuff done bang bang bang these guys will never will never be able to recover""***



This is exactly what is happening. We are falling for it. The airtime that a lot of his verbal garbage has gotten in the past two weeks is a smokescreen for what is going on behind the scenes. 

  
People are falling into the trap of letting themselves be distracted (including myself). There cannot be any organized movements or coordinated efforts of masses of people listening to federal employees and appointed officials because everyone is spread thin between outrage and fighting about Gaza, Trump Coin, Greenland, Tariffs, Nata, Ukraine. There is no singular point to focus on.

  
Trump knows that a lot of what he says will not get passed, but it does not matter. Because the lying, deceit and corruption is so normalized. 



I just don't see how these past two weeks have been anything other than the democrats/non-maga people being anything other than helplessly playing into his hand. At every point he wins. Even when he looses he wins because nobody cares. He controls the spin. As far as he and his supporters are concerned he wins every single encounter. 

Trump is using the tinkerbell effect to certify himself as the winner. He won the tariffs because he has the largest microphone and everyone who is glued to watch his daily outrage are falling into his web. His ratings, his ""bad publicity is better than no publicity"". The mass confusion. 



Am I wrong? I feel that Project 2025 and Steve Bannon laid out that plan years ago. Like Brave New World, the true dystopian nightmare is that the truth is not some hidden conspiracy. It's out there in the open with everyone to see and hear. But everyone is so scattered and disjointed that no change can happen because the constant attack on our focus by fueling endless rivers of garbage idiotic manufactured outrage tricks people from proactively resisting this takeover.",Extension_Fun_3651,1309,0.8600000143051147,229,1738885546,2025-02-06 17:45:46,changemyview,https://www.reddit.com/r/changemyview/comments/1ijh6od/cmv_trumps_true_agenda_is_to_create_outrage_and/,2,2025
1ip14zv,CMV: I have become racist.,"I live in Atlanta (in the city not the suburbs), born and raised here. I live/ and have grown up, in a diverse neighborhood, blacks, whites, hispanics, and a couple asian families as well. I am white. I tend to have mostly black friends, don't know why it just kind of happened. I was also raised in a very liberal family, always taught to never judge others, be kind to everyone, diversity is amazing, black lives matter etc (my entire family is like this). As I've gotten older its very hard to ignore the obvious things i see around me. Almost all crimes in my area are by black people. In my schools the people getting in fights, disrespecting teachers, all black. When I'm walking on the street or in public transportation, only black people will threaten me, be obnoxiously loud on the phone, or play loud music disregarding everyone else. My parents are from the north, grew up around practically only white people, I began to realize how easy it was for them to have their believes as they did not grow up around any other races. So when i'm walking home at night and see a black person with a hood up coming towards me, I do cross the road, the past 20 years of my life have taught me that. I dont want to be racist, I'd love to say that everyone is nice and I would never judge someone based on something that they cant even change, but I don't think I can.",TraditionalReturn357,1299,0.7699999809265137,1251,1739502731,2025-02-13 21:12:11,changemyview,https://www.reddit.com/r/changemyview/comments/1ip14zv/cmv_i_have_become_racist/,2,2025
1izqtzv,CMV: The Economic Blackout Boycott will fail entirely.,"I believe the Economic Blackout Boycott on February 28th will fail entirely because the threat of no sales for a day is effectively null.

Let’s say the movement includes 100% of all adults in the US (It most certainly will not). Even if they all stop buying most large scale companies will have customers outside of the US. And for there to be any effect on companies it would need to at least last several months. They’re threatening literally nothing. Most people don’t even buy things every day so many won’t even do anything different.

Even if they decided to make it last 4 months most people can’t do that. You’ll find that every product you buy somewhere in the chain will have a mass produced item from a huge company. And most items can’t be made at home. This won’t be like the colonial times where people could make the goods at home with some decreased quality. You cannot simply make gasoline at home or build a computer chip entirely from scratch. 

Plus this only affects individual consumers not any of the companies that receive stock from them. And what about those little businesses you care about so much that receive some of their product from the large corporations. 

Once the boycotts over people will go back to buying what they would’ve bought yesterday. And if they were to continue the boycott for months then what happens when companies start to fire employees. People are now losing jobs because of your silly little boycott. You’re harming the people too. Obviously this won’t happen cause people aren’t gonna boycott literally everything except the Amish run companies who run entirely separate from the rest of society. 

If you want to make a change then you need to target specific companies that you can live without, are entirely based in the US, and boycott them for months to years. 

This entire “boycott” is barely even a boycott. Your not exercising your power over the mega corporations your showing your reliance on them and unwillingness to go without the essentials for more than a day.
",Masterpiece-Haunting,1280,0.75,779,1740691249,2025-02-27 15:20:49,changemyview,https://www.reddit.com/r/changemyview/comments/1izqtzv/cmv_the_economic_blackout_boycott_will_fail/,2,2025
