post_id,title,text,author,score,upvote_ratio,num_comments,created_utc,created_datetime,subreddit,permalink,month,year
1iy3g36,"CMV: Russia should be held accountable for invading Ukraine, and they shouldn’t be allowed to veto their own punishment","Russia’s invasion of Ukraine is a clear violation of international law and sovereignty. The fact that Russia, as a permanent member of the U.N. Security Council, can veto any resolution aimed at holding them accountable is deeply troubling. It’s like allowing a criminal to veto their own punishment—how can we expect justice when the perpetrator has that kind of power?

The U.N. General Assembly overwhelmingly condemned Russia’s actions (93 to 18), but the Security Council’s structure gives Russia the ability to block any real consequences. This is not just a flaw in the system; it’s a serious issue that allows a nation to act out wildly, without facing the repercussions of their aggression.

If Russia is allowed to continue this unchecked, it sets a dangerous precedent where powerful countries can invade others and avoid consequences simply because they have the power to block action. That’s not how international law should work. If we believe in sovereignty and accountability, we need to reform the U.N. and prevent Russia from using its veto to avoid facing the consequences of its actions.

How to change my view: 
If presented with evidence that Russia was not in the wrong in invading Ukraine, and that somehow it was Ukraine’s fault, I would be open to reconsidering my position. Also, if you can explain to me how having five permanent powers in the U.N. is more fair, especially when those countries are acting in bad faith, and how it’s justifiable for them to have a veto on being held accountable for their actions, that would also help change my perspective.",PoolShotTom,1238,0.9399999976158142,222,1740511643,2025-02-25 13:27:23,changemyview,https://www.reddit.com/r/changemyview/comments/1iy3g36/cmv_russia_should_be_held_accountable_for/,2,2025
1ir5tyk,CMV: Trump Misunderstands Trade Deficits and It’s Hurting Americans,"Trump repeatedly claims that a trade deficit means the U.S. is “losing” money to other countries. This is fundamentally incorrect. A trade deficit is not government debt—it simply means a country imports more than it exports. In reality, trade deficits can be a sign of economic strength, and Trump’s misunderstanding of this basic concept has led to misguided trade policies that hurt both American businesses and consumers.

**1. A Trade Deficit is Not Like Owing Money**

The U.S. trade deficit means Americans buy more goods from other countries than they sell abroad. But that doesn’t mean money is just disappearing. Foreign countries use their U.S. dollars to invest back into the American economy, whether through purchasing U.S. stocks, bonds, or real estate. The U.S. benefits from a trade deficit because it gets cheap imports, which lower costs for consumers and businesses.

**2. The U.S. Trade Deficit is Largely a Result of American Economic Strength**

The U.S. has a massive trade deficit in goods, but a surplus in services (like finance and technology). Americans have more disposable income than many other countries, so they buy more imports—that’s a sign of consumer power, not weakness. A strong U.S. dollar makes imports cheaper, which naturally contributes to the trade deficit.

**3. Trump’s Tariffs Backfired and Proves he Doesn’t Understand Trade**

Trump’s tariffs on China didn’t reduce the trade deficit—they actually made goods more expensive for Americans. Instead of fixing the deficit, Trump’s policies led to retaliatory tariffs, which hurt American farmers and manufacturers. The damage was so severe that Trump had to approve a $28 billion bailout for farmers during his first term to offset their losses. If his trade policies were actually working, why did U.S. farmers need a government bailout? The trade deficit with China remained high because businesses just shifted supply chains to other countries like Vietnam and Mexico. The U.S. International Trade Commission reported in 2021 that tariffs raised prices between 1.7% and 7.1% in the ten most affected sectors, including apparel, car parts, furniture, and computer equipment. These findings are one of the many studies that indicate tariffs often result in increased costs for consumers, as importers and retailers adjust prices to offset the additional expenses.

**4. If Canada Stopped Exporting Oil, It Would Run a Trade Deficit With the U.S.**

Trump loves to complain about the U.S. trade deficit with Canada, but he ignores that it’s largely because Canada exports massive amounts of oil and raw materials to the U.S. If Canada stopped exporting oil, it would run a trade deficit with the U.S. because it imports more U.S. manufactured goods than it sells back in other sectors. Said raw materials and crude oil are then refined and manufactured into higher-value products by American companies, who sell them for a profit. This means the U.S. isn’t just “losing” money to Canada—it’s leveraging Canada’s exports to fuel its own industries. Trade deficits don’t mean one country is “winning” and another is “losing”—they’re just a reflection of what different economies specialize in.

Trump sees trade as a zero-sum game where the U.S. “loses” if it imports more than it exports. However, that’s not how trade works. Trade deficits can actually be beneficial, and Trump’s ignorance on this issue has led to harmful policies that hurt American workers, businesses, and consumers.",ChazzioTV,1201,0.8700000047683716,232,1739748544,2025-02-16 17:29:04,changemyview,https://www.reddit.com/r/changemyview/comments/1ir5tyk/cmv_trump_misunderstands_trade_deficits_and_its/,2,2025
1itx4hk,CMV: Trump recent comments on Ukraine prove he's basically a Russian asset,"So, Trump recently called Zelenskyy a “dictator” which,let’s be real, is straight out of the Kremlin’s playbook. Russia has been trying to paint Ukraine’s government as illegitimate since day one to justify their invasion. Now Trump is repeating that same narrative, right when U.S. support for Ukraine is on shaky ground.

This isn’t just a one-off. There’s a pattern here:

He Keeps Echoing Russian Talking Points! Whether it’s doubting Ukraine’s legitimacy, suggesting NATO is useless, or taking Putin’s word over U.S. intelligence, he has a history of saying things that conveniently benefit Russia.

He’s undermining ukraine right when it needs support most! By calling Zelenskyy a dictator, he’s fueling skepticism about military aid, which plays right into Putin’s hands.

It’s not just Words, it’s actions too! Let’s not forget that Trump literally withheld aid from Ukraine in 2019, leading to his first impeachment. Even now, he’s openly saying he’d let Russia do “whatever the hell they want” if NATO countries don’t pay up.",No_Discussion6913,1103,0.8700000047683716,498,1740053714,2025-02-20 06:15:14,changemyview,https://www.reddit.com/r/changemyview/comments/1itx4hk/cmv_trump_recent_comments_on_ukraine_prove_hes/,2,2025
1imiurs,CMV: The far-left  also needs to reflect on the harm it is doing,"One of the biggest issues with the far-left is how it frames political debates in rigid moral terms instead of engaging with the. complexities of people’s lived experiences. This doesn’t just alienate conservatives, it pushes away center-leftists too, the very people who play really important roles in bridging divides in polarized societies like the US today.

when asking difficult questions or expressing skepticism gets you labeled a racist, sexist, or bigot, people will just stop engaging. But they don’t stop thinking. They go elsewhere—often to spaces that welcome them but also expose them to reactionary pipelines. This is a real problem. Instead of fostering open debate, the left is making itself smaller, less persuasive, and more insular.

If progressivism is about changing minds AND building coalitions, then moral absolutism is the fastest way to fail, no? The left needs to be willing to have uncomfortable conversations without assuming bad faith, doubling down, and being quick to label something as an ism.",aincs22,1086,0.6200000047683716,1552,1739225897,2025-02-10 16:18:17,changemyview,https://www.reddit.com/r/changemyview/comments/1imiurs/cmv_the_farleft_also_needs_to_reflect_on_the_harm/,2,2025
1ikq3cq,CMV: It feels like conservatives aren't really against censorship,"Many conservatives claim to be strong defenders of free speech, constantly criticizing censorship, cancel culture, and government overreach. But I’ve noticed a pattern where some of the same people who fight against censorship are fine with suppressing speech when it suits their agenda.

Many conservatives praised Elon Musk for taking over Twitter, saying he would restore free speech. But under his leadership, Twitter has banned journalists who criticized him, suspended accounts tracking his private jet, and suppressed posts from political opponents.

If it was wrong for Twitter to censor conservatives before, why is it okay now?

Some conservatives argue that businesses should be free from government interference. But in states like Tennessee and Florida, they’ve pushed for laws restricting drag performances and LGBT content, even in private businesses.

If conservatives oppose government control over businesses, why support laws dictating what people can perform or express?

Conservatives often defend companies rights when it comes to political donations or free market decisions. But when companies take stances they don’t like, such as Disney opposing Florida ""Don’t Say Gay"" bill, suddenly they advocate for government retaliation.

If businesses should be free to support conservative causes, shouldn’t they also be free to support progressive ones?",No_Discussion6913,1031,0.8199999928474426,747,1739029456,2025-02-08 09:44:16,changemyview,https://www.reddit.com/r/changemyview/comments/1ikq3cq/cmv_it_feels_like_conservatives_arent_really/,2,2025
1ikyule,CMV: Republicans don't really believe in small government,"Former Republican and former proponent of small government here. Republicans claim to be the party of small government and limited regulation. This is rhetoric meant to cynically stoke anger and galvanize support from the base. However, many of their voters rely directly on government benefits and subsidies. Elon's capture of government is another Dobbs moment for the party. He is carrying out a promise, and Republican politicians are scared shitless of Elon primarying them if they oppose and voters turning on them for the economic damage Elon is causing.",PrettyModerate,1009,0.8299999833106995,442,1739051910,2025-02-08 15:58:30,changemyview,https://www.reddit.com/r/changemyview/comments/1ikyule/cmv_republicans_dont_really_believe_in_small/,2,2025
1izmeqx,CMV: US Americans who voted for Trump and are now regretting it shouldn't receive sympathy,"If you voted for Trump and are completly ok with what he is doing and you are not regretting it, this is not for you, and this post is not addressing these people.

However, this post is specifically addressing the people who after going through Trump's first term decided to elect him again. for example this person here: https://archive.is/2025.02.27-114505/https://www.washingtonpost.com/politics/2025/02/27/fired-federal-worker-trump-voter/

During his first term Trump did so many questionable things including:
1. Denying that he lost the election and refusing to concede which let to the insurrection.

2. Put doubt on he's own health departments covid response.

e.t.c

I struggle to see how the should receive any sympathy given all of the information that was there about Trump.




 ",kindly102,961,0.75,992,1740680117,2025-02-27 12:15:17,changemyview,https://www.reddit.com/r/changemyview/comments/1izmeqx/cmv_us_americans_who_voted_for_trump_and_are_now/,2,2025
1iy695u,"CMV: White men and Christians are NOT being “attacked” or “persecuted”. They are just experiencing public backlash and being held accountable for the first time, and now, they are playing victim.","I keep seeing this rhetoric about how Christianity and the white male is under attack in America. I believe that these populations are just finally experiencing backlash , made possible with things like the internet and free speech. 

Take the “make loneliness epidemic” for example. Young men have began blaming everyone but themselves for not being able to find a girlfriend. With women becoming more independent over the past several decades and moving away from the trad wife role, they’re now able to be a little more picky . Theyre also making more money on their own. There’s no reason to settle for someone who isn’t right for them in the long term, whereas in the past, women felt much more obligated to men  because of the dependence dynamic. 

Because the trad wife / male provider idea has been around for a while, young men are still being raised to believe women need them, that women must be homemakers, and they feel entitled to a wife. Men never had to try very hard in the past too find a wife because , like i said, women were not in a position where they could be picky. Now, women are getting educated and working , and men are falling behind because they never saw value in that, and just assumed they would magically get a wife someday. There are so many men nowadays who expect a trad wife , but without themselves playing the role of the provider. They get pissed whenever women don’t like them , all because women have much higher standards and expect to be treated with the same amount of respect as anyone else. Men don’t realize they are not entitled to a wife, and there’s no reason for any woman to be with them if they don’t want to be. So now They just start blaming women for “asking for too much” , they blame the government for everything being expensive and not being able to make more money than their woman counterparts, they blame “woke” for everyone becoming “too sensitive and entitled”, etc. They blame everyone but themselves for the situation they’re in, they take no accountability, and now they’re playing victim. 

It’s similar with Christianity. Christianity was always , *AND STILL IS*, the majority religion in the USA. However, with the country evolving and being more accepting of lifestyles outside of the traditional Christian life, and with the internet giving more voice to people to express their disdain for the religion, they now think they’re under attack. All that’s really happening is that people are freely voicing their opinions about the religion , and how they feel the religion has been harmful to their existence in some way. There have been no laws or regulations passed that outlaw or hinder the practice of Christianity in any way, in fact, white Christian men are currently running the country. 

They just feel that the very existence of anything outside their view of traditional family values is an attack. Being allowed to fly a pride flag at a school is not attacking Christianity. Trans people simply existing in public spaces is not an attack on Christianity. Gay marriage is not an attack on Christianity. if the person certifying the marriage is a Christian, and is obligated by law to certify that marriage, that is not an attack on Christianity. Allowing other ideals and belief systems to exist in the same space as Christianity is not an attack on Christianity. If a gay man gets online and expresses his disdain for the religion , because his Christian family disowned him, that is not an attack on Christianity. That is someone voicing their opinion, which they are allowed to do, and that is someone who is having an emotional response to being harmed in the name of Christianity. Not everyone has to agree with or follow your religion. If you can’t take it, don’t dish it out. As long as an entirely Christian government can be elected into office by will of the people, the religion is not being persecuted. There is no reason to play victim. 

TLDR; White Christian men have finally been held accountable for all the oppression and harm they’ve inflicted onto everything they touch. Now, the world is figuring out we don’t need to depend on men or Christianity to survive, and they now must actually earn the respect of people. However, they still have the same sense of entitlement they had before, they aren’t trying at all to catch up with society and other part, and are now playing victim all because no one views them as superior anymore— hint, they never were superior. The “male loneliness epidemic” proves this , with white men feeling entitled to the respect of women,  and the Christian “traditional family values”. ",Broad-Hunter-5044,910,0.6800000071525574,1014,1740518598,2025-02-25 15:23:18,changemyview,https://www.reddit.com/r/changemyview/comments/1iy695u/cmv_white_men_and_christians_are_not_being/,2,2025
1ihplop,cmv: Pro-lifers that carve out exceptions for rape are morally inconstant.,"I would like to start by saying that this is not a pro-life vs pro-choice post. That's not the point of this CMV, so I won't be engaging with the comments that are arguing for/against pro-life.

In the discussions on reddit about abortion, you'll often see pro-choicers demonize pro-lifers for not carving out exemptions  for rape when they are discussing their views. You'll see pro-choicers justify their view by saying that someone shouldn't carry their rapists baby. This is a completely fair view with in the context of bodily autonomy. The problem is that this view doesn't matter in the context of ""all human life has some inherent value"" the way that pro-lifers believe.

The life of someone who was conceived by rape isn't any less valuable than the life of someone who was conceived in some other manner. So for the people who believe that all human life has some inherent value and should be protected, why would it make sense for them to carve out exceptions for rape?

Why wouldn't it be considered morally inconsistent if they make those exceptions?

",PM_UR_TITS_4_ADVICE,894,0.8299999833106995,360,1738696098,2025-02-04 13:08:18,changemyview,https://www.reddit.com/r/changemyview/comments/1ihplop/cmv_prolifers_that_carve_out_exceptions_for_rape/,2,2025
1ig96ua,"CMV: There will be a US presidential election in 2028, but it will not be free or fair.","As we know, in the final months of the last Trump administration, President Trump, along with many Republican politicians both in Congress and in his administration, tried to overturn the result of the 2020 election. This culminated in the botched coup attempt on January 6th 2021.

Trump did this without the support of the broader government bureaucracy or the military, and nevertheless got surprisingly close to succeeding, or at least to causing the greatest constitutional crisis since the civil war. As I write this, he and his new administration are working to reshape the federal workforce, rooting out, deliberately or not, all those who wouldn't cooperate with a second coup attempt.

Further, while the attempt in 2020/21 was unsuccessful, no one at the top has faced any real consequences, least of all Trump himself. Nothing has happened since 2021 that might convince him that a second coup attempt is not worth it.
  
As a result, I believe that Trump and his administration will try again, one way or another, and that this time there's a good chance they'll succeed. 

To change my view, you'd have to convince me that either:
1) Trump did not try to overturn the 2020 election result, or;
2) he did but has since changed his mind and would leave office peacefully in 2029, or;
3) another coup attempt would most likely fail. 

Clearly, as Trump's re-election shows, there are a huge number of Americans who don't agree with me on this - so what am I missing?


Notes:

I think for clarity I should point out that I'm aware that constitutionally Trump cannot run in 2028. I'm assuming here that the Republican candidate in the next election will be either Trump's anointed successor, be that JD Vance or whoever else, or even Trump himself utilising some kind of loophole.

Similarly, I've deliberately not discussed the exact mechanism(s) by which the 2028 election could be subverted. I think that a sufficiently powerful executive would have several viable options, and that the specifics of each are besides the point. Nevertheless, as stated above, I'm open to being convinced that it simply can't be done. ",MrScaryEgg,891,0.7300000190734863,395,1738534162,2025-02-02 16:09:22,changemyview,https://www.reddit.com/r/changemyview/comments/1ig96ua/cmv_there_will_be_a_us_presidential_election_in/,2,2025
1izafgc,CMV: The American public is unwilling to fight for regime change.,"I do not want to have some debate on individual policies, I am focused on the idea that the American public is simply unwilling to do what it takes change the current situation.
  
As events have gone on, I've had many discussions in person and online regarding things. I've been somewhat politically active in person, more than most, and I think that's where my hope is slashed - I've done the bare minimum and sacrificed little. And as far as I can see, there are less than 50k people in the entire country are willing to even get off their chair for a couple hours.
  
Most Americans won't take a penny out of their pocketbook to enact change. Hell 40% of them couldn't even bother to vote, even if they had their ballots mailed directly to them! 
  
Precisely nobody is doing anything to stop what appears to be a constitutional crisis, but hey, get owned eggs rose in price! That should get everyone out of their chairs. Cost so much it's unaffordable to doordash them!
  
Change requires sacrifice and Americans just won't do it. Costs too much to protest. Rush hour traffic. Might be seen by boss. 
  
And the haunting fact that 1/3-1/2 of the country approves of what's going on doesn't make me feel better. But a million of them showed up for their guy. None have shown up to stop theirs.
  
I hope someone can change my view. It makes me feel quite alone. I see someone here or there don't feel as alone, but then again, a million showed up to try to forcefully keep Trump in power. I've not seen a million on the streets. I don't think I will. I don't think itl break 100k in a single day. It has before, but it won't now.",CommunicationFun7973,863,0.7200000286102295,1242,1740641756,2025-02-27 01:35:56,changemyview,https://www.reddit.com/r/changemyview/comments/1izafgc/cmv_the_american_public_is_unwilling_to_fight_for/,2,2025
1isdzij,CMV: r/Conservative posts are getting pushed to the front page with little engagement,"Posted this in r/nostupidquestions originally, but it was removed for being a rant, so hopefully I can get an answer here. So, like some others have also noted, I’ve been getting more posts from the conservative subreddit pushed to my popular page, and I noticed that there’s a big discrepancy between the upvotes on the post itself versus the top level comments.

Here's what I mean:

Political and current event posts usually get a LOT of engagement, a post that has ~4000 upvotes usually has a top comment with upvotes between 800 to 2400, but the r/conservative posts that are getting around 4k votes have top comments around 200. 

Why such a huge difference? Are people really scrolling through Reddit, upvoting the post but not reading or voting on any of the comments?

On top of that, the comments are weird too. I know it’s a heavily moderated subreddit, but the comment count versus the amount of comments you can actually see is an order of magnitude in difference, and when you click on the collapsed replies most of them have nothing there. Don’t removed comments show as deleted?

I realize that I might just be ignorant of how Reddit works, and I’m not trying to make this a political post. I’m genuinely looking for an answer here, and thanks in advance.

Some examples from the last couple days:

https://www.reddit.com/r/Conservative/s/qsDslLhVXP

4.4k upvotes with the top comment at 189 upvotes, and 29 comments showing versus 278 comments counted, at time of posting.

https://www.reddit.com/r/Conservative/s/NukDmHg2Kf

4k upvotes with the top comment at 221 upvotes, and 19 comments showing versus 262 comments counted, at time of posting.

",lupus_bonum,838,0.75,365,1739889145,2025-02-18 08:32:25,changemyview,https://www.reddit.com/r/changemyview/comments/1isdzij/cmv_rconservative_posts_are_getting_pushed_to_the/,2,2025
