post_id,title,text,author,score,upvote_ratio,num_comments,created_utc,created_datetime,subreddit,permalink,month,year
1ftufds,"CMV: CMV: Within legally recognized marriages, adultery should have clear, civil legal consequences, unless expressly agreed between spouses.","The legal concept of marriage, where spouses act as partners, is almost always built on mutual trust that certain aspects of the relationship, such as sex, are to be exclusive to the relationship unless agreed upon otherwise. Legally and financially rewarding spouses for betraying the trust of their spouse by allowing a cheating spouse to come out ahead in divorce undermines one of the key relationship dynamics in our society.

For the vast majority of people, entering into marriage is an explicit agreement that unless divorced or otherwise agreed upon, the people in the marriage will not have sex with or develop romantic relationships with other people. This should apply evenly to all genders, and if you view this as benefitting one over the other, it says a lot about your view on who may or may not be more likely to cheat.

Before I'm accused of being some kind of conservative or traditionalist: I have zero issue with any form of LGBTQ+ relationship or poly setup. I'm speaking strictly to traditional, legally recognized, monogamous marriages, which comprise the bulk of those in our society. I'm also not religious or socially conservative.

Heading off a few arguments:

1. ""The government shouldn't be involved in marriage""

Too late for that. Marriage is a legally binding agreement that affects debt, assets, legal liability, taxes, homebuying, and other fundamental aspects of our lives. The end of marriage has profound, legally enforceable consequences on both parties. It is also included in a pre-existing legal doctrine of [https://en.wikipedia.org/wiki/Alienation\_of\_affections](https://en.wikipedia.org/wiki/Alienation_of_affections).

2) ""But what if the spouses want to open their marriage?""

Totally fine. My post is in reference to the most common form of marriage, which is monogamous.

3) ""Adultery doesn't have a clear definition""

It does. ""voluntary sexual [intercourse](https://www.google.com/search?sca_esv=05826a3c56c67289&sca_upv=1&rlz=1C1ONGR_enUS1127US1127&q=intercourse&si=ACC90nwZrNcJVJVL0KSmGGq5Ka2Y_LZNCuz-rXf3RWbWGZD0YFuvQ0gck8iv_I-vXEsPMmDpeldPlTyUN0FJ6k9nx2_KAjj_QmEabPxsAQcdvs4E9R8NkyU%3D&expnd=1&sa=X&ved=2ahUKEwj_k-r92u2IAxVAMdAFHaqNGncQyecJegQIOhAO) between a married person and a person who is not his or her spouse."" ""Sexual intercourse"" would include all the commonly recognized forms of sex. This would have to be proven via the typical preponderance standard, which is greater than 50% odds, via typical evidence used to evidence behaviors - depositions/testimony under oath, any written or photographic evidence, circumstantial evidence, etc.

4) ""What should the legal consequences be?""

At the very least, immediate forfeiture of any rights to alimony or spousal support. Shifts in the default assumption of a 50/50 split of marital assets are another route to explore. Certainly not enough to leave anyone destitute, though.

5) ""What about children?""

Child support is a separate issue, as it affects the child, who has no say in one of their parents cheating on the other.",insect_ligaments,654,0.6800000071525574,1145,1727805246,2024-10-01 12:54:06,changemyview,https://www.reddit.com/r/changemyview/comments/1ftufds/cmv_cmv_within_legally_recognized_marriages/,10,2024
1gbla2c,CMV: Elon Musk has most likely committed treason,"WSJ just dropped an article today, and it paints a pretty grim picture. 

Elon is deeply involved in the US space, defense and military industries and his companies receive billions in government contracts, yet he is getting chummy and regularly communicating with Putin and using Starlink to help Russia and hinder Ukraine. People in government are uncomfortable with it but the US government is painfully dependent on SpaceX. 

I wonder if his recent campaigning and fundraising for Trump is entirely to try to secure a pardon for potentially serious charges. 

Link to article:
https://www.wsj.com/world/russia/musk-putin-secret-conversations-37e1c187?st=AtqyMW&reflink=article_copyURL_share",yuicebox,649,0.6700000166893005,312,1729827662,2024-10-24 22:41:02,changemyview,https://www.reddit.com/r/changemyview/comments/1gbla2c/cmv_elon_musk_has_most_likely_committed_treason/,10,2024
1gf4vgz,CMV: the black people at my college are starting to make me feel racist ,"I’m a very liberal person. I have never ever had an issue with black people. But ever since arriving at my college, almost any interaction I have had with a black person was bad. The ones here are just plain disrespectful to anyone they aren’t close to. Anytime they do laundry here they leave it for hours when they know there’s people waiting, they just don’t give a fuck. I’m trying to not stereotype them but it’s very consistent, & I’ve started hating them for it. It’s not my view on ALL black people, just the ones attending my college. They’re loud, say slurs all the time (not just the n word) & legit have zero respect for ANYONE. I don’t want to feel this way towards any race, but it’s not like there’s no reason I feel this way. ",YakCultural8444,630,0.699999988079071,757,1730234383,2024-10-29 15:39:43,changemyview,https://www.reddit.com/r/changemyview/comments/1gf4vgz/cmv_the_black_people_at_my_college_are_starting/,10,2024
1g01fdk,CMV: Conspiracy theories are just coping mechanisms for life’s unpredictability.,"With Hurricane Milton making landfall in Florida, there are countless people who believe the government has the ability to generate a Category 5 hurricane with minimal effort. Cloud seeding, chemtrails, and other theories come up frequently. But at the core, these theories are about people being afraid of things they can’t control.

A lot of them advocate for ‘waking up’ and seeing the truth. They have to be constantly vigilant, as if there’s some kind of unseen enemy out to get everyone. The idea that things just happen randomly, without anyone being at fault, is impossible for them to accept.

It’s hard for them to face the fact that we can’t control nature, other people, or the forces of the universe. They’d rather believe that someone is pulling the strings behind the scenes for their own gain. But sometimes, the truth is simpler: sh*t happens.  ",Kerminetta_,609,0.8600000143051147,213,1728506071,2024-10-09 15:34:31,changemyview,https://www.reddit.com/r/changemyview/comments/1g01fdk/cmv_conspiracy_theories_are_just_coping/,10,2024
1fzrumy,CMV: The UN resolution calling for Israel's withdrawal from the occupied territories in 12 months shows the UN has no real interest in peace,"Just to preface: I'm an Israeli, I fully believe that a two state solution is the only way for peace and that eventually Israel will have to withdraw from the west bank.

Last month the UN general assembly passed a resolution calling for the complete withdrawal of Israel from the occupied territories in 12 months, among other things. This is obviously completely impossible for 2 main reasons -

1. Currently there are around 700K Israelis living in the west bank and transfering all of them out of there in a year is simply not doable. It's not like Israel has cities, houses and jobs ready to accommodate these people. The toll such a massive transfer of civilians would take on the economy and probably military is just too high for such a move to be realistic.

2. Israel cannot withdraw from the west bank before it is stable enough to not be threat to Israeli security. Pulling the army out of the west bank would leave Israel's heartland completely exposed to attacks from militants within the territory, something Israel simply can't allow to happen as it would majorly compromise the country's security. This is obviously the main reason why such a hasty, one sided withdrawal is impossible. 

This makes this resolution, in my opinion, detrimental to peace and not the opposite. 

This is because it's a resolution that Israel simply cannot accept. The consequences of this will be that many around the world and in Palestine will have the idea that Israel continuously ignores UN resolutions reinforced and Israel will garner even more hate for it. And in Israel it feeds straight into the ""UN and everyone is anti - semitic and can't be trusted"" narrative, which only strengths and emboldens the nationalists and drives people away from peace. 
I also thinks this leads the the UN becoming less credible as what's it's point if it is pushing out unrealistic resolutions? 

In my opinion if the UN truely cared about achieving peace they would adopt a resolution calling for Israel and the PA to restart earnest talks about adopting a 2 state solution, and the fact they instead adopted this one shows their interest isn't peace, but rather virtue signaling and optics. 

Now I know some might say that the UN general assembly resolutions are non binding and it's more about sending a message and reinforcing international law, but I would still say that sending an unrealistic message is useless and causes more harm than good. ",Xx_Mad_Reaps_xX,599,0.6200000047683716,1263,1728481757,2024-10-09 08:49:17,changemyview,https://www.reddit.com/r/changemyview/comments/1fzrumy/cmv_the_un_resolution_calling_for_israels/,10,2024
1g9o244,CMV: An abortion ban will only create more human suffering,"Banning abortion is going to create a lot more suffering, especially for kids who end up in foster care. Right now, only about 20% of foster kids ever get adopted, which means the rest are stuck in the system until they either go back to their biological families or age out at 18. For the 20% who age out without a permanent family, life gets really tough. About 50% end up addicted to drugs, and 1 in 5 becomes homeless. For the boys, more than half end up in jail, and for the girls, about 70% are pregnant by age 21.

That’s a huge problem, and banning abortion is only going to flood the foster care system with more kids, which is already struggling to keep up. The system’s broken, and we know that kids who grow up in foster care are way more likely to end up in trouble—about 80% of people in prison spent time in foster care as kids.

So really, banning abortion isn’t just about babies being born—it’s about putting more kids into a system that can’t handle them and setting them up for a hard life. If we care about reducing suffering, pushing more kids into foster care is only going to lead to more addiction, crime, and pain for everyone.",AmbassadorFar4335,595,0.75,726,1729618719,2024-10-22 12:38:39,changemyview,https://www.reddit.com/r/changemyview/comments/1g9o244/cmv_an_abortion_ban_will_only_create_more_human/,10,2024
1g4b3ls,"CMV: In almost every practical way, No Tax on Tips is a bad policy","I don't know why both candidates are supporting it.

1. If you think people who make less should be paying less in taxes, just advocate that, adding complexity doesn't help.
2. It opens the door to more tip-based jobs in society. Surgeons will be making $2.13/hr with an expectation you tip 20% on your triple bypass surgery, and that be how they make their money. There's already an expectation to tip plastic surgeons. These large tips on expensive procedures being tax free will just continue us down the rabbit hole
3. If you want to incentivize people to work jobs like service industry jobs that are tip-based, the government shouldn't be the one doing it, the businesses should be. I would prefer business subsidies to businesses that pay their employees well over no tax on tips. This just perpetuates the cycle of businesses relying on the government instead of actually providing for their employees.

The only argument that makes sense is that people are already not paying taxes on tips by just tax evading, so it just gets rid of the fear of those tax evaders of getting legal consequences for their actions, but appeasing people who are breaking the law isn't how we should be making policies",Free-Database-9917,581,0.800000011920929,471,1729007838,2024-10-15 10:57:18,changemyview,https://www.reddit.com/r/changemyview/comments/1g4b3ls/cmv_in_almost_every_practical_way_no_tax_on_tips/,10,2024
1g5y5nf,CMV: It Is Unwise for Supporters of Kamala Harris to Mock Undecided Voters ,"I was inspired to write this by an exchange I had regarding this post: https://www.reddit.com/r/PoliticalHumor/s/E2Mj2dgkA8. As you can see the OP made a big hit. Over 1000 upvotes at the time I write this.

But take a second to consider the implications of that meme: it suggests that there are only two groups that exist in the American electorate —people who have decided to vote for Harris, and MAGA authoritarians. That’s it.

Now, I realize this was just a silly bit of fun, but I raised a question to other users on that heavily Democratic-leaning sub: is it wise to shame and ridicule people who still might vote for Kamala, especially considering that the election will almost certainly be decided by a extremely narrow segment  of the electorate? Does it make sense to mock undecided voters under these circumstances?

My concerns were met with scorn.

“I’m tired of swing voters! If they can’t figure out who to vote for, they should just stay home!”, said one.

“Swing voters don’t actually exist. They know they’re going to vote for Trump and just pretend to be undecided for attention.”, claimed another.

“I would hate to deny a person their right to vote but if a person can’t figure out why voting for Trump is bad…”

I am paraphrasing here, but only a little. What’s worse, I hear similar ideas from my progressive friends and I believe these opinions are common in left-of-center circles.

For example there was a post not too long ago right here on this sub where the OP expressed concern that Harris was not getting enough support from labor unions. I commented that the Democrats are increasingly becoming the party of the university educated managerial class and that they are losing wage earning workers in the process and I suggested that this was lamentable. Lots of people responded that the working class is mostly composed of bigots anyway so progressives shouldn’t seek their votes at all.

Now, that point of view is totally unhinged for a variety of reasons but I do want to say that I get why people are frustrated with swing voters.

Like, how can you be “not sure” about voting for or against a convicted criminal with authoritarian tendencies who endorses dictators and threatens civil rights? What kind of person would struggle with that decision?

But getting impatient is still not the appropriate response because despite what some Reddit users may believe swing voters are real.

There are people who voted for Obama, then Trump and then Biden and who have not made their mind yet about the 2024 election at this time. The key point for me is no matter how exasperating this kind of behavior might be, we need to try to coax these people to vote for our candidate and cannot afford to scoff at them publicly.

Statistically, swing voters are less educated and less politically engaged than hardcore supporters of either party, but they will decide the election. If a person does not want another Trump presidency, it is necessary to appeal to undecided voters. There simply aren’t enough Subaru Outback-driving, NPR-listening progressives (describing myself here) in the country—or in swing states—to carry the day for Kamala alone.

And like it or not, fair or not, there does exist a perception that Democrats are elitist college students and professors with nothing but sneering contempt for those without higher education. We can count on Trump and the Republicans to exploit that feeling to their advantage.

Making posts like the I referenced above exacerbates the problem. Even if it is at a micro level, the sentiment that undecided voters are stupid is widely spread and widely disseminated in progressive circles. And perception and feelings are more important than policy or facts right now, particularly for those “low information” voters who are going to decide whether or not Trump goes back to the Oval Office.

Under these conditions, I think a little tolerance and goodwill toward undecided voters makes strategic sense right now and I’m speaking to all of us who plan to vote for Kamala Harris.

Or maybe I’m wrong. Does it make sense to be openly scornful of swing voters right now?

I just want to say off the bat. Responses that say something to effect of, “What the Republicans do is even worse!” will not change my view. I don’t want the GOP to win so if they shoot themselves in the foot, I’m happy.

And if you do support Trump, I’m glad for you. I don’t. We can discuss him somewhere else.",BluePillUprising,568,0.7099999785423279,1010,1729190685,2024-10-17 13:44:45,changemyview,https://www.reddit.com/r/changemyview/comments/1g5y5nf/cmv_it_is_unwise_for_supporters_of_kamala_harris/,10,2024
1gf1rtc,CMV: Being ugly is really detrimental to your life experience ,"I feel like I’m living life as an outcast. I grew up being bullied and picked on and I used to think it was luck that I used to experience it, but it didn’t stop in my adult life, if anything it got worse. I had big teeth that took years to fix, and very bad acne. This was changeable during my early years. But my facial appearance and my height are not.

I notice how people treat me, especially at work in environments full of people against someone who is very physically attractive, and it’s like night and day. 

It’s much harder to form relationships and much harder to get the opposite sex to be attracted to you. I don’t blame women for feeling unattracted to me either, because I would probably feel the same way.

People who say ‘beauty is within the eye of the beholder,’ have never truly experienced life as an unattractive person. Because if you were unattractive, you wouldn’t say this.

I’ve been alone for most of my life, and jobs have been much harder to hold down, friends have been harder to keep. 

It annoys me that we live in a time of promoting obesity on beauty magazines, especially for women, and especially when this is something within someone’s control. Someone’s height and face are not easily changed without plastic surgery which is extremely expensive and not to mention unnatural and sometimes even dangerous.

 I feel like my life experience would never compare to someone who is physically attractive. It feels like life is a chore rather than something to be enjoyed, all because of genetically factors that are completely outside of my control. No matter how much someone tells me ‘I’m blaming women for why they are not attracted to me’ or ‘you need to love yourself first,’ will ever change what it is like to have an unattractive face and to actually have to live with it. 

",otoolealexanderben,562,0.8500000238418579,241,1730226659,2024-10-29 13:30:59,changemyview,https://www.reddit.com/r/changemyview/comments/1gf1rtc/cmv_being_ugly_is_really_detrimental_to_your_life/,10,2024
1fzw96j,CMV: too many people have a victim mentality these days,"A victim mentality is when a person feels like a victim even when there is evidence that says otherwise. I see so many people with this affliction these days, as in their immediate thought when something bad happens or they are stuck in life is that it’s someone elses fault. They think life owes them something, when in fact no one is entitled to anything, not even a moment of happiness or pleasure. this should make people grateful that they have the chance to better their situation but they don't. Most people don’t even realize they have victim mentality. Of course other people are going to look out for themselves first, and you get the short end of the stick. That’s not you being a victim, that’s just human nature. ",Specific-System-835,556,0.7599999904632568,369,1728493037,2024-10-09 11:57:17,changemyview,https://www.reddit.com/r/changemyview/comments/1fzw96j/cmv_too_many_people_have_a_victim_mentality_these/,10,2024
1g6vuts,"CMV: People who require that food be ""authentic"" to its cultural roots in order for it to be considered good are closed minded and have an unearned and illogical sense of superiority over other people's taste in food.","In my view, the only 3 things that truly matter with regards to food (in 99% of cases) are how the food tastes, how much it costs, and its nutritional value. Obvious exceptions to this general rule would be things like false advertising (restaurant advertises itself as ""authentic"" cuisine, but is obviously very far from being authentic to its cultural roots), or cultural events/festivals that are setup with the express purpose of celebrating a specific traditional culture. 

A classic example of my view is the friend or coworker we all seem to have who is 1/4 Italian, but has never been to Italy, and constantly talks about how terrible Olive Garden is because it isn't ""authentic"" Italian cuisine. This type of person is objectively closed minded, because they automatically write off anything that isn't exactly what they consider ""authentic"", no matter how much better the dish actually tastes compared to the authentic dishes they prefer. 

There is nothing about its proximity to traditional Mexican culture that somehow makes a traditional Mexican meal objectively superior to a San Diego-style Mexican dish or a New Mexican-style Mexican dish. 

If the only thing I knew about someone was that they automatically assume authentic traditional cuisine is better than modernized/Americanized/fusion style cuisine, then I believe they have a much higher statistical probability of being closed minded and having other illogical/nonsensical views, and thus I should automatically trust them less than I would trust another stranger who I know nothing about. I should especially trust them less when it comes to their opinions on art, travel, music, philosophy/ethics, and other endeavors where open mindedness is key to enjoyment and appreciation of said endeavor.

Change my view!",PM_me_ur_lifestoryy,514,0.8500000238418579,177,1729294586,2024-10-18 18:36:26,changemyview,https://www.reddit.com/r/changemyview/comments/1g6vuts/cmv_people_who_require_that_food_be_authentic_to/,10,2024
1g03o69,CMV: Weird Al should be asked to host SNL,"[Al has admitted that he'd jump at the chance if asked.](https://people.com/weird-al-yankovic-recalls-andy-samberg-asking-for-approval-before-snl-parody-exclusive-8724517)

He's got a filmography that demonstrates his ability to act.  He's funny.  He's versatile.  He does quick changes at his tours (recent ""self indulgent"" tours excluded), so he's well prepared to change characters during a commercial break.  His 40+ touring career proves that he's good with live audiences.  He could even be one of the rare combination music guests / hosts.

He's family friendly.  He's a household name.  He's untouched by controversy.  Given that both he and the show have been around for over forty years and they've never worked together, news of him being asked to host would make headlines and cause an uptick in viewership.  

I don't see a good reason *not* to ask him to do it.  Is there one?  Change my view!  ",AlwaysTheNoob,492,0.8700000047683716,77,1728511936,2024-10-09 17:12:16,changemyview,https://www.reddit.com/r/changemyview/comments/1g03o69/cmv_weird_al_should_be_asked_to_host_snl/,10,2024
1g7c5b3,CMV: Black Lives Matter has been a failure,"Back in the 2010s, and especially in 2020, it seems like the Black Lives Matter was gaining strength. Videos of police brutality, especially against African Americans, became viral, and millions became outraged that this was so common in America. When George Floyd was murdered, millions justifiably took to the streets to protest against police brutality and racism. Politicians came out in support for police reform, and discussions on how to reform policing (from “how to make the police better” to “defund the police”) were all the rage.

But from 2021, it seems like everything took a complete 180. Crime skyrocketed during COVID (in part of police refusing to do their jobs in protest of BLM), causing the average American to support the police a lot more. Pro-police politicians like Eric Adams were elected while pro-BLM politicians like Chelsea Boudin were ousted from their positions.

Now, absolutely nobody talks about police brutality these days, not politicians nor the general public. But has the problem gone away? No! It has only gotten worse! 2023 has seen a record number of killings by police, and I don’t expect that number to go down in the future.

https://www.theguardian.com/us-news/2024/jan/08/2023-us-police-violence-increase-record-deadliest-year-decade

Unfortunately, rather than being addressed, police brutality has become like gun control. Someone being killed by police, even on live video, no longer elicits outrage. Instead, people will just give “thoughts and prayers,” shrug, and accept it as a fact of American life.

And the BLM movement itself? Well, rather than becoming the second coming of the Civil Rights Movement, it seems to have been condemned to the ash heap of history.",ice_cold_fahrenheit,480,0.6700000166893005,471,1729353836,2024-10-19 11:03:56,changemyview,https://www.reddit.com/r/changemyview/comments/1g7c5b3/cmv_black_lives_matter_has_been_a_failure/,10,2024
