post_id,title,text,author,score,upvote_ratio,num_comments,created_utc,created_datetime,subreddit,permalink,month,year
17ma6nr,"CMV: The ""Mediocre White Man"" idea that some on the left like to promote is toxic, divisive and, if enough people buy into it, outright dangerous","This CMV is partly inspired by a conversation I saw on Reddit a couple of weeks ago where a male user was repeatedly putting himself down and a female user was not exactly doing anything to disabuse him of the notion that he's some sort of failure. 

It was upsetting to see somebody who, based on the comments, really hadn't done anything bash themselves over and over again for not being good enough. And this is by no means the first time I've seen this behavior. I think many on the left see it as a good thing, that if society can shake white men's core sense of self they'll be open to learning about other perspectives. 

I think the opposite is true. I think people who have no core sense of self who believe they are mediocre over all because of societal messaging are the most dangerous, and the most likely to lash out and hurt others. Anecdotally, I believe when I was at my lowest I was a much worse and far more toxic person. 

Change my view!",ICuriosityCatI,766,0.6399999856948853,2143,1698949774,2023-11-02 13:29:34,changemyview,https://www.reddit.com/r/changemyview/comments/17ma6nr/cmv_the_mediocre_white_man_idea_that_some_on_the/,11,2023
17v10la,CMV: Trump’s odds of winning in 2024 are significantly overstated in betting markets (currently a 50/50 on predictit),"I feel that giving trump 50/50 odds of winning the 2024 presidential election is overly generous. 

Ever since Trump initially won in 2016, Republicans have failed to win at a national level. 2018 was considered a disappointment for them, trump lost in 2020, 2022 “red wave” never materialized, and now suddenly we’re supposed to believe that 2024 will turn things around. 

For Trump to win, he needs to pick up 3 of the 6 below states- 

- Georgia
- Wisconsin
- Arizona
- Pennsylvania
- Michigan
- Nevada

Georgia went blue because of the growth of Atlanta, which has only continued to grow. The population has gone up by 300,000 people since 2020. The whole j6 and Georgia lawsuits has only served to hurt Trump’s image in that state. I consider his odds of flipping that state very poor considering his position is weaker than the last time he lost.

I consider his odds to win in Pennsylvania incredibly poor, considering how his endorsement of Oz couldn’t beat a disabled candidate in the senate. PA is getting bluer. 

Michigan is a lost cause for the GOP considering how Tudor Dixon performed there. 

I almost didn’t include Nevada in this list because it has always felt like a stretch for the trump campaign. It’s a state that has very slowly started to shift red, but Trump needs to find 30,000 votes to flip there in 24 to win it and I don’t see where they will come from. 

Arizona is like 60/40 for Biden because of the continued growth of Phoenix and the unpopularity of trump there due to his arduous history with John McCain. 

And finally there’s Wisconsin, which was incredibly close and I guess he could win in 24. They had a winning gop race I recently. To be nice to him, let’s say that one is 60/40 for trump.

So that’s 1 state that he is 60/40 likely win (Wisconsin), 1 where he’s a 60/40 on the losing end (Arizona), and 4 where I consider his chance of victory to be very poor. I’ll assign them 25% chances of winning each. 

Plugging those odds into a calculator online, I see that his odds of winning would really be 11.27%, rather than 50/50. 

I believe that my estimates make sense given the current environment and issues like abortion making republicans have a very difficult uphill battle with voters. I’d be curious as to things I’m missing with my estimates that would require I shift my view.

Edit- sorry have something that popped up at work, will follow up in a couple hours to more responses",Money_Whisperer,744,0.800000011920929,886,1699964279,2023-11-14 06:17:59,changemyview,https://www.reddit.com/r/changemyview/comments/17v10la/cmv_trumps_odds_of_winning_in_2024_are/,11,2023
182gcld,CMV: Locs on a non black person isn’t cultural appropriation.,"To start off I myself am a black man with locs and As the title says I believe there is no issue to a white or non black person to have locs. I don’t see any reason why there should be a problem? But as soon as I bring it up to another black person they’re “concerned” because I think that way. As if me not victimizing myself and trying to cause a problem on something that is completely harmless such as someone’s own personal “hair” is me being stupid or “succumbing to white people stealing what “we created”,  which isn’t true. I just feel a lot of Us blacks victimize a situation that utterly has none of our concern. I think it’s cool non blacks are fascinated with bits of black culture I don’t see the problem in people expressing that . Am I wrong for thinking that? Why the hell are we so worried about what another person does to their hair. Let them be happy and stop turning everything into a history lesson when it doesn’t even need to be. The more we focus on bullshit the longer we will stay in it. I understand when things actually NEED concern though but claiming and getting upset and calling a white person the word “gross” and saying it’s cultural appropriation over a hairstyle?? Cmon why are we nitpicking when there is so much more we should be focused/worried about. It’s hair at the end of the day . It’s not like their intent is ill. They just like a hairstyle us blacks tend to rock.",Wise_Comparison_8476,744,0.7900000214576721,624,1700789670,2023-11-23 19:34:30,changemyview,https://www.reddit.com/r/changemyview/comments/182gcld/cmv_locs_on_a_non_black_person_isnt_cultural/,11,2023
17p10mg,CMV: democracy cannot tolerate ignorance. Sovereignty for the undereducated is bad for democracy.,"Democracy requires a highly educated electorate; democracy collapses if the people lack advanced education.

It sounds elitist sure, but I strongly believe that it’s true. Popular sovereignty is a nice idea, but an extremely bad one. Literacy tests were certainly abused during the Jim Crow era, but they have well-founded reasoning behind them. 

Demagoguery can really only occur if the population is ignorant enough to believe that the would-be tyrant isn’t lying; or that history repeats itself. 

Take Trump for example. Those who haven’t read primary sources reflecting the rise of the German National Socialist Party might not see the parallels between American populism and German populism. Or at worst, people might not even know what populism is. 

From a policy perspective, the ignorant might think a bunch of government stimulus is a good thing and will never have any negative consequences. Whereas anyone who took high school economics could tell you that inflation will rise as a direct consequence of free money injected into consumer wallets. 

In countries where dictators or oligarchs rule, there is no need for a wise population. In fact, the stupider the better. However a democracy will crumble to ruin if the ignorant are permitted to vote and in large numbers.",Ok-Story-9319,695,0.7599999904632568,877,1699271559,2023-11-06 05:52:39,changemyview,https://www.reddit.com/r/changemyview/comments/17p10mg/cmv_democracy_cannot_tolerate_ignorance/,11,2023
18624kk,CMV: far-right Muslim extremist organizations like Hamas should be treated the same way we treat far-right Christian extremist organizations.,"Progressive intersectionality has been a net asset for many causes including the struggle of oppressed minorities, women, LGBT groups, etc...

However, in recent times, it has lost its focus by trying to include supporting far-right religious extremists such as Hamas, a terrorist organization, all in the name of intersectionality.

It is mind-blogging that many progressive activists to this day still refuse to condemn Hamas' rape, torture, and beheading of innocent civilians. Some even go so far as to deny that rape and gender-based violence even took place.

**It shouldn't be difficult to stand with innocent Israeli and Palestinian civilians while still condemning Hamas' terrorist attacks.**

If a Christian Copt Terror group in Egypt, started to rape, torture, and behead innocent Muslim civilians in the name of Jesus Christ, you can be sure that these same progressive activists would condemn them.

They would ignore the context of the oppression that the Copt minority has suffered at the hands of Egypt's Muslim majority Government and instead, they would only focus on ""Christians killing Muslims"".

But when Muslims kill Jewish people or Christians, many progressive activists refuse to condemn Hamas all in the name of intersectionality. 

**CMV: far-right Muslim extremist organizations like Hamas should be treated the same way we treat far-right Christian extremist organizations.**",Su_Impact,664,0.6800000071525574,1977,1701194112,2023-11-28 11:55:12,changemyview,https://www.reddit.com/r/changemyview/comments/18624kk/cmv_farright_muslim_extremist_organizations_like/,11,2023
187frmy,"CMV: You have to have a certain level of stupidity, intentional ignorance, or intellectual blindness to believe the entirety of any of the main religious texts existing today.","I find it genuinely mind boggling when I hear people, especially those under the age of about 65 saying things like 'evolution never took place', 'the earth was created in 7 days, approximately 3000 years ago', 'humans and dinosaurs could have co existed.

I genuinely thought for years, as being someone who was brought up outside of organised religion, that the people who made these claims were playing some kind of big practical jokers. Like I thought (and still kinda do) about flat earthers in the same way because I genuinely believe that the claims were equally idiotic.

Even the Catholic Church has to kowtow to religion when the evidence is so incredibly overwhelming that you just make yourself look aggressively unintelligent arguing against it. There would probably still be people that doubt heliocentrism if the church hadn't publicly (and posthumously) apologised to Galileo.

People that believe in the entirely of for example the bible or the quran are just eventually going to be left behind in science, maths, biology and so many other important fields of study. They're almost modern day luddites.

Just to clarify this isn't for the nominal or moderate religious folks who can accept things like evolution and rainbows not being gifts from God. Just for those who are die hard enough to ignore scientific advances that contradict their scripture.


Thanks for reading, please try to CMV",Winston-Fucking-Wolf,653,0.75,769,1701341248,2023-11-30 04:47:28,changemyview,https://www.reddit.com/r/changemyview/comments/187frmy/cmv_you_have_to_have_a_certain_level_of_stupidity/,11,2023
181mvuv,CMV:Social media is harming young men's view on women immensely and maybe the other way round is true as well.,"As a male I think the more time I spend on the internet and espically on short form content like youtube shorts or tiktok on top of social media like twitter the more I get shown specifically selected young women that show 0 empathy or understand of consequences for their actions while simultaneously thinking they are near perfect and expect a man to be the top 0.1% to be good enough for her. and I really think the way these algorithms work means you get shown this and show men talking about it with the idea ""women these days are like this""

I think its just awful and I don't know what is being shown to anybody the algorithms mark as women but can't imagine its any better. 

I know this stuff isn't accurate. I know meeting people irl will show you so many women who are awesome people and i could make a long list of women who are caring empathetic people. 

but my worry is even if I know the internet is showing me the worst to keep my attention is I don't think enough people do. I think lots of people are seeing this stuff and giving up on the idea of dating and start to believe it. believe you need to become this 6"" all muscle man who is a millionaire in his 20's or women will all turn you down. believe that if you marry a woman she is just waiting till somebody better comes along so she can leave you and take half your stuff. 

studies show men benifit more from marriage but the internet makes it all look like its better for women and a man is just taking a risk at her destorying his life and taking everything 

[https://www.psychologytoday.com/gb/blog/fear-intimacy/202210/men-sometimes-avoid-marriage-it-benefits-them-more-women#:\~:text=Married%20men%20are%20better%20off,the%20highest%20rates%20of%20suicide](https://www.psychologytoday.com/gb/blog/fear-intimacy/202210/men-sometimes-avoid-marriage-it-benefits-them-more-women#:~:text=Married%20men%20are%20better%20off,the%20highest%20rates%20of%20suicide). because I mentions studies I will say the References under this article are the ones i'm talking about when I said that. ",Randombelief,653,0.8500000238418579,352,1700695246,2023-11-22 17:20:46,changemyview,https://www.reddit.com/r/changemyview/comments/181mvuv/cmvsocial_media_is_harming_young_mens_view_on/,11,2023
182fd42,CMV: Nobody has the inherent right to any territory,"Nobody has the inherent right to any piece of land

I often hear the idea that certain groups of people have the inherent right to any group of land because ""they were there first"", and I hear this regarding many groups like native Americans, the Jewish state, or others.

But the reality is that nobody has any inherent right to a piece of land. Maps are drawn through war, and territory belongs to whichever group can conquer it. Some people may be forgetting that because the borders of western nations haven't been redrawn for a while.

Just as the Comanche conquered land in America's southern territory and took it from the Apache, the American government conducted a series of wars against the native Americans and took land from them.

Japan used to be numerous states but a man by the name of Oda Nobunaga led a series of conquests in order to unite Japan into a single nation. He died, but his goal was fulfilled by some other individuals.

We see the same thing happening right now in Ukraine. If Russia can take it then it's their territory. But Ukraine seems to be quite capable in defending themselves, so they get to keep ownership of the territory. And the same thing is happening in Gaza right now. If Hamas can defend the territory then they can keep it, but otherwise they might lose it.

This might sound insensitive but this is just the way the world works and is how it has always worked. Your right to a piece of property is upheld by the laws of your country. The laws are upheld by the government, and the Sovereignty of the government is upheld by the military establishment. Even countries without militaries are defended by (other) militaries.

Maps are drawn by war (unless they can be settled diplomatically). It doesn't matter if you were there first.",BrokenWalkmanBelt,609,0.75,809,1700786516,2023-11-23 18:41:56,changemyview,https://www.reddit.com/r/changemyview/comments/182fd42/cmv_nobody_has_the_inherent_right_to_any_territory/,11,2023
183xayy,"cmv: When people say 'white', they mean 'white North American'.","Disclaimer: This doesn't really affect North American people. This post is centered around a Eurpean perspective, and so it might be confusing to some of you. 


I live in Germany as an immigrant, and I have friends from all across the world. I am European. 

Across the bank, the majority of friends I have met that were from outside of Europe had a very specific set of prejudices against me, that never really bothered me too much and just calmly explained this was not a thing in my country. 

I have noticed, however, that some things always repeated although being absolutely absurd. Here are some examples of the things I have been told/ were expected of me. 

1) Not seasoning food

- I am Italian. We have very simple cuisine but it's good. The same friends who tell me this about ""white people"" love my cooking and ask for my recipes/ to make their favourite dish again. 

2) Not having an own culture

- A friend of mine said something along the lines of ""White people appropriate other cultures and festivities because they don't really have their own"". I believe we were talking about Dia de los Muertos in that regard. But all European countries have their own very different cultures. 

In general, I don't think ""black culture"" and ""white culture"" apply to Europe the same way they do to the US. While there may be an african american culture across the U.S., my Ethiopian friend and my Tanzanian friend have just as little in common as a Russian and a Spanish person. They don't share one culture, they each have their own, which may overlap in some parts of life. 

3) My culture was never oppressed

I come from a part of Italy that used to have it's own language and traditions. When Italy was formed in the 19th century, people were forced to stop having their own customs and speaking their own language, or call themselves anything other than Italians. 

My grandparents still spoke the language, but I was never allowed to. I was expected to behave like an Italian so that I would have better chances in life and people would not know my background, which was considered lesser. 

I am not an exception. There are many ethnic groups in Europe that are considered white and still suffered oppression and sometimes persecution. I hate to see these stories devalued by someone saying a blanket statement.

4) This is silly, but the sandal

""White people will never understand how scary it is when your mother picks up the sandal"". But we do have the sandal in Italy. And when I pointed this out, I was told that that was cultural appropriation. 

5) Beige

""White people love to have their walls painted beige and all interior decor has to be beige.""

This was just yesterday. I talked about how houses in my region are not like that at all. And then I thought about it and described how Swedish houses are not like that. Nor are russian houses. Or French ones. Or Spanish ones. Or German ones, at that. Even my German friend, who initially agreed (in shame) that all white houses were just beige, did so while sitting in her perfectly colourful apartment with no beige in sight. I asked her if she had ever seen such a beige home in real life. She has not. Neither had anyone else, when we thought about it. 

To be honest, I don't even think most American white people live like that. I think it's just a social media fad. 



And that brings me to the reason why I am here:

As much as I am not upset at people when they make assumptions, it can be tiring when you hear the same things over and over again. I am upset that European people have to be culturally associated with North America just because we look similar, even though culturally we are so far apart. Social media paints a picture where every white person is from a Florida suburb, and people choose to believe it. 

Please tell me I am wrong about this, a I would hate to be right.",7kingsofrome,593,0.75,451,1700956793,2023-11-25 17:59:53,changemyview,https://www.reddit.com/r/changemyview/comments/183xayy/cmv_when_people_say_white_they_mean_white_north/,11,2023
184ii29,CMV: There should be treatment options offered to pedophiles who haven't victimized anyone to prevent them from doing so.,"And there should be more public awareness of the epidemic of child sex abuse.

There should be intensive treatment programs offered to pedophiles to prevent them from offending in the first place.

It should even include offering chemical or physical castration. Of course these can't be forced they'd have to be voluntary.

People should also be made aware that the most prolific child molesters are actually underage adolescent boys.

More than 99% of offenders are known to their victim

The vast majority of this is incestuous abuse occuring within the home

Or the abusers live within the home but are not related.

Others occur outside the home by extended family, family friends, acquaintances, people in teaching or mentoring roles, neighbors

Stranger assaults are statistically extremely rare

The vast majority of victims never report the crimes to law enforcement",throwlostaway,578,0.8899999856948853,416,1701026803,2023-11-26 13:26:43,changemyview,https://www.reddit.com/r/changemyview/comments/184ii29/cmv_there_should_be_treatment_options_offered_to/,11,2023
17ugk46,CMV: The majority of people who think the economy is doing poorly dont understand inflation and the process of getting it under control and instead think they would be better off in a recession,"A large percentage of people currently believe that Biden is doing terrible on the economy, largely due to inflation and difficulty affording things. I think that is entirely because they do not have an understanding of what inflation actually is and dont realize that this is, in fact, the ideal scenario. 

When Biden was inaugurated, inflation was at 7.7% and is currently down to 3.7%. While still elevated, this is a remarkable improvement and the fact that we are slowly approaching the ideal rate of 2% without entering a recession and having people continued to be employed is remarkable. I think, what people dont understand, is that inflation is cumulative and the numbers will never go back down without major things happening and I would like to use the example of food to illustrate this. There are two things that will cause the price of food to largely return to where it was, either a technological breakthrough that doubles yields (not happening) or, the more likely scenario, a drastic decrease in demand because people are out of work and are no longer able to afford anything because the economy is in a recession. I think this later scenario is what many are naively arguing for! 

In addition, I dont think they really understood the 3 paths that we were facing at that time. The first path was runaway inflation, second path was slowly decreasing the inflation rate to 2%, and the third path was entering into a recession. I think we are currently on this middle path and seem to be doing it really well, but if you look at posts all over reddit, people will say, ""the economy isnt doing great, I can barely afford my rent and groceries when I used to be able to"". I am not saying that isnt true, but they dont realize that that is the goal. Would they rather we have entered into runaway inflation? Would they rather have lost their job and not be able to afford rent at all but at least the rent in their area hasnt increased? ",lidlpainauchocolat,555,0.6600000262260437,1062,1699898521,2023-11-13 12:02:01,changemyview,https://www.reddit.com/r/changemyview/comments/17ugk46/cmv_the_majority_of_people_who_think_the_economy/,11,2023
17m51d2,CMV: Parents should be required to be present in the room and watch the whole procedure while their child is being circumcised.,"At least in North America,  parents usually stay out of the procedure room while their child is being circumcised. I believe if parents would have to stomach watching their child getting mutilated fewer people would want to do it and it would fall out of favor.

Aside from clinically indicated cases, circumcision is a barbaric and unnecessary practice based on distorted perceptions stemmed from religion or social norms.

The prepuce (foreskin) is a normal part of the body that protects the very sensitive glans of the penis. Unless there is a clinical indication for amputating a normal part of the body, it is mutilation. 

Circumcision is also a violation of four basic human rights:
- the convention against torture 
- the convention of the rights of the child
- the universal declaration of human rights
- and the international covenant on civil and political rights.",zerokids2023,525,0.6899999976158142,885,1698936133,2023-11-02 09:42:13,changemyview,https://www.reddit.com/r/changemyview/comments/17m51d2/cmv_parents_should_be_required_to_be_present_in/,11,2023
17qlhq0,"CMV: Even without the benefit of hindsight, NFTs were always a bad idea and the people who invested in them were always using poor decisionmaking","CMV: Even in retrospect, NFTs were always a bad idea and the people who invested in them were always using poor decisionmaking 


I am looking for an ironman argument to oppose this. I want to see why someone might have thought it was a good idea

* [NFT market has collapsed](https://www.bloomberg.com/news/articles/2022-06-29/nfts-have-fallen-off-the-cliff-as-sales-sink-to-lowest-in-year?sref=oioIU9CW)

* NFTs were always a bad idea. The actual technology behind them has uses but the idea of digitally owning a JPEG is just silly

* There was never any interesting backers or supporters behind NFTs. Is there was a legitimate and known artist who released works on NFT that might have been a reason to buy them, but the vast majority of the NFT ""art"" was just ugly mass produced AI stuff

* There was never any intrinsic value to them and never any reason to believe the price would rise. Very dissimilar to someone buying a share of a company

* NFT never had real mainstream appeal and was always relegated to nerdy/techbro internet subculture",DrCornSyrup,502,0.9200000166893005,374,1699449626,2023-11-08 07:20:26,changemyview,https://www.reddit.com/r/changemyview/comments/17qlhq0/cmv_even_without_the_benefit_of_hindsight_nfts/,11,2023
