post_id,title,text,author,score,upvote_ratio,num_comments,created_utc,created_datetime,subreddit,permalink,month,year
1gepnua,CMV: There is very little evidence that ethnic diversity is actually economically beneficial for a company,"First a disclaimer, I am not against ethnic diversity. I am neutral/slightly positive towards the diversity campaigns for ethical reasons. However, company trainings provide you with information like ""most diverse companies are 40% more likely to outperform compared to least diverse ones"" and I just don't feel that these claims of massive economic benefits actually hold water.

Vast majority of these claims seem to stem from the famous McKinsey diversity reports. However, these reports  are documented to have [issues with reverse causality and they have proven to be very difficult to replicate](https://econjwatch.org/File+download/1296/GreenHandMar2024.pdf?mimetype=pdf).

Scrolling Scopus or Google Scholar actually reveals a lot of fairly recent articles, in more reputable journals than the one linked above, which do not find any correlation whatsoever apart from rather localized areas or find a negative one (examples: [1](https://www.sciencedirect.com/science/article/pii/S0014292113001670?casa_token=9_YjMecwRV0AAAAA:hBP-bZf8z1T8v4DR_3UOy4Yh9oJuMNfjYovgaWPXHzjEgb09g1Zu0zledGJYYQraWlBpRA0YB1E), [2](https://direct.mit.edu/rest/article-abstract/103/3/521/97644/Ethnic-Diversity-and-Growth-Revisiting-the)).

This is simply not how a consensus in a field looks like. I am a layman, so I am not going to go as far as taking my stance on which side is right. But the evidence about positive economic impact of ethnic diversity seems quite doubtful and highly contested to say the least.

Hence, I find it quite insulting to be fed this on company trainings. Why don't they rather tell me that they want diversity, because they believe it is right? Trying to sell it on a tentative indication that it is good for business looks bad.

Change my view!

edit: to change my view, I would like to see some solid piece of evidence which confirms these major benefits or a nice explanation why it must be true, ideally with some example (but not just 'more viewpoints are always better', because I find that very abstract and not necessarily valid).",Downtown-Act-590,462,0.7099999785423279,241,1730190280,2024-10-29 03:24:40,changemyview,https://www.reddit.com/r/changemyview/comments/1gepnua/cmv_there_is_very_little_evidence_that_ethnic/,10,2024
1fxe6gx,CMV: any industry that involves the care of human beings should not be for profit,"The goal of a for-profit company or industry is just that: to turn a profit. Whether it’s a publicly traded company or a private business, if your goal is to make money, then providing quality care is always secondary. 

The applies to healthcare, childcare, long-term care, and basically any other industry that involves caring for fellow humans.  

If you look at these industries, the cost are rising well the pay for those actually giving the care remains low. For example, in 2024, the cost of a semi private room in a nursing home is $95,000 a year. 

It’s only going to get worse until we actually agree as a society that the care of human beings should not ever be a for-profit business.",0nlyhalfjewish,448,0.8299999833106995,240,1728213324,2024-10-06 06:15:24,changemyview,https://www.reddit.com/r/changemyview/comments/1fxe6gx/cmv_any_industry_that_involves_the_care_of_human/,10,2024
1g9zjx6,CMV: Women who require men to pay/support them when dating are inherently going against feminism and equality movement and is extremely harmful to dating culture,"As the title states, I believe women that require the men to pay for them if they want to be in a relationship are inherently against the equal rights movement for women. I want to first clarify what I mean by ""paying for them"". A large notion of dating culture is that men are supposed to pay for dates, rents, bills, and financially support the women in order to be seen as a romantic partner and a real man. This belief directly goes against the idea of equal rights between genders as it infantilizes women. It also feeds into the stigma held by men against all forms of feminism that women only want equal rights when it benefits them as they want to have all the positive aspects of an equal relationship while also having the upside of having your entire life financed by your partner. I also believe that it is hypocritical to believe that you are in an equal relationship if you are being completely supported by your male partner. This belief also severely impacts dating for any men who are not in a financial state to be fully paying for another person. For example any low income groups, college students. It basically makes it seem like you have to be rich enough to ""buy"" a date and a relationship. I have heard the counter argument that feminism is about being able to choose to be in this type of relationship. Before I address this I want to be clear, if you want to be in a trad relationship, go for it, however you both people have to take the traditional roles. However, choosing to be financially supported while being in an equal rights relationship and while having your own career is essentially infantilizing yourself in the relationship. You are basically stating you want a ""father"" not a partner. This is the same version as men who make their partner do all the housework while the wife also has a career. In summary, I believe that women who want to be in a modern and equal relationship while having the men to support you financially are hypocrites. An equal relationship is one that splits finances, housework, and all other aspects of the relationship according to what makes sense to that relationship. This unequal relationship causes a lot of negative effects to overall dating culture",lordamir008,392,0.6800000071525574,669,1729649376,2024-10-22 21:09:36,changemyview,https://www.reddit.com/r/changemyview/comments/1g9zjx6/cmv_women_who_require_men_to_paysupport_them_when/,10,2024
1g617o2,CMV: You shouldn't be able to sue someone for poisoning food to bait a lunch thief,"If food is in a container with your name on it, you should be allowed to put almost anything in there, as long as it doesn't hurt people peripherally (no explosives, for example). I don't understand why you can get sued for putting in laxatives or you have to show you can eat that level of spice yourself. If they don't have any business eating it, and they don't eat it, they won't get hurt. And don't tell me kids might accidentally eat it, most offices ban kids, and you can change the rule if kids truly run amok in your specific case, it shouldn't change the general rule. Is there anything I'm missing? Why is this even like this? Is it just some shitty legal precedent and our current zeitgeist of not wanting to call out bad behaviour?",apoplexiglass,380,0.6800000071525574,1487,1729198580,2024-10-17 15:56:20,changemyview,https://www.reddit.com/r/changemyview/comments/1g617o2/cmv_you_shouldnt_be_able_to_sue_someone_for/,10,2024
1ga8yqr,CMV: MLKs true message has been distorted in American history ,"Martin Luther king jrs true message and struggles have been flanderized into the equivalent of love thy neighbor, nonviolence, and I have a dream. These elements only describe a small part of who he was as a man and why his message still rings true today. 

Although people love to lampoon our modern activists as not being as good as MLK and being disruptive and engaging in criminal activity, this was the bulk of the civil rights movement and particularly MLKs strategy. He was a jailbird who was arrested numerous times and encouraged others to be jailed as well.

He didn’t just wish for the benefit of blacks and whites but for the allyship and solidarity of working class people of all colors as he recognized that we would never be free without being economically free, something that has still not come to pass and perhaps gotten even worse.

Recently protestors on college campuses were criticized for having outside agitators but MLK already spoke against this in the letter to Birmingham. 

“Injustice anywhere is a threat to justice everywhere. We are caught in an inescapable network of mutuality, tied in a single garment of destiny. Whatever affects one directly, affects all indirectly. Never again can we afford to live with the narrow, provincial ""outside agitator"" idea. Anyone who lives inside the United States can never be considered an outsider anywhere within its bounds.”

BLM protestors were criticized for being disruptive and rowdy, saying MLK only protested peacefully, but his protests were considered negatively as well. 

“You may well ask: ""Why direct action? Why sit ins, marches and so forth? Isn't negotiation a better path?"" You are quite right in calling for negotiation. Indeed, this is the very purpose of direct action. Nonviolent direct action seeks to create such a crisis and foster such a tension that a community which has constantly refused to negotiate is forced to confront the issue.”

Malcolm X was criticized for speaking negatively on white liberals but MLK spoke on this as well in the same letter just replacing liberal with moderate.

“I have almost reached the regrettable conclusion that the Negro’s great stumbling block in his stride toward freedom is not the White Citizen’s Counciler or the Ku Klux Klanner, but the white moderate, who is more devoted to “order” than to justice; who prefers a negative peace which is the absence of tension to a positive peace which is the presence of justice”

He was a complex man and detractors against him want to say his message shouldn’t be accepted as he cheated on his wife with white women. These same people refuse to admit that this information was given to us by the corrupt FBI who followed and threatened him for years, tracking his every move and almost every word as if he was a terrorist. They even sent him letters pretending to be black people asking him to kill himself.

He was a believer in shutting down convenience even if he had to shut down a highway. He was an agitator and scholar and not just the I have a dream guy and now every street that bears his name is in the worst part of whichever city it’s in as the governments  honor to him.
",Expert-Diver7144,354,0.8399999737739563,169,1729685398,2024-10-23 07:09:58,changemyview,https://www.reddit.com/r/changemyview/comments/1ga8yqr/cmv_mlks_true_message_has_been_distorted_in/,10,2024
1fzqvtw,CMV: sad beige mums are bad mothers.,"For those who don’t know these are mums that get rid of all colour in their children’s bedrooms/toys, like their own homes.

They basically have only whites, creams, browns and beiges, that includes the children’s toys, clothing, and other things.

The reason why this is bad is because children and infants need colour for cognitive development, contrast is essential for them because their eye sight isn’t fully developed yet and need colour and contrast.

Also getting rid of a child’s colour for your aesthetic is oddly cruel.",Lapis-lad,332,0.7400000095367432,198,1728478990,2024-10-09 08:03:10,changemyview,https://www.reddit.com/r/changemyview/comments/1fzqvtw/cmv_sad_beige_mums_are_bad_mothers/,10,2024
1g4khwz,CMV: The Israeli government and army are truly behaving like monsters right now,"Sources from the BBC state that there have been 3 hospitals bombed in the last couple of months, as well as schools being targeted in Gaza. A house has been struck with mainly women and children killed. 

There has even been (yet unverified) reports of a man being burnt alive due to a fire caused by secondary explosions and no evidence of any close by Hamas base. Even doctors without borders has verified this.

In Lebanon, buildings with babies and children are being destroyed and countless innocent lives are lost.

In the guardian, there have been reported of a 'very relaxed' approach to specific targeting - in order to bomb an area with a suspected low level Hamas operative, an exceptionally high level of 'collateral damage' is permitted. This is far different to Israel's previous strategies.

There have been, of course, many terrorists who have been killed. However, I do not believe this justifies the enormous amount of civilian casualties. If anything, this will achieve the opposite of their goals - any Gazan or Lebanese, after seeing their loved ones killed, will be radicalised against Israel even more.

Even the US, Israel's biggest ally, has been alarmed by the amount of aid being restricted in Israel and has even threatened to suspend some arms sales. The situation looks really bad, and it is becoming increasingly harder to be able to even attempt to justify Israels options.

Rather than being a moral army, or even no worse than others, at this moment in history they are far worse than other armies in the extent and ruthlessness of damage to civilians.",Acceptable-Guide2299,329,0.5899999737739563,1272,1729031914,2024-10-15 17:38:34,changemyview,https://www.reddit.com/r/changemyview/comments/1g4khwz/cmv_the_israeli_government_and_army_are_truly/,10,2024
1gangu3,CMV: The modern U.S. Republican party is a fascist party,"The word ""fascism"" gets thrown around as a slur nowadays, but it was a mainstream, popular movement for a good chunk of the last century. 

* Donald Trump's former chief of staff (Mark Kelly), along with the highest-ranked military officer who served under Trump (Mark Milley), have both said on-record that the leader of the Republican party [is a fascist](https://abcnews.go.com/Politics/john-kelly-swinging-trump/story?id=115061457).
* A leading historian of fascism, [Robert Paxton](https://www.nytimes.com/2024/10/23/magazine/robert-paxton-facism.html) (paywall, sorry), recently adopted this view and said it goes beyond the party's leader: ""It's bubbling up from below in very worrisome ways, and that's very much like the original fascisms. It's the real thing. It really is.""
* Umberto Eco, who lived in fascist Spain, defined ""[Ur-Fascism](https://en.wikipedia.org/wiki/Ur-Fascism)"" in a 1995 essay as a collection of attributes that pretty much match the modern Republican party. 

I don't personally know anyone who *self-identifies* as ""fascist"" in real life. But they are not hard to find on the internet. If you go to the largest neo-nazi site on the internet, which I won't link to for obvious reasons, you will see news stories that mostly resemble mainstream Republican talking points about how immigrants and Democrats are ruining America. While some self-identified fascists are sitting out the election, most seem to be voting Republican (and as far as I can tell exactly zero are voting for Democrats). 

One big difference seems to be that the Republican party isn't antisemitic while most self-identified fascists are. But I don't think the specific identity of the fascists' scapegoat group is vital to the definition.  ",APurplePerson,326,0.550000011920929,676,1729723009,2024-10-23 17:36:49,changemyview,https://www.reddit.com/r/changemyview/comments/1gangu3/cmv_the_modern_us_republican_party_is_a_fascist/,10,2024
1fwyycs,"CMV: Trump and MAGA Didn't Drain the Swamp, they Became the Swamp","In 2016, the rally cry of MAGA was ""DRAIN THE SWAMP."" It was unapologetically anti-establishment and supported by frustrated people from all types of political slants. Whatever your thoughts about it overall, under that banner he won office.

Fast forward to 2020 and 2024, and the ""DRAIN THE SWAMP"" banner has been taken down (and probably burned out back) in favor of quotes from Trump like:

>“I’m for electric cars, I have to be because Elon endorsed me very strongly” at a rally in Atlanta, GA.

>""You’ve been waiting on a permit for five years; you’ll get it on Day 1"" Trump was quoted when speaking to oil execs in exchange for hefty donations.

These are just a few, flagrant ""quid pro quo"" style corruption scenarios which Trump seems **proud of**. Trump's pledges to take a ""hands on"" approach to interfering with interest rates sound like an antithesis of the 2016 MAGA mission statement. Trump's pledges to impose tariffs on all imports sound like an antithesis of the original 2016 MAGA mission statement. Trump's intention to bring Elon Musk, a silicon valley billionaire and enormous lobbying and dark money proponent, into his administration sound like an antithesis of the original 2016 MAGA movement.

My view is that the original MAGA movement died nearly as it began. It got Trump elected, and proved to be ""too hard"" to actually pursue beyond that. Trump and Co. realized it would be much easier to move into the swamp than try and drain it. Instead of taking down Wall Street ponzi brokers, he himself now sells ""crypto-coins"" that are worthless to working people. He's so out of touch with his base, he is trying to sell them watches for $100K a piece.",FinTecGeek,318,0.699999988079071,304,1728158441,2024-10-05 15:00:41,changemyview,https://www.reddit.com/r/changemyview/comments/1fwyycs/cmv_trump_and_maga_didnt_drain_the_swamp_they/,10,2024
1gewuha,CMV: Dating preferences shouldn’t be considered wrong for people to have ,"This is mostly a social media thing but social media makes it’s way into real life. I’ve noticed over the years people have been against certain preferences, and to me I don’t see a problem with having preferences in your dating life. As long as you aren’t saying people who aren’t your preference are objectively less than, and we can admit that everyone has their own taste. I’ve seen people say if you wouldn’t date someone at all it’s a requirement not a preference, and to that I do agree but preference is kind of a euphemism many times in this case

But if someone only dates white people, let them who cares. It doesn’t affect anyone else, as long as they don’t shit on other races. If someone doesn’t wanna date fat people, then so what? As long as they aren’t insulting people who cares? If someone doesn’t wanna date a person with a high body count or who is a SW, as long as they don’t talk down on those people. I may only like chocolate icecream and never eat vanilla, but that doesn’t mean I’m going around hating vanilla it means I wouldn’t eat it myself.

Also I see a lot of people have an issue with this because they view it as a prejudice, and in a way dating is inherently predjudice but people feel like it shouldn’t be towards things someone can’t change. But this obviously isn’t the case. Plenty of people say they want a “smart” partner, but people can’t change their IQ. If you want a partner with similar interests to you is that fair if someone can’t control what’s interesting to them or not? Dating is inherently judging someone to see if they meet your standards of dating and there’s nothing wrong with that as long as your judgements don’t go past would I personally want to be in a intimate relationship with this person.",Accomplished-Fix1204,314,0.6899999976158142,761,1730214400,2024-10-29 10:06:40,changemyview,https://www.reddit.com/r/changemyview/comments/1gewuha/cmv_dating_preferences_shouldnt_be_considered/,10,2024
1g8t1tx,"CMV: Post J6, there are no Trump supporters who are both morally good supporters of American democracy *and* well-educated on the issues.","Bending over backwards to give people the benefit of the doubt, I could see this being possible right up until January 6, 2021. Post J6, there are only two camps for Trump supporters:

1. You are uneducated/gaslit/brainwashed by propaganda and are ignorant to the threat he poses to the country and the harm he has done and continues to do. Basically morally good but an idiot. A useful idiot who has lost the plot on where reality ends and the MAGA conspiracy universe begins.
2. You are aware of and educated on the threat he poses and the damage he does, but either don't care or actively support the hate/racism/authoritarianism. Essentially a smart and well-informed person who is morally bankrupt or opposes American democracy.",theod4re,304,0.6800000071525574,922,1729526012,2024-10-21 10:53:32,changemyview,https://www.reddit.com/r/changemyview/comments/1g8t1tx/cmv_post_j6_there_are_no_trump_supporters_who_are/,10,2024
1fuof4o,"CMV: Piracy isn't immoral, Nor is the damage from it as big as people make it out to be.","- ""If buying isn't owning, then piracy isn't stealing.""

We've all heard this phrase countless times, and that's what i wanna dive into here. Companies have been and continue to get greedier by the second, and they've started to completely disregard people's conditions when it comes to acquiring a product. Streaming services deliberately serve you ads on their lower tier subscriptions in order to get you to upgrade (giving ads to paying customers is ridiculous), certain game stores have shit regional pricing or don't have it at all, game companies continue to include DRM software that damages the experience of the paying customers (cough cough, denuvo) and completely fucks up the experience of paying customers. Let's not even get into Nintendo and their abuse of the copyright system, i'll leave it for another post.

Not only is piracy these days not immoral, its actually the only way some people can acquire something they want to consume because they don't have a choice. So one could argue it ends up reaching people that would've otherwise just not consumed the product: You're not getting someone who can't buy a product to buy a product. But through pirating it they may become a potential customer. But lets digress a little.

So you, yeah, the person reading the post. Lets say you wanted to buy a game. Perhaps you'd use an online game store like epic games or steam, right? Now you own the game, and you can play it. Simple and convenient right? Except you don't own the game. If you, for any reason, get banned from the platform or lose access to your account you'll end up with either one of two things: an excruciating headache from trying to get it back or no games at all. Oh, you say you're a paying customer and you acquired everything legally? Sucks to be you! (You're also subject to the service's longevity, ToS changes, bugs, online authentication, bullshit DRM integration... I mean at least take me out to dinner before you f-- me like that-)

...Nah, for real though. The difference between getting games these days and lets say, 20 years ago, is that you actually owned the game physically. Unless you were using your CDs to cut bananas or something, you just need the game console and the CD. Nowadays you basically need to have everything online and completely depend on the company and be subject to their online authentication for various games before you can actually play them. Again, making the life of paying customers harder for no reason. 

If these companies are extremely rich and they keep buying out or getting rid of competition (cough cough nintendo), keep flipping the bird to the customers and push us to do exactly what they want once they've monopolized the market, how is piracy immoral? Doing anything about injustices legally will get you slapped around by big time lawyers and legal fees, so it is quite literally the only way that we have to rebel against these companies and make them change the way they behave. Your support ticket #2131321 is not changing shit, but speaking with your wallet surely will, especially if more people do it. Piracy isn't immoral, and it is purely a service issue. Its born out of the greed of streaming services and game companies. I guarantee it'd drop by an astounding 99% if they were to just fix the fucking way they operate, but they refuse to. So i say, sail the high seas and find that One Piece! Okay i need to stop... but anyways, change my view if there's something im missing here.

CMV!",DylanLousa,296,0.699999988079071,651,1727896397,2024-10-02 14:13:17,changemyview,https://www.reddit.com/r/changemyview/comments/1fuof4o/cmv_piracy_isnt_immoral_nor_is_the_damage_from_it/,10,2024
1g8pqfg,CMV: Doing your own oil change is not worth it,"After doing my own oil change, I have realized it is just not worth it.

I have to get $30 in supplies and save $100 that would have gone to the shop. My net savings is $70. However I have to:

-Go to a auto parts store to buy the oil/filter

-Go home, jack up the car, get underneath the car, risk getting old oil all over your body/clothes/and floor

-Drain the oil from the drain pan into a disposable jug

-Take a shower, clean up because its near impossible to not get anything on you.

-Drive back to the auto parts store to dispose of the jug

  
For $70 or so in savings, its just not worth it.",garmium,292,0.7300000190734863,474,1729517429,2024-10-21 08:30:29,changemyview,https://www.reddit.com/r/changemyview/comments/1g8pqfg/cmv_doing_your_own_oil_change_is_not_worth_it/,10,2024
1fzgdl4,CMV: Gerrymandering and the electoral college should be abolished or at least reduced beyond their current capacity ,"Basically title, I’m trying to understand why Gerrymandering is still around and if there is any relevance to it in current politics. 

If it wasn’t for the electoral college there wouldn’t have been a Republican US president at all in the 21st century. In fact the last Republican president to win the popular vote was in 1988 (Bush). 

Gerrymandering at the state level is also a huge issue and needs to be looked at but the people that can change it won’t because otherwise they would lose their power. ",HundrEX,290,0.7400000095367432,444,1728437999,2024-10-08 20:39:59,changemyview,https://www.reddit.com/r/changemyview/comments/1fzgdl4/cmv_gerrymandering_and_the_electoral_college/,10,2024
