post_id,title,text,author,score,upvote_ratio,num_comments,created_utc,created_datetime,subreddit,permalink,month,year
1goeneu,"CMV: Americans don’t realize how fortunate they are compared to most of the world.

","Hello guys! 



So, I’m a European, and I wanted to share an outsider's perspective on what I think of American life. I often hear Americans talk about their struggles, the “rat race” culture, healthcare costs, or the pressure to succeed. I get it—no place is perfect. But I sometimes wonder if people in the U.S. realize how much they actually have going for them, especially compared to most of the world.



From where I sit, the U.S. has so many advantages that are easy to take for granted. For instance:



\*\*Higher Salaries and Access to Resources:\*\* When I see what many Americans make, even in entry-level jobs, it’s much higher than in a lot of European countries. It’s not unusual to find people earning really solid money in certain U.S. industries where those jobs just don’t pay as well here. And while the cost of living varies, the potential for income growth in the U.S. is immense.



\*\*Economic Dominance and Influence:\*\* The U.S. has an economy that’s massive on a global scale. American companies, innovations, and cultural exports dominate worldwide. That opens doors for people who might have an idea, product, or dream that could make it big. It’s a different playing field compared to what we have, where things are more stable but often slower and harder to scale.



\*\*Endless Opportunities:\*\* The “American Dream” may be a cliché, but I think there’s some truth in it. The diversity of landscapes, industries, and educational opportunities is unmatched. People from all around the world move to the U.S. specifically to chase opportunities. From Silicon Valley to Hollywood to Wall Street, there are specialized career paths that just don’t exist in other countries.



\*\*Power in Numbers and Influence:\*\* As a European, I see the influence of American culture, politics, and media constantly, even here. The U.S. has a massive cultural and political footprint, which can be frustrating at times, but there’s also power in it. Americans get to help set global trends and policies, and that gives people in the U.S. a voice and level of influence that few other countries have.



\*\*Innovation and Infrastructure:\*\* There’s a strong innovation culture in the U.S., with people who are ready to embrace change. Technology, entertainment, and business innovations often start there before going global. America has some impressive infrastructure, too, even if it doesn’t always seem that way to people living there. For example, you have massive universities with resources on a scale you rarely see anywhere else.



\*\*Social and Cultural Diversity:\*\* The U.S. is so vast and diverse, culturally and socially. I feel like people in the U.S. have endless opportunities to explore different lifestyles, perspectives, and hobbies that bring vibrancy to everyday life. You can meet people from almost every background and culture—something that is harder to find in many smaller, more homogenous countries.



\*\*Higher Education System and Research Opportunities:\*\* While the cost of college in the U.S. is famously high, the country still has some of the best universities and research facilities in the world. Graduating from an American university can open doors globally, and there's a level of innovation and funding in research that’s tough to match elsewhere. Many cutting-edge fields and technologies are pioneered there, making it a fantastic environment for academics and researchers.



\*\*Access to Vast Natural Beauty and Outdoor Activities:\*\* The diversity of landscapes in the U.S. is incredible. There’s everything from national parks and ski resorts to beaches and desert landscapes. Americans have access to some of the most spectacular natural beauty in the world, with the infrastructure and freedom to explore it relatively easily—often just a road trip away. That’s something many countries don’t offer in the same abundance or scale.



\*\*Job Mobility and Flexibility:\*\* In the U.S., it’s relatively common for people to switch jobs or move to different states in search of better opportunities. In many European countries, job markets are more stable but can also be restrictive. In America, people have a high degree of freedom to pursue different paths, start new careers, or move around, which can be both liberating and rewarding.



\*\*Advancements in Medicine and Cutting-Edge Healthcare:\*\* Despite the challenges with affordability, the U.S. is often at the forefront of medical advancements, from high-end surgeries to pioneering treatments for rare conditions. American hospitals and research institutions lead in many fields, and the country offers access to some of the world’s most advanced healthcare technology.



\*\*Consumer Variety and Convenience:\*\* Americans have access to an incredible range of products, often at lower prices compared to much of the world. The convenience culture, where many services are available 24/7, is also unique. Fast food, extensive shopping options, and rapid delivery services add convenience that isn’t as common or accessible elsewhere.



\*\*Support for Innovation and Startups:\*\* The “startup culture” is so deeply rooted in the U.S., and there’s infrastructure to back it up—incubators, venture capital funding, and an investor mindset that encourages people to try new things. People with entrepreneurial ambitions have a lot of resources, networks, and access to capital to help bring their ideas to life, something that’s often harder to come by in more traditional economies.



\*\*Strong Legal System and Individual Rights:\*\* Americans enjoy a high degree of personal freedom and strong protections for individual rights under the Constitution. Freedom of speech, the right to privacy, and legal protections for workers are more robust in the U.S. than in many countries. This legal infrastructure can create a sense of security and autonomy that’s valued by many.



\*\*TL;DR:\*\* Even with its issues, the U.S. has a lot going for it—economic opportunity, natural beauty, innovation, and freedoms that many people around the world dream of. As a European, I wonder if Americans appreciate just how fortunate they are to live in a place that offers so much.",RotenSquids,512,0.7799999713897705,304,1731282737,2024-11-10 17:52:17,changemyview,https://www.reddit.com/r/changemyview/comments/1goeneu/cmv_americans_dont_realize_how_fortunate_they_are/,11,2024
1gpm00t,CMV: People should learn English if they’re going to live in the US,"I was surprised this was a controversial opinion to be honest. And no I’m not one of those “people should speak English here people” who gets mad at people for speaking another language to the people they’re with in public. It’s a given that people will always be most comfortable speaking in their first language and language is also culture. I’m also very impressed by those who are bilingual. But I think it’s basic decency for you to learn or be actively trying to learn the predominant language in the country you are moving to. 

This comes up the most with Spanish since the US has a very large Latino/Hispanic population, but it applies to all languages. It’s honestly just a respect thing, if you’re going to come to someone else’s country then you should know the language or try your best to learn enough to make your way around. And I know people are going to say “America doesn’t have an official language” but most of the states do, do most people here would consider that our main language. 

I also think a lot of people protest this because they think American English speakers = white people and learning English is something white people want minorities who come here to do. But that’s not even the case, the majority of people who were born here only speak English. Not to mention black people who have been here 400 years speak English and this is our country as well. To me it’s about basic respect. You wouldn’t move to France and not learn French. You wouldn’t move to Mexico and not learn Spanish. You wouldn’t move to China and not learn mandarin. And if you would and you make no effort to learn the language you’re probably a douche ",Accomplished-Fix1204,506,0.699999988079071,904,1731421857,2024-11-12 08:30:57,changemyview,https://www.reddit.com/r/changemyview/comments/1gpm00t/cmv_people_should_learn_english_if_theyre_going/,11,2024
1h27kmz,CMV: Non-western governments don't get enough crap for their crimes,"Nothing can change or make up for colonization or genocide. However, being held accountable, making reparations, abd educating people goes a long way in helping. Germany, Britain, Australia, New Zealand, America, and others have been heavily criticized fir their roles in such atrocities (for good reason) and have paid reparations, educated their populaces, and made sure that their actions would be remembered.

But how about Japan? The first thing most think of when I use that word is anime ~~girls~~. They paid reparations, sure, and made some public apologies, but continue to allow imperial-sympathetic groups into their government and honor their war criminals. They flooded the Philippines with Japanese culture to make younger Filipinos more sympathetic to Japan. Or Turkey? Their (and their neighbors to the south and east) government and populace continue to deny the Late Ottoman Genocides and promote Turkish Nationalist sentiments in the government. Or China? Or the suppression of minorities in all of South and Southeast Asia?

At least here in the US, we don't learn about any atrocities outside of the Holocaust and the Trail of Tears, and its criminal.",FourTwentySevenCID,492,0.7799999713897705,214,1732833494,2024-11-28 16:38:14,changemyview,https://www.reddit.com/r/changemyview/comments/1h27kmz/cmv_nonwestern_governments_dont_get_enough_crap/,11,2024
1h15jnn,"CMV: Terms like unalive detract from the painful reality of suicide, the fact that words are now being used which specifically became mainstream due to people not wanting to get demonetised is a sad reflection of the state of humanity","The word came about from subtitles on shorts and videos, to prevent getting the video demonetised. This is dystopian, the fact that watered down language that shouldn’t exist now does, not due to language progressing, but rather regressing due to money being held above using proper terminology.

I don’t blame the creators, but I do blame anyone who uses such words.

Example: Kurt Cobain museum now uses the tiktok “unalived” the man blew his brain out and committed suicide, let’s face the dark reality as people in dark situations aren’t helped by bubbly words which detract from the real issue.",CopyGrand7281,459,0.8899999856948853,226,1732717662,2024-11-27 08:27:42,changemyview,https://www.reddit.com/r/changemyview/comments/1h15jnn/cmv_terms_like_unalive_detract_from_the_painful/,11,2024
1gz2rjr,CMV: Cocaine is an overrated drug,"It being the main driver of the drug trade and in many ways the reason for ""the war on drugs"" and a lot of crime and suffering. 

But it's not as good for clubbing as Ecstasy, not giving the clarity and experiences of mushrooms, and if you need something to keep you focused for longer at work you are better if with some ADHD medicine. 
(I am aware that everyone reacts differently to drugs, so I've asked around, and it doesn't seem to be anyones favorite)

Add on top of that that you always are at risk of overdosing, that you need to top up regularly and that it's obvious to anyone that you are high. 

The positive i can see is the price and how easy it is to obtain(in Latin America), but that is not the case in most parts of the world. 

Is everyone just caught up in the hype, or am i missing something?",Repulsive_Dog1067,437,0.8600000143051147,176,1732485548,2024-11-24 15:59:08,changemyview,https://www.reddit.com/r/changemyview/comments/1gz2rjr/cmv_cocaine_is_an_overrated_drug/,11,2024
1gyeswl,CMV: Calling something “common sense” is not a valid argument.,"You are debating someone with a different viewpoint than you. You seem to disagree on fundamental issues. You ask why they believe what they do, and they respond “it’s just common sense.” How do you argue against that?

I see this way too often, where people seem to use the term common sense to justify their bigotry. Why? Because “common sense” can be used to describe things so arbitrarily. It is used to oversimplify more nuanced topics.

This isn’t a one sided issue, so I will give two examples, and keep in mind I’m not disagreeing with the arguments themselves:

- **Common Sense Gun Laws:** When you describe the gun laws as common sense, how is it so? Is it common sense to folks that are hunters and gun enthusiasts that believe that gun ownership is their right? This seems like a case where “common sense” is being used to prevent further conversation about solutions to an issue like gun violence.

- **Economic Policy:** A lot of times, people will argue that social programs shouldn’t exist or should be limited because “It’s common sense, you get money by working hard.” But is it common sense for the people that have used social programs to get back on their feet and provide them the opportunity to make a living? Like the last example, this argument takes away the nuance.

You can see how that term can be weaponized. It is a fallacy. It is used as an argument to evade providing actual evidence, and just resort to what they perceive as the reality.
 ",Lisztchopinovsky,409,0.8899999856948853,136,1732409744,2024-11-23 18:55:44,changemyview,https://www.reddit.com/r/changemyview/comments/1gyeswl/cmv_calling_something_common_sense_is_not_a_valid/,11,2024
1gzmh2l,CMV: Lying and exaggerating trumps rhetoric (or any rhetoric for that matter) only leads to more defenders of said rhetoric. ,"What I noticed a lot during this campaign was that people would say “look at what this person said” and you look at their comments and the actual tweet or Reddit post or news article you see is an interpretation of seemingly unrelated comments. I don’t know if I’m allowed to identify a subreddit here but there’s one particular page that is notorious for this. There was a whole thing about how Trump threatened Kamala supporters but he actually said something like “raise your hand actually don’t do that because it would be bad” at one of his rally’s which in reality is not a threat. It’s unprofessional and should not be coming from a presidential candidate but they made it seem worse than it was. The same rhetoric exists around abortion. Labeling anybody anti abortion as someone who wants to control women’s bodies when their reality could be that they genuinely believe it’s murder. I think when you say these things to make someone seem more extreme than they actually are then it makes people see the actual harm they bring to society in a less harmful way. They look like they’re being attacked. I always say, if you believe in something the truth should be enough to convince people Trump said plenty of terrible things and a lot of it is posted on his website. Weaponize his real words against him. When you build your defense around lies and exaggerations like all of the abortion stuff (which white women clearly don’t care about as much as they claim) some people will just defend the person who’s being lied on. ",Scary-Ad-1345,405,0.6200000047683716,855,1732551157,2024-11-25 10:12:37,changemyview,https://www.reddit.com/r/changemyview/comments/1gzmh2l/cmv_lying_and_exaggerating_trumps_rhetoric_or_any/,11,2024
1gh8oh6,CMV: There is nothing inherently wrong with losing weight via Ozempic & similar drugs,"(this argument assumes there is no scarcity for the drug, and that me using it would not prevent others from having access to it or raise prices)

If the health issues due to obesity are greater than the side effects of ozempic then the patient should take ozempic. There has been a tremendous amount of hate for this drug from both extremes of the ""fatphobia"" spectrum. On one side you have the extreme anti-fatphobia crowd that thinks ozempic is bad because there is nothing wrong with being fat, and on the other end you have those who genuinely hate fat people thinking ozempic is wrong because you should have to lose weight the old fashioned way.

Most people sit somewhere in the middle on that spectrum. So do I. Drugs are neither good or bad. All that matters is their effects, and ozempic has shown astonishing clinical results in weight loss. Think most people would agree obesity is a big public health issue in our society (or maybe that's a CMV for another day). I don't think it's morally wrong to be fat, but I don't think it's good for you.

Personally I want to stop being fat for both health and aesthetic reasons, and I don't think that should be moralized. While it is not a huge priority in my life right now, I'd love to go on ozempic if it could help me lose weight. If I lost some weight it would be so much easier to be active and live a genuinely healthy lifestyle. And I would feel better about myself. I don't see what the big deal with ""doing it right"" is. I acknowledge that there are some side effects but those side effects pale in comparison to the hit to my quality of life caused by obesity. I have tried many many times to lose weight ""the right way"" to no avail. I have since learned to feel okay in my body, but tbh I would be a lot more comfortable if I were 100lb lighter. (26yo 6'4"" 350lb male for anyone who needs to know). As I get older my weight is going to affect my life span. If going on ozempic could add years and quality to my life why shouldn't I use it?

I know a lot of people will say ""it could have side effects we don't know about yet,"" but I don't find that convincing. *Everything* could have side-effects we don't know about yet. Being obese has side effects I *do* know about and experience right now. I view this argument the same as I view anti-vax arguments: the FDA's drug screening process is a lot more reliable than my unscientific intuition.

Edit:

On the argument ""when you stop taking it you'll gain the weight back""

I would be willing take it forever. And even if I couldn't, I just want to be healthy and active while I am young at least for a little while. My chance to do that is slipping away.

I haven't been a healthy weight since before puberty. I have never been athletic. I want to try sports and actually be good at them. I want to be able to run without shame and pain. I want to feel good when I look in the mirror. Even if it's temporary I want just a little time like that.

This argument alone cannot be dispositive. Being healthy for a little while and then going back to being fat is better than having been fat the whole time.

Edit 2:

I find it hilarious that I have explained multiple times how I managed to lose weight and keep it off when I lived in a different country with conditions that made it easier to make healthy choices and instead of trying to help me find solutions based on what has already worked, many brilliant health experts in the comments are suggesting ""no, ignore that. Keep everything in your life exactly the same but just start doing diet and exercise. You lack the willpower? Well stop it you silly goose. It's actually easy if you aren't such a pathetic loser.""

I didn't really set out to make this post a referendum on me, personally, but go off if it makes you guys feel better.",Prince_Marf,396,0.7300000190734863,834,1730476477,2024-11-01 10:54:37,changemyview,https://www.reddit.com/r/changemyview/comments/1gh8oh6/cmv_there_is_nothing_inherently_wrong_with_losing/,11,2024
1gvp156,CMV: all government ethics investigations should always be public ,"There's a big hubbub going on right now in the USA over whether Republicans are going to release the results of the ethics investigation into Matt Gaetz, and Republican representative MTG is ""threatening"" the release of other ethics investigation reports as some sort of retaliation.

Not only do I think her bluff should be called, I think a law should be passed that all activity and investigations, hearings, etc by the Ethics Committee should be made public by default.

 Certainly any information relevant to national security could be redacted, but embarrassing information about politicians? Fair game. Should we not expect to be fully informed about those we vote for?",LegitimateBuffalo242,391,0.9399999976158142,95,1732107906,2024-11-20 07:05:06,changemyview,https://www.reddit.com/r/changemyview/comments/1gvp156/cmv_all_government_ethics_investigations_should/,11,2024
1h3fhh0,CMV: Liberal democracies are decaying into illiberal democracies or democracies in name only,"For a democracy to thrive it needs the following (among others):

* A population that agrees on facts: Therefore, channels of information (e.g., podcasts, social media, and traditional media) need to be able to distribute fair and accurate information to the public.
* A population that is informed of their civic duty and is willing to honor them: This means that political participation should be enabled as much as possible e.g by making voting as easy as possible, but most importantly by making education much more than just preparation for a job, but more about how to function as a participant in a society where democracy is the political system
* A political system that is not corrupted by money and special interests: i.e. shouldn't be allowed to buy votes or pay (donate to) politicians to pass favorable legislation.

Around the world, all of the above points are being undermined for example in the EU one of the vice presidents of the EU parliament was arrested for accepting bribes from Qatar, see here: [https://www.politico.eu/article/mep-kaili-charged-with-corruption-by-belgian-prosecutors-reports/](https://www.politico.eu/article/mep-kaili-charged-with-corruption-by-belgian-prosecutors-reports/)

There are many examples of the lack or deterioration of the above basic requirements in numerous places hence my view is that liberal democracies will eventually only be democracies in name only in the future unless we find a way of fixing the :

* information sources so that people can agree on the facts
* Voting is made easier and people understand their civic duty
* Remove corruption from politics.",kindly102,382,0.800000011920929,200,1732982133,2024-11-30 09:55:33,changemyview,https://www.reddit.com/r/changemyview/comments/1h3fhh0/cmv_liberal_democracies_are_decaying_into/,11,2024
1gl3esj,CMV: A bird flu pandemic worse than COVID is inevitable and imminent.,"What's been lost amid the election results form yesterday is the news from a few days ago that \[bird flu has made the jump to pigs.\](https://theconversation.com/bird-flu-detected-in-pigs-heres-why-virologists-are-concerned-242623#:\~:text=H5N1%20influenza%20has%20now%20been,rapid%20global%20spread%20in%202020.) I've spent the last hour or so in the H5N1 subreddit, and it seems that most people there think this is a big step and that the next pandemic is upon us within a few months. With Donald Trump in the Oval Office, having promised to make RFK Jr. his HHS secretary, it's looking like the response to H5N1 in the United States is going to be even worse this time than it was last time. This, coupled with the fact that H5N1 has a case-fatality rate much higher than COVID did even at its peak, means that we're almost certainly going to see a bigger pandemic than COVID. I desperately want my view changed on this, because I'm having an existential crisis right now. Thanks. ",SacluxGemini,380,0.7799999713897705,176,1730912839,2024-11-06 11:07:19,changemyview,https://www.reddit.com/r/changemyview/comments/1gl3esj/cmv_a_bird_flu_pandemic_worse_than_covid_is/,11,2024
