post_id,title,text,author,score,upvote_ratio,num_comments,created_utc,created_datetime,subreddit,permalink,month,year
1hwzoat,"CMV: Trump is not fit to be the face of America, let alone the president.","This post is really just relevant to American users, but I'd like to hear the opinions of anybody outside the country if they do have a say. I, personally, do not understand how people can openly support Trump with the vast amount of information out there that definitely does not paint him as a good person. I've seen most supporters say that they voted for him hoping for cheaper gas prices, groceries, and to ""Make America Great Again."" I believe the country has never truly been great and needs much work, but that is an entirely different conversation.  
 Even if I did believe Trump could and would do everything his supporters are hoping for, I would not vote for him. Why? He was openly a close friend of Jeffrey Epstein for, according to Epstein himself, 10 whole years. There are clips of the two of them talking about women's looks - which I doubt their conversations were respectful after the ""grab 'em by the pussy"" comment. Trump says these exact words about Epstein: ""I've known Jeff for 15 years. Terrific guy... It is even said that he likes women as much as I do, and many of them are on the younger side."" I'm not saying that Trump was a part of Epstein's crimes, but I would not be surprised if such news were to ever be revealed. I am simply pointing out who he has been associated with - for example, Matt Gaetz, who was said to have paid a 17-year-old girl for sex. Trump has faced similar allegations of sexual assault since 1970- 26 different allegations, to be exact. He has denied all of them, but considering the people he is around and the things he has said, it is very hard to believe him. As just about everyone knows, he IS a convicted felon.  
 America might need the cheaper gas prices, we might need the cheaper groceries, the walls, the need to be great, but is it truly worth putting the state of the country into the hands of a felon? The hands of a man that has likely touched and hurt women without a care in the world? Hands that shook with Jeffrey Epstein? No. I would truly love to know how anybody could ever choose that just for a cheaper life. ",Silent_Ice6040,482,0.6800000071525574,739,1736382170,2025-01-08 18:22:50,changemyview,https://www.reddit.com/r/changemyview/comments/1hwzoat/cmv_trump_is_not_fit_to_be_the_face_of_america/,1,2025
1i0lzxk,CMV: Biden's term in office did not meaningfully deliver victories for the American left domestically,"I'll start with Biden's legislature passed during his term and explain why I think his tenure did not meaningfully advance the goals of the American left. 

Biden's first signature piece of legislature was the $1.9 trillion American Rescue Plan, which in fairness to Biden is not your typical giveaway to the wealthy. It included child tax credits that were wildly successful, I believe they cut the child poverty rate by half. However, these expired.

Via The New York Times, reporting on the stimulus package at the time:

*For a working single mother of a 3-year-old who earns the federal minimum wage — just under $16,000 a year — the bill would provide as much as $4,775 in direct benefits, Ms. Pancotti estimates. For a family of four with one working parent and one who remains unemployed because of child care constraints, the benefits could total $12,460.*

It was also refreshing to see after Trump's usually immodest boastings about his amazing soon to arrive infrastructure bill, that one was actually passed. Although the cost ($1 trillion) does seem excessive to me and it is irking that those who seemed to benefit most were large firms like CAT. 

Now the negatives:

the raw amount of spending is rather modest when put into perspective. Via Paul Krugman:

*But when I see news reports describe these laws as “*[*massive*](https://www.cnbc.com/2022/08/12/house-to-vote-on-inflation-reduction-act-tax-and-climate-bill.html)*” or huge, I wonder whether the writers have done the math. The infrastructure law will add* [*roughly $500 billion*](https://www.crfb.org/blogs/infrastructure-plan-will-add-400-billion-deficit-cbo-finds) *in spending over the next decade. The Inflation Reduction Act will increase spending by roughly* [*an additional half trillion*](https://www.crfb.org/blogs/whats-inflation-reduction-act)*. A law to promote U.S.* [*semiconductor production*](https://www.bloomberg.com/news/articles/2022-07-28/house-sends-52-billion-chip-bill-to-biden-for-his-signature?sref=qzusa8bC) *will add around $50 billion more. Overall, then, we’re talking about a bit more than $1 trillion in public investment over 10 years.*

*To put this in perspective, the Congressional Budget Office expects* [*cumulative gross domestic product*](https://www.cbo.gov/system/files/2022-05/57950-Outlook.pdf#page=13) *to be more than $300 trillion over the next decade. So the Biden agenda will amount to around one-third of one percent of G.D.P. Massive it isn’t.*

I am of the opinion that the CHIPS and Sciences Act was unnecessary or at least should have been amended as some Democratic senators suggested so that the chips companies receiving the subsidies didn't turn around and use the federal money on buybacks and dividends.

Speaking of stock buybacks, Biden's 1% tax on stock buybacks was welcome but in my opinion too modest to alter a practice that could potentially damage American competitiveness for the long term (as companies like IBM are spending more on buybacks than R&D)

I'm not sure what the ideal solution is to this (and obviously some of this is down to California's jurisdiction and its governor) but it doesn't seem to reflect well on Biden that in California the average home price is $700,000, which cannot be good for the average person. Recently, figures have also come out that US homelessness has risen to an all time high of 770,000. 

Wage growth adjusted for inflation on paper has been impressive (7.3% for the bottom 10% since 2019) it is  important to note that often the cost of living increases for these individuals have probably been greater than the official inflation statistics (grocery prices make up only 8% of the CPI but the average person in the bottom 10% spends more than 8% of their budget on groceries).

Biden cannot really be faulted for the nearly $400 billion in climate spending though in the IRA, good job there. 

Biden's student loan forgiveness plan (though this was not really his fault) ended up being hacked to pieces by the Supreme Court. 

Regulatory outlook:

Lina Khan's FTC came in with an ambitious plan to rewrite existing US antitrust practice. The results have been decidedly mixed. Lawsuits against Microsoft and Meta failed. A good symbol of where policy has become misguided under Biden is that the FTC sued to block the Tapestry-Capri Holdings merger over whether prices for affordable handbags would become too high. This hardly seems like a top priority for the left in my view.",PrestigiousChard9442,449,0.75,261,1736795840,2025-01-13 13:17:20,changemyview,https://www.reddit.com/r/changemyview/comments/1i0lzxk/cmv_bidens_term_in_office_did_not_meaningfully/,1,2025
1i89lhx,CMV: Pardoning the insurrectionists will prove disastrous for the Republican Party,"I’m open to having my mind changed on this, but I personally fail to see how this plays out well for the GOP. 

I believe this move has short term effects that help Trump’s administration earn some brownie points with MAGA supporters but in the long term I think it might do more harm than good.

I feel like this move solidifies the GOP as a chaotic, anti-law-and-order party, whereas usually they aim to be seen as the opposite. It obviously alienates moderate and independent voters who were disgusted with the events of Jan 6 - as well as younger voters who, as I understand it, are especially critical of the Jan 6 attack on the capitol.

If that isn’t enough, this would solidify Trump’s ties to the Republican party indefinitely, essentially meaning any Republican candidate for the foreseeable future has to play along, embrace the pardon and I could see that playing out badly when they try to appeal to the general electorate when Trump inevitably cannot run again in 2028.

Thoughts? Rebuttals? Looking for some clarity here.
",plazebology,438,0.6899999976158142,736,1737655398,2025-01-23 12:03:18,changemyview,https://www.reddit.com/r/changemyview/comments/1i89lhx/cmv_pardoning_the_insurrectionists_will_prove/,1,2025
1i53y3p,"CMV: TikTok is deliberately suppressing anti-China content, and this is sufficient to justify banning the app.","I've seen a lot of posts about TikTok recently, but relatively few posts with sources, so I thought I'd throw my hat into the ring.  [This substack article](https://thezvi.substack.com/i/142559317/tiktok-promoting-chinese-interests) was what convinced me of my current views.  It's very long, but I'll focus this CMV on what is IMO the strongest point.

In December 2023, a think tank did a [study](https://networkcontagion.us/wp-content/uploads/A-Tik-Tok-ing-Timebomb_12.21.23.pdf) comparing how common different hashtags are on Instagram and TikTok.  Using ordinary political topics like Trump, Biden, BLM, MAGA, etc as a baseline, they found a few significant differences (page 8), but nothing that I don't think could be explained by selection effects.

On the other hand, when they looked at content related to China, [they found a rather different pattern:](https://substackcdn.com/image/fetch/f_auto,q_auto:good,fl_progressive:steep/https%3A%2F%2Fsubstack-post-media.s3.amazonaws.com%2Fpublic%2Fimages%2F429fa831-69e8-4faf-bf10-7925282c513c_1042x759.jpeg)

- Pro-Ukraine, pro-Uighur, and pro-Taiwan hashtags are about 10x less common on TikTok as they are on Instagram.
- Hashtags about Tibet are about 25x less common.
- Hashtags about [Hong Kong](https://substackcdn.com/image/fetch/f_auto,q_auto:good,fl_progressive:steep/https%3A%2F%2Fsubstack-post-media.s3.amazonaws.com%2Fpublic%2Fimages%2F5a2856f7-af25-4f08-91cd-fe9a43bf51af_978x1003.png) and Tianenmen Square are over 100x (!!) less common.
- Conversely, hashtags about Kashmir separatism in India are [~1000x *more* common.](https://substackcdn.com/image/fetch/f_auto,q_auto:good,fl_progressive:steep/https%3A%2F%2Fsubstack-post-media.s3.amazonaws.com%2Fpublic%2Fimages%2F51e2a055-b3f3-43f5-8430-f0192da03e97_974x227.png) 

I don't think you can explain this with selection bias.  Absent a coordinated effort from everyone who posts about Tianenmen Square to boycott TikTok, a 100x difference is *far* too large to occur naturally.  The cleanest explanation is that the CCP is requiring TikTok--a Chinese company that legally has to obey them--to tweak their algorithm to suppress views they don't like.

I think this justifies banning TikTok on its own.  Putting aside the other concerns (privacy, push notifications in a crisis, etc), the fact that an unfriendly foreign country is trying to influence US citizens' views via content manipulation--and not just on trivial stuff, on major political issues--is an enormous problem.  We wouldn't let Russia buy the New York Times, so why let China retain control over an app that over a third of all Americans use?

(I'm fully aware that the US government has pressured US social media companies about content before.  That said, if my only options are ""my government manipulates what I see"" and ""my government *and* an unfriendly government manipulate what I see"", I would prefer ""nobody manipulates what I see"" but would settle for the former if that's not an option.)

Here's a few possible ways you could change my view (note: if you can give me links or sources I will be much more likely to award deltas):

- Find major problems with the posted studies that make me doubt the results.
- Convince me that the bill is problematic enough that it's not worth passing even if TikTok *is* manipulating content.
- Show that the US is pressuring social media companies to suppress anti-US content on a similar scale (this wouldn't change my views about banning TikTok, but it would change my views about the US).
- Convince me that most of the bill's support in Congress comes from reasons other than content manipulation and privacy (you'll need a good argument for how strong the effect is, I already know that e.g. Meta has spent boatloads lobbying for this bill but I'm not sure how many votes this has bought them).

CMV!",Tinac4,402,0.7200000286102295,355,1737308219,2025-01-19 11:36:59,changemyview,https://www.reddit.com/r/changemyview/comments/1i53y3p/cmv_tiktok_is_deliberately_suppressing_antichina/,1,2025
1i0ojk9,CMV: California's insurers are not 'greedy' for cancelling policy renewals,"**Myth #1:** ""They made all this money then just left!"" 

Tyler Perry (a billionaire) is pushing this rhetoric, stating recently: *""Does anyone else find it appalling that insurance companies can take billions of dollars out of communities for years and then, all of a sudden, be allowed to cancel millions of policies for the very people they became rich on?""*

The problem? In the last decade in California, for every $1.00 insurers have collected in premiums, they've paid out $1.09 in claims. Not only have they not made any money, they've suffered *heavy losses*. 

**Myth #2:** ""They're canceling these people's policies so they don't have to pay the claims!""

Outside of non-payment of premiums or fraud, California law prohibits insurers from canceling an insurance policy *during its term*. 

What they're canceling is the *renewal* of the policy. 

**Myth #3:** ""They're just *greedy*!"" 

* Over the past decade, the average combined ratio for the U.S. homeowners line was 101.3%, indicating insurers paid out more in claims than they received in premiums.

The last update in State Farm's wiki has their net revenue at a $5.5B *loss* (they're a prime target right now). Did they just forget to be greedy, then?

**Why did they cancel policies (renewals), refuse to take on more, and try to exit California altogether?** 

Because California made it impossible for them to function properly as an insurer. 

In 2017, voters passed a measure with support of the Newsom regime that heavily regulated the insurance industry under the guise of keeping home insurance ""affordable"". 

\- This required insurers to get approval from regulators before raising rates.   
\- They could only assess their rates based on historical losses in California, instead of forward-looking risk assessment  
\- California quickly became the worst state in the country for the disparity between actuary assessed rate (people who determine future risk and determine what premiums should be), and the regulatory approved rate.  
\- They delay for regulatory approval/rejection approached 300 days on average  
\- They were also prohibited (until very recently) from passing on the cost of reinsurance (insurance for insurance companies, basically) to customers. 

So the result was in effect the inability to function properly as an insurer, exposing themselves to catastrophic risk, and the necessity to pull out of these areas altogether less face bankruptcy. 

This has nothing to do with ""greed"". And if it does, the greed was on the part of Californians who thought they're too special to have to pay more for living in a disaster-prone area, and insurers should just be bending over backwards to lose money for their customer's benefit. 

Change my mind! ",ConundrumBum,381,0.6800000071525574,500,1736802126,2025-01-13 15:02:06,changemyview,https://www.reddit.com/r/changemyview/comments/1i0ojk9/cmv_californias_insurers_are_not_greedy_for/,1,2025
1i6qxi9,CMV: stop debating with conservatives. It is a waste of time. Work around them or against them. You will never change them.,"The last straw for me was the persistent blaming of immigrants for all of Britain’s woes when the real problem is the far right and the very rich.

To quote Sartre:

Never believe that anti-Semites are completely unaware of the absurdity of their replies. They know that their remarks are frivolous, open to challenge. But they are amusing themselves, or it is their adversary who is obliged to use words responsibly, since he believes in words. The anti-Semites have the right to play. They even like to play with discourse for, by giving ridiculous reasons, they discredit the seriousness of their interlocutors. They delight in acting in bad faith, since they seek not to persuade by sound argument but to intimidate and disconcert. If you press them too closely, they will abruptly fall silent, loftily indicating by some phrase that the time for argument is past.
Jean-Paul Sartre

In simpler terms: Never Wrestle with a Pig. You Both Get Dirty and the Pig likes it.

Fight them in the courts, in the media, on the streets, wherever you need to but never try to debate with them because their position is one of hate for common human decency and everyone outside their in group and you will never win.",MaroonMedication,326,0.6899999976158142,503,1737487738,2025-01-21 13:28:58,changemyview,https://www.reddit.com/r/changemyview/comments/1i6qxi9/cmv_stop_debating_with_conservatives_it_is_a/,1,2025
1hzwscm,CMV: American capitalism is severely flawed and exploitation of the working class is inherent to becoming a billionaire,"Throughout history, it has been evident that the capitalist economic philosophy of profit above all else, little/no government regulation, and letting the uber-rich hoard their incomprehensibly large amount of wealth is a leech on the well-being of society as a whole and leads to a constantly growing wealth divide not only within the scale of country, but on a global scale as well; a very clear divide between ""developed"" and ""less developed"" countries.

I can understand the philosophy behind the free market, having absolute equal distribution of wealth between everyone is ridiculous and creates stagnation in the development of a country. However, an unchecked wealth gap between the working and corporate/wealthy class creates turmoil and division amongst the people of a country. Throughout history, we can see that the uber-wealthy tend to use hatred against fellow people to distract the working class from who is really exploiting them; a scapegoat if you will. 

We can see in current day America that Donald Trump, a billionaire who is also endorsed by (and essentially a partner to) Elon Musk, the richest man on the planet, uses Mexican immigrants as a scapegoat for all the working man's troubles, Grocery prices, gas prices, inflation, etc, while creating tax cuts for the uber wealthy and killing welfare programs and departments, including the Department of Education. Despite the fact that deporting 10 million Mexican immigrants would cripple the American economy, the common working class white American believes it, simply because they are of a different culture and it is very easy to believe that they are the enemy because of human psychology.

The wealthy benefit from this because a working class that is too busy hating eachother is a working class that wont develop class consciousness. The billionaires will still cut corners at their companies and lobby to keep minimum wages stagnant as inflation slowly chips away at the value of the dollar, all while they grow wealthier. 

The unimaginable hoarding of wealth we see in the billionaire class is a cause for most of the economic troubles. There is no justification for one man to own as much wealth as millions of people while there are people who cant eat or drink. To be a billionaire, you must have exploitation at some point along the chain among at least one of their income streams, mainly their companies. Jeff Bezos is a prime example, a man acclaimed to have made his wealth ""by himself"", yet Amazon is notoriously one of the worst workplaces in the entire country for worker who make pennies to Bezos' millions.

I don't call for a total communist revolution within America, I just think that no person should have a billion dollars of wealth to their name no matter what they do as there's no reasonable justification for it that doesn't involve leeching off the working class. The corporate class should be taxed and regulated over ten-fold so that the capitol earned by the people is in the hands of the people.",itszesty0,322,0.6899999976158142,450,1736715517,2025-01-12 14:58:37,changemyview,https://www.reddit.com/r/changemyview/comments/1hzwscm/cmv_american_capitalism_is_severely_flawed_and/,1,2025
1hyt4ya,CMV: the world is fucked and I'm all here for it.,"With openly fascist parties and demagogues rising to power worldwide and people voting against their interest time and time again, social media doing way more harm then good, I think this won't be get better, it will only get worse.

I'm not angry at greedy, powerhungry assholes doing greedy, powerhungry asshole things. I'm not angry at the snails eating the lettuce in my garden either. It's just what they do.

I'm angry at the substantial amount of bootlicking morons not being able to see behind the lies.

I'm angry at the moderate politicians thinking idealism will still get them anywhere after witnessing the effectiveness of extremist propaganda.

But that anger has slowly turned into apathy and actually sometimes recognition.

I catch myself more and more often thinking: ""So y'all wanna get fucked? Ok let's fucking go! Let's see how bad it can really get.""

And this sentiment is seeming to get stronger.

",atiustirawa,319,0.5899999737739563,688,1736591106,2025-01-11 04:25:06,changemyview,https://www.reddit.com/r/changemyview/comments/1hyt4ya/cmv_the_world_is_fucked_and_im_all_here_for_it/,1,2025
1i9i8mj,"CMV: Without radical change, the Democratic Party will functionally cease to exist before 2040.","This view has one argument behind it: once solid Democratic voting blocs have steadily turned against them. 

From 1980 to 2012, the Latino vote has, with only two exceptions, been over 60% Democrat, usually a victory by 20+ points. Harris won the Latino vote by 5. This isn’t an anomaly either, it’s not Harris being deeply unpopular. It’s a downward trend taking place since 2008. (And probably further back, if you don’t count the outlier of Kerry v. Bush, where Latinos voted conservative at levels roughly equivalent to 2024.)

The same is largely true among black voters. From 95+% during the Obama years, with a steadily decreasing lead since then, black voters seem to be shifting rightward. Even if you consider the Obama years to be an anomaly, which I suppose they are, but not an outlier, the shift is dramatic. Harris won the black vote, despite being black herself, by the smallest margin in the last thirty years at least, and almost certainly more. This is also part of a continuous downward trend. Since Obama, they’ve voted less consistently Democrat than expected. 

If these trends continue, and I think they will, the Democratic Party will functionally cease to exist. They don’t even need to continue far. If they slip a few points more among black voters, that’s *it.*

I haven’t seen anyone talking about this. Sure, people have talked about the Latino vote going more red than expected or Trump making minor gains among black men, but no one seems to have acknowledged that these are *trends* that the Democratic Party will not survive continuing. Is there some glaring flaw in my logic? Or is there a deep panic going on behind closed doors? ",Separate_Draft4887,293,0.7400000095367432,193,1737792069,2025-01-25 02:01:09,changemyview,https://www.reddit.com/r/changemyview/comments/1i9i8mj/cmv_without_radical_change_the_democratic_party/,1,2025
1ibg3w9,CMV: States whose senators vote against federal funding packages should not receive federal funds.,"I’m a frustrated democrat in the US. Time and again, I will see Republicans tout all the federal funding their states are getting from bills like the CHIPs act, the IRA, or the infrastructure bill yet their voting record aggressively opposed passing any of that legislation. 

They don’t deserve it. Their states don’t deserve the funding that they clearly don’t ideologically support. 

I believe that if you’re a senator and you do not vote to pass a bill that assigns federal funds for improvement, you do not deserve the benefits of that improvement. Hell, I could be convinced that states that voted against the ACA don’t deserve the same healthcare protections. 

I can understand that many people in red states do not vote for the R candidate and they would suffer if this were followed. I don’t know that that matters. We’re in a representative democracy and if the majority of constituents don’t want federal funding, they shouldn’t be rewarded. ",arcticmonkgeese,292,0.7599999904632568,199,1738002323,2025-01-27 12:25:23,changemyview,https://www.reddit.com/r/changemyview/comments/1ibg3w9/cmv_states_whose_senators_vote_against_federal/,1,2025
