post_id,title,text,author,score,upvote_ratio,num_comments,created_utc,created_datetime,subreddit,permalink,month,year
1ing2ad,CMV: Elon Musk walks around with his son on his shoulders to deter assassination attempts,"In many of his recent public appearances, Elon Musk has been seen keeping his four year old son X Æ A-Xii on his shoulders.

I think that the main reason he keeps this child on his shoulders in so many public appearances is to deter assassination attempts. An assassin would be much less likely to attack him if the son is on his shoulders.

---

How to change my view:

Either

1. Come up with a reason that makes more sense
2. Demonstrate that there is no reason to think that assassins would be deterred",razorbeamz,9321,0.8600000143051147,1756,1739325841,2025-02-11 20:04:01,changemyview,https://www.reddit.com/r/changemyview/comments/1ing2ad/cmv_elon_musk_walks_around_with_his_son_on_his/,2,2025
1iht2i4,CMV: The new DNC Vice Chair David Hogg exemplifies exactly why the Democratic Party lost the 2024 election,"So for those who aren't familiar, one of the Vice Chairs elected by the DNC earlier this week is David Hogg, a 24 year old activist. There's nothing wrong with that aspect, its fine to have young people in leadership positions, however the problem with him is a position he recently took regarding an Alaska Democrat, Mary Peltola. 

Mary Peltola was Alaska's first Democrat Rep in almost 50 years, and she lost this year to Republican Nick Begich. Throughout her 2024 campaign, David Hogg was very critical of her, saying she should support increased gun restrictions, and then he celebrated her loss in November saying again that she should support gun control, in Alaska. This is exactly what's wrong with the DNC.

In 2024, the Democrats lost every swing state, every red state Democratic Senator, and won only three Democratic House seats in Trump districts (all of whom declined to endorse the Harris/Walz ticket). If you look at the Senate map, there is no path to a majority for the Democrats without either almost all of the swing state seats or at least with a red state Democrats. Back in Obama's first term, the Democrats had seats in Montana, Missouri, West Virginia, and both Dakotas, but in 2010 after supporting the ACA and a public option on party lines they lost most of them, and in 2024 after supporting BBB on party lines they lost all of them. 

My view is that the Democrats are knowingly taking a position that its better to lose Democrats in redder areas than to compromise on certain issues, something that has recently been exemplified by the election of a DNC Vice Chair that celebrated the loss of an Alaska Democrat. I think if this strategy continues, they will go decades without retaking the Senate and likely struggle to win enough swing states to take the Presidency again either. ",badabinggg69,8203,0.8799999952316284,2729,1738704560,2025-02-04 15:29:20,changemyview,https://www.reddit.com/r/changemyview/comments/1iht2i4/cmv_the_new_dnc_vice_chair_david_hogg_exemplifies/,2,2025
1iu4qpq,CMV: the Democratic Party isn’t up for this,"For context, I’ve been politically active my whole life in the US and have pretty much always been a democrat, volunteered for campaigns, flew to Nevada for this election, etc. 

It pains me to say it, but the party isn’t up for the task of dealing with what’s happening right now and is essentially a failed party, in need of near wholesale change at the leadership level. 

Here are the main points:
1- they don’t know how to get media attention
2- they have no actual plan to resist the trump administration 
3- they have no clear articulate message for what they stand for, leaving a vacuum for maga to fill it in for them 

Chuck Schumer’s grand resistance plan was to release a new bill to counter the dismantling of federal agencies (and called it “stop the steal”) and it made zero news. 

The opposition party needs to be rising to the level of intensity in this moment. Sit ins on the house floor, getting arrested if need be. They need to be running ads and other paid media now like if they were running a campaign. They need to be a real political party. 

Every day that goes by without major fight is a lost opportunity and shows that they just aren’t up for it. 

",Pokoparis,8114,0.9399999976158142,2293,1740074264,2025-02-20 11:57:44,changemyview,https://www.reddit.com/r/changemyview/comments/1iu4qpq/cmv_the_democratic_party_isnt_up_for_this/,2,2025
1imbzi7,CMV: Trump Will Mark the Beginning of the End of the U.S. as a Global Superpower,"For the past 80 years, the United States has been *the* dominant Western superpower—militarily, economically, technologically, and culturally. However, Trump's presidency, particularly his second term, has made it clear to the rest of the world that the U.S. can no longer be relied upon as a stable military ally or a self-regulating democracy with effective checks and balances.

For decades, much of the Western world has relied on the security and global leadership of the U.S., particularly through NATO. But now, many of us are waking up to the reality that this reliance is no longer viable. Regardless of the fact that a significant portion of Americans oppose Trump and everything he represents, the fact remains: the country elected him—*twice*. This suggests one of three possibilities:

1. A deliberate and conscious choice by the public to embrace Trump’s leadership.
2. The result of institutions so weakened, corrupt, or manipulated that public ignorance was effectively engineered—potentially by external forces that stand to benefit (it would certainly align with known Russian geopolitical strategy).
3. A mix of both—some voters knowingly supporting him while others were misled by systemic dysfunction.

I say this as someone from Spain, where, like many other European nations, we have neglected our own capacity for self-defense, relying instead on NATO and the security provided by an allied nation that spends more on its military than the rest of the world combined in any given year. But Trump's America has demonstrated that this reliance is no longer sustainable.

In just three weeks (!) since his second inauguration, Trump and his administration have already threatened military action in **Panama, Gaza, Greenland**, and have come dangerously close to doing the same with **Canada**—one of the closest and strongest alliances in the world. Instead of military threats, he has chosen economic coercion to undermine Canada’s sovereignty.

People are not stupid. You can call these tactics “negotiation strategies,” “distractions,” or whatever justification you want—but that doesn’t change the long-term consequences. Whether intentional or not, Trump’s actions have made it clear that NATO, Europe, and the broader Western world can no longer depend on the United States as the so-called “world police” (a sentiment that has existed since Vietnam and solidified with Iraq).

European leaders are already acknowledging this, openly discussing the need for greater military and economic independence. And while Europe has its own issues—particularly the resurgence of far-right populism—Trump’s second term offers a *real-time case study* in how democratic institutions can be undermined from within. This might, hopefully, give European governments enough time to reinforce their own institutions before a similar phenomenon takes root here.

Beyond geopolitics, Trump’s America is also self-sabotaging its academic and technological leadership. The U.S. has long attracted the brightest minds in science, technology, and research, but under Trump, those systems are being crippled. If you are a top researcher, why would you choose to work in a country where:

* Salaries might be higher, but the quality of life is worse?
* You have unrestricted access to guns but limited reproductive rights?
* Free speech is celebrated on social media but censored in academic research?

This will inevitably lead to *brain drain*, further accelerating the decline of U.S. leadership in innovation, science, and education.

Yes, in the short term, Trump’s aggressive trade policies might secure *favorable* economic deals, but they come at the cost of severely damaging U.S. alliances and international trust—possibly beyond repair. It does not matter if Trump comes out tomorrow, apologizing for everything, and saying he is sorry (lol). Why would any country *trust* the U.S. again in the next 20 years?

I don’t see a way back from this. CMV. ",hakezzz,5465,0.8399999737739563,996,1739209340,2025-02-10 11:42:20,changemyview,https://www.reddit.com/r/changemyview/comments/1imbzi7/cmv_trump_will_mark_the_beginning_of_the_end_of/,2,2025
1isek68,"CMV: The point of DOGE is to target things Trump/Musk/the GOP dislike and not reducing waste, fraud, and abuse","If your goal is to reduce waste, fraud, and abuse, you would empower the inspectors general to investigate as an independent group to provide oversight. 

If your goal is to increase waste, fraud, and abuse, you would fire the inspectors general (as the Trump admin has done). This makes it easier to avoid oversight. 

If your goal is to reduce waste, fraud, and abuse, you would not hire the world’s richest man to do alleged audits when his companies have billions in contracts with the government. Fat chance he is going to investigate any of his company’s contracts. 

If your goal is to reduce waste, fraud, and abuse, you would staff a team with relevant experience. 

If your goal is to reduce waste, fraud, and abuse, you would start with looking at the biggest expenses in government spending and not tiny programs that provide aid. 

",MeteorMike1,3755,0.9100000262260437,864,1739890743,2025-02-18 08:59:03,changemyview,https://www.reddit.com/r/changemyview/comments/1isek68/cmv_the_point_of_doge_is_to_target_things/,2,2025
1izkhsl,CMV: The image of the US police force will never recover because of the mindset on using unmarked/stealth cars,"I firmly believe that the police force image in the US will never heal until they adopt a mindset similar to Europe. Most European countries use brightly marked cars for their police force because you're supposed to easily identify and approach them. 

 The US police force and their image will always be at odds with their citizens as long as they regularly use stealth/unmarked cars. Every encounter turns into a sneaky gotcha moment and are what keeps people distrustful. Extends to their uniforms too. Most wear some form of black or blue as it helps them blend in. There's no reason unless your mentality is to surprise.

There's a time and place for unmarked cars. That time and place is when you have a perp or bust you know about in advance. Not a random encounter with a citizen. They operate like every encounter is a sting operation. IMO they'll continue to fail unless that changes.  ",ButtHurtStallion,2729,0.8999999761581421,430,1740675416,2025-02-27 10:56:56,changemyview,https://www.reddit.com/r/changemyview/comments/1izkhsl/cmv_the_image_of_the_us_police_force_will_never/,2,2025
1iubnci,CMV: Elon Musk has some dirt on Donald Trump,"There is no way DT would tolerate being made to look like the second wheel in a relationship if there wasn't some kompromat on him in Elon's hands.  DT has invariably tossed on the trash heap anyone who threatened his ""Dear Leader"" role.   The only two people he has allowed to make him their b\*\*\*\* are Putin and Musk.  I have believed for years that Putin had/has kompromat on DT.  Now I am sure that the muskrat does.  DT looked so miserable in the joint oval office appearance.  Nothing could have made him grovel to the muskrat except something held over his head.",SaltPresent7419,2641,0.8600000143051147,1162,1740091308,2025-02-20 16:41:48,changemyview,https://www.reddit.com/r/changemyview/comments/1iubnci/cmv_elon_musk_has_some_dirt_on_donald_trump/,2,2025
1ioyoy4,CMV: TikTok should have been permanently banned in the US,"When TikTok was temporarily blocked in the US back in January, I uninstalled it, thinking it was gone for good. Turns out, it was only down for a few hours, but even now, downloading it from the App Store or Play Store is still impossible. New users can’t get it, and anyone who deleted it—like me—was locked out.

Yesterday, I saw a post on Reddit saying that TikTok is now letting people install it again through [tiktok.com/download](https://www.tiktok.com/download), bypassing the app stores entirely. So technically, nothing is stopping me from reinstalling it… but I don’t want to.

I used to spend 2-3 hours a day on TikTok. When I uninstalled it, I expected to replace it with something else—another app, another distraction. But that never happened. I just stopped wasting time. Now, looking back, I don’t think I was enjoying TikTok as much as I was just stuck in it.

This whole situation made me realize that maybe the ban should’ve been permanent. If TikTok had stayed fully blocked, millions of people would’ve naturally moved on, like I did. But now that it’s creeping back in, people are rushing to reinstall it without questioning whether they actually need it.

Convince me I’m wrong",Derek_919,2384,0.8500000238418579,486,1739494974,2025-02-13 19:02:54,changemyview,https://www.reddit.com/r/changemyview/comments/1ioyoy4/cmv_tiktok_should_have_been_permanently_banned_in/,2,2025
1ip1btt,"CMV: MEN, if you want a stay at home trad wife, then you directly support alimony.","Men generally say they want a traditional wife, who stays home, raises the kids, and takes care of the household. At the same time, these same men complain that alimony is unfair to men in divorce cases.

They conveniently forget that alimony literally exists because women historically weren’t allowed to work, and even today, women still often sacrifices their career to be a full time homemaker, she loses years (or even decades) of work experience, skill development, and retirement savings. If the marriage ends, she’s at a serious financial disadvantage compared to her husband, who continued earning, advancing in his career, and securing his financial future.

The very tired rebuttal I always get from my fellow is essentially “women initiate most divorces, so they shouldn’t get anything.” If a woman spends 20 years raising kids, maintaining the home, and supporting her husband’s career, only to file for divorce (and you believe she should walk away with nothing just because she initiated the divorce) then you never truly supported the trad wives to begin with. You supported a system where she financially depends on her husband, but the moment she decides to leave, you think that dependence should be punished.

If you genuinely believe in the traditional roles, you also accept the responsibility that comes with it. If a woman devotes her life to supporting a man’s career and raising his children, why should she be left with nothing if the marriage ends?",Cajite,2250,0.8399999737739563,1327,1739503345,2025-02-13 21:22:25,changemyview,https://www.reddit.com/r/changemyview/comments/1ip1btt/cmv_men_if_you_want_a_stay_at_home_trad_wife_then/,2,2025
1iqpkgw,"CMV: The increasingly vague usage of ""DEI"" as a term is to help enforce segregationist policy or silence/invisibility","Terminology is a powerful thing, when we stop using words'meanings we can start to divorce and lose the concepts. Diversity, equity inclusion, and accessibility are very generalized terms for potentially dozens to hundreds of different forms of programming and initiatives. Increasingly it has been used as a dog whistle term much like affirmative action to be a stand in for the Boogeyman of racial quotas. However that fails to really address the increasingly broad application of the concept by those seeking to destroy it. This broad application of the term appears to be used to essentially mean: Any acknowledgement of non-white, non-cis, non-able bodies, judeo-christian men is considered an extension of DEI.

Recently plaques were covered that the  Cryptology Museum in Maryland and women in STEM have found articles about their work or even mentioning their being highlighted have evaporated. How does acknowledging the hard work overcoming historical obstacles do harm? How does it detract from society and how does hiding them improve the federal government or save money? Rumors are surfacing that National Park Services staff are not only facing firing but are being asked to scrub local history, especially as it related to ""DEI"". As many may know cancer and other medical research *needs* a focus on gender, race, etc. (Data  doesn't care about whether the  population fits our ideals, data is data and not having that data is a problem for real people of all kinds). It simply appears that acknowledging unique history or the struggles of a group are being seen as innately un-American which was a common Civil Rights refrain. MLK, SNCC, was seen as just as un-American as the Black Panther Party or even their white allied organizations. To speak on Rosa Parks or to just state facts about the Stonewall Riot is framed as unnecessary in the context of anti-DEI and removed from historical and state documentation.

What furthers my belief is the release of DOGE's plan to essentially move from eliminating programs to an undefined description of firing any employee tied to DEI activity...without ever defining it oreven limiting it to ""Within their official role as a federal employee"". Based on that idea, going to a PRIDE parade, being a member of the NAACP, or potentially having been in a student union in college could be reason to let someone go. What's to stop a group of DSS workers from being fired for making their own little work group to trade tips for managing ADHD? What would stop an investigation from happening because a senior engineer decided to take three autistic new hires to lunch because that engineer also is autistic and just is happy to spend time with similar peers? Would an HBCU graduate speaking at an HBCU graduation be a problem? Increasingly the answer is all of these situations are suspicious and harmful because the definition is intentionally broad

 Quite frankly, there's no definition of ""DEI"" which is much scarier than affirmative action because it could be applied in incredibly sweeping generalizations.

If this anti Diversity and accessibility crusade was about unfairly focusing on historically marginalized groups harming people with more historical access to baseline opportunities etc. Why would we need to erase any mention of the past acknowledgememts or stop anything regarding research in the medical field? If this is about stopping unfairness then why isn't DEI more narrowly defined and why would they go after individuals generally involved in any ""DEI programming?

It is not logical to believe it is harming a white man to also study why prostate cancer is having X affect more often on Asian men. There is no tangible benefit to anyone in that example and perhaps general risk to both groups due to not identifying or isolating unique information that may further our general understandings. ",DarlaLunaWinter,2180,0.8600000143051147,1157,1739702086,2025-02-16 04:34:46,changemyview,https://www.reddit.com/r/changemyview/comments/1iqpkgw/cmv_the_increasingly_vague_usage_of_dei_as_a_term/,2,2025
1isgi09,CMV: Claims that Kamala should’ve “been more progressive” are out of touch with reality,"I'll be responding to a talking point  
  
**""Being more progressive would've energized her base"".** No. It would not have energized her base, it would have energized *you*. Progressives are not, and never have been, the base of the Democratic Party. Progressivism is something that was introduced to us 10 years ago by someone who wasn't even a democrat (Bernie), and both times (2016 & 2020) the voters said ***no***, decisively. (No, the 2016/2020 primaries were not ""rigged"", but I can debate that in the comments)  
  
In 2016 & 2020, Harris watched her, as well as other progressives (Bernie & Warren), get demolished in the primaries by more moderate figures. Now with that in mind, why would she try that strategy again? It's pretty simple lol. And even when Kamala proposed mildly progressive ideas ( eg child tax credit), she got hit with the ""why didn't you do this in the past 4 years""?

Nobody cares about paying +10% taxes for socialism when they can't even afford groceries.. Read the room.. The 2024 election was not the time or place for that. You can't expect her to become a clone of Bernie Sanders so she can pander to you... 

This isn't to say Harris ran a perfect campaign, but progressives don't really know what they're talking about (imo).",Large_Grape_5674,1939,0.6899999976158142,1865,1739895651,2025-02-18 10:20:51,changemyview,https://www.reddit.com/r/changemyview/comments/1isgi09/cmv_claims_that_kamala_shouldve_been_more/,2,2025
1ig5g5l,CMV: Trump's focus on politically loyalty over expertise resembles Soviet-Era communist failures.,"Trump, today, is making no mystery of the fact he is firing anyone in government who would enforce a law he ""does not like"" or ""thinks is stupid"" (sorry, 47 admin's wording there). While you hear much about parallels to alt-right fascism, I am actually more reminded of the failures of East Germany and the USSR.

The mentality looks to be driven by two primary engines: the ""unitary executive/committee"" and ""rooting out intellectuals.""

For the unitary executive theory, the USSR and East Germany believed the government existed only to execute the commanding party's agenda. It was acceptable for the executive or executive committee to fire and retaliate against anyone in government who acted against the party's political agenda under this framework, even when the actions that instigated firing or retaliation were driven by legitimate laws there to protect society, the environment, etc. I'd offer that this is exactly the Trump/MAGA attitude today. Regardless if federal law dictates employers hire disabled or racially diverse people when they can, it is acceptable to fire the FAA director for following that long-established federal law, because it does not serve the commanding party's interests.

As for ""quieting"" and ""rooting out"" intellectuals, this again seems to be a Soviet-Era failed posture that Trump/MAGA are adopting full-steam. Real, premiere doctors and researchers look set to be stifled from innovation by a bureaucratic system RFK, Jr., will construct with party loyalists. The same can be said with cybersecurity and defense experts, who will face bureaucratic systems designed to stifle and perhaps even retaliate against real scientists any time they present an idea that is at odds with the MAGA-consensus view. I shudder to think what Trump might have in mind for intellectuals who would risk ""humiliating"" him for failed policies and directives, but at the very least we know he is willing to fire and ridicule them through public posts to social media...

All of this to say, people seem very eager to not repeat the horrors of WW2-era fascism in Germany, and certainly there are reasons to be concerned about that in today's climate. But what I see from Trump and Co. today looks very much more like bureaucracy designed to insulate the unitary executive and stifle intellectuals and their innovation unless it serves the political needs of MAGA. That sounds like Soviet-Era communism that came and failed in East Germany after the war.",FinTecGeek,1842,0.8999999761581421,231,1738524783,2025-02-02 13:33:03,changemyview,https://www.reddit.com/r/changemyview/comments/1ig5g5l/cmv_trumps_focus_on_politically_loyalty_over/,2,2025
1ihdctq,CMV: Islam's Prophet muhammad was a horrible and disgusting person,"I'm an ex Muslim, and one of the biggest reasons I left islam had to do with all the disgusting things that Muhammad said and did throughout his life. 

Muslim apologists and dawah people love to portray him as an amazing human being, someone who was a flawless and timeless example for all of mankind, and if you're not that knowledge it's easy to be deceived into believing such things. As a muslim when I would hear about some of the more disturbing things he did from critics I would just brush it off as either inauthentic or taken out of context. 

As I became more religious and started studying more, I came across things he did and said that either didn't make any sense or were just straight up disgusting. Some of those things include: Marrying a literal child, forbidded eating with the left hand, commanding the execution of apostates, had several sex slaves, said that women who pluck their eyebrows are cursed, married up to 9 wives at one time even though the quran permits men to marry no more than 4, said that black dogs are devils, said women who wear perfume are like adulterous whores, said that men who wear trousers over their ankles will go to hell, forbidded music and other types of art, and so much other horrible and ridiculous shit.




",Revolutionary-Fix110,1635,0.8199999928474426,772,1738658662,2025-02-04 02:44:22,changemyview,https://www.reddit.com/r/changemyview/comments/1ihdctq/cmv_islams_prophet_muhammad_was_a_horrible_and/,2,2025
