post_id,title,text,author,score,upvote_ratio,num_comments,created_utc,created_datetime,subreddit,permalink,month,year
1hxbia1,"CMV: until democrats figure out why their party couldn’t beat someone like Trump instead of blaming Trump and his voters, they are destined to keep losing","Democrats on Reddit hate to hear this. I know it because any sentiment like this is usually immediately downvoted. “It’s them! Why can they get away with everything! Their voters are selfish, dumb, and/or racist!”

Yeah whatever that might be true but at the end of the day, if democrats couldn’t pick someone more attractive to the voters than Donald Trump then they need to figure out why that is and what to do about it. 

Because frankly the more whining democrats do about what the other side voted for and wants, the more they will continue to push voters in that direction.  

I won’t even go into all the shit dems have done wrong. I voted for Kamala myself bc not Trump was enough motivation for me but not Trump isn’t good enough these days so they need to figure out what is. 

It’s along the same of if you want something done right you gotta do it yourself. Can’t expect other people to change, to want what you want, etc. you have to step up and change and do things yourself to get what you want. 

For some reason democrats don’t understand this applies to politics as well. ",Itchy-Version-8977,4351,0.8399999737739563,3164,1736424971,2025-01-09 06:16:11,changemyview,https://www.reddit.com/r/changemyview/comments/1hxbia1/cmv_until_democrats_figure_out_why_their_party/,1,2025
1icegiw,CMV: America has gotten so fat that overweight people are viewed as average weight and average weight people are viewed as skinny,"Ok went down a bit of a rabbit hole the CDC says that 
73.6% of American adults are either overweight or obese. At first I was like this percentage doesn't make sense. Then I started to think that I'm probably just so used to looking at people that are a bit overweight my perception of what's skinny healthy overweight obese is probably warped. I'm also aware that bmi doesn't automatically mean healthy weight and doesn't account for muscle mass so that could skew the results a bit. But still 73.6% is a huge number and I really don't see musle mass being the lone cause for this. ",Whiskersandroses,2974,0.8899999856948853,493,1738103731,2025-01-28 16:35:31,changemyview,https://www.reddit.com/r/changemyview/comments/1icegiw/cmv_america_has_gotten_so_fat_that_overweight/,1,2025
1i22ljg,CMV: People flocking to Rednote proves the Governments argument about the TikTok ban,"Most people believe the reason the Federal Government banned TikTok was because of data collection, which is for sure part of it, but that's not the main reason it was banned. It was banned because of concerns that a foreign owned social media app, particularly one influenced directly by a foreign Government can manipulate US citizens into behaving in a way that benefits them.

No one knew what Rednote was 2 weeks ago in the US. All it took was a few well placed posts encouraging people to flock to a highly monitored highly censored app directly controlled by the CCP and suddenly an unknown app in the United States rocketed to the number 1 app in the country. 

This is an app that frequently removes content mentioning LGBTQ rights, anything they view as immodest, and any discussion critizing the CCP- a party actively engaging in Genocide against the Uyghurs. Yet you have a flood of young people who just months ago decried the US's response to the Gazan crisis flocking to an app controlled by a government openly and unapologetically engaging in Genocide. 

This was not an organic movement. If one is upset at the hamstringing of free speech their first reaction would not be to rush to an app that is controlled by a government that has some of the worst rankings of free speech globally. All it took was a few well placed posts on people's fyp saying ""Give the US the middle finger and join rednote! Show them we don't care!""

",Alarmed_Horse_3218,2635,0.7900000214576721,1431,1736961889,2025-01-15 11:24:49,changemyview,https://www.reddit.com/r/changemyview/comments/1i22ljg/cmv_people_flocking_to_rednote_proves_the/,1,2025
1i1qdgi,CMV: Muslim immigrants demanding Sharia Law in Europe should go back home ,"I think that Muslims who have immigrated to European nations and are now demanding Sharia Law (or the choice to be tried under Sharia) in that country should go back to their home countries. I’m a left leaning person and respect everyone’s religion and beliefs, but I don’t think they should be forced on others or the people who practice said religions should be harassing people who don’t follow the same. There have been protests lately in Germany where Muslims are demanding Sharia law, and polls show that a large number of middle eastern Muslim immigrants living in France, England, Denmark etc support bringing Sharia Law to those countries. I don’t believe that Sharia goes well whatsoever with western values, and I don’t think they should even have the option to be tried under sharia in these countries either. Sharia law includes things like: 

- Killing someone who decides to leave the Muslim faith 
- Not much freedom for Women 
- Sex before marriage is punishable by death 
- Homosexuality punishable by death
- Women unable to travel for more than a couple of days without a male guardian 
- Death Penalty/ Extreme over the top punishment for thieves 
- Grown men being able to marry young girls 

These things don’t align whatsoever with most western values.

If middle eastern immigrants in Europe (or anywhere else for that matter but mainly focusing on Europe rn) that are demanding Sharia Law should go back to their home countries or to a country that has Sharia if it’s that big of a deal to them. I just don’t see why they’re in a western country if they don’t agree with western values. ",EchoVital,2630,0.8899999856948853,1186,1736918247,2025-01-14 23:17:27,changemyview,https://www.reddit.com/r/changemyview/comments/1i1qdgi/cmv_muslim_immigrants_demanding_sharia_law_in/,1,2025
1i6d2gc,"CMV: Congress must remove Trump over the $TRUMP memecoin scandal, and if they won't Americans should revolt","In my view, it has come to this. The idea that a POTUS can rake in billions and billions of dollars in personal wealth - becoming one of the world's richest people overnight - as a new, completely unethical perk of being POTUS, is sickening. Things have gone too far, and Congress has a constitutional duty to react to this quickly and without partisan breakdown. If the US Congress cannot bring themselves to remove a POTUS who has personally benefitted from the Presidency on day one by billions and created massive conflicts of interest to the discharge of his duties - then they have simply outlived their purpose, and it is necessary to begin again. This is harsh, perhaps, but we are witnessing in real time the office become a place where monarchs are made - and not public servants.",FinTecGeek,2391,0.7799999713897705,772,1737443311,2025-01-21 01:08:31,changemyview,https://www.reddit.com/r/changemyview/comments/1i6d2gc/cmv_congress_must_remove_trump_over_the_trump/,1,2025
1i7wbcj,"cmv: Joe Rogan and Lex Fridman are dangerous and do not deserve to have the platform they have. They are naive, fragile and inauthentic leaders of a cult.","Background: I once was an avid listener of ‘the rogansphere’ podcasts such as Joe Rogan, Lex Fridman and their friends. I stopped after realising that they are no longer some apolitical piece of individual media but something entirely else.
I have changed my mind to now be very anti-Rogan and I am amongst many male peers who are still in it or entering it. It was a phase for me and I hope it is for them too. 

My view: 
Joe Rogan and Lex Fridman are the kind of people who really like to appear as indifferent and open-minded but they have a really specific agenda. It seems as though their ideas of merit all come from martial arts, physical fitness, counter-academia, comedy and your willingness to partake in popular conspiracies. 

We all know Joe Rogan is not academic or by any means a genius, and he would even agree. But the fact that he uses his platform to encourage and broadcast ideas that he likes without any proper debating or counterpoints means that he is, intentionally or not, propagating an agenda. I’m afraid the usual argument of ‘it’s his podcast he can have whoever he wants on’ is just not acceptable now. His platform is too big and he should take responsibility for the ideas he is spreading.

Lex Fridman is a total worm. His monologues and soliloquies, I once saw as charming, are so naive, cringe and insufferable. A total narcissist who needs people to love him and view him as some innocent soul who only wants peace and love. He’s always like ‘I am trying my best’. Well do better, you have a massive platform and if you really want to be indifferent than be authentically indifferent rather than riding the coat tails of Rogan and Musk. He is just echoing the same agenda as the rest of the Rogansphere. The fact that in his podcast with President Zelenskyy, he has the nerve to question a world leader’s willingness to negotiate a peace deal with Russia in such a naive and holier-than-thou way just goes to show how these idiots aren’t equipped to ask proper questions and be reliable talk pieces for us to listen to. 

They also have massively contributed to division within the culture wars, much more so than what they claim ‘wokeness’ has.
They are becoming talk pieces for the far-right and seriously doing a lot more damage to the world than they are claiming. 

Please tell me how these guys are useful, why they deserve their platform and how they aren’t a total cult.


",Ok-Bullfrog-7951,2211,0.7300000190734863,1198,1737609885,2025-01-22 23:24:45,changemyview,https://www.reddit.com/r/changemyview/comments/1i7wbcj/cmv_joe_rogan_and_lex_fridman_are_dangerous_and/,1,2025
1hsaw8u,CMV: Non-white countries are a lot more racist than white countries,"Based on my personal experience, what I've been hearing from my relatives, friends and co-workers, and also what I've read online on various forums, blogs, social media posts, I strongly believe that non-white countries are a lot more ignorant toward ""minorities"" or people who are considered non-white. In modern days most white countries would gladly accept immigrants and politically and socially they have dedicated laws and resources that are meant to help immigrants. Since the majority of white countries have a history of colonizing the world, modern history and social culture focus a lot on the sentiment of accepting people who are different than you, or simply the idea of racial/ethnic diversity and inclusion when it comes to representation and treatment. The school system or general education emphasizes on that, and all the organizations and firms would also follow and do the same(even if they have ulterior motive/not being genuine). As long as you grow up in a modern environment, you will learn about racism and that miniorities are perceived as ""vulnerable"" and there is this idea of treating people with respect no matter their cultural background, skin color, language etc.

Most white countries are diverse and have a lot of non-white citizens and migrants who yet to obtain their documents. In contrast, non-white countries are less immigrant-friendly and hence the society generally is not very aware of the aforementioned ideology/concept related to diversity, inclusion, racism etc. 

In Japan for example, there are restaurants can out right say no to people who look foreign(especially those with darker skintones) to them and use the ""no foreigner"" excuse to deny non-Japanese customers in the disguise of xenophobia. Such excuse would not be acceptable in western society. If a restaurant owner from UK, France, U.S, Canada denies someone who is foreign from entering their restaurant just because they are a foreigner or in the worst case that they believe they look foreign by their ethnicity, they will get sued and exposed on social media, and by laws and societal standards they will lose their license to operate. 

A Taiwanese friend of mine also told me that he has experienced way more casual/systematic racism in Congo than in other european countries he has lived in(he travels around because he works as an intepreter for a logistic company). From being stopped by police and asked to pay dirty money since he looks asian, to being denied rental housing even though his paperwork was perfect to Congolese casually pulling their eyes and mimick chinese person speaking, the incident amount is absurd as opposed to what he experienced in Canada, U.S and New Zealand. Such contrast of racist incidents are also reported a lot by my other friends who are from different ethnicities and a particular Pakistani friend who has very dark skin of mine said he was denied multiple jobs when he was working in UAE because his employers outright prefer to hire white caucasian, arab or even east asian workers because ""it makes the company looks more professional"". There are no specific laws that will define prejudice/racism in many context in these countries and even if they are, many can get away with it and the society as whole does not put enough emphasis to fight agianst racial/ethnic discirmination like what the western society does.

In conclusion, I believe non-white countries are a lot more racist than white countries, and its not just limited to casual, day to day personal racism but also systematic racism. (See how China can outright limits the freedom of any ethnic minorities or lock away foreigners as the authority deems so, or that African countries can infringe the rights of white/non-black citizens or that the fact non-white countries do not have enough immigrant politicians in the government because people do not vote for them and they gain no power and favorism even in elections etc).",padorUWU,1880,0.800000011920929,810,1735868750,2025-01-02 19:45:50,changemyview,https://www.reddit.com/r/changemyview/comments/1hsaw8u/cmv_nonwhite_countries_are_a_lot_more_racist_than/,1,2025
1hvu7na,CMV: Western countries are the least racist countries in the world,"So unlike what much of Reddit may want you to believe Western countries by and large are actually amongst the least racist countries on earth. So when we actually look at studies and polls with regards to racism around the world we actually see that the [least racist countries](https://worldpopulationreview.com/country-rankings/least-racist-countries) are actually all Western countries, while the [most racist countries](https://worldpopulationreview.com/country-rankings/most-racist-countries) are largely non-Western countries.

In some of the largest non-Western countries like China or India for example racism is way more prevalant than it is in the West. In China for example they openly show ads like[ this one ](https://www.bbc.com/news/world-asia-china-36394917)on TV and in cinemas, where a Chinese woman puts a black man into a laundry machine and out comes a ""clean"" fair-skinned Chinese man. 

And in India colorism still seems to be extremely prevelant and common place, with more dark-skinned Indians often being systemtically discriminated against and looked down upon, while more light-skinned Indians are typically favored in Indian society.

And Arab countries like Saudi Arabia, Qatar or United Arab Emirates according to polls are among the most racist countries on earth, with many ethnic minorities and migrant workers being systemtically discrimianted against and basically being subjected to what are forms of slave labor. Meanwhile the least racist countries accroding to polls are all Western countries like New Zealand, Canada or the Netherlands.

Now, I am not saying that the West has completely eliminated racism and that racism has entirely disappeared from Western society. Surely racism still exists in Western countries to some extent. And sure the West used to be incredibly racist too only like 50 or 60 years ago. But the thing is the West in the last few decades by and large has actually made enormous progress with regards to many social issues, including racism. And today Western countries are actually by and large the least racist countries in the world.

Change my view. ",RandomGuy92x,1829,0.7900000214576721,895,1736264570,2025-01-07 09:42:50,changemyview,https://www.reddit.com/r/changemyview/comments/1hvu7na/cmv_western_countries_are_the_least_racist/,1,2025
1ibmxfc,CMV: It's entirely reasonable and not hypocritical to doubt the results of the 2024 election,"To be clear, I'm not saying Trump cheated to win the 2024 election. I don't know that and I don't think we ever will know that for certain. And due to the post-election security gaps that is true for every election- though I see no reason to doubt other elections. 

But when a notorious cheater facing prison who was despised by many, who threw a tantrum when he lost the popular vote last time, not only wins an election but wins the popular vote in every single swing state... I think it's reasonable to have some doubts. Especially when it happens after false bomb threats from a foreign power are called into polling places, forcing everybody there to evacuate. 

What's done is done, but given the circumstances I think  more questions should have been raised after the votes were counted and I think it's entirely reasonable and not hypocritical to doubt the results. I'm not saying Trump should be removed from power- I think he's a terrible president and person, but barring concrete evidence of election interference, as far as anybody knows, he was elected fair and square. But at least for me, this election will always have a question mark above it. But I welcome other views on this subject. Change my view. ",ICuriosityCatI,1766,0.7300000190734863,1102,1738019000,2025-01-27 17:03:20,changemyview,https://www.reddit.com/r/changemyview/comments/1ibmxfc/cmv_its_entirely_reasonable_and_not_hypocritical/,1,2025
1hxh0ka,"CMV: If Trump attacked Greenland and Denmark tried to defend it, his government wouldn't survive it","Currently, Denmark is close to perfect US ally...

* They have been NATO Allies for 75 years
* They spend >2 percent of GDP on defence
* They mostly buy American equipment and try
* When US trigerred Article 5, Denmark answered and their troops didn't shy away from combat in most violent parts of Afghanistan and Iraq. They actually had very similar per capita losses to the US in Afghanistan and highest of the non-US countries
* They gave very significant amounts of material to Ukraine, including F-16 fighter jets
* They allow US to have bases on their territory in Greenland and do whatever US wants there
* They have overwhelmingly favourable view of the US and support most of its foreign policy

If Trump decided to attack territory of such a nation, most of the US public would certainly see it as an incredible betrayal and he would have trouble keeping power. If Denmark decided to try to defend Greenland and internet would get flooded with imagery of US forces destroying Danish troops, who are merely defending their border, I don't believe that even the hardline Republican party members would be able to stomach it. 

Moreover, the long standing and mostly mutually beneficial transatlantic partnerships would be completely lost if Trump stayed in power after something like this. 

I think his goverment would collapse pretty much immediately. Change my view!",Downtown-Act-590,1646,0.8299999833106995,1112,1736440993,2025-01-09 10:43:13,changemyview,https://www.reddit.com/r/changemyview/comments/1hxh0ka/cmv_if_trump_attacked_greenland_and_denmark_tried/,1,2025
1icxw1i,CMV: The proposed Strategic Bitcoin Reserve is just a thinly veiled transfer of taxpayer money to current bitcoin holders,"Regarding the proposed strategic bitcoin reserve: 

https://www.nbcnews.com/business/markets/trump-bitcoin-digital-asset-stockpile-strategic-reserve-cryptocurrency-rcna188921

And so much for the idea that bitcoin is supposed to free the financial system from the government.  After the government spends all that taxpayer money buying bitcoin and becomes a large holder of it, it can manipulate the price through transactions on the open market ... open market operations.  Hmmm, that's beginning to sound like a central bank.

This is all just a grift by the new administration to reward cryptobros and cryptovangelists for their support during the campaign. They went hard for him just because the previous administration was more bitcoin-skeptical.",ifuckedyourdaddytoo,1441,0.9700000286102295,192,1738168365,2025-01-29 10:32:45,changemyview,https://www.reddit.com/r/changemyview/comments/1icxw1i/cmv_the_proposed_strategic_bitcoin_reserve_is/,1,2025
1iea3au,CMV: Religion is extremely harmful to humanity as a whole,"Something recently happened in my country that solidified my view on the topic of religion. Basically, an 8 year old diabetic girl died due to her parents and 12 other people who were part of a ""Religious group"" decided to stop giving her insulin and instead pray to god to heal her of her disease. Prior to this, I had figured religion was harmful as it has caused wars, killed millions (possibly billions) of innocent people, caused hate and discrimination for many different groups etc. I also feel like religion is used as a tool of manipulation used to make people seem better than they are, or to justify actions. It also doesn't help that people sometimes ignore parts of holy books such as the bible, but follow others because it's convenient for them to. Tldr, I feel like religion has harmed humanity as it has killed millions of completely innocent people, causes hate and discrimination for many groups and is used as a tool of manipulation to justify people's actions or to make people look better than they are and I don't feel religion does anything to benefit humanity.",Az_30,1430,0.7400000095367432,689,1738311018,2025-01-31 02:10:18,changemyview,https://www.reddit.com/r/changemyview/comments/1iea3au/cmv_religion_is_extremely_harmful_to_humanity_as/,1,2025
1hu9kqs,CMV: Luigi's killing of the UHC healthcare CEO will change nothing about the US healthcare system. ,"UHC's new CEO who was replaced almost immediately with no disruption to business have stated that they will stay the course.

An example of change(Anthem's reversal of their policy to pay less for anesthesia) that was spurred by the killing that is often brought up, was a move in the wrong direction if you look into it.

Link to [Vox Article](https://www.vox.com/policy/390031/anthem-blue-cross-blue-shield-anesthesia-limits-insurance?gad_source=1&gclid=Cj0KCQiAvbm7BhC5ARIsAFjwNHtmbUPqvQCAq7-CFLCd1FEjXjc-RGaA4I2EM2CzIrVMRcWGsP7Hl8MaAj8BEALw_wcB) that briefly explains why.

People online seem to be claiming that the Luigi has bipartisan support(which could be true).

However, more than 50% of voters in the US voted for a felon who had a 'concept of a plan' about healthcare rather than [Kamala's policies](https://www.statnews.com/2024/11/04/kamala-harris-election-win-could-bring-health-care-policy-changes/) which would be a move in the direction of Germany's public healthcare system.

As long as the public's fascination is with the killing of the CEO and not with any centralized, specific legislative plan, nothing will change.",MelonDoodle,1365,0.8899999856948853,529,1736091344,2025-01-05 09:35:44,changemyview,https://www.reddit.com/r/changemyview/comments/1hu9kqs/cmv_luigis_killing_of_the_uhc_healthcare_ceo_will/,1,2025
1i9hqhz,CMV: Democrats need to realize that listing off the unhinged things the Donald Trump says/does won’t get them anywhere as it’s ACTUALLY what his supporters like about him.,"Trump’s supporters watch news about him more closely than anyone else—including factual and true news. They know and even believe many of the wild things he’s said and done, but don’t care. In fact, that’s a feature of him that they prefer. Calling politicians by names and going “off the cuff” is exactly what they are seeking because it’s how they themselves feel.

So when Democrats or Democratic politicians chastise him for being immoral or corrupt, it doesn’t help their cause at all. The information is already out there and his supporters have already absorbed it. It’s nothing new or alarming for them.

All of this outrage about Trump is a waste of time and effort. Instead, Democrats should focus on trying to understand what his supporters really feel and want in order to win them over.",DropKicck,1141,0.8899999856948853,462,1737789827,2025-01-25 01:23:47,changemyview,https://www.reddit.com/r/changemyview/comments/1i9hqhz/cmv_democrats_need_to_realize_that_listing_off/,1,2025
