post_id,title,text,author,score,upvote_ratio,num_comments,created_utc,created_datetime,subreddit,permalink,month,year
1fzi81j,CMV: All transportation should be free out of evacuation zones. ,"Currently there is a massive problem with price gouging by airlines (supposedly now capped...) and it made me think...

If you are under a mandatory evacuation, you should not have to pay to evacuate. You are already likely going to lose your home. You may have no work to return to. You are limited in the possessions you can bring. And now you must also spend hundreds or even thousands of dollars just to leave? 

If an area falls under a mandatory evacuation and you live in that area, the government should be funding all of that. That should be part of FEMA to ensure everyone who has to evacuate doesn't need to worry about how. It would be easier and avoid fraud as well if we just did this up front instead of reimbursing people later. 

You tell the airlines ""there's a major hurricane how many people can you transport out of the area within X time"". Figure out how much it would cost. Create the guidelines for that many people. Do the same with trains and busses. If people are driving out (which should be a last resort because the more people who drive the more people who get trapped) the gas should be freely available. 

Any amount of ""fraud"" in a situation like this would be minimal. People will either pay to travel back or call it lost and stay put or travel somewhere else. You can coordinate with multiple airports/train/bus stations so that people get out of the hurricane zone to designated spots and they can either stay there or they can pay to travel somewhere else.

But they shouldn't have to worry about if they can afford to get out of the initial area. ",adhesivepants,5963,0.9300000071525574,610,1728444000,2024-10-08 22:20:00,changemyview,https://www.reddit.com/r/changemyview/comments/1fzi81j/cmv_all_transportation_should_be_free_out_of/,10,2024
1fz8a7x,"CMV: Western right wingers and islamists would get along great, if it wasn't for ethnic and religious hatred.","They both tend to believe:

* That women should be subservient to men and can't be left to their own devices
* In strict gender roles that everyone must adhere to, or else
* That queer people are the scum of the earth
* That children should have an authoritarian upbringing
* In corporal and capital punishment
* That jews are evil

Because of this, I think the pretty much only reason why we don't see large numbers of radicalized muslim immigrants at, for example, MAGA rallies in the US, or at AfD rallies in Germany, is that western right wingers tend to view everyone from the Middle East and Central Asia as a barabaric idiot with terroristic aspirations, and islamists tend to view everyone who isn't a Muslim as an untrustworthy, degenerate heathen.",Fraeddi,4573,0.7200000286102295,1621,1728415606,2024-10-08 14:26:46,changemyview,https://www.reddit.com/r/changemyview/comments/1fz8a7x/cmv_western_right_wingers_and_islamists_would_get/,10,2024
1fxdrrv,CMV: Elon Musk speaking at a Trump Rally in PA is the greatest gift you could possibly give to the Democratic Party. ,"As the title states. 

Just finished watching the Trump rally in Butler PA… and I am astounded by how out of touch and disconnected it was. 

Obviously, Elon Musk speaking at the event is going to be taking up most of the headlines covering this event. If I were a member of Kamala Harris’ team however, I would be ecstatic about this. 

A major narrative that her team has been trying to create is that a Trump presidency would mean more tax cuts and deferential policy directed towards the wealthiest members of society, all at the expense of everyday, working people. 

Based on this fact, it seems really counter-intuitive for the Trump campaign to openly play into this obvious talking point that the Harris team has created. Musk has been outspoken about his support on Twitter… but speaking at a Trump campaign rally is a MASSIVE change. 

What would be the rationalization to justify making this decision, which I view to be a complete mistake… Obviously Musk didn’t just show up, this was a coordinated campaign event. Seems really strange for both Musk (who’s car business has always been heavily dependent on Democratic support for electric vehicles) and Trump to make this decision so close to the election. 



",Doub13D,2620,0.7699999809265137,788,1728211642,2024-10-06 05:47:22,changemyview,https://www.reddit.com/r/changemyview/comments/1fxdrrv/cmv_elon_musk_speaking_at_a_trump_rally_in_pa_is/,10,2024
1g8zgxy,CMV: Malcolm X was correct about the white American liberal.,"I am not a conservative or a Trump supporter, I am simply tired of liberals now being seen as some kinf of ultimate good compared to the devils on the conservative side.

Malcolm x said that the White American who identifies as a liberal is the most ‘dangerous’ and ‘deceitful’ thing in the Western Hemisphere. He said that the issues concerning black Americans were raised by white liberals as part of a vicious power politics to get back at the white conservatives. In his own words, the liberals do so in order to gain power or retain power. 

This is fully seen in how the liberal of today talks about social justice and moral issues especially on Reddit. Issues that would traditionally be seen as important to liberals causes that affect minorities, and other contentious issues are thrown out the window as soon as it seems it may hurt the chances of a Democrat winning the election.

Malcolm said that conservatives are like wolves who make their intention to destroy you plain and compared liberals to foxes that hide their hand and plot when attempting to eat you. Many liberals on Reddit say things like if you even question Whether the democratic option is a good choice or matches your policies than you are aligned with fascism or don’t care about women/whichever other vulnerable demographic they can use as a card. This is manipulative and is reflective of Malcolm’s argument.

“The American negro is nothing but a political football and the white liberals control this ball. Through tricks, tokenism, and false promises of integration and civil rights…,” he remarked. Although he is talking about black people it applies to women, LGBTQ people, and more recently Arab communities. When it’s in fashion and low stakes, then it’s okay to criticize Israel for their crimes but when it’s election time we have to ignore all of their faults and behave as their #1 supporter.

This is the same behavior that Susan b Anthony behaved in when she joined white conservatives to lift up women at the cost of the allyship with enslaved people and abolitionists.",Expert-Diver7144,2485,0.7200000286102295,1582,1729541461,2024-10-21 15:11:01,changemyview,https://www.reddit.com/r/changemyview/comments/1g8zgxy/cmv_malcolm_x_was_correct_about_the_white/,10,2024
1fz67ym,CMV: Haiti is not a failed state but a victim of colonization and revenge,"With the recent tragedies going on in Haiti due to gang violence and the assassination of the i president many people on this site have referred to the country as a failed nation and asked what could’ve happened to bring them to this state. I think this is an ignorant position that makes light of history.

Haiti was a slave nation where people who were stolen from Africa were traded and made to work under threat of violence rape castration lynching and murder. When they orchestrated one of the first major successful slave rebellion, pushing back the French, and allowing for the Louisiana purchase to occur they were not only not welcomed into the rest of the world but brutally punished and forced to pay back “reparations” to the French. 

The enslaved people of Haiti were forced to pay money to the people who killed, raped, and enslaved them and this debt was not paid off for 122 years. Under threat of warship they were told to pay back more than 10x the cost of the Louisiana purchase. The equivalent of 20-30 billion dollars.

Thomas jefferson worked to isolate Haiti diplomatically and strangle it economically, fearing that the success of Haiti would inspire slave revolts back home. Haitian success was perceived as a threat to slavery in America for decades, and the United States didn't officially recognize Haiti until 1862, as slavery began being abolished.

The United States  worked to isolate a newly independent Haiti during the early 19th century and violently occupied the island nation for 19 years in the early 20th century. While the U.S. officially left Haiti in 1934, it continued to control Haiti's public finances until 1947, siphoning away around 40% of Haiti's national income to service debt repayments to the U.S. and France.

This means that while other countries were taking advantage of the various and exponentially quick technological revolutions, Haiti was trying to pay its way out of a fictional and racist debt “owed” to slave holders at gunpoint. 

If you add on the effects of natural disasters and the earthquake as well as the fact their president was murdered by foreign mercenaries. It makes sense that they would be in this position, and they deserve empathy not the designation of a failed state. 



",Expert-Diver7144,2311,0.699999988079071,796,1728410433,2024-10-08 13:00:33,changemyview,https://www.reddit.com/r/changemyview/comments/1fz67ym/cmv_haiti_is_not_a_failed_state_but_a_victim_of/,10,2024
1gehf05,CMV: Muslims and the Qu'ran itself have too many non-democratic and unacceptable standpoints to be supported in secular western countries,"Before saying anything else, I'm going to tell you that most of my viewpoints are based on empirical evidence that I and those around me have collected over the past years and not on looking deeper into muslim culture and reading the Qu'ran, which I'm planing to do at a later point.

I live in Germany, in a city that has both a very large support for homosexuality and the lgbtq community, as well as a large amount of muslims. An overwhelmingly large amount of the muslims I met in my life have increadibly aggressive views on especially the lbtq-community and jewish people, constantly using their religion as reasoning for their hatred. I know that this problem isn't exclusive to Islam, but christians tend to have a much less aggressive approach to these topics because of principles like charity and taking a hit to the other cheek. Muslims on the other hand oftenly take a much more aggressive approach, presumably because of their principles of an eye for an eye and the high importance of the jihad. 

Furthermore, people from muslim countries tend to be harder to immigrate than almost all other cultures, because of their (depending on the school) strict religious legislation on the behavior of women, going as far as women not being allowed to talk to any people outside, leading to generations of people not even learning our language and never socialising with the native germans at all, in spite of many (free) possibilities to do so. Many also oppose the legitimacy of a secular state and even oppose democracy in general, because it doesn't follow the ruling of their religion, which emphasizes that only muslim scholars should rule the state. 

While I tried to stay open to most cultures throughout my life, I feel like muslims especially attempt to never comprimise with other cultures and political systems. Not based on statistics, but simply my own experience in clubs and bars in cologne (the city I live in), the vast majority of fights I've seen happen, have been started by turkish or arab people. I've seen lots of domestic violence in muslim families too and parents straight up abondening and abusing their children if they turned out to be homosexual or didn't follow religious rulings.

I know that this problem isn't exclusive to Islam, but barely any other culture is so fierce about their views. I'm having a hard time accepting and not opposing them on that premise.

Nonetheless, I feel like generalization is rarely a good view to have, so I hope some of you can give me some insight. Is it really the culture, or did I just meet the wrong people?",RetepExplainsJokes,1890,0.75,800,1730160592,2024-10-28 19:09:52,changemyview,https://www.reddit.com/r/changemyview/comments/1gehf05/cmv_muslims_and_the_quran_itself_have_too_many/,10,2024
1g016fw,CMV: Being pro-Palestine is not antisemitic,"I suppose most of this line of thinking is caused by the people who want to erase Israel from the map entirely along with its Jewish inhabitants which is as antisemitic as it gets, so to clear up, I mean pro-Palestine as in: against having innocent Palestinians barely surviving in apartheid conditions and horrified by 40 000 people (and other 100 000 injured) being killed and it being justified by many / most of the world as rightful protection of the state. I am not pro-Hamas, I can understand a degree of frustration from being in a blockade for years, but what happened on October 7 was no doubt inhumane... but even calling what's been happening over the past year a war feels for how one-sided is the conflict really feels laughable (as shown by the death toll).  
  
I browsed the Jewish community briefly to try to see another point of view but I didn't expect to see the majority of posts just talking about how every pro-Palestinian is uneducated, stupid, suspectible to propaganda and antisemitic. Without explaining why that would be, it either felt like a) everyone in the community was on the same wave-length so there was no need to explain or b) they just said that to hate on anyone who didn't share their values. As an outsider, I want to give them the benefit of the doubt and say that it's possible that I hold my current views because I'm ""uneducated"", I have admittedly spent only a relatively short amount of time trying to understand the conflict and I'm not very good with keeping historical facts without having them written somewhere... but again, I reserve my right to identify what goes against basic human principles because it shouldn't ever be gatekept, so I doubt any amount of information would be able to make me switch 180 degrees suddenly, but there is room for some nuance. 

Anyway, I'm assuming the basic gist is: being pro-Palestine > being anti-Israel > being anti-Zionist > being antisemitic (as most Jews are in fact Zionists). I find this assessment to having made a lapse of judgement somewhere along the way. Similarly to how I'm pro-Palestinian civilians trapped in Gaza, I'm not anti-Israel / Jewish people, I am against (at least morally, as I'm not a part of the conflict) what the Israel government is doing and against people who agree with their actions. I'm sorry that Jewish people have to expect antisemitism coming from any corner nowadays, as someone who is a part of another marginalized community I know the feeling well, but assuming everyone wants me dead just fuels the ""us vs them"" mentality. Please CMV on the situation, not trying to engage in a conflict, just trying to see a little outside my bubble.",settonsy,1744,0.6499999761581421,2335,1728505439,2024-10-09 15:23:59,changemyview,https://www.reddit.com/r/changemyview/comments/1g016fw/cmv_being_propalestine_is_not_antisemitic/,10,2024
1fz6425,CMV: Presidential Debates should have LIVE Fact Checking,"I think that truth has played a significant role in the current political climate, especially with the amount of 'fake news' and lies entering the media sphere. Last month, I watched President Trump and Vice President Harris debate and was shocked at the comments made by the former president.

For example, I knew that there were no states allowing for termination of pregnancies after 9 months, and that there were no Haitian Immigrants eating dogs in Springfield Ohio, but the fact that it was it was presented and has since claimed so much attention is scary. The moderators thankfully stepped in and fact checked these claims, but they were out there doing damage.

In the most recent VP Debate between Walz and Vance, no fact checking was a requirement made by the republican party, and Vance even jumped on the moderators for fact checking his claims, which begs the question, would having LIVE fact checking of our presidential debates be such a bad thing? Wouldn't it be better to make sure that wild claims made on the campaign trail not hold the value as facts in these debates?

I am looking for the pros/cons of requiring the moderators to maintain a sense of honesty among our political candidates(As far as that is possible lol), and fact check their claims to provide viewers with an informative understanding of their choices.

I will update the question to try and answer any clarification required.

",DK-the-Microwave,1515,0.8299999833106995,744,1728410161,2024-10-08 12:56:01,changemyview,https://www.reddit.com/r/changemyview/comments/1fz6425/cmv_presidential_debates_should_have_live_fact/,10,2024
1gdi4gm,CMV: Allowing children to become morbidly obese is child abuse. ,"As the title states, parents that allow their children to become morbidly obese are abusing them and should be treated as abusive parents. That includes CPS involvement and possibly loss of custody. 

In regards to the type of abuse, I believe that allowing a child to be some obese falls under “neglect.” Neglect occurs when a person responsible for the care of another person does not provide needed care or leaves them without care. In this instance, the parents are not providing the needed care, which I believe is a healthy diet/exercise regiment needed to maintain a healthy weight. 


While I think that enabling obesity could also be categorized as physical abuse because it causes bodily injures, I think that this falls short of the definition of physical abuse because there is a lack of direct physical contact by the abuser. With that said, I am open to a different opinion on this point as it could be argued that the physical symptoms of allowing a child to become obese is still physical abuse even if the abuser doesn’t inflict the injury with direct bodily contact. 

So how should this abuse be addressed by officials? First, CPS should be involved and allowed to investigate the reasons behind a child’s morbid obesity. If it does result from neglect, then the parents should have to work with professionals to address the issue. The cost of this care would be dependent upon the families financial situation. Failure to do so, and or failure to improve the child’s weight would result in a loss of custody. 

Maybe this is just crazy? Change my view. 





",Sicily_Long,1470,0.8700000047683716,584,1730054842,2024-10-27 13:47:22,changemyview,https://www.reddit.com/r/changemyview/comments/1gdi4gm/cmv_allowing_children_to_become_morbidly_obese_is/,10,2024
1g5ebf6,CMV: States shouldn’t simultaneously have no-knock warrants and a castle doctrine,"No-knock warrants allow law enforcement to enter a property without prior notification (knocking or announcing their presence).

Castle doctrine laws give individuals the right to use force, including deadly force, to defend themselves in their home without the duty to retreat.

Many states have some nuance with these laws but a lot of states have an overlap where they allow both of these to simultaneously exist. Texas for example has both.

This post is NOT arguing for one or the other but rather the fact that they both shouldn’t coexist.

If they coexist, it introduces a potential deadly threat to both law enforcement and the person defending their home and bystanders. In a scenario where law-enforcement gets a no-knock warrant and attempts to go through, the person can defend their home to this unknown intruder. This can of course lead to a gun fight.

Maybe this is a popular opinion but the fact that 30+ states have this overlap is mind boggling.",bernful,1333,0.949999988079071,550,1729124755,2024-10-16 19:25:55,changemyview,https://www.reddit.com/r/changemyview/comments/1g5ebf6/cmv_states_shouldnt_simultaneously_have_noknock/,10,2024
1fzuimf,CMV: Florida Real Estate Will Collapse Within The Next Few Years,"The insurance crisis in Florida already quite bad, and with Milton, it's [poised to get even worse.](https://www.fox9.com/news/hurricane-milton-florida-homeowners-insurance) 

We're reaching a tipping point where either homes become completely uninsurable or the insurance becomes so expensive that homes start losing value. 

This will precipitate a death spiral, where homeowners start to realize that buying or owning a home in Florida is not a good investment and they'll leave the state. Supply will increase as demand falls. 

I will add one caveat here and it's that the federal government could step in and rescue Florida through a subsidized insurance scheme, but the politics of this are really iffy. Republicans would be most incentivized to save the state, but such intervention is also against Republican orthodoxy. 

So, CMV, barring some federal intervention, the Florida housing market is cooked. ",tomtomglove,1240,0.9100000262260437,394,1728488702,2024-10-09 10:45:02,changemyview,https://www.reddit.com/r/changemyview/comments/1fzuimf/cmv_florida_real_estate_will_collapse_within_the/,10,2024
1fzfefy,CMV: If you hold a government elected office and spread disinformation that is completely ludicrous you should be removed from your position immediately.,I find it absolutely stunning that there are no elected officials stating that the hurricane is being controlled by Vice President Harris. It's ludicrous but it's also dangerous because we know that there is a large population of people out there that are willing to believe anything. I think they know that it's ludicrous and they're using it for that particular purpose. I think they should be removed from office and barred from ever holding office again. And if they truly believe this they still need to be removed from office because they're obviously not mentally stable enough to hold a government office.,Patri100ia,1188,0.8999999761581421,204,1728434988,2024-10-08 19:49:48,changemyview,https://www.reddit.com/r/changemyview/comments/1fzfefy/cmv_if_you_hold_a_government_elected_office_and/,10,2024
