post_id,title,text,author,score,upvote_ratio,num_comments,created_utc,created_datetime,subreddit,permalink,month,year
1hu8iop,CMV: The United States should continue to send aid to Ukraine,"I don’t understand why Republicans are killing Ukraine aid. I don’t mean to sound like the liberal who just complains about republicans either, please don’t just agree with me in the comments and crap on conservatives, I actually do not understand why they believe we should stop sending money to Ukraine. The arguments against it as I’ve heard have been:

1. We should be spending it here in America. Which I don’t understand why the 60billion that was proposed was too much foreign aid as it is roughly 1% of the budget. The U.S. military receives dozens of times more money in our annual budget to accomplish the same goal as the aid to Ukraine: protect American, our allies and our interests around the world.

2. The war has gone on long enough and we should stop funding a brutal meat grinder. I could be on board with this if it weren’t for the fact that A. Ukraine is the country that was invaded B. We supplied the saudis long protracted war against the Houthis that went nowhere and we’ve been giving Israel billions in aid money for decades just so they can fight a never ending war. Yet for some reason the war that involves the largest source of misinformation and propaganda is the one people have grown tired of?

As for the affirmative case I think it’s as simple as Russia is an adversarial near peer threat and every bullet that we send Ukraine we degrade their capabilities to compete with us in other areas of the world.",Thebeavs3,684,0.7099999785423279,2255,1736088353,2025-01-05 08:45:53,changemyview,https://www.reddit.com/r/changemyview/comments/1hu8iop/cmv_the_united_states_should_continue_to_send_aid/,1,2025
1hyihsz,CMV: Bans on car sales direct to consumers is bad for consumers and used to prop up car dealerships,"In most U.S. states it is actually illegal to sell automobiles directly to consumers from manufacturers. This practice dates from the early 20th century when car manufacturers were much less standardized and lawmakers believed the layman at the time would have no knowledge of engines or machinery and could be taken advantage of. The idea was that a middle man wouldn’t be interested in a certain car maker and would just try and sell the best cars to the most people for the most money. Ironically now that the baseline consumers knowledge about cars has increased the dealerships are taking advantage of consumers. Because every car has to be sold through dealerships the dealers have all the power, they ostensibly provide no value to the consumer and jack up the price on cars so they can make their profit.",Thebeavs3,676,0.9800000190734863,163,1736552549,2025-01-10 17:42:29,changemyview,https://www.reddit.com/r/changemyview/comments/1hyihsz/cmv_bans_on_car_sales_direct_to_consumers_is_bad/,1,2025
1i852w8,"CMV: the term “Nazi” is an entirely appropriate approximate description of Trumpist Republicans based on a contemporaneous understanding of Nazi ideology, rather than a retrospective one.","Nazi isn't a generic slur. Neither does it require perfect specificity. Fascism itself is a collection of broad ideological goals, political tendencies, tactics, and aesthetics.

The idea of the Nazi as a cartoonishly evil villain stems from our retrospective understanding of what Nazism ultimately achieved. But for the average German citizen in the late 1920s-early 1930s, Nazism would have looked remarkably similar to Trumpism. The major exceptions are the nationalization of corporations and the explicit naming of Jews in the platform. The fact that today's GOP is smart enough to build on the Atwater/Nixon/Reagan Southern Strategy and not specifically call out racial and ethnic groups is a matter of tactics and degrees -- not a meaningful difference in ideology. In addition, you don't need to nationalize industry when you have a corporate oligarchy -- you can preserve the mythologies of capitalism while enjoying the benefits of corporate socialism. 

While some people may have reasonable concerns about the (over)use of the term ""Nazi"" to describe the American right today, many people who are pushing back against this language simply want cover to flirt with ideas and policies German Nazis would have loved. To advance the ideas without the label so those ideas appear respectable -- so they can rail against immigrants and trans people, remain in polite society and make extremism more acceptable. The rest are just pedants.

Here is the pre-war Nazi party platform:

1. We demand the union of all Germans in a Greater Germany on the basis of the right of national self-determination.
2. We demand equality of rights for the German people in its dealings with other nations, and the revocation of the peace treaties of Versailles and Saint-Germain.
3. We demand land and territory (colonies) to feed our people and to settle our surplus population.
4. Only members of the nation may be citizens of the State. Only those of German blood, whatever their creed, may be members of the nation. Accordingly, no Jew may be a member of the nation.
5. Non-citizens may live in Germany only as guests and must be subject to laws for aliens.
6. The right to vote on the State’s government and legislation shall be enjoyed by the citizens of the State alone. We demand therefore that all official appointments, of whatever kind, whether in the Reich, in the states or in the smaller localities, shall be held by none but citizens.
We oppose the corrupting parliamentary custom of filling posts merely in accordance with party considerations, and without reference to character or abilities.
7. We demand that the State shall make it its primary duty to provide a livelihood for its citizens. If it should prove impossible to feed the entire population, foreign nationals (non-citizens) must be deported from the Reich.
8. All non-German immigration must be prevented. We demand that all non-Germans who entered Germany after 2 August 1914 shall be required to leave the Reich forthwith.
9. All citizens shall have equal rights and duties.
10. It must be the first duty of every citizen to perform physical or mental work. The activities of the individual must not clash with the general interest, but must proceed within the framework of the community and be for the general good.
We demand therefore:
11. The abolition of incomes unearned by work.
The breaking of the slavery of interest
12. In view of the enormous sacrifices of life and property demanded of a nation by any war, personal enrichment from war must be regarded as a crime against the nation. We demand therefore the ruthless confiscation of all war profits.
13. We demand the nationalization of all businesses which have been formed into corporations (trusts).
14. We demand profit-sharing in large industrial enterprises.
15. We demand the extensive development of insurance for old age.
16. We demand the creation and maintenance of a healthy middle class, the immediate communalizing of big department stores, and their lease at a cheap rate to small traders, and that the utmost consideration shall be shown to all small traders in the placing of State and municipal orders.
17. We demand a land reform suitable to our national requirements, the passing of a law for the expropriation of land for communal purposes without compensation; the abolition of ground rent, and the prohibition of all speculation in land.
18. We demand the ruthless prosecution of those whose activities are injurious to the common interest. Common criminals, usurers, profiteers, etc., must be punished with death, whatever their creed or race.
19. We demand that Roman Law, which serves a materialistic world order, be replaced by a German common law.
20. The State must consider a thorough reconstruction of our national system of education (with the aim of opening up to every able and hard-working German the possibility of higher education and of thus obtaining advancement). The curricula of all educational establishments must be brought into line with the requirements of practical life. The aim of the school must be to give the pupil, beginning with the first sign of intelligence, a grasp of the notion of the State (through the study of civic affairs). We demand the education of gifted children of poor parents, whatever their class or occupation, at the expense of the State.
21. The State must ensure that the nation’s health standards are raised by protecting mothers and infants, by prohibiting child labor, by promoting physical strength through legislation providing for compulsory gymnastics and sports, and by the extensive support of clubs engaged in the physical training of youth.
22. We demand the abolition of the mercenary [i.e. professional] army and the formation of a people’s army.
23. We demand legal warfare on deliberate political mendacity and its dissemination in the press. To facilitate the creation of a German national press we demand:
(a) that all editors of, and contributors to newspapers appearing in the German language must be members of the nation;
(b) that no non-German newspapers may appear without the express permission of the State. They must not be printed in the German language;
(c) that non-Germans shall be prohibited by law from participating financially in or influencing German newspapers, and that the penalty for contravening such a law shall be the suppression of any such newspaper, and the immediate deportation of the non-Germans involved.
The publishing of papers which are not conducive to the national welfare must be forbidden. We demand the legal prosecution of all those tendencies in art and literature which corrupt our national life, and the suppression of cultural events which violate this demand.
24. We demand freedom for all religious denominations in the State, provided they do not threaten its existence nor offend the moral feelings of the German race.
The Party, as such, stands for positive Christianity, but does not commit itself to any particular denomination. It combats the Jewish-materialist spirit within and without us, and is convinced that our nation can achieve permanent health only from within on the basis of the principle: The common interest before self-interest.
25. To put the whole of this program into effect, we demand the creation of a strong central state power for the Reich; the unconditional authority of the political central Parliament over the entire Reich and its organizations; and the formation of Corporations based on estate and occupation for the purpose of carrying out the general legislation passed by the Reich in the various German states.
The leaders of the Party promise to work ruthlessly—if need be to sacrifice their very lives—to translate this program into action.

",reddituserperson1122,671,0.699999988079071,752,1737643967,2025-01-23 08:52:47,changemyview,https://www.reddit.com/r/changemyview/comments/1i852w8/cmv_the_term_nazi_is_an_entirely_appropriate/,1,2025
1i83dj7,"CMV: ""Nazi” isn’t a slur","Nazi” isn’t a slur. It’s a word that describes real people who earnestly believe in their ideas. Their ideas are disgusting and hateful, but of course, they often do not realize it. 



I keep running into racists who think that it’s not white supremacists to believe that white people are inherently superior to other races. No…that’s the whole definition!! The fact that they believe it earnestly and don’t think it’s an idiotic, hateful belief doesn’t mean it’s not an idiotic, hateful belief.



Nazi isn’t a word that means “bad boogeyman” it means “someone who believes in their racial superiority, extreme protectionist nativism, the purifying of society by eliminating undesirables, expansionism, active suppression of dissent, and total state power held in the hands of a tiny group.”



Ensure the people you’re cheering for don’t believe these things because otherwise…",Nice_Substance9123,670,0.7599999904632568,1152,1737639027,2025-01-23 07:30:27,changemyview,https://www.reddit.com/r/changemyview/comments/1i83dj7/cmv_nazi_isnt_a_slur/,1,2025
1hvpmcx,"CMV: With the same reasoning as the US TikTok ban, European countries ought to ban American social media","As far as I understand, the US Congress is trying to ban TikTok because they believe that a big Chinese-owned social media site/app is dangerous because the Chinese government might use it to spy on Americans and push propaganda to them.

I am not trying to be pro-China nor anti-China, but it is undeniable that the political relations between the USA and China are not great, and they are likely to get worse under the new Trump regime. Hence it is within the realm of reason for Americans to be be wary of Chinese agendas. (Again, I do not mean to be anti-Chinese.)

However, in my opinion, all the arguments I have heard about Chinese social media also apply to American social media. From my perspective as a European, the USA is a foreign power led by a dangerously unpredictable right-wing extremist. Elon Musk (who controls Twitter) is a close Trump-supporter, and as far as I can tell Mark Zuckerberg (who controls Facebook) also supports Trump. I don't know about the owners of other major social media such as YouTube or Reddit, but I do not trust any of these people. Any of these might ally with Trump and use their platforms to spread propaganda to support a Trumpist ideology. That could cause a lot of damage to my country and others.

If Chinese-owned social media are dangerous, then American-owned social media are just as dangerous. Especially under Trump, but also without Trump. Hence, if it is reasonable for the US Congress to regulate or ban TikTok, then it is just as reasonable for European countries to regulate or ban American-owned social media such as Twitter, Facebook, YouTube, and also Reddit. 

(One problem, of course, would be that there is not much left. But I am not worried about that. In a hypothetical scenario where the EU bans all non-EU-controlled social media, a few EU-based ones would soon rise to replace them.)

What I have said about European countries may also apply elsewhere; I am hesitant to generalize.",SpectrumDT,605,0.7599999904632568,418,1736250227,2025-01-07 05:43:47,changemyview,https://www.reddit.com/r/changemyview/comments/1hvpmcx/cmv_with_the_same_reasoning_as_the_us_tiktok_ban/,1,2025
1icj9o3,"CMV: If Muslims are upset about Cordoba being a Church and not sharing it with them, then they should give Christians back Hagia Sophia or they should share Al Aqsa with the Jews.","I have seen many Muslims complain online about how Christians have just stolen their mosque, now called the Cathedral of Our Lady of the Assumption. Yet, Muslims forget that the site was originally dedicated to St Vincent of Saragossa, but was demolished by the Umayyads after they conquered Spain. Also, the Church-Mosque of Cordoba has been a church for over 500 years, which is the same argument use for their defense of previously Christian Churches that became mosques, in the Ottoman Empire. Muslims complain that the building had been Muslim mosque longer than it has been a church, since it was built in 785. Yet Hagia Sophia, a cathedral built under Justinian in 537, and had served as a Christian church for 900 plus years, which is about 250 years longer than Cordoba had been a mosque. Also, Al Aqsa had been used by Jews for worship since before Islam and Christianity were religions. Yet, Muslims have prohibitted Jews from entering the site. What I am trying to say is, that Muslims are being hypocrites if they want Christians to return former mosques, yet they think it is completly fine to keep former Christian churches as mosques, and not return them",St_Gregory_Nazianzus,598,0.8199999928474426,215,1738117094,2025-01-28 20:18:14,changemyview,https://www.reddit.com/r/changemyview/comments/1icj9o3/cmv_if_muslims_are_upset_about_cordoba_being_a/,1,2025
1ibbe8c,"CMV: Colonialism was basically inevitable and some other power would eventually do it, if Western Europe didn't","From 16th century onwards, European powers had a really unique combination of opportunity and necessity. They had the means to start colonizing large swaths in the rest of the world and it perfectly fitted the economic needs of the slowly industrializing society. 

What on the other hand wasn't at all uncommon around the world was the desire for conquest and power and complete lack of morals towards achieving these goals. Be it the Qing China, the Mughals or the Ottomans, you would find countless examples of militaristic empires willing to enslave, exploit or genocide anyone standing in the way of their goals. Most African or American empires were maybe less successful, but hardly morally better in this regard.

Even if Europeans somehow decided to not proceed with colonizing the rest of the world, it was only a matter of time until another society undergoing industrialization needs the resources and markets and has the naval power to do exactly what the Europeans did. There was no moral blocks, which would prevent this from happening. 

If the Americas didn't get taken by the Europeans, they would simply face industrialized China or India a few hundred years later. Or maybe it would be the other way around. But in the fragmented world of the past, a  clash would eventually occur and there would probably be a winner. 

I think that colonialism is basically an inevitable period in human history. Change my view!",Downtown-Act-590,596,0.8100000023841858,324,1737990948,2025-01-27 09:15:48,changemyview,https://www.reddit.com/r/changemyview/comments/1ibbe8c/cmv_colonialism_was_basically_inevitable_and_some/,1,2025
1ib2o29,CMV: Donald Trump is playing everyone,"I’ve been following him from afar for a while trying to get my head around the whole phenomenon and understand it.

Essentially it’s ‘fear’, he’s inciting people’s basic instincts talking about various boogeymen, immigrants, weak leaders, real fears that people have and mainly to amplify those in his base to distract them from his real motives (picking their pockets)

But it’s actually not his nature, he’s only scared of being laughed at. He’s not actually scared of immigrants or DEI hires or trans people himself.  He’s a rich well socialised guy who just basically wants to feel important and grab money.

He is using his tough guy image as a negotiating tactic to try and throw weight around, and it’s working as people are actually believing he’s crazy and destructive, and he will even do things until people complain.

He’s not sure how to actually do anything so he’s just saying a lot and listening to what latches on in people and what they say, just spitballing.

He’s won’t intentionally start a war as he’s scared of conflict but also stupid enough to do by mistake ",wild_crazy_ideas,577,0.6600000262260437,567,1737963343,2025-01-27 01:35:43,changemyview,https://www.reddit.com/r/changemyview/comments/1ib2o29/cmv_donald_trump_is_playing_everyone/,1,2025
1i25vp1,"CMV: ""I disapprove of what you have to say, but I will fight for your right to say it"", is a good principle for society.","I am relative purist when I comes to free speech. Whilst I accept there are some limitations, I think I these are fringe cases (violence, libel).

I think broadly society should have a mutually understood principle that even if you disagree or disapprove of someone's speech, they have the right to say it.

This includes supposed 'misinformation' and 'hate speech'.

As John Stuart Mill makes clear in On Liberty ""he who knows only his own side of the case knows little of that"", and ""“If all mankind minus one were of one opinion, and only one person were of the contrary opinion, mankind would be no more justified in silencing that one person, than he, if he had the power, would be justified in silencing mankind.”

Hate speech is a poorly worded and fascial set of legislation in the UK that can be used to prosecute anyone (including a young girl posting lyrics to a rap song and many teaching his dog to nazi salute as a joke - both of which have been arrested and prosecuted, though the former was released on appeal).

Ultimately a functioning society requires us to appreciate others views and allow them the space to air their beliefs, even if we believe they are wrong. ",Fando1234,552,0.8399999737739563,582,1736970173,2025-01-15 13:42:53,changemyview,https://www.reddit.com/r/changemyview/comments/1i25vp1/cmv_i_disapprove_of_what_you_have_to_say_but_i/,1,2025
1ie7pyp,cmv: the New York Times paywall is actively doing harm,"I don’t personally hold the NYT in any kind of significant reverence- to me it’s really just another mostly objective media conglomerate pandering to a billionaire in charge. But I do think that blocking access to updates on current events and relevant fact checking data is very dangerous for a country that already lacks enough critical thinking and discernment to investigate credible news sources. 

 I obviously don’t expect journalism to all of a sudden \~develop scruples\~ but I’ve been thinking a lot about current news source accessibility, fearmongering, and boomers getting all their news on facebook and needed somewhere to yell about it ",tortured_mulder,504,0.8500000238418579,221,1738301058,2025-01-30 23:24:18,changemyview,https://www.reddit.com/r/changemyview/comments/1ie7pyp/cmv_the_new_york_times_paywall_is_actively_doing/,1,2025
1i86unn,"CMV: I’m Afraid This Administration Will Make Life Substantially Worse for Black Americans, and I Don’t Know If There’s a Line They Won’t Cross","I’m scared, and I’m looking for reassurance. As a Black person, I’ve already concluded that Trump and Elon Musk are racist, based on their actions and statements. What I’m struggling with is this fear that life under this administration will get substantially worse for people like me—and that their supporters won’t ever draw a line, no matter how bad things get.

Here are some things that have already happened or seem to be in the works:
	
Ending Equal Opportunity Programs: Trump revoked policies aimed at promoting racial equity in hiring and government programs.

Stop-and-Frisk: He signed an executive order encouraging its return, which disproportionately impacts Black and brown communities.
	
Wildfire Risks: Water is being rerouted from Northern California, a region that hasn’t had major wildfires in years, to Central California. This feels like it’s putting lives at risk unnecessarily.
	
Elon Musk’s Nazi Affiliation: Musk has amplified neo-Nazi accounts on Twitter, seemingly supported Germany’s far-right party, and even made what looks like a Nazi salute at a public event.

I’m terrified of what this could escalate to. Discrimination in hiring might push more Black people into desperate situations like selling drugs or stealing to survive. With policies like stop-and-frisk, that could mean more of us ending up incarcerated. My biggest fear is that there’s no “step too far” for their supporters. Would things like migrant camps or even more explicit authoritarian measures finally make people realize this is heading into Nazi territory? Or will they just keep defending every action?

I’m not asking for someone to convince me these people aren’t racist—I’m already past that. I just want to believe that there’s a line they can’t cross, that legal systems, public resistance, or something will stop things from spiraling further.

Can anyone reassure me that there’s hope? Or convince me that this won’t make my life—and the lives of Black Americans—substantially worse?",Scary-Ad-1345,495,0.6000000238418579,1865,1737648586,2025-01-23 10:09:46,changemyview,https://www.reddit.com/r/changemyview/comments/1i86unn/cmv_im_afraid_this_administration_will_make_life/,1,2025
