post_id,title,text,author,score,upvote_ratio,num_comments,created_utc,created_datetime,subreddit,permalink,month,year
165gf8q,"CMV: Most ""inclusive"" spaces online are one of the most bigoted and discriminatory places you can be.","So any sub or space online claims to be ""inclusive"" ""tolerant"" blah blah are one of the most prejudiced hate filled, bigoted spaces. The thing is if you say anything remotely different than what they want you to say they will ban you, remove your comments. But aren't these places supposed to be inclusive? I am still the same female, bisexual, poc etc that they claim to protect so why is my opinion not important when I don't agree with them.

I'd rather be in a sub where free speech is allowed and I say this while fitting the description of the users they claim to protect,if you dare to say anything against them they will literally make a mob and attack you and I am not even conservative/right wing.
Most inclusive spaces are where people genuinely want to listen to what you say and inclusive spaces are not that.",alienalien24,2286,0.7599999904632568,2022,1693406044,2023-08-30 09:34:04,changemyview,https://www.reddit.com/r/changemyview/comments/165gf8q/cmv_most_inclusive_spaces_online_are_one_of_the/,8,2023
15f26d4,CMV: Neopronouns are pretentious,"Before I get roasted by everyone just hear me out. I am a liberal, I am not transphobic and I respect trans people and trans rights. I also respect if female presenting people want to go by he/him/they/them and if male presenting people want to go by she/her/they/ them.

What I cannot stand are neopronouns like xe/xem/xyr, ze/hir/hirs, and ey/em/eir. You can't just make up all of these little words and expect people to remember and use them. I get that some people are non-binary, and that's fine by me! But I feel like using they/them is sufficient because it indicates that you don't feel like a male or a female, and it's still an actual English word.

Like, what is a xyr? I refuse to believe that anyone could feel like a word they just made up. It sounds like some kind of creature from Lord of the Rings.

I believe in being tolerant of other peoples self expression, but there is also a limit as to what qualifies as reasonable self expression.",worminthebud,1274,0.8399999737739563,908,1690864329,2023-07-31 23:32:09,changemyview,https://www.reddit.com/r/changemyview/comments/15f26d4/cmv_neopronouns_are_pretentious/,8,2023
166f071,Cmv: Religion has done more harm than good for humanity.,"This is most likely a biased opinion as I grew up non-religious, but as i’ve observed the world I see religion as an agent of mass violence and hatred for the world. I don’t deny the great things that religious motivations have done for the world- art, literature, culture, healthcare, donations, you name it- but it seems to me that a large portion of conflicts TODAY are based on religious disagreements spanning thousands of years. The mass killings throughout history done in “the name of god”, the persecution of minority groups like the LGBTQ+, the denial of science and silencing of great thinkers working to advance humanity, and the mixing of religion and government to create harmful legislation have contributed to my perception that religion has had a net negative impact on humanity. I would be super interested to here any evidence against my point, I appreciate any responses in advance!",BigBananaBoi256,1186,0.6800000071525574,1449,1693497457,2023-08-31 10:57:37,changemyview,https://www.reddit.com/r/changemyview/comments/166f071/cmv_religion_has_done_more_harm_than_good_for/,8,2023
15momit,CMV: Conservatives have very little to lose if liberals win. Liberals have everything to lose if conservatives win.,"On most issues, the liberal stands to lose a lot, while the conservative stands to lose little or nothing.

Take abortion, for instance. If liberals win, it doesn't mean pregnant conservative women will be forced to get abortions against their will. Conservative life goes on unaffected. If conservatives win, on the other hand, it means pregnant liberal women will be denied abortions (if they want them.)

Gay marriage - if liberals win, no heterosexual conservative is going to be forced to marry someone of the same gender against their will. Conservative life goes on unaffected. On the other hand, if conservatives win, gay/lesbian liberals would be prevented from being able to marry.

Taxes - sure, liberals may raise taxes if they win, but it would be for *everyone*. Liberals are not going to pass some tax that only hits conservatives but spares liberals. There are plenty of rich liberals who would be hit hard by higher taxes if taxes were raised. 

Climate change - what do conservatives have to lose from a liberal world in which there are less carbon emissions and less air pollution? That's a *beneficial* thing.

Now, there are a few I could see conservatives losing substantially on:

Guns - this is one issue the political right might be affected somewhat; liberals might try to enact very strict gun control. That being said, plenty of liberals own guns, so they'd be affected as well.

Affirmative action: This could lead to fewer conservatives getting hired or admitted to elite colleges while more liberals get in.

The funny thing, though, is that based off of the *behavior* of conservatives and liberals, you'd never be able to tell that it was liberals who had the most to lose. Conservatives are the ones who fanatically support Trump, were so desperate that they tried a Jan-6 insurrection, while liberals are comparatively more placid, lazy and lackadaisical despite having much more to lose. ",SteadfastEnd,1038,0.7200000286102295,1767,1691608629,2023-08-09 14:17:09,changemyview,https://www.reddit.com/r/changemyview/comments/15momit/cmv_conservatives_have_very_little_to_lose_if/,8,2023
161yf92,CMV: The seven dwarves are not supposed to be people with dwarfism. It’s idiotic that Disney will not feature dwarves in their remake of Snow White.,"In case you aren't aware, Disney is remaking Snow White and the Seven Dwarves. But, there are no longer going to be any dwarves. Instead, there are going to be seven magical forest creatures. From what I can tell, Disney is doing this because they think it’s not politically correct to make a movie featuring dwarves. This is idiotic 

**Fantasy dwarves are not people with dwarfism**

Fantasy dwarves are not meant to represent individuals with the medical condition of dwarfism. In fantasy, dwarves are usually depicted as stout, bearded beings, distinct from humans. They don’t have the same proportions as people with the real medical condition. 

Fantasy dwarves are not people with dwarfism any more than giants are people with gigantism. The same goes for gnomes, hobbits, leprechauns, etc. These diminutive beings are distinct creatures, not people with real medical conditions. Santa’s workshop is not staffed by people with dwarfism. 

**How to cast dwarf characters**

Disney is correct for worrying that its problematic to cast people with dwarfism to play fantasy dwarves. Its potentially belittling because it portrays people with a real medical condition as being like silly magical creatures. 

But, this doesn't mean that fantasy dwarves can never appear in movies. It means you shouldn't cast people with dwarfism to play them. You follow the blueprint laid out by Perter Jackson. You cast an ordinary actor, and then you use movie magic to make them shorter. 

**Disney's current casting choices are offensive**

Furthermore, I would say that Disney has not avoided controversy by eliminating references to dwarves. Here's a cast picture:

https://i.dailymail.co.uk/1s/2023/07/14/12/73212119-12298801-image-a-139_1689332652585.jpg

They've cast at least 1 person with dwarfism to play these magical forest creatures. As I argued above, this is belittling towards people with dwarfism. They are portraying people with a real medical condition as being whimsical creatures. Despite their efforts, I think people can legitimately argue that this movie will be disrespectful towards people with dwarfism. 

Disney has totally misunderstood the nuances of this situation. There would have been no problem if they cast actors in Peter Jackson style costumes to play the dwarves. But, by casting a person with dwarfism to play a magical forest creature, Disney has done something that's actually offensive. They gain nothing by avoiding the word ""dwarf"".",damndirtyape,993,0.8899999856948853,486,1693064242,2023-08-26 10:37:22,changemyview,https://www.reddit.com/r/changemyview/comments/161yf92/cmv_the_seven_dwarves_are_not_supposed_to_be/,8,2023
15kz5zb,CMV: The NoFap movement is nothing more than just BroScience and has no verifiable scientifically backed evidence of long term potential benefits.,"If you've perused the NoFap forums/boards, you will see people who believe that going weeks/months (or even years) without ""beating the meat"" can have life changing positive effects like better cognition, better energy levels, improved charisma and sexual magnetism(whatever that means), etc. Surely over masturbation is a bad thing and doing anything in excess can have negative impact on ones mental and physical health. But I find these claims and promises about a life changing impact to be bs and such long term abstinence not only has fictitious benefits but can also be dangerous in the long run. Change my mind.",UnsuccessfulLobotomy,981,0.8199999928474426,491,1691447049,2023-08-07 17:24:09,changemyview,https://www.reddit.com/r/changemyview/comments/15kz5zb/cmv_the_nofap_movement_is_nothing_more_than_just/,8,2023
164xhqk,CMV: Slavery reparations should NOT be given out.,"I dont think people should be given cash for slavery reparations. Reparations should take a more indirect form, things like tax breaks and investment in communities rather than just handing people a bunch of money and telling them to spend it wisely.

Of course reparations is a little vague, but the most common sum Ive seen is in the hundreds of thousands of dollars, which is quite a lot for the average person. You only have to look at lottery winners to see that giving ordinary people large sums of money is a bad combination. 

There's also the issue of how much would be given out. The most common sum I have seen is 250-300k, but Ive also seen 1 million thrown around which if true would cost almost 6 times the annual us budget.

It also seems like it could become a slippery slope. If someone is murdered does the murderer's family now have to pay reparations to the deceased descendants?",Communist21,941,0.699999988079071,2116,1693350197,2023-08-29 18:03:17,changemyview,https://www.reddit.com/r/changemyview/comments/164xhqk/cmv_slavery_reparations_should_not_be_given_out/,8,2023
15gdyf8,CMV: No amount of mass shootings is going to persuade gun supporters to give up their guns.,"Every time there is a mass shooting in the United States, the attitude of many gun opponents seems to be one of bated breath: *""Surely* ***this*** *one will be The One - the one that will finally mark a watershed moment and convince gun supporters that enough is enough, and that it's time to give up guns.""*

......and it doesn't happen.

If there were to be a critical-mass moment, it would have happened by now. The sheer volume of awful mass shootings - Columbine, Parkland, Sandy Hook, Pulse, Vegas, Uvalde, Aurora, El Paso, Sutherland Springs, Virginia Tech, etc. - would have done it by this point. And yet most gun supporters are no nearer to abandoning their stance than before. Gun opponents are waiting for a ""straw that breaks the camel's back"" moment that may never come.

Granted, it's hard to see what argument *would* work to persuade gun supporters to give up guns - if any such argument even exists. But it can be clearly seen, from the last 20 years, that ""hoping that the next mass shooting will finally be the one that changes their mind"" isn't it.  

And when America gets its next mass shooting that kills dozens of people - which, for all we know, might come as soon as next week or something like that - the argument of most gun supporters will most likely be the same again: ""2nd Amendment, my guns didn't cause the shooting, the self-defense benefits of guns outweigh the drawbacks of mass shootings, we need guns to resist governmental tyranny, the best way to stop a bad guy with a gun is a good guy with a gun,"" etc.

&#x200B;",SteadfastEnd,804,0.8399999737739563,1825,1690994746,2023-08-02 11:45:46,changemyview,https://www.reddit.com/r/changemyview/comments/15gdyf8/cmv_no_amount_of_mass_shootings_is_going_to/,8,2023
15uwzhx,CMV: Abandonware should automatically enter the public domain after 7 years of inactivity and a lack of declared intent to renew rights.,"For context: abandonware is software that's no longer sold, updated or maintained by the developers. On the one hand, it generally becomes impossible to purchase or obtain if you don't already have it, and on the other it's illegal to download or use if you don't already have it. This even applies to software where the teams that made it have long since dissolved and the rights could be held by companies that have literally forgot it exists. So, I think it makes sense that generally software is eventually released to the public domain if it isn't actually being used. If a company's planning on a reboot or selling the IP or something along those lines, sure they can put in with the courts that they want to renew the IP and retain rights and let that be a thing, but I mean specifically for the old and dusty projects that haven't been thought about in decades, just let them lapse into public domain so the freeware community has those resources without engaging in piracy, the chances of adding value for someone are way higher than the chances of taking away from value from anyone.",MostRecommendation84,786,0.9599999785423279,150,1692394259,2023-08-18 16:30:59,changemyview,https://www.reddit.com/r/changemyview/comments/15uwzhx/cmv_abandonware_should_automatically_enter_the/,8,2023
15txqtc,cmv: I don't see the emotional benefit in me having children.,"Genuinely looking for people to change my view <3

I am a 30 year old married woman to a 32 year old man. We own a home, and my husband has a pretty stable job that incentives parenthood (US military). 

I'm at that age now where it seems like every coupled person has kids, and honestly I just don't see the point. For what? I don't see the point in having sleepless nights and a 20 year expensive commitment, just for the occasional feeling of ""I love them so much my heart might burst"".

The only child I have an interest in fostering is my inner one. I don't think society would suffer if I didn't multiply - I ain't anything special. I'm just a regular millennial. Honestly I think I'm quite childlike at heart, and I feel like I can stay this way forever so long as I'm never a mom. I really really hate the idea of having a kid, and my husband being like most men and suddenly working longer hours to ~~not be at home~~ ""bring in more income"", and me being saddled with the brunt of the work whilst also dealing with all the body and hormonal changes. The whole idea offends me, honestly. Is there something wrong with me? Am I missing out?",Successful_Swan_28,692,0.7699999809265137,896,1692301927,2023-08-17 14:52:07,changemyview,https://www.reddit.com/r/changemyview/comments/15txqtc/cmv_i_dont_see_the_emotional_benefit_in_me_having/,8,2023
15ja8n4,CMV: JK Rowling doesn't deserve the hate she gets,[removed],eng002,688,0.6499999761581421,599,1691278358,2023-08-05 18:32:38,changemyview,https://www.reddit.com/r/changemyview/comments/15ja8n4/cmv_jk_rowling_doesnt_deserve_the_hate_she_gets/,8,2023
15y5y4j,CMV: Hard work pays off is BS,"Complete and utter BS. The entire notion of ""hard work pays off"" is just manipulative to the everyday employee. Especially since the idea of ""hard work"" is totally subjective.

If the hardest workers reaped the most rewards, then roofers and coal miners would be the richest people in society. 

The real truth is that investment of time in the right places pays off. I worked my ass off in blue-collar, and, at some point, you hit a cap. There's only so many hours in a week and only so much you can work. You can sacrifice every personal/social event in your life to work all the overtime you can, but you'll always hit a cap.

I became tired, and my health was suffering. I fell into a deep depression. All of my coworkers started calling me lazy when I started rejecting the overtime. I invested time into earning certifications in a different field. This was an easy thing to do here and there. My certifications put me in another position, making double the money with half the hours and a fraction of the labor.

Was it hard work? Nope. I assure you that in comparison, sitting in front of my computer for a couple hours on the weekends was a LOT easier than working 15+ extra hours at my job where I was killing myself with the workload.

I promise you, you can live a good life working hard, but you will live a great life working smart.

Ofcourse it's true that if you're not working at all, you won't achieve anything. And ofcourse it's true that if you work really hard you might get a promotion that puts you in a better place, but my point is ""hard work"" always has a cap. At some point it becomes less about the workload you complete, and about where you invest your time.

You'll hit a wall, and the only way to move up after a certain point is to build connections and invest time/money into yourself. Nepotism is very real, and it will throw your hard work out the window.

Change my view.",NewDaysBreath,681,0.7599999904632568,370,1692711079,2023-08-22 08:31:19,changemyview,https://www.reddit.com/r/changemyview/comments/15y5y4j/cmv_hard_work_pays_off_is_bs/,8,2023
15s891q,"CMV: The conservatives who complain ""Why are we sending money to Ukraine instead of helping people here at home in America?"" wouldn't want that money to be spent on people in America, either.","Since the beginning of the war, a certain Trumpish faction of Republicans has been arguing that we shouldn't spend money on helping Ukraine ""because of the domestic needs at home.""

The first problem with this is that the amount of money the U.S. has sent to Ukraine is actually only a tiny percentage of GDP/federal budget, and it's for a good cause.

But the second, more pressing, problem is that even if the U.S. never sent any aid to Ukraine, and instead diverted the $70 billion in weaponry and financial aid back to America instead..........most of these Trump-wing conservatives wouldn't want that money spent on Americans either, despite their complaint. I'm talking about the Marjorie-Taylor-Greene type.

If it were spent on school lunches........Republicans have been spending a lot of effort blocking free school lunches.

If it were spent on welfare.......Republicans would complain that that's......well, welfare.

If it were spent helping the homeless...........Republicans would complain that it's helping 'stinky, dirty, lazy homeless people.'

In other words, Republicans don't actually **want** that money spent on helping people, they just want something to complain about.

Lastly, if the Biden administration indeed sent no aid to Ukraine, you can 100% guarantee that these Trump-wing Republicans would do a 180-degree and attack Biden for being ""weak,"" an ""appeaser,"" and claiming that Biden is letting Russia win.",SteadfastEnd,671,0.8199999928474426,626,1692140979,2023-08-15 18:09:39,changemyview,https://www.reddit.com/r/changemyview/comments/15s891q/cmv_the_conservatives_who_complain_why_are_we/,8,2023
15j96fq,CMV: Humanity has not been visited by “non-human intelligence”,"David Grusch recently testified before the US congress that the United States is in possession of air/spacecraft operated by non-human intelligence. He has also mentioned in an interview that the United States is in possession of bodies of pilots flying these craft and they were non-human in origin. He goes on to elaborate that they have had these craft and bodies for decades and have even involved other foreign entities, specifically the Vatican, who have helped them recover these craft.

I think this is ridiculous. It would require a multi-national effort with airtight secrecy lasting decades. It would require multiple nations and government officials to stay silent on this topic and have no photographic evidence or other objective evidence of these craft fall into public hands. 

The non-human intelligence would need to constantly operate in a covert manner and avoid large populations of humanity to avoid having indisputable proof of their existence documented. Despite multiple private and public entities attempting to search for intelligent life on other planets, the only entities who have supposedly found proof of intelligent life are shadowy classified government entities. 

I think the far more likely answer is that David Grusch is either mistaken, mislead, or intentionally misleading people",JFKme,528,0.8799999952316284,471,1691275571,2023-08-05 17:46:11,changemyview,https://www.reddit.com/r/changemyview/comments/15j96fq/cmv_humanity_has_not_been_visited_by_nonhuman/,8,2023
15vcvrh,CMV: Unless proven otherwise you should assume everything you see on the internet is fake. Or at the very least it should be taken with a massive grain of salt.,"Edit: This isn't black and white. And based on previous comments I think the title is a bit too serious and literal. I apologize for that. English isn't my first language 


No. I am not gonna start the rambling about AI and deep fakes or other dumb sh*t like that. That's a different topic for another day. 


This is probably the closest belief to a conspiracy theory I believe. 


This is something we should have done since the beginning of the internet. 


Many things are fake on the internet, or at least have missing contexts. From news on social media, photoshoped/airbrushed models, drama made as an attempt for attention, etc. 


Needless to say most mental health issues, scams, dumb culture and misinformation related to the web are steming from taking the internet at face value. 


Even before AI and pals it is incredibly difficult to verify what's real or not. Not always but at least in *most* cases it sure as hell is.


The remedy to this: Assume everything you read is fake. 


Example: If one assume everything he/she reads is fake (or at least take it with a massive grain of salt) then it will be more difficult to be scammed, feel bad for oneself or get fooled by the internet.



You're almost never sure who's behind the screen. 


I could be Linus from LTT in an alt account, or that pyramid girl iilluminaughtii. Maybe PewDiePie?


Maybe I am Alex Jones, ChatGPT, Dream or snooroar. I could very easily be a bot.


Maybe I am Vladimir Putin himself, lol. Or.... 


Simply I am just a random loser nobody. YOU F*CKING NAME IT!


Point is: If you don't even know who is actually speaking/giving this info to you, why take him seriously?


Why take someone or something seriously when you cannot even verify it at an acceptable enough level?",andrew21w,478,0.8799999952316284,114,1692441743,2023-08-19 05:42:23,changemyview,https://www.reddit.com/r/changemyview/comments/15vcvrh/cmv_unless_proven_otherwise_you_should_assume/,8,2023
15kmtfo,CMV: I see nothing wrong with legalized euthanasia,"hat's it. My view is simple. However, to expand why I think so. I think if someone wants to die, they have a fatal condition or they hate life. Now, I know some things are temporary, and that it can be fixed. So I propose that government give them one year of therapy etc. If they still want to die they should be allowed to. 

My second reason is, if the government has failed them, then the least the government can do is not punish the helper and them for taking matters into their own hands. Morally speaking, for example, if there was a town for whatever reason, think wild west, with no sherrif or the sheriff is literally sitting on his/her ass all day, I have no problem morally if everyone went all 'batman'. 

My third reason is, and probably the most important one, freedom and consent. If it's proven that there was no coercision etc. then the doctor or whoever shouldn't be arrested. 

Thats why I believe it's better to legalize it. There would be institutions to make sure that 

Now for background. I'm in canada. We already have checks in place for fatal conditions, I see nothing wrong with expanding it. 

But really the heart of the matter is, I don't see why the government should have a say what I do with my body. I am of the principle if it doesn't remove someone elses freedoms or rights, then it should be ok. I took nothing from my neighbour by dying. Breaking in and entering takes away their right to safety. My freedom to die does not impede on your freedoms.",donotholdyourbreath,473,0.8799999952316284,369,1691419683,2023-08-07 09:48:03,changemyview,https://www.reddit.com/r/changemyview/comments/15kmtfo/cmv_i_see_nothing_wrong_with_legalized_euthanasia/,8,2023
