post_id,title,text,author,score,upvote_ratio,num_comments,created_utc,created_datetime,subreddit,permalink,month,year
1gtmuou,"CMV: When you sexualize yourself to get attention, you shouldn't be surprised when the attention you receive is sexual","To me this sounds kinda like a ""duh"" take but but apparently some people disagree so I want some insight to shift my view. I'll use women in this example, but i think it applies to men as well.

I'll use the example of Instagram. I absolutely can't stand it now because EVERYTHING is made sexual and it's a bit predatory in my opinion because creators almost FORCE you to view them by gaming the algorithm. One thing I think IG user will come across is a woman who will be making very basic content like describing a news story or telling a trending joke. But the woman makes sure to perfectly position herself where her cleavage is visible because that's usually the only thing in her content that is actually of 'value'.  You see this a lot with IG comedians where the joke is ""sex"" or ""look at my ass/tits"". Like if you watch gym videos you've probably stumbled across one of the many female creators who use gym equipment to do something sexual and the joke is ""Haha sex"". 

But then, as expected, the comments will be split between peopple (usually men) sexualizing the creator and people (usually women) shaming the men for sexualizing her and being ""porn addicted"". But what really do you expect? When you sexualize yourself it shouldn't be a surprise when the attention you get is sexual. And I think that applies to all situations both in real life and online.

Now what I normally see in the comment is the argument that ""well she's a woman and that's just her body. She's not sexualizing it you are"". But I think this is just a cop out that takes away personal responsibility, assumes the women are too dumb to understand how they are presenting themselves and that the viewer is too dumb to have common sense. 

I also think America is so over hypersexualized that people will go out dressing like a stripper and be baffled when they're viewed as such. So yeah pretty much my view is the title that when you oversexualize yourself, it should be a surprise when the attention you get is sexual. ",Shak3Zul4,1948,0.6899999976158142,1571,1731875407,2024-11-17 14:30:07,changemyview,https://www.reddit.com/r/changemyview/comments/1gtmuou/cmv_when_you_sexualize_yourself_to_get_attention/,11,2024
1glymqm,"CMV: As a European, I find the attitude of Americans towards IDs (and presenting one for voting) irrational.","As a European, my experience with having a national ID is described below:

The state expects (requires) that I have an ID card by the age of 12-13. The ID card is issued by the police and contains basic information (name, address, DoB, citizenship) and a photo.

I need to present my ID when:

* I visit my doctor
* I pick up a prescription from the pharmacy
* I open a bank account
* I start at a new workplace
* I vote
* I am asked by the police to present it
* I visit any ""state-owned service provider"" (tax authority, DMV, etc.)
* I sign any kind of contract

Now, I understand that the US is HUGE, and maybe having a federal-issued ID is unfeasible. However, what would be the issue with each state issuing their own IDs which are recognized by the other states? This is what we do today in Europe, where I can present my country's ID to another country (when I need to prove my identity).

Am I missing something major which is US-specific?

",dstergiou,1727,0.800000011920929,2081,1731007281,2024-11-07 13:21:21,changemyview,https://www.reddit.com/r/changemyview/comments/1glymqm/cmv_as_a_european_i_find_the_attitude_of/,11,2024
1gkdy23,CMV: the stigma around men discussing their feelings is caused just as much by women as men,"My friend and I got into a disagreement over the weekend with our girl friends around the problems of men’s mental health. Their argument was that men don’t feel comfortable talking about their feelings because of the patriarchy that they have established. They argue that men self-impose toxic masculinity and this prevents them from expressing themselves fully. 

We responded by saying that women don’t want to listen to men’s problems. Their response was that women’s issues are more important because they have been historically wronged by society. The basic contention they proposed was that women face more oppression and a slew of issues fighting against the patriarchal society that we would never be able to understand. 

The underlying claim in their argument was that therefore men’s issues aren’t as deep or significant. To me, this literally proved our point that women tend to trivialize men’s problems. ",JBSwerve,1635,0.75,628,1730832190,2024-11-05 12:43:10,changemyview,https://www.reddit.com/r/changemyview/comments/1gkdy23/cmv_the_stigma_around_men_discussing_their/,11,2024
1gpjsx0,CMV: Pete Buttigieg should not run in the 2028 primary,"In 2020, Pete Buttigieg won Iowa and tied in New Hampshire, despite the fact that he was a no-name mayor from a mid-sized town in Indiana.  The only people who were doing as well, or better than him were well-known national figures like Biden and Bernie

In the 4 years since, he's become more experienced, more polished, and has grratly expanded his national profile, while developing a reputation for being one of best speakers in politics.

If he runs again in a democratic primary, he will win, and I just don't think a gay man can win Trump's America, and if he loses, not only will that give Republicans another victory, it'll also more or less kill his chances at the White House (which would be unfortunate, since he can probably be a decent a president a a few elections from now)",RVarki,1511,0.7900000214576721,1390,1731415233,2024-11-12 06:40:33,changemyview,https://www.reddit.com/r/changemyview/comments/1gpjsx0/cmv_pete_buttigieg_should_not_run_in_the_2028/,11,2024
1gst4rz,"CMV: Egypt will collapse, and it will trigger the largest refugee crisis in human history","I believe that Egypt is heading for a catastrophic collapse that will lead to the largest refugee wave we've ever seen. This isn't speculation—it's rooted in harsh realities of demography, food security, and economic pressures.

First, let's talk numbers: Egypt's population has exploded over recent decades, reaching over 110 million people. Projections show that this growth is not slowing down. The population continues to rise, while the country is running out of land to sustain it. Egypt already imports more than half of its food, and they are the world's largest wheat importer. Rising food prices, global supply chain issues, and instability in global markets leave Egypt extremely vulnerable to supply shocks.

Water scarcity is another massive factor. The Nile River, which Egypt relies on for 97% of its water, is under increasing stress from climate change and upstream development, particularly Ethiopia's Grand Renaissance Dam. Egypt has a limited capacity to adapt, and water shortages will only exacerbate food insecurity.

Politically and economically, Egypt faces significant instability. The regime under President el-Sisi has been maintaining order through a combination of subsidies and repression, but this is unsustainable. Rising economic pressure on the poorest citizens, compounded by inflation, energy crises, and unemployment, will create widespread unrest.

When (not if) Egypt's stability breaks, it will trigger a massive outflow of refugees, mainly toward Europe and neighboring countries. We are talking about millions of people moving due to famine, water scarcity, and political collapse. If we look at the Syrian Civil War and the refugee crisis that followed, it pales in comparison to what could happen here.

This isn't just a humanitarian crisis in waiting; it's a geopolitical time bomb that will reshape borders, cause international tensions, and strain global systems. The signs are all there, and ignoring them won't make this looming disaster go away.",Ok_Yellow1,1394,0.9100000262260437,338,1731780487,2024-11-16 12:08:07,changemyview,https://www.reddit.com/r/changemyview/comments/1gst4rz/cmv_egypt_will_collapse_and_it_will_trigger_the/,11,2024
1gk5r4y,CMV: those who don't vote because of a single issue (e.g. Gaza) don't care about any other issues,"Many have strong opinions about certain topics, such as wars, inflation, or others. Some view both US presidential candidates as equally apathetic to their top issue. This is not a good justification for not voting, because there are [many more issues](https://www.nbcnews.com/politics/2024-election/harris-trump-stance-issues-policies-president-race-rcna150570) at stake. What they should do instead is consider their other priorities to break the tie.

Inflation, abortion, crime, gun safety, the border, and many others are on the ballot. In my view, those who don't vote because of a single issue don't care about any other issues. And no, silence does not help their cause.

""Neutrality helps the oppressor, never the victim. Silence encourages the tormentor, never the tormented."" -Elie Weisel",James_Fortis,1351,0.7300000190734863,1092,1730810511,2024-11-05 06:41:51,changemyview,https://www.reddit.com/r/changemyview/comments/1gk5r4y/cmv_those_who_dont_vote_because_of_a_single_issue/,11,2024
1giv72i,CMV: There is no such thing as an ethical billionaire.,"This is a pretty simple stance. I feel that, because it's impossible to acquire a billion US dollars without exploiting others, anyone who becomes a billionaire is inherently unethical. 

If an ethical person were on their way to becoming a billionaire, he or she would 1) pay their workers more, so they could have more stable lives; and 2) see the injustice in the world and give away substantial portions of their wealth to various causes to try to reduce the injustice before they actually become billionaires. 

In the instance where someone inherits or otherwise suddenly acquires a billion dollars, an ethical person would give away most of it to righteous causes, meaning that person might be a temporary ethical billionaire - a rare and brief exception.

Therefore, a billionaire (who retains his or her wealth) cannot be ethical. 

Obviously, this argument is tied to the current value of money, not some theoretical future where virtually everyone is a billionaire because of rampant inflation.",jrice441100,1317,0.6800000071525574,1773,1730662648,2024-11-03 13:37:28,changemyview,https://www.reddit.com/r/changemyview/comments/1giv72i/cmv_there_is_no_such_thing_as_an_ethical/,11,2024
1h2li68,CMV: Authors Have No Obligation to Make Their Fiction Morally Perfect,"I’ve seen criticism directed at J.K. Rowling for her portrayal of house elves in Harry Potter, particularly the fact that they remain slaves and don’t get a happy ending. I think it’s completely valid for an author to create a grim, imperfect world without feeling obligated to resolve every injustice.

Fiction is a form of creative expression, and authors don’t owe readers a morally sanitized or uplifting narrative. A story doesn’t have to reflect an idealized world to have value it can challenge us by showing imperfections, hardships, or unresolved issues. The house elves in Harry Potter are a reflection of the flawed nature of the wizarding world, which itself mirrors the inequalities and blind spots of our own society.

Expecting authors to “fix” everything in their stories risks turning fiction into a checklist of moral obligations rather than a creative exploration of themes. Sometimes the lack of resolution or the depiction of an unjust system is what makes a story compelling and thought-provoking.

Ultimately, authors should have the freedom to paint their worlds as grim or dark as they want without being held to a standard of moral responsibility. CMV",Empty_Alternative859,1292,0.8299999833106995,818,1732885992,2024-11-29 07:13:12,changemyview,https://www.reddit.com/r/changemyview/comments/1h2li68/cmv_authors_have_no_obligation_to_make_their/,11,2024
1god8ad,CMV: I am justified in not inviting family members who vote for anti-same-sex-marriage politicians to my same-sex wedding.,"My fiance and I live in a state that legalized same-sex marriage in 2010, when we had a Democratic governor and Democratic majorities in both our State House and State Senate.

Currently, as of last week's election, it is confirmed that our state will have a Republican governor, and a Republican majority in the State Senate; once all the votes are counted, it is all but guaranteed that Republicans will have a majority in the State House as well.

Our state's Republican Party's platform, as listed on their website,, states that their goal is to, ""recognize marriage as the legal and sacred union between one man and one woman as ordained by God, encouraged by the State, and traditional to humankind, and the core of the Family."" This is dated to April 13, 2024 - it's not an obsolete or outdated policy point for them.

At a national level, a 2024 Gallup Poll showed that only 46% of Republicans believe that same-sex marriages should be recognized by the law as valid. As in our state, the results of last week's election have given us a Republican president, a Republican Senate, and as it stands currently, a very high chance of a Republican House. 

Conveniently, Republicans now also hold a majority on the Supreme Court. In his concurring opinion on the Dobbs case in 2022, Clarence Thomas stated that the court, ""should reconsider all of this Court’s substantive due process precedents, including Griswold, Lawrence, and Obergefell"" - with Obergefell being the case that required the entire nation to recognize and perform same-sex marriages.

In summary: while it's not set in stone quite yet, there is a very distinct chance that, at some point in the next four years, we will become unable to legally marry in our home state, and unable to gain the financial and legal benefits of marriage if we were to have it performed in another state or country.

Because of this looking threat to our rights, we are planning on going to City Hall to get a marriage certificate sometime before the end of the year. At some point further down the road, we can hold a symbolic ceremony and reception, no matter the political situation at the time (we had been putting this off for cost purposes anyways).

When it comes to our guest list, I feel completely justified in instructing our potential guests that, if they have voted for political candidates who belong to the party that threatens our right to marry in the most recent election, then we ask that they do not attend our marriage. I cannot stomach the thought of enabling their hypocrisy, specifically their ability to perform acts that harm us one day, then show up to congratulate us and share in our joy the best day.

While we haven't outright asked everyone on our drafted guest list who they have voted for, it appears that this request would mean that at least, my mother, my grandmother, and many aunts, uncles, and cousins on my fiance's side would be asked to decline their invitations. I am fine with my mother and grandmother not attending, as my father and most of my siblings would be there, and I know that my fiance's mother and brother would be there as well.

My fiance states that, should I make this request, the resultant family drama on his side would be so tumultuous that it would tear the family apart, and he would never hear the end of it until everyone requested not to attend had passed away.

It is worth noting that, prior to my coming up with the idea of this request, his side of the family occupied about three times more of the drafted guest list than my side - he has offered a similar justification that choosing to invite some but not all of his family would cause too much drama. Meanwhile, I had only ever intended to invite my nuclear family, my one surviving grandmother, and the aunt/uncle/cousins that live closest by that I am on the best terms with.

So, what do you think? Is it worth causing ""family drama"" in order to take a stand against hypocrisy? Should I, instead, grin and bear the unwanted presence at our wedding of those who voted against our right to marry?",BosomsaurusRex,1287,0.7200000286102295,910,1731278810,2024-11-10 16:46:50,changemyview,https://www.reddit.com/r/changemyview/comments/1god8ad/cmv_i_am_justified_in_not_inviting_family_members/,11,2024
1gykzg9,CMV: No single person should be able to possess a net worth of more than 1 billion dollars.,"Considering the fact that in the United States (for instance), the three richest individuals control more wealth than the bottom 50% of the entire country, or the fact that the richest 1% of the global population control more wealth than the other 99% combined, I take the position that no individual should possess more than 1 billion dollars.

Please consider the following points before commenting:

1. The currency domination isn't important (it could be euros, yen, or whatever), but using USD as a benchmark.

2. A married couple could possess 2 billion dollars, so lets eliminate that argument at the start.

3. Choosing 1 billion is subjective, it could be 5 billion, or 500 million. I am picking this number to demonstrate that I have no problems with capitalism, nor am I advocating for communism, or that I don't acknowledge that societies in general will always have wealth inequality. 

4. I do hope this doesn't end up being an echo chamber, because part of this position does seem a bit 'obvious.' 

5. I don't have some great answer for how a redistribution would work, however, I don't necessarily think this should be a reason to not do it.

I am open to a discussion as I recently started following this subreddit and have found it quite stimulating.",robbcandy,1213,0.6600000262260437,1751,1732431173,2024-11-24 00:52:53,changemyview,https://www.reddit.com/r/changemyview/comments/1gykzg9/cmv_no_single_person_should_be_able_to_possess_a/,11,2024
1gk33fs,CMV: Islamophobia is not irrational,"First off, I’m not interested in comparing Islam to other religions in this post, this discussion is only about Islam, so please keep comments focused on that.

For context, I grew up in Iran around Shia Muslims. Most of the people around me identified as Muslim in name, but many didn’t strictly follow the religion, and some even despised it. Personally, I hold a very critical view of Islam.

From my perspective, Islam promotes outdated, unhealthy, and often bigoted ideas. While I know not all Muslims follow these beliefs to the letter, these aspects are deeply rooted in the ideology. A few examples I find concerning:

* Islam often promotes misogynistic beliefs that limit women’s freedom.
* It teaches intolerance towards homosexuals and apostates.
* It encourages violence against its enemies and places a strong emphasis on martyrdom and military supremacy.
* The goal of Islam, as stated in its texts, is to dominate the world as the true religion.

With these factors in mind, I think a critical view or even fear of Islam isn’t irrational. I believe that acknowledging these issues is important, rather than ignoring them under the guise of tolerance.",Empty_Alternative859,1209,0.7200000286102295,1085,1730799942,2024-11-05 03:45:42,changemyview,https://www.reddit.com/r/changemyview/comments/1gk33fs/cmv_islamophobia_is_not_irrational/,11,2024
1go56j6,CMV: “educate yourself” is the intellectual version of “pull yourself up by your bootstraps” and is elitist,"In my opinion, your worldview is not something you “build yourself with your own two hands” it’s largely given to you.  This is why there are liberal areas where liberal families live and raise liberal kids, same with conservatives.  

I can’t stand people with their self righteous “educate yourself” BS.  These people act like they get up at the 4 am every day to read everything under the sun to make sure they choose the correct moral stance on a given issue, and anyone who hasn’t looked into it or come to the right conclusion is less than.  It’s honestly pathetic and it’s pure mental bias.  

A lot of you might be surprised to see how you would have voted, for instance, if you had come from deep conservative territory.  

It’s especially frustrating because half of the “high moral ground” that many of my leftist contemporaries claim is that they are EMPATHETIC TOWARDS PEOPLE.  My leftist contemporaries have sympathy for the issues that come with poverty in cities but if you’re broke and from the country and you didn’t vote blue, you’re a piece of shit.  It’s ridiculous.  

If someone comes from an area with deep ideology and is able to reject that culture and worldview and build their own, because they disagree with it, that’s amazing and those people should be commended, but people who can’t do that (vast majority of people) should not be demonized.  

If you are proud of your worldview and you think it makes you a better person, believe me you are lucky to have it and it’s a gift.  You didn’t work for it and no one owes you applause, and you’re dead wrong to make villains of people less fortunate.  

",DeuceBane,1207,0.7400000095367432,877,1731258010,2024-11-10 11:00:10,changemyview,https://www.reddit.com/r/changemyview/comments/1go56j6/cmv_educate_yourself_is_the_intellectual_version/,11,2024
1gvch39,"CMV: Male circumcision is wrong, but calling circumcised men ""mutilated"" or implying that they are sexually dysfunctional is also wrong.","Basically, my understanding of the issue of male circumcision is that it is a bad thing, but only mildly so.  

There are statistically low risks of surgical complications, and even lower statistical risk that the complications could result in serious long-term problems.  The only studies that I have seen that claim that circumcised men experience more sexual dissatisfaction, discomfort or dysfunction, are based on online survey results which have low N counts and would suffer from confirmation bias.  The most convincing studies I have seen that are based on meta-analyses and medical data find that circumcised men are not more likely to suffer from sexual dysfunction or dissatisfaction than uncircumcised men.  

The trade-off is the purported hygiene and STD preventing effects of circumcision, which I understand to be questionable at best, and perhaps more applicable to countries where hygiene practices and conditions are not great. 

On the balance, it's not a good practice and it should definitely be discouraged, maybe even banned.  Especially when you factor in more abstract and unproven concerns, like the possible psychological impact on infants and just the abstract point of losing sexual sensitivity relative to uncircumcised men.

All of that being said, I don't think it is either logically accurate or rhetorically effective to describe male circumcision as a form of mutilation, or to imply in any way that circumcised men are sexually dysfunctional.  

I think the word ""mutilation"" implies that there are malicious and/or medically-arbitrary (e.g. purely cultural) *intentions* behind male circumcision, and also that the harm done is severe and debilitating.  I do not think that implication rings true.  I think most parents still believe that the hygiene/STD prevention reasons are valid, and a lot of doctors also don't know well enough to disabuse them of this notion.  And even if the parents due it purely for cultural reasons, as discussed above, the risks and harms of circumcision are relatively minor - parents wouldn't do it otherwise.  

I also think that telling parents that they are ""mutilators"" and circumcised men that they have been ""mutilated"" is unconvincing.  You are using more extreme rhetoric thinking that the fact that it is more extreme means it will have more of an impact, but really that extreme rhetoric just makes the whole position seem unrealistic.  

Especially when it comes to circumcised fathers, who are usually the ones to push for circumcision more than the mothers.  Tell a circumcised father that they have been mutilated and that their son's dick isn't going to work, and they will laugh in your face - because, of course they never considered themselves to be ""mutilated"", and of course they never had problems with their own dick working.  

Tell parents instead ""there's really no benefit to doing this, and there are some pretty severe downsides on the rare chance that it goes wrong"" - and they will be much, much more likely to be convinced.  Not to mention that you are actually telling them the truth, which is always better than lying to people via hyperbole.

CMV.",AcephalicDude,1156,0.6700000166893005,2322,1732062152,2024-11-19 18:22:32,changemyview,https://www.reddit.com/r/changemyview/comments/1gvch39/cmv_male_circumcision_is_wrong_but_calling/,11,2024
