post_id,title,text,author,score,upvote_ratio,num_comments,created_utc,created_datetime,subreddit,permalink,month,year
1gprni8,cmv: The “girl-bossification” of sex work is not the feminist take people think it is.,"It has become apparent in recent times that sex-work, either through OF or other means, has been received as a feminist movement that empowers women for sexualising themselves in exchange for money.

I’ll preface this by saying that I don’t wish to demonise sex work; women pushed to those positions should be protected and unharmed, and don’t deserve hateful narratives expressed in media.

However, on the other hand, not demonising prostitution or sex work does not mean viewing it as some profound, empowering stance. Sure, in an ideal world, to engage in sex work without the inequality of demand, pay, and income, would possibly result in a less degrading position, but that simply isn’t the world we live in. 

I’ve seen points such as: 

1) “Well, I could be assaulted/consent for sex, without making any money. So why not introduce an economic aspect to it?”

That is a reductive approach to the concept of one’s bodily autonomy. It is absolutely a tragedy that one could be assaulted, and feel as though they could gain something from it—and yes, hypersexuality is often a symptom of those who’ve experienced sexual abuse. These are not (a) empowering decisions, or (b) healthy decisions. In the same way that people may have found unhealthy coping mechanisms for PTSD, trying to own oneself sexually through economic means is similar in that regard. Consent cannot be garnered correctly wherein a transactional relationship is established. 

Similarly, if one does consent to sex, but also considers the monetary gain that could come from it, they may need to consider why they connect sex with an act of labour—is it because you are sleeping with partners you don’t like/are attracted to, or is it seen as an economic benefit that one could obtain? Are you considering sex work because you want to provide for yourself with means that are more easily accessible, as opposed to being rejected/unhappy in the normal corporate world? Perhaps the issue is that we are fed with media that convinces us that luxury is comfortability, and we woe the mundane life. Or perhaps we view sex work as easy and a get-rich quick scheme; consumers of it being stupid and desperate enough to pay for anything. But that isn’t the case.

As I’ve mentioned before, consent via economic transaction is not usual consent. That is not to say it’s abuse, or rape, but it is not normal relationship consent. It is not a hookup, or FWB, or relationship-established occurrence. It is the subjugation of one individual to service another. And regardless of the subjugated party gains money or economic gain from it, it is still an entirely degrading act to force oneself into. 

Feminists online seem to embrace sex work as a profoundly anti-patriarchal stance, without the realisation that it isn’t as autonomous as it seems. I will reiterate that sex workers deserve respect, but we shouldn’t parade it as a viable solution to earning money, or as a job. It is deeply flawed and dangerous, and in a modern society, we shouldn’t embrace the selling of one’s body.",Careful-Panda9885,377,0.800000011920929,493,1731436132,2024-11-12 12:28:52,changemyview,https://www.reddit.com/r/changemyview/comments/1gprni8/cmv_the_girlbossification_of_sex_work_is_not_the/,11,2024
1glc7i8,CMV: One of the biggest flaws European Liberal party’s made the last decade was not combating islamist extremism.,"I know titles like this leave room for interpretation so before I start some information. I’m a 19 year old, Atheist, bisexual dude who is very left-leaning on social issues and more centrist on economical issues. No I don’t think people from Muslim countries or Muslims are inherently evil or that religion in general is stupid.

One of the trends we can see in the last decades is that islamist extremism and terrorism is on the rise. Even in Europe which tended to be becoming more atheist and liberal Christian in the last decades. This has given right wing populist an extremely successful target and led to the success of right wing parties in recent years.

Liberal party’s were to scared that they seemed racist if they even addressed problems related to Islam which is a thing that still baffles me because textbook Islam(like many religions) is inherently anti feminist and homophobic so one would assume that liberal party’s would try to protect women’s and queer rights/safety. Again I don’t have anything against any religion as long as they don’t interfere with politics.",Kyaruga,368,0.7400000095367432,192,1730935150,2024-11-06 17:19:10,changemyview,https://www.reddit.com/r/changemyview/comments/1glc7i8/cmv_one_of_the_biggest_flaws_european_liberal/,11,2024
1h1xtf9,CMV: Reddit has a moderator problem,"Just to be clear. This does not apply for all moderators. I know some moderators on small Subreddits that are really good people. Speaking for a lot of larger Subreddits where moderation is an issue. 

Reddit has a moderator problem. They can do a lot of things to you that doesn't really make lots of sense, and they do not give you a reason for it. More often than not, you're just muted from speaking with the moderator. Unfortunately, due to a lot of Reddit mods and Redditors in general being left-wing, there are a lot of examples of right-wingers being the victims. Such as this one on the r/ medicine Subreddit. He got deleted for asking questions. A person said Trump's NIH nomination caused ""large scale needless death"". When he was asked what the large scale death in question was, his comment was deleted by the mods. Along with a person being perm banned for saying ""orange man bad. Laugh at joke. Unga Bunga"" in r/ comics. The most notable case of moderation abuse is from r/ pics where they just ban you for participating in a ""bad faith Subreddit"". Even if you just commented.

This is not a good thing. It means that if you want to participate in a major Subreddit with a lot of people, you will have to conform to what the moderators personally see as ""correct"" or ""good"". This doesn't foster productive conversations, nor is it good for anybody but the moderator's egos. ",Terrible_Onions,358,0.7900000214576721,438,1732806116,2024-11-28 09:01:56,changemyview,https://www.reddit.com/r/changemyview/comments/1h1xtf9/cmv_reddit_has_a_moderator_problem/,11,2024
1gnxluh,"CMV: We are producing Lost Boys in factory-like quantities, and the price will be astronomical","The hustle economy isn’t building anything sustainable; it’s hollowing out young men from the inside, encouraging them to project a flimsy brand rather than develop genuine value. And while everyone’s waving the flag of empowerment or self-actualization, all they're actually doing is exploiting a generation starving for direction, identity, and validation—otherwise known as the Lost Boys. 

>The Lost Boys Phenomenon: Disposable Youth

For the past two decades, we’ve been cultivating an entire demographic of disillusioned young men—educated in classrooms that devalue them, raised in families that are increasingly unstable or absent, and sent into a society that neither needs nor respects them. Despite the hand-wringing articles, neither side of the ideological divide cares about solving this problem; both are too busy pushing their own shallow narratives. On one hand, society shames these men as “overgrown boys” who avoid responsibility; on the other, it calls them “toxic” or dangerous if they express traditional masculinity. It’s a catch-22: no role models, no roadmap, just isolation and contradiction. Enter the Hustle Economy. It's the lifeline dangling in front of these young men. Except it’s not a lifeline; it’s a noose.

>Hustle Culture: The Mirage of Influence

In the hustle economy, brand trumps substance every time. Fame, however hollow, is currency. Validation, however fleeting, is dopamine. But here's the reality: we’ve created a system where ""influence"" is a simulacrum of achievement, where image and validation replace any real development of skills or character. Young men aren’t learning to create, innovate, or lead; they’re learning how to project a hollow image. They’re being conned into thinking that the *performance* of success is the same as success itself. Today, any Lost Boy can be a “thought leader” by spewing someone else’s platitudes into an algorithm and watching the numbers roll in.

But it’s all smoke and mirrors. The influencers and gurus selling the fantasy of the hustle economy—personal brands, online courses, or lifestyle tips—are the biggest hustlers of all. They’ve perfected the art of selling air, and they’re pulling these young men into their orbit by promising a quick path to purpose, self-worth, and financial success. What’s the result? It’s a generation of men seeking identity in follower counts and purpose in the next “grind,” never realizing they’re burning out their very souls for a temporary high that leaves them emptier each time.

> The Brand of Me: Identity in Freefall

Here’s the truth: we’ve so deeply intertwined personal identity with brand identity that young men now equate their self-worth with the size of their online following. It’s a vicious cycle. The hustle economy feeds insecurity by tying self-worth to fleeting metrics. Today, being a “man of substance” means being a man with influence, with likes, with numbers. No one cares what you do if no one can see it. And the problem with that? It’s a treadmill. When followers are your identity, you can’t afford to stop. When money is your validation, you can’t afford to fail.

This is what we're teaching them: that the projection of value is more critical than actual value, that growth is measured in clicks, not character. It's creating a generation of men who are as disposable as the metrics they chase. When numbers inevitably decline, when the brand fails to pivot, they’re left with nothing. And the cycle repeats, chewing up the next wave of Lost Boys looking for someone—anyone—to show them what it means to be worth something.

>The Hustle Economy: Grifters Teaching Grifters

These “gurus” and “coaches” know exactly what they’re doing: they’ve created an economy that preys on the desperate, selling hope in the form of clickbait aspirations. Each influencer, each “life coach,” each self-proclaimed expert is making bank by leveraging the vulnerabilities of the Lost Boys, who are seduced by the promise of easy money, fame, and—let’s be honest—female validation. The young men they’re targeting don’t know any better, because no one taught them anything better. They’re sheep without shepherds, and the only “guidance” they’re receiving is coming from people who are just looking to turn a profit on their insecurities. 

And let’s be clear: there’s no real value in what’s being sold. Hustlers aren’t innovating; they’re replicating the same playbooks, the same formulas, the same lies, and branding it as something revolutionary. They’re conning young men into buying courses, joining mastermind groups, and “leveling up” their personal brands, all while knowing that these Lost Boys are just prey. The real business of the hustle economy isn’t self-actualization or empowerment; it’s self-delusion, mass-marketed and highly profitable.

> The Cost: A Generation Hollowed Out

So where does this leave us? With a generation of men who are nothing but empty shells, men who have wasted their youth chasing shadows, men who wake up one day with nothing to show for their time except a string of expired “opportunities” and a lot of wasted money. Men who have no identity, no skills, and no real place in society. Men who are angrier, more isolated, more vulnerable than ever.

We are producing Lost Boys in factory-like quantities, and the price will be astronomical. A culture built on “influence” over innovation, on *sizzle over steak*, can only go one way: collapse. And when it does, when the next wave of young men finds out that their heroes were hustlers, that their dreams were hollow, that their worth was measured by numbers rather than their true potential, they won’t just be disappointed. They’ll be lost for good. The hustle economy isn’t an answer for these young men; it’s a death sentence dressed as a promise.",Top_Present_5825,336,0.75,466,1731233730,2024-11-10 04:15:30,changemyview,https://www.reddit.com/r/changemyview/comments/1gnxluh/cmv_we_are_producing_lost_boys_in_factorylike/,11,2024
1gnq7gi,CMV: Giving police officers full immunity will be detrimental ,"Not really much more to elaborate on. Our president elect has talked several times about giving police officers full immunity and even recommended giving them “one violent day” or “violent hour” and plans on doing this when he gets back into the white house 

Policie officers are already known for abusing their power, but has went down a bit after George Floyd’s death in 2020. The officers involved were arrested, but if in the future police officers have immunity from prosecution, i think we’ll definitely see a rise in police brutality, resulting in more protests and riots (rightfully so)

Giving someone already in a position of power the ability to do whatever they want will not end well. ",young_comrade_,336,0.7900000214576721,331,1731204842,2024-11-09 20:14:02,changemyview,https://www.reddit.com/r/changemyview/comments/1gnq7gi/cmv_giving_police_officers_full_immunity_will_be/,11,2024
1h1sxtn,CMV: Adultery Should Be Treated as Breach of Contract with Financial Penalties,"Marriage isn’t just about love; it’s also a legal agreement regulated by the government. When you get married, you get a government-issued marriage license, which essentially makes it a formal contract between two people. So, if someone cheats (without consent), isn’t that a clear breach of the agreement? And if contracts in business or other legal contexts come with penalties when broken, why not this one too?

Here’s my view: adultery should be treated as fraud or deceit, not just a personal issue. If one partner cheats, there should be tangible, government-enforced consequences - like fines or losing alimony rights. This wouldn’t make cheating a criminal offense, but it would acknowledge the harm caused and hold the cheater accountable. Right now, the cheated-on spouse often suffers emotionally *and* financially (if they choose to start divorce proceedings), while the cheater faces no real repercussions. That’s just unfair.

If the government is involved in the marriage process from the start, issuing licenses and all that, why shouldn’t they also enforce penalties for breaching this contract? It’s not about moral policing; it’s about fairness and accountability.

Why shouldn’t adultery have legal consequences like other forms of fraud?",SinghStar1,330,0.6800000071525574,635,1732788997,2024-11-28 04:16:37,changemyview,https://www.reddit.com/r/changemyview/comments/1h1sxtn/cmv_adultery_should_be_treated_as_breach_of/,11,2024
1gjysh4,CMV: Lottery games with misleading odds should be illegal,"I'll give you a simplified example. 

A lottery game was advertised as $1 for ticket that is printed out of the machine at the time of purchase. The game was advertised as ""If your number matches our number. You win the prize"". The numbers can be 1 through 45.

So the advertised logic is that you have a 1 out of 45 chance to win.

I bought the ticket and lost.

So after looking online for several minutes, I found an obscure PDF file with the real odds. You have a 1 out of 500,000 chance to win.

How it works is it does a 1:500000 random number generation and if it decides you win, then it prints the ""winning number"" as the number you picked. Otherwise it randomly picks any of the other 44 losing numbers and puts that as the ""winning number"". 

To me, that is straight up fraud. 

It would be the equivalent of me telling you to guess a coin flip, but written on the bottom of my foot is a ""rule"" that lets me flip the coin to the opposite of whatever you picked 499,999 times out of 500,000. Then blaming you for not checking the bottom of my foot.
This fraud has become so commonly accepted that people blame you for taking their game's advertised rules at face value.

This is how the printable EzMatch and Scratch Off tickets work.

All the ""games"" and ""rules"" are obfuscation to hide the fact that the odds are astronomically higher than the known games they advertise (Bingo, 7-11-21, Lotteria, Number Matching, Monopoly, etc). 

The matching numbers they list are also irrelevant since they don't have ANY relevance to whether a ticket is a winning one or not. The numbers are just a façade to fraudulently think that the odds of winning are significantly higher than they really are. 

BTW, the tickets are in the machine with only the front facing so you can't read the back. Also the back contains ZERO information about the real odds. Instead it has a single line of small text that says ""visit the website for the rules"". That is only available after you've bought the ticket. 

Convince me that it isn't fraud to advertise ""games"" with ""rules"", but games and rules advertised don't matter because theres a second hidden set of rules that make you lose way more.",Random-Gif-Bot,322,0.8700000047683716,218,1730781615,2024-11-04 22:40:15,changemyview,https://www.reddit.com/r/changemyview/comments/1gjysh4/cmv_lottery_games_with_misleading_odds_should_be/,11,2024
1gy6nns,CMV: ED meds like bluechew and hims are being vastly over-marketed for younger people,"Erectile dysfunction prescription medications like sildenafil are being sneakingly marketed for younger people for the wrong reasons. They’re being marketed as sexual performance enhancers rather than what they’re supposed to be used for, those with erectile dysfunction. Bluechew is a big one that started this, which uses generic viagra and cialis in their meds, but don’t mention that in their marketing ads. A lot of young people are under the illusion that these are supplements for sex, rather than the fact they actually contain ED medications 

Young people do not need these that often. ED is caused by blood vessel damage or high blood pressure. Psychological ED like performance anxiety, these do not even help that. They performed no better than placebo in performance anxiety studies. They’re also not aphrodisiacs so they won’t help if you’re not already turned on. 

So, how long until the FDA steps in? No different than something like adderall being marketed for cognitive enhancement, and the FDA sure as hell would shut that down very quickly ",rickestrickster,321,0.8700000047683716,191,1732387500,2024-11-23 12:45:00,changemyview,https://www.reddit.com/r/changemyview/comments/1gy6nns/cmv_ed_meds_like_bluechew_and_hims_are_being/,11,2024
1gyvez1,cmv: Abortion bans like the one in Idaho don't actually protect the life of the mother because they were intentionally drafted to allow for excessive danger to women.  ,"Many of the abortion bans are dangerous for women.  Conservatives say these bills aren't dangerous because they provide exceptions for life of the mother.  I actually bought this line to some extent until these news stories started popping up, and even then I was a bit skeptical, but I decided to research these bans myself, and that's when I saw exactly how dangerous they are.

The one in Idaho provides that an abortion may be performed when ""necessary to save the life of the mother"" with no clarification given as far as I can tell. That is both incredibly restrictive language, and incredibly vague. So let's say a woman has a 45% chance of dying if the doctors don't perform an abortion, is doing one ""necessary"" to save her life? What about 10%? With a 2-5 year prison sentence awaiting any doctor who violates these rules, and with them being so strict and vague, it's no wonder than women are being put in dangerous positions.  

""Necessary"" in other statutes and case law is often deemed to include a time requirement. So even if a condition will likely lead to the mother's death, a doctor may have to wait until the situation gets bad enough to actually treat her which further adds to the danger. 

As incompetent as state legislators can be, half of them are lawyers and know exactly what they were doing with language like this.  They are making it as difficult as possible to get an abortion while still telling the public they are protecting the lives of women, even when they are not.

Even if one is pro life, most of them still support protections for the life of the mother. They should want these bans to be repealed and to be replaced with something more reasonable that actually protect the life of the mother  
",StrangeLocal9641,317,0.7300000190734863,573,1732467021,2024-11-24 10:50:21,changemyview,https://www.reddit.com/r/changemyview/comments/1gyvez1/cmv_abortion_bans_like_the_one_in_idaho_dont/,11,2024
1gty4bv,"CMV: Americans and people in the West's criticism of Netanyahu is for the ""wrong reasons"", and would have been the same if any other Israeli was in charge","Israelis hate Netanyahu, but not because of the reasons Americans/people in the world despise him. Israelis hate Netanyahu because he is a corrupted megalomaniac with a god complex, not because of ""war crimes"" or because of his tough stances on Palestinians. In fact most Israelis dislike the Palestinians (especially after Oct7) and share the tough stances on them. 

Even when Netanyahu goes, Israelis still won't support a 2SS (Most of the opposition opposes it), the War will continue and in fact, all of the criticism about Netanyahu for his management of the War and the genocide remarks would have been the same even if Lapid or Yair Golan were in charge, because when it comes to the War and Oct7, most of Israelis are pretty united. (While they are divided when it comes to the Hostage deal, the global Ceasefire now crowd is using the hostages to push a prominent ceasefire that will keep Hamas in power and end the War, while Israelis who want the hostage deal still want Hamas destroyed and to continue the war after the deal)

The Western left who considers themselves as Pro-Israel and anti-bibi, wants Netanyahu gone because they see him as an ""obstacle"" to the 2 State solution (That nowadays no Israeli and no Palestinian support). They don't really care about his domestic corruption and attempts to become a de-facto dictator. At the same time, if you would say to the Israeli public (including the secular centrists who voted for people like Lapid, Gantz and Lieberman) that the world views Bibi as an obstacle to the 2SS, it would make them appreciate Netanyahu for standing up to the world and deflecting pressures. ",PathCommercial1977,314,0.6800000071525574,629,1731909454,2024-11-17 23:57:34,changemyview,https://www.reddit.com/r/changemyview/comments/1gty4bv/cmv_americans_and_people_in_the_wests_criticism/,11,2024
1gx4o9z,CMV: Culling male chicks is the least cruel option after in-ovo sexing,"Several EU countries have banned the practice of culling male chicks because the general population finds it ""icky."" The thing is, factory farming as a whole is inherently icky and culling the male chicks is objectively the most humane way of dealing with the fact that it makes zero economic sense to raise these chickens. Instead of going into the grinder shortly after they hatch, the male chicks are shipped off to live in a warehouse with the absolute worst conditions allowed by law until they're ready for slaughter. So we either kill the chick on day 1 or we kill it on like day 50 after it's spent its entire life inside a windowless warehouse where there's not even enough space to move. Either way, we're killing the chicken and the grinder minimizes the time it has to suffer. 

Raising all of the male chickens also causes a surplus of chicken meat and, since there isn't enough demand for this meat in the EU, it ends up being exported to developing nations and destabilizing their own poultry industry, which will inevitably cause them to be dependent on the EU for food. Without fail, every single time a developing nation has become dependent on wealthier nations for food, it has had absolutely devastating consequences for the development of that nation. So you can't even really argue that ""At least the male chickens are dying for a reason if we slaughter them"" because a) the chickens *literally* do not give a fuck and b) the ""reason"" is to dump cheap meat in Africa. 

Destroying the male eggs before they even hatch with in-ovo sexing is obviously the best option but, as far as I understand, this is still pretty expensive and hasn't been universally adopted. Until the cost for in-ovo sexing comes down, the grinder remains the best option. It would be different if the male chicks were being shipped off to some green pasture to live out their days but this is literally the opposite of what actually happens to them. I would even argue that these bans on culling are a form of performative activism so that privileged Europeans can feel better about themselves while they remain willfully ignorant to the horrors of factory farming. 

I am not vegan and regularly consume mass produced meat, dairy, and eggs. ",Consistent-Gap-3545,313,0.7599999904632568,324,1732270673,2024-11-22 04:17:53,changemyview,https://www.reddit.com/r/changemyview/comments/1gx4o9z/cmv_culling_male_chicks_is_the_least_cruel_option/,11,2024
