post_id,title,text,author,score,upvote_ratio,num_comments,created_utc,created_datetime,subreddit,permalink,month,year
17wrmkj,"CMV: If they are all equally humanely (or inhumanely) killed, there is nothing that makes the consumption of cat meat, dog meat, horse meat, dolphin meat, etc. any more or less moral than the consumption of pork, poultry, beef, fish or mutton.","As someone once said, ""People get outraged about dolphins being caught in tuna nets, but why aren't they outraged about the tuna being caught in tuna nets?""

There is no valid argument given as for why certain animals should be ethical to consume as meat and others should not be (other than, perhaps, that certain animals are killed in more inhumane ways than others, but the objection has often persisted even *if* they were all to be killed the same way.)

**Cuteness:**  The argument is oft-given that dogs and cats are cuter than pigs and chickens, and hence should not be consumed. But this is highly subjective. What if I find chickens to be cute, but don't think cats or horses are cute?

**Intelligence:** The argument is oft-given that dogs, dolphins, monkeys are more intelligent, and hence should not be consumed. But the octopus is a highly intelligent animal, yet people don't object to it being eaten.

**""It's gross"":**  This is also highly subjective. One may think it's gross to eat horse meat, but then again many cultures consume pork while Muslims think pork is despicable. So if I think it is gross but you think it's okay, why should my preferences overrule yours?

&#x200B;",SteadfastEnd,487,0.8100000023841858,468,1700153490,2023-11-16 10:51:30,changemyview,https://www.reddit.com/r/changemyview/comments/17wrmkj/cmv_if_they_are_all_equally_humanely_or/,11,2023
17mtqet,CMV: the United States government should pay teachers similar to military service members relative to experience and education,"I served in the US Army and my final rank was Sergeant (E5). I am currently a math teacher with a MS in Math plus an additional 30 graduate credit hours and 14 years of teaching experience. 

My current salary is $68,000 and I live in a rural area in Northern Georgia. While cost of living is low here, I can't help but look up what my pay would had been had I stayed in the military - even if I stay as E5, with my wife and kid, my base pay plus BAH would put me at around the same as my current salary, without the degrees and I am not even counting my qualifiers that would net higher pay. 

Both teachers and military are performing vital public services, so why is pay gap this enormous? Objectively, my job in the Army was far easier - I only need to focus on my mission and manage fewer than 5 personnel who have to complete basic training/AIT, so in a sense, self-selected. Whereas as a teacher, I am responsible for the learning outcome of 30+ young people who often do not want to be here.

I have to complete 6 years of higher education in STEM program to even get started in my teaching career for my current pay track (I would get paid even less if I only have a BS) plus it took me years in teaching before I firmly grasp the craft of education; whereas I enlisted in the Army when I was 17 with just a HS diploma, promoted to E5 after 2 years in services (I joined as E3 due to JROTC, received a waiver for E4 at 18 months TIS, then promoted to E5 in secondary zone), I know that is a bit faster than most, but I didn't really need to have much qualifications for my enlistment and promotions. 

As an E5, I was highly expendable. I get it that recruitment number are low but someone else could have easily done replaced me. Yet, as a math teacher, it is next to impossible for me to be replaced. Our department have been operating with 
 less than 75% faculty due to multiple people leaving within the past few years and we simply failed to attract new hires. As of the past 4 years, I am the only person in my department who is qualified to teach Statistics, all of us are teaching more students, committing more tutoring hours... The point is, the military recruitment shortage isn't due to low pay, but teacher shortage is.

My view is that Americans should commit to paying teachers just as much as paying military service members, after all, one cannot function without another.",JianJiaHei,479,0.8299999833106995,576,1699013799,2023-11-03 07:16:39,changemyview,https://www.reddit.com/r/changemyview/comments/17mtqet/cmv_the_united_states_government_should_pay/,11,2023
17ybivq,"CMV: If an event uses a city’s taxes, will take place in public, affect the locals, and won’t let the locals watch without paying thousands of dollars then the city’s residents should be able to vote on if the event takes place","Now, I’m not a F1 fan. But I’m disappointed in F1 and feel bad for their Vegas fans. From what I heard, the race really affected the locals and used local taxes. Yet they put up barriers for the sole purpose of keeping the locals from being able to view the race unless they paid thousands of dollars.

Now, IMO I feel like because of this cities should give the residents a voice in if these sorts of events take place in the city. Because from the way I see it, all this race did was take tax dollars from the residents, then spit at their feet by using those same tax dollars to put up barriers just so the people couldn’t see. 

By having a vote, people could choose if they’d want their city to do something like this. 

If someone wants to argue that no city’s population would vote to have a race like this, then maybe F1 could consider how they could be better to their fans/ nicer to locals to make people want their races in their cities.",Lillian822,462,0.9100000262260437,142,1700328952,2023-11-18 11:35:52,changemyview,https://www.reddit.com/r/changemyview/comments/17ybivq/cmv_if_an_event_uses_a_citys_taxes_will_take/,11,2023
17m9hy3,CMV: People in the 1st World are so miserable because they have no perspective,"I feel like all I see on reddit is people whining about EVERYTHING. How LITERALLY EVERYTHING SUCKS. All of the ""misery"" is self inflicted because people have no perspective at all anymore. We used to say ""well let's be grateful for what we DO have because some people in this world have much less than us"". Not anymore, now it's ""everything sucks, where's my house, food costs money, blah blah blah"". I see videos of people crying about inflation in their CARS!! Do they even know how few people get the privilege of owning a car is so many countries? I don't think so. It's incredible what self importance and lack of perspective can do to a person. Do you have food, shelter, running water, electricity, heating, entertainment, etc then you are better off than 99.999% of human history. People need to learn to be grateful for what we do have instead of focusing on the negatives all the time. How many times have I heard this year ""I'm so depressed I'm never going to be able to buy a house""... so what? How many people in this world today would literally kill for what you currently have and all you can do is talk yourself into a depression about not owning more things.",feelingoodwednesday,440,0.699999988079071,359,1698947990,2023-11-02 12:59:50,changemyview,https://www.reddit.com/r/changemyview/comments/17m9hy3/cmv_people_in_the_1st_world_are_so_miserable/,11,2023
17m7807,CMV: Bottled Water is the world's most successful scam,"To start off, allow me to admit that I understand there are cases where bottled water is necessary such as in the recovery of a natural disaster or if tap water is unsafe to drink due to contamination.

That said, for the vast majority of people in the First World, bottled water is a massively overpriced scam.

Firstly, bottled water companies upcharge massively due to the cost of producing plastic bottles, so bottled water costs hundreds of times more than tap water. It would be like paying $300 for something you can get for $1.

Secondly, bottled water is unnecessary if your concern is purification/safety since municipal systems are actually held to similar, if not higher, standards. The bottled water industry actually often uses the same source in fact.

Thirdly, bottled water is perishable since the microplastics break down. I'm sensitive to it. To me, bottled water tastes terrible because it makes me think of liquid plastic.

Fourthly, bottled water is a huge strain on the environment.",Dawntodusk87,413,0.8399999737739563,302,1698941971,2023-11-02 11:19:31,changemyview,https://www.reddit.com/r/changemyview/comments/17m7807/cmv_bottled_water_is_the_worlds_most_successful/,11,2023
17vzoxn,CMV: People who plan not to vote for Biden because of his handling of the Israel-Palestine conflict are damaging their own cause,"I understand that there are a lot of emotions about the current conflict, but the other day there was a pro-Palestine rally in my very liberal neighborhood and people were chanting “Fuck Joe Biden!” 

I was shocked and have since read that, among those who support Palestine, some are saying that Biden’s trip to Israel, his plan to send economic support for their army, and his speeches supporting them have cost him their vote in the 2024 presidential election.

Meanwhile, Trump is the one who recognized Jerusalem as Israel’s capital, called for a ban of all Muslims immigrating to the United States and has recently suggested that we should ban anyone from Gaza from entering the United States. I read a quote from him stating that, if he were elected in 2024, “Israel would never have to be prepared” against future attacks, implying he would completely destroy Gaza to remove that threat. In short, Trump’s position is much more strongly pro-Israel and virulently anti-Palestine than Biden.

Additionally, although Biden has supported Israel, he has also reportedly urged caution about the scale of the invasion, voiced disagreement with Israel’s handling of the war, and insisted on humanitarian pauses and delivery of aid to the Gazan people. In short he seems to be a voice of reason and advocating for civilian safety.

Granted that some progressives in deep blue states abstaining from voting for Biden may not swing the election to Trump. However, if it does and Trump assumes power, I think many of the people who support Palestine will be sorry with their decision.",Advanced_Piano1062,398,0.7400000095367432,505,1700071778,2023-11-15 12:09:38,changemyview,https://www.reddit.com/r/changemyview/comments/17vzoxn/cmv_people_who_plan_not_to_vote_for_biden_because/,11,2023
185skh3,CMV: I think it's insecure for people to try to control whether or not their partner watches p*rn,"I'm genuinely opened to have my opinion changed on this.

I think the porn industry is exploitative as hell. I think using porn on a daily basis is bad for your mental health and how you view relationships with people.

I definitely see the ethical concerns with porn consumption itself.

What bothers me is the insecurity people have with it.

I view myself as an inherently non-jealous person. It takes an awful lot for someone to make me jealous with my partner.

I think, I could see myself getting jealous if my boyfriend was getting nudes from another girl directly or sex tapes.

I can't understand why being interested in seeing another person naked would be an issue for someone. Isn't that just biology? Especially for men who are much more visual.

I think that having to shut that off to cater to a partner's insecurities is unreasonable. It's like asking someone to become asexual for anyone but you.

I genuinely don't understand. I've seen so many people talk about their partner's pornography use or even finding other people attractive on social media and becoming jealous over it.

Why is it ok to cater to that insecurity? Isn't that unhealthy in a relationship?

I also think men have different biological urges than women. Like, alot of men will get physically uncomfortable if they go too long without ejaculating. If they don't do it while awake, they'll do it in your sleep. I view it as a regulation like peeing or pooping, and porn just making it simpler.

I think it becomes an issue when it interferes with your sex life or you expect your partner to fill the void pornography does for you.

Can anyone enlighten me on why I could be wrong in my perception of this?",Successful_Radish484,372,0.6700000166893005,886,1701165601,2023-11-28 04:00:01,changemyview,https://www.reddit.com/r/changemyview/comments/185skh3/cmv_i_think_its_insecure_for_people_to_try_to/,11,2023
187jsmw,CMV: American politics has become the sister of Religion.,"American political discourse today is based on faith and not fact.  Any discussion about politics is based on what the participants are told, and not what they know.  Major “news” outlets have a doctrine that they push out, and people self identify with one doctrine or the other and then participate in that doctrine with blind enthusiasm.

The facts are there if you look and read and decide, but that doesn’t happen in American politics.  American political discussion is based on beliefs and faith in a higher authority.  American political discussion is just the regurgitation of “talking points”, or said another way, the ideology that is created for the faithful.

Deviation is not tolerated.
The word is absolute.
Non believers are the enemy.",jennimackenzie,371,0.7900000214576721,324,1701354470,2023-11-30 08:27:50,changemyview,https://www.reddit.com/r/changemyview/comments/187jsmw/cmv_american_politics_has_become_the_sister_of/,11,2023
186krbt,CMV: hell is a horrible concept morally,"This post goes for anybody who belongs to the abrahamic religions or any other religion that believes in hell 

Many people have made the argument I’m gonna make here against religion but I’m asking it because I’ve never heard a good refutation and it is one of the biggest points of argument for me that these religions are fictional

So hell is universally considered to be a place of eternal torture, involving burning for the unfortunate beings who end up there. This goes on for eternity. Can you imagine what somebody would have to do to you for you to want them to burn *for the rest of eternity*? Our minds can’t even comprehend a timeframe that long. It will never end. Imagine if we kept prisoners alive permanently somehow and kept them in a cell for the rest of the universes existence. And that’s only a cell, that’s not burning them the entire time it’s happening

And worse yet, this doesn’t just go for somebody who mercilessly rapes then murders an innocent child, this goes for me, and most of the people who have ever existed and exist today because we either reject God or worship the wrong one. Why should a Hindu who is born in India and spends their entire lives only knowing Hinduism be tortured for the rest of eternity? Why should an atheist scientist be tortured for the rest of eternity for simply learning about science and realizing that fundamentalist abrahamic religions don’t work well with it? 

This honestly seems like one of the most evil beliefs one can have to me, given that the religious person believes it literally and not metaphorically. I can see believing that people will go to a metaphorical hell for not adopting certain beliefs, though even that I disagree with cause it doesn’t apply to everyone

I’ll give Muslims a bit of leeway for this cause at least, according to what I’ve been told as I was converting to Islam, a persons exposure to the religion is taken into account and for some I guess there is another challenge after they die if they don’t make it to jannah. But even then, many ex Muslims go on to be perfectly decent people so this is still morally reprehensible

For Christians from what I know this is a hard set rule that if you reject Christ, you burn for eternity

Please if you have a good argument against this, try to change my view. I have an open mind",jxssss,371,0.800000011920929,495,1701246708,2023-11-29 02:31:48,changemyview,https://www.reddit.com/r/changemyview/comments/186krbt/cmv_hell_is_a_horrible_concept_morally/,11,2023
17lp7ob,CMV: Weddings are pointless and a waste of money,"Hello all, 


I would like you to change my view on weddings as I've been getting heat from my family for not wanting to go to weddings (or any social gathering in general tbh).

I find weddings completely pointless. They're just a show of how well off the parents are and how great their normal kids are. I don't get the point of dressing nice, to sit in a venue who's owners are too cheap to properly run heat or ac depending on the time of year, despite the fact they're charging boatloads of money, to eat generic and over hyped food from a vendor that prob got a new watch over the overpriced menu, to dance like awkward fools on the dance fool and just stareing at people you generally don't care about after the event 


I'm Arab/Muslim so we don't even have booze at our weddings (so don't go ""open bar hur dur). 


What's the obsession with it and why am I expected to go, even if they're my cousin or sister.",abuchewbacca1995,370,0.699999988079071,801,1698880468,2023-11-01 18:14:28,changemyview,https://www.reddit.com/r/changemyview/comments/17lp7ob/cmv_weddings_are_pointless_and_a_waste_of_money/,11,2023
183wtc2,"CMV: Female superheroes are ‘failing’ because they have no character arc, not because of PC culture","Seen a few posts on this topic recently, and I disagree with all of them. 

The reason female superhero movies are doing less successfully is primarily because their character arcs deviate from that of the standard superhero. The standard superhero starts off as weak person with low status in society (or a rich playboy with pain on the inside), acquires powers in a freak accident, goes through formative trials that test their abilities and their values, and then hones both of these just in time to fight the main villain. Female superheroes don’t have this same character arc: they start off every movie all powerful, like a literal invincible god. Their character arc tends to be, really, I don’t know, nothing… In essence, every single female superhero is Superman, except without kryptonite or Lois Lane. 

Take Wonder Woman for example. She starts off as a literal Amazon Goddess. Her only character arc is that she has to be taught by a man how to function in human society (sarcasm to point out that it was actually kind of a sexist movie). 

Take Captain Marvel for example. The most powerful Avenger who literally couldn’t be involved in all the movies or she’d break the story. She started off her first movie all powerful, just minus her memory… I’ll leave out for spoilers. Needless to say, she doesn’t really have significant personal growth, or growth in her powers. Wonder why her second movie bombed so hard.

Why can’t they just treat a female superhero like the first Spider-Man? Nerdy person gets superpowers, gets confidence, gets love interest and fights bad people? Is it maybe because the directors themselves are sexist and think people won’t take a female superhero seriously unless they make them incredibly powerful?

It’s not the fact that people don’t want to see a woman beat up men. People love superhero movies. Just stop treating women completely differently than men when you make them into heroes, it’s not hard.",Moonlight-gospel,365,0.8199999928474426,297,1700955315,2023-11-25 17:35:15,changemyview,https://www.reddit.com/r/changemyview/comments/183wtc2/cmv_female_superheroes_are_failing_because_they/,11,2023
17nl4so,"CMV: ""baby on board"" stickers should be removed when the baby is not on board","the original use for these were for first responders to know to look for a baby, but then people never remove them when their baby is not on board or when their kids grow up. i know an emts and firefighters will look in the back seat for signs of a child, but it's a waste of their time if there is no baby. if the adults are unconscious, they could spend time looking for an injured child. i dont think people are actually more careful around those cars and half of the time they don't even have car seats. i think the decals that have the families and a dog or whatever is better. it says ""this is my family who might be in the car"" not ""these people are on board right now so care to them in an accident.""",1111hereforagoodtime,358,0.7599999904632568,180,1699102721,2023-11-04 07:58:41,changemyview,https://www.reddit.com/r/changemyview/comments/17nl4so/cmv_baby_on_board_stickers_should_be_removed_when/,11,2023
17uik1y,CMV: The idea that all Americans are stupid and the educational system as a whole is a failure is wrong.,"So I don't get why so many people think all Americans are stupid. Yeah you're gonna get ignorant people, especially on YouTube or TikTok where the put the dumbest people in the spotlight for clicks. But the vast majority of people I talk to who have a High School diploma are decently competent in most subjects. I'm sure if you went to London, Istanbul, Moscow, or any other major European city, you'll find similar levels of completely oblivious people, it just seems like everyone likes to pick on Americans for one reason or another. Obviously there's many problems with the education system but the stereotype that ""All Americans are stupid"" is factually incorrect.",Zodiac1919,349,0.7099999785423279,516,1699903625,2023-11-13 13:27:05,changemyview,https://www.reddit.com/r/changemyview/comments/17uik1y/cmv_the_idea_that_all_americans_are_stupid_and/,11,2023
