post_id,title,text,author,score,upvote_ratio,num_comments,created_utc,created_datetime,subreddit,permalink,month,year
1gingrk,"CMV: Homeschooling is at best moderately, and at worst severely damaging to a child.","Academically, even with access to curriculum supports, almost all parents are going to struggle to provide a comprehensive education in all subjects to the level a public school would. Even if the parent has a strong academic background, they will be missing elements of other subjects or of pedagogy in general. They may struggle to fully identify progress or gaps in learning that go on to multiply in the subsequent years.  
  
Beyond academics, a key function of school is the social aspect - to expose young children to their peers and social scenarios both positive and negative for them to navigate in preparation for adulthood. You can try to supplement this with playgroups, team sports, etc. to some extent, but you're not going to replicate the nature or frequency of school relationships.

Finally, the fact that the majority of their peers will have these common experiences will leave them perpetually feeling like an outsider, even once school is well behind them.

All of the above leads to believe homeschooled students are being done a disadvantage by parents who insist on it, usually for self-serving, insular reasons, or to ensure they are not taught aspects of the curriculum they disagree with. Anecdotally, I have several friends who were homeschooled (only until high school) who either express regrets of their own, or showcase social or academic deficiency as a result; I am sure the negatives outweigh the positives.",Rome_Leader,1012,0.7400000095367432,681,1730642388,2024-11-03 07:59:48,changemyview,https://www.reddit.com/r/changemyview/comments/1gingrk/cmv_homeschooling_is_at_best_moderately_and_at/,11,2024
1gv74sz,CMV: charging your kids rent no matter how old they are is ridiculous and destroys their only stable security.,"What happened to people loving their kids unconditionally? What happened to giving your kids a home to come back to when times are tough? A home should be a safe haven and you should welcome your kids back no matter what. Teach them to work with money responsibly in different ways, not by destroying their only place of comfort and trust that they can come back to when they make a mistake! If people seriously refuse to house their kids just because they could not save enough or could not make enough for their “rent” then I’m loosing faith in humanity. Everyone deserves security and love even if they are not perfect. not caring if they end up on the street is not love and care, it’s neglect! ",Ok-Paramedic8197,924,0.75,456,1732048279,2024-11-19 14:31:19,changemyview,https://www.reddit.com/r/changemyview/comments/1gv74sz/cmv_charging_your_kids_rent_no_matter_how_old/,11,2024
1gk7ekw,CMV: It is okay to criticize Non-Western traditionalism,"I feel like a lot of left-wingers are stuck in the mindset, that Non-Western cultures are inherently less oppressive and more free than Western cultures, even though they are much more conservative than Western ones. American right-wing Christians have much more in common with Conservative Muslims than they think, compared to Atheist Progressive people. It is just they use the same tactics in controlling societies, but they happened to be in different teams.

It is just happened, that Non-Western traditionalists don’t have political power to have influence in Western politics and install their supremacy, so they fall into the category of oppressed ones, however the left-wingers fail to realize, that they are not their ideological allies. In fact they will oppose Western equality until they will have the right to install their rules. 

I have no idea, how Western societies can tolerate their traditionalism as the culture, if it is inherently oppressive. For the same rules we can perceive culture of some hardcore weird Christian sects of Deep South, like Quiverfull, their own culture, but we are aware, that this Deep Southerner Christian culture is really bad for USA as a whole and it would be better, if it was disbanded. I am aware, sone of y’all will say, that they don’t have a culture etc, however mostly it is political instrument to fight against these cultures rather than a correct statement (I also hate Christianity too).

Especially, i see this problem with Non-Western men rather than with Non-Western women. Non-Western women actually care about relationships between different groups and collective callout of bigotry, while retaining their culture in more ecological ways, while Non-Western men tend to be hypocrites in using only anti-racist rhetoric against White racists (who they actually share most of core beliefs with, but they are in different teams), while actively participating in sexism and homophobia, defending their actions with “muh these are our traditions” shield. ",Karandax,781,0.8600000143051147,274,1730815433,2024-11-05 08:03:53,changemyview,https://www.reddit.com/r/changemyview/comments/1gk7ekw/cmv_it_is_okay_to_criticize_nonwestern/,11,2024
1gww5gv,CMV: American “patriots” who sympathize with Putin are not actually patriots,"I don’t think it’s reasonable to say you’re a patriot and that you support western values and then turn around and sympathize/ show support for authoritarian dictator Vladimir Putin. You either are a patriot that supports western values, or you are *not* a patriot and support fascism. Being a patriot means you’re proud of your country and your countries values. In the United States, our values mainly consist of equality, diversity, freedom, democracy, and equal opportunity, just to name a few. 

If you call yourself an american patriot, it means that you are proud of these values that your country holds. If you’re proud of equality, why are you supporting a foreign dictator who doesn’t believe in equality? Members of the LGBTQ community are terribly persecuted in Russia, and the majority of russians support laws discriminating against the gay community. Freedom? If you claim to be an american patriot, you should clearly support freedom. There is alot of censorship in russia and freedom of speech is pretty much non existent there. Putin has his political opponents  jailed, executed or exiled. No fair elections. Doesn’t sound like freedom to me… 

Democracy? I’ve pretty much just explained how there is no democracy in Russia. No fair elections, having political opponents killed or jailed, limited or no free speech, no freedom of expression. If you sympathize with Putin, you don’t believe in any of those things. So you don’t actually care about American values.

Equal opportunity? Simply doesn’t exist in Russia. 

There are so many Americans sympathizing with or even idolizing Putin, and they claim to be American patriots. Most of these people are among the MAGA crowd of course, but not all of them. 

I just don’t understand how someone can stand for both things. CMV ",bidensonlyfanz,761,0.7599999904632568,591,1732238956,2024-11-21 19:29:16,changemyview,https://www.reddit.com/r/changemyview/comments/1gww5gv/cmv_american_patriots_who_sympathize_with_putin/,11,2024
1grcnjc,CMV: not all cultures deserve respect ,"hot take but yeah. i come from a country that thrives off it’s cultural practices and I partake in them. I believe culture is the very essence of humanity. however i don’t believe ALL cultures deserve to be respected and tolerated. some examples of cultural practices i’ve come across that i will never personally tolerate or understand:

1. women who leave marriages should walk out with the clothes on their backs and nothing else. this happens close to where i live. as a woman, if uou choose to leave your marriage for whatever reason, you don’t get to keep ANYTHING in the house with your husband. not even your clothes and personal belongings.

2. forced marriage. no no no NO. i don’t even need to explain myself for this. 

3. brides drinking water off their husband’s feets. if you’re on instagram reels a lot you’ll know what i mean. disgusting and degrading towards the woman. 

",ZealousidealWorth986,709,0.7900000214576721,350,1731611632,2024-11-14 13:13:52,changemyview,https://www.reddit.com/r/changemyview/comments/1grcnjc/cmv_not_all_cultures_deserve_respect/,11,2024
1gh685o,CMV: We actually fail students by not failing students,[removed],EternalSophism,677,0.949999988079071,348,1730470006,2024-11-01 09:06:46,changemyview,https://www.reddit.com/r/changemyview/comments/1gh685o/cmv_we_actually_fail_students_by_not_failing/,11,2024
1gly6bc,CMV: Terms Like 'Incel' Prove That We Reduce People's Worth to Sexual Success,"Let’s start with the term “incel,” which often reduces a person’s value to whether they succeed in the dating world. I think this is a narrow view. After all, it overlooks bigger struggles, like isolation and the lack of meaningful relationships, which are real issues. When we focus only on sexual success, we miss the chance to understand deeper emotional needs and human dignity.

Indeed, not all men who identify as “incels” (or are labeled as such) see others as mere objects for sex. However, the culture around the term often promotes (and proves) a transactional view of relationships, where human connections are reduced to something that validates someone’s identity. In my opinion, this directly takes away from the true depth and respect that relationships should have.

Of course, misogyny, toxic masculinity, and objectifying women are serious problems, no doubt. But I think the bigger issue is that society struggles to understand human dignity. We need to see each other as whole, multi-dimensional people, not as objects to conquer or manipulate. Respect should come from this deeper recognition.

Yeah, relationships are naturally complicated, and we all want intimacy and connection. But they shouldn’t be seen as transactions, where someone’s worth is based only on what they can give in return.

In the end, I believe that sexual success should never define a person’s worth or the health of a relationship. So, when society overemphasises it, we set up unrealistic expectations, frustration, and lose sight of the emotional bonds that make relationships last.

Consequently, societal expectations impact relationships, but we need spaces where people can connect authentically, without pressure to meet shallow standards. The goal isn’t to eliminate all expectations but to shift the focus away from appearances or sexual success and make room for genuine, meaningful connections.",borisdandorra,673,0.6399999856948853,732,1731006127,2024-11-07 13:02:07,changemyview,https://www.reddit.com/r/changemyview/comments/1gly6bc/cmv_terms_like_incel_prove_that_we_reduce_peoples/,11,2024
1gvof1v,CMV: Pedo hunters/ Vigilantes are NOT doing the right thing ,"
You know, the videos on social media going viral of “pedo hunters” luring men in and then proceeding to humiliate them in public/ beat them and 9/10, they don’t even call the police. So what’s the point of even luring them out if you’re not even going to call the police and report them? Any reason you can think of just leads to these pedo hunters getting some sort of gain/satisfaction from it, and not that they actually care about stopping pedos. If they actually cared about stopping it, they’d have the person arrested instead of just humiliating them and then letting them go to potentially do the same again. 

1: They go viral 
2: They have an excuse to physically assault someone without legal consequences, because they know these guys they’re assaulting won’t call the police because of what they’re being accused of could also get them arrested 
3: They get to look like “hero’s” for beating up a dude who is accused of trying to meet up with children. 

Let me make myself clear, i have absolutely no sympathy for pedophiles. I wish they’d all just drop off the face of the earth. However, this affects much more than just the men caught in these stings. It affects their wives if they have one, their children, their siblings, their family. Anyone closely associated with this person who goes viral will be humiliated aswell. 

Not to mention, some men in this situation actually didn’t know the person was underage until they were already at the meet up location: 

https://amp.theguardian.com/uk-news/2013/oct/25/vigilante-paedophile-hunters-online-police

Some have died 

https://www.nytimes.com/2020/11/19/world/europe/netherlands-pedophile-hunters.html

Either call the police immediately after luring these men out, or sit back and let the police catch them themselves. This whole “look at me i’m a hero because i just beat up a guy and shaved his head and made him eat dog food because he tried to meet a 15 year old boy” isn’t justice, it’s just unnecessary violence. Besides, it isn’t their place to deliver justice, it’s a judges place. 

CMV
",bidensonlyfanz,663,0.7699999809265137,594,1732105904,2024-11-20 06:31:44,changemyview,https://www.reddit.com/r/changemyview/comments/1gvof1v/cmv_pedo_hunters_vigilantes_are_not_doing_the/,11,2024
1gr1tbe,CMV: It isn't hyperbolic for the west to be worried about the rise of fascism,"Like clockwork, economic downturn inevitably leads to populists using minorities and migrants as cultural scapegoats to solve economic problems - and in turn disillusioned citizens become increasingly disgruntled with existing political structures. It's a fertile space for authoritarian leaders to promise swift and easy solutions to complex questions.

The Great Depression and the post-WW1 economy spurred the rise of the Nazis, Mussolini's Fascist Party and Franco’s Dictatorship.

Here in the UK movements like the BUF, National Front and now arguably UKIP/Reform have bubbled up during The Great Depression, Stagflation and the various modern financial crises respectively.

Even eastwards, while not strictly a fascist state, the dissolution of the Soviet Union opened the door in Russia for far-right, nationalist and authoritarian movements that still maintain power to this day.

It's not hard to draw comparisons between these examples and our contemporary lay of the land. We know the economy isn't ideal for most people right now. We know it's the highest concern for most of a given electorate. We know that minorities and immigrants are being touted as the solution to many of those concerns. We know that sadly, a great deal of those solutions are veering into dehumanization and will only continue to do so while populists continue to win support.

I don't believe we're standing right at the doors of fascism at this very moment and I basically believe many of our institutions can withstand authoritarian power grabs for the time being. But it's my view that a worst-case scenario of a western fascist state - or a fascist movement with a lot of support - is an increasingly possible reality that its pretty reasonable to actively worry and talk about.",hotdog_jones,609,0.699999988079071,721,1731579850,2024-11-14 04:24:10,changemyview,https://www.reddit.com/r/changemyview/comments/1gr1tbe/cmv_it_isnt_hyperbolic_for_the_west_to_be_worried/,11,2024
1gu9whc,CMV: Servers should pay taxes like everybody else,"So Trump and Harris both supported changing the system so that servers don't pay taxes on the tips they receive. But can someone tell me why they shouldn't pay taxes on that income like every other worker? Like they are lower page than the average worked afaik, sure, but why should other workers that make below average money pay a higher percentage of their income as taxes than servers specifically? This makes no sense to me. Like why should the dishwasher who makes less than waiters pay a higher percentage of their income in taxes? ",Plane-Tie6392,594,0.7699999809265137,774,1731950169,2024-11-18 11:16:09,changemyview,https://www.reddit.com/r/changemyview/comments/1gu9whc/cmv_servers_should_pay_taxes_like_everybody_else/,11,2024
1gp868o,CMV: Sex Strikes and the General 4B movement is ineffective. (At least in the States),"Now I imagine most people already know what the 4B movement is. For those that don't, it is a movement started by women in South Korea where women will be celibate, not get married, not have kids and not have sex with men. Sex strikes are just the latter part.

Now, this concerns the United States, South Korea I've heard plenty of horror stories regarding systemic sexism and thus can understand why those women perform this movement, but its strange when looking at the states.

1. Conservative men are typically very Religious, they not only preach against hookup culture but support celibacy for women and are extremely anti abortion. The 4B movement is everything they want out of women by preventing more abortions and not having sex outside of marriage.

2. Conservative men are not going to go out with more left leaning women who do not share their values, most of these men despise feminists and they have no problem with women they have no interest in not dating them.

3. No Conservative man wants left leaning women to procreate, why would they want more people in future generations to challenge their values instead of populating the future with children who subscribe to their views.

4. This hurts liberal men. Men who are feminists or are sympathetic to these women are far more likely to date and marry the women in these movements, and thus they are hurt by this movement, while nothing changes for conservative men.

In general, it seems like the 4B movement is self defeating and gives conservative men exactly what they want while hurting both left leaning men and women.

CMV",LynxBlackSmith,590,0.6200000047683716,1704,1731372091,2024-11-11 18:41:31,changemyview,https://www.reddit.com/r/changemyview/comments/1gp868o/cmv_sex_strikes_and_the_general_4b_movement_is/,11,2024
1gvw1rk,CMV: Modern Politics is no longer Left/Right but Up/Down on Maslow's Hierarchy of Needs,"Modern politics is no longer represented by Left/Right, but instead by Up/Down on Maslow's Hierarchy of Needs. Those needs are portrayed in the shape of a pyramid, as an individual's most basic needs must be satisfied before working towards higher-level needs. The levels are the following, starting from the bottom:

1. Physiological needs
2. Safety needs
3. Belongingness & Love needs
4. Esteem needs
5. Self-actualisation

Currently, based on the issues that Left/Right-wing parties identify with, it's possible to observe a shift from traditional economic/ideological divides towards a division based on different levels of Maslow's hierarchy.

Right-wing parties generally prioritise issues related to the lower levels of the hierarchy, such as Physiological needs (economic stability, food prices, gas prices) and Safety needs (crime, immigration control, self-defence). 

Left-wing parties, on the other hand, prioritise issues related to the higher levels of the hierarchy, such as Belongingness needs (diversity, equality, inclusion), Esteem needs (social justice, representation in media) and Self-actualisation (activism, environmental sustainability).

This is also the reason why a lot of people on either side are unable to comprehend the issues that matter to the other side. If you have to satisfy your Basic needs (Physiological & Safety), you will find Psychological needs (Belongingness, Esteem) to be irrelevant to your current situation, as they're luxuries you can't afford. On the other hand, if you have your Basic needs satisfied already, you'll consider (moderate) increases in prices and a (general) decrease in safety quite irrelevant, as it doesn't affect you that much personally.",Security_Breach,554,0.6899999976158142,388,1732126417,2024-11-20 12:13:37,changemyview,https://www.reddit.com/r/changemyview/comments/1gvw1rk/cmv_modern_politics_is_no_longer_leftright_but/,11,2024
1gl5345,"CMV: Most reddit mods are biased and remove/leave content which they personally disagree/agree with, despite it violating/not violating the rules of the subreddit.","Alright, let’s talk about something I’ve noticed happening on Reddit.   
  
Moderators there are supposed to be impartial, right? They’re tasked with enforcing rules fairly, keeping things balanced, and making sure discussions stay open for everyone. But lately, it seems like some moderators are letting personal beliefs influence what stays and what goes.   
  
They’re picking which posts stay visible based on whether they agree with them or not, which can feel unfair to a lot of users. Sometimes, posts that are technically against the rules are allowed to stay up if they fit a certain narrative. And other times, posts that don’t break any guidelines get removed because they don’t align with a particular perspective. This inconsistency in enforcement can lead to a sense of unfairness for a lot of users who feel like the playing field isn’t even.   
  
What I am seeing as a result is that Reddit is turning into more of an echo chamber in certain spaces. Many subreddits tend to show only one side of a conversation, one perspective. If you’ve got an opposing opinion, or you want to question the main views in those subs, it’s tough to have your voice heard.  


Take r/pics for example, we know that it got so much bad rep for political posts throughout the 2024 US Presidential Election cycle, I mean all of you who are active on that subreddit saw how we had 10s of posts everyday where embarrassing pictures regarding the two candidates were shared.   


But I saw that the posts which were against Donald Trump (Republicans) got 1000s of upvotes and comments. While the ones against the Democrats, got removed by mods there fairly quickly. Even though the posts did not break any rule.  
  
I believe this kind of moderation is harmful to free speech and people deserve a chance to share their perspectives in an open forum and feel confident that the rules are applied the same way to everyone.   
  
That said, I’m open to changing my mind on this. If there’s a valid reason why this approach to moderation is necessary or if someone can make a solid case for how it’s ultimately better for the community, I’m all ears. I’m not set in stone here—if there’s a perspective I haven’t considered, I’d genuinely like to hear it.",Embarrassed-Try4601,545,0.8500000238418579,311,1730917055,2024-11-06 12:17:35,changemyview,https://www.reddit.com/r/changemyview/comments/1gl5345/cmv_most_reddit_mods_are_biased_and_removeleave/,11,2024
1h3es22,CMV: Lobbying is the key reason that Americans are suffering ,"I have several reasons I believe this. 

1. The real constituents of politicians isn’t people, it’s corporations. Politicians need to perpetually financially audited. 

2. The senate and house votes do not represent public opinion because of lobbying. They  are literally undermining democracy. 

3. Reforms are stagnated. We can’t even get good healthcare bills passed because big insurance, pharma, healthcare providers will lobby against it. 

4. Tax cuts beneficial to the rich by lobbyists representing the rich. Reagenomics doesn’t bloody work. 

I mean we could all keep going im sure. I see no light at the end of the tunnel unless lobbying is somehow banned, criminalized, and politicians are frequently investigated. They should be public servants not becoming mega millionaires. ",Successful-Topic7850,535,0.8500000238418579,358,1732980110,2024-11-30 09:21:50,changemyview,https://www.reddit.com/r/changemyview/comments/1h3es22/cmv_lobbying_is_the_key_reason_that_americans_are/,11,2024
1gu3cl1,CMV: Feeding your children nothing but junk food is child abuse ,"I’ve seen this happen a lot in person and online. I’m sure everyone has seen the viral videos on tiktok or instagram like “pack my child’s lunch with me” or “plate my child’s dinner with me” bla bla bla, and it’s just unhealthy garbage like powdered donuts, gummies, frozen pizza, frozen nuggets, soda etc. Never anything healthy. I also know an insane number of parents who almost exclusively feed their children junk food. Little debbie’s or dry cereal for breakfast, frozen dino nuggets for lunch, frozen pizza for dinner. 

I don’t see an issue with allowing children to have junk every now and then, but every single day it’s extremely harmful to their physical health and will cause issues in the long run. The child can’t just go get healthy nutritious food themselves, and are only able to eat what their parents prepare for them, so i see this as abusive. 

It shocks me that there are so many people out there who see nothing wrong with this, so maybe i’m overreacting? CMV",young_comrade_,524,0.8100000023841858,570,1731932091,2024-11-18 06:14:51,changemyview,https://www.reddit.com/r/changemyview/comments/1gu3cl1/cmv_feeding_your_children_nothing_but_junk_food/,11,2024
