post_id,title,text,author,score,upvote_ratio,num_comments,created_utc,created_datetime,subreddit,permalink,month,year
15gq2ic,"CMV: If people have different temperature preferences for a shared space, they should accommodate those who prefer it cooler.","This is with respect to climate-controlled environments where heating/cooling costs are either not prohibitive or not the responsibility of the occupants. (I agree that it's necessary for people who like it cold to tolerate some discomfort if maintaining their preferred temperature is unaffordable.) People who feel that a room is too cold can dress in as many layers as they require to be comfortable, but people who feel too warm have much less ability to mitigate their discomfort. This is especially true of spaces like schools and offices where a dress code requires more than just minimal clothing. I'm not opposed to compromise, but in situations where there is no temperature that's acceptable to everyone, the group should defer to those who want it cooler.",PurePerfection_,465,0.8399999737739563,417,1691025620,2023-08-02 20:20:20,changemyview,https://www.reddit.com/r/changemyview/comments/15gq2ic/cmv_if_people_have_different_temperature/,8,2023
15p2lws,CMV: The Selective Service System should require both male and female U.S. citizens to register,"The Selective Service System should require all Americans to register, including female Americans, because if male and female Americans have equal rights then male and female Americans should have equal civic duties to the United States. To answer the two most common arguments to this:

Argument 1: What about the biological differences between male and female humans?

Answer 1: Although I do not deny the biological differences, the Selective Service System currently only drafts able-bodied male Americans who pass the physical strength requirements. If female Americans were also drafted, the same process would apply so no one who is not physically capable will be drafted. Therefore, the biological differences won't create an unfair draft.

Argument 2: No one should be required to register.

Answer 2: I completely agree except America’s leaders agree that despite the success of the All-Volunteer Force, registration with Selective Service must continue as a key component of national security strategy. There is no way that America’s leaders would ever allow for registration to end so this is the next best solution for equality and civic duty to the United States.",Miky2025,444,0.8600000143051147,649,1691841072,2023-08-12 06:51:12,changemyview,https://www.reddit.com/r/changemyview/comments/15p2lws/cmv_the_selective_service_system_should_require/,8,2023
15h4pfx,CMV: moving on from someone who is deceased is easier than moving on from someone who is still living.,"I’ve been divorced now almost 20 years and my ex is still alive and well.  Through social media and mutual kids we stay in contact although at a bare minimum.  I’ve since remarried, relocated, and started a new family with new friends.   My ex wife still pops up in my dreams in a positive way at least once a week.   I’ve lost friends, relatives, and coworkers due to death and it’s always easier to except that they are gone.  I still miss her and consider her my number one even though it’s 100% obvious she isn’t.  The day she passed away I believe I will feel the biggest sense of relief.",Jaaveebee123,437,0.8600000143051147,85,1691070348,2023-08-03 08:45:48,changemyview,https://www.reddit.com/r/changemyview/comments/15h4pfx/cmv_moving_on_from_someone_who_is_deceased_is/,8,2023
16095rl,CMV: we should get rid of the TSA's current airport security and replace it with standard metal detectors,"I believe that while not entirely useless, the TSA is security theater. In tests, the TSA fails to identify weapons and other dangerous contraband 95% of the time. 

Source: [https://reason.com/2021/11/19/after-20-years-of-failure-kill-the-tsa/](https://reason.com/2021/11/19/after-20-years-of-failure-kill-the-tsa/) 

Meanwhile, travelers are now forced to arrive at the airport 2 hours early or more, lest the TSA stop them. Once at the airport, travelers are subjected to stringent and illogical rules. You can't bring more than 3 oz of a specific liquid, and it has to be put in a quart sized bag. But if it's in your checked bag, suddenly it's fine. You can buy water once you get past TSA, but it's always much more expensive than water you'd buy outside of the airport. It's a price gouging scam. 

The TSA also discriminates against various minorities. Black women get their hair searched by the TSA. Since the TSA agents put the gender they assume a passenger to be into the machine, and it scans that way (if an agent puts male in for someone who is biologically female, their breasts will get flagged), LGBTQ passengers who's appearance may not match their physical sex are often flagged by the scanners and forced into a patdown. Breastfeeding mothers are also often required to have their breast milk tested, which is ridiculous. 

Sources: 

[https://essence.com/news/tsa-will-stop-searching-black-womens-natural-hair/](https://essence.com/news/tsa-will-stop-searching-black-womens-natural-hair/) [https://www.propublica.org/article/tsa-transgender-travelers-scanners-invasive-searches-often-wait-on-the-other-side](https://www.propublica.org/article/tsa-transgender-travelers-scanners-invasive-searches-often-wait-on-the-other-side)  

[https://www.tsa.gov/travel/security-screening/whatcanibring/items/breast-milk#:\~:text=TSA%20officers%20may%20need%20to,not%20plastic%20bags%20or%20pouches](https://www.tsa.gov/travel/security-screening/whatcanibring/items/breast-milk#:~:text=TSA%20officers%20may%20need%20to,not%20plastic%20bags%20or%20pouches). 

I believe the best solution is to replace the TSA's current system with metal detectors. The metal detectors would be able to identify weapons better than body scanners, since metal detectors just search for metal. Metal detectors would also deal with the discrimination issue since it isn't scanning for body shapes, just metal. 

I'm definitely open to my view being changed.",adventurousorca,434,0.8600000143051147,255,1692899771,2023-08-24 12:56:11,changemyview,https://www.reddit.com/r/changemyview/comments/16095rl/cmv_we_should_get_rid_of_the_tsas_current_airport/,8,2023
163kvrh,CMV: Radical Christianity has completely lost some of the core tenets of Christianity,"I see a lot of extremist Christianity and I just don’t understand how they can profess to read the bible on one hand and not want to help the down and needy on the other 
—-———————————————————————-
Matthew 19:21
Jesus said to him, ""If you would be perfect, go, sell what you possess and give to the poor, and you will have treasure in heaven; and come, follow me.""

Proverbs 29:7 
A righteous man knows the rights of the poor; a wicked man does not understand such knowledge.

Deuteronomy 15:7-8
""If among you, one of your brothers should become poor, in any of your towns within your land that the LorD your God is giving you, you shall not harden your heart or shut your hand against your poor brother, but you shall open your hand to him and lend him sufficient for his need, whatever it may be.

Corinthians 8:9 
For you know the grace of our Lord Jesus Christ, that though he was rich, yet for your sake he became poor, so that you by his poverty might become rich.

John 3:17 
But if anyone has the world's goods and sees his brother in need, yet closes his heart against him, how does God's love abide in him?

Leviticus 25:35 
""If your brother becomes poor and cannot maintain himself with you, you shall support him as though he were a stranger and a sojourner, and he shall live with you.

Luke 12:33 
Sell your possessions, and give to the needy.
Provide yourselves with moneybags that do not grow old, with a treasure in the heavens that does not fail, where no thief approaches and no moth destroys.

Deuteronomy 15:10 
You shall give to him freely, and your heart shall not be grudging when you give to him, because for this the Lord your God will bless you in all your work and in all that you undertake.

James 2:5 
Listen, my beloved brothers, has not God chosen those who are poor in the world to be rich in faith and heirs of the kingdom, which he has promised to those who love him?

Samuel 2:8 
He raises up the poor from the dust; he lifts the needy from the ash heap to make them sit with princes and inherit a seat of honor. For the pillars of the earth are the Lord's, and on them he has set the world.

Timothy 6:17-19 
As for the rich in this present age, charge them not to be haughty, nor to set their hopes on the uncertainty of riches, but on God, who richly provides us with everything to enjoy. They are to do good, to be rich in good works, to be generous and ready to share, thus storing up treasure for themselves as a good foundation for the future, so that they may take hold of that which is truly life.

Psalm 68:10 
Your flock found a dwelling in it; in your goodness, O God, you provided for the needy.

Psalm 112:9 
He has distributed freely; he has given to the poor; his righteousness endures forever; his horn is exalted in honor.

Malachi 3:5
""Then I will draw near to you for judgment. I will be a swift witness against the sorcerers, against the adulterers, against those who swear falsely, against those who oppress the hired worker in his wages, the widow and the fatherless, against those who thrust aside the sojourner, and do not fear me, says the LorD of hosts.

Proverbs 31:9
Open your mouth, judge righteously, defend the rights of the poor and needy.",AdChemical6828,431,0.8100000023841858,575,1693226013,2023-08-28 07:33:33,changemyview,https://www.reddit.com/r/changemyview/comments/163kvrh/cmv_radical_christianity_has_completely_lost_some/,8,2023
165sjkh,CMV: The US Should Mandate all Fees/Expenses be Disclosed Up Front As Much As Possible,"I believe the United States should legally require ticket sellers like Ticketmaster to provide prices inclusive of all fees and surcharges when shopping for tickets.

Hidden fees distort the free market and make it harder for customers to fairly do price comparisons. These fees are deceptive and can often add up to 40% of the advertised price.

I’m tired of clicking on a $49 dollar ticket for a show to find out it’s really $70 when I go to checkout.  Or a $50/night hotel room having a mandatory $30/night “resort fee”

Similar policy should apply to things like hotel rooms, car rentals, phone bills and all sorts of other consumer purchased goods.

If a fee is variable (like shipping) or taxes, I could see that not being included in an advertised price if they can’t be reasonably determined at the time of advertising.  a TV commercial for a national brand, they could say “$499 + tax” since the tax is different everywhere.

However, for sales where the tax CAN be determined, it should be included in the price.  A hotel room should advertise the total price, since the tax calculation is based on where the hotel is, and can be reasonably determined at the time of advertising.

This greater price transparency would greatly benefit consumers.",Front_Many_6231,430,0.949999988079071,214,1693433781,2023-08-30 17:16:21,changemyview,https://www.reddit.com/r/changemyview/comments/165sjkh/cmv_the_us_should_mandate_all_feesexpenses_be/,8,2023
166h3ge,CMV: Most people would not speak out or fight against slavery/genocide/apartheid/theocracy if they lived in such a society.,"Many students in the USA and Europe are understandably horrified by what happened in the past. They read about how a popular dictator like Hitler genocided Jews and other groups. Or how several European societies were complicit in chattel slavery and brutal colonialism. Or how the USA and other countries wiped out entire native tribes and fiercely subjugated their non-white populations. They also wonder why don't the citizens of Russia try to overthrow Putin's regime or why the women in Saudi Arabia tolerate being second-class citizens with little autonomy. From the student's point of view, these are clear and egregious human rights violations and it is any sane and moral person's duty to oppose such a government or institution.

What is often ignored is that the average person (especially in developing nations or historical states) has many personal problems and is just trying to live their day-to-day lives. Going on a huge and dangerous moral crusade to save a group of people you don't even belong to and might not even be able to pay you back seems completely foolhardy from their perspective. What you also must understand is that nobody is born in a completely neutral environment; morals and beliefs all come from somewhere. The people who partook in any historical atrocity or even merely ""looked the other way"" were fed ton of propaganda from birth justifying how abusing/killing the bad people is righteous and in-line with what God wants. The people in such societies have access to completely different information/technology than what modern Western kids have along with a different lifestyle. And it is not like modern westerners don't have their own biases and ignorant beliefs as well.

Before being offended that people in another land or in another time are committing major atrocities, how about some people try to fix the major wrongdoings going on in their own homeland first. Let's focus on the USA since most Redditors are from there. How many Americans support prison reform? How many Americans support animal rights? How many Americans want to stop climate change? How many Americans actually engage in protests? How many Americans even bother to boycott?

Everyone likes to imagine they would be the hero, but in reality, they would probably only join the heroes once their victory is inevitable. Assuming you aren't a member of the persecuted group, your average person nowadays wouldn't oppose chattel slavery if they were born in the 18th Century New World. The average person wouldn't oppose The Holocaust if they were a German during the 1930s/1940s, the average person wouldn't oppose the apartheid if they were a White South African in the 1960s. The average person wouldn't join a secular revolution if they lived in an Arab theocracy. This is not to say brave revolutionaries don't exist, or otherwise societies would never change. But revolutions more often succeed due to external forces and extra-political factors than they do to brave heroes finally saying enough is enough and standing up for what is right.

To change my view, you have to demonstrate that either ""evil regimes"" have a lot less popular support than I think, or that a significant part of the population opposing an atrocity that doesn't directly affect them is actually quite common.",Utopia_Builder,430,0.8899999856948853,231,1693502396,2023-08-31 12:19:56,changemyview,https://www.reddit.com/r/changemyview/comments/166h3ge/cmv_most_people_would_not_speak_out_or_fight/,8,2023
1644dcp,CMV: The government should pay people €100k euro if they donate a kidney to someone who needs one,"I'm going to use numbers from my own countries as reference:  

In Belgium, a year's worth of dialysis treatment costs the government roughly €60k per year per patient. Meanwhile, a kidney from a healthy live donor lasts on average between 15-20 years with relatively minimal other costs after transplant.   
So let's assume 15 years of dialysis saved on average that would mean that 1 transplant saves the government roughly €800k (assuming €100k in total for surgery + medical follow-up of donor and recipient).   

I think to encourage more people to donate their kidney, the government should pay people €100k. Even with such a large payment, it would still lead to big savings for the government. And obviously, the recipient would benefit greatly as well due to massively increased QoL.    

And because I know people will bring up the health impacts on the donor: I don't consider this to be enough of an impact to not implement this plan. A thoroughly screened and healthy donor sees an extremely limited (if any) impact on their life. A month after the surgery, the donor can resume life as normal without any restrictions whatsoever. And the odds of developing kidney failure later in life are also very small when properly screened.    

And even if kidney failure is developed, there would be plenty of donors ready to give a kidney due to the high payment involved.",SuckMyBike,428,0.800000011920929,428,1693272003,2023-08-28 20:20:03,changemyview,https://www.reddit.com/r/changemyview/comments/1644dcp/cmv_the_government_should_pay_people_100k_euro_if/,8,2023
15sq1vm,CMV: Password manager tools and systems aren't actually worth it.,"I have a background in information security, system administration, IT risk management, and so on. I say that not as some kind of brag, but to set the tone for this conversation and to express that I have really thought this through.

For example, putting all your passwords into a service that can now be hacked, disrupted, or is subject to access by its employees is actually risky and I'm not sure why people think it's ok. 

Beyond that, what about the convenience factor? If I use a strong password system (of my own design) that I can remember easily, but is long, unique, and has solid variety, I can be on my computer, any number of laptops, my phone, my wife's computer, friends' computers, or anywhere else and still be able to log in if I want to. With a password system, I don't have my own passwords and I'm stuck anywhere that password tool isn't available.

Mostly, a good individual password pattern system seems sufficient. CorrectHorseBatteryStaple after all.

&#x200B;",suddenly_ponies,406,0.8100000023841858,344,1692192759,2023-08-16 08:32:39,changemyview,https://www.reddit.com/r/changemyview/comments/15sq1vm/cmv_password_manager_tools_and_systems_arent/,8,2023
15x3ug4,"CMV: If your family gifted you financial stability, it's good manners to acknowledge it in conversations on financial topics","I have several friends/acquaintances that had a property or two gifted/inherited by their family. Usually the house they live in and maybe a separate flat or two to rent, not massive wealth but more than enough to be life changing (from the point of view of the average person paying rent/mortgage).

I'm super happy for them (and surely a little bit jealous), some of them were able to transform their hobbies/passions in small businesses, some have travel the world extensively, some others have kept a regular job but of course they have no financial worries. I have no issue accepting that this is the way life is, some families are richer/more generous and each person is entitled to do the best with what they get in life. Good for them! 

What rubs me the wrong way are the ones that don't acknowledge their luck when talking about life choices/life opportunities. It honestly felt disrespected at times:  
I'm mentioning how hard it can be to keep up with mortgage payments and you start complaining about property taxes on your second/third flat that you're renting as if we are in the same boat? seriously?   
I'm complaining about my job and you tell me how happy you are about your ""brave"" choice to stop working and travel around? or how becoming a Pilates instructor changed your life?   
On the other side I do have friends/acquaintances that have no problems being honest about how their financial luck impacted their life chances/choices and it's honestly so refreshing to hear! 

To wrap it up: I struggle to respect people that have been gifted financial stability but, instead of acknowledge it, try to downplay it/hide it in order to feel like ""one of the team"" or in order to  brag about their life choices, should I CMV? ",invertedBoy,398,0.8100000023841858,331,1692614022,2023-08-21 05:33:42,changemyview,https://www.reddit.com/r/changemyview/comments/15x3ug4/cmv_if_your_family_gifted_you_financial_stability/,8,2023
15qa9uf,CMV: Nobody is too Busy to not Text Back Within a Couple of Days,"This is moreso related to dating than just conversing between friends/family. One thing that has really frustrated me about modern dating is this idea that everyone is somehow ""too busy"" to text back. I understand not wanting to message someone back and forth, especially when it's early in a relationship, every couple of hours. That's exhausting and we all have day jobs/hobbies we want to pursue and not be constantly trying to think how to keep someone we barely know, or maybe haven't even met yet, entertained through our words.

That said, I think it's way too common these days for people to claim they don't text back within 24ish hours because they're ""too busy"". I get that life is sometimes unpredictable and things break/shit happens. I work in a pretty demanding job and I have periods too where I basically have to be heads down and really focus on something for 14+ hours a day. The thing is, I don't believe that:

1. Most peoples' jobs are THAT demanding. From what I've seen/read online, most people do maybe 4ish hours of work a day and are pretending to be busy the rest of the time
2. This is the more important part: I know for me personally that if I really like a girl, I'll respond to her by EOD. For one, it realistically only takes 5-10 mins max to think of something and type it out. Even if I worked 14 hours that day, I can still find 5 mins before bed to text someone I'm into before I fall asleep at worst. Correct me if I'm wrong, but I don't see how it'd be different from a woman's perspective if she were really into me
3. IME, whenever I start talking to a girl over the phone, we generally feel each other out and naturally come up with a ""rhythm"", for lack of better word, of how often we communicate. The two things I've noticed are that if a girl is really into me, she'll text me back come hell or high water. The second is that the minute this ""rhythm"" starts getting extended, that's when things have gone south.

So that's my TedTalk. Go ahead Reddit: prove me wrong and change my view",showmetheEBITDA,364,0.800000011920929,150,1691960798,2023-08-13 16:06:38,changemyview,https://www.reddit.com/r/changemyview/comments/15qa9uf/cmv_nobody_is_too_busy_to_not_text_back_within_a/,8,2023
15q9bob,CMV: LED headlights should be banned from cars and trucks.,"Brights exist for a reason, so when your base headlights are brighter than peoples brights, there’s a problem. 

Driving behind, or in front of someone with LED headlights is blinding. I can’t see anything but light. 

To be fair, I’ve never actually driven in one, so I have no clue how useful they actually are for the user compared to normal headlights, but from my 2009 car with normal headlights I see these as pure hazards. 

Apparently these headlights are banned, but not when the car comes with them? I’m not too sure about laws but it seems like they are generally disallowed, so why do I see (or not see because they blind me) them all the time?

Someone please give me a reason to think these things are useful on the roads at all.",ZombieIsTired,353,0.8399999737739563,124,1691958523,2023-08-13 15:28:43,changemyview,https://www.reddit.com/r/changemyview/comments/15q9bob/cmv_led_headlights_should_be_banned_from_cars_and/,8,2023
161ghmx,"CMV: France should do an ""outlet mall"" approach instead of destroying its wine",[removed],LentilDrink,349,0.9200000166893005,193,1693010536,2023-08-25 19:42:16,changemyview,https://www.reddit.com/r/changemyview/comments/161ghmx/cmv_france_should_do_an_outlet_mall_approach/,8,2023
15np1zp,"CMV: If you move to a different country, you should be able to speak the language at least a little bit before moving there","I'm Kenyan and I've noticed that we've been receiving very large amounts of Chinese and Indian immigrants here who don't speak any of the local languages. 90% of these people don't speak a word of Swahili, and their English is so broken that it's extremely hard to communicate with them. Now, to be fair to these two groups of people, not all of them are like this, and they aren't the only group of people that does this. I've seen plenty of people move to countries around the world without speaking any of their languages. But still, I don't think it's a good thing. I as a Kenyan would never move to China without learning at least a little bit of Chinese or move to Japan without learning a little bit of Japanese, so I feel like it should be the same the other way around 

I don't expect people to be 100% fluent in a language before moving to another country, but they should still make some attempt to learn the language beforehand. Moving to a different country without having learned even just a handful of simple phrases in the local language shows that you have little to no respect for the locals there imo",KpopMarxist,338,0.8600000143051147,118,1691703054,2023-08-10 16:30:54,changemyview,https://www.reddit.com/r/changemyview/comments/15np1zp/cmv_if_you_move_to_a_different_country_you_should/,8,2023
