post_id,title,text,author,score,upvote_ratio,num_comments,created_utc,created_datetime,subreddit,permalink,month,year
15nodtz,CMV: The military has a right to be as selective as it chooses when it comes to screening for medical conditions,"I am really lost at this point and looking for various opposed ideas.

The military has a right to disqualify certain medical conditions for service. Whether that be a history of medical disorders or physical limitations.

Here are a list of conditions ive seen ppl have a problem with;

Diabetes mellitus (either type), a history of gestational diabetes, a history of gout, high cholesterol or TAG, history of anemia even if known to be caused by nutritional deficiency, history of kidney stones that reoccur, irregular menstrual, history of irregular PAP smears, PCOS, being intersex, being menopausal, fibromyalgia, osteoarthritis, history of more than one knee dislocation, history of stress fracture, excema/psoriasis/dermatitis that requires systemic steroid therapy or covers more than 10% of the body, severe acne, history of allergies that cause anaphylaxis, severe allergy to shellfish, peanuts, or treenuts, severe allergy to biting or stinging insects, restless leg syndrome, if you've had sleepwalking or night-terrors after the age of 13, Tourette's syndrome, if you have a history of headaches after having experienced a concussion, migraines, cluster headaches, ADHD if you've needed any accommodations (educational or work) after the age of 14 or you have taken medication for it within the past 2 years or have any other comorbid mental disorder or it's ever been documented to adversely impact your work or education, dyslexia, autism, depression if you ever needed more than 12 months of counseling or had symptoms or treatment in the last 3 years, any history of eating disorders even if in recovery, any history of suicidality, and any history of self-injury are all disqualifying, among many others.

And so on.

I have these believes because at times the military can lead people into austere deprived places around the world. Many medical resources wouldn't be there to treat underlying/ prior conditions.

If jo bob has a history of suicidal attempts when he becomes depressed ( deployments can be very sad places) he trys to hurt himself or others. He know is a person who cannot function in a immanent hostile area that is now taking up space and exhausting resources for those other warfighters.

Im looking for open discussion. And can i get some insight on why there is a big push for people with gender dysphoria to join the military.TY.",NoDrama3756,196,0.8500000238418579,416,1691701466,2023-08-10 16:04:26,changemyview,https://www.reddit.com/r/changemyview/comments/15nodtz/cmv_the_military_has_a_right_to_be_as_selective/,8,2023
15wbkon,CMV: Men that are victims of criminals who happen to be men are not responsible for their victimization.,"I often see the argument of the women-men assault/crime statistics yet they blame men for these issues as a whole, because the majority of attackers are - men.

  
When presented with the fact that men suffer from those issues more than them, I often see that women say ""Well, you're attacked by men, you are also a man. its not our problem"".

How is a victim responsible for the gender of criminal that conducts those things?   
It makes no sense in my mind that you would regard a man being assaulted by another man to be any different from a woman assaulted by a man. 

This argument is absolutely stupid, makes no sense, and is hypocritical of anyone who has self respect.",Dudiel,189,0.6899999976158142,458,1692538449,2023-08-20 08:34:09,changemyview,https://www.reddit.com/r/changemyview/comments/15wbkon/cmv_men_that_are_victims_of_criminals_who_happen/,8,2023
15nrxil,CMV: Peak Privilege is Having Almost No Anxiety,"Those who grow up in households where most of their financial and social (and psychological) needs were met, and whose family has learned to enjoy such privileged life, will clearly have little to no anxiety. It seems obvious but I think there's more to it. Ever seen videos of someone doing an adventurous feat and commenters writing ""white people shit"". Yeah, it's because white people enjoy financial and social privilege in the US, they thus have little financial and social anxiety, and are more likely to be adventurous bc of it. Number one trait to know whether someone comes from an upper or lower class background? It's their anxiety. Some of my lower income tenants are extremely anxious for even the slightest inconvenience. Upper income people enjoy the luxury of not having learned anxiety in its harmful form while growing up. They do stuff, get injured if need be, and move on.  


  
And the social component is as equally important as the financial. The privilege of not getting anxious if a girl you are flirting with talks back? Of having social/romantic privilege, and knowing that you can get your social/romantic/sexual fantasies satisfied (even if not totally fulfilled). Think Chuck Bass in Gossip Girl. Of course it can make you a douchebag if you so choose, but it also gives you the freedom and privilege to enjoy a life without social fears.Just had these thoughts as I evaluate how I want to live my life. If you agree/disagree let me know why. Cheers",rapp17,188,0.6700000166893005,130,1691709820,2023-08-10 18:23:40,changemyview,https://www.reddit.com/r/changemyview/comments/15nrxil/cmv_peak_privilege_is_having_almost_no_anxiety/,8,2023
15qyp5n,CMV: The solution to the homeless crisis in America is to bring back the asylums.,"We had plenty of insane asylums, mental hospitals, whatever you wanna call them it doesn't matter. Then reagan came along and destroyed it because conservatives like destroying useful programs, and now all those mentally ill people are on the street using drugs. The solution is to bring them all back, round up the homeless whether they like it or not, and keep them there until they're normal. 

This cleans up the streets, it gets the mentally ill taken care of, and it makes are streets safer. There's no downside to it that I can see",Watchyobackistan,181,0.6000000238418579,702,1692028789,2023-08-14 10:59:49,changemyview,https://www.reddit.com/r/changemyview/comments/15qyp5n/cmv_the_solution_to_the_homeless_crisis_in/,8,2023
15ha8o8,"CMV: It’s all Cultural Appreciation until you intentionally attempt to harm or denigrate a culture, then and only then is it Cultural Appropriation.","I think many people are misusing the word Cultural Appropriation.  I don’t think there’s anything wrong with taking/borrowing/using symbols or items from other cultures, unless you mean to insult or harm others of that culture or the culture itself. 

Want to wear dreads? Sure. 

Get Polynesian Tattoos? Go for it. 

Wear Cowboy Hats? Why not. 

Wear Tribal Native American Feather Headdresses? Suit yourself. 

Use R&B to make Rock and Roll? Excellent. 

Participate in El Dia de Los Muertos? Fine by me. 

Just don’t do these things in a way that aims to criticize or insult the cultures that place significance on them. I’m sure there are a plethora of other examples, the main point is - we get it, some things are important to an individual culture, but don’t gatekeep it for the sake of keeping the outsiders out. 

As an example, I don’t have any issue with a Chinese person with Polynesian Tattoos, having dreads under his Cowboy hat or a White person remastering old R&B songs to make new Rock riffs while adorning a feather headdress  and setting up an Ofrenda. I don’t see why anyone should care or be offended by this. I’m open to Changing my View.",Standyourground2,180,0.8199999928474426,291,1691083493,2023-08-03 12:24:53,changemyview,https://www.reddit.com/r/changemyview/comments/15ha8o8/cmv_its_all_cultural_appreciation_until_you/,8,2023
