post_id,title,text,author,score,upvote_ratio,num_comments,created_utc,created_datetime,subreddit,permalink,month,year
1867cb8,CMV: Taylor Swift Makes Mediocre H&M Music And I Don't Understand Why She Is So Popular,"Now, let me start off with the things I do like about Taylor Swift. I like songs like Bad Blood, Blank Space, and Look what you made me do. I like that she has a work ethic and a great PR mindset.

However, I don't understand the appeal of her music. It sounds like music you would hear at a clothing store. Bland. I think her voice is mediocre, I think her dance moves are medicore, and I think her performance set is as well. I do not understand the appeal of her lyrics either. They are a hit or miss. She can defintely write a song, but it's never anything groundbreaking for me. She's not particulary a ""bad artist"" to me, just very repetive and bland.",Tiffanyblueberries,2641,0.800000011920929,982,1701207040,2023-11-28 15:30:40,changemyview,https://www.reddit.com/r/changemyview/comments/1867cb8/cmv_taylor_swift_makes_mediocre_hm_music_and_i/,11,2023
17z1fd7,CMV: Elon Musk is a man child and a conman,"In the past I thought he was a cool guy. He had a certain mystique to him that I think a lot of people liked. As of today I don't like him. From hearing about the working conditions of his employees to the unhinged shit he says and does online I just don't like him. He comes off as a pseudointellectual developmentally stunted man-child, and every time I hear about him I like him less. 

I also see him as arrogant. He can't even manufacture his cars that aren't riddled with production errors, and he wants to put chips in people's brains. With the way he's handled twitter, I think that this is also a disaster waiting to happen. He says he's vehemently against censorship, but that really only applies when it supports his agenda. I could see neuralink leading to a lot of ethical issues and manipulation of large populations: that is, if it doesn't just lead to the maiming and death of it's users like it did with the monkeys he tested on. ",6968IHateReddit6969,1975,0.7599999904632568,1498,1700412914,2023-11-19 10:55:14,changemyview,https://www.reddit.com/r/changemyview/comments/17z1fd7/cmv_elon_musk_is_a_man_child_and_a_conman/,11,2023
17x0gha,"CMV: Pregnancy is not ""the happiest period in a woman's life"", it's one of the most unpleasant things a human can experience","Pregnant person here, who just got told this is the happiest period of my life. 

I think we've been conditioned to believe pregnancy is *magical* and *the happiest period in a woman's life*, because for so many people it is not, that I think they are the majority and we're just white-knuckling it, hoping our brains will do their job and we will forget one day.

Prenatal depression. Natal depression. Postpartum depression. Why is that? A living organism growing inside your body, getting bigger, slowing you down, changing your body and brain chemistry, making you act like you're not yourself and then exiting in a painful and often traumatising way. It's a hormonal BODYHORROR rollercoaster that sucks from start to finish.

To me, pregnancy is a ""necessary evil"", a means to an end - to get a child in the world, and not the ""happiest period"" in someone's life.

Obviously, I'd like my view to be changed, because I feel very bad right now.",Consistent_Aerie9653,1970,0.8799999952316284,469,1700176356,2023-11-16 17:12:36,changemyview,https://www.reddit.com/r/changemyview/comments/17x0gha/cmv_pregnancy_is_not_the_happiest_period_in_a/,11,2023
17llow9,"CMV: Conservatives do not, in fact, support ""free speech"" any more than liberals do.","In the past few years (or decades,) conservatives have often touted themselves as the party of free speech, portraying liberals as the party of political correctness, the side that does cancel-culture, the side that cannot tolerate facts that offend their feelings, liberal college administrations penalizing conservative faculty and students, etc.

Now, as a somewhat libertarian-person, I definitely see progressives being indeed guilty of that behavior as accused. Leftists aren't exactly accommodating of free expression. The problem is, I don't see conservatives being any better either.

Conservatives have been the ones banning books from libraries. We all know conservative parents (especially religious ones) who cannot tolerate their kids having different opinions. Conservative subs on Reddit are just as prone to banning someone for having opposing views as liberal ones.  Conservatives were the ones who got outraged about athletes kneeling during the national anthem, as if that gesture weren't quintessential free speech. When Elon Musk took over Twitter, he promptly banned many users who disagreed with him. Conservatives have been trying to pass ""don't say gay"" and ""stop woke"" legislation in Florida and elsewhere (and also anti-BDS legislation in Texas to penalize those who oppose Israel). For every anecdote about a liberal teacher giving a conservative student a bad grade for being conservative, you can find an equal example on the reverse side. Trump supporters are hardly tolerant of anti-Trump opinions in their midst.

&#x200B;",SteadfastEnd,1721,0.7400000095367432,2419,1698871212,2023-11-01 15:40:12,changemyview,https://www.reddit.com/r/changemyview/comments/17llow9/cmv_conservatives_do_not_in_fact_support_free/,11,2023
1858lk8,CMV: Not voting for Biden in 2024 as a left leaning person is bad political calculus,"Biden's handling of the recent Israeli-Palestinian conflicts has encouraged many left-leaning people to affirm that they won't be voting for him in the general election in 2024. Assuming this is not merely a threat and in fact a course of action they plan to take, this seems like bad political calculus. In my mind, this is starkly against the interests of any left of center person. In a FPTP system, the two largest parties are the only viable candidates. It behooves anyone interested in either making positive change and/or preventing greater harm to vote for the candidate who is more aligned with their policy interests, lest they cede that opportunity to influence the outcome of the election positively.

Federal policy, namely in regards for foreign affairs, is directly shaped by the executive, of which this vote will be highly consequential. There's strong reason to believe Trump would be far less sympathetic to the Palestinian cause than Biden, ergo if this is an issue you're passionate about, Biden stands to better represent your interest.

To change my view, I would need some competing understanding of electoral politics or the candidates that could produce a calculus to how not voting for Biden could lead to a preferable outcome from a left leaning perspective. To clarify, I am talking about the general election and not a primary. Frankly you can go ham in the primary, godspeed.

To assist, while I wouldn't dismiss anything outright, the following points are ones I would have a really hard time buying into:

- Accelerationism
- Both parties are the same or insufficiently different
- Third parties are viable in the general election",baroquespoon,1615,0.7400000095367432,1597,1701106663,2023-11-27 11:37:43,changemyview,https://www.reddit.com/r/changemyview/comments/1858lk8/cmv_not_voting_for_biden_in_2024_as_a_left/,11,2023
184bs54,"CMV: creationism should not be taught in public schools at all, even alongside evolution.","I was watching the Simpsons episode where they start teaching creationism alongside (later instead of) evolution in Springfield elementary. It was goofy, but while watching I remembered that my high school did the exact same thing. I went to a decently well-funded public school in the Midwest during the early 21st century. 

At the time I didn’t care all that much, I was raised Christian but I was always a curious kid so I already knew about and believed in evolution. Actually, I did care a little bit because, while on the debate team, I *lost* a debate regarding whether creationism should be taught in schools. So maybe you could say the episode reminded me of some embarrassing high school moments. 

I agree with the Simpsons: creationism should *not* be taught in school because there is no scientific merit to the book of Genesis. Schools are institutions of science and evolution is science. Churches are where children should learn about creationism and how religion squares with our contemporary world. 

Still, as an adult I don’t care all that much, so my opinion can still be subject to change. I lost the debate arguing that creationism should *not* be taught in public schools, so obviously there are valid arguments as to why creationism *should* be taught in schools. 

I should also note, I chose the words in the title carefully. Creationism should not be taught *at all.* In my school it was an option, you could learn about evolution and creationism in tandem. I’m taking a rather extreme position that creationism shouldn’t be taught at all. So maybe change my view so that I can see the merit of teaching them both and giving the option for students. Or change my view that creationism should be taught instead of the evolution hoax. 

TL;DR: creationism shouldn’t be taught in schools at all, even if it’s taught alongside evolution.",Ok-Story-9319,1551,0.8700000047683716,634,1701008606,2023-11-26 08:23:26,changemyview,https://www.reddit.com/r/changemyview/comments/184bs54/cmv_creationism_should_not_be_taught_in_public/,11,2023
17zpvpe,cmv: Shoes off should be the default when visiting a guest’s house.,"This should be the default as it is the polite thing to do. Shoes carry a lot of dirt and germs, therefore you should leave them at the door. 

It is also uncomfortable for the owner of the home to have to ask folks to remove their shoes. It sets a strange tone to the a visit. 

I think it’s also especially necessary to remove shoes when the owners of the home has young babies who crawl on the ground. 

The only exceptions (imo) are the very elderly or disabled who can’t bend down easily to take off their shoes.",intimidateu_sexually,1457,0.8899999856948853,898,1700490919,2023-11-20 08:35:19,changemyview,https://www.reddit.com/r/changemyview/comments/17zpvpe/cmv_shoes_off_should_be_the_default_when_visiting/,11,2023
187wktd,"CMV: The notion that the Democrats or Republicans ""must"" run Biden or Trump ""because there are no other viable candidates"" is ridiculous. There are thousands of people who would make better presidential candidates for 2024 than Biden or Trump.","Every argument for Biden or Trump to run in 2024 boils down to some version of ""status quo"" or ""inertia."" We're told that the Ds and Rs have no choice but to run these super-old candidates because there's nobody else who could be suitable.

&#x200B;

In a nation of 332,000,000 people, there are well over 100 million who are over the age of 35, American-born, and have resided in the United States for 14 years or more - in other words, are constitutionally eligible to run for president.

Out of those 100 million, surely at least half have a basic education, are mature, sensible, decent people, and have demonstrated solid character - and also be significantly younger than Trump or Biden.

Out of those 50 million, surely at least ten million would qualify as *highly* educated - the metrics of which can be tricky to figure out (is it a master's degree? or something else?) - but they would be significantly above average.

Out of those 10 million, surely at least one million would be quite exceptional - people who have substantially high IQ, have advanced quite far in life and a career - such as being a doctor, or having worked in public governmental service for decades, etc.

And out of those million, surely at least 10,000 would have the political know-how, the charisma, the political interest, maybe have spent significant time abroad in foreign countries or speak multiple languages, to be a suitable president.

In fact, even in Congress, state legislatures or governorships alone, there must be dozens of good, qualified, educated, experienced politicians who would be much younger than Trump or Biden, and who would make suitable presidential candidates. 

So, CMV on this one. I don't buy for one moment the notion that, in a nation of 332 million people, America somehow has no choice but to run Biden vs. Trump in 2024 because ""we've got no one else who'd be a good candidate.""  ",SteadfastEnd,1424,0.8299999833106995,430,1701386868,2023-11-30 17:27:48,changemyview,https://www.reddit.com/r/changemyview/comments/187wktd/cmv_the_notion_that_the_democrats_or_republicans/,11,2023
17t7m5g,CMV: Dating for 2+ years and still not having a ring is completely normal and not a red flag,"So i’m not sure if this is just a thing on tiktok, or if others also believe this but i constantly see tiktoks where a girl will mention her and her significant other have been dating for 3+ years and there will be a flood of comments saying “wow and you still have no ring that’s a red flag run sis”. I believe marriage is a life long commitment and knowing someone for one year is not enough time to fully know them or make the biggest decision and marry them. I know couples in my personal life who got married quickly just to divorce less than two years being married. I’m 20 and i’ve noticed a lot of people in my generation don’t believe in marriage, I think there should be a talk to have a few months within dating to see if that is both of your guys end goal. And i know it’s different for couples who are 30+ and dating but i still see this getting thrown around at people in their early 20s. Another thing to mention is I know after 8+ years and still no ring then that is considered a red flag, but as mentioned earlier i think each person should be aware of what they want to get out of the relationship within the first few months of dating. To summarize it up, get married at whatever time you feel is best and you fully know your partner. If you’ve been dating for 2 years i don’t think you should automatically expect a ring.",Alive_Ad823,1284,0.8700000047683716,565,1699747038,2023-11-11 17:57:18,changemyview,https://www.reddit.com/r/changemyview/comments/17t7m5g/cmv_dating_for_2_years_and_still_not_having_a/,11,2023
17li6f3,Cmv: Americans take their country for granted,"I really can’t understand why everyone on reddit says bad stuff America.
But me as a person that is from third world country dream about living there .
It’s a country full of opportunities like it’s the best country for building financial prosperity 
It has low tax high paying jobs .
It’s easy to start a business because there is low bureaucracy. 
and when you build your financial prosperity 
Social things like healthcare and education wouldn’t be a problem at all.
Healthcare isn’t even that bad you just need a insurance that you pay 200 dollar each month for it .
Also there are amazing kind people , there is racism everywhere but it’s worse in other countries.
You can pay your college loan after you graduate and everything works greatly 
I feel like it’s a country that if you put your best at things and you become skilled and professional you would be appreciated and get what you deserve. Many countries doesn’t have that and i feel like people should appreciate it more",printhelloworld123,1275,0.7599999904632568,1565,1698861758,2023-11-01 13:02:38,changemyview,https://www.reddit.com/r/changemyview/comments/17li6f3/cmv_americans_take_their_country_for_granted/,11,2023
17tpxj8,"CMV: Most people who say that the education system in America doesn't teach you any ""real life skills"" just aren't good students and don't put any effort into school","Just to preface I am talking about high school in America here.

First of all, if high schools actually taught classes like taxes and personal financial literacy nobody would pay attention anyways. Second of all most people don't understand that subjects like math and science are like weightlifting for your brain. When do you ever see a football player ever do a squat on the field? Never, but doing squats builds up a level of strength in the legs that is vital to being a good football player. Same thing with school. You'll so often hear that ""ill never use algebra in the real world"" when the whole point is that you learn how to problem solve and also understand concepts and put them to work. English is an important subject because having good grammar and being a good writer is important no matter what. Thirdly you'll hear people say ""oh school is designed to made us into complacent workers who follow orders"" and this just isn't true. It's really not a crazy thing to expect kids to listen to their teachers and follow simple instructions (Which you have to do in the real world no matter what your job is)

My main gripe with the education system is that public schools in America do not pay the good teachers enough so any good teacher has no incentive to stay at a public school when they can go to a private school. The material we teach is 100% the right stuff.",ElectroFalcon34,1203,0.8299999833106995,623,1699812666,2023-11-12 12:11:06,changemyview,https://www.reddit.com/r/changemyview/comments/17tpxj8/cmv_most_people_who_say_that_the_education_system/,11,2023
17zz6u2,"CMV: Only Individuals, NOT limited liability entities, should be allowed to legally own real property zoned for single families.","There has been a housing crisis in the United States since the turn of the century. The damn broke in 2008 when large financial institutions violently awoke the nation from her American dream of homeownership. There has been a wealth “crisis” developing since the turn of the 19th century where individual wealth has depleted while corporately owned wealth has skyrocketed. Even the richest billionaire is but a worthless pauper compared to average multinational corporations. These two crises are related. The monumental wealth of large enterprises and the increasing poverty of the bourgeoisie has caused the prospect of owning a parcel of the planet earth ever more illusory each decade. 

We almost forget that *American* society exists to protect the citizen against the collective. This is *not* a socialist state, the rights of the individual are paramount against the rights of the group or the state. The citizen serves themselves, the citizen does not serve the state nor the corporation. To paraphrase, the Declaration of Independence holds that once a government no longer permits the citizen to live and die according to their means and abilities, the government must be dissolved by any means necessary. 

I am not saying that the US ought to collapse because of modern social inequalities like many radicals on the far left/right. Instead, I think a sensible solution to the dual problems of inequality and the lack of owned real properties is a simple change in national policy. It should be law across every jurisdiction that areas zoned for “single-family” homes can only be sold to individuals born of woman. No entities may own real property zoned like this, unless such an entity exposes their owners to unlimited liability. 

I mention all the stuff about American culture/law to undermine the argument that prohibiting corporations from purchasing would violate the “freedom” of a corporation to engage in the market. Individuals have freedoms under the Constitution, and individuals may associate freely. But such associations should not have the same claim to rights/freedoms that individuals have. This argument is unavailing because society serves the individual, not the collective. 

Another counterargument I can imagine is that the economy might suffer because (1) housing prices are inflated; (2) the only entities that can reliably pay inflated prices with ready cash (or favorable financing) are corporate entities; and (3) if the wealthiest entities in the market are banned from buying, housing prices would dramatically collapse. Last time housing prices collapsed, Obama had to give billions to banking executives lest their feelings got hurt. /s (kinda). To this argument, I say the ends would justify the means. Billions in home equity would evaporate so that future generations could have a justifiable hope in affordable home ownership. 

TL;DR: Perpetuating the American dream for current and future generations of homebuyers is more important than big business profit and the retirement plans of current homeowners. Therefore business should be unilaterally banned from owning single-family owned property, any business currently owning such property should divest ASAP.",Ok-Story-9319,1134,0.9200000166893005,741,1700514881,2023-11-20 15:14:41,changemyview,https://www.reddit.com/r/changemyview/comments/17zz6u2/cmv_only_individuals_not_limited_liability/,11,2023
17wqbsc,CMV: an engagement ring should be given back if the engagement is called off.,"I was watching a Netflix show where a woman decides she’s no longer attracted to her fiancé so she breaks things off. When he asks for the ring back she refuses, he hesitates then agrees that she can keep it and angrily claims that every time she sees it she’ll think of their short lived relationship. 

This got me thinking of my ex fiancé, and how I broke things off, I did pretty much the same thing and she claimed it was so pretty so I gave in and let her keep it, eventually I got it back but there was no reason for her to keep it in the first place as an engagement ring represents a promise, it’s usually expensive, and it basically turns into a trophy celebrating how I got this person to propose to me, it seems almost greedy or narcissistic to keep.

Outside of the fiancé dying or not asking for it back there’s no benevolent reason to keep an engagement ring, if someone asks for it back it should be given back, please, change my view.",KeyStoneLighter,1059,0.9100000262260437,216,1700150342,2023-11-16 09:59:02,changemyview,https://www.reddit.com/r/changemyview/comments/17wqbsc/cmv_an_engagement_ring_should_be_given_back_if/,11,2023
1854mcy,"CMV: Men who think women over 30+ are ""washed up"" are destined to be alone/lonely","I'm just curious if my view would be correct  

If your view is that women are only for babies and that they are no longer ""useful"" and washed up, then you too, will he alone. Sure men probably last longer, but once he's old and unable to do physical jobs, he too will be alone. obviously that's not my view but like attracts like. 

So I believe if he views women base on use then women will also do the same. 

He will be married maybe. But he will he lonely. he will be used for money the way the woman will be used as a baby maker  

And unless he's rich and hot, he won't be able to replace her once she tires of his misogyny 

These type of men will be exactly like the women they hate on",WaterDemonPhoenix,1056,0.7400000095367432,1312,1701096451,2023-11-27 08:47:31,changemyview,https://www.reddit.com/r/changemyview/comments/1854mcy/cmv_men_who_think_women_over_30_are_washed_up_are/,11,2023
