post_id,title,text,author,score,upvote_ratio,num_comments,created_utc,created_datetime,subreddit,permalink,month,year
1igar20,CMV: DEI was a Trojan horse that killed affirmative action and acted as a midwife to MAGA,"DEI was used by corporations to gain social and societal currency. It has always been performative, virtue signaling lacking in intellectual rigor. It has been used as a trojan horse to force ultra leftist identity politics down everyone’s throats, and as a result inadvertently hijacked the black liberation movement. 

Affirmative Action (AA) was born out of the black liberation movement. It had far more teeth and had actual legal backing. DEI stripped it of its power by shifting the focus from enforceable systemic correction to voluntary corporate optics. With affirmative action, failure to act had real consequences. With DEI, failure to act means a company simply updates its branding.

AA mandated hiring goals, quotas, and enforceable accountability measures. DEI, on the other hand is voluntary, self-policed, and lacks any real enforcement mechanism. There’s no requirement to actually hire, retain, or promote diverse talent at scale.

AA was about outcomes, increasing representation through concrete hiring and admissions policies. DEI, in contrast, moved the conversation to “awareness” and “culture”, allowing companies to look progressive while maintaining the same power structures.

AA explicitly targeted **historically oppressed racial groups, acknowledging the need for corrective measures due to centuries of discrimination.** DEI shifted the conversation to include everybody else’s problems.

Since DEI isn’t legally binding, corporations easily and often manipulate it for PR without real investment. Many companies make grand DEI and ESG commitments, but internally have toxic work environments, lay off DEI teams, slow down diversity hiring, and maintain overwhelmingly white leadership. 

It alienated and fueled animus from white men— often making its biggest mistake of openly demonizing white men who were always the primary antagonist for every group. Many DEI initiatives framed white men as the default oppressors while elevating everyone else, often through surface-level representation efforts. Instead of fostering genuine coalition-building, DEI created an “us vs. them” dynamic. This is why I believe it can definitely take some credit for the birth of MAGA. DEI absorbed the language of justice without the obligation to deliver it, effectively neutralizing the radical potential of affirmative action.

DEI became a softer, more palatable alternative to AA. It was designed to placate demands for systemic change while maintaining corporate and institutional power structures. Its blindspot was always white men who were actively ostracized from its objectives. 
",TenaciousVillain,816,0.7099999785423279,315,1738538298,2025-02-02 17:18:18,changemyview,https://www.reddit.com/r/changemyview/comments/1igar20/cmv_dei_was_a_trojan_horse_that_killed/,2,2025
1iztb0f,CMV: Conservative ‘Christians’ aren’t Christian at all.,"I was raised Catholic. 17 years of parochial school, completed four of the seven sacraments. I graduated from a Jesuit university with a minor in religious studies.

Conservative 'Christians' aren't Christian as all. The main takeaways in the Bible is that God loves everyone, treat others as you want to be treated and that God made us all in his image.

This post is specifically for those that voted for Trump, go to church every Sunday and feel that gays are an abomination and that abortions are a sin: How do you justify calling yourself a Christian when you spew nothing but hate?

The majority of you feel like the Bible needs to be followed word for word. With that said, how do you justify being a fan of football, having a vegetable garden, working on Sunday or deporting 'illegal' immigrants?
(if you get my reference, kudos to you!)

If you feel the need to respond with an insult, then you'd just be making my point.
",AlternativeDue1958,766,0.75,1000,1740697775,2025-02-27 17:09:35,changemyview,https://www.reddit.com/r/changemyview/comments/1iztb0f/cmv_conservative_christians_arent_christian_at_all/,2,2025
1ip2s01,CMV: Indians only hire Indians,"I've seen it everywhere here in Australia as well as back home in the states.

I can walk in to a Woolworths or a Coles grocery store and all workers and the manager are all indian, I see it in corporate settings where once we had a Chinese Australian manager, he left and a Indian guy got promoted to lead developer, he just focused on hiring all indians and slowly the diversity shrunk as the old workers left. I've seen this in fleet and courier companies where Indian managers will prioritise jobs to indian workers therefore shrinking and forcing the non-indian people to leave due to no shifts. ",MiucinFilip,750,0.8199999928474426,364,1739508274,2025-02-13 22:44:34,changemyview,https://www.reddit.com/r/changemyview/comments/1ip2s01/cmv_indians_only_hire_indians/,2,2025
1ij2io3,CMV: Conservative non-participation in science serves as a strong argument against virtually everything they try to argue.,"So many things we are forced to argue these days are talking points that scientific study has already settled. But since there's one side of the aisle that eschews science, we have to work against viewpoints like ""I just know in my mind that such-and-such is true"", which is, needless to say, incredibly frustrating and pointless.

Remember, of course, that even something as simple as collecting historical data and summarizing it counts as a study, and papers are routinely published on those lines. Randomized clinical trials are not the only form of study out there.

Some examples: immigrant crime. So many studies show definitively how immigrants commit FAR fewer thefts, rapes, and murders than native-born citizens, and yet we still have to contend with viewpoints that immigrants are more commonly associated with murder, rape, and theft than the average native-born US citizen. Studies show that gender-affirming therapy very, very rarely causes anyone, *even children*, to regret the therapy they were given, and yet we still have to contend with viewpoints that gender-affirming therapy is likely to screw people up for life. Numerous studies show the effectiveness of all sorts of different types of gun control implementation, and yet we still have to contend with viewpoints that gun control is, across the board, wholly ineffective. 

The most important part of all this, and the part that I hope to discuss the most, is this: if you think the data supports your opinion, *a study would have come out saying so by now*. It mystifies me that people think there are still major stones unturned in the study of everything. Do you realize how hard it is to find a topic of study these days, because of how everything has been studied to death? Why is it that we would all laugh and nod in agreement if I said ""seems like there's a new study coming out every time I breathe"", and this has been true for probably over a century now, and yet you still think maybe we don't have a study analyzing whether gender-affirming treatment actually works? 

It's not even a valid excuse to say that science has a liberal bias...looking at the vote counts of the 2024 US Presidential election, there are at least 75 million conservatives out there. You are really telling me that there was not a single one of those 75 million people who liked science, who had an aptitude for science, who went to school for a scientific field and chose to study some issue that was a big deal to his political persuasion? Not one of the 75 million conservatives did this? Really? *Really?* And if it were a matter of finding a place to publish, are there not numerous conservative research institutes like The Heritage Foundation who would publish your research? Is there otherwise some lack of funding and power amongst conservatives that restricts them from starting journals of their own where they can publish this research? (I hope there's not a single person on the planet who would say yes...)

It's hard to take any angle seriously when it is only argued from a place of internal mental reasoning, rather than from citation of evidence, ESPECIALLY when it is something we should be able to easily settle by looking at the numbers. I rarely, rarely see conservatives do this, and it seriously undermines their credibility. In my experience, they really will answer ""what evidence do you have that X happens?"" with ""common sense"" and they think they've actually scored points in a debate, rather than admitted that they have no proof to back up what they're saying. It's astonishing, really.

CMV.",Nillavuh,722,0.7599999904632568,1019,1738848489,2025-02-06 07:28:09,changemyview,https://www.reddit.com/r/changemyview/comments/1ij2io3/cmv_conservative_nonparticipation_in_science/,2,2025
1im0mun,CMV: Trump's plan for Gaza is painting a target on the back of Americans.,"History has apparently taught us nothing. This is not a post advocating for this outcome, far from it, however it hinges on an incredibly straightforward prediction that anyone paying attention to the past thirty years can see coming miles away.

Terrorists have attacked the West over what they consider to be forms of Western Imperialism in the past.

His current direction is an unapologetic and unambiguous foray into bona fide modern day imperialism. The situation in Palestine was cited by Bin Laden as one of the key motivations behind 9/11.

I'm sitting here pulling my hair out over what seems to be such an obvious and foreseeable disaster being sleepwalked into, not just from a humanitarian POV on behalf of Gazans but on behalf of the very Americans Trump is supposedly representing. It feels like everybody is thinking it, worried about it, but nobody is saying it out loud for the same reason people don't log into their internet banking the day after a shockingly expensive night out.",ChaosKeeshond,720,0.8199999928474426,422,1739172271,2025-02-10 01:24:31,changemyview,https://www.reddit.com/r/changemyview/comments/1im0mun/cmv_trumps_plan_for_gaza_is_painting_a_target_on/,2,2025
1isdlp7,"CMV: Billionaires and their companies have no allegiance to country, only to wealth.","Basically, that billionaires might make themselves out as patriots when it's politically convenient, but have no real loyalty to their native or chosen countries.

For example, the fact that Tesla sues people on China who dare criticize their cars and usually wins indicates that Musk is all snuggled up with the CCP. You'll recognize China as a country not really considered an ally, but the man currently decimating our federal government is in good with their totalitarian government. He only does what's best for his pocketbook. 

https://www.independent.co.uk/tech/tesla-crash-brakes-musk-china-zhang-yazhou-b2699677.html

Meanwhile, Zuckerberg's lackey is over in the EU threatening to get Trump involved if Europe continues to impose fines on Facebook for privacy and security issues, among other things. That's a fight we shouldn't be in, and no company exec should feel entitled to tell anyone, ""We'll see who's boss! Just wait until I call the president!"" 

https://gizmodo.com/meta-says-itll-tattle-to-trump-if-eu-keeps-being-mean-2000564638

In sum, the mere existence of billionaires is a moral failure, and we should stop deluding ourselves that they have any loyalty to place or patria. 

Change my view. 





",CrowRoutine9631,689,0.9100000262260437,235,1739888079,2025-02-18 08:14:39,changemyview,https://www.reddit.com/r/changemyview/comments/1isdlp7/cmv_billionaires_and_their_companies_have_no/,2,2025
1iv555n,CMV: Congestion Pricing in NYC is a great idea and should be much higher,"As a person living in Manhattan, in the congestion zone, there are no credible arguments I have heard against it. Driving a personal car in NYC is a luxury and only the very wealthiest drive. There is no such thing as a poor New Yorker driving into Manhattan, they take the subway! The streets are so much clearer, quieter and generally a more pleasant place to be. It’s truly amazing how much better the streets have been, even before all the capital improvements. Quicker ambulance times, buses, truck deliveries. I’m open to hearing arguments against what is effectively a toll road which can be found in most states.",Comprehensive_Fly542,676,0.8299999833106995,253,1740180867,2025-02-21 17:34:27,changemyview,https://www.reddit.com/r/changemyview/comments/1iv555n/cmv_congestion_pricing_in_nyc_is_a_great_idea_and/,2,2025
1ihwjem,CMV: Elon Musk's role in Trump's administration is the product of corruption,"Elon Musk donated at least $277 million to Trump's election campaign. Musk was then appointed to lead the ""Department of Government Efficiency."" His employees now enjoy high-level access to sensitive information in organizations like the treasury.

If Musk earned this high position through his qualifications, then the $277 million donation would be an improbable coincidence. The writing on the wall is very clear: Musk bought access to the executive branch from Trump.

In order to change my view, you would have to convince me that either the campaign donations are a coincidence, or that creating a new organization and then giving control of it to your biggest individual campaign donor is not corrupt. ",TreeLicker51,614,0.8399999737739563,137,1738713577,2025-02-04 17:59:37,changemyview,https://www.reddit.com/r/changemyview/comments/1ihwjem/cmv_elon_musks_role_in_trumps_administration_is/,2,2025
1iw2evt,"CMV: If the United States Wants to Raise Funds, It Should Start by Taxing Religious Organizations, Namely Churches","The U.S. has a massive national debt and frequently debates how to raise revenue—whether by increasing taxes on individuals, businesses, or the wealthy. But one major source of untapped funds is religious organizations, particularly churches, which collectively hold hundreds of billions of dollars in assets and generate billions in untaxed revenue each year.

Religious institutions currently benefit from 501(c)(3) tax-exempt status, meaning they pay no federal income tax, property tax, or investment tax, and members can deduct donations to them. This is justified under the principle of separation of church and state, but I’d argue that exemption is outdated and unfair for several reasons:

1. Churches function like businesses. Many run multi-million-dollar enterprises, own vast real estate holdings, and operate profitable ventures (e.g., book sales, TV networks, investments). Yet, they are taxed less than the average small business. Why should a megachurch be tax-free while a struggling coffee shop pays full taxes?
2. Some churches engage in political activity. Under IRS rules, tax-exempt organizations must refrain from endorsing candidates, yet some churches routinely influence elections and policy. If they want to play politics, they should pay taxes like PACs do.
3. Fraud and lack of financial oversight. Unlike other nonprofits, churches do not have to disclose financial statements. This lack of transparency enables fraud, mismanagement, and wealth hoarding under the guise of religious exemption. Examples include televangelists living in mansions and pastors flying private jets.
4. Taxing churches would be a fairer way to raise revenue. Instead of increasing taxes on middle-class Americans or small businesses, taxing religious organizations could generate tens of billions annually, easing the burden on everyone else.

To be clear, I am not advocating taxing individual donations to religious causes, nor am I saying all churches are corrupt. But if a religious organization accumulates significant assets, engages in business-like activities, or influences politics, it should pay its fair share like any other entity.

CMV.",barkatoshi,595,0.8500000238418579,156,1740286685,2025-02-22 22:58:05,changemyview,https://www.reddit.com/r/changemyview/comments/1iw2evt/cmv_if_the_united_states_wants_to_raise_funds_it/,2,2025
1iy0flp,"CMV: Now that US has started to parrot Russian propaganda , its only a matter of time before Russia attacks Georgia again either physically or via a coup.","Now that First consul Trump and musk have decided to sell out Ukraine and vote to non condemn Russia , its clear that they arent even attempting to hide their backdoor dealings.  Ukraine is toast and idk why russia would just stop at that tbh, sure putin's army has broken down but where is the aid for georgia even going to come from ? Ukraine shares a large border with its allies , Georgia is alone and a very easy to pick apart.

its no secret that putin is annoyed by those protests there , its only a matter of time before russia decides to ""restore order "" and go in again. who's gonna stop them ? EU ? yea good luck with that.

dont see why armenia will last longer too tbh. Putin and Turkey no longer have a beef in Syria. who knows they decide to puppet Armenia as well.",ruckfeddit22t,592,0.8299999833106995,130,1740504306,2025-02-25 11:25:06,changemyview,https://www.reddit.com/r/changemyview/comments/1iy0flp/cmv_now_that_us_has_started_to_parrot_russian/,2,2025
1iy0xg6,CMV: The trolley problem is constructed in a way that forces a utilitarian answer and it is fundamentally flawed,"Everybody knows the classic trolley problem and whether or not you would pull the lever to kill one person and save the five people.

Often times people will just say that 5 lives are more valuable than 1 life and thus the only morally correct thing to do is pull the lever.

I understand the problem is hypothetical and we have to choose the objectivelly right thing to do in a very specific situation. However, the question is formed in a way that makes the murders a statistic thus pushing you into a utilitarian answer. Its easy to disassociate in that case. The same question can be manipulated in a million different ways while still maintaining the 5 to 1 or even 5 to 4 ratio and yield different answers because you framed it differently.

Flip it completely and ask someone would they spend years tracking down 3 innocent people and kill them in cold blood because a politician they hate promised to kill 5 random people if they dont. In this case 3 is still less than 5 and thus using the same logic you should do it to minimize the pain and suffering.

I'm not saying any answer is objectivelly right, I'm saying the question itself is completely flawed and forces the human mind to be biased towars a certain point of view.",randomafricanboi,590,0.8299999833106995,307,1740505506,2025-02-25 11:45:06,changemyview,https://www.reddit.com/r/changemyview/comments/1iy0xg6/cmv_the_trolley_problem_is_constructed_in_a_way/,2,2025
1ijdxuv,CMV: Duels between two consenting adults should be legal,"Basically what the title says, dueling should be legalized with certain parameters. Public dueling should be illegal due to risk for an innocent bystander to be hurt, but there should be a system in place where you can schedule a duel. Maybe have them take place in an indoor facility made to withstand a small pistol round, like the material used in indoor firing ranges. Seems to me like it would possibly cut down on innocent bystanders getting hit (like in a gang drive by scenario, if the two rivals are allowed to duel in a protected area that could prevent them from taking action in public). ",DepartmentDramatic18,526,0.7799999713897705,335,1738877175,2025-02-06 15:26:15,changemyview,https://www.reddit.com/r/changemyview/comments/1ijdxuv/cmv_duels_between_two_consenting_adults_should_be/,2,2025
1ixxklm,"CMV: The pandemic single handedly broke peoples brains in North America more than anywhere else with foreign and domestic right wing disinformation propaganda to sway non political people to believe all structures of govt are out to get them, and then support a despot like trump...who is in the govt","Being a world traveler and person with many friends and family around the world, talking to them about what was happening here in North America during and after the pandemic is illuminating and sad. Try explaining to them that a huge number of people here—who have never experienced real hardship—genuinely believe that being asked to stay home, practice basic hygiene, and wear a mask was the greatest oppression of their lives. Many of them have no idea how brainwashed they became because they’ve never been able to see it from an outside perspective. Yes, some people worldwide fell for similar disinformation, but the scale was nowhere near what happened in North America. While people in impoverished countries were dying in droves, struggling to get access to vaccines, privileged North Americans—convinced by conspiracy theories—thought the government was ""out to get them"" and planned to throw them in camps. And now, those same people overwhelmingly support an actual fascist leader who is literally building camps and prisons for his opposition. The lack of empathy, the complete ignorance of global struggles, and the deep entitlement have turned many into unwitting pawns of right-wing ideology. The avenues of propaganda—from so-called “natural health” influencers lacking critical thinking, to incel culture, to marginalized communities who (rightfully) remember past government abuses but fail to see today’s reality—is staggering. And, of course, the openly bigoted groups who already aligned with right-wing politics only strengthened their position. All of these groups, from different backgrounds, were funneled into the same right-wing propaganda machine—one that thrives on fear, misinformation, and manufactured victimhood.",Forsaken-Feeling3481,507,0.7699999809265137,649,1740497176,2025-02-25 09:26:16,changemyview,https://www.reddit.com/r/changemyview/comments/1ixxklm/cmv_the_pandemic_single_handedly_broke_peoples/,2,2025
1ifxdbo,CMV: Most Anti Immigration people are just racist,"I’ve genuinely never seen an anti immigration/ pro deportations person talk about the “issue” of immigration without using racist talking points or bringing up skin color. Whether it be right wing politicians, people in person or people online. I’ve seen politicians call these people “poison” and “vermin” just like how Hitler talked about the jews, and their main focus is Mexicans and South Americans and Africans. Never have I seen them talk about the thousands of Russians, Western Europeans and Canadians that are here illegally. Plus the propaganda about how all immigrants are rapists and gang bangers, which is just factually untrue. There are so many of them here just working to provide for their kids and then there’s a few bad apples in Colorado and they use it to push their agenda that these people are “dangerous criminals”. Miss me with that. 

On top of that, the MAGA party wanting to change “Gulf of Mexico” to “Gulf of America”, taking the Spanish option off of their website and ICE detaining people just for speaking Spanish in public seems pretty racist to me. They aren’t going after criminals they’re going after anyone who is brown and speaks Spanish. If they just want to deport the criminals then why are they trying to enter churches and elementary schools??

Trump now wants to start something up in Guantanamo Bay that is more or less a concentration camp. If it’s all about just getting these people out and having them come the “legal way” then why hold them in a camp on in a dangerous place. Also if they’re “pro immigration” as long as it’s legal why is this administration trying to make that process harder??

I’ve never heard a good argument against immigration that isn’t rooted from racism and stereotypes. These people add billions to our social security every year, they pick our vegetables, build our houses, create new jobs and contribute greatly to our economy. Anyone who knows this knows our country won’t be better by getting rid of them, but they’ll just repeat the “they’re all criminals!” And “they’re raping our women!” Until they’re blue in the face with no facts to back it up. Most Americans are living paycheck to paycheck, how does immigrants being here affect our lives negatively at all?? MAGA just wants them to believe that instead of focusing on the real enemy which is greedy corporations and billionaires. 
",EchoVital,494,0.6899999976158142,899,1738503421,2025-02-02 07:37:01,changemyview,https://www.reddit.com/r/changemyview/comments/1ifxdbo/cmv_most_anti_immigration_people_are_just_racist/,2,2025
1ihjhs3,CMV: CDC employees must release public health data regardless of what Trump has decreed,"People don't work for the CDC if they aren't fully committed to the public health of Americans. That commitment is not to the White House or any political party but to the American people.

Trump's insane and immoral executive order to muzzle the CDC threaten the health and lives of *all Americans* and must be ignored for the good of the country. Politics does not supercede public health.

It is the duty of CDC employees to release the public health data that we, as taxpayers, have paid for, regardless of the ravings of a madman in the White House.

A lot of talk is about Luigi and jury nullification, well this is a similar argument. Trump is endangering the health and lives of all Americans—the elderly, the young, working families—all of us.

It is time to rise up and resist this psychopath and do what is the right and moral thing for the country. Publish/leak the CDC data.",Interanal_Exam,469,0.8799999952316284,125,1738681011,2025-02-04 08:56:51,changemyview,https://www.reddit.com/r/changemyview/comments/1ihjhs3/cmv_cdc_employees_must_release_public_health_data/,2,2025
