post_id,title,text,author,score,upvote_ratio,num_comments,created_utc,created_datetime,subreddit,permalink,month,year
1icdp5l,CMV: Billionaires shouldn’t exist,"The existence of billionaires is proof of a rigged system that mistakes greed for “innovation” and exploitation for “merit.” It is not a sign of a thriving economy.

No one earns a billion dollars. You *extract* it by underpaying workers, dodging taxes, privatizing public goods,  commodifying basic human needs, etc.

The math doesn't lie. Even spending $1 million a day, it would take almost 3,000 years to go through a billion dollars. The top 1% of Americans hoard $44 trillion in wealth which is more than the bottom 90% combined. Meanwhile ending global poverty would cost roughly $300 billion *annually*. Jeff Bezos could single-handedly fund that for 50 years and still die richer than Croesus. This isn’t capitalism. It’s just feudalism with better PR.  

“But they create jobs!”

No, workers create value and billionaires just skim it. Elon Musk’s wealth surged by $150 billion during the pandemic while his factory employees fought for bathroom breaks and unions. The Walton family’s fortune for example was built on welfare-subsidized Walmart wages so low, taxpayers foot the bill for their employees’ food stamps.  

And philanthropy is a scam. Gates and Zuckerberg don’t “donate” wealth. They stash it in tax-free foundations to lobby governments, dodge accountability, and shape policy in their image. I’m no other toke has this been more true then now with Trump. 

Want to end malaria? Pay. Your. Taxes. Let democratically elected leaders, not unelected oligarchs, decide how to fix society.  

Oh and these 2,600 billionaires on Earth emit a million times more carbon than the average person. Private jets, mega-yachts, and Mars escapism aren’t “rewards for hard work” 😂 

They’re crimes against humanity’s survival.  

“They took risks”

So do teachers, nurses, and firefighters. They just don’t get to offshore their salaries to the Cayman Islands. Billionaires aren’t “self-made.” They’re products of publicly funded infrastructure, education, and research. 

Steve Jobs didn’t invent the iPhone. He exploited taxpayer-funded tech like GPS and the internet.  

Defend billionaires as anything other than glitches in a broken system. Argue that hoarding wealth equal to 10,000 lifetimes of labor is ethical while 1 in 9 people starve. Bonus points if you do it without quoting Ayn Rand or pretending “trickle-down” isn’t a debunked. ",Gold_Palpitation8982,1028,0.7900000214576721,844,1738101789,2025-01-28 16:03:09,changemyview,https://www.reddit.com/r/changemyview/comments/1icdp5l/cmv_billionaires_shouldnt_exist/,1,2025
1i31opi,"CMV: Changing the correct term from ""homeless"" to ""unhoused"" does nothing to break the social stigma and is arguably a worse term","I want to open a discussion on the terms ""homeless"" and ""unhoused"" as I have seen many different opinions on this. Personally, I think it's counterproductive to call out people for being offensive because they use the term homeless for a few different reasons.

1. From an etymology standpoint, these words mean almost the same exact thing. House and home are synonymous. -Less means to be without, and un- means the opposite of. So homeless means to be without a home, and unhoused means you are not housed.
2. I think ""unhoused"" excludes people who choose to live with no stationary home. To me, homeless better describes this because it just means to be without a permanent dwelling. Unhoused, to me, could imply that the norm is housed and you are not. I think it can also imply you have become unhoused due solely to outside factors. Homeless, in my opinion, does not determine any fault or factor. It is simply to be without a permanent home. This is why I think it could be worse to use ""unhoused"" as that word has a higher chance of having a connotation attached to it.
3. Changing this term does nothing to help the homeless/unhoused population. Because they have similar definitions, no social stigma is decreased in changing it. Homeless is not a slur. Instead of bringing attention to programs and support for the population and trying to resolve the problem, it instead leads to mainly calling out others for being ""offensive"" to the population. Calling out others for being offensive is not a problem on it's own obviously; we should all be kinder to one another, and it's lead to getting rid of outdated hurtful words like the r word. But I do think it's an issue when there's almost no discernable difference between the words' meaning. It defies common sense.

Please share your opinion below. I'd love to see some other perspectives on this and see if my view changes with some of your points. Thank you for your time :)",iwishtonotexistpls,1021,0.949999988079071,209,1737067741,2025-01-16 16:49:01,changemyview,https://www.reddit.com/r/changemyview/comments/1i31opi/cmv_changing_the_correct_term_from_homeless_to/,1,2025
1i88qtx,"CMV: Despite being more knowledgeable, wealthier and apparently more tolerant, the political and individual left's biggest flaw is their inability to communicate pragmatically and empathetically with those who don't agree with them.","I've seen this rather confounding phenomenon that despite being ""smarter"" ""wealthier"" ""more tolerant"" and all the general buzz words you hear from the entire left, ranging from mainstream dems to far left people, their inability to humble themselves to actually *help* the other side is the biggest reason they can't succeed. 

Yes, let's rule out the hardest core right wing. But there are too many instances of a hyperventalive, astonished left that absolutely diminishes the pragmatic points they try to make. 

The general example i'm going to reference is the AOCs versus the Bernies. The breathy left versus the ""I have to find solutions"" left. 

I don't understand how anyone with more knowledge than someone cannot communicate with someone who has less knowledge than them. How if *you* know the answer, you can't communicate it with someone patiently enough to come up with common ground.

The problem is the gap in communication. We all get that there are no compromise righties that won't believe a word of what you're saying, but the inability to create mutual understanding is on you. If you can't communicate, then I'm sorry but I don't feel bad for you. There is obviously a lack of respect, and yes, I will forgive some of the interfamily dynamics that can get anyone on edge, but the overall loss of the left is due to their inability to humble themselves to create paradigms that people who oppose them can understand. It is to be on the same page (whether you agree or disagree) that is something worth fighting for, not to simply be astounded that someone thinks ""illegal immigrants are ruining the country,"" ""climate change isn't real"" ""x, y or z."" The *way* you communicate *facts* is what is harming you. 

Trust me when I say that if you are in position of control (are smarter), you should be able to reason with someone you disagree with. Ask any parent if they understand what their kid is saying, yet they can still reason with them and create dialogue. I truly do not believe that someone who is supposed to be smarter, cant find reason. And yes, the reason in this dialogue isnt ""you now agree with me,"" it's the patience to understand that you got them to think that you may be right. 

My true advice to anyone is to work on your communication and reasoning skills then stomping on someone. Learn the advantage of progress versus winning. Achieve common ground with someone you disagree with. 

My advice to your response isn't to simply blame the right. I've given the examples where you can blame them (furthest right, eg., bad actors; family). Let's make the goal to create respect than winning. And we all know that the right has its problems, but just remember, this thread is about you, the left.",poopchow,1013,0.7099999785423279,1398,1737653281,2025-01-23 11:28:01,changemyview,https://www.reddit.com/r/changemyview/comments/1i88qtx/cmv_despite_being_more_knowledgeable_wealthier/,1,2025
1i4wew7,"CMV: People don't actually understand what the ""TikTok Ban"" actually means for the typical American.","The bill that was passed to ban TikTok H.R.7521, is a bill that essentially deems applications made by our Foreign Adversaries (China, Russia, Iran, etc, etc.) to be ""banned""/unusable across American borders. The issue that resides within in this is the fact that it is just another step, or at least in the wording of, for our Government to control more aspects of our common life. That's why it's not just a social media being banned, but quite possibly a step in a direction that I doubt anyone wants to see taken. As well, there hundreds if not thousands' of people who have made some decent headway with money on that app, so there's that too.",bansheehallows,962,0.7099999785423279,1089,1737285827,2025-01-19 05:23:47,changemyview,https://www.reddit.com/r/changemyview/comments/1i4wew7/cmv_people_dont_actually_understand_what_the/,1,2025
1ie2m3n,"CMV: Until Melania and Baron Trump are deported, nobody else in the US should be ripped from their homes.","CMV: Nobody in the U.S. should be deported until Melania and Barron Trump are deported, because by Donald Trump's own definition, they are not legal citizens and should be the first to go—along with Elon Musk.

Premise 1: Trump’s Own Immigration Standards  
Donald Trump has consistently advocated for stricter immigration policies, including ending birthright citizenship, revoking visas for those who ""take American jobs,"" and heavily scrutinizing chain migration—the very system through which Melania Trump obtained citizenship. Under his own logic, Melania’s citizenship, obtained via the EB-1 visa (intended for people with ""extraordinary ability""), should be considered invalid, as her qualifications were dubious. If chain migration is unacceptable, then her parents, who became citizens through her, also should not be here. Barron Trump, as the child of an allegedly ineligible citizen, would also lack valid status under this framework.  

Premise 2: Consistency in Deportation Priorities
If the U.S. government enforces deportation policies, it should start with the most high-profile and politically connected individuals who benefited from questionable immigration practices. Trump’s own rhetoric suggests that immigrants take jobs, commit crimes, and exploit loopholes. Elon Musk, a billionaire immigrant, has been accused of labor violations and manipulating the visa system to benefit himself and his businesses. If deportation is about protecting American workers, Musk should be at the top of the list.  

Premise 3: Moral and Logical Fairness  
It is unjust to target vulnerable, low-income immigrants while allowing wealthy or politically powerful immigrants to remain. If Trump’s base truly believes in enforcing immigration laws without exception, they should demand the deportation of those who benefited from the very systems he condemns—starting with his own family. Until this happens, no one else should be deported, as doing so would be an inconsistent and hypocritical application of immigration law.  

Conclusion
If Trump’s immigration policies are to be applied fairly, Melania and Barron Trump, as well as Elon Musk, should be first in line for deportation. Until that happens, the U.S. should halt all other deportations to avoid selective enforcement that disproportionately harms the powerless while protecting the elite.  

Change my view.",Jacostak,941,0.699999988079071,399,1738284760,2025-01-30 18:52:40,changemyview,https://www.reddit.com/r/changemyview/comments/1ie2m3n/cmv_until_melania_and_baron_trump_are_deported/,1,2025
1i9u2h8,cmv: Trump was not a reasonable choice for president.,"Let me get this straight. I am German, and while I do have some horses in this race considering the US is such a large country that it effects me too, I am not nearly as effected as actual Americans. 

I am also left. I am not super politically active, but I know enough about Trump to dislike him. Aside from his treatment of minority groups such as LGBTQ people and his ignorance of climate change, I also dislike his economic tatiff plans for the US and how they seem to mostly help the 1%. Project 2025 is also a whole different can of worms. And I also heard something about him raising the prices for medicine already. And his relationship to Elon who supports the AFD, did two nazi gestures and censors Twitter is.. well. You know it.

Once again, I am not super into politics but the fact that Trump actually got elected surprised me. In hindsight I shouldnt of been, but I thought ""someone like THAT won't be voted AGAIN, they can't be this dumb. He dodged a question about border security with aliens eating cats and dogs."" 

But here we are.

But I want to try and be unbiased. I dont even want you to prove to me that he was a better choice, just a reasonable one. Make me say ""Well I disagree but I can see why one might think like that.""

I want to hear both conservatives and democrats on this, I am super curious about actual discussions between the two parties.",Fishy_smelly_goody,917,0.699999988079071,1531,1737831361,2025-01-25 12:56:01,changemyview,https://www.reddit.com/r/changemyview/comments/1i9u2h8/cmv_trump_was_not_a_reasonable_choice_for/,1,2025
1hwv4lp,CMV: Disney should make new movies with minority leads instead of race swapping in remakes ,"Literally the title. I’m a huge Disney fan but this is so lazy. I feel like if they actually cared about inclusion and representing minorities, they’d make original stories that represent them, not the half assed remakes that they’re using for cash grabs. I’m not one of those “why is Disney woke now 😡” kind of people, I’m happy to see more representation but I just hate how they’re doing it. Race swapping white characters like Ariel the mermaid and Hercules in live action remakes is just a dead giveaway that they’d rather take the easy way out instead of actually taking time to make fresh stuff. 

I feel like Disney was more inclusive back when they didn’t try so hard. Stuff like Pocahontas, Mulan, Lilo & Stitch and Princess and the frog. It felt real. Now it just feels so forced that many are unable to appreciate it. 

With only making remakes with minority leads instead of taking time to make them their own original princess/ main character I feel like they’re basically saying “you’re not worth the time of a new project”. Why can’t they just continue with things like Encanto, Moana, and Wish? Have they ran out of ideas or something? ",EchoVital,890,0.8700000047683716,573,1736370805,2025-01-08 15:13:25,changemyview,https://www.reddit.com/r/changemyview/comments/1hwv4lp/cmv_disney_should_make_new_movies_with_minority/,1,2025
1i5akbz,"CMV: When you are very naive, you believe the USA is the greatest country in the world. When you start to learn more, you believe it is a mess, almost a 3rd world country. When you are truly educated, you realize it is amazing compared to most of the world, and probably in the top 10 to live in.","this is at least what I gathered from fellow argentinians opinions on the US. The reality is that it has lots of very large problems to tackle, but in comparisson to the rest of the world, in terms of standard of living, it is one of the best countries in the world. for women, for LGBT people, for working people in general.

countries that may be even better are probably in the single digits, or low double digits: norway and switzerland probably, then maybe denmark and finland. much more difficult to determine are countries such as germany which is probably about the same, sweden which is in my opinion slightly worse than the US, maybe taiwan, australia.

the fact is, the US is very rich. it has ridiculous amount of disposable income, and while it is economically unequal, still most people have more purchasing power than in other developed countries. it is very good for doing business, inversting, it is very good compared to the world in LGBT laws and people's opinion on LGBT issues. it is one of the least racists countries in the world, if you travelled a lot you would know about it.

in my 18-20s I was very anti-USA, then I educated myself and put it in the top 10 best countries to live in. which is specially commendable giving its very large land area and population to manage. the single worst issue compared to other developed countries is security: homicides and its GPI is very much worse than other comparable countries. then in democracy, GINI, health it could be better. but in median income, GDP PPP, GDP PPP per capita, poverty rates, unemployment rates, HDI,  business, competitive, innovation indexes, economic freedom, etc. is a beast.

It would be a pleasure for most people in the world to live in the US. I travelled to the US, and was able to see, apart from just reading and educating myself about it. it is spectacular. infrastructure, cleanliness, the level of houses in suburbia and city centre. 

whats more, in economic and population (fertility & immigration) fronts, it has a very bright future. europe and developed asia face much more challenges, though this is a little bit more subjective.

BACK to the title: due to being the only superpower of the world, its bast cultural and propagandistic influences in the world makes it so that when you are naive, you think its amazing. then you start to learn about opioid crisis, health insurance crisis, uber-conservatives, etc so you think its a developing nation. after that, you get the gift of nuance and start to see that, comperatively, it is truly an amazing country to live in.

to change my view, you need to

1. establish the US as a probably non top 10 country to live in

2. convince me that most naive people in the world 'worship' the US, then when they learn some stuff they hate it, and then people who are very passionate about global politics, economics, int. relations, that read & watch much about comparable standards of living from country to country with nuance and an open mind, love the US or at least respect it a lot.",cuervodeboedo1,809,0.7300000190734863,586,1737324508,2025-01-19 16:08:28,changemyview,https://www.reddit.com/r/changemyview/comments/1i5akbz/cmv_when_you_are_very_naive_you_believe_the_usa/,1,2025
1hz13nc,CMV: Obama laughing with trump is not something to be concerned about,"I’m not too desperate to get into most political talk, but people being concerned with Obama laughing at a joke by trump has been quite the stir recently. Ive seen posts on a few subreddits making the claim that the issue is not left or right, but classism, while using the photo of trump and Obama laughing at jimmy carters funeral. 

I’ve wanted to make the counter argument that the photo can be seen as a positive for Obama. I feel as though he has the capability to sit with anyone and perceive them as human. The ability to sit down and chat with your opposition is a positive trait that Obama uses as both leverage and assurity of level headedness from himself. 

I’m not going to deny the statement that class issues are a huge problem. Class inequality is what I believe to be one of our bigger issues in the United States and needs to be addressed. However, I do believe that Obama is not in the wrong for the ability to laugh at a joke by their opposition party, nor does it conclude that he is a problem with such an issue. In fact, I think that is something that Trump had begun to remove from the political scene compared to all other elections before his first run in 2016. You can compare political debates before the 2016 election and find more level headedness while still disagreeing. 

I also apologize if some of this is a bit unclear, feel free to have me rewrite some statements. I’ve just woken up and a bit hungover, idk why I have the energy to discuss this but I’m down for it lol

CMV",TheBone_Zone,759,0.8199999928474426,724,1736616956,2025-01-11 11:35:56,changemyview,https://www.reddit.com/r/changemyview/comments/1hz13nc/cmv_obama_laughing_with_trump_is_not_something_to/,1,2025
1i59te1,CMV: Conservatives Will Dominate America for the Next ~20 Years,"Note: By “conservatives,” I mean both Republicans and conservative Democrats.

Trump’s win in November was resounding in every way except the final popular vote tally. Trump won every swing state, and every state moved to the right. Trump fell short of a true majority of the popular vote and only won it by 1.5 points, but it was still the first time a Republican won the popular vote since 2004. Additionally, Republicans won over millions of voters from majority-Democratic voting blocs.

Many left-leaning people have claimed, falsely, that Democrats lost due to low turnout. In truth, the 2024 election saw the second- highest turnout of any presidential election, and swing states like Georgia and North Carolina saw record turnout. By all metrics, the Harris-Walz team’s attempts to “get out the vote” worked. They successfully got out the vote… for Trump. Indeed, Trump won both Independents and first-time voters. Trump won *because* of high turnout. High turnout no longer benefits Democrats.

All post-election polling has suggested that Republicans are now the more popular party. Overall, America shifted to the right by four points in 2024. One poll found that 43 percent of voters viewed Democrats favorably and 50 percent viewed them unfavorably. Increasingly, Democrats are viewed as affluent, out-of-touch, college-educated elites who ask for votes and never return the favor. Most voters trust Republicans more on the economy, immigration, and crime. The economy and immigration were the two most important issues for voters last year. Most voters support mass deportations, which Trump has repeatedly promised to begin on day one. It’s obvious that MAGA has won over the majority of voters, which is also why Democrats are starting to move towards the center on issues, immigration chief among them.

The shifts among key demographics are even more alarming. Harris barely won a majority of the Latino vote, and most Latino men voted for Trump. Harris won Asians nationally, but Asians in Nevada shifted to the right by more than *50 points*. Democrats may have permanently lost the Muslim vote because Muslims hate ~~Jews~~ ~~Israel~~ “genocide,” and the recent ceasefire deal, in which Trump was apparently instrumental, might be the final nail in the coffin, especially considering Muslims’ social views make white evangelicals seem progressive. That could mean that Democrats will never again win Michigan. Other racial and religious groups, such as blacks and Jews, also shifted to the right by smaller amounts.

However, the most alarming shift is among young voters. According to the AP VoteCast, Harris only won young voters by 4 points; Biden carried them by more than 30. Young men especially are rapidly shifting towards the GOP. The reasons for this shift are debated, though many attribute it to perceived abandonment and/or demonization of men by the left. Also worth noting are the issues that are genuinely worse for men, such as the male suicide rate. For instance, the percentage of college students who are female now is roughly equal to the percentage of college students who were male prior to Title IX, and college enrollment among men is declining. More and more men are opting for trade schools instead, largely due to costs. This is important because college-educated people tend to be more liberal (the so-called “diploma divide”), while tradespeople tend to be very conservative. Lastly, since young voters’ views tend to be the most malleable, it stands to reason that more and more young voters will embrace MAGA.

This shift to the right is not limited to the US. In fact, the West as a whole is moving sharply to the right, largely for the same reasons as the US: the economy and immigration. The Conservatives are all but guaranteed to take control of Canada later this year and were even before Trudeau’s resignation. Although Labour took control of Parliament just last year, its popularity has already plummeted, and Reform UK’s popularity has surged. The SPD is poised to get voted out this year, and the AfD is becoming more popular by the minute. Now, the situation in Europe is different - and frankly, more dire - than the situation here in the States. Europe is currently facing widespread economic stagnation, and European society is being upended by immigration, particularly from the Islamic world. Similarly, largely unrestricted immigration in Canada has inflated home prices and created numerous social issues. As a result, left-wing parties haven’t been less popular since the Cold War, and right-wing populist parties who claim to have solutions are rapidly gaining popularity. Arguably, Trump’s comeback was the final nail in the coffin for the progressivism of the early century. At the time of writing, all signs point to a generation of right-wing dominance of America and the West as a whole.",Emperor_Kyrius,697,0.7099999785423279,1225,1737322633,2025-01-19 15:37:13,changemyview,https://www.reddit.com/r/changemyview/comments/1i59te1/cmv_conservatives_will_dominate_america_for_the/,1,2025
