post_id,title,text,author,score,upvote_ratio,num_comments,created_utc,created_datetime,subreddit,permalink,month,year
1kbhaxc,More than 150 noble-prize winning scientists warn of an imminent global famine by 2050s,[removed],[deleted],1,1.0,0,1746021765,2025-04-30 09:02:45,science,https://www.reddit.com/r/science/comments/1kbhaxc/more_than_150_nobleprize_winning_scientists_warn/,4,2025
1kaq5fx,Childhood Bacterial Infections May Hold the Key to Rising Colon Cancer Rates in Young Adults,[removed],[deleted],1,1.0,0,1745939074,2025-04-29 10:04:34,science,https://www.reddit.com/r/science/comments/1kaq5fx/childhood_bacterial_infections_may_hold_the_key/,4,2025
1ka7rx0,"Science ADHD Power Playlist: Energize Your Mind and Body During or After Work

Living with ADHD often means battling energy crashes, focus issues, and motivation slumps throughout the day. Music has been a huge help for me personally when it comes to keeping my mind engaged without feeling overwhelm",[removed],[deleted],1,1.0,0,1745877364,2025-04-28 16:56:04,science,https://www.reddit.com/r/science/comments/1ka7rx0/science_adhd_power_playlist_energize_your_mind/,4,2025
1k9oqrs,"An 18-year-old high school student, Matteo Paz, developed an AI tool that analysed NASA's huge amount of NEOWISE infrared data, identifying 1.5 million previously uncatalogued cosmic objects. The peer-reviewed official article was published in [IOP Science]",[deleted],[deleted],1,1.0,1,1745820785,2025-04-28 01:13:05,science,https://www.reddit.com/r/science/comments/1k9oqrs/an_18yearold_high_school_student_matteo_paz/,4,2025
1k7mv7o,Better oral health linked to lower risk of depression and anxiety in older adults | Participants who had received dental surgery had 42% lower odds of developing depression than those with missing or unrepaired teeth.,[deleted],[deleted],1,1.0,1,1745592674,2025-04-25 09:51:14,science,https://www.reddit.com/r/science/comments/1k7mv7o/better_oral_health_linked_to_lower_risk_of/,4,2025
1k6dyvl,Indian plate is moving and breaking apart under the Himalayas,[removed],[deleted],1,1.0,0,1745451719,2025-04-23 18:41:59,science,https://www.reddit.com/r/science/comments/1k6dyvl/indian_plate_is_moving_and_breaking_apart_under/,4,2025
1k68iyh,What will end up happening to the world when an electron ends up having a positive charge?,[removed],[deleted],1,1.0,1,1745437753,2025-04-23 14:49:13,science,https://www.reddit.com/r/science/comments/1k68iyh/what_will_end_up_happening_to_the_world_when_an/,4,2025
1k5zqr5,Autism Rates: What RFK Jr. Gets Wrong About the Science,[removed],[deleted],1,1.0,0,1745416423,2025-04-23 08:53:43,science,https://www.reddit.com/r/science/comments/1k5zqr5/autism_rates_what_rfk_jr_gets_wrong_about_the/,4,2025
1k5y20z,"🎬💖 Calling All K-Drama Fans!

If you are a woman who watches Korean dramas, please take a moment to participate in my thesis study! This survey will take about 15 minutes, and your responses will remain completely confidential.

I’d also appreciate it if you could share this with others who watch",[removed],[deleted],1,1.0,1,1745411730,2025-04-23 07:35:30,science,https://www.reddit.com/r/science/comments/1k5y20z/calling_all_kdrama_fans_if_you_are_a_woman_who/,4,2025
1k5y0lu,[Survey] Psychological Impact of Korean Dramas on Female Viewers (FEMALE)(18+)(INDIA),[removed],[deleted],1,1.0,0,1745411611,2025-04-23 07:33:31,science,https://www.reddit.com/r/science/comments/1k5y0lu/survey_psychological_impact_of_korean_dramas_on/,4,2025
1k4cnro,"High-fat, high-sugar diets impact cognitive function | he findings build on a growing body of evidence showing the negative impact of high-fat, high-sugar (HFHS) diets on cognitive ability, adding to their well-known physical effects.",[deleted],[deleted],1,1.0,1,1745239656,2025-04-21 07:47:36,science,https://www.reddit.com/r/science/comments/1k4cnro/highfat_highsugar_diets_impact_cognitive_function/,4,2025
1k28ejd,"People with medical debt five times more likely to not receive mental health care treatment. Almost half of Americans with mental health disorders don’t receive treatment, and the findings in the study reinforce the view that medical debt contributes to that treatment gap.",[deleted],[deleted],1,0.6700000166893005,2,1744991916,2025-04-18 10:58:36,science,https://www.reddit.com/r/science/comments/1k28ejd/people_with_medical_debt_five_times_more_likely/,4,2025
1k282ks,Popular narratives have often portrayed menstruation as a condition that impairs thinking and decision-making. A new meta-analysis finds no robust evidence that women’s cognitive abilities vary across different phases of the menstrual cycle.,[removed],[deleted],1,1.0,2,1744991080,2025-04-18 10:44:40,science,https://www.reddit.com/r/science/comments/1k282ks/popular_narratives_have_often_portrayed/,4,2025
1k25i4p,"Four new studies show correlational link between heavy cannabis use, serious health risks",[removed],[deleted],1,1.0,0,1744984470,2025-04-18 08:54:30,science,https://www.reddit.com/r/science/comments/1k25i4p/four_new_studies_show_correlational_link_between/,4,2025
1k25hkp,Attention Required!,[removed],[deleted],1,1.0,0,1744984429,2025-04-18 08:53:49,science,https://www.reddit.com/r/science/comments/1k25hkp/attention_required/,4,2025
1k25gb6,"Four new studies show link between heavy cannabis use, serious health risks",[removed],[deleted],1,1.0,0,1744984331,2025-04-18 08:52:11,science,https://www.reddit.com/r/science/comments/1k25gb6/four_new_studies_show_link_between_heavy_cannabis/,4,2025
1k25fds,Atmospheric CO2 Now Trapping 2x More Heat Than 1990 - New climate modeling study,[removed],[deleted],1,1.0,2,1744984258,2025-04-18 08:50:58,science,https://www.reddit.com/r/science/comments/1k25fds/atmospheric_co2_now_trapping_2x_more_heat_than/,4,2025
1k1feyc,The Science Behind Nubbin Tech’s Neural Magic,[removed],[deleted],1,1.0,1,1744903244,2025-04-17 10:20:44,science,https://www.reddit.com/r/science/comments/1k1feyc/the_science_behind_nubbin_techs_neural_magic/,4,2025
1k0jnfq,"Wildflowers could be absorbing toxic metals that pass on to bees, study finds | Scientists call for urban areas to be tested for contaminants and potentially cleaned before wildflowers are planted",[deleted],[deleted],1,1.0,1,1744807910,2025-04-16 07:51:50,science,https://www.reddit.com/r/science/comments/1k0jnfq/wildflowers_could_be_absorbing_toxic_metals_that/,4,2025
1k09krc,"RSV vaccine in pregnancy: real-world study shows safety aligns with trials, but preterm birth signal persists",[removed],[deleted],1,1.0,0,1744769802,2025-04-15 21:16:42,science,https://www.reddit.com/r/science/comments/1k09krc/rsv_vaccine_in_pregnancy_realworld_study_shows/,4,2025
1jtmb0n,"Benefits of ADHD medication outweigh health risks, study finds | Children taking ADHD drugs showed small increases in blood pressure and pulse rates but ‘risk-benefit ratio is reassuring’",[deleted],[deleted],1,1.0,1,1744035393,2025-04-07 09:16:33,science,https://www.reddit.com/r/science/comments/1jtmb0n/benefits_of_adhd_medication_outweigh_health_risks/,4,2025
1jthn7v,"Study links cannabis and synthetic cannabinoid use to poorer male sexual function | The research found that men dependent on these substances not only experienced poorer sexual function overall, but also struggled with sexual esteem and elevated sexual-related depression.",[deleted],[deleted],1,1.0,1,1744020143,2025-04-07 05:02:23,science,https://www.reddit.com/r/science/comments/1jthn7v/study_links_cannabis_and_synthetic_cannabinoid/,4,2025
1jr8xfi,"45.6% of nation's teens have at least one chronic disease, ADHD or autism",[deleted],[deleted],1,1.0,1,1743763643,2025-04-04 05:47:23,science,https://www.reddit.com/r/science/comments/1jr8xfi/456_of_nations_teens_have_at_least_one_chronic/,4,2025
1jqktdj,"New model published in Nature and developed by the University of Michigan and the University of Colorado shows extreme weather events—like wildfires, windstorms, and heatwaves—can cause major economic losses by disrupting ecosystem services, such as pollination, timber, and recreation",[deleted],[deleted],1,1.0,1,1743692659,2025-04-03 10:04:19,science,https://www.reddit.com/r/science/comments/1jqktdj/new_model_published_in_nature_and_developed_by/,4,2025
1jotuf6,Extraverts with autotelic personality traits are more likely to experience flow | Extraverted individuals with pronounced autotelic personality traits—those who engage in activities purely for the experience—were more likely to experience flow while playing the game Perfection alone.,[deleted],[deleted],1,1.0,1,1743508902,2025-04-01 07:01:42,science,https://www.reddit.com/r/science/comments/1jotuf6/extraverts_with_autotelic_personality_traits_are/,4,2025
