post_id,title,text,author,score,upvote_ratio,num_comments,created_utc,created_datetime,subreddit,permalink,month,year
1hp5lf3,"'Achilles Heel' of Drug-Resistant Bacteria Has Been Found, Scientists Say",[deleted],[deleted],1,1,1,1735505745,2024-12-29 14:55:45,science,https://www.reddit.com/r/science/comments/1hp5lf3/achilles_heel_of_drugresistant_bacteria_has_been/,12,2024
1hoh85c, Electricity from body movement: 280x more efficient device developed in South Korea ,[removed],[deleted],1,1,0,1735425322,2024-12-28 16:35:22,science,https://www.reddit.com/r/science/comments/1hoh85c/electricity_from_body_movement_280x_more/,12,2024
1hnerhw,Groundbreaking technology converts cancer cells into normal cells,[removed],[deleted],1,1,1,1735305771,2024-12-27 07:22:51,science,https://www.reddit.com/r/science/comments/1hnerhw/groundbreaking_technology_converts_cancer_cells/,12,2024
1hn6llo,"Study: Lifeelong singles have lower scores on life satisfaction measures and different personality traits compared to partnered people, findings that point to the need for both helpful networks and ways to create such networks that are better catered to single people.",[removed],[deleted],1,1,2,1735272795,2024-12-26 22:13:15,science,https://www.reddit.com/r/science/comments/1hn6llo/study_lifeelong_singles_have_lower_scores_on_life/,12,2024
1hn5u2c,"The Risk of Cancer Fades as We Get Older, And We May Finally Know Why",[deleted],[deleted],1,1,1,1735270215,2024-12-26 21:30:15,science,https://www.reddit.com/r/science/comments/1hn5u2c/the_risk_of_cancer_fades_as_we_get_older_and_we/,12,2024
1hlv0o7,Verity - NASA Probe Makes Record-Setting Solar Fly-by,[removed],[deleted],1,1,0,1735106630,2024-12-25 00:03:50,science,https://www.reddit.com/r/science/comments/1hlv0o7/verity_nasa_probe_makes_recordsetting_solar_flyby/,12,2024
1hlerdt,https://www.science.org/doi/10.1126/sciadv.adp3743,[removed],[deleted],1,1,2,1735050898,2024-12-24 08:34:58,science,https://www.reddit.com/r/science/comments/1hlerdt/httpswwwscienceorgdoi101126sciadvadp3743/,12,2024
1hhiw5s,"Diarrheal diseases remain a leading killer for children under 5, adults 70+| Global study reports a 60% drop in global mortality from diarrheal diseases, but children and the elderly still have the highest death rates, particularly in sub-Saharan Africa and South Asia (eurekalert.org)",[deleted],[deleted],1,1,1,1734576252,2024-12-18 20:44:12,science,https://www.reddit.com/r/science/comments/1hhiw5s/diarrheal_diseases_remain_a_leading_killer_for/,12,2024
1hhivuj,"Diarrheal diseases remain a leading killer for children under 5, adults 70+| obal study reports a 60% drop in global mortality from diarrheal diseases, but children and the elderly still have the highest death rates, particularly in sub-Saharan Africa and South Asia",[deleted],[deleted],1,1,1,1734576224,2024-12-18 20:43:44,science,https://www.reddit.com/r/science/comments/1hhivuj/diarrheal_diseases_remain_a_leading_killer_for/,12,2024
1hf4cyi,"Im sorry, i really just need some advice or help for food, was refused ay food bank not ate for 4 days (read comment) ",[removed],[deleted],1,1,0,1734302201,2024-12-15 16:36:41,science,https://www.reddit.com/r/science/comments/1hf4cyi/im_sorry_i_really_just_need_some_advice_or_help/,12,2024
1hdthlz,Leaded Fuel May Have Triggered a Mental Health Crisis Among Generation X,[removed],[deleted],1,1,0,1734145338,2024-12-13 21:02:18,science,https://www.reddit.com/r/science/comments/1hdthlz/leaded_fuel_may_have_triggered_a_mental_health/,12,2024
1hcc9ov,IBS research,[removed],[deleted],1,1,0,1733974773,2024-12-11 21:39:33,science,https://www.reddit.com/r/science/comments/1hcc9ov/ibs_research/,12,2024
1hb1ktl,Cotton-and-squid-bone sponge can soak up can remove 98.0 to 99.9% of microplastics in four types of real water and maintain a high removal efficiency of up to 95.1 to 98.1% after five adsorption cycles.,[deleted],[deleted],1,1,1,1733836811,2024-12-10 07:20:11,science,https://www.reddit.com/r/science/comments/1hb1ktl/cottonandsquidbone_sponge_can_soak_up_can_remove/,12,2024
1havaju,A new study shows that people who believe they will succeed are far more passionate and have greater willpower than those who do not have the belief.,[deleted],[deleted],1,1,1,1733810811,2024-12-10 00:06:51,science,https://www.reddit.com/r/science/comments/1havaju/a_new_study_shows_that_people_who_believe_they/,12,2024
1h6uw95,"Early Americans ate tons of mammoth, 13,000-year-old bones from Clovis culture baby reveal",[removed],[deleted],1,1,0,1733355707,2024-12-04 17:41:47,science,https://www.reddit.com/r/science/comments/1h6uw95/early_americans_ate_tons_of_mammoth_13000yearold/,12,2024
1h6lzif,Study Suggests New Structure of Brain Neurons,[removed],[deleted],1,1,1,1733333903,2024-12-04 11:38:23,science,https://www.reddit.com/r/science/comments/1h6lzif/study_suggests_new_structure_of_brain_neurons/,12,2024
1h6d5yz,"Meta-analysis reveals increased alpha brain activity with 2G electromagnetic field (EMF) exposure during resting state but highlights a major gap: inconsistent methods across studies hinder conclusive evidence on mobile phone EMF effects. Calls for standardized, rigorous research protocols.",[deleted],[deleted],1,1,1,1733308823,2024-12-04 04:40:23,science,https://www.reddit.com/r/science/comments/1h6d5yz/metaanalysis_reveals_increased_alpha_brain/,12,2024
1h3qye1,Lingering Lyonization:The Genetics of Asperger's Syndrome?,[removed],[deleted],1,1,1,1733013806,2024-11-30 18:43:26,science,https://www.reddit.com/r/science/comments/1h3qye1/lingering_lyonizationthe_genetics_of_aspergers/,12,2024
