post_id,title,text,author,score,upvote_ratio,num_comments,created_utc,created_datetime,subreddit,permalink,month,year
1eq9acs,"Testosterone is protective against severe Covid-19, suggests a new study. The effect may arise because the hormone reduces inflammation in the lungs and other organs. The findings have public health and treatment implications.",[deleted],[deleted],21,0.9599999785423279,4,1723455057,2024-08-12 04:30:57,science,https://www.reddit.com/r/science/comments/1eq9acs/testosterone_is_protective_against_severe_covid19/,8,2024
1elfqpc,"1st-ever quantum, classical internet merger achieved via single optical fiber | This novel quantum experiment has the potential to advance telecommunications.",[deleted],[deleted],17,0.7799999713897705,1,1722945124,2024-08-06 06:52:04,science,https://www.reddit.com/r/science/comments/1elfqpc/1stever_quantum_classical_internet_merger/,8,2024
1eq7wsn,"Men's cancer numbers are on the rise and Australia tops the tables - A new study found that the number of men's cancer cases is expected to increase globally over the next 25 years, globally projected to increase from 10.3 million to 19 million, an 84% increase.",[deleted],[deleted],13,1.0,2,1723449328,2024-08-12 02:55:28,science,https://www.reddit.com/r/science/comments/1eq7wsn/mens_cancer_numbers_are_on_the_rise_and_australia/,8,2024
1elh05o,Study finds refined corn flour with added corn bran can lower cholesterol | Impacts to the gut microbiota were examined as part of the cross-over clinical trial,[deleted],[deleted],9,0.7400000095367432,1,1722948824,2024-08-06 07:53:44,science,https://www.reddit.com/r/science/comments/1elh05o/study_finds_refined_corn_flour_with_added_corn/,8,2024
1eqaaea,“Smoking weed it gets you over the hump”: Cannabis provided rapid relief from opioid withdrawal reducing frequency of opioid use. Low barrier access to cannabis due to legalization facilitated co-using to decrease opioid use.,[deleted],[deleted],2,1.0,1,1723458928,2024-08-12 05:35:28,science,https://www.reddit.com/r/science/comments/1eqaaea/smoking_weed_it_gets_you_over_the_hump_cannabis/,8,2024
1eq9s7k,"Timing sleep closely after practice sharpens motor skills - The timing of your sleep may be just as important as the practice itself. Motor memories, our brain’s way of holding on to skills and actions, can be significantly enhanced (by about 30%) when sleep closely follows practice.",[deleted],[deleted],2,1.0,1,1723457031,2024-08-12 05:03:51,science,https://www.reddit.com/r/science/comments/1eq9s7k/timing_sleep_closely_after_practice_sharpens/,8,2024
1f5al2o,Vast ‘doughnut’ discovered in molten metal of Earth’s core: Australian scientists hail finding as a step in unlocking secrets of planet’s protective magnetic field | Seismic low-velocity equatorial torus in the Earth’s outer core: Evidence from the late–coda correlation wavefield,[deleted],[deleted],1,1.0,1,1725064055,2024-08-30 19:27:35,science,https://www.reddit.com/r/science/comments/1f5al2o/vast_doughnut_discovered_in_molten_metal_of/,8,2024
1f4qpbs,Name,[removed],[deleted],1,1.0,0,1725008866,2024-08-30 04:07:46,science,https://www.reddit.com/r/science/comments/1f4qpbs/name/,8,2024
1f4005u,Study reveals extreme surge in suicidal ideation following Robin Williams’ death | These high-profile suicides had a measurable impact on public mental health and these tragic events led to significant spikes in suicidal thoughts and behaviors across the United States.,[deleted],[deleted],1,1.0,1,1724930911,2024-08-29 06:28:31,science,https://www.reddit.com/r/science/comments/1f4005u/study_reveals_extreme_surge_in_suicidal_ideation/,8,2024
1ezgezh,Reforming regulation with an eye toward equity | Science,[removed],[deleted],1,1.0,0,1724428803,2024-08-23 11:00:03,science,https://www.reddit.com/r/science/comments/1ezgezh/reforming_regulation_with_an_eye_toward_equity/,8,2024
1ezzet3,"Autistic people's feelings mostly misread—empathy works both ways, research reveals",[removed],[deleted],1,1.0,1,1724483434,2024-08-24 02:10:34,science,https://www.reddit.com/r/science/comments/1ezzet3/autistic_peoples_feelings_mostly_misreadempathy/,8,2024
1ezfdyv,Your Familiarity with the Concept of Colorism. I'm writing an essay for school and I would love it if you helped me fill out this super quick questionnaire. Here's the link,[removed],[deleted],1,1.0,0,1724426296,2024-08-23 10:18:16,science,https://www.reddit.com/r/science/comments/1ezfdyv/your_familiarity_with_the_concept_of_colorism_im/,8,2024
1evuewc,Approximately 4.4 billion people drink unsafe water — double the previous estimate — according to a study published today in Science. Almost half of the 4.4 billion live in South Asia and sub-Saharan Africa. ,[removed],[deleted],1,1.0,2,1724046808,2024-08-19 00:53:28,science,https://www.reddit.com/r/science/comments/1evuewc/approximately_44_billion_people_drink_unsafe/,8,2024
1f2myq4,Nice Genes! Podcast Season 4 Trailer Released,[removed],[deleted],1,1.0,1,1724779915,2024-08-27 12:31:55,science,https://www.reddit.com/r/science/comments/1f2myq4/nice_genes_podcast_season_4_trailer_released/,8,2024
1f2g6c2,Singing Amazing Grace reverses heart disease effects,[removed],[deleted],1,1.0,0,1724762821,2024-08-27 07:47:01,science,https://www.reddit.com/r/science/comments/1f2g6c2/singing_amazing_grace_reverses_heart_disease/,8,2024
1f3i1qr,"Researchers found in mice the neurological mechanism underlying anorexia nervosa, pointing to possible cure",[removed],[deleted],1,1.0,1,1724870883,2024-08-28 13:48:03,science,https://www.reddit.com/r/science/comments/1f3i1qr/researchers_found_in_mice_the_neurological/,8,2024
1f3hyhl,Researchers might have identified the neurological mechanism behind anorexia nervosa and a potential cure,[removed],[deleted],1,1.0,1,1724870668,2024-08-28 13:44:28,science,https://www.reddit.com/r/science/comments/1f3hyhl/researchers_might_have_identified_the/,8,2024
1eq9xni,MYT1L haploinsufficiency in human neurons and mice causes autism-associated phenotypes that can be reversed by genetic and pharmacologic intervention,[removed],[deleted],1,1.0,1,1723457610,2024-08-12 05:13:30,science,https://www.reddit.com/r/science/comments/1eq9xni/myt1l_haploinsufficiency_in_human_neurons_and/,8,2024
1eqrwgd,"Study of Nearly 10 Million People Finds Marijuana Linked to Improved Outcomes for Heart Attack Patients, Reduced In-Hospital Mortality - NewsBreak",[removed],[deleted],1,1.0,0,1723503090,2024-08-12 17:51:30,science,https://www.reddit.com/r/science/comments/1eqrwgd/study_of_nearly_10_million_people_finds_marijuana/,8,2024
1et4vir,Widespread global exacerbation of extreme drought induced by urbanization,[removed],[deleted],1,1.0,0,1723751975,2024-08-15 14:59:35,science,https://www.reddit.com/r/science/comments/1et4vir/widespread_global_exacerbation_of_extreme_drought/,8,2024
1es3d0v,"Researchers from The Pennsylvania State University have found that early life exposure to “forever chemicals” permanently disrupts the gut microbiome in mice, potentially increasing the risk of developing metabolic disease later in life.",[deleted],[deleted],1,1.0,1,1723646482,2024-08-14 09:41:22,science,https://www.reddit.com/r/science/comments/1es3d0v/researchers_from_the_pennsylvania_state/,8,2024
1eq970b,"Gluten reaction trigger identified, could lead to new celiac treatments - In studies in mice and lab-grown mini-intestines (called organoids), scientists identified how and where the gluten response begins, with certain cells playing a bigger role than thought.",[deleted],[deleted],1,1.0,1,1723454680,2024-08-12 04:24:40,science,https://www.reddit.com/r/science/comments/1eq970b/gluten_reaction_trigger_identified_could_lead_to/,8,2024
1eq8itb,"Horses can plan ahead and think strategically, scientists find | Team hopes findings will help improve equine welfare after showing cognitive abilities include being ‘goal-directed’",[removed],[deleted],1,0.6700000166893005,2,1723451886,2024-08-12 03:38:06,science,https://www.reddit.com/r/science/comments/1eq8itb/horses_can_plan_ahead_and_think_strategically/,8,2024
1eq98o6,"Weight loss surgery may reduce the risk of developing heart failure for people living with obesity by improving blood flow through their heart muscle. Six months after their surgery, patients had lost an average of 29 kg, and 13 of the 17 patients with type 2 diabetes before surgery were in remissio",[deleted],[deleted],1,1.0,1,1723454869,2024-08-12 04:27:49,science,https://www.reddit.com/r/science/comments/1eq98o6/weight_loss_surgery_may_reduce_the_risk_of/,8,2024
1eq9qcm,Sleep's secret power: Timing bedtime closely after practice sharpens motor skills,[deleted],[deleted],1,1.0,1,1723456847,2024-08-12 05:00:47,science,https://www.reddit.com/r/science/comments/1eq9qcm/sleeps_secret_power_timing_bedtime_closely_after/,8,2024
1eplv3l,"Dirty campaigning increases distrust in politicians and decreases trust in democracy, study finds | Research found that perceived dirty campaigning increases anger, frustration, and disgust towards campaigns.",[deleted],[deleted],1,1.0,1,1723385928,2024-08-11 09:18:48,science,https://www.reddit.com/r/science/comments/1eplv3l/dirty_campaigning_increases_distrust_in/,8,2024
1eq816j,Data reveal how doctors take women’s pain less seriously than men’s,[removed],[deleted],1,1.0,2,1723449812,2024-08-12 03:03:32,science,https://www.reddit.com/r/science/comments/1eq816j/data_reveal_how_doctors_take_womens_pain_less/,8,2024
1enr1c4,"Study of Nearly 10 Million People Finds Marijuana Linked to Improved Outcomes for Heart Attack Patients, Reduced In-Hospital Mortality - NewsBreak",[removed],[deleted],1,1.0,0,1723178746,2024-08-08 23:45:46,science,https://www.reddit.com/r/science/comments/1enr1c4/study_of_nearly_10_million_people_finds_marijuana/,8,2024
1elnk9r,Dozing at the wheel? Not with these fatigue-detecting earbuds,[removed],[deleted],1,1.0,1,1722964836,2024-08-06 12:20:36,science,https://www.reddit.com/r/science/comments/1elnk9r/dozing_at_the_wheel_not_with_these/,8,2024
1elikpv,New gut microbiome discovery: Sodium valerate could be key to reducing alcohol abuse,[deleted],[deleted],1,1.0,1,1722952902,2024-08-06 09:01:42,science,https://www.reddit.com/r/science/comments/1elikpv/new_gut_microbiome_discovery_sodium_valerate/,8,2024
1ellopo,"NHS soup and shake diet can beat type 2 diabetes | Sticking to it may be challenging though, results suggest. Dieters must endure a few months of consuming only shakes, soups and meal-replacement bars, before healthy solid foods can be gradually reintroduced.",[removed],[deleted],1,1.0,2,1722960380,2024-08-06 11:06:20,science,https://www.reddit.com/r/science/comments/1ellopo/nhs_soup_and_shake_diet_can_beat_type_2_diabetes/,8,2024
1ekwijn,"Association between osteoporosis and the rate of telomere shortening | Aging
",[deleted],[deleted],1,1.0,1,1722885593,2024-08-05 14:19:53,science,https://www.reddit.com/r/science/comments/1ekwijn/association_between_osteoporosis_and_the_rate_of/,8,2024
1ehj9m9,"Cancer rates in millennials, Gen X-ers have risen starkly in recent years, study finds. Experts have 1 prime suspect.",[removed],[deleted],1,1.0,0,1722525498,2024-08-01 10:18:18,science,https://www.reddit.com/r/science/comments/1ehj9m9/cancer_rates_in_millennials_gen_xers_have_risen/,8,2024
