id,title,selftext,author,score,num_comments,upvote_ratio,popularity,created_utc,permalink,year,month
1jmw567,AITA for not consulting my sister-in-law to schedule my wedding in 15 months?,"AITA for not having my wedding based on my SIL's schedule?

I (26F) am a Canadian living in Germany, with my German fiancé (27M). We have been together for 6 years and we are planning our wedding to be in summer 2026.

My MIL & FIL are both doctors and my SIL (25F) is in med school. My family is from a regular middle class background, we are not doctors, we don't have fancy cars or expensive hobbies. My fiancé and I grew up very differently. My SIL has never had a full-time job, she drives a luxury German car, has her [second] horse, has all the latest Apple products, and her rent completely paid for by her parents.

My in-laws are completely estranged from their families — MIL doesn't talk to her siblings or parents, they ""kicked her out of the family"". My FIL also doesn't talk to his mom or his brother, claiming them to be toxic. Therefore, my fiancé has no ""real"" family in Germany except for his immediate family: mom, dad, sister, and by extension, the sister's boyfriend.

I have a big immigrant family in Canada and a lot of friends. Our international friends have all expressed enthusiasm to travel to Canada for the wedding. I moved to Germany to be with my partner. My partner and I are planning the wedding over 16 months in advance to (1) save up enough to pay for it ourselves and (2) ensure that all the people important to us can come. We know it is a big ask for our non-Canadian guests (mainly friends, as no family aside from the immediate were gonna be invited). Last week, we signed a venue contract to secure our date in July 2026. We mentioned to both our families that July was our target month as it's a beautiful time in Canada and after the FIFA World Cup.

After signing, we made a Save-the-Date graphic and sent it to our immediate families + closest friends (max. 10 people so far). My family was thrilled, my MIL's first response was: ""Why didn't you consult us and your sister first? That's during her exam season."" A few days later, my in-laws decided to cancel their stay with us (we live in different German cities) and said they are offended by our actions for not consulting them on the date and have now decided not to go to our wedding in Canada, to be in solidarity with their daughter, who may have an exam on that date. My SIL's exam schedule is not released until mid 2026. 

My partner and I are paying for this wedding ourselves. My in-laws are also threatening to ""kick my fiancé out of the family"" because we are ""selfish.""

My in-laws will be in town next week and want to set up an ""appointment"" to discuss this and how the ""family will move forward."" 

Are we the assholes in this? Should we change the date because my SIL *might* have an exam during this time? BTW the wedding date is on a Saturday and money is no issue to my in-laws. My partner and I are completely financially independent from both of our parents. 

This wedding is taking place 15 months in the future.",According-Top-8621,1149,429,0.9300000071525574,0.1328892503149116,1743282056,/r/AmItheAsshole/comments/1jmw567/aita_for_not_consulting_my_sisterinlaw_to/,2025,3
1jm9f4c,AITA for telling my family that I’m not taking my grandma to church anymore?,"I already do a lot for my family, which consists of my mom(60sf), grandma (80sf), and disabled brother (20sm).

Basically, I told my family I wasn't going to drive Grandma to church on Sundays anymore. Reason being is because Grandma tries to use it as a matchmaking service for me. I really don't like the guys she tries to set me up with. 

I told her to stop it and that I wasn't going to take her if she keeps trying to set me up with her friends' relatives. Problem is that Grandma insists I stay with her, and I just want a day off to myself.

After last week, I told Grandma I had enough and that was the last time I take her. She and my mom are upset because she doesn't have another way to get to church. Mom can't drive and we don't have reliable public transportation.

So far, I've been holding my ground but Grandma is upset. Sunday is coming up and she's sad she won't get to attend. I told mom she needs to figure something out because I'm sick of being the unpaid chauffeur. 

AITA? ",No_Remote9777,2353,150,0.9700000286102295,0.12995864310917238,1743206263,/r/AmItheAsshole/comments/1jm9f4c/aita_for_telling_my_family_that_im_not_taking_my/,2025,3
1j3lg3q,AITA for crashing out cause I’m not invited on the family holiday,"Hi guys (23F). My family recently booked a holiday and asked if I wanted to come I said I couldn’t afford it and that was that. Recently was talking to my mum and she said that both of my younger siblings are bringing a friend that she is fully paying for. My brother is 20 like he lives at home and she is paying for him and a friend. And my sister (15) and her friend to go on an all inclusive holiday to Spain. 

It was the same last year they all went on holiday without me but last year they didn’t bring anyone else. I was fine with it until I heard my mums paying for other kids to do but wouldn’t bring me so I’m annoyed with her. I do so much for her as well like way more than my other siblings. I live 10 mins down the road so always picking up/ dropping to school or doing things around the house for her but I’m butt hurt that she clearly had this extra money to spend to bring other peoples kids on holiday but not me. 

Am I the asshole? 

EDIT: I initially asked a few weeks ago for her to tell me how much it would be if I booked on cause I would have went if it was affordable. She got back to me saying it’s 900 and I just said I couldn’t afford that anyways and that was it. Until I found out she’s paying for 2 of my siblings friends. She said in convo who was going and I just said “what you could have paid for me to go but instead ur paying for 2 other children “ and she ignored that comment. ",ApartContribution573,1773,261,0.949999988079071,0.12680326365694322,1741122086,/r/AmItheAsshole/comments/1j3lg3q/aita_for_crashing_out_cause_im_not_invited_on_the/,2025,3
1jdnuz7,AITA for not giving my (soon to be ex husband) 50% of the home we started our relationship in…,[removed],LittleJokeyJokes,2010,203,0.9399999976158142,0.1256251885210828,1742245662,/r/AmItheAsshole/comments/1jdnuz7/aita_for_not_giving_my_soon_to_be_ex_husband_50/,2025,3
1jdp3hi,AITA for Not Inviting My In-Laws to Stay in Our Home?,"Several years ago, I was a full-time caretaker for my husband, who was awaiting back surgery, and my mother, who was in palliative care with dementia. In addition, I worked full-time. It was a lot, so I used the services of someone who cleaned every few weeks.  After my husband's surgery, his sisters decided to visit, and I welcomed them into our home. After their visit, I learned that they'd entered parts of our home that were not open to visitors, looked through things, and commented about its cleanliness. Granted, the private spaces were not as tidy as the public parts of our home, but I was doing the best I could. This was especially hurtful to my husband because there is shame associated with this topic in their family. Fast forward, and we have a family event coming up. My husband has suggested that the family stay with us, and, based on the last experience, I said no. I'm in school and have a full-time job, and he may say he's going to clean, but he won't and will become angry with me because it's not done. I suggested they stay at a hotel (even if we pay) because I don't want the stress associated with the visit because our standards don't align. He's pretty upset, but AITA?",Clean-Beach2891,2531,78,0.9800000190734863,0.1235237233427431,1742248770,/r/AmItheAsshole/comments/1jdp3hi/aita_for_not_inviting_my_inlaws_to_stay_in_our/,2025,3
1jbglie,AITA for refusing to be the main caretaker for my elderly parents?,"My parents are both in their 80s and live about two hours from me. For reference, I have a sibling that lives right down the road from them. Neither of them have aged well- they always refused to be active and have lived very sedentary lives in their retirement so aging has been hard on them. My father especially has struggled with type 2 diabetes and dementia/alzheimers. He is very combative and mean about everything, which is how he has always been, but dementia and old age has made it worse. He directs a lot of his anger towards me and is especially mad that I am trying to get them to move into assisted living because they fall constantly and need so much help. Anytime he disagrees with me about anything he starts screaming and calling me names including “ fat-a** and “the thing.” “The thing” hurts especially hard because I am his daughter and he is reducing me to something that is hardly human. He will say “ don’t look at the thing over there, she’s so ugly she might break your face” or just ridiculous stuff. He does this when he is completely lucid and remembering everything/everyone. Or he will say “ don’t feed the thing,” when my mom tries to offer me food. I tried so hard to ignore this treatment, but once he did it in front of my kids I put my foot down and stopped visiting. My mother now wants me to come to her 3+ times a week to help with cooking,cleaning, helping dress my father, etc. i have said no because the way he treats me is terrible and I have to look out for my own well being. She says I just need to ignore it because he is old and grumpy. She says I take things too personally and I am obligated to help them because they raised me. AITA for saying they need either a full time nurse or assisted living?",Tiffer82,2019,182,0.9800000190734863,0.12191193697959413,1741992315,/r/AmItheAsshole/comments/1jbglie/aita_for_refusing_to_be_the_main_caretaker_for_my/,2025,3
1j4h4ba,"AITA for allegedly ""emotionally manipulating"" my husband into changing his entire life plan?",[removed],AppointmentFew6206,1118,359,0.9100000262260437,0.11790156118003925,1741216432,/r/AmItheAsshole/comments/1j4h4ba/aita_for_allegedly_emotionally_manipulating_my/,2025,3
1jhkcwh,WIBTA if i don't pay entry for all the children coming to celebrate my sons 1st birthday,"Hi everyone, just looking for some perspective here on whether I'm the asshole or not.

So for context my son is turning one in June, which here in Australia is the middle of winter. We've been starting to organise his first birthday party. Unfortunately our house is not very big and we're unable to host his party here. We discussed holding it at a park in town, however we were worried about the weather. It tends to rain a lot where we are in winter.

Finally we settled on the children's indoor playground. We thought it was convenient and this way we didn't have to worry about the weather or supervision. 

Here's where I maybe the asshole. When talking to my friends about his party, I mentioned I'd be supplying all the food and drink; however I wouldn't be paying entry for all the children invited. My friend was surprised and said since the party was at an indoor playground, it was implied I'd be paying entry for all the children.
Now entry is not expensive, it's $6 per child. The issue is me and my husband both come from very big families and including the few friends my son has, we will be looking at between 20-30 children. Meaning it would cost us roughly $200 in entry fees for all the children. Plus the cost of food. 

My friend pointed out that $200 isn't a great deal of money and I agreed, however I've only recently returned to work from maternity leave and money is still tight. Also I felt as it was his first birthday and not an actual party package party (they host actual parties here for older children) it wasn't unreasonable that each family pays for their own child's entry.

My family and husband agree that it's fair everyone pays for their own children's entry, while we supply all food and drink

However now my friend has me second guessing.

So what do you think, AITA?",Tskye93,409,502,0.7599999904632568,0.11547140542279329,1742682253,/r/AmItheAsshole/comments/1jhkcwh/wibta_if_i_dont_pay_entry_for_all_the_children/,2025,3
1jbhr1h,AITA for mistaking my girlfriends weight accidentally,"So I (21m) was driving with my girlfriend (20f) earlier tonight and we were talking about ideal protein intake based on your body weight (about 1.5 grams for kilogram of body weight)

She was saying how that would mean she needed like 150 grams per day, which by my mediocre on the spot math at the time meant that she was about 250 pounds. Which I didn’t believe for a second. My girlfriend is about 5’7 and looks to be a completely normal weight. 

That being said I remembered a few months ago that my girlfriend say that she stepped on the scale and told me that her weight in pounds started with a 2, which again I didn’t believe, as I assumed she was around the same weight as me, if not maybe a bit heavier (I’m 5’4 150lbs and she’s a bit taller than me so I figured it was around 160-170 for her at most) but she seemed pretty adamant that she was over 200 pounds, so I believed her even though it didn’t seem to add up to me.

Flash forward back to tonight. When she said she was 250 pounds, which I knew was an over exaggeration, I said “you’re obviously not 250 pounds, at most you’re like 190 (which again, I didn’t really believe but I was going off the number she’d given me a few months ago, minus a few pounds as I think she has lost a little weight since then).

What you need to know about my girlfriend is that she is VERY self conscious about her weight. Even though I think she has an incredibly attractive body, she always says how she’s “huge” and sometimes refuses to eat meals because of her fear of being overweight (I wouldn’t say she has an eating disorder, but she definitely does not have a healthy attitude towards her body and eating)

When I said that guess of 190, she got incredibly upset at me and started crying and asking for me to bring her home, and said that she couldn’t believe that I thought she was that heavy. I apologized and told her I was only going off the number she had given me a few months before, which she said she had been a joke (from my recollection there was nothing about her tone at that time that suggested it was a joke, even if I didn’t fully believe her.)

I apologized again, and told her that I didn’t really think she looked 190, and that I when she told me she was over 200 I didn’t really believe it but went along with it because a) I’ll be honest, I’m not that confident in myself when guessing peoples weight, and b) it is incredibly hard to know when my girlfriend is joking.

She rebuffed me and said that I should be good at guessing weights as I used to work at a gym, and she said that “it’s no wonder [I] got fired” (for the record, I wasn’t fired, I just got my shifts cut down for reasons out of my control).

I reassured her that she looks beautiful and doesn’t look overweight at all, and she seems to have calmed down now that we’ve gotten home. Still I just want to make sure that I wasn’t being a complete asshole to her, because I care a lot about her and try my best to support and reassure her about her body.

",SkimBeans,877,388,0.8399999737739563,0.11324883580402426,1741995537,/r/AmItheAsshole/comments/1jbhr1h/aita_for_mistaking_my_girlfriends_weight/,2025,3
1jg2rbt,AITA for not letting my dad's gf walk through the front door that's in my room when she was upset?,"I (23m) live with my dad, his gf (when my dad hasn't kicked her out after one of their spats), and my youngest brother for the past 3 or 4 years. We recently moved into a new house around August of 2023 and my new room is like a mudroom but we only use it as a bedroom for me, but it has the front door which is fine bc my family only uses the back door really, and I can just grab whatever food or packages are delivered and distribute them.

Anyways, my dad's gf, let's call her Stacy (34f), and my dad always get into arguments when he's drunk. We have a small house so she has no where to go but outside when they argue or their closet. Well sometimes my dad is on the back porch drinking with my uncles and even though they will ignore her when she walks through them to go around the house to sit on the front steps, she would rather go through the front door.

Well since the front door is in my room, Stacy needs to ask since yknow, privacy and things and bc I would have to move a bunch of things and leave the door and screen door unlocked and open for her, and she always does ask.

I normally let her, but a few months ago, when this incident happens, she asks me and I said no, bc I just didn't want to have to move all my stuff and I was stressed and wanted to have personal convos with my friends without worrying she's snooping (she likes to eavesdrop and had stolen my sister's gf's things when my sis and her gf lived with us). Also, I have anxiety of leaving the front door unlocked and open (PTSD things) which increased with my stressed state. Anyways, when I said no, she cursed me out and said I was being inconsiderate before storming out of my room and almost slamming the door.

My friends said I wasn't an asshole and that it was my room so I have the right to say no and it's just my people pleasing personality making me feel guilty. Yet Stacy didn't talk to me for almost a month after, and our relationship is still strained. I'm internally torn. So tell me, Reddit, am I the Asshole?",Sbi_technosupport,2059,124,0.9700000286102295,0.11230425123183808,1742512806,/r/AmItheAsshole/comments/1jg2rbt/aita_for_not_letting_my_dads_gf_walk_through_the/,2025,3
1j1cv51,AITA for telling a family member off for purposely triggering my OCD?,"

Hello I am 23F and I had a disagreement with a family member 60M over an incident. I am living with them and overall we have a very good and supportive relationship, but something that happened today really upset me. I was diagnosed with OCD as a child and have been in therapy/on medication for it since. It’s something I’ve spent a lot of time working on and I’m very proud of the progress I have made. 



My OCD is about contamination/germs. My FM has known about my diagnosis since I got it and I have spent a lot of time talking to him about it. I even bought a book about living with someone with OCD as I know it can be difficult. He has been a huge supporter of my recovery even though he doesn’t fully understand it. 



However, today as I was making coffee I saw that he came out of the bathroom without washing his hands. I playfully gave him a hard time and encouraged him to wash his hands. He did and we both joked about it and it felt like it ended fine. 



Later, when I was making lunch he came out of the bathroom again without washing his hands. I could hear him approaching me and I asked if he washed his hands. He laughed and said no before wiping his hands on the sides of my sweatshirt and pants. I was so shocked I ran out of the room to go change. 



After, I came back down and said that I thought it was a mean thing to do and that it was very upsetting and that not washing your hands after using the restroom is inconsiderate as well as an immature habit to have at his age. He begrudgingly apologized, but acted like I was lecturing him for no reason. To be clear, I never raised my voice- I was definitely a bit stern but I felt it was necessary. 



While I don’t expect him to keep track of all my triggers I feel like that is something that would upset anyone- OCD or no OCD. Especially within hours of our first conversation about the importance of washing hands after using the restroom. 



AITA for lecturing him about doing something he knew would be upsetting? 


Edit for spelling and capitalization ",asknat770,1227,300,0.9100000262260437,0.11105121861030023,1740871593,/r/AmItheAsshole/comments/1j1cv51/aita_for_telling_a_family_member_off_for/,2025,3
