id,title,selftext,author,score,num_comments,upvote_ratio,popularity,created_utc,permalink,year,month
1jc77j4,AITA for calling out my husband's friend after he made inappropriate comments about my son's paternity?,"I (23 F) have been married to my husband, Alex (27 M), for 2 years, and we have a 10 month old son, Dylan.

Alex has a friend named Mike (27 M). They’ve been best friends since high school. From my first encounter, I did not like Mike. He is really childish, likes to be the center of attention, and has a crude sense of humor. It’s like he never got out of his frat boy phase. All of my husband’s friends are married or in long-term relationships, whereas Mike has never been in a long-term relationship or has brought any woman around. He has also made some weird comments toward me that made me uncomfortable. My husband has a deep bond with Mike, and they often go on hunting trips or have boys' nights. I’ve never tried to keep my husband from hanging out with his friend, but I have limited my contact with Mike as much as possible since we’ve been together.

Mike came over to pick up my husband to go golfing. I was holding our baby when I answered the door. Mike greeted us at the door, asked to hold my baby, and was cooing at him. Then he said, “Hey there, man…come to poppa,” and my husband and Mike started laughing. A bit of background: I have brown hair and blue eyes, and my husband has black hair and brown eyes. Our son’s hair is coming in blonde, and he has blue eyes. Mike has blondish hair and blue eyes. I was a bit caught off guard by it but ignored his comment. Mike then said, “He looks like me. Maybe he's mine,” and my husband and Mike continued to laugh. I was obviously not amused. I told Mike to hand me my son and then told him, “Not in a million years, and no woman with sense would want you.” Neither my husband nor Mike laughed at my comment, and Mike just made a face before he and my husband left.

Later, my husband told me I “took it too far” with Mike, that Mike was just joking, but I made it personal. I told him those comments were disrespectful to me as his wife and the mother of this child. He then said it’s obviously not true, so why am I so upset when I know how Mike is. ",Bellanella10,9099,1982,0.949999988079071,0.7761524963949258,1742078724,/r/AmItheAsshole/comments/1jc77j4/aita_for_calling_out_my_husbands_friend_after_he/,2025,3
1jhkq9l,AITA for agreeing with my daughter it is weird her friend's mom has access to their conversations?,"My daughter is 14 years old and has a friend ""Chloe"". She and Chloe have been friends for a little over a year now. Chloe's mom ""Gina"" is someone I'd consider pretty strict. I was aware she'd check Chloe's phone (and I know a lot of parents do this), but I found out a few months ago through my daughter that she'd respond through Chloe's phone to Chloe's friends, including my daughter. It was never anything overkill, just ""Chloe can't talk right now, she's busy with homework"" or whatever. I thought this was odd but didn't say anything to Gina about it because that's her life and her business. 

I got a call from Gina earlier this afternoon. She was very pissed off and told me that my daughter was rude, I needed to start monitoring what she says, etc. I asked her what exactly happened and she said my daughter gave her an attitude via text. I was still very confused and asked why they were texting. Gina became exasperated and snapped ""Through Chloe's phone!!"" I told her I'd call her back and asked my daughter specifically what happened. My daughter willingly showed me her texts. She had texted Chloe something. Gina had responded (using Chloe's phone) saying Chloe was busy. My daughter replied asking when Chloe would be available to talk. Gina told her ""When she's ready, stop texting her"". My daughter replied ""You don't have to be so rude"". Gina said she wasn't being rude. My daughter said yes, Gina was, and also called her a weirdo for using Chloe's phone. 

I told my daughter next time, just don't engage. I did also say it wasn't kind to call someone a weirdo and not to do it again, but that I also understood her frustration. I didn't punish her, she seemed receptive to the talk and I left it at that. I called Gina back and told her I had spoken to my daughter and handled the problem. Gina started ranting that I need to monitor my daughter's phone and have I seen some of the things she talks about? She started on crushes, rants about teachers, saying there were times my daughter badmouthed me when frustrated. I said that's all fine, I'd rather her have a safe space to vent with her friends, after all, she's a teenager. Gina kept pressing on the issue and what would be done. I told her nothing, I spoke with my daughter and handled it. Gina said ""But she insulted an adult!"" I told her I handled it, but my daughter also didn't say anything that wasn't true, Gina \*was\* acting like a weirdo.

Now, Gina is angry with me, My daughter doesn't care that I said all of this. However, my husband thinks that I shouldn't have said it, as it didn't solve anything, and Gina can parent how she wants. I said I never commented on Gina's parenting, until she tried to undermine/insult mine. AITA?",Immediate-Phrase-999,11685,862,0.9800000190734863,0.6682279469164715,1742683315,/r/AmItheAsshole/comments/1jhkq9l/aita_for_agreeing_with_my_daughter_it_is_weird/,2025,3
1j59byb,AITA for feeding my family a fish dinner while I eat steak and potatoes,"So apparently we don’t get many characters so I’ll try my best to make this short and simple and straight to the point. 

I am three months pregnant and almost everyday I’ve been craving steak and sour cream baked potatoes. I never really cared for steak I’m more of a chicken fingers and fries girlie but I’m guessing the baby must’ve loved steak in its past life because that literally all I crave when I don’t even care for it. 
Today I made my family baked pizza spaghetti with fried catfish a lunch eat salad (salad with chopped deli meat) and dinner rolls. I of course am making the same dish I’ve been eating for almost everyday these last few months. I pretty much make 2 separate meals each night for my cravings. 

Last night after I served the kids and was getting ready to make my finances plate he expressed he wanted steak and potatoes like me. Mind you he was aware of the menu because I have my meals planned night before . I told him I only had that one steak for me. He said “ well we can share” I politely told him that I will need to eat all of my food since I am feeding for two and this is all I have for the night knowing I’ll most likely still be hungry whilst you guys have a meal you can come back for seconds. I am now, in his words a “selfish woman using pregnancy as an excuse to be selfish”. I asked what’s different about today than all the other days when I’ve been literally eating the same shit almost everyday with no complaints? He said nothing but shook his head and said “ it’s the principle bae” and just walked off. We’ve barely spoken since. Just a dry good morning and goodbyes. AITA? 

Maybe if he expressed that he wanted the same thing as me I would have prepared for it but he literally always eats what I make. I didn’t know I had to be a mind reader.",readywhipped_velvet,8095,1305,0.9200000166893005,0.6010680940656319,1741303489,/r/AmItheAsshole/comments/1j59byb/aita_for_feeding_my_family_a_fish_dinner_while_i/,2025,3
1j2ulw6,AITA for telling a lady to get her dog out of the restaurant because it freaked my 3 year old daughter out.,[removed],DangerousGain9879,1922,2562,0.7400000095367432,0.582242190842961,1741038898,/r/AmItheAsshole/comments/1j2ulw6/aita_for_telling_a_lady_to_get_her_dog_out_of_the/,2025,3
1j6u713,AITA for telling my client my birthday and she shamed my coworkers for forgetting my birthday?,"I was hired last May into a company that is all about celebrating everyone. I was asked and paid into collections for my bosses birthday, 3 coworkers birthdays were everyone got flowers and cake and cards and balloons and free lunch. I sung happy birthday and participated in pictures, etc. I also participated in collections for coworkers when family died and my boss for the Christmas party. My birthday was last week. I had mentioned I was excited for my birthday the week before. Nothing. No one said a thing. Noone wished me happy birthday, or a card or anything. It hurt, but I ignored it. So, my client knew there was someone on the staff with a birthday near hers and she was trying to figure out who the Pisces on staff was. Every day for 2 weeks. The day after my birthday I told her. She had lots to say to the staff about not celebrating my birthday in our usual fashion. It hurts I was forgotten, but I don't think I did anything wrong. Somehow, my coworkers are blaming me for not giving them time to celebrate my birthday. (It literally is in our computer email system...wish your team member a happy birthday!) AITA?",AnyWinter7757,8948,241,0.9800000190734863,0.42991760689208025,1741476929,/r/AmItheAsshole/comments/1j6u713/aita_for_telling_my_client_my_birthday_and_she/,2025,3
1jamw4y,WIBTA for not going to my sister’s wedding because her venue is not wheelchair accessible?,"My (24F) sister (30F) is getting married soon. I’m very happy for her and there are no issues between the two of us.

She really wanted to get married in a specific location and she got it, which is great, but that location is pretty much not accessible to wheelchairs. I have a significant disability (paraplegia) and cannot move at all without a wheelchair, so going there would be tough.

She told me that I could be carried up any stairs and then stay at the tables, but that’s not something I’m comfortable with. Getting carried is very uncomfortable and dangerous, especially when done repeatedly by someone that isn’t used to it, and I really don’t want to have to be carried to the toilets at a wedding full of strangers… or even worse, have an accident.

Then I also wouldn’t expect people to just sit with me while the celebrations are going on, but the idea of sitting there and watch for hours feels wrong, especially that after a few hours sitting hurts a lot and skin becomes a concern, but I wouldn’t ask someone to leave the wedding just for me.

I’m not upset about the fact that they picked that venue, it’s their day and I don’t expect them to plan it based on my needs, but I also don’t think she understands that it’s not as easy as she thinks. There are so many things that could go very wrong.

I intend to get them a nice gift and propose to maybe spend quality time together afterwards/before. One of my cousins told me that it’s just one day and that it’s very important for my sister, so I should make an effort and “get out of my comfort zone”, but I feel like endangering my health isn’t as simple as getting out of my comfort zone…

So, WIBTA for not going?",Ataleiia,6034,766,0.9800000190734863,0.4076868500720013,1741900295,/r/AmItheAsshole/comments/1jamw4y/wibta_for_not_going_to_my_sisters_wedding_because/,2025,3
1j2uxz0,AITAH for wanting a drink immediately ?,"Just had fight with my wife.  She was washing dishes and I was super thirsty and she was using the tap and instead of just stepping aside for 20 seconds max so I can have a glass of water, she made me 'wait my turn' for three minutes.

It doesn't sound a long time but standing there with a glass, super thirsty. She calls me impatient and I just simply and will never understand how you would just not stop washing dishes for 10 seconds to allow your spouse a glass of water.

But of course I had to apologise.  

Quite sad about it, as I just never want to argue, but that triggered me.  

Was I right to get annoyed or should I just have let her have the sink till it was free? Thoughts please. ",Skiingscottishlawyer,2103,1509,0.7900000214576721,0.38448365014896296,1741039749,/r/AmItheAsshole/comments/1j2uxz0/aitah_for_wanting_a_drink_immediately/,2025,3
1jf933s,AITA after telling my Aunt they can't respect my decisions then my kid can't come over anymore?,"I(33F) have an Aunt(53F) who sometimes picks up daughter (6F) for over nights at her place. My daughter recently returned from one of those trips. During so I got a phone call about my daughter's toes being red and maybe the shoes being too small. My aunt was wanting to throw them out but I was going to pass them on to my younger niece(2F) as my kid hasn't worn those shoes much. My aunt's boyfriend said he was worried I would put them back in her, which I said I wouldn't if they were small but wanted them back to pass down to my niece. Turns out she decided to go to my mom (53F) for permission to pitch the shoes. My mom gave the blessing since she didn't know why I wanted them back. When my daughter was dropped off, my aunt dropped he and her stuff off quickly then bolted which was weird for her. As I was emptying my daughter's luggage I noticed said shoes were not in there. Daughter sad that they told her they were keeping the shoes for safe keeping but I found out the truth shortly after. I tried calling my Aunt but she is not answering. It's not just about the shoes but this has happened multiple times with other things because my mom said it was ok and her being my mom negates my decisions for MY daughter. AITA for saying if my decision can't be respected and if MY daughter can't return with everything she brought them she can't come over anymore?",Somebodyoutthere91,6191,313,0.9700000286102295,0.32599737047536875,1742421631,/r/AmItheAsshole/comments/1jf933s/aita_after_telling_my_aunt_they_cant_respect_my/,2025,3
1j606lg,AITA for leaning on a nearby wall after being denied use of gym equipment by a woman doing supersets?,"So my apartment building has a small exercise area including a cable crossover machine, an adjustable bench, dumbbells, some treadmills, and a small side room for yoga or other bodyweight/kettlebell exercises.


The gym was empty this morning except for one woman doing row exercises on the cable crossover machine. I noticed that she had placed her phone next to the bench with a couple of dumbbells. For context, I’m a tall-ish guy and she’s shortish and appears nonbinary (which is fine by me, I’ll refer to her as “she” here because I don’t know her pronouns or how she personally identifies). I specify this because it seems like that plays into the dynamic from her perspective.


“Can I use this bench?” I ask.


“No,” she replies. “I’m doing supersets.”


I was a bit taken aback. There is room for two, maybe three people in the resistance/weight training area, and she was using every piece of equipment.


Not sure what to do, I lean on a nearby wall and start looking at my phone. I’m a bit miffed and I look up every so often to see when she’ll be done. She takes her earphone out and says something to the effect of, “Are you just going to stand there?” and we get in a big argument.


I say something to the effect of “What else am I supposed to do? You won’t let me work in.”


“I don’t want you up in my space. Go do something else,” she says.


“So I can’t do pullups on the cable crossover while you’re using the bench?” I reply.


“No. I don’t want you up in my space,” she says.


“That’s just bad etiquette,” I reply.


It then continues like this for a bit. I accuse her of being rude, she accuses me (verbatim) of using my “male privilege.” Eventually she finishes her sets and leaves.

In every gym I’ve worked out at it would be considered rude to bogart multiple pieces of equipment while others have to wait. I lived abroad for years before this - is this still the case in US gym culture? AITA for leaning on a nearby wall and waiting, rather than going and stretching or running on the treadmill?

",tripping_on_phonics,5705,356,0.9599999785423279,0.3135933596486218,1741381214,/r/AmItheAsshole/comments/1j606lg/aita_for_leaning_on_a_nearby_wall_after_being/,2025,3
1jg2tqy,AITA for not loving my sister's children the way she and her husband do?,"TL;DR - On a recent visit to see my sister and her threr children, told me she was hurt and disappointed that I don't love her children in the same manner that she and her husband do. I told her this was an unreasonable expectation...AITA?

The past two years I (43f) have traveled to spend a week with my sister (40f) and her family. She and her husband and have three young boys - a 3.5 year old and twin 2.5 year olds. It's about a 6 hour flight, so it's not a trip I can make on a regular basis.

When I visited last February, it was a great trip. Good mix of sister time, hanging out with the kids and her husband, a night out, a house party, just all around enjoyable. Her husband is great and is a stay at home Dad. My sister works from home and is a successful business woman. I was genuinely excited to go visit again last month.

I'm not a kid person and I never have been. My partner and I are intentionally childless and we love our quiet, low key life. I'm good with kids. I'll play with them with their toys, I'll crawl around on the floor with them, I'm down to do whatever goofy thing they're into - but for only about 2 hours at a time. Then I have to tap out and recharge.

I'm also not great with the constant noise kids make. I understand that's just what they do, but I've got a low threshold for it, especially when it's the full blown meltdowns. For the first 3-4 days I was at my sister's, the three kids were screaming and crying nearly every 25 minutes. So when the temper tantrums started, I'd go outside or at least leave the room.

At one point, the kids and husband are out of the house and my sister took the opportunity to tell me how she's disappointed that I ""don't love the boys the way (husband's name) and I do."" 

I said that I do love the boys and I asked if there was something I did or didn't do with the kids that upset her. She said no, that I was great with them. I asked if she thought I was paying enough attention to them. She said I was, but brought up my low tolerance for the fits. I apologized and reminded her that I'm really not used to it and that it's kind of stressful, so I just remove myself from the situation.

Things kind of devloved from there, but we recovered and the rest of the trip was fine enough. Am I the asshole thinking that my sister's request is way off base? I love my nephews, but I don't think anyone can love children in the way that child's parents do. 

Edit: Thank you for all the feedback! It gave me a lot of things to think about and reflect on. I've come to think my sister's criticism that I don't love her boys like she does is not an actual, literal expectation. I think it might be a weird, kind of manipulative way of saying ""I need you to think I'm a good parent.""

It's entirely too much to get into here and of course details and context are missing. But, I think I need to call her so we can talk about this and what's going on.

Thanks for confirming that I'm NTA and that the perspectives of my family and friends were not just super biased in my favor 🙃",happyhappy_joyjoy11,5734,348,0.9800000190734863,0.31327298654473046,1742512993,/r/AmItheAsshole/comments/1jg2tqy/aita_for_not_loving_my_sisters_children_the_way/,2025,3
1jbew6q,AITA for “sneaking” vegetarian food into my FIL’s meal?,"Not a throwaway but a private because my fiancé knows my main. 

My fiancé (23M) and I (23F) plan to get married in October of this year. I'd like to start off by saying i'm not looking to end my relationship with my fiancé. 

I'm a vegetarian, my fiancé is not, nor are his parents. This has never been a problem for me, my him, or his mother. But my father in law has always been weird about it.

For example, whenever we all go out to eat and I order something vegetarian, he always gives me weird looks. He also always tries to convince me to eat meat, saying things like ""You're really missing out."", ""You know you want some of this."", ""That fake meat will never be better than the real thing."", Etc.
 
Yesterday, my fiancé and I invited his parents over to our house for dinner. I made spaghetti & meatballs for my fiancé and his parents, spaghetti & vegetarian meatballs for me, I put them in two different pots and put them both on the table.

When his parents were grabbing their food, his father happens to grab the spaghetti and meatless meatballs instead of the real ones.

Now here's where I might be the A-hole, after I see him put the meatless meatballs on his plate instead, I decide not to tell him. He sits down, finishes the whole plate, and even gets a second helping.

Once his parents left and me and my fiancé were cleaning up, I tell him about the whole fake meat thing. My fiancé gets really mad at me and immediately calls his dad.

His dad then calls me and starts berating me on the phone, saying i'm a psycho and my fiancé should leave me for trying to ""poison him""???

I try to defend myself by saying I wasn't the one that gave him the fake meat, and he grabbed himself (which is 100% true) 

My fiancé says I should of told him which was which, but I genuinely don't see the problem. I know he isn't allergic to soy beans or anything, so I don't see the harm in trying vegetarian food once.

I think I might be the A-hole because usually my fiancé always defends me when his father and I get into arguments like this, but the fact that he isn't worries me. So reddit, AITA?

Update: A bit of a quick update, but after reading your comments i've decided i'm going to apologize to my FIL, whether I was in the wrong or not it wasn't right to not tell him what he was eating.

Also, I've seen a lot of comments saying if it was the other way around i'd be screaming at him or something. Just wanna say no I wouldn't, sure i'd be a little sad but i've accidentally eaten meat a few times (been vegetarian since I was 16) and I don't really care. 

Thank you for all your comments! :)",Sherry7Cooky,2004,960,0.8899999856948853,0.27310459274936644,1741987788,/r/AmItheAsshole/comments/1jbew6q/aita_for_sneaking_vegetarian_food_into_my_fils/,2025,3
1jcwo15,AITA for not doing an art commission I was not told about?,"Title sounds a little confusing, wasn't sure how to best word it. Hopefully this all makes sense! 

I (F33) do a lot of art in the needlework medium. Embroidery, cross-stitch, weaving etc. I'm going to toot my own horn here, I'm very good at it. I've won first prize at a couple of our state fair competitions, and the one tapestry piece I had in a gallery sold for a good bit of money.  

A few years ago I made a choice I would no longer take commissions. The deadlines, back and forth between clients and all that jazz made me hate what was once a hobby I could do for hours shutting my brain off. I'll still make presents on occasion (my wife's bff just had a baby, and I made a cross-stitch birth announcement for the nursery, for example) but anything outside of that is not happening.  

This past week I got a message on my Instagram from my friend ""Mike's"" friend ""Abigail."" Abigail said Mike recommended me for an embroidery she wanted done, and how soon could I get to the process. I told Abigail I was sorry, but I no longer take commissions and Mike knew that already. Abigail was a little pissy, but Mike- omg. He texted me in a fury saying he really buttered up my work to Abigail and he was trying to date her and I've fucked things up for him.

I'm sad that Mike is acting this way, but I also wonder that since Abigail was ""misled"" about me not doing commissions- should I just do it? My wife says absolutely not and I 85% think she's right, but I just wanted the perspective of people who aren't married to me, lol. 



 ",GreenMulberry7805,4772,282,0.9700000286102295,0.25922853916077676,1742161643,/r/AmItheAsshole/comments/1jcwo15/aita_for_not_doing_an_art_commission_i_was_not/,2025,3
