id,title,selftext,author,score,num_comments,upvote_ratio,popularity,created_utc,permalink,year,month
1j7itfg,AITA for refusing to change my bachelorette trip date and shutting down a friend’s attempts to reschedule?,"I’m getting married this year, and my friends (a group of 16) and I have been planning my bachelorette trip. To make scheduling fair, I asked everyone to send me the dates they were not available so I could pick a date that worked for the most people—especially since some friends are traveling from other countries.

After going through everyone’s responses, there was only one date that worked for everyone. So, I announced it.

That same day, one of my closest friends suddenly said she had been planning a trip around that time. However, she had never mentioned it before, hadn’t booked flights, and was only reconsidering her dates because someone told her her destination might be crowded.

Since the condition for choosing my trip date was to prioritize the availability of the most people, I explained to her three separate times why that date was final. Despite that, she kept trying to change it. She even created another poll in our group chat to see if others could move their own important plans to accommodate her.

She also started privately messaging people, trying to convince them to say they could be flexible. At first, I didn’t directly call her out in the chat, but after she made a second poll, I sent a general message stating that the date was already chosen and wasn’t changing. Now, she’s upset and claims I embarrassed her by “calling her out” instead of speaking to her privately—even though I had already tried three times.

I feel like she put me in a tough position, making me choose whose availability mattered more. I understand she really wants to be there, but I also think it was unfair for her to disregard everyone else’s plans.

I have no intention of changing the date, and honestly, I’m not planning to apologize because I don’t think I did anything wrong.

AITA?",Maki_M,5237,178,0.9700000286102295,0.2588292001495141,1741557356,/r/AmItheAsshole/comments/1j7itfg/aita_for_refusing_to_change_my_bachelorette_trip/,2025,3
1j4exew,AITA for keeping my door locked so my roommate doesn’t snoop in my room?,"Hello all, I F26 live with M28, M25, This particular event is about M25 (John), I’ve lived here for about a year and I’m moving out at the end of June (yay!), over the course of the year John has been an okay roommate and I haven’t had any real issues with him outside of the random weird/creepy comment about my gym clothes up until now, So recently I started noticing things in my room being moved or just in general it just felt like someone had been in my room, it’s hard to describe. But I ended up installing a lock on my door and locking it before I left for work or anywhere really, now cut to today I get a text message from John and I’ll copy and paste it: “Hey I noticed your door is locked, what’s going on? We need all of them unlocked, it’s a fire hazard.” Now keep in mind this has never been an issue before, I even asked my other roommate M28 if he locks his door and he told me he does and John never said anything to him about it. Now I’m like super creeped out and convinced that he was in fact, going into my room. I texted him back saying “No, if there’s a problem with my room being locked during the day it needs to be told to me by the landlord” all I got back was “okay I’ll tell him to tell you”.  AITA here? Part of me feels like I’m causing unnecessary drama but the other part of me feels like he’s definitely been creeping in my room :c",milkypwg,3688,504,0.9800000190734863,0.25616981277664375,1741211065,/r/AmItheAsshole/comments/1j4exew/aita_for_keeping_my_door_locked_so_my_roommate/,2025,3
1joe3w9,"AITA for charging an “entry fee” for a family dinner on April 1st, leading my aunt to think it was an April Fool’s joke?","I (26F) am the go-to host for family dinners, and I usually enjoy it. But my aunt (55F) has a frustrating habit: she shows up uninvited with extra guests like friends or random relatives without telling me. It’s happened too many times, leaving me to stretch food and space on the spot. I’ve asked her nicely to give me a heads-up, but she just says, “Family should be spontaneous,” and ignores me.

With today being March 31st, I’m hosting a family dinner tomorrow, April 1st, for my parents’ anniversary. Knowing my aunt will likely crash it with extras, I decided to try something new. Last week, I sent a group message saying that because hosting costs keep rising (and the guest list keeps growing), I’m asking each adult to chip in $10 to cover expenses. I figured this was a fair way to handle it without pointing fingers.

Tomorrow’s the big day, but I can already picture it: my aunt will roll up with three unannounced friends. When I ask for the $10 contributions at the door, she’ll probably laugh and say, “Oh, great April Fool’s joke!” I’ll have to explain it’s not a prank and that it’s about respect and planning, especially since she keeps doing this. I’m betting she’ll get mad, call me “stingy,” and storm off, which has happened before when I’ve set boundaries.

The family’s already split. Some think I should let it slide since it’s a special occasion (and tomorrow’s April Fool’s Day might confuse things), while others say I’m right to stand my ground. I’m worried my aunt will spin it as me pulling a “mean prank” if she takes it the wrong way.

TL;DR: AITA for charging an entry fee for tomorrow’s dinner, even though it’s on April 1st?",Content-Pressure4241,3735,464,0.9399999976158142,0.25037453690203115,1743455009,/r/AmItheAsshole/comments/1joe3w9/aita_for_charging_an_entry_fee_for_a_family/,2025,3
1jnnggj,AITA for turning away my partner's grandparents when they showed up unannounced?,"My partner and I had twins in February. We're currently living in her parents' neighboring house because they acquired it after the neighbor passed away, and we're renting/renovating it with them. We have set clear boundaries that we don't want surprise visitors, and we would like it if they only came over once or twice a week so we can have some privacy. 

Today, my partner's dad texted her while she was trying to nap, letting her know that her grandmother (his mother) had shown up at their house unannounced. We appreciated the heads-up, and she continued with trying to rest, as the twins were finally fed, changed, and no longer being fussy. About 10-15 minutes later, her phone starts ringing, and I see it's her dad. I answered, and he let me know her grandma and grandpa were walking over. I told him I would turn them away, as everyone was finally sleeping and it wasn't a good time. He said ""You shouldn't do that, because it will start a fight."" I said ""Oh well, it's not a good time.""

Her grandparents rang the doorbell twice during that phone call, almost back to back, waking her and one of the boys up. I told her to just keep sleeping, I'll deal with it. I answered the door, and her grandma could tell I was exhausted, because she asked if we were sleeping. I said ""Yes, we all are."" She said ""Too bad,"" and tried stepping towards the door. I pulled it shut a little more so it was barely open enough for me, and told her ""No. It's not a good time. They haven't been sleeping good, and I don't want them waking up since they're finally asleep."" She pretended she was ok with it, and parted ways.

A few minutes later, my partner called her dad with the boys screaming in the background, telling him we turned them away. He did what he usually does when he's mad, and kept giving short, one or two word replies. Then, after she was done talking, he blew up, talking about how he's going to have to deal with her grandma being pissed off now, and saying something like ""I might as well fucking broadcast your damn rules to everyone to not show up unless they call ahead!"" along with some other stuff I didn't catch, as I was in the other room. She started crying, said bye while he was still yelling, and hung up.

Now I feel like I shouldn't have told her grandparents to come back another day, because her dad apparently can't deal with his mother's (or his own) emotions, and it would've been easier to just deal with them coming in and disturbing the peace that we had just managed to establish. So, AITA for turning them away? Should I have just dealt with them coming in for a little while?",GingerKenobi,4490,255,0.9800000190734863,0.24189246607121562,1743370951,/r/AmItheAsshole/comments/1jnnggj/aita_for_turning_away_my_partners_grandparents/,2025,3
1j59fnv,AITA for snapping at my boyfriend's friend for touching my hair?,"

I'm (15M)  black and I live in a predominantly white area and go to a mostly white school and I'm pretty introverted. I have a fro and the amount of people who will just up and try/ start touching my hair is wild. It's gotten to the point where it pisses me off.   I met my bf Colt (15M) at a wrestling meet a few months ago and I let him play in my hair and I play in his curly jewfro.  It's just kind of an intimate soothing thing between us.

We go to different schools so we don't hang around each others friends a whole lot. Saturday he was having like a movie marathon with some of his friends and he wanted me to come. While there one of his friends some white girl named Madison starts just playing in my hair saying it's softer than she thought. I immediately jerked back and asked her WTF are you doin? She tells me she just wanted to see what it was like. I snapped at her that I wasn't a damn dog and she gets all defensive saying she saw Colt doing it and thought it was ok. I yelled at her that I'm not dating her and went home.

Colt came over later and apologized for her ,but he says I didn't have to get so upset and go off on her like that. He says people come up to him trying to touch his jewfro to see what Jewish hair feels like all the time and he never took it that seriously.. I tell him it's kinda different but he still thinks I overreacted. AITA?

Edit: just so everyone knows I'm a guy",Imaginary_Report2596,3649,432,0.949999988079071,0.24044948436665436,1741303775,/r/AmItheAsshole/comments/1j59fnv/aita_for_snapping_at_my_boyfriends_friend_for/,2025,3
1j22f6e,AITA For telling a friend isn’t not her business how me and MY husband parent?,"My husband has a friend Erica. I don’t like her. She always seems weirdly judgmental of the way we do things. Most of that judgement being on me.

Anyways the last time she was over, my husband and her were talking about kids (Erica and her so have kids, as do we) and mornings got brought up. 

For some information, I don’t do mornings, my husband does. He works 9-6 and I start at the same time as him but end earlier. He does mornings because he doesn’t mind waking up earlier, and I get more sleep and less on my mind in the morning. It’s an arrangement that works for us and I always do mornings if he’s sick or physically can’t.

When Erica found that out, she started with judgement. I was in the same room as them but just wasn’t adding to the conversation. Stuff like “Oh both my husband and I do mornings” and “Kind of sucks you’re on your own 100% of the time.”  I didn’t like that and let her know that my husband and I’s decisions aren’t any of her business. The topic switched over to something else and she didn’t say anything related to me after.

Aita? My husband says that I made if “awkward”",Ill_Butterscotch_274,3971,353,0.9599999785423279,0.23881019020963043,1740952048,/r/AmItheAsshole/comments/1j22f6e/aita_for_telling_a_friend_isnt_not_her_business/,2025,3
1jnpwvy,AITA if I say no to letting my sister wear my wedding dress?,"I (34F) have a sister (37F) who just recently got engaged in February. My sister and I have never been close growing up, to the point where this summer we went no contact after another argument. My partner and I will have been married 3 years this August, and after my partner proposed my sister messaged me saying she did not want to be involved in the wedding or even hear about wedding plans. Although hurtful I complied, and now that she is getting married she has begun to make contact again. Today while talking to my mother she mentioned that my sister had said she wants to wear my wedding veil. I told her that was okay as long as I could give it to her with a box stating “something borrowed” as I have already offered it to two other friends with upcoming weddings. Then my mother informs me my sister and her partner are getting married the weekend of my and my partners wedding anniversary, that they are booking the same photographer, that she wants her photos taken in the same location as mine- and then asked if my sister could wear my dress (which she would have to have fitted so it would never be my dress again). I expressed to my mother I wasn’t sure about using my dress and how I wanted to keep it. However, my father chimed in to the phone call saying I should “just give it to her”. AITA if I say no? 


[TL/DR - My older sister plans to get married on my anniversary weekend, wear my dress and  veil, and take pictures at the same location as I did. AITA to say she can’t wear my dress?] ",kittylover419,1982,776,0.949999988079071,0.23625376916902413,1743377934,/r/AmItheAsshole/comments/1jnpwvy/aita_if_i_say_no_to_letting_my_sister_wear_my/,2025,3
1j63h2m,AITA for naming my daughter something that my MIL doesn't approve of?,[removed],Quiet_End2185,2104,747,0.9399999976158142,0.2358144962566352,1741390078,/r/AmItheAsshole/comments/1j63h2m/aita_for_naming_my_daughter_something_that_my_mil/,2025,3
1jmxadw,AITAH? Told my girlfriend not to use my electric face razor on her vag but she did anyway.,"So long story short, in the past my gf (me 27, her 26) admitted to using my razor on her coochie. I told her to never do that again and even gave her my old electric one to use. Fast forward to recent and I found out she used it again. Along with that, I have been telling her for months to stop showering without the fan on or door open a bit as it’ll cause water damage over time. Well, at the same time of finding out about the razor, she had made the bathroom walls wet with water again and I blew up a little bit. She has a hard time taking any criticism and has a hard time admitting fault so this went over not too great. Now a week or so later I was asking where something of mine was and if she possibly used it. Her response was, “why do you always assume I’m using your stuff???” I threw back, “says the person that was asked to not use my razor on her vag yet she did anyway!” Now for the first time she has decided to go spend the Saturday on her own instead of having me come with. I’m not worried we’re drifting apart, however I don’t want these things to keep happening without change.

For reference the ONLY thing we really bicker about is chores and who has done what (I really wish this would stop but we both keep on keeping track). We have also been together for about a year and 2 months. Any ladies or anyone else out there have any advice on how to get my lady to see my point of view or how to get her to be more reasonable to admitting fault/not being defensive all the time? Thanks.",mgmproductionz3208,2100,702,0.8799999952316284,0.22686113524515006,1743285295,/r/AmItheAsshole/comments/1jmxadw/aitah_told_my_girlfriend_not_to_use_my_electric/,2025,3
1jicfiz,AITA for calling friend’s penis decent?,"I (19F) am currently on spring break. Me and my friends (as well as some of their friends) decided to go to a nearby beach. It was a two day trip where we go swimming, eat out, and do a little shopping before heading back. While we were on the beach, some of us got hungry. A few people decided to go to a nearby gas station to grab some snacks and bring it back, while others stayed. I stayed and so did B (20M). B is a friend of a friend, and we aren’t that close, but we did get along. We stayed to watch over everyone’s stuff in case it got stolen or anything. 

The two of us were chatting and sitting. Now I want to note, he was wearing a *really* short trunks, which wasn’t a problem. Until he moved his legs and his penis peeked through his shorts. He didn’t realize and I felt awkward to point it out because I didn’t know this guy that well. I had only met him a few days ago. But after a minute or two, I kind of hinted for him to look down and he got shocked. He fixed the issue and we sat there awkwardly and didn’t say anything. 

That night, I get a call from B. He told me he was embarrassed about the situation and that he didn’t mean to flash me. I said to not worry about it because it was clearly an accident. Then he asks me what I thought about his penis. I was shocked and unsure how to respond. So, I just said that it was decent. Now, in hindsight, I genuinely do not know what I meant by decent. I just blurted it out since that was the first word that popped in my head. He got upset and was wondering why it was decent, and I didn’t have a response. We hung up. 

The next day, I saw him at breakfast and could clearly see he was upset. He wasn’t upset at anyone else and made it a point to completely avoid me, not sitting or standing near me. I assuming it was because of what I said about his penis. 

Now, I haven’t told anyone about this event, mainly because I don’t want to embarrass him or anything. But I feel like I was being an asshole for saying that and I could’ve like approached that better. So, AITA?",snowonbeach,1769,756,0.9300000071525574,0.2232363195072848,1742771042,/r/AmItheAsshole/comments/1jicfiz/aita_for_calling_friends_penis_decent/,2025,3
1j4gw7k,AITA: opened a jar of sauce to use some and put the rest in the fridge,"So to preface this: my (18m) mom (47 F) usually has no issue with opening jars of red sauce, using a little, then putting them in the fridge and using them for a meal later on. My dad does it, I do it, she does it, my grandma does it. She has never expressed a problem with it before. This is important. It is also important to note I am autistic. 

So tonight, I opened a jar of Alfredo sauce. I asked my brother (12 M) for help with opening the jar, and mom starts freaking out and saying not to open it- but by the time she said anything, it was already open. So I used the sauce in my pasta and she starts complaining that it can’t be used for a meal now. 

Thankfully I had the self control not to say my immediate response out loud, and instead said “Yes it can?? It’s not like I stuck my fingers in the jar.” 

And now she’s moping on her phone and acting like I’ve committed a federal offense. 

Did I do something wrong?? Am I the asshole or is this stupid…
ETA: I closed the jar and put it back when I was done with it. Because it’s Alfredo, once it’s open you’re supposed to fridge. She’s never had a problem with this before, even with other cream based sauces. She never said I couldn’t open the Alfredo UNTIL it was already open. 
ETA2: there was two jars. I opened and used only one.",plain-smol_pineapple,1753,756,0.8500000238418579,0.22255168108195317,1741215843,/r/AmItheAsshole/comments/1j4gw7k/aita_opened_a_jar_of_sauce_to_use_some_and_put/,2025,3
1j3n68v,UPDATE AITA for reporting my coworker for cheating in the company walking competition?,"So the feedback on my last [post](https://www.reddit.com/r/AmItheAsshole/comments/1ipgc44/aita_for_reporting_my_coworker_for_cheating_in/?utm_source=share&utm_medium=web3x&utm_name=web3xcss&utm_term=1&utm_content=share_button) made me feel like less of an asshole for sure but what happened next definitely got rid of any remaining guilt I may have had.

Tiffany won the steps competition.

After I spoke with Matt he tried to clear things up with Tiffany but in his words she was “combative and rude” so he ended up looping in our HR rep, Jill. Jill decided that Tiffany could keep her 65,000 steps and the rules would just be clarified for everyone going forward.

Well going forward Tiffany continued to post 35,000-40,000 steps every single day. Less ridiculous then 65,000 but still ridiculous considering we all sit at desks 8 hours day. It was still a tight race between the 4 of us, because we (Dave Jenna and I) had been posting higher then Tiffany prior to the 65,000 step day. Then Dave got sick. He only posted 4,000 one day and that was enough for him to fall too far behind. Then I had something urgent and time consuming come up at work and only got 10,000 steps that day. That was enough for me to fall too far behind too. So it was basically up to Jenna at that point and she was really working for it. Even got up at 4am the last couple days of the competition to try and max out steps. The highest she ever got to was about 41,000 and in the end Tiffany beat her by about 250 steps overall.

Tiffany had zero issue happily accepting her award at the next company wide meeting and gave this super annoying speech about how “everyone did so great” and how in the end she’s “just glad we all became more active and healthy.”

I never responded to the message she sent me about being depressed about her dog or whatever. At the end of the day, this is my job and I’m not trying to get into some messy and weird fight over an Apple Watch and an extra 4 hours on a Friday.",GalaxyGarlic,4240,199,0.9800000190734863,0.22026602892677516,1741126386,/r/AmItheAsshole/comments/1j3n68v/update_aita_for_reporting_my_coworker_for/,2025,3
1jjxve6,AITA for refusing to go to the store when my significant other cooks meals for me?,"My signifiant other (M38) and I (F35) have lived together for over a year. His mother and our daughter (F13) are also in the home. He is the primary cook in the home as he prefers to cook and is picky about how the food is prepared. He also does the majority of the shopping because he prefers to shop at certain stores. I do also cook occasionally and pay for meals when we order out. Additionally when I give him money to assist with bills I give extra to help pay for food costs. I do also clean the kitchen after each meal which is not a small task because he doesn't clean as he cooks and typically any thing he touches in the meal prep process is left out. None of this bothers me so much as when he asks me to go to the store for last minute ingredients. For some reason he never has all the ingredients right before the meal needs to be cooked. For instance tonight, he starts cooking pasta at 6:45pm and right before he cooks he forgot that we did not have noodles. He started planning dinner at 10am. He then expects me to drop anything I am doing to go to the store to get the items. When I say ""no, you could have asked earlier or planned better"" he accuses me of being lazy or not helpful. He does this during holidays too. Days before the holiday I asks several times does he need me to go to the store. Every day leading up to the holiday he says no, then inevitably the day of the holiday he needs a few ingredients. I ask him all the time just to be thoughtful of my time because I could end up having to make trips to the store everyday due to his poor planning. I am starting to feel he does this as a way to make me earn my meal. AITA?",Any-Basis4931,2857,447,0.9599999785423279,0.20948728278112314,1742945707,/r/AmItheAsshole/comments/1jjxve6/aita_for_refusing_to_go_to_the_store_when_my/,2025,3
1j3m6wc,"AITA for offering multiple solutions to my girlfriend’s problem, only for her to reject them and then blame me?","I (19M) am at home in Bootle, while my girlfriend (19F) is at her uni accommodation in Liverpool. Tonight, around 9:20 PM, she complained about being hungry but said she had no food in. She has money but refuses to buy ingredients to cook.

I offered to send her money just in case, but she refused. I suggested she grab something quick from Tesco (like a meal deal), but she refused. I even offered to take the train to see her and bring food, but she refused that too. Lastly, I offered to pay for a food delivery—McDonald’s, KFC, Taco Bell, Boojum—but she turned them all down.

She started acting cold, then abruptly ended the call with a blunt “bye” before I could even respond. A few minutes later, she texted me: “Why am I being treated like this?”

I don’t understand. I tried everything to help, and she shut down every option, only to act like I’m the bad guy. She does this often with other topics too. Am I missing something here? AITA?",SenorStinkyFeet1995,1682,669,0.9100000262260437,0.20253467535291647,1741123939,/r/AmItheAsshole/comments/1j3m6wc/aita_for_offering_multiple_solutions_to_my/,2025,3
