id,title,selftext,author,score,num_comments,upvote_ratio,popularity,created_utc,permalink,year,month
1jfz99i,AITA for telling my coworker to “freshen up” for an important event?,"Throwaway account since the people involved use Reddit. 
I (32M) work at a company with the occasional events. I take them as chances to network with people from other companies and so on. 

My coworker [33M], who we’ll call Ben is pretty scruffy. Showing up to work in the same outfit he wore the previous day and even sleeping at his desk sometimes. I’ve never interacted with him 1-on-1 per se but we’ve been on the same projects and I’m friendly with him. 

Here is where the issue is: Recently, there was a company event, and, for once, Ben didn’t really participate or speak about it beforehand, so most of us assumed he wasn’t going. I didn’t expect him to come of course, but he did in the most unprofessional outfit. He was wearing wrinkled clothes and colors that didn’t match. Like he rolled out of bed. He walked up to my circle and we locked eyes and I joked that he should’ve freshed up a bit to an event like this and there were some chuckles but everyone was mostly silent. 

He soon walked away and my other coworker pulled me aside and told me that I was way out of line, and her and my colleagues think that I shouldn’t have spoken about his attire especially since I don’t know him very well. I thought I was just making a joke to lighten the mood. I haven’t seen him since and he’s been actively avoiding me. mostly everyone in my circle is expecting me to apologize to Ben, AITA for making a joke? 

Edit: I understand how the joke wasn’t a joke at all  now, and I’ll be apologizing to Ben at work tomorrow. ",Useful-Science8384,1518,647,0.8299999833106995,0.19122361080630404,1742503791,/r/AmItheAsshole/comments/1jfz99i/aita_for_telling_my_coworker_to_freshen_up_for_an/,2025,3
1j1b4od,AITA for wearing an engagement looking ring?,"So I (26M) doesn't wear much jewelry due to it either not feeling nice and I don't like the look of most stuff. I went thrifting a month ago and found a gold ring inlaid with a thin black stone in the middle. It felt/fit amazing on my left ring finger and I started wearing it. 
I met my friend today (26F) while wearing it and she was shocked and asked when I got engaged? I was confused and asked what she meant since I'm single and she just pointed at the ring.

I laughed and said no it just looked cool. She responded with accusing me of catfishing girls.
Tbf I have noticed some unusual positive attention lately from women but attributed it to me losing weight.

Now she is mad and calling me a fuck boy, but I can't really see what I did wrong. AITA?",lookoka,2621,403,0.949999988079071,0.1908018246335551,1740866843,/r/AmItheAsshole/comments/1j1b4od/aita_for_wearing_an_engagement_looking_ring/,2025,3
1j7hy7m,AITA for telling my husband his mom can't live with us for months-long stretches,"My husband and I have been married for almost 2 years and our son is 10 months old. My parents live nearby which has been invaluable during my pregnancy and since. My mom comes over regularly to help us out, my husband and her are on good terms too so it's been going well. His parents live in another country. We have visited them once since we got married, that was 7 months ago. The time prior to that was our wedding itself which took place there.

My husband had been talking about my MIL visiting soon for a long visit which I was happy with. We recently moved into our new house, I've done a good job decorating it, we have a large guest room, and I was looking forward to hosting her especially since it would make my husband happy. A couple of days ago he was complaining about how detailed her visa application was. I told him I was surprised it was so thorough. He told me that it's because while regular visa forms allow a stay of 6 months max, this one allows 2 years. I asked why would she need a stay of more than 6 months. He said that she had been thinking of winding up her medical practice and basically retiring, and this would then allow her to stay for a longer visit if we all decide that it works.

I was stunned. I told him he should just do the regular app because his mom won't be staying for anywhere close to 6 months. I had it in my mind that she'd be staying for like a month. That's how long we stayed for when we went there. He said that's his mom, she tells him how alone she feels, she can't go to my BIL's because he lives with roommates, and we can't just put a timer on her visit here. He said she's been looking forward to helping us out with our son. I told him we don't need help we manage fine on our own and with my mom's help. I wanted to host his mom as a guest not as a part of our household. He complained that how was it fair that my parents could visit whenever they wanted while his can't. I was hurt by that because my parents have helped us out a lot and I asked him if he wants us to limit how often my mom comes to visit. He said no, that's not what he meant, that he likes her but it wasn't fair to his parents. My reply was that when my mom comes, she goes at the end of the day. That wouldn't be the case with his. I ended it by saying he should look into the easier regular form because she can't be thinking of staying for that long. He chose to sleep on the couch that night and has been cold with me since. I hate that. We've never been cold to each other like this. 

I talked to my mom too. She said that having his mom live with us for long stretches would definitely affect me. That this is worth fighting for.

I haven't seen him working on the application since. Last night he went out when his mom called. When he came back I asked him how she took it. He told me he had told her he's looking into what application best suits her. He asked me if I'd changed my mind. I said no. He just shook his head and started watching TV. AITA?",RewardSpecialist3390,2134,441,0.9700000286102295,0.17737922374909687,1741555079,/r/AmItheAsshole/comments/1j7hy7m/aita_for_telling_my_husband_his_mom_cant_live/,2025,3
1j60urv,AITA for changing my legal name ?,"Hi! I was born after my mom had a stillborn baby. She was supposed to be named Angélique (a French name because my mom’s French). My stillborn sister was born and died on December 6th, 2004. Then my mom had me on May 6th, 2006, and named me Coline (another French name, like Colleen).

Listen, so the problem is—when I was told this story, I was about 14. I had never known before, but I had always hated my name due to bullying and really dumb jokes about it. But then it started getting weird for me because, in France, you have a name day, which is basically a celebration of your name for a day (because of Christianity or something—I don’t really know, I’m not very Christian. I don’t know if other countries do this).

I discovered that my mother gave me the name Coline on purpose because it was celebrated on my stillborn sister’s birthday. That made me feel like I was just a replacement for her since Angélique was supposed to be my mom’s last kid (she said that to my face, yeah).

What made it even worse to wear my name was my father. I won’t go into details, but he’s an asshole. He straight-up said they were supposed to have an angel—referring to my sister—but had the devil instead (me, lol). He also said he would have preferred if I had died instead of my sister.

Around that time, I started talking to my friends about it and asked them to call me by a new name I picked, which had nothing to do with my sister—Lyx. They all agreed and have never stopped calling me Lyx since I was 14. I’m now almost 19. They even call me Lyx when talking to my mom, but she got mad at me and said she would disown me if I dared change my name to Lyx.

So, AITA for wanting to change my name?
(If you guys could be 100% honest in your opinion, that would really help. Tysm ♡)",Spiritual_Goose_4811,2536,311,0.9599999785423279,0.1692099601262252,1741383165,/r/AmItheAsshole/comments/1j60urv/aita_for_changing_my_legal_name/,2025,3
1jg3cvi,AITA for not inviting my pregnant sister in law to my wedding?,"My partner and I are due to get married soon. My brother David has always been viewed as the favourite in my family, and so is his wife Jill. I on the other hand am always viewed as the problem in my mothers eyes

A few years ago, we celebrated my step brothers wedding with our family.  David, Jill,  my fiance and I  stayed in an apartment and had breakfast together the next morning and all was seemingly great. That was until later that afternoon when I received a call from my mum saying Jill was at her house in tears because I insulted her appearance at the wedding. I have zero recollection of this but my fiance was with me the whole night and was adamant that I did not say anything, plus Jill showed no signs of being upset or annoyed with me at any point. I was disappointed that my mum did not ask me and jumped to conclusions that I was in the wrong. I apologised to Jill and that was seemingly the end of it. 

Our relationship with Dave and Jill has been icy since then and Jill has made no effort to engage with my fiance on our upcoming wedding at family events. At Christmas, when we were visiting my mum and step dad, Dave and Jill both arrived and announced that they are expecting a baby (first grand kid in the family) and that’s it’s due on our wedding day. After a few drinks my step dad made a remark that ‘our big day is now about Dave and Jill aswell’ I spoke to my mum about this and she assured me that this wouldn’t be the case and that they would be celebrating us, my step dad disagreed again. Our wedding day is really important to us and our friendships. We have a two day wedding, the first day is a ceremony and a meal in an upmarket restaurant for 30 of our closest friends and immediate family. The next day is a party for all our other friends and extended family. David and Jill are invited to both days but given the long day and that she is due to give birth on the day, we did not have the space to accommodate Jill for the evening meal. She also said she didn’t want to go originally as she doesn’t like that kind of food but has changed her stance since on wanting to attend. 

My mum has now demanded that we invite Jill to the meal and has been pretty aggressive towards me and my fiance. We have stated that we don’t have the space (my fiances close friends and step mum aren’t going) and that we don’t think it’s suitable, the ceremony at the meal is very intimate and we only want our closest friends there. My mum has now said that they need to be there for Jill in case she goes into labour and so she needs to be at the venue. I should point out that Jill also has family albeit they are a 1 hour flight away, and not all of our family are going to the meal. We are paying for the wedding ourselves too. I just feel like this should be a day to celebrate me and my to be wife but my family have made it clear that they want it to be about Jill,who has made it clear she doesn’t even like us. So please help, AITA? Thanks!",Mobile-Assistant-119,2358,339,0.9399999976158142,0.16705783851872785,1742514440,/r/AmItheAsshole/comments/1jg3cvi/aita_for_not_inviting_my_pregnant_sister_in_law/,2025,3
1j4hpft,AITA for not telling husband he could get a form notarized instead of going with me in person to get our baby’s passport,"Yesterday we were in line at the post office for our baby's passport application appointment. We had a 12:30 noon appt but there were still 3 applicants ahead of us since they were backed up (meaning at least 30-40 min wait on top of the 20+ we'd already waited). The lady in back of us asked if she needed both parents for her baby's renewal; I said 'I think yes both parents need to be present or you can submit a notarized form on behalf of the dad.' My husband heard and started to get really angry that I hadn't told him. Then he said 'let's go home' and we proceeded to have a huge argument where he yelled at me and said I ""hid"" the fact from him and wasted his time. I explained that it didn't even cross my mind as we are together and both local. He said I should have at least mentioned the notary option to give him a chance to decide. I didn't know that the wait would be so long since we had an appointment. He called me ""negligent"" for not knowing that these things take a long time. I told him the passport process is his responsibility too, but he thinks that since I'll be waiting in line anyway, I should have respected his time and made it as quick as possible for him by giving him the notary option so he doesn't have to go and interrupt his day to come in person. So now he said he'll do the notarized form on HIS TIMING ""I'll do it when I do it and I don't want you asking me about it"" and then I have to go back a third time AGAIN on my own to apply for the passport. 

For context this was our second time at the post office because the first time we didn't have an appt and the line was so long we left and made an appt to come back. I honestly did not know the lines would be so long and backed up; who knew so many people would be applying for a passport at any given time? Husband thinks I should apologize for not telling him about the notary option and “not respecting his time”. Looking back, that would have been the way to go given that its been so difficult coordinating times with him to go (he's been dragging his feet on this because he doesn't care to go on any international trips anytime soon and I do, which is another issue). He's very protective about his time, especially on weekdays and mid-day events as it ""interrupts his flow."" Meanwhile I think it's crazy that he feels so entitled to me mentioning the notary option. I'm annoyed at him for being such a maniac about this. I think we should have just waited and finished the task; the argument + getting the notarized form + going back is going to take way more time than if we had just waited. AITA? ",pickypebble,1394,528,0.9399999976158142,0.16269361929413698,1741217956,/r/AmItheAsshole/comments/1j4hpft/aita_for_not_telling_husband_he_could_get_a_form/,2025,3
1j4hmt0,AITA for being offended that the girl I'm dating keeps saying that she hates men.,"I (30 M) have been dating a woman (29) for about two months. The dates have been going well and she’s been super nice to me. However, lately, she’s been talking repeatedly about how much she “hates men.” 

It started when she invited me over to her house when she was extremely drunk and we were watching “Love is Blind.” She went on an hour long tirade about how she hates the men on the show and she probably said the phrase “I hate men” about a dozen times. I brushed this off because she was very drunk and angry about the reality show. 

However, two days later we went for dinner and I recommended a book to her. She said that she probably wouldn’t read it because she hates male authors. I said this was kind of limiting, but I agreed with her and made a joke about how bad male authors are at describing female characters. She then started talking more about how she hated men and said “I don’t think men should get therapy because they will use it against you.” She then realized how bad this sounded and said “obviously I’m joking. I think everyone should get therapy.” I’m very non-confrontational so I made a joke about how I’ve never had therapy and we talked about other things until the night ended.

The next day I sent her a text saying that she should stop saying that she “hates men” because it makes me feel like she hates me. She replied: “I only hate men who take it personally!!”

Did I overreact? Am I being too sensitive about jokes that she’s making towards men in general and not me specifically?

",69ingisOverrated,803,639,0.8100000023841858,0.15906755092449237,1741217760,/r/AmItheAsshole/comments/1j4hmt0/aita_for_being_offended_that_the_girl_im_dating/,2025,3
1j60br0,AITA for not pressing my daughter to meet a long lost sister.,[removed],last_mile76,2512,228,0.9800000190734863,0.15198471989650256,1741381764,/r/AmItheAsshole/comments/1j60br0/aita_for_not_pressing_my_daughter_to_meet_a_long/,2025,3
1jkqimr,AITA for not offering to split gas on a road trip I didn’t want to go on?,"Last weekend, I (24F) got dragged into a spontaneous hiking trip with my friends Jason and Lily (they’re a couple). We were hanging out Friday night at their place—I was already half-dead from the work week and had too much wine, so I just crashed on their couch.

Saturday morning, I was super hungover, like dry mouth, hoodie-over-eyes level. All I wanted was some water, maybe a hash brown, and no human interaction. But Jason was already up and buzzing about this hike four hours away. Lily was into it too. I said, very clearly, multiple times, “I’m down to hang but I’m not hiking. I feel like crap.”

They were like, “Oh come on, you’ll feel better once we’re out there,” and “It’s mostly flat.” I didn’t push back hard enough, I guess. I wasn’t trying to be a buzzkill. Next thing I know, we’re in Jason’s car, and I’m wedged in the back with my hood up and a bottle of Gatorade.

Spoiler: I never hiked. We got there, I walked to the trailhead, and then just sat in the car with the windows cracked, reading a paperback I found in the backseat (I think it was Lily’s copy of Circe? Good book though). They were gone for three-ish hours, came back sweaty and glowing and very into themselves. I clapped politely. We drove back.

Then—on the drive home—Jason says, all casual, “So if y’all could Venmo me like thirty bucks for gas, that’d be great.”

I hesitated and said, “Wait, seriously?” I told him I didn’t really feel comfortable paying for a trip I didn’t want to go on and didn’t participate in. I said it as lightly as I could, like I even added a half-laugh so it didn’t sound rude, but neither of them responded.

It got weirdly quiet after that. Like… not just “we’re tired” quiet, but stiff, polite quiet. Lily scrolled through Instagram the rest of the ride. Jason turned the music up and didn’t really talk to me again until they dropped me off.

I texted later that night just to say thanks for driving anyway, and Lily replied with a thumbs-up emoji. Not even a “np” or anything, just 👍.

I’ve been replaying it in my head because I do get that gas isn’t free, but also—I didn’t want to go, I said that, and I barely even left the car. I felt like I was being held financially hostage for a vibe I wasn’t part of.

AITA for not paying gas money for a trip I got peer-pressured into and didn’t even enjoy?",CosmicCupcakes_,1434,447,0.8999999761581421,0.14859725282819203,1743033115,/r/AmItheAsshole/comments/1jkqimr/aita_for_not_offering_to_split_gas_on_a_road_trip/,2025,3
1jj5ihj,AITA for disagreeing with my wife to alter my birthday gift that my friend gave me?,"So a friend of mine gave me frames with quotes and poems that resonated with me. I was really moved by his gesture and the thought he put into it. A couple days later, my wife said the photos in the frames are 'bad resolution' and that she wants to print the same images in better resolution so it doesn't look pixelated. To be fair, the images were pixelated, but I told her thats a part of the gift and it means something to me. So I wouldn't want to replace the photos, even if they're exactly the same (ship of theseus?). 
Today she went ahead and printed the new images (exactly the same image, dimensions etc.) and replaced those in the frames from my friend. She said she'll still hold on to the photos my friend gave with the frames. I had no clue she was going to do it despite my explicit disapproval when she originally proposed the idea. 
This led to a huge argument between us and she feels I'm being unreasonable because she's trying to improve the look of the photos while keeping the same image. Am I the asshole to be upset at her and wanting to keep the original gift with the slightly blurry images?",emo_engineer,2141,268,0.949999988079071,0.1439160676581498,1742859274,/r/AmItheAsshole/comments/1jj5ihj/aita_for_disagreeing_with_my_wife_to_alter_my/,2025,3
1jj3l3t,WIBTA If I refused to pay a cat rescue for fixing my foster cats?,"Personally, I felt I was scammed by a rescue. Which is a statement I never thought I’d make, because usually I regard a rescue as a very honorable and respectable organization that only intends on helping. 

However, I ran into a particularly unfriendly rescue helper who responded to a post I had made requesting help with two kittens I had rescued from outside. (In AZ, where temps get up to about 120 degrees). 

I had mentioned in the posts that I am a young mom who just bought my house and cannot afford to spay/neuter them and if there’s anybody out there who could help me help them, to please reach out. 

She contacted me, asked me to explain why I felt that I needed the help, and then proceeded to ask me to bring the kittens for the procedure. I thanked her profusely, and she never mentioned once requiring that I pay her back.

She also blew up my phone the day of the procedure telling me I must call her back NOW or else she will not see the kittens, even though I had sent her a text message the night before letting her know that I would be there. 

Anyways, now that the kittens have found a new home she sent me an invoice saying that I owe her $120 for the spay/neuter. She charged me more for the male kitten than the quote I got at a local clinic, and I would have definitely declined her offer for “help” had I known she would charge me and at this price. 

So, WIBTA for ignoring her texts or reaching out to tell her I didn’t agree to pay her back at this price? ",Distinct-Stage-3828,1953,296,0.949999988079071,0.14133604703482017,1742854392,/r/AmItheAsshole/comments/1jj3l3t/wibta_if_i_refused_to_pay_a_cat_rescue_for_fixing/,2025,3
1jcwuxb,AITA for not letting my in-laws see my daughter when she was born?,[removed],_kiwaaathebest_,463,616,0.75,0.14003030366800648,1742162173,/r/AmItheAsshole/comments/1jcwuxb/aita_for_not_letting_my_inlaws_see_my_daughter/,2025,3
1jef5sa,AITA for not chipping in for my friend’s Uber after he felt uncomfortable sleeping at my place?,"I (26m) have been friends with Josh (26m) since college. We were basically inseparable then, but only stayed in touch intermittently since graduation. Recently he moved to NYC (where I live), and we have been hanging out like old times. 

Josh mainly comes near me because there's some bars we like to go to there. I've offered to go to his neighborhood (he lives in a different borough), but he says there's no fun places there. The only issue is he has to leave pretty early because the trains get wonky at night and Ubers are expensive. I've offered to let him crash, but he says he didn't want to be a burden. 

Anyway last Saturday Josh wanted to stay out and asked if he could crash. I told him of course. We went back to my studio (he knew it was a studio) and he asked if I had any pajamas he could borrow. I told him no because 1. I genuinely own no pajamas and 2. I have some sweatpants but I'm weird about people wearing my clothes. Can't explain why just am. A germ thing. 

Anyway I suggest to Josh he just sleep in his boxers and he got annoyed. He said he wouldn't have stayed if he had known I'd be so accommodating and I said all I offered him was a couch to crash on. He ubered home and it was about 100 dollars. 

The next day he Venmo requests me 30 and says it's because he would've gone home earlier if he known I was going to be ""weird.""  I denied the request and then when I tried to follow up on some previously made plans he's been distant and has apparently trash talked me to a mutual friend. AITA?",DonutFar8089,1440,393,0.9300000071525574,0.13831535055150873,1742330050,/r/AmItheAsshole/comments/1jef5sa/aita_for_not_chipping_in_for_my_friends_uber/,2025,3
